headline,date,doc_type,material_type,section,keywords
"Sports of The Times; In Westfield, Fans Hope For a Miracle",1997-09-23,article,News,,['Football']
A Buffo Rossinian Book in a Chinese Wrapper,1997-09-23,article,Review,,['Opera']
"Paid Notice: Deaths  EINHORN, HERBERT ARTHUR",1997-09-23,article,Paid Death Notice,,[]
A Troupe's Far-Flung Family Gathers in Tribute,1997-09-23,article,Review,,"['Reviews', 'Dancing']"
Ballesteros Is Brimming With Pride In His Team,1997-09-23,article,News,,"['Ryder Cup (Golf)', 'Golf']"
House May Seek Court Ruling on Census Sampling,1997-09-23,article,News,,"['Population', 'Law and Legislation', 'Decisions and Verdicts', 'Census']"
Pitt's Passer Is Quick To Share Fans' Praise,1997-09-23,article,News,,['Football']
Mussels' Mighty Muscles,1997-09-23,article,News,,"['Mussels', 'Fish and Other Marine Life']"
"Shaken by Collapse of Bubble Economy, The Mindset of Investors Begins to Change : Japanese Come to Terms With Idea of Credit Risk",1997-09-23,article,News,,[]
Rangers May Get LaFontaine,1997-09-23,article,News,,"['Hockey, Ice', 'Trades (Sports)']"
Bulls Add Burrell,1997-09-23,article,News,,"['Trades (Sports)', 'Basketball']"
The Varying Accents of Romanticism,1997-09-23,article,Review,,"['Music', 'Reviews']"
Is Global Warming Tied to Solar Storms?,1997-09-23,article,Summary,,[]
Genovese Crime Figures Given Federal Sentences,1997-09-23,article,News,,"['Organized Crime', 'Sentences (Criminal)', 'Building (Construction)', 'Extortion and Blackmail', 'Waste Materials and Disposal']"
New Jersey Daily Briefing; Economy Nears Full Recovery,1997-09-23,article,News,,"['Recession and Depression', 'Economic Conditions and Trends']"
"Paid Notice: Deaths  SCHICK, ROBERT D.",1997-09-23,article,Paid Death Notice,,[]
Corrections,1997-09-23,article,Correction,,"['Festivals', 'Correction Stories']"
Patronage in the Counting House,1997-09-23,article,Editorial,,"['Mayors', 'PATRONAGE', 'Editorials', 'Constitutions', 'Elections', 'PRIMARIES']"
"For Spring Bridge Lines, Fashion Comes First",1997-09-23,article,News,,['APPAREL']
"As the stigma fades, Madison Ave. steps up its fight against AIDS.",1997-09-23,article,News,,"['Acquired Immune Deficiency Syndrome', 'ADVERTISING']"
You Want Boring? Try That Game in '83,1997-09-23,article,News,,"['Television', 'Football']"
New Strain of Highly Contagious Tuberculosis Is Identified,1997-09-23,article,News,,['Tuberculosis']
"Paid Notice: Memorials  KAHAN, JOSHUA",1997-09-23,article,Paid Death Notice,,[]
White House Fund-Raising Clearly Violated Law,1997-09-23,article,Letter,,"['Frauds and Swindling', 'Elections', 'Presidential Election of 1996']"
Financial Giants Woo Lower-Income Market : Tuning In To Small Investors,1997-09-23,article,News,,[]
Playoff Tickets On Sale Today,1997-09-23,article,News,,['Baseball']
Sham Ethics,1997-09-23,article,Editorial,,"['Editorials', 'Ethics', 'Law and Legislation']"
CHRONICLE,1997-09-23,article,News,,[]
Bobby Jones and the Mets Foil the Marlins' Celebration for One More Day,1997-09-23,article,News,,['Baseball']
"Paid Notice: Deaths  FRIEDMAN, MILDRED (BARRY)",1997-09-23,article,Paid Death Notice,,[]
"Children of the Reform; Benefits at Risk, Young Mothers Turn Back to School",1997-09-23,article,Series,,"['Surveys and Series', 'Education and Schools', 'Welfare (US)']"
New TV Season in Review,1997-09-23,article,Review,,"['Reviews', 'Television']"
New Jersey Daily Briefing; Backing for a Casino License,1997-09-23,article,News,,"['Gambling', 'Casinos', 'Bribery']"
Goodrich Plans to Buy Rohr In $789 Million Stock Deal,1997-09-23,article,News,,"['Mergers, Acquisitions and Divestitures']"
BIG FLOWER PRESS TO PAY $260 MILLION FOR 3 COMPANIES,1997-09-23,article,News,,"['Mergers, Acquisitions and Divestitures']"
On My Mind; Getting To Know Him,1997-09-23,article,Op-Ed,,"['United States International Relations', 'Biographical Information', 'CHINA-INTERNATIONAL RELATIONS-US', 'Freedom and Human Rights']"
"Snarled Traffic, the Secret Service, and a Presidential Night at the Opera",1997-09-23,article,News,,['Opera']
"Paid Notice: Deaths  BLACKMAN, FLORENCE",1997-09-23,article,Paid Death Notice,,[]
"Tobacco Profits May Soar Under Deal, Government Study Shows",1997-09-23,article,News,,"['States (US)', 'Suits and Litigation', 'Forecasts', 'Smoking and Tobacco']"
McDonald's Brazil Plans,1997-09-23,article,News,,"['Restaurants', 'Finances', 'Fast Food Industry']"
'Carmen' Opens Met Opera Season,1997-09-23,article,Review,,"['Reviews', 'Opera']"
"Paid Notice: Deaths  GOTTLIEB, JACK",1997-09-23,article,Paid Death Notice,,[]
"Paid Notice: Deaths  SHEA, THOMAS G.",1997-09-23,article,Paid Death Notice,,[]
Navajo Leaders Embrace Faith -- and Lawyers,1997-09-23,article,Letter,,"['Indians, American']"
CHRONICLE,1997-09-23,article,News,,"['Awards, Decorations and Honors']"
"Eat Fat, Get Fat",1997-09-23,article,News,,"['Diet and Nutrition', 'Weight', 'Carbohydrates', 'Children and Youth', 'Oils and Fats', 'Food']"
Hundley Will Focus On Elbow,1997-09-23,article,News,,['Baseball']
Should the Yanks Play for Position or Prepare for the Post-Season?,1997-09-23,article,News,,"['Baseball', 'Playoff Games']"
The Land of Cowboys and Indians,1997-09-23,article,Review,,"['Reviews', 'Books and Literature']"
Drug Money (in Literal Sense) Is a New Legal Twist,1997-09-23,article,News,,"['Currency', 'Cocaine and Crack Cocaine', 'Drug Abuse and Traffic']"
"BASEBALL: Formidable, And Forgetful; Whether at Bat, in the Field or on the Street, Cleveland's Ramirez Is on a Path of His Own",1997-09-23,article,Biography,,"['Baseball', 'Biographical Information']"
Fassel Sticking by Daluiso,1997-09-23,article,News,,['Football']
Bond Prices Mixed Ahead Of Auctions,1997-09-23,article,News,,"['Finances', 'Interest Rates', 'Government Bonds']"
Corrections,1997-09-23,article,Correction,,"['MOTION PICTURES', 'Reviews', 'Correction Stories']"
A Nazi's Trail Leads to a Gold Cache in Brazil,1997-09-23,article,News,,"['JEWS', 'Gold', 'Biographical Information', 'NAZI POLICIES TOWARD JEWS AND OTHER MINORITIES']"
Observer; Ravaged by Piety,1997-09-23,article,Op-Ed,,"['Finances', 'Ethics', 'Elections', 'Presidential Election of 1996']"
Corrections,1997-09-23,article,Correction,,"['Reviews', 'Correction Stories', 'Dancing']"
Broadway Tries Analysis And Gets Shock Therapy,1997-09-23,article,News,,"['INDUSTRY PROFILES', 'Theater']"
Metrocard Transfers Are Only a First Step,1997-09-23,article,Letter,,"['Prices (Fares, Fees and Rates)', 'Transit Systems']"
"Paid Notice: Deaths  LEIBERMAN, TILLA",1997-09-23,article,Paid Death Notice,,[]
"Memorandum Suggests That Clinton Made $50,000 Call From the White House",1997-09-23,article,News,,"['Finances', 'Ethics', 'Elections', 'Presidential Election of 1996']"
5 on Bankruptcy Panel Cleared in Conference-Call Case,1997-09-23,article,News,,"['Law and Legislation', 'Decisions and Verdicts', 'Bankruptcies']"
WALTER INDUSTRIES TO BUY APPLIED INDUSTRIAL MATERIALS,1997-09-23,article,News,,"['Mergers, Acquisitions and Divestitures']"
"Market Place: Quality Service, With Wings; Midwest Express Profits By Pampering Passengers",1997-09-23,article,News,,"['AIRLINES AND AIRPLANES', 'COMPANY AND ORGANIZATION PROFILES', 'Prices (Fares, Fees and Rates)']"
Columbia's Ties to Doctors To Be Severed,1997-09-23,article,News,,"['Frauds and Swindling', 'Doctors', 'Medicare', 'Medicine and Health', 'Hospitals']"
College Admissions Test Isn't Culturally Biased,1997-09-23,article,Letter,,"['Colleges and Universities', 'SCHOLASTIC ASSESSMENT TEST (SAT)', 'Tests and Testing']"
"AT&T Offers Buyouts to 3,000 Employees",1997-09-23,article,News,,"['LABOR', 'Telephones and Telecommunications']"
Metro Business; Time Warner Settlement,1997-09-23,article,News,,"['Television', 'Suits and Litigation', 'CLASS-ACTION SUITS', 'Electric Light and Power']"
REXEL AGREES TO BUY 2 ELECTRICAL PARTS DISTRIBUTORS,1997-09-23,article,News,,"['Mergers, Acquisitions and Divestitures']"
Fie! Enough Mud Slung At Bob and the C.I.A.!,1997-09-23,article,News,,"['Finances', 'Ethics', 'Elections', 'Presidential Election of 1996']"
Kennedy Filibuster Is Final Hurdle for Measure to Speed the Review of Medicines,1997-09-23,article,News,,"['Filibusters and Debate Curbs', 'Medicine and Health', 'Law and Legislation']"
De Klerk's Party Ends Suit Against South Africa's Truth Panel,1997-09-23,article,News,,"['Biographical Information', 'Suits and Litigation']"
"Paid Notice: Deaths  WEINTRAUB, JULIUS (BIG JULIE)",1997-09-23,article,Paid Death Notice,,[]
"Paid Notice: Deaths  CHARLES, RICHARD LINCOLN",1997-09-24,article,Paid Death Notice,,[]
A.F.L.-C.I.O. Turns Energy Against Pacts On Free Trade,1997-09-24,article,News,,"['International Trade and World Market', 'Treaties', 'FREE PORTS AND TRADING ZONES', 'Law and Legislation']"
CALENDAR,1997-09-24,article,Schedule,,[]
"Wine Talk; In the Ratings Game, 1995 Graduates With Honors",1997-09-24,article,News,,"['Wines', 'Ratings and Rating Systems', 'ALCOHOLIC BEVERAGES']"
INSIDE,1997-09-24,article,Summary,,[]
AIDS Studies Violate Helsinki Rights Accord; Women at Greatest Risk,1997-09-24,article,Letter,,"['Acquired Immune Deficiency Syndrome', 'Research']"
Metro Business Briefs; Renewing the Old Hotel,1997-09-24,article,News,,['HOTELS AND MOTELS']
Chancellor Agrees to Let Teacher Return in Dispute,1997-09-24,article,News,,"['Wages and Salaries', 'Education and Schools', 'Teachers and School Employees']"
End for Team's Dream And Hundley's Season,1997-09-24,article,News,,"['Baseball', 'Appointments and Executive Changes']"
The Return of Thalidomide,1997-09-24,article,Editorial,,"['Birth Defects', 'Editorials', 'Thalidomide (Drug)', ""Leprosy (Hansen's Disease)""]"
Bits and Bytes,1997-09-24,article,News,,"['COMPUTERS AND INFORMATION SYSTEMS', 'Wines', 'Restaurants', 'Television', 'INTERNET AND WORLD WIDE WEB', 'Cooking and Cookbooks', 'ALCOHOLIC BEVERAGES', 'Food']"
"With Timber Scarce, Old Logs Deep in a Lake Become a Sunken Treasure",1997-09-24,article,News,,['Wood and Wood Products']
"Paid Notice: Deaths  SCHULMAN, BETTY",1997-09-24,article,Paid Death Notice,,[]
Washington Journal; Stores Invite Police To Stop By,1997-09-24,article,News,,"['Police', 'RETAIL STORES AND TRADE']"
Twist in Case of Missing Restaurateur,1997-09-24,article,News,,"['LIE DETECTORS', 'Missing Persons']"
AIDS Studies Violate Helsinki Rights Accord; Similar to Tuskegee,1997-09-24,article,Letter,,"['Acquired Immune Deficiency Syndrome', 'Research']"
Residents Can Opt For Hospice Treatment,1997-09-24,article,News,,['Medicine and Health']
"Endgame: It's All Work Now for Deep Blue, Chess Champ",1997-09-24,article,News,,"['COMPUTERS AND INFORMATION SYSTEMS', 'Chess']"
"Paid Notice: Deaths  WELS, ARTHUR N. (ARTY)",1997-09-24,article,Paid Death Notice,,[]
Campus Journal; Final Volume of Study Documents a Central Role for Black Colleges,1997-09-24,article,News,,"['Education and Schools', 'Blacks', 'Black People', 'Colleges and Universities', 'SCHOLASTIC ASSESSMENT TEST (SAT)', 'Research']"
"Paid Notice: Deaths  SIMETI, VINCENT",1997-09-24,article,Paid Death Notice,,[]
"Paid Notice: Deaths  CAMPANELLI, MARY",1997-09-24,article,Paid Death Notice,,[]
Cheap Food Is Costly,1997-09-24,article,Letter,,['Food']
Rebels Gear Up for Colorado Primary,1997-09-24,article,News,,"['Legislatures and Parliaments', 'Term Limits (Political Office)', 'Elections']"
Student Wins Suit Accusing A Professor Of Plagiarism,1997-09-24,article,News,,"['Plagiarism', 'Colleges and Universities', 'Teachers and School Employees', 'Decisions and Verdicts']"
City Opera Sets Strike Deadline,1997-09-24,article,News,,"['LABOR', 'Opera']"
Temptation; A Potato Chip That Flirts With Perfection,1997-09-24,article,News,,['Potato Chips']
Scientists Ease Up On Fear Of Eggs,1997-09-24,article,News,,"['Heart', 'Diet and Nutrition', 'Eggs', 'Oils and Fats', 'Cholesterol', 'Food']"
"DANA WILL DISMISS 1,100 EMPLOYEES",1997-09-24,article,News,,"['Automobiles', 'LABOR', 'Finances', 'Layoffs and Job Reductions']"
"Paid Notice: Deaths  MCDERMOTT, MAURICE M.",1997-09-24,article,Paid Death Notice,,[]
FOOTLIGHTS,1997-09-24,article,News,,"['Books and Literature', 'Monuments and Memorials']"
Metro Business Briefs; HMV Records Plans Store in Harlem USA,1997-09-24,article,News,,['RETAIL STORES AND TRADE']
"Paid Notice: Memorials  RYLE, JOSEPH D.",1997-09-24,article,Paid Death Notice,,[]
Double Surprise In a Maverick Piano Contest; Out-and-Out Grant to a Star,1997-09-24,article,News,,"['Music', 'GILMORE ARTIST AWARD', 'Awards, Decorations and Honors', 'GILMORE INTERNATIONAL KEYBOARD FESTIVAL']"
"Paid Notice: Deaths  STONE, JANET IASON",1997-09-24,article,Paid Death Notice,,[]
"For Haitians, Leadership Split Is a Generation Gap",1997-09-24,article,News,,"['Social Conditions and Trends', 'Haitian-Americans']"
Columbia/HCA Unit Gets Offers,1997-09-24,article,News,,"['Frauds and Swindling', 'Mergers, Acquisitions and Divestitures', 'Medicare', 'Medicine and Health', 'Hospitals']"
"Paid Notice: Deaths  HECHT, IRA M.",1997-09-24,article,Paid Death Notice,,[]
F.C.C. Is Urged to Keep Close Eye on Cable Rates,1997-09-24,article,News,,"['Cable Television', 'Mergers, Acquisitions and Divestitures', 'Television', 'Prices (Fares, Fees and Rates)', 'Satellites', 'Consumer Protection', 'Regulation and Deregulation of Industry']"
Kiwi Announces New Routes,1997-09-24,article,News,,"['AIRLINES AND AIRPLANES', 'Bankruptcies']"
"Paid Notice: Deaths  SCHEINE, ARNOLD J.",1997-09-24,article,Paid Death Notice,,[]
Topics of The Times; Croatia Bullies A Critic,1997-09-24,article,Editorial,,"['Editorials', 'Politics and Government', 'Freedom and Human Rights']"
"Hicks, Muse to Seek Investments in Food",1997-09-24,article,News,,"['Mergers, Acquisitions and Divestitures', 'Finances', 'Food']"
"Paid Notice: Deaths  TURINGAN, JEAN, M.D.",1997-09-24,article,Paid Death Notice,,[]
What's in a Name? Testing a Bar for 'Greatness',1997-09-24,article,News,,['Bars']
"Diplomacy, Gore-Style, Is a Study In 'Process'",1997-09-24,article,News,,"['United States International Relations', 'RUSSIA-INTERNATIONAL RELATIONS-US']"
Campus Journal; Marlboro College Seeking More Welcoming Campus,1997-09-24,article,News,,['ARCHITECTURE']
Lewis's Injury Causes More Scrambling,1997-09-24,article,News,,['Football']
"Paid Notice: Memorials  EDLEY, SOL J.",1997-09-24,article,Paid Death Notice,,[]
"From Chairman of House Inquiry, No Apologies for Aggressive Style",1997-09-24,article,News,,"['Finances', 'Biographical Information', 'Ethics', 'Elections', 'Presidential Election of 1996']"
Texas Deal by Merry Land,1997-09-24,article,News,,"['Mergers, Acquisitions and Divestitures', 'Housing']"
Key Rates,1997-09-24,article,Statistics,,['KEY RATES (NYT COLUMN)']
Business Travel; American and Delta join United in cutting travel agent commissions. Should consumers care?,1997-09-24,article,News,,"['AIRLINES AND AIRPLANES', 'COMMISSIONS (FEES)', 'Travel Agencies and Agents']"
Remarks Send Dollar Lower Against Yen,1997-09-24,article,News,,['Currency']
"A Star Is Licensed; With 'Arthur,' Public TV Stretches Commercial Limits",1997-09-24,article,News,,"['MARKETING AND MERCHANDISING', 'Television', 'Children and Youth', 'Toys']"
The Pop Life; Buildup Begins For Star Wars,1997-09-24,article,News,,"['RECORDINGS (AUDIO)', 'Music', 'ADVERTISING', 'MARKETING AND MERCHANDISING']"
Gooden Nominates Wells to Be Third Post-Season Starter,1997-09-24,article,News,,['Baseball']
Restaurants; Cleverly Combining Flavors Borrowed From All Across Asia,1997-09-24,article,Review,,"['Reviews', 'Restaurants']"
"Paid Notice: Deaths  LIPSON, MORRIS",1997-09-24,article,Paid Death Notice,,[]
"$25 and Under; In Greenwich Village, A Trattoria Gives It a Try",1997-09-24,article,Review,,['Restaurants']
Smith Barney Agrees to Settle Bond Charges for $2 Million,1997-09-24,article,News,,"['Frauds and Swindling', 'Securities and Commodities Violations', 'Suits and Litigation', 'Government Bonds']"
"Paid Notice: Deaths  KEETON, KATHY",1997-09-24,article,Paid Death Notice,,[]
TV Notes; Fox Quits Time Slot,1997-09-24,article,News,,"['Television', 'Ratings and Rating Systems', 'TELEVISION AND RADIO PROGRAMMING']"
"Paid Notice: Deaths  STOCK, LEONARD PLAUT",1997-09-24,article,Paid Death Notice,,[]
"Paid Notice: Deaths  LANIGAN, JANET",1997-09-24,article,Paid Death Notice,,[]
CRACKEN HARKEY IS BUYING EL CHICO RESTAURANTS,1997-09-24,article,News,,"['Mergers, Acquisitions and Divestitures']"
McGreevey Takes On Whitman's Good-Times Theme,1997-09-24,article,News,,"['Taxation', 'Political Advertising', 'ELECTION ISSUES', 'Governors (US)', 'Property Taxes', 'Economic Conditions and Trends', 'Elections', 'Automobile Insurance and Liability']"
Critic's Notebook; Attuning Classical Music to the Eye as Well as the Ear,1997-09-24,article,News,,['Music']
"Paid Notice: Deaths  GILBERT, MARK JEFFERSON (JEFF)",1997-09-24,article,Paid Death Notice,,[]
SECURITY AIDE SEES PRESENCE IN BOSNIA BEYOND DEADLINE,1997-09-24,article,News,,['UNITED STATES ARMAMENT AND DEFENSE']
Guinness Profit Climbed 4% in First Half,1997-09-24,article,News,,['Company Reports']
Corrections,1997-09-24,article,Correction,,"['Heart', 'Weight', 'Pondimin (Drug)', 'REDUX (DRUG)', 'Correction Stories']"
"Paid Notice: Deaths  TRAINA, NICHOLAS JOHN",1997-09-24,article,Paid Death Notice,,[]
"Already One of the Best, Richter Gets Better Still",1997-09-24,article,News,,"['Hockey, Ice']"
Anger Flares as Focus Shifts to Campaign Remedies,1997-09-24,article,News,,"['Reform and Reorganization', 'Finances', 'Ethics', 'Filibusters and Debate Curbs', 'Law and Legislation', 'Elections', 'Presidential Election of 1996']"
"Fables or Not, Marco Polo's Legacy Is Real",1997-09-24,article,Letter,,[]
"Paid Notice: Deaths  NEWMAN, NAOMI",1997-09-24,article,Paid Death Notice,,[]
Israel Identifies Four Suicide Bombers as West Bank Palestinians,1997-09-24,article,News,,"['Palestinians', 'Bombs and Explosives', 'Terrorism']"
ROUNDUP,1997-09-24,article,News,,"['GRAND SLAM CUP', 'Tennis']"
How Honesty Can Lead Police Astray,1997-09-24,article,Review,,"['MOTION PICTURES', 'Reviews']"
Corrections,1997-09-24,article,Correction,,"['Correction Stories', 'Deaths (Obituaries)']"
"Paid Notice: Deaths  GREEN, JULES L.",1997-09-24,article,Paid Death Notice,,[]
"Sports of The Times; Barry Bonds: Too Little, Too Late?",1997-09-24,article,News,,['Baseball']
Serpico Steps Out of the Shadows to Testify,1997-09-24,article,News,,"['Police Brutality and Misconduct', 'Police']"
About New York; Raffle Plan For Yankees Thrown Out,1997-09-24,article,News,,['Baseball']
Musical Tribute to Diana Sells Briskly in U.S. Debut,1997-09-24,article,News,,['Music']
Messinger Says Giuliani Ad Falsifies Position She Took,1997-09-24,article,News,,"['Mayors', 'Political Advertising', 'ELECTION ISSUES', 'PORNOGRAPHY AND OBSCENITY', 'Elections']"
INTERNATIONAL MULTIFOODS TO CLOSE POULTRY EXPORT UNIT,1997-09-24,article,News,,"['Shutdowns (Institutional)', 'FACTORIES AND INDUSTRIAL PLANTS']"
"On U.S. Team, Woods Is Just One of the Guys",1997-09-24,article,News,,"['Ryder Cup (Golf)', 'Golf']"
20th Century Fox Is Added to Gravano Suit,1997-09-24,article,News,,"['MOTION PICTURES', 'Organized Crime', 'Books and Literature', 'Suits and Litigation', 'Informers', 'Crime and Criminals']"
"Paid Notice: Deaths  SHEA, THOMAS G.",1997-09-24,article,Paid Death Notice,,[]
Questionable Medicine,1997-09-24,article,Letter,,['Medicine and Health']
"Ripken's Will Is Still Iron, but Not His Body",1997-09-24,article,Biography,,"['Baseball', 'Records and Achievements']"
"Stretching Limits, and Ears and Noses",1997-09-24,article,Review,,"['ANIMATED FILMS', 'MOTION PICTURES']"
N.Y.U. Center And Mt. Sinai Resume Talks,1997-09-24,article,News,,"['Mergers, Acquisitions and Divestitures', 'Medicine and Health', 'Hospitals']"
Lawsuit Charges Racial Bias,1997-09-24,article,News,,"['Blacks', 'Black People', 'Suits and Litigation', 'RETAIL STORES AND TRADE']"
Witness Says He Warned Man Who Was Slain Over Parking,1997-09-24,article,News,,"['Police Brutality and Misconduct', 'Murders and Attempted Murders']"
A Seedy World You Want to Flee,1997-09-24,article,Review,,"['MOTION PICTURES', 'Reviews']"
"Paid Notice: Deaths  KIMMEL, MICHAEL",1997-09-24,article,Paid Death Notice,,[]
"Paid Notice: Deaths  WACHS, SADIE",1997-09-24,article,Paid Death Notice,,[]
"For Panthers, a Cure For Racial Strife: Win",1997-09-24,article,News,,"['Blacks', 'Black People', 'Football']"
House Seeks Leverage for Favored Items,1997-09-24,article,News,,"['Vouchers', 'International Trade and World Market', 'Population', 'Education and Schools', 'Treaties', 'FREE PORTS AND TRADING ZONES', 'Law and Legislation', 'Census']"
Democrats' Chances Rated,1997-09-24,article,News,,"['Legislatures and Parliaments', 'Elections']"
"Paid Notice: Deaths  ROSEMAN, JACK",1997-09-24,article,Paid Death Notice,,[]
What Victims Seek,1997-09-24,article,Letter,,['Murders and Attempted Murders']
A Philosophical Eye on Big Prizes,1997-09-24,article,News,,"['Theater', 'Awards, Decorations and Honors', 'Culture', 'Music', 'Dancing']"
"Risking China's Wrath, U.S. and Japan Bolster Military Ties",1997-09-24,article,News,,"['JAPAN-INTERNATIONAL RELATIONS-US', 'United States International Relations', 'ARMAMENT, DEFENSE AND MILITARY FORCES', 'CHINA-INTERNATIONAL RELATIONS-US', 'UNITED STATES ARMAMENT AND DEFENSE']"
"An industry women's group passes judgment with the Good, the Bad and the Ugly Awards.",1997-09-24,article,News,,"['ADVERTISING', 'GOOD, BAD AND UGLY AWARDS (ADVERTISING)', 'Women', 'Awards, Decorations and Honors']"
Liberties; The Devil in Prime Time,1997-09-24,article,Op-Ed,,"['JESUITS', 'Television', 'Priests']"
BELLSOUTH TO BUY BACK UP TO $1 BILLION IN STOCK,1997-09-24,article,News,,['Finances']
Disappointing Auction Trims Bond Prices,1997-09-24,article,News,,"['Finances', 'Interest Rates', 'Government Bonds']"
Corrections,1997-09-24,article,Correction,,"['Books and Literature', 'Correction Stories', 'BOOKER PRIZE', 'Awards, Decorations and Honors']"
"BASEBALL: Mets' Drama Ends and Yanks' Rehearsals Continue; In a Preview, Indians Take Center Stage",1997-09-24,article,News,,['Baseball']
Appeals Court Upholds Fine Imposed on Trader for Daiwa,1997-09-24,article,News,,"['Frauds and Swindling', 'Fines (Penalties)', 'Sentences (Criminal)', 'Decisions and Verdicts']"
"Paid Notice: Deaths  LEVY, ANNABELL E.",1997-09-24,article,Paid Death Notice,,[]
"Viscount Tonypandy, 88, Ex-Speaker of Commons, Dies",1997-09-24,article,Obituary; Biography,,"['Biographical Information', 'Deaths (Obituaries)']"
What Victims Seek,1997-09-24,article,Letter,,['Murders and Attempted Murders']
"Paid Notice: Memorials  PAUMARD, BRICE",1997-09-24,article,Paid Death Notice,,[]
The Chef,1997-09-24,article,News,,"['Cooking and Cookbooks', 'Recipes']"
"Paid Notice: Deaths  GUCCIONE, KATHY KEETON",1997-09-24,article,Paid Death Notice,,[]
Attempted Murder Charge Is Added in a Beating Case,1997-09-24,article,News,,"['Murders and Attempted Murders', 'Blacks', 'Black People', 'Assaults', 'Hate Crimes']"
What Victims Seek,1997-09-24,article,Letter,,['Murders and Attempted Murders']
Restoring a Fragile Link to New Years' Past,1997-09-24,article,News,,"['JEWS', 'ROSH HA-SHANAH', 'Cooking and Cookbooks', 'Recipes']"
Return of a White Marble Palace; Buildings Agency to Occupy Old Home of Stewart's and The Sun,1997-09-24,article,News,,['Historic Buildings and Sites']
"Paid Notice: Deaths  SLOSBERG, HOWARD",1997-09-24,article,Paid Death Notice,,[]
"Paid Notice: Deaths  PONSFORD, ERICA (NEE NEWMARK)",1997-09-24,article,Paid Death Notice,,[]
Chelsea at Stanford,1997-09-24,article,Letter,,[]
Dollar Climbs Against Mark On German Economic Data,1997-09-24,article,News,,"['Currency', 'Prices (Fares, Fees and Rates)', 'Interest Rates', 'Credit', 'Economic Conditions and Trends']"
EATON TO SELL APPLIANCE CONTROL BUSINESS,1997-09-24,article,News,,"['Mergers, Acquisitions and Divestitures']"
Wall St. Giant Reports Net Soared 51%,1997-09-24,article,Statistics,,['Company Reports']
Giants Hope To Get Offense and Defense Clicking Together,1997-09-24,article,News,,['Football']
"Paid Notice: Deaths  COLTMAN, EVELYN O.",1997-09-24,article,Paid Death Notice,,[]
"Paid Notice: Memorials  MOTTEL, BERTHA",1997-09-24,article,Paid Death Notice,,[]
"Paid Notice: Deaths  WEINTRAUB, JULIUS",1997-09-24,article,Paid Death Notice,,[]
ATKINSON MULLING POSSIBLE SALE OR MERGER,1997-09-24,article,News,,"['Mergers, Acquisitions and Divestitures', 'Bankruptcies']"
TV Notes; Spike Lee on Hold,1997-09-24,article,News,,"['Television', 'TELEVISION AND RADIO PROGRAMMING']"
Market Place; Salomon Soars On Speculation Of a Takeover By Travelers,1997-09-24,article,News,,"['Mergers, Acquisitions and Divestitures', 'Stocks and Bonds']"
Health Care Behind Bars,1997-09-24,article,Letter,,"['HEALTH MAINTENANCE ORGANIZATIONS AND MANAGED CARE', 'Prisons and Prisoners', 'Medicine and Health']"
Disaster Relief for County,1997-09-24,article,News,,"['Weather', 'Floods']"
"Paid Notice: Deaths  ROSS, IRWIN",1997-09-24,article,Paid Death Notice,,[]
"Louima, on Critical List, Has Blood Clot",1997-09-24,article,News,,"['Police Brutality and Misconduct', 'Police', 'Haitian-Americans']"
INSIDE METRO,1997-09-24,article,Summary,,[]
"LIGHT TRUCKS, HEAVY RISK: A special report.; A Deadly Highway Mismatch Ignored",1997-09-24,article,Special Report,,"['Accidents and Safety', 'Trucks and Trucking', 'Automobile Safety Features and Defects', 'Roads and Traffic', 'UTILITY VEHICLES']"
Speaker and Panel Chief Avert Battle on Highway Spending,1997-09-24,article,News,,"['Transportation', 'Roads and Traffic', 'FINANCE', 'Law and Legislation', 'Budgets and Budgeting']"
Flight Of the Bumblers,1997-09-24,article,Op-Ed,,"['Space', 'Space Stations', 'MIR (SPACE STATION)']"
Gehrig's Streak Ended When Gehrig Said So,1997-09-24,article,Biography,,['Baseball']
Norwest to Split Stock,1997-09-24,article,News,,['Finances']
