headline,date,doc_type,material_type,section,keywords
New Jersey Daily Briefing; Oil Spill Money to Help Birds,1997-09-16,article,News,,"['Water Pollution', 'Oil (Petroleum) and Gasoline', 'Exxon Valdez (Tanker)', 'Birds']"
"Market Place; A Russian bank turns about, a rare response to shareholders.",1997-09-16,article,News,,"['Nickel', 'Mines and Mining', 'Finances']"
Mideast 'Kindness'?,1997-09-16,article,Letter,,"['United States International Relations', 'Palestinians']"
Prison in the Forest; The Itinerant Jailer Is an Adirondack Plan's Best Booster,1997-09-16,article,News,,['Prisons and Prisoners']
"Paid Notice: Deaths  MINDELL, GERALDINE",1997-09-16,article,Paid Death Notice,,[]
"Paid Notice: Deaths  MITCHELL, ARTHUR",1997-09-16,article,Paid Death Notice,,[]
"As a Status Symbol, Big East Is Lagging",1997-09-16,article,News,,['Football']
Product Delay Sends Microsoft Shares Lower,1997-09-16,article,News,,"['COMPUTERS AND INFORMATION SYSTEMS', 'COMPUTER SOFTWARE', 'Finances']"
Weird Karma in the End Zone,1997-09-16,article,News,,['Football']
WebTV Introduces a System Linking Live TV and Internet,1997-09-16,article,News,,"['COMPUTERS AND INFORMATION SYSTEMS', 'Television', 'INTERNET AND WORLD WIDE WEB']"
Guards Find A Pipe Gun After Inmate Is Shot in Jail,1997-09-16,article,News,,"['BROOKLYN HOUSE OF DETENTION', 'Prisons and Prisoners', 'Firearms']"
"Paid Notice: Deaths  JOSEPH, FRANK",1997-09-16,article,Paid Death Notice,,[]
"No Shortage of Criticism, But Little for Each Other",1997-09-16,article,News,,"['Mayors', 'Television', 'Debating', 'Elections']"
"Jets Supply Effort, but Parcells Holds the Praise",1997-09-16,article,News,,"['Coaches and Managers', 'Football']"
Whitman Shifts Focus From Car Insurance to Record on Other Issues,1997-09-16,article,News,,"['PUBLIC OPINION', 'ADVERTISING', 'Political Advertising', 'ELECTION ISSUES', 'Governors (US)', 'Elections', 'Automobile Insurance and Liability']"
"Aron Broches, 83, Official at World Bank",1997-09-16,article,Obituary; Biography,,"['Biographical Information', 'Deaths (Obituaries)']"
"Will Hare, 81, a Founder of Actors Studio",1997-09-16,article,Obituary; Biography,,"['Biographical Information', 'Deaths (Obituaries)']"
INTERNATIONAL BUSINESS: Japanese Economy Follows A Zigzag; Exporters Thrive as Other Sectors Sink,1997-09-16,article,News,,"['International Trade and World Market', 'Economic Conditions and Trends']"
How Long Will Good Times Roll?,1997-09-16,article,Editorial,,"['United States Economy', 'Editorials', 'Forecasts']"
"Cloudy, Chance of Annihilation",1997-09-16,article,Op-Ed,,"['Weather', 'EL NINO (PACIFIC OCEAN CURRENT)']"
"Paid Notice: Deaths  GROTTA, PAULINE (NEE BORNSTEIN)",1997-09-16,article,Paid Death Notice,,[]
Violence Against Women Isn't a Numbers Game; No Feminist Trickery,1997-09-16,article,Letter,,"['Domestic Violence', 'Women']"
Interacting To the Beat Of a Street,1997-09-16,article,Review,,"['Reviews', 'Dancing']"
"Paid Notice: Memorials  POLIAK, SAUL AND JANICE",1997-09-16,article,Paid Death Notice,,[]
Chief of Coke Still in Hospital,1997-09-16,article,News,,['Biographical Information']
Executive Changes,1997-09-16,article,News,,['Appointments and Executive Changes']
"Sara Lee Announces a Big Revamping, and Stock Climbs",1997-09-16,article,News,,"['Mergers, Acquisitions and Divestitures', 'COMPANY AND ORGANIZATION PROFILES', 'Finances', 'Textiles']"
Corrections,1997-09-16,article,Correction,,"['Music', 'Correction Stories']"
Even Scorecard Can't Help TNT Analysts,1997-09-16,article,News,,"['Television', 'Football']"
Kodak Warns Of Weak Sales; Stock Drops,1997-09-16,article,News,,"['Sales', 'Finances', 'Photography']"
Ewing to Lead Players Union,1997-09-16,article,News,,['Basketball']
"Citing Fraud in Home Care, Clinton Halts New Permits",1997-09-16,article,News,,"['Frauds and Swindling', 'Standards and Standardization', 'Medicare', 'Medicine and Health']"
GRANCARE AND LIVING CENTERS RENEGOTIATE MERGER PLAN,1997-09-16,article,News,,"['Mergers, Acquisitions and Divestitures', 'Nursing Homes']"
Schools Chief Drops His Plan For Majors,1997-09-16,article,News,,"['Mathematics', 'Standards and Standardization', 'Education and Schools', 'Language and Languages', 'Science and Technology']"
"Paid Notice: Deaths  GELSEY, BILLIE (FAY CHARNEY)",1997-09-16,article,Paid Death Notice,,[]
Bonds Rise As Investors Await Reports,1997-09-16,article,News,,"['Finances', 'Interest Rates', 'Government Bonds']"
Wheat Falls on Export News As Weather Lifts Soybeans,1997-09-16,article,News,,"['Weather', 'International Trade and World Market', 'Wheat', 'Prices (Fares, Fees and Rates)', 'Grain', 'Rain']"
"Paid Notice: Deaths  FINETTE, CHARLES. M.",1997-09-16,article,Paid Death Notice,,[]
Albright Says She Found 'Tattered' Mideast Situation,1997-09-16,article,News,,"['United States International Relations', 'Palestinians', 'Biographical Information']"
Old Problem Is Pinpointed In the Crash Of Fighter,1997-09-16,article,News,,"['Accidents and Safety', 'AIRLINES AND AIRPLANES', 'Military Aircraft']"
Representative Plans Bill To Aid Deaf Immigrants,1997-09-16,article,News,,"['Deportation', 'Deafness', 'IMMIGRATION AND REFUGEES', 'Law and Legislation']"
CHRONICLE,1997-09-16,article,News,,"['Awards, Decorations and Honors']"
"Paid Notice: Deaths  CHAPMAN, WILLIAM HAVEN",1997-09-16,article,Paid Death Notice,,[]
New Jersey Daily Briefing; Libertarian Seeks Funds,1997-09-16,article,News,,"['Finances', 'Governors (US)', 'Elections']"
Jews Oust Arab Tenants From House In Jerusalem,1997-09-16,article,News,,"['United States International Relations', 'Palestinians', 'Housing']"
LORAL TO SELL BACK 22.5% INTEREST IN K & F INDUSTRIES,1997-09-16,article,News,,"['Mergers, Acquisitions and Divestitures']"
Theorists See Evolutionary Advantages In Menopause,1997-09-16,article,News,,"['ARCHEOLOGY AND ANTHROPOLOGY', 'Hadza Tribe', 'Women', 'Menopause', 'Research', 'Evolution']"
Brave Quest of Africa Hunt: Bringing Back Extinct Quagga,1997-09-16,article,News,,"['QUAGGA (EXTINCT ANIMAL)', 'Endangered and Extinct Species', 'Zebras', 'Breeding of Animals']"
New Jersey Daily Briefing; No Smoking at County Jail,1997-09-16,article,News,,"['Prisons and Prisoners', 'Smoking and Tobacco']"
Sinn Fein Joins Ulster Talks But Protestants Stay Away,1997-09-16,article,News,,"['Biographical Information', 'Civil War and Guerrilla Warfare']"
"Paid Notice: Deaths  NOBLE, ANNA (LOUGHLIN)",1997-09-16,article,Paid Death Notice,,[]
Ingersoll-Rand to Buy Westinghouse's Thermo King Unit,1997-09-16,article,News,,"['Mergers, Acquisitions and Divestitures']"
"Lahic Journal; From Splendid Isolation, Treasures for the World",1997-09-16,article,News,,"['Copper, Brass and Bronze', 'Handicrafts']"
Tiniest Terror Plaguing Los Angeles,1997-09-16,article,News,,['Ants']
Honoring Mother Teresa,1997-09-16,article,Letter,,['Biographical Information']
A Streetwise Solomon,1997-09-16,article,Review,,"['Reviews', 'Television']"
Amgen to Pay $96 Million in Drug Dispute,1997-09-16,article,News,,"['Drugs (Pharmaceuticals)', 'Suits and Litigation', 'EPOETIN ALFA (DRUG)', 'ANEMIA', 'Decisions and Verdicts']"
Footlights,1997-09-16,article,News,,"['MOTION PICTURES', 'Television', 'Royal Family', 'TORONTO FILM FESTIVAL', 'Entertainment and Amusements', 'Opera', 'Awards, Decorations and Honors', 'Theater']"
Armenian Genocide,1997-09-16,article,Letter,,[]
A Good Reason to Floss,1997-09-16,article,News,,"['Stroke', 'Gums (Mouth)', 'Research', 'Bronchitis', 'Teeth and Dentistry', 'CHLAMYDIA PNEUMONIAE (BACTERIA)']"
"Paid Notice: Deaths  YOUNG, GERTRUDE (GERRY)",1997-09-16,article,Paid Death Notice,,[]
"Paid Notice: Deaths  POMORY, PAMELA JANE FENN",1997-09-16,article,Paid Death Notice,,[]
HEALTH WATCH; Red Wine in Virtual Tie,1997-09-16,article,News,,"['Heart', 'ALCOHOLIC BEVERAGES', 'Wines']"
Chess,1997-09-16,article,News,,['Chess']
"Paid Notice: Deaths  HUNT, BRO. GREGORY, FSC",1997-09-16,article,Paid Death Notice,,[]
Mideast 'Kindness'?,1997-09-16,article,Letter,,['Palestinians']
"Treasure of Biodiversity Discovered, and It's in Nation's Yard",1997-09-16,article,News,,['Environment']
Violence Against Women Isn't a Numbers Game; Fear of Retaliation,1997-09-16,article,Letter,,"['Domestic Violence', 'Women']"
"Paid Notice: Deaths  FELDMAN, S.",1997-09-16,article,Paid Death Notice,,[]
"Paid Notice: Deaths  WALLER, RONALD R.",1997-09-16,article,Paid Death Notice,,[]
"How to Hold, How to Fold: A Lost Art",1997-09-16,article,News,,"['Newspapers', 'Transit Systems']"
Chess,1997-09-16,article,News,,['Chess']
Corrections,1997-09-16,article,Correction,,[]
New Culprit in Deaths of Frogs,1997-09-16,article,News,,"['Endangered and Extinct Species', 'Frogs']"
Muzzatti Makes Debut For Rangers in Victory,1997-09-16,article,News,,"['Hockey, Ice']"
O'Brien's Goal: Break Own Record,1997-09-16,article,News,,"['Decathlon', 'Track and Field']"
"Paid Notice: Deaths  SUSSMAN, MURRAY",1997-09-16,article,Paid Death Notice,,[]
Of America as a Splendid Junk Heap,1997-09-16,article,Review,,"['Reviews', 'Books and Literature']"
Colombian Utility Sold for $2.18 Billion,1997-09-16,article,News,,"['Mergers, Acquisitions and Divestitures', 'Electric Light and Power']"
Patients Who Require Antibiotics For Dental Work Can Cut Doses,1997-09-16,article,News,,"['AMOXICILLIN (DRUG)', 'Heart', 'ANTIBIOTICS', 'Teeth and Dentistry', 'ALLERGIES']"
"Paid Notice: Deaths  GOLDIN, ISAAC",1997-09-16,article,Paid Death Notice,,[]
INSIDE METRO,1997-09-16,article,Summary,,[]
Canada Tries Once Again to Make Unity Palatable to Quebec,1997-09-16,article,News,,"['Politics and Government', 'INDEPENDENCE MOVEMENTS AND SECESSION']"
Nassau Chief Wants to Cut Property Tax By 5 Percent,1997-09-16,article,News,,"['Taxation', 'Finances', 'ELECTION ISSUES', 'Property Taxes', 'Budgets and Budgeting', 'Elections']"
Judge Denies ITT Move to Drop Hilton Suit,1997-09-16,article,News,,"['Mergers, Acquisitions and Divestitures', 'HOTELS AND MOTELS', 'Suits and Litigation', 'Decisions and Verdicts']"
I.B.M.'S TIVOLI SYSTEMS PLANS TO BUY UNISON SOFTWARE,1997-09-16,article,News,,"['Mergers, Acquisitions and Divestitures']"
Queen Issues Feisty Denial Of Disputes Over Funeral,1997-09-16,article,News,,"['Accidents and Safety', 'Roads and Traffic', 'Royal Family', 'Biographical Information', 'Drunken and Reckless Driving']"
On My Mind; The Right Message,1997-09-16,article,Op-Ed,,"['Freedom of Religion', 'Biographical Information', 'Religion and Churches', 'Christians and Christianity', 'Law and Legislation']"
National News Briefs; Arkansas Man Arrested In Series of Sex Assaults,1997-09-16,article,News,,"['Sex Crimes', 'Biographical Information']"
By Design; The Velvet Accent,1997-09-16,article,News,,['APPAREL']
MARINER HEALTH TO BUY PRISM HEALTH FOR $84 MILLION,1997-09-16,article,News,,"['Mergers, Acquisitions and Divestitures']"
Arts in America; A Southerner Journeying From Blues to Bureaucracy,1997-09-16,article,Obituary; Biography,,"['Biographical Information', 'Culture']"
A Choreographer's Sad But Funny Past,1997-09-16,article,Review,,"['Reviews', 'Dancing']"
A G.E. Apartment Venture,1997-09-16,article,News,,"['Mergers, Acquisitions and Divestitures', 'Housing', 'APARTMENT HOUSES']"
Other Nations Call New U.S. Terms for Mine Ban Unacceptable,1997-09-16,article,News,,"['United States International Relations', 'Mines, Explosive', 'Treaties']"
Federal Express Doubles Earnings,1997-09-16,article,News,,"['LABOR', 'Delivery Services', 'Strikes', 'Company Reports']"
Concern Develops on Wall St. Over Wide Swings in Stocks,1997-09-16,article,News,,"['Forecasts', 'Stocks and Bonds', 'Dow Jones Stock Average']"
"To American Peacekeepers in Bosnia, Danger Is Just Beginning",1997-09-16,article,News,,"['United States International Relations', 'Civil War and Guerrilla Warfare', 'UNITED STATES ARMAMENT AND DEFENSE']"
Metro Business; Suite for the Blind to Open,1997-09-16,article,News,,"['HOTELS AND MOTELS', 'Blindness']"
Equity Office Properties to Absorb Beacon,1997-09-16,article,News,,"['Mergers, Acquisitions and Divestitures', 'OFFICE BUILDINGS']"
Seats Found After Crash of New Jersey-Based Plane,1997-09-16,article,News,,"['Accidents and Safety', 'AIRLINES AND AIRPLANES', 'MCGUIRE AIR FORCE BASE (NJ)', 'Military Aircraft', 'C-141 AIRPLANE', 'UNITED STATES ARMAMENT AND DEFENSE']"
Soccer; NOTEBOOK,1997-09-16,article,News,,['Soccer']
The Blame Slag Heap,1997-09-16,article,Op-Ed,,"['Water Pollution', 'Mines and Mining', 'Hazardous and Toxic Substances']"
Q&A,1997-09-16,article,Question,,['Calcium']
Boeing Says Jet Output Is Off Pace,1997-09-16,article,News,,"['AIRLINES AND AIRPLANES', 'Finances', 'Production']"
"Paid Notice: Deaths  PELL, RICHARD, SR.",1997-09-16,article,Paid Death Notice,,[]
Personal Health,1997-09-16,article,News,,"['Diet and Nutrition', 'Weight', 'Exercise']"
COMPANY BRIEFS,1997-09-16,article,News,,[]
A Continental Divide of Stars,1997-09-16,article,News,,"['Hockey, Ice', 'ALL-STAR GAMES']"
Violence Against Women Isn't a Numbers Game,1997-09-16,article,Letter,,"['Domestic Violence', 'Women']"
"Paid Notice: Deaths  BISHARA, ELIZABETH (NEE DOOGAN)",1997-09-16,article,Paid Death Notice,,[]
New Work Proposed For Shuttles: Salvage in Space,1997-09-16,article,News,,"['Space', 'SPACE SHUTTLE', 'Privatization', 'Satellites', 'Salvage']"
Many Pitchers Are Far From Post-Season Form,1997-09-16,article,News,,['Baseball']
CRITIC'S CHOICE/Country CD's; Getting More Bang for the Twang,1997-09-16,article,Review,,"['RECORDINGS (AUDIO)', 'Music', 'Reviews']"
Welfare's New Face?,1997-09-16,article,Letter,,['Welfare (US)']
Downsizing Activism: Greenpeace Is Cutting Back,1997-09-16,article,News,,"['Water Pollution', 'Forests and Forestry', 'Weather', 'Environment', 'Finances', 'Waste Materials and Disposal', 'Fish and Other Marine Life']"
Fight Over Nomination Clearly Shows Rifts in G.O.P.,1997-09-16,article,An Analysis; News Analysis,,"['United States Politics and Government', 'UNITED STATES FOREIGN SERVICE', 'Biographical Information']"
"Paid Notice: Deaths  BAXT, RUTH",1997-09-16,article,Paid Death Notice,,[]
AMERICA WEST SIGNS A $1.4 BILLION DEAL WITH AIRBUS,1997-09-16,article,News,,['AIRLINES AND AIRPLANES']
"Paid Notice: Memorials  RATNER, MORRIS",1997-09-16,article,Paid Death Notice,,[]
Giants Lose Hilliard For Rest Of Season,1997-09-16,article,News,,['Football']
Researchers Find a Concentrated Anticancer Substance in Broccoli Sprouts,1997-09-16,article,News,,"['Cancer', 'ENZYMES', 'Broccoli', 'Research', 'ISOTHIOCYANATES (CHEMICAL)']"
"Paid Notice: Deaths  PETERS, PHILIP HOMER",1997-09-16,article,Paid Death Notice,,[]
"Paid Notice: Deaths  BRODY, STANLEY J.",1997-09-16,article,Paid Death Notice,,[]
Presenting the Governor's First Term in 30 Seconds,1997-09-16,article,News,,"['ADVERTISING', 'Television', 'Political Advertising', 'Governors (US)', 'Elections']"
New Jersey Daily Briefing; Roadside Inspections to Start,1997-09-16,article,News,,"['Buses', 'Trucks and Trucking', 'Diesel Power', 'Roads and Traffic', 'Air Pollution']"
Special Education Class Sizes Are Linked to a Drop in Scores,1997-09-16,article,News,,"['Education and Schools', 'Special Education (Handicapped)']"
"Paid Notice: Deaths  CORBIN, EDWIN I., M.D.",1997-09-16,article,Paid Death Notice,,[]
Grabbing TV Airwaves,1997-09-16,article,Letter,,"['Television', 'Regulation and Deregulation of Industry']"
Scientists Use Light To Create Particles,1997-09-16,article,News,,"['Light', 'Physics']"
The Winners of the 1997 Emmy Awards,1997-09-16,article,List,,"['Television', 'Emmy Awards', 'Awards, Decorations and Honors']"
Yankees Bail Out Wells With Some Timely Hits,1997-09-16,article,News,,['Baseball']
Private-Suite Concept Is Coming to Broadway,1997-09-16,article,News,,['Theater']
Excerpts From Weld Talk,1997-09-16,article,Text,,"['United States International Relations', 'UNITED STATES FOREIGN SERVICE']"
In Their Own Words,1997-09-16,article,Text,,"['Mayors', 'Television', 'Debating', 'Elections']"
Key Rates,1997-09-16,article,Statistics,,['KEY RATES (NYT COLUMN)']
"Paid Notice: Memorials  REID, DONALD DAVID",1997-09-16,article,Paid Death Notice,,[]
"Paid Notice: Deaths  MARTON, DR. HENNY T. (NEE SCHLESINGER)",1997-09-16,article,Paid Death Notice,,[]
"Paid Notice: Deaths  LAUTON, AMY VIVIAN",1997-09-16,article,Paid Death Notice,,[]
A Political Animal Trained Upon Victory,1997-09-16,article,Review,,"['Reviews', 'Theater']"
A Promise Is Kept: Mill Reopens,1997-09-16,article,News,,"['FIRES AND FIREMEN', 'Biographical Information', 'Textiles', 'FACTORIES AND INDUSTRIAL PLANTS']"
New Jersey Daily Briefing; Two More Arrests in Arson,1997-09-16,article,News,,"['FIRES AND FIREMEN', 'ARSON']"
Retirement Complexes Sold,1997-09-16,article,News,,"['Mergers, Acquisitions and Divestitures', 'RETIREMENT COMMUNITIES']"
"Paid Notice: Deaths  MILLER, HASBROUCK BAILEY",1997-09-16,article,Paid Death Notice,,[]
Dollar Falls Against the Mark On Hint of German Rate Rise,1997-09-16,article,News,,"['Currency', 'Interest Rates', 'Credit']"
Fund-Raising and Law,1997-09-16,article,Letter,,"['Editorials', 'Finances', 'Ethics', 'Elections', 'Presidential Election of 1996']"
Sappi in Deal to Create European Paper Giant,1997-09-16,article,News,,"['Mergers, Acquisitions and Divestitures', 'Paper and Pulp']"
HOCKEY: The N.H.L.'s Olympic Gamble; Stars' Participation in Nagano Could Raise Sport's Profile,1997-09-16,article,News,,"['Hockey, Ice', 'OLYMPIC GAMES (1998)']"
"Paid Notice: Deaths  TOBACK, DR. CHARLES",1997-09-16,article,Paid Death Notice,,[]
"Paid Notice: Deaths  DOLAN, SALLY (MRS. HARRY FRANCIS ROBY DOLAN, JR.)",1997-09-16,article,Paid Death Notice,,[]
"Paid Notice: Deaths  SIREFMAN, GUSSIE",1997-09-16,article,Paid Death Notice,,[]
2 Teamsters Trade Barbs As Feud Gets More Heated,1997-09-16,article,News,,"['Finances', 'Ethics', 'Elections', 'Presidential Election of 1996']"
Making Their Mark In the Record Book,1997-09-16,article,News,,"['Records and Achievements', 'Blacks', 'Black People', 'Track and Field']"
"Paid Notice: Deaths  BREGMAN, SAMUEL",1997-09-16,article,Paid Death Notice,,[]
"Paid Notice: Deaths  FRANK, JOAN H.",1997-09-16,article,Paid Death Notice,,[]
Party Lines Don't Define Debate: Clinton's Foes on Trade Bill Are Democrats,1997-09-16,article,News,,"['LABOR', 'International Trade and World Market', 'United States Economy', 'Law and Legislation']"
Observer; The Poor Get Poorer,1997-09-16,article,Op-Ed,,"['Tuition', 'Colleges and Universities']"
Latest Effort to Schedule New Auctions for Wireless Licenses Fails,1997-09-16,article,News,,"['LICENSES', 'Cellular Telephones', 'Auctions', 'Telephones and Telecommunications']"
Patterns,1997-09-16,article,News,,"['Biographical Information', 'APPAREL']"
Fine Those Who Deprive Workers of Sleep,1997-09-16,article,Letter,,"['Accidents and Safety', 'Trucks and Trucking', 'Roads and Traffic', 'Sleep']"
White House Denies Seeking I.R.S. Audit of Clinton Accuser,1997-09-16,article,News,,"['Taxation', 'Biographical Information', 'Suits and Litigation', 'Sexual Harassment']"
Accounts,1997-09-16,article,News,,['ACCOUNT CHANGES']
Prudent on Central Park,1997-09-16,article,Letter,,['Parks and Other Recreation Areas']
"After Game 1 Homer Barrage, Mets Manage Only a Split",1997-09-16,article,News,,['Baseball']
"At New Jersey Air Base, Day of Anxiety and Hope",1997-09-16,article,News,,"['Accidents and Safety', 'AIRLINES AND AIRPLANES', 'MCGUIRE AIR FORCE BASE (NJ)', 'Military Aircraft', 'C-141 AIRPLANE', 'UNITED STATES ARMAMENT AND DEFENSE']"
Law Seen Aiding City in Battle Over Illegal Home Conversions,1997-09-16,article,News,,"['Accidents and Safety', 'Housing', 'Law and Legislation']"
"Paid Notice: Deaths  NEWCOMB, ROBERT S.",1997-09-16,article,Paid Death Notice,,[]
Dresdner Official Under Investigation,1997-09-16,article,News,,"['Tax Evasion', 'Taxation', 'Income Tax']"
Eagles Let Upset Slip Through Fingers,1997-09-16,article,News,,['Football']
Ghost at China's Communist Banquet Recalls Tiananmen,1997-09-16,article,News,,"['Politics and Government', 'Biographical Information', 'Demonstrations and Riots', 'Freedom and Human Rights']"
"Rats Need Hugging, Too",1997-09-16,article,News,,"['Rats', 'Stress (Human)', 'BENZODIAZEPINES (DRUG)', 'GLUCCORTICOIDS (HORMONES)', 'Mental Health and Disorders', 'Research']"
New Jersey Daily Briefing; Gambling Earnings Are Up,1997-09-16,article,News,,"['Gambling', 'Casinos']"
"Paid Notice: Memorials  BARTH, PAMELA",1997-09-16,article,Paid Death Notice,,[]
Absentee Vote May Give Nomination to Messinger,1997-09-16,article,News,,"['Mayors', 'Biographical Information', 'Elections', 'Absentee Voting', 'PRIMARIES']"
Fund-Raising and Law,1997-09-16,article,Letter,,"['Finances', 'Biographical Information', 'Ethics', 'Elections', 'Presidential Election of 1996']"
"Medicare Overhaul Is Halted, Bogging Down in Complexity",1997-09-16,article,News,,"['Frauds and Swindling', 'COMPUTERS AND INFORMATION SYSTEMS', 'Medicare', 'Medicine and Health']"
"Paid Notice: Deaths  BURKE, JANIS WINFREY",1997-09-16,article,Paid Death Notice,,[]
Metro Business; A New York Bank To Stay in the Bronx,1997-09-16,article,News,,"['Relocation of Business', 'Taxation', 'Banks and Banking']"
Third Defense Line Found at Troy,1997-09-16,article,News,,['ARCHEOLOGY AND ANTHROPOLOGY']
"Paid Notice: Deaths  KAPLAN, MARY R.",1997-09-16,article,Paid Death Notice,,[]
Weld Ends Fight Over Nomination By Withdrawing,1997-09-16,article,News,,"['United States International Relations', 'United States Politics and Government', 'UNITED STATES FOREIGN SERVICE', 'Biographical Information']"
"Paid Notice: Deaths  SIMON, MAX",1997-09-16,article,Paid Death Notice,,[]
Bowness Pins Isle Hopes On Salo as No. 1 Goalie,1997-09-16,article,News,,"['Hockey, Ice']"
House Ready to Step In On Fund-Raising Cases,1997-09-16,article,News,,"['Finances', 'Ethics', 'Elections', 'Presidential Election of 1996']"
"Paid Notice: Deaths  RISSO, JOSEPHINE",1997-09-16,article,Paid Death Notice,,[]
"Woman From Russia Held As a Sex Slave, the Police Say",1997-09-16,article,News,,"['Sex Crimes', 'IMMIGRATION AND REFUGEES']"
State Office to Help Survivors Of Holocaust Recover Assets,1997-09-16,article,News,,['NAZI POLICIES TOWARD JEWS AND OTHER MINORITIES']
"Paid Notice: Deaths  MICHALOS, DAPHNE",1997-09-16,article,Paid Death Notice,,[]
NEWS SUMMARY,1997-09-16,article,Summary,,[]
STERLING ELECTRONICS STOCK RISES 13% ON MERGER TALKS,1997-09-16,article,News,,"['Mergers, Acquisitions and Divestitures']"
"Paid Notice: Deaths  HELLER, SALLY",1997-09-16,article,Paid Death Notice,,[]
Texas Law Professor Prompts A Furor Over Race Comments,1997-09-16,article,News,,"['Equal Educational Opportunities', 'Mexican-Americans', 'Blacks', 'Black People', 'Colleges and Universities', 'Teachers and School Employees']"
QUOTATION OF THE DAY,1997-09-16,article,News,,['QUOTATION OF THE DAY']
"Paid Notice: Deaths  HARAN, JACQUES F.",1997-09-16,article,Paid Death Notice,,[]
"Paid Notice: Deaths  EDELSTEIN, LOUIS",1997-09-16,article,Paid Death Notice,,[]
"Sports of The Times; Past the Hype, It Looks Like The Jets' Past",1997-09-16,article,News,,"['Coaches and Managers', 'Football']"
INSIDE,1997-09-16,article,Summary,,[]
Derailed Train Cuts Service At Penn Station,1997-09-16,article,News,,"['Accidents and Safety', 'Railroads', 'Pennsylvania Station (NYC)']"
"Paid Notice: Deaths  BURNS, MURIEL H.",1997-09-16,article,Paid Death Notice,,[]
Today: Later News and More Sections,1997-09-16,article,Editors' Note; Summary,,[]
Ex-Snapple Chief Takes South Beach Posts,1997-09-16,article,News,,"['Appointments and Executive Changes', 'Biographical Information']"
"A Pocketful of Dreams, and Bytes",1997-09-16,article,News,,"['COMPUTERS AND INFORMATION SYSTEMS', 'Reviews']"
"Paid Notice: Deaths  LOOKSTEIN, GERTRUDE",1997-09-16,article,Paid Death Notice,,[]
Adieu to William Weld,1997-09-16,article,Editorial,,"['United States International Relations', 'United States Politics and Government', 'UNITED STATES FOREIGN SERVICE', 'Editorials', 'Biographical Information']"
Gilmore in the Lead,1997-09-16,article,News,,[]
CHRONICLE,1997-09-16,article,News,,['Freedom and Human Rights']
"Breaking the Rules, Again",1997-09-16,article,News,,"['Biographical Information', 'APPAREL']"
"His Cancer in Remission, Hamilton Is Back on Ice",1997-09-16,article,News,,"['Ice Skating', 'Figure Skating']"
Transactions,1997-09-16,article,List,,[]
Norway Chief Steps Down As Votes Fall Short of Goal,1997-09-16,article,News,,"['Politics and Government', 'Biographical Information', 'Elections']"
BUSINESS DIGEST,1997-09-16,article,Summary,,[]
Winnie Mandela Joins the Race for South Africa's No. 2 Spot,1997-09-16,article,News,,"['Assassinations and Attempted Assassinations', 'Politics and Government', 'Biographical Information', 'Elections']"
The Met Is Delighted by New Russian Link,1997-09-16,article,News,,"['Appointments and Executive Changes', 'Finances', 'Opera']"
"Sheik Abdullah al-Tariki, 80, First Saudi Arabian Oil Minister",1997-09-16,article,Obituary; Biography,,"['Biographical Information', 'Deaths (Obituaries)']"
"Paid Notice: Deaths  MADONICK, LEON",1997-09-16,article,Paid Death Notice,,[]
"In New York City Elections, the Precise Tallies Take Time",1997-09-16,article,News,,"['Voting Machines', 'Mayors', 'Elections', 'Absentee Voting']"
Two Saudi Banks Merge,1997-09-16,article,News,,"['Names, Organizational', 'Mergers, Acquisitions and Divestitures', 'Banks and Banking']"
Networks Grumbling Over Emmys for Cable,1997-09-16,article,News,,"['Television', 'Emmy Awards', 'TELEVISION AND RADIO PROGRAMMING', 'Awards, Decorations and Honors']"
Like a Baby Streisand All Grown Up,1997-09-16,article,Review,,"['Music', 'Reviews']"
"Paid Notice: Deaths  ARNOLD, ALLAN C.",1997-09-16,article,Paid Death Notice,,[]
Margo Rose Dies at 94; Helped Design 'Howdy Doody',1997-09-16,article,Obituary; Biography,,"['Biographical Information', 'Deaths (Obituaries)']"
Dismissed Mail Carrier Is Shunning News Media,1997-09-16,article,News,,['Postal Service']
