headline,date,doc_type,material_type,section,keywords
"In Canada, Final Shot Is Sweet For Jones",1997-09-08,article,News,,"['BELL CANADIAN OPEN (GOLF)', 'Golf']"
"Our Celebrities, Ourselves",1997-09-08,article,Op-Ed,,"['Celebrities', 'Biographical Information', 'News and News Media']"
The Long-Term Low Profile Behind the Buzz at Glamour,1997-09-08,article,Biography,,"['COMPANY AND ORGANIZATION PROFILES', 'Biographical Information']"
"Paid Notice: Deaths  MAZUR, FRANK",1997-09-08,article,Paid Death Notice,,[]
"Paid Notice: Deaths  CHECKNOFF, RUTH (NEE ROSENBERG)",1997-09-08,article,Paid Death Notice,,[]
Reversal: Rogers Is Hero While Torre Hears Boos,1997-09-08,article,News,,['Baseball']
A Fine Day for Royal Indy and Jerkens,1997-09-08,article,News,,"['Horse Racing', 'GAZELLE HANDICAP']"
"Paid Notice: Deaths  EPSTEIN, EDITH",1997-09-08,article,Paid Death Notice,,[]
"Business is up, yet on-line services have image problems.",1997-09-08,article,News,,"['COMPUTERS AND INFORMATION SYSTEMS', 'PUBLIC OPINION']"
Retail Customers To Get Intel's New Chips First,1997-09-08,article,News,,"['Computer Chips', 'COMPUTERS AND INFORMATION SYSTEMS']"
"Paid Notice: Deaths  WATKINS, THOMAS T.",1997-09-08,article,Paid Death Notice,,[]
Saturn Mission's Use of Plutonium Fuel Provokes Warnings of Danger,1997-09-08,article,News,,"['Accidents and Safety', 'Plutonium', 'Saturn (Planet)', 'Space', 'Radiation', 'Biographical Information', 'Cancer', 'Cassini (Spacecraft)']"
Many Tenants Are Struggling To Pay Rent,1997-09-08,article,News,,"['Housing', 'Renting and Leasing']"
"Leon Edel, 89, Prize-Winning Biographer of Henry James, Dies",1997-09-08,article,Obituary; Biography,,"['Books and Literature', 'Biographical Information', 'Deaths (Obituaries)']"
"Paid Notice: Deaths  GLUCROFT, HANNAH",1997-09-08,article,Paid Death Notice,,[]
"Accused Officers Barred From Duty, but With Pay",1997-09-08,article,News,,"['Police Brutality and Misconduct', 'Suspensions, Dismissals and Resignations', 'Sex Crimes', 'Police', 'Haitian-Americans', 'Torture']"
New York's Darkened Courts,1997-09-08,article,Editorial,,"['Courts', 'Television', 'Editorials', 'Law and Legislation', 'News and News Media']"
"Paid Notice: Deaths  CROCOLL, EDWIN JOHN, SR.",1997-09-08,article,Paid Death Notice,,[]
"Mobutu Sese Seko, Zairian Ruler, Is Dead in Exile in Morocco at 66",1997-09-08,article,Obituary; Biography,,"['Politics and Government', 'Biographical Information', 'Civil War and Guerrilla Warfare', 'Deaths (Obituaries)']"
This City Won't Need Another Party for 850 Years,1997-09-08,article,News,,['Fireworks']
Teachers Prepare to Strike,1997-09-08,article,News,,"['LABOR', 'Wages and Salaries', 'Education and Schools', 'Strikes', 'Teachers and School Employees']"
Battalions of Cleaning Crews Descend on Subway Stations To Fight Battle of the Gunk,1997-09-08,article,News,,"['Subways', 'Chewing Gum', 'Transit Systems', 'Stations and Terminals (Passenger)']"
People,1997-09-08,article,News,,['Appointments and Executive Changes']
Veteran Links Prison Camp Terror to Slaying,1997-09-08,article,News,,"['Murders and Attempted Murders', 'Prisoners of War', 'Mental Health and Disorders', 'Post-Traumatic Stress Disorder', 'World War II (1939-45)']"
Flower Power,1997-09-08,article,An Analysis; News Analysis,,"['Royal Family', 'Biographical Information']"
"Good Exercise, Nice People and a Fast Lesson in Architecture",1997-09-08,article,News,,"['Running', 'ARCHITECTURE']"
"Paid Notice: Deaths  RIFKIN, MITCHELL",1997-09-08,article,Paid Death Notice,,[]
Some large clients including Mastercard and Aamco settle on agencies for their accounts.,1997-09-08,article,News,,"['ADVERTISING', 'ACCOUNT CHANGES']"
Hollywood Exotica With Electronic Blips,1997-09-08,article,News,,"['Music', 'Reviews', 'CMJ Music Marathon']"
INSIDE,1997-09-08,article,Summary,,[]
"Paid Notice: Deaths  FITZGERALD, WALKER S. SGT. NYPD",1997-09-08,article,Paid Death Notice,,[]
White House Said to Specify 3 Demands in Tobacco Deal,1997-09-08,article,News,,"['Taxation', 'Children and Youth', 'Nicotine', 'Smoking and Tobacco', 'Regulation and Deregulation of Industry', 'Liability for Products']"
"The Learning Curve Effect, Both at Home and on the Road",1997-09-08,article,News,,['Football']
"Paid Notice: Deaths  KREMNITZER, ERNEST G.",1997-09-08,article,Paid Death Notice,,[]
"Paid Notice: Deaths  COHEN, WOLFE",1997-09-08,article,Paid Death Notice,,[]
Economic Calendar,1997-09-08,article,Schedule,,[]
In Their Own Words,1997-09-08,article,Text,,"['Mayors', 'Elections']"
"Calls Via the Internet, But in Low Fidelity",1997-09-08,article,News,,"['COMPUTERS AND INFORMATION SYSTEMS', 'INTERNET AND WORLD WIDE WEB', 'Prices (Fares, Fees and Rates)', 'Telephones and Telecommunications']"
"In Primary Debate Slugfest, Democrats Slug Only Giuliani",1997-09-08,article,News,,"['Mayors', 'Television', 'Debating', 'Elections']"
Chronicle,1997-09-08,article,News,,[]
Hingis Quickly Defeats Williams for a 3d Title,1997-09-08,article,News,,"['Tennis', 'United States Open (Tennis)']"
Race Track Plan Protested,1997-09-08,article,News,,['Automobile Racing']
"Driver Is Sought Who May Have Tried to Slow Diana's Car Before Crash, Lawyers Say",1997-09-08,article,News,,"['Roads and Traffic', 'Royal Family', 'NEWS PHOTOGRAPHY', 'Biographical Information', 'News and News Media']"
Enemies Share a Goal,1997-09-08,article,Letter,,"['Palestinians', 'Bombs and Explosives', 'Terrorism']"
Don't Blame Netanyahu,1997-09-08,article,Letter,,"['Palestinians', 'Bombs and Explosives', 'Terrorism']"
"Paid Notice: Deaths  STERN, HILDA",1997-09-08,article,Paid Death Notice,,[]
"Paid Notice: Memorials  TONDEL, LYMAN M. JR.",1997-09-08,article,Paid Death Notice,,[]
Giants Take Step in Wrong Direction,1997-09-08,article,News,,['Football']
Contemporary Styles for Flamenco's Ancient Passion,1997-09-08,article,Review,,"['Music', 'Reviews']"
"To Palestinians Without Hope, Peace Is a Mirage",1997-09-08,article,Letter,,"['Palestinians', 'Bombs and Explosives', 'Terrorism']"
"For Some Football Fans, A Web Link Is a Must",1997-09-08,article,News,,"['COMPUTERS AND INFORMATION SYSTEMS', 'INTERNET AND WORLD WIDE WEB', 'Football']"
"Paid Notice: Deaths  GONZALEZ, BROOKE EMMENS",1997-09-08,article,Paid Death Notice,,[]
"At 37 Kiosks, City Hall at Your Fingertips",1997-09-09,article,News,,"['Fines (Penalties)', 'COMPUTERS AND INFORMATION SYSTEMS', 'CREDIT CARDS AND ACCOUNTS', 'Parking', 'Taxation', 'INTERNET AND WORLD WIDE WEB', 'Property Taxes']"
The Toe Squeeze,1997-09-09,article,News,,['Shoes and Boots']
Q&A,1997-09-09,article,Question,,['Peanut Butter']
Millions of Dollars Pouring In To Diana's Favorite Charities,1997-09-09,article,News,,"['Philanthropy', 'Hospitals']"
Corrections,1997-09-09,article,Correction,,"['Education and Schools', 'Correction Stories']"
HARCOURT TO BUY 18% OF STECK-VAUGHN FOR $42.8 MILLION,1997-09-09,article,News,,"['Mergers, Acquisitions and Divestitures']"
Jets' Loss Simply Put: They Were Outclassed,1997-09-09,article,News,,['Football']
"Just Bidness, Charlie",1997-09-09,article,Op-Ed,,['Athletics and Sports']
Hong Kong's Leader Heads for U.S. to Correct 'Misconceptions',1997-09-09,article,News,,"['HONG KONG-INTERNATIONAL RELATIONS-US', 'United States International Relations', 'Politics and Government', 'Demonstrations and Riots', 'Freedom and Human Rights']"
"Derek Taylor, Beatles' Spokesman, Dies at 65",1997-09-09,article,Obituary; Biography,,"['Biographical Information', 'Deaths (Obituaries)']"
Warming Could Bring Some Cold Surprises,1997-09-09,article,News,,"['Carbon Dioxide', 'Weather', 'Oceans', 'Greenhouse Effect', 'Air Pollution', 'Fish and Other Marine Life']"
"Paid Notice: Deaths  JACOBS, JERRY C., M.D.",1997-09-09,article,Paid Death Notice,,[]
"Paid Notice: Deaths  CROCOLL, EDWIN JOHN, SR.",1997-09-09,article,Paid Death Notice,,[]
"Paid Notice: Deaths  MATTHEWS, MARY B.",1997-09-09,article,Paid Death Notice,,[]
Corrections,1997-09-09,article,Correction,,"['Mayors', 'Correction Stories', 'Elections']"
Guard Is Charged in Fire,1997-09-09,article,News,,"['FIRES AND FIREMEN', 'ARSON']"
$2.2 Billion Bailout For South Korean Banks,1997-09-09,article,News,,"['Finances', 'Banks and Banking']"
Disputed commercial wins a TV award as quarrel is resolved.,1997-09-09,article,News,,"['ADVERTISING', 'Television', 'Emmy Awards']"
Fashion's Affair With the Paparazzi,1997-09-09,article,News,,"['Reviews', 'NEWS PHOTOGRAPHY', 'Photography', 'APPAREL', 'News and News Media']"
"After Mets Lose Duel, The Bottom Falls Out",1997-09-09,article,News,,['Baseball']
CSX and Others Ordered to Pay Billions in '87 Rail Chemical Fire,1997-09-09,article,News,,"['FIRES AND FIREMEN', 'Chemicals', 'Suits and Litigation', 'Decisions and Verdicts']"
Pilot Regents Math Test: So Tough That Few Pass It,1997-09-09,article,News,,"['Mathematics', 'Education and Schools', 'Tests and Testing']"
New Allegations of Abuse For Officer in Torture Case,1997-09-09,article,News,,"['Police Brutality and Misconduct', 'DISORDERLY CONDUCT', 'Blacks', 'Black People', 'Suits and Litigation', 'SUITS AND CLAIMS AGAINST GOVERNMENT', 'Police', 'Haitian-Americans', 'Torture']"
Haitians in Brooklyn Turn To the Radio for Comfort,1997-09-09,article,News,,"['Accidents and Safety', 'Ferries', 'Radio', 'Haitian-Americans', 'Telephones and Telecommunications']"
"For Many Women, Gazing at Diana Was Gazing Within",1997-09-09,article,News,,[]
It's Push Comes to Penalty For Giants,1997-09-09,article,News,,['Football']
"For Queens, Tennis Center Is an Intrusion",1997-09-09,article,Letter,,"['ARTHUR ASHE STADIUM (NYC)', 'Tennis']"
The Surplus Gun Invasion,1997-09-09,article,Editorial,,"['International Trade and World Market', 'Editorials', 'Law and Legislation', 'Firearms']"
Senior Republicans Stop Bloc Trying to Soften Budget Deal,1997-09-09,article,News,,"['Finances', 'Law and Legislation', 'Budgets and Budgeting']"
QUOTATION OF THE DAY,1997-09-09,article,News,,['QUOTATION OF THE DAY']
"Paid Notice: Deaths  MAYBERGER, BERNARD",1997-09-09,article,Paid Death Notice,,[]
Not-So-Dangerous Drugs,1997-09-09,article,Letter,,"['Cancer', 'PHENOLPHTHALEIN (DRUG)', 'Laxatives']"
Bond Prices Rise a Bit After Last Week's Selloff,1997-09-09,article,News,,"['Finances', 'Government Bonds']"
"Yearning for Southern California, 1965",1997-09-09,article,Review,,"['Music', 'Reviews']"
INSIDE METRO,1997-09-09,article,Summary,,[]
"Paid Notice: Deaths  WERBER, ANNE M. (NEE SULLIVAN)",1997-09-09,article,Paid Death Notice,,[]
"Paid Notice: Deaths  GONZALEZ, BROOKE EMMENS",1997-09-09,article,Paid Death Notice,,[]
"Paid Notice: Deaths  KOLB, LIBBY",1997-09-09,article,Paid Death Notice,,[]
"In Salmon War, a New Broadside as British Columbia Sues the U.S.",1997-09-09,article,News,,"['Salmon', 'SUITS AND CLAIMS AGAINST GOVERNMENT', 'Fishing, Commercial', 'Fish and Other Marine Life']"
2 High News Posts Filled by The Times,1997-09-09,article,News,,['Appointments and Executive Changes']
Two Lawyers For Paula Jones Want to Withdraw from Case,1997-09-09,article,News,,"['Suits and Litigation', 'Sexual Harassment']"
"Paid Notice: Deaths  MARGOLIS, LAURA",1997-09-09,article,Paid Death Notice,,[]
More Than 300 Feared Lost on Haiti Ferry,1997-09-09,article,News,,"['Accidents and Safety', 'Rescues', 'Ferries']"
"At 18, the 'Squirt TV' Guy Resumes His Pop-Scene Assault",1997-09-09,article,Biography,,"['Music', 'Radio']"
"Paid Notice: Deaths  PHONE, MARTIN",1997-09-09,article,Paid Death Notice,,[]
In Their Own Words,1997-09-09,article,Text,,"['Mayors', 'Elections']"
"Paid Notice: Deaths  STUDNER, FAY B. KUHN",1997-09-09,article,Paid Death Notice,,[]
CABOT OIL TO SELL RESERVES TO LOMAK FOR $92.5 MILLION,1997-09-09,article,News,,"['Mergers, Acquisitions and Divestitures', 'Oil (Petroleum) and Gasoline']"
NEWS SUMMARY,1997-09-09,article,Summary,,[]
RESULTS PLUS,1997-09-09,article,News,,[]
Pitfalls of a Triple-Threat Machine,1997-09-09,article,News,,"['COMPUTERS AND INFORMATION SYSTEMS', 'Computer Printers', 'FACSIMILE SYSTEMS', 'Office Equipment', 'Scanning Devices']"
"Paid Notice: Deaths  SOLTI, GEORG",1997-09-09,article,Paid Death Notice,,[]
"Paid Notice: Deaths  NAFTALIN, RUTH YOFFEY",1997-09-09,article,Paid Death Notice,,[]
Chess,1997-09-09,article,News,,['Chess']
"Paid Notice: Deaths  SLATER, FLORENCE",1997-09-09,article,Paid Death Notice,,[]
New York's Highest Court Observes Its 150th Year,1997-09-09,article,News,,['Courts']
"In Sermon And in Silence, Mother Teresa Is Celebrated",1997-09-09,article,News,,"[""ST PATRICK'S CATHEDRAL (NYC)""]"
"Winning Literary Acclaim, A Voice of Central Europe",1997-09-09,article,Biography,,['Books and Literature']
Experts on Climate Change Pondering: How Urgent Is It?,1997-09-09,article,News,,"['Carbon Dioxide', 'Weather', 'Forecasts', 'Greenhouse Effect', 'Air Pollution']"
CHRONICLE,1997-09-09,article,News,,['News and News Media']
Teams Duel in Nevada Desert Over Land Speed Record,1997-09-09,article,News,,"['Records and Achievements', 'JET ENGINES AND JET PROPULSION', 'Automobile Racing']"
Teacher Is Charged With 3 More Assaults,1997-09-09,article,News,,"['Foster Care', 'Sex Crimes', 'Children and Youth']"
"For Asia, Austerity and Exports",1997-09-09,article,An Analysis; News Analysis,,"['International Trade and World Market', 'Currency', 'Economic Conditions and Trends']"
Talking About the Country Club,1997-09-09,article,News,,"['Blacks', 'Black People', 'Discrimination', 'Tennis']"
College Life vs. My Moral Code,1997-09-09,article,Op-Ed,,"['Colleges and Universities', 'Sex', 'Ethics', 'JEWS']"
"Paid Notice: Deaths  GROSSMAN, FLORENCE",1997-09-09,article,Paid Death Notice,,[]
"Paid Notice: Deaths  ROTHENBERG, WERNER WILLIAM",1997-09-09,article,Paid Death Notice,,[]
Fox in Deal With New Regency Productions,1997-09-09,article,News,,['MOTION PICTURES']
Grammys Stay In New York,1997-09-09,article,News,,"['Music', 'Grammy Awards']"
"John Esposito, 69, Ex-Legislator And Koch Challenger in 1981",1997-09-09,article,Obituary; Biography,,"['Biographical Information', 'Deaths (Obituaries)']"
"Strong-Arming, Profit and Fine Food",1997-09-09,article,News,,"['Organized Crime', 'Prices (Fares, Fees and Rates)', 'Fishing, Commercial', 'Clams', 'GEODUCKS (CLAMS)', 'Fish and Other Marine Life']"
CANADIAN OIL COMPANIES TO MERGE IN $209 MILLION DEAL,1997-09-09,article,News,,"['Mergers, Acquisitions and Divestitures', 'Oil (Petroleum) and Gasoline']"
"For Selig, the Interim Is 5 Years and Longer",1997-09-09,article,News,,"['Baseball', 'SPORTS COMMISSIONERS']"
Ramos Will Remember His Return to U.S. Team,1997-09-09,article,News,,"['World Cup (Soccer)', 'Soccer']"
America Online to Maintain 2 Services,1997-09-09,article,News,,"['COMPUTERS AND INFORMATION SYSTEMS', 'Mergers, Acquisitions and Divestitures', 'INTERNET AND WORLD WIDE WEB']"
"Paid Notice: Deaths  AVRETT, JACK",1997-09-09,article,Paid Death Notice,,[]
Thomas Helps Eagles Rediscover Defense,1997-09-09,article,News,,['Football']
A Good Deal for Central Park,1997-09-09,article,Editorial,,"['Editorials', 'Parks and Other Recreation Areas']"
"Paid Notice: Deaths  KANTER, ADELE",1997-09-09,article,Paid Death Notice,,[]
Rail Strike Has San Francisco Commuters Creeping Along Alternative Routes,1997-09-09,article,News,,"['LABOR', 'Wages and Salaries', 'Roads and Traffic', 'Transit Systems', 'Strikes']"
"IN PRIMARY TODAY, DEMOCRATS SELECT GIULIANI OPPONENT",1997-09-09,article,News,,"['Mayors', 'Elections']"
"With Retirement in Sight Again, a Business Empire Awaits",1997-09-09,article,Biography,,['Basketball']
Clinton to Rekindle Old Debate on Trade,1997-09-09,article,Summary,,[]
The Health Page,1997-09-09,article,Schedule,,[]
Politicking on the Links,1997-09-09,article,Letter,,"['Finances', 'Ethics', 'Elections', 'Presidential Election of 1996', 'Buddhism']"
German Buyer Seeking 43% Stake in Grundig,1997-09-09,article,News,,"['Mergers, Acquisitions and Divestitures']"
"Drugs Common in Schools, Survey Shows",1997-09-09,article,News,,"['PUBLIC OPINION', 'Education and Schools', 'Children and Youth', 'Drug Abuse and Traffic']"
ZELL PAYS $300 MILLION FOR 38 HOME PARKS,1997-09-09,article,News,,"['Mergers, Acquisitions and Divestitures', 'MOBILE HOMES', 'Housing']"
New York City Primary Choices,1997-09-09,article,Editorial,,"['Editorials', 'Endorsements', 'Elections']"
Catholic Bishop Is Ordained,1997-09-09,article,News,,[]
Art and Friendship Were Discarded; Art Alone Survived,1997-09-09,article,News,,['Art']
"Paid Notice: Deaths  STRAUS, MARJORIE LEWENGOOD",1997-09-09,article,Paid Death Notice,,[]
A Young Man's Success,1997-09-09,article,Letter,,"['Bilingual Education', 'Education and Schools']"
Stocks Higher in Tokyo,1997-09-09,article,News,,"['Stocks and Bonds', 'Nikkei Stock Average']"
Motorola and I.B.M. Look Beyond Chip Pact With Apple,1997-09-09,article,News,,"['Computer Chips', 'COMPUTERS AND INFORMATION SYSTEMS', 'Electronics']"
I.B.M. Dropping Plans for a Simplified PC,1997-09-09,article,News,,['COMPUTERS AND INFORMATION SYSTEMS']
"Elton John's Revised 'Candle,' For a Princess and Charity",1997-09-09,article,News,,"['RECORDINGS (AUDIO)', 'Music', 'RECORDINGS (VIDEO)', 'Television']"
Open Mixed History With the Unexpected,1997-09-09,article,News,,"['Tennis', 'United States Open (Tennis)']"
Corrections,1997-09-09,article,Correction,,"['Taxation', 'Finances', 'Federal Taxes (US)', 'Law and Legislation', 'Correction Stories', 'Budgets and Budgeting']"
TRANSACTIONS,1997-09-09,article,List,,[]
"Paid Notice: Deaths  KAHN, MALCOLM ''BUD''",1997-09-09,article,Paid Death Notice,,[]
"In Germany, Humble Herb Is a Rival to Prozac",1997-09-09,article,News,,"['Herbs', 'Drugs (Pharmaceuticals)', ""ST JOHN'S WORT (HERB)"", 'Mental Health and Disorders', 'ANTIDEPRESSANTS', 'Prozac (Drug)', 'Depression (Mental)']"
MetroStars in Crucial Game,1997-09-09,article,News,,['Soccer']
"For Now, Survivor Is Unable To Speak With Investigators",1997-09-09,article,News,,"['Accidents and Safety', 'Roads and Traffic']"
Another Spacecraft Nears Mars For Orbiting Survey of Planet,1997-09-09,article,News,,"['Mars (Planet)', 'MARS GLOBAL SURVEYOR', 'Life, Extraterrestrial', 'Space', 'SOJOURNER (ROBOT)', 'PATHFINDER (SPACECRAFT)', 'Maps']"
Dormant Fire Hydrants Fading Into City History,1997-09-09,article,News,,"['FIRE HYDRANTS', 'FIRES AND FIREMEN']"
"Paid Notice: Deaths  ALFANDRE, JULIAN E.",1997-09-09,article,Paid Death Notice,,[]
California Is Big Enough,1997-09-09,article,Letter,,['Economic Conditions and Trends']
Key Rates,1997-09-09,article,Statistics,,['KEY RATES (NYT COLUMN)']
CHRONICLE,1997-09-09,article,News,,"['Watches and Clocks', 'Nudism and Nudity', 'Biographical Information']"
"Paid Notice: Deaths  BLOOMBERG, GEORGINE",1997-09-09,article,Paid Death Notice,,[]
"Paid Notice: Deaths  FAYTELL, FANNIE",1997-09-09,article,Paid Death Notice,,[]
"The Fallen Commissars of 1918, Now Fallen Idols",1997-09-09,article,News,,['Monuments and Memorials']
INSIDE,1997-09-09,article,Summary,,[]
Wash That Mustache!,1997-09-09,article,News,,"['MUSTACHES', 'Pollen', 'ALLERGIES']"
Private Investors to Be Offered 20% of Stock : A Slice of France Telecom,1997-09-09,article,News,,[]
"Super Bowl III Revisited, on ESPN",1997-09-09,article,News,,"['Super Bowl', 'Football']"
Chess,1997-09-09,article,News,,['Chess']
"Paid Notice: Deaths  PAUL, SAMUEL J. JR.",1997-09-09,article,Paid Death Notice,,[]
"Police Charge a Queens Man With Killing His Wife, Son and Sister-in-Law",1997-09-09,article,News,,['Murders and Attempted Murders']
"Paid Notice: Deaths  LI, K.C.",1997-09-09,article,Paid Death Notice,,[]
Celtics Reach Deals With Top Picks,1997-09-09,article,News,,['Basketball']
The Half-Century War,1997-09-09,article,Op-Ed,,"['Palestinians', 'Finances', 'Terrorism']"
Judge Hospitalized With Stroke,1997-09-09,article,News,,"['Courts', 'Radio', 'Suits and Litigation', 'Libel and Slander']"
A Teacher's Poem,1997-09-09,article,Op-Ed,,"['Education and Schools', 'Teachers and School Employees']"
Campbell Soup Expected to Announce Spinoff,1997-09-09,article,News,,"['Mergers, Acquisitions and Divestitures', 'Company Reports']"
"Paid Notice: Deaths  MENOWITZ, NINA POWELL",1997-09-09,article,Paid Death Notice,,[]
Bilingual Education Keeps Students in School,1997-09-09,article,Letter,,"['Bilingual Education', 'Education and Schools']"
"Paid Notice: Deaths  BING, RUDOLF",1997-09-09,article,Paid Death Notice,,[]
Reader's Digest Chief Hires Ex-Executives,1997-09-09,article,News,,"['Suspensions, Dismissals and Resignations', 'Appointments and Executive Changes', 'Biographical Information']"
Why Did Mommy Leave? Imagining the Reasons,1997-09-09,article,Review,,['Books and Literature']
"Paid Notice: Deaths  YASSER, MAC",1997-09-09,article,Paid Death Notice,,[]
We Strive to Be Insular,1997-09-09,article,Letter,,"['Bilingual Education', 'Education and Schools']"
"Paid Notice: Deaths  STAFF, SONYA",1997-09-09,article,Paid Death Notice,,[]
"Paid Notice: Deaths  ESPOSITO, JOHN A.",1997-09-09,article,Paid Death Notice,,[]
Report Says Judge in Domestic-Violence Cases Abused Power,1997-09-09,article,News,,"['Courts', 'Domestic Violence']"
A Minimalist Approach With Maximum Results,1997-09-09,article,Review,,"['Music', 'Reviews', 'CMJ FESTIVAL']"
"Paid Notice: Deaths  WEICHSEL, DORIS (NEE CAAN)",1997-09-09,article,Paid Death Notice,,[]
"Paid Notice: Deaths  SLATTERY, LELA HENDRY",1997-09-09,article,Paid Death Notice,,[]
Midtown Tower to Be Sold,1997-09-09,article,News,,"['Mergers, Acquisitions and Divestitures', 'OFFICE BUILDINGS']"
Isles and Rangers Settle With Key Players,1997-09-09,article,News,,"['Hockey, Ice']"
PRICE MUTUAL FUND ACQUIRES A 5.6% STAKE IN PENNZOIL,1997-09-09,article,News,,"['Mergers, Acquisitions and Divestitures', 'Oil (Petroleum) and Gasoline']"
"Paid Notice: Deaths  MARCH, MYRNA",1997-09-09,article,Paid Death Notice,,[]
"Paid Notice: Deaths  BLAIR, FREDERIC ROBERTS",1997-09-09,article,Paid Death Notice,,[]
"Paid Notice: Deaths  GOLD, MIRIAM",1997-09-09,article,Paid Death Notice,,[]
"Paid Notice: Deaths  ROSAHN, SONYA",1997-09-09,article,Paid Death Notice,,[]
Airport Kickback Sentencing,1997-09-09,article,News,,"['AIRLINES AND AIRPLANES', 'AIRPORTS', 'NEWARK INTERNATIONAL AIRPORT (NJ)', 'Sentences (Criminal)', 'Extortion and Blackmail', 'Bribery']"
Tribes' New Power Over Welfare May Come at Too High a Price,1997-09-09,article,News,,"['WORKFARE AND EMPLOYMENT OF WELFARE RECIPIENTS', 'Indians, American', 'Welfare (US)', 'Federal Aid (US)']"
France to Sell Large Stake In Telecom,1997-09-09,article,News,,"['Privatization', 'Telephones and Telecommunications']"
First Gene for Social Behavior Identified in Whiskery Mice,1997-09-09,article,News,,"['Autism', 'Schizophrenia', 'Mammals', 'Genetics and Heredity', 'Psychology and Psychologists', 'Mental Health and Disorders', 'Mice']"
"For Queens, Tennis Center Is an Intrusion",1997-09-09,article,Letter,,['PORT AUTHORITY BUS TERMINAL (MANHATTAN)']
"Paid Notice: Deaths  SCHRAM, JOHN M.",1997-09-09,article,Paid Death Notice,,[]
Ms. Albright's Daunting Agenda,1997-09-09,article,Editorial,,"['United States International Relations', 'Palestinians', 'Editorials', 'Terrorism']"
Staten Island Ferry Delays,1997-09-09,article,News,,"['Ferries', 'STATEN ISLAND FERRY']"
Team Effort Aimed At P.& G. Duties,1997-09-09,article,News,,"['ADVERTISING', 'Television']"
"Paid Notice: Deaths  CHARNAY, LEONARD",1997-09-09,article,Paid Death Notice,,[]
Neck Injury Sidelines Giants' Hilliard,1997-09-09,article,News,,['Football']
U.S. Gives Up on Plea Bargaining With Saudi in Bombing Case,1997-09-09,article,News,,"['Bombs and Explosives', 'AIR FORCES', 'Terrorism', 'UNITED STATES ARMAMENT AND DEFENSE']"
Economics Are a Factor,1997-09-09,article,Letter,,"['Bilingual Education', 'Education and Schools']"
"Paid Notice: Deaths  CHERKASKY, MARTIN, MD.",1997-09-09,article,Paid Death Notice,,[]
Driver Checks Are Challenged,1997-09-09,article,News,,"['COMPUTERS AND INFORMATION SYSTEMS', 'Roads and Traffic']"
Following Up on the Disabilities Law,1997-09-09,article,Review,,['Television']
"Paid Notice: Deaths  REINFELD, AL",1997-09-09,article,Paid Death Notice,,[]
A Powerful Odor,1997-09-09,article,News,,"['Cockroaches', 'Odors']"
"Paid Notice: Deaths  STEINMAN, LEWIS",1997-09-09,article,Paid Death Notice,,[]
"Paid Notice: Deaths  GRUNEBAUM, EDWARD J.",1997-09-09,article,Paid Death Notice,,[]
Accounts,1997-09-09,article,News,,['ACCOUNT CHANGES']
"Student Held 30 Hostage At School, Police Say",1997-09-09,article,News,,"['Hostages', 'Education and Schools']"
EASTERN COLLEGE REPORT,1997-09-09,article,News,,['Football']
Netanyahu's Hard Line Faces Rising Israeli Dissent,1997-09-09,article,News,,"['Palestinians', 'Bombs and Explosives', 'Terrorism']"
"Paid Notice: Deaths  DISTEFANO, ROSA",1997-09-09,article,Paid Death Notice,,[]
Cone to Test His Shoulder In Drill Today,1997-09-09,article,News,,['Baseball']
Trimming Role of Lawyers in Fairfield Real Estate,1997-09-09,article,News,,"['Housing', 'Legal Profession']"
Sunbeam Sues the A.M.A. On Voided Marketing Deal,1997-09-09,article,News,,"['ADVERTISING', 'Endorsements', 'Suits and Litigation', 'Medicine and Health']"
"Paid Notice: Deaths  REISS, MARGARETTE",1997-09-09,article,Paid Death Notice,,[]
Small-Company Stocks Continue to Gain,1997-09-09,article,News,,"[""STANDARD & POOR'S STOCK INDEX"", 'Nasdaq Composite Index', 'Stocks and Bonds', 'Dow Jones Stock Average']"
Patterns,1997-09-09,article,News,,"['Men', 'APPAREL']"
New Viral Dangers,1997-09-09,article,Letter,,"['Acquired Immune Deficiency Syndrome', 'Genetic Engineering']"
"Paid Notice: Memorials  CAMHI, SONYA",1997-09-09,article,Paid Death Notice,,[]
AVANT TO BUY TECHNOLOGY MODELING FOR $150 MILLION,1997-09-09,article,News,,"['Computer Chips', 'COMPUTERS AND INFORMATION SYSTEMS', 'Mergers, Acquisitions and Divestitures']"
Daewoo Denies Talk Of Italian Investment,1997-09-09,article,News,,"['Mergers, Acquisitions and Divestitures', 'Electric Light and Power']"
Steinbrenner Warns Orioles,1997-09-09,article,News,,"['Baseball', 'Playoff Games']"
