headline,date,doc_type,material_type,section,keywords
Sports of The Times; Valentine Just Needs To Manage Himself,1999-10-17,article,News,,"['Baseball', 'Playoff Games', 'Biographical Information']"
Uncertainty After Death Of a Landlord,1999-10-17,article,News,,[]
American Funds Aims To Allow New Share Class,1999-10-17,article,News,,[]
VIEW; Va-Va-Va-Voom: Learning From Marilyn,1999-10-17,article,News,,"['Auctions', 'Biographical Information']"
"October 10-16; No Pain, Plenty of Gain",1999-10-17,article,News,,[]
Error-Prone Hofstra Gives Away Unbeaten Status,1999-10-17,article,News,,"['College Athletics', 'Football']"
"Paid Notice: Deaths  FREID, MARVIN G.",1999-10-17,article,Paid Death Notice,,[]
"Paid Notice: Deaths  KAVON, PAUL, CANTOR",1999-10-17,article,Paid Death Notice,,[]
The Piano Man Sings For Baron Shareholders,1999-10-17,article,News,,[]
The Other Executive's Philanthropy,1999-10-17,article,News,,[]
A Funkmaster Comes Home,1999-10-17,article,News,,[]
CYBERSCOUT,1999-10-17,article,News,,[]
"Hilary Shaw, Peter Houldin",1999-10-17,article,News,,['Weddings and Engagements']
Soft Money's Multifaceted Foe,1999-10-17,article,Biography,,[]
"After the Flood; With a Billion of Dollars in Damage, New Jersey Will Be Wringing Out a Long Time",1999-10-17,article,News,,[]
Corrections,1999-10-17,article,Correction,,[]
"In Salzburg, a Fresh Skirmish in the Culture Wars",1999-10-17,article,News,,[]
"Ms. Lesch, Mr. Mesa Sanin",1999-10-17,article,News,,['Weddings and Engagements']
"Paid Notice: Deaths  BETCHER, ALBERT, M.D.",1999-10-17,article,Paid Death Notice,,[]
Tailoring Arias to Suit the Vagaries of the Voices,1999-10-17,article,News,,[]
Parting of the Ways at Macari Vineyards,1999-10-17,article,Review,,[]
Editorial Observer; Pakistan's Dangerous Addiction to Its Military,1999-10-17,article,Editorial,,[]
October 10-16; Drug Arrests in Colombia,1999-10-17,article,News,,[]
"Many Faces of Woman, Adding Up to More Than a One-Woman Show",1999-10-17,article,Review,,[]
"Laura Seymann, Jonathan Beinner",1999-10-17,article,News,,['Weddings and Engagements']
"Picturing a Lost Boy, Drawing on Memory",1999-10-17,article,Review,,[]
When the Sun Revolved Around Manhattan,1999-10-17,article,Review,,[]
Smokers Always Knew,1999-10-17,article,Letter,,"['Suits and Litigation', 'Smoking and Tobacco', 'Liability for Products']"
A Large Quake Mostly Just Jolts Californians,1999-10-17,article,News,,"['BLACKOUTS (ELECTRICAL)', 'Earthquakes']"
"Paid Notice: Deaths  GLADSTONE, KENNETH",1999-10-17,article,Paid Death Notice,,[]
Corrections,1999-10-17,article,Correction,,[]
Storm Heads for Carolinas After Soaking South Florida,1999-10-17,article,News,,"['HURRICANE IRENE', 'Hurricanes and Tropical Storms']"
Taking a Dim View Of Review of Bad Views,1999-10-17,article,Letter,,['Parks and Other Recreation Areas']
FIVE QUESTIONS for BERNARD ARNAULT; Putting Fendi Into a Bigger Bag,1999-10-17,article,Interview,,[]
October 10-16; New Clinton Plan for Forests,1999-10-17,article,News,,[]
It Takes All Kinds; Werner Heisenberg: The Radical Thinker,1999-10-17,article,News,,"['Biographical Information', 'Culture', 'Physics']"
"THEATER; A Family Divorce Intrigues a Grandson, Who Writes a Play",1999-10-17,article,Review,,[]
How 'I' Moved Heaven and Earth,1999-10-17,article,News,,"['Social Conditions and Trends', 'Religion and Churches']"
"Emily Docken, Peter Webster",1999-10-17,article,News,,['Weddings and Engagements']
Is This the Place Where All the Children Are Above Average?,1999-10-17,article,News,,[]
"Paid Notice: Deaths  WILLIAMS, CLAYTON",1999-10-17,article,Paid Death Notice,,[]
Unworldly Americans,1999-10-17,article,Letter,,"['Music', 'Culture']"
Corrections,1999-10-17,article,Correction,,"['Correction Stories', 'Travel and Vacations', 'Floods']"
"Paid Notice: Deaths  GLUCK, RUTH C.",1999-10-17,article,Paid Death Notice,,[]
Have a Best Friend? Let Us Know,1999-10-17,article,News,,[]
Toys 'R' Murder,1999-10-17,article,Review,,"['Reviews', 'Books and Literature']"
A Slightly Scary Neighbor For a Catholic Girls' School,1999-10-17,article,News,,[]
"I'm O.K., You're Selfish",1999-10-17,article,News,,"['Social Conditions and Trends', 'PUBLIC OPINION', 'Ethics']"
Books in Brief: Nonfiction,1999-10-17,article,Review,,"['Reviews', 'Books and Literature']"
From I.M.F. to IMF: A Trademark Battle,1999-10-17,article,News,,[]
Out of the Sky,1999-10-17,article,Letter,,"['Accidents and Safety', 'AIRLINES AND AIRPLANES', 'Explosions', 'Books and Literature']"
Three Dandies,1999-10-17,article,Letter,,['Baseball']
Pakistan's Ruler Pledges to Curb Corruption,1999-10-17,article,News,,[]
Hold the Chitterlings,1999-10-17,article,Review,,"['Reviews', 'Books and Literature']"
October 10-16; Fessing Up to Smoking Risks,1999-10-17,article,News,,[]
October 10-16; Big Move by Con Ed,1999-10-17,article,News,,[]
Unlikely Opponents Agree On a Riverdale School Plan,1999-10-17,article,News,,[]
"Marisa Knopf, Peter Rosenthal",1999-10-17,article,News,,['Weddings and Engagements']
Chilean Fjords,1999-10-17,article,Letter,,"['Ships and Shipping', 'Glaciers', 'Travel and Vacations', 'Cruises']"
State's Representatives In Washington,1999-10-17,article,List,,[]
Too Much History,1999-10-17,article,Review,,"['Reviews', 'Books and Literature']"
"POSTINGS: From $9 Million to $18 Million; At 65th and Fifth, 10 New Condos",1999-10-17,article,News,,"['Condominiums', 'Housing']"
THE GUIDE,1999-10-17,article,Schedule,,[]
"Face Painting, Races and Protective Suits",1999-10-17,article,News,,"['Festivals', 'Hazardous and Toxic Substances', 'Children and Youth', 'ATOMIC ENERGY']"
Reebok Got Off Lightly For Sidewalk Ads,1999-10-17,article,Letter,,"['Shoes and Boots', 'Graffiti']"
"Paid Notice: Memorials  BERLER, ANDREW",1999-10-17,article,Paid Death Notice,,[]
It Seemed Easy: Sell Shampoo To the Chinese,1999-10-17,article,News,,[]
"FIRST PERSON; Natural History, Condensed",1999-10-17,article,News,,[]
Report Calls for New Focus On Aid for Minority Students,1999-10-17,article,News,,"['Indians, American', 'Minorities (US)', 'Education and Schools', 'Blacks', 'Black People', 'Asian-Americans', 'Hispanic-Americans']"
Terra Incognita,1999-10-17,article,News,,['Culture']
Tracking Down Pedophiles Gains Impetus,1999-10-17,article,News,,[]
Spraying Concerns,1999-10-17,article,News,,[]
Where Baseball Bows to World Series of Dominoes,1999-10-17,article,News,,"['Baseball', 'Dominoes', 'Hispanic-Americans']"
Katherine Jones And Harry Koster,1999-10-17,article,News,,['Weddings and Engagements']
Breaking Away: A Television Tradition,1999-10-17,article,News,,"['Television', 'TELEVISION AND RADIO PROGRAMMING']"
"Miss Burtschy, Mr. Sacerdote",1999-10-17,article,News,,['Weddings and Engagements']
"Paid Notice: Deaths  CAPRON, MARGARET (PEG) M.",1999-10-17,article,Paid Death Notice,,[]
Make Room for Daddies,1999-10-17,article,Review,,"['Reviews', 'Books and Literature']"
Faces Are the Focus Of a Baltimore Exhibit,1999-10-17,article,News,,[]
Lottery's Opponent,1999-10-17,article,Letter,,"['Tax Exemptions', 'Religion and Churches', 'Lotteries']"
New Jersey Brownfields Are Drawing Developers,1999-10-17,article,News,,"['Environment', 'Area Planning and Renewal', 'SHOPPING CENTERS', 'Economic Conditions and Trends', 'Waste Materials and Disposal', 'Land Use Policies', 'Golf', 'RETAIL STORES AND TRADE']"
'White Flight' Student Exploited Trenton School,1999-10-17,article,Letter,,"['Education and Schools', 'Blacks', 'Black People']"
Going Too Far,1999-10-17,article,Letter,,['Baseball']
Promoting Violence,1999-10-17,article,Letter,,[]
Protecting the U.N.'s Rescuers,1999-10-17,article,Editorial,,[]
It Takes All Kinds; Heloise: The Ultimate Lover,1999-10-17,article,News,,"['Biographical Information', 'Culture']"
The Me Veneration,1999-10-17,article,News,,['APPAREL']
"Paid Notice: Deaths  STEIN, DAVID",1999-10-17,article,Paid Death Notice,,[]
"Paid Notice: Deaths  SHEPETIN, MORTON",1999-10-17,article,Paid Death Notice,,[]
"Paid Notice: Deaths  MCGUIRE, MARGARET JOSEPH (NEE MAUNDSLEY)",1999-10-17,article,Paid Death Notice,,[]
Kate Cote and Peter Gillin,1999-10-17,article,News,,['Weddings and Engagements']
The Home of Jai Alai,1999-10-17,article,Review,,"['Reviews', 'Books and Literature']"
"As Sons Throw Spirals, Dads Throw Punches",1999-10-17,article,News,,[]
Brilliance and Promise Will Only Go So Far,1999-10-17,article,Review,,[]
October 10-16; Suharto Case Is Dropped,1999-10-17,article,News,,[]
Guns Are a Children's Health Issue; Follow Colt's Lead,1999-10-17,article,Letter,,"['Gun Control', 'Firearms']"
"American Icon, Father Of His Country",1999-10-17,article,Review,,[]
"Paid Notice: Memorials  SCHAINMAN, PEARL C.",1999-10-17,article,Paid Death Notice,,[]
"After Yonkers Teachers Strike, Some Mutual Admiration",1999-10-17,article,News,,[]
"SHOPPING WITH: Serena Williams; Game, Set, Dress Me In Leather",1999-10-17,article,Biography,,['APPAREL']
No Sympathy From Wendell,1999-10-17,article,News,,"['Baseball', 'Playoff Games']"
Q&A/Hershel Sarbin; A Retiree Who Refuses to Slow Down,1999-10-17,article,Interview,,[]
Bad Hair Day? Cool,1999-10-17,article,News,,['Hair']
Close Your Eyes; Open Your Ears,1999-10-17,article,News,,[]
Wall Street Discounts The Future,1999-10-17,article,News,,[]
Of Pirates and Prehistory,1999-10-17,article,News,,[]
Lifting Body and Spirit,1999-10-17,article,News,,[]
Buchanan Paradox,1999-10-17,article,Letter,,['Presidential Election of 2000']
"Paid Notice: Deaths  VERSHAY, NORMAN C.",1999-10-17,article,Paid Death Notice,,[]
Bookend; On the Road Again,1999-10-17,article,News,,"['Books and Literature', 'Book Trade']"
Ideas & Trends: Blown to Bits; Cyberwarfare Breaks the Rules of Military Engagement,1999-10-17,article,News,,[]
"Mary McCagg, Kane Larin",1999-10-17,article,News,,['Weddings and Engagements']
"OPINION; Nassau's Budget Mess, in One Act",1999-10-17,article,News,,[]
Christopher Sipes and Grail Walsh,1999-10-17,article,News,,['Weddings and Engagements']
Guides to Nature and Wildlife Are Issued for Seven Counties,1999-10-17,article,News,,[]
"Q & A/Stuart Woods; Writing Risque, With Local Twist",1999-10-17,article,Interview,,[]
Books in Brief: Fiction,1999-10-17,article,Review,,"['Reviews', 'Books and Literature']"
"Jennifer Donofrio, David Moore",1999-10-17,article,News,,['Weddings and Engagements']
Yoshii Available for a Game 5,1999-10-17,article,News,,"['Baseball', 'Playoff Games', 'Biographical Information']"
"Kelly Koenig, Daniel Levi",1999-10-17,article,News,,['Weddings and Engagements']
Guns Used More for Suicide Than Homicide,1999-10-17,article,News,,"['Mayors', 'Elections']"
Jennifer Liu and Jonathan Kelly,1999-10-17,article,News,,['Weddings and Engagements']
Conversation; The Secret Life of Biographers,1999-10-17,article,News,,['Books and Literature']
The Pursuit of Pleasure,1999-10-17,article,Review,,"['Reviews', 'Books and Literature']"
Children's Books; Bookshelf,1999-10-17,article,Review,,[]
Messiaen's Excursion Into Rapturous Opera,1999-10-17,article,Review,,[]
The World; Doomed Treaties,1999-10-17,article,News,,[]
"In the Region/New Jersey; With Land Scarce, Developed Sites Are Reused",1999-10-17,article,News,,"['OFFICE BUILDINGS', 'Land Use Policies']"
Amtrak Changes,1999-10-17,article,Letter,,['Railroads']
"HARVARD 37, FORDHAM 30",1999-10-17,article,News,,"['College Athletics', 'Football']"
"Volunteers Brighten City's Public Schools; 9,000 Cheerfully Paint and Plant",1999-10-17,article,News,,"['Education and Schools', 'Volunteers']"
"On Language; Me, Myself and I",1999-10-17,article,News,,['English Language']
What Woes? The Red Sox Slug Away at Fenway Park,1999-10-17,article,News,,"['Baseball', 'Records and Achievements', 'Playoff Games']"
Blacklist in Jordan,1999-10-17,article,Letter,,['Blacklisting']
"Paid Notice: Deaths  OATES, JAMES J.",1999-10-17,article,Paid Death Notice,,[]
'White Flight' Student Exploited Trenton School,1999-10-17,article,Letter,,"['Education and Schools', 'Blacks', 'Black People']"
Schwab Counters A Pincers Movement,1999-10-17,article,Interview,,[]
"In the Land of Good and Plenty, a Disturbing Trend; From Greenwich to Norwich, Demand Is Up at Food Pantries and Soup Kitchens",1999-10-17,article,News,,[]
MOVIES: CRITICS' CHOICE,1999-10-17,article,News,,[]
Ideas & Trends; Verbatim: Wilt the Stilt's Views on Race and Hoops,1999-10-17,article,News,,[]
"On Pelham Parkway, Blame Drivers, Not Trees",1999-10-17,article,Letter,,"['Trees and Shrubs', 'Roads and Traffic', 'Speed Limits and Speeding']"
"Jonathan Elsen, Ellen Hogan",1999-10-17,article,News,,['Weddings and Engagements']
"Paid Notice: Deaths  SPROUL, JODI D. (NEE GOLDSTEIN)",1999-10-17,article,Paid Death Notice,,[]
"Twig by Twig, a New Suburban Sprawl",1999-10-17,article,News,,[]
JERSEY DIARY,1999-10-17,article,News,,[]
"PAPERBACK BEST SELLERS: October 17, 1999",1999-10-17,article,List,,[]
Revived Red Sox Batter Clemens as Martinez Silences Yanks,1999-10-17,article,News,,"['Baseball', 'Records and Achievements', 'Playoff Games', 'Biographical Information']"
Back Pay for Workers,1999-10-17,article,News,,[]
"Under City Hall, Dreams and Nightmares; Fears That Reopening Station as Museum Might Lure Terrorists",1999-10-17,article,News,,"['Subways', 'Restoration and Rehabilitation', 'Transit Systems', 'Terrorism']"
"Paid Notice: Deaths  COHEN, TED",1999-10-17,article,Paid Death Notice,,[]
Bottles for the Nuovo Mondo,1999-10-17,article,Review,,[]
"Dr. Knafo, Mr. Yagupsky",1999-10-17,article,News,,['Weddings and Engagements']
"Paid Notice: Deaths  SIDERS, IRVING",1999-10-17,article,Paid Death Notice,,[]
When a V.P. Runs for President,1999-10-17,article,Letter,,[]
Ideas & Trends; Wrestling With Unruly Numbers,1999-10-17,article,News,,[]
What Makes Him Tic?,1999-10-17,article,Review,,"['Reviews', 'Books and Literature']"
There's No Business Like Community Theater Business,1999-10-17,article,News,,[]
October 10-16; Daily Cell Growth in Brain,1999-10-17,article,News,,[]
Endorsement Brings Big Labor Test for Gore,1999-10-17,article,News,,"['Labor Role In Politics', 'LABOR', 'ELECTION ISSUES', 'Endorsements', 'Presidential Election of 2000', 'Unemployment']"
"Malinda Polk, Stuart Harris",1999-10-17,article,News,,['Weddings and Engagements']
"Chamberlain Remembered As 'Giving, Loving'",1999-10-17,article,News,,"['Basketball', 'Deaths (Obituaries)']"
"Paid Notice: Deaths  FRANQUINHA, MARIA",1999-10-17,article,Paid Death Notice,,[]
"Our Towns; Oh, the Times They Have A-Changed",1999-10-17,article,News,,"['Social Conditions and Trends', 'Nineteen Hundred Sixties']"
Swiss Movement,1999-10-17,article,Review,,[]
Learning TV News Reporting in the Trenches,1999-10-17,article,News,,[]
It Takes All Kinds; Jane Austen: The Cool Artist,1999-10-17,article,News,,"['Biographical Information', 'Books and Literature', 'Culture']"
Bigger Media Voices,1999-10-17,article,Letter,,"['Mergers, Acquisitions and Divestitures', 'Television', 'Telephones and Telecommunications', 'News and News Media', 'Computers and the Internet']"
Valentine Plays Healer After Henderson Flub,1999-10-17,article,News,,"['Baseball', 'Playoff Games']"
Books in Brief: Fiction,1999-10-17,article,Review,,"['Reviews', 'Books and Literature']"
"Kerry Armstrong, George Cheney",1999-10-17,article,News,,['Weddings and Engagements']
'Thinking About You',1999-10-17,article,News,,[]
"Paid Notice: Memorials  BELMONT, BEVERLY",1999-10-17,article,Paid Death Notice,,[]
"Paid Notice: Deaths  WAGNER, ROBERT",1999-10-17,article,Paid Death Notice,,[]
Sprewell Banishes Some Memories And Moves Into the Starting Lineup,1999-10-17,article,News,,"['Biographical Information', 'Basketball']"
Muslim Fighter Embraces Warrior Mystique,1999-10-17,article,News,,['INDEPENDENCE MOVEMENTS AND SECESSION']
New Orleans Casino To Open At Last,1999-10-17,article,News,,[]
Devotees of This Camera Aim for the Unpredictable,1999-10-17,article,News,,[]
New & Noteworthy Paperbacks,1999-10-17,article,Review,,[]
"Paid Notice: Deaths  CLARK, MURIEL",1999-10-17,article,Paid Death Notice,,[]
Three More Suspects Held In Killings at Muffin Shop,1999-10-17,article,News,,"['Robberies and Thefts', 'Murders and Attempted Murders']"
"Mindy Schwartz, Brian Tumpowsky",1999-10-17,article,News,,['Weddings and Engagements']
How McCain Plans To Defeat Bush,1999-10-17,article,News,,"['Presidential Election of 2000', 'PRIMARIES']"
Deciding on a Place for a Home Office,1999-10-17,article,News,,['HOME REPAIR']
"Behind the Woolens, an Einstein Museum",1999-10-17,article,Interview,,[]
"Jennifer Ablow, Jeffrey Measelle",1999-10-17,article,News,,['Weddings and Engagements']
"Fassel's X's and O's Take a Hit Off the Field, Too",1999-10-17,article,News,,"['Coaches and Managers', 'Football']"
Sports of The Times; Seventh Game Is a Bad Idea for Clemens,1999-10-17,article,News,,"['Baseball', 'Playoff Games']"
"In a New Haven Cafe, Piquant Turkish Fare",1999-10-17,article,Review,,[]
His Own Scene,1999-10-17,article,Letter,,['Music']
"Paid Notice: Deaths  KAUFMAN, FLORENCE (SUNNY)",1999-10-17,article,Paid Death Notice,,[]
A Task on the Scale Of a Hollywood Epic,1999-10-17,article,Review,,[]
How to Combat The Bat,1999-10-17,article,News,,"['Housing', 'Bats']"
"Paid Notice: Deaths  DIAMOND, SIGMOND",1999-10-17,article,Paid Death Notice,,[]
Word for Word/The Prize and the Fury; Nobels That Some Felt Weren't So Dynamite,1999-10-17,article,News,,[]
A Question of Balance,1999-10-17,article,Letter,,"['Private and Sectarian Schools', 'Education and Schools']"
INSIDE,1999-10-17,article,Summary,,[]
"The Patina, the Glow of Antique Beauty",1999-10-17,article,News,,[]
Books in Brief: Nonfiction,1999-10-17,article,Review,,"['Reviews', 'Books and Literature', 'Biographical Information']"
"Little Italy, Yesterday and Today",1999-10-17,article,News,,[]
Postal Addresses Have Come a Long Way,1999-10-17,article,Letter,,"['ZIP CODE', 'Postal Service']"
"Motoyo Suzuki, Steven Pollock",1999-10-17,article,News,,['Weddings and Engagements']
Liberties; Capitol Hill Bordello,1999-10-17,article,Op-Ed,,"['Prostitution', 'Television', 'Finances', 'ELECTION ISSUES', 'Ethics', 'Elections']"
Bigger Media Voices,1999-10-17,article,Letter,,"['Mergers, Acquisitions and Divestitures', 'Television', 'Telephones and Telecommunications', 'News and News Media', 'Computers and the Internet']"
Children's Books,1999-10-17,article,Review,,"['Reviews', 'Books and Literature']"
San Jose's Sights in Stone,1999-10-17,article,News,,[]
"Paid Notice: Deaths  STECKLER, WILLIAM",1999-10-17,article,Paid Death Notice,,[]
"Paid Notice: Deaths  EPSTEIN, BETTY",1999-10-17,article,Paid Death Notice,,[]
PULSE,1999-10-17,article,News,,"['Magazines', 'CATALOGUES']"
Elderly Say 12 Steps Are Too Many,1999-10-17,article,News,,[]
"Florence Schanen, Lawrence Bier",1999-10-17,article,News,,['Weddings and Engagements']
Protest on Canvas,1999-10-17,article,Review,,"['Reviews', 'Books and Literature', 'Biographical Information']"
Popular Images Of Washington,1999-10-17,article,Review,,[]
Residents Say Drug Campaign Just Sweeps Dealers From View,1999-10-17,article,News,,[]
October 10-16; California Sets Nurse Levels,1999-10-17,article,News,,[]
PLAYING,1999-10-17,article,News,,[]
An Accidental Feast of Photography,1999-10-17,article,Review,,[]
Countdown to Pakistan's Coup: A Duel of Nerves in the Air,1999-10-17,article,News,,"[""Coups D'Etat and Attempted Coups D'Etat"", 'United States International Relations', 'ARMAMENT, DEFENSE AND MILITARY FORCES']"
18th-Century Letters Send Boys on Quest,1999-10-17,article,News,,[]
What Social Climbing?,1999-10-17,article,Letter,,['Education and Schools']
Steinbrenner Rejects Request by the Orioles,1999-10-17,article,News,,['Baseball']
Lottery's Opponent,1999-10-17,article,Letter,,['Lotteries']
"Juliette Tuakli, Kweku Ghartey",1999-10-17,article,News,,['Weddings and Engagements']
Argentine Escapades With Choice Food,1999-10-17,article,Review,,[]
"At Last, a Plan to Improve Parkway-Route 78 Connection",1999-10-17,article,News,,[]
"Beneath a Placid Sky, A Jungle in the Water",1999-10-17,article,News,,"['Fishing, Sport']"
A Golden Leash?,1999-10-17,article,News,,[]
"Nancy Espeseth, Kenneth Rudin",1999-10-17,article,News,,['Weddings and Engagements']
Words That Hurt,1999-10-17,article,Letter,,['Music']
Correction,1999-10-17,article,Correction,,[]
"Paid Notice: Memorials  FERGUSON, ANDREW B. JR.",1999-10-17,article,Paid Death Notice,,[]
Larry Bird Remembers the One Ball He Coveted,1999-10-17,article,News,,"['Biographical Information', 'Basketball']"
"One Neighborhood, Two Newspapers, Two Worlds",1999-10-17,article,News,,[]
Wittiness of Creation,1999-10-17,article,Letter,,"['Education and Schools', 'Religion and Churches', 'Science and Technology', 'Evolution']"
Books in Brief: Nonfiction,1999-10-17,article,Review,,"['Baseball', 'Reviews', 'Books and Literature']"
It Takes All Kinds; Ignatius of Loyola: The Saintly Boss,1999-10-17,article,News,,"['Biographical Information', 'Culture']"
Coming Back To Jamaica,1999-10-17,article,News,,[]
The Other End of the Telescope,1999-10-17,article,Review,,"['Reviews', 'Books and Literature', 'Biographical Information']"
Inside Out,1999-10-17,article,News,,"['Biology and Biochemistry', 'ANATOMY AND PHYSIOLOGY', 'Photography']"
Split Personalities Can Be Better Than One,1999-10-17,article,News,,['Culture']
October 10-16; A Nobel for Doctors' Group,1999-10-17,article,News,,[]
Health Care Provides Degree Opportunities,1999-10-17,article,News,,[]
DIANE ARCHER,1999-10-17,article,News,,[]
Being Faithful to a Victorian Ideal,1999-10-17,article,News,,[]
"FULFILLING A PROMISE: A special report.; A Sports Sisterhood, Measured in Olympiads",1999-10-17,article,Special Report,,"['OLYMPIC GAMES (2000)', 'Surveys and Series', 'Olympic Games', 'Women', 'Track and Field']"
Children's Books; By Zeppelin From Now to Then,1999-10-17,article,Review,,"['Reviews', 'Books and Literature']"
Paris,1999-10-17,article,News,,[]
Correction,1999-10-17,article,Correction,,[]
"Paid Notice: Deaths  BAKER, CROWELL",1999-10-17,article,Paid Death Notice,,[]
"October 10-16; A Bird's Eye View, for a Price",1999-10-17,article,News,,[]
BEHIND THE WHEEL / 2000 Mitsubishi Eclipse GT; Sport Coupe for Mature Audiences,1999-10-17,article,News,,['Automobiles']
Land in Manhattan for $1 a Lot?,1999-10-17,article,News,,[]
Columbia Is Picked Apart by Penn's Hoffman,1999-10-17,article,News,,['Football']
Food; Coddled Egos,1999-10-17,article,News,,"['Cooking and Cookbooks', 'Recipes']"
When Goofy Didn't Mean Disney on Times Square,1999-10-17,article,News,,[]
"Paid Notice: Deaths  HENRY, JANET RUTH",1999-10-17,article,Paid Death Notice,,[]
"Paid Notice: Deaths  KAHN, MELVIN, M.D.",1999-10-17,article,Paid Death Notice,,[]
"Seeing to Herbs, Roses and Bulbs",1999-10-17,article,News,,['Gardens and Gardening']
A Dowager Hotel?,1999-10-17,article,Letter,,['HOTELS AND MOTELS']
TELEVISION/RADIO; 'Cat Therapist' and Other Sitcoms-Not-to-Be,1999-10-17,article,News,,[]
October 10-16; Colt's to Curb Gun Sales,1999-10-17,article,News,,[]
October 10-16; Babbitt Inquiry Ends,1999-10-17,article,News,,[]
Natural Man,1999-10-17,article,Review,,"['Books and Literature', 'Reviews']"
Lone Star History,1999-10-17,article,Letter,,"['Slavery', 'Books and Literature', 'History']"
Books in Brief: Fiction; A Fluffmeister Seeks Redemption,1999-10-17,article,Review,,"['Books and Literature', 'Reviews']"
State Is Far From Reluctant To Aid Its Cities,1999-10-17,article,Letter,,[]
For the Barefoot Boy On Bleecker Street,1999-10-17,article,News,,[]
Ailing Foreign Policy,1999-10-17,article,An Analysis; News Analysis,,"['ATOMIC WEAPONS', 'United States International Relations', 'ARMS CONTROL AND LIMITATION AND DISARMAMENT']"
"The View From/Ox Ridge Hunt Club, Darien; Yale and Virginia Meet Mid Ponies and Picnics",1999-10-17,article,News,,[]
TRANSACTIONS,1999-10-17,article,List,,[]
Artax Gets Early Jump And Doesn't Look Back,1999-10-17,article,News,,"['Horse Racing', 'BELMONT PARK RACE TRACK']"
Schlemiels,1999-10-17,article,Review,,"['Reviews', 'Books and Literature']"
The Lost Art Of Immortality,1999-10-17,article,News,,"['Biographical Information', 'Books and Literature', 'Culture']"
"Paid Notice: Deaths  PHELAN, SONDRA SICKLES",1999-10-17,article,Paid Death Notice,,[]
Penn State Batters Buckeyes to Win,1999-10-17,article,News,,"['College Athletics', 'Football']"
QUOTATION OF THE DAY,1999-10-17,article,News,,['QUOTATION OF THE DAY']
Male for Good Reason,1999-10-17,article,Letter,,"['Music', 'ORCHESTRAS AND OTHER MUSIC GROUPS', 'Women']"
Jealousy in a Material World,1999-10-17,article,News,,[]
POP MUSIC; The Apple Doesn't Fall Far From the Tree,1999-10-17,article,Review,,[]
No Cheers for Braves Fans,1999-10-17,article,News,,"['Baseball', 'Playoff Games', 'Biographical Information']"
Yanks' Success Is No Accident,1999-10-17,article,Letter,,['Baseball']
Bergen Catholic Is Not Caught Napping for Long,1999-10-17,article,News,,"['Interscholastic Athletics', 'Football']"
Q. & A.,1999-10-17,article,Question,,[]
"Issue by Issue, First Lady Details Differences With Giuliani",1999-10-17,article,News,,"['LABOR', 'Minimum Wage', 'Vouchers', 'United States Economy', 'Education and Schools', 'ELECTION ISSUES', 'Law and Legislation', 'Elections']"
The More Things Change . . .,1999-10-17,article,Letter,,"['Private and Sectarian Schools', 'Education and Schools']"
A Singer Sails On,1999-10-17,article,News,,[]
Going With the Amazon's Flow,1999-10-17,article,News,,[]
Troupe Dreams,1999-10-17,article,News,,[]
"Car Registration to Be Done On Line, Rather Than in Line",1999-10-17,article,News,,[]
Delta Shuttle To Get Quieter Planes,1999-10-17,article,News,,[]
"In the Region/Westchester; Vacancies High, but Office Market Still Thrives",1999-10-17,article,News,,"['Renting and Leasing', 'OFFICE BUILDINGS']"
"Paid Notice: Deaths  BURG, RABBI JOSEF",1999-10-17,article,Paid Death Notice,,[]
"1,200 Miles South, a Connection to Home",1999-10-17,article,News,,[]
Residential Sales,1999-10-17,article,List,,[]
