headline,date,doc_type,material_type,section,keywords
American Standard Chooses an Outsider,1999-10-08,article,News,,"['Appointments and Executive Changes', 'Mergers, Acquisitions and Divestitures', 'Biographical Information']"
"Paid Notice: Deaths  FOA, BRUNO",1999-10-08,article,Paid Death Notice,,[]
Fen-Phen Maker to Pay Billions In Settlement of Diet-Injury Cases,1999-10-08,article,News,,"['Heart', 'Weight', 'Dieting', 'Fen-Phen (Drug Combination)', 'Suits and Litigation', 'Consumer Protection', 'Liability for Products']"
How to Miss a Big Bull Market: Invest in Perelman Stocks,1999-10-08,article,News,,['COMPANY AND ORGANIZATION PROFILES']
WORLD BRIEFING,1999-10-08,article,News,,[]
WACHOVIA TO BUY B C BANKSHARES FOR $134 MILLION,1999-10-08,article,News,,"['Mergers, Acquisitions and Divestitures']"
INSIDE ART,1999-10-08,article,News,,"['Philanthropy', 'Lead', 'Children and Youth', 'Art']"
Astros Look Longingly to Hampton Against the Braves,1999-10-08,article,News,,"['Baseball', 'Playoff Games']"
Bush Challenges the Orthodoxy But Is Still a Devout Conservative,1999-10-08,article,News,,"['ELECTION ISSUES', 'Presidential Election of 2000']"
Russia Investigating Its Own Banks for Role in Suspicious Cash Movements,1999-10-08,article,News,,"['Money Laundering', 'Banks and Banking']"
QUOTATION OF THE DAY,1999-10-08,article,News,,['QUOTATION OF THE DAY']
Review/Fashion; Just How Sexy Does a Woman Want to Look?,1999-10-08,article,Review,,"['Reviews', 'APPAREL']"
Grunwald Gets Deal; Willis Is Re-signed,1999-10-08,article,News,,[]
Sega Gameworks Names a Chief,1999-10-08,article,News,,"['Suspensions, Dismissals and Resignations', 'Appointments and Executive Changes', 'Biographical Information']"
"INTUIT TO BUY ROCK FINANCIAL, AN ON-LINE MORTGAGE SELLER",1999-10-08,article,News,,"['Mergers, Acquisitions and Divestitures']"
Survey Shows Drop In Costs for TV Ads,1999-10-08,article,News,,"['ADVERTISING', 'Television', 'Finances']"
"E. C. Banfield, 83, Maverick On Urban Policy Issues, Dies",1999-10-08,article,Obituary; Biography,,"['Deaths (Obituaries)', 'Biographical Information']"
"Charity Led by General Powell Comes Under Heavy Fire, Accused of Inflating Results",1999-10-08,article,News,,[]
"Paid Notice: Deaths  YOUNG, LUCYLLE",1999-10-08,article,Paid Death Notice,,[]
Watch Out for a Daughter With an Unflinching Camera,1999-10-08,article,Review,,"['MOTION PICTURES', 'Reviews', 'Documentary Films and Programs', 'Biographical Information']"
Martin Luther King Jr. High School Coach Is Reinstated,1999-10-08,article,News,,"['Soccer', 'Coaches and Managers', 'Interscholastic Athletics']"
DINER'S JOURNAL,1999-10-08,article,Review,,"['Reviews', 'Restaurants']"
"Paid Notice: Deaths  DURFEE, VIRGINIA",1999-10-08,article,Paid Death Notice,,[]
"A Brand New Club, an Ageless Star",1999-10-08,article,Review,,"['Music', 'Reviews']"
Clean Up the I.N.S.,1999-10-08,article,Letter,,['IMMIGRATION AND REFUGEES']
"Paid Notice: Deaths  MURRAY, SHIRLEY FOERDERER",1999-10-08,article,Paid Death Notice,,[]
The Reality Of Welfare Reform,1999-10-08,article,Letter,,"['WORKFARE AND EMPLOYMENT OF WELFARE RECIPIENTS', 'Welfare (US)', 'Discrimination']"
Teacher Is Charged With Selling Cocaine,1999-10-08,article,News,,"['Education and Schools', 'Teachers and School Employees', 'Cocaine and Crack Cocaine', 'Drug Abuse and Traffic']"
Brodeur Gets Ejected And Devils Lag Behind,1999-10-08,article,News,,"['Hockey, Ice']"
$100 Million To Be Given To Cornell,1999-10-08,article,News,,"['Philanthropy', 'Restoration and Rehabilitation', 'Colleges and Universities']"
"Paid Notice: Deaths  MORTON, CLAUDE",1999-10-08,article,Paid Death Notice,,[]
SPARE TIMES,1999-10-08,article,Schedule,,[]
"And Still, Serbs Bar Muslims In Bosnia",1999-10-08,article,News,,"['Assassinations and Attempted Assassinations', 'United States International Relations', 'WAR CRIMES AND CRIMINALS', 'Politics and Government', 'Islam', 'UNITED STATES ARMAMENT AND DEFENSE']"
"For Enlightenment, Her Heart Will Go On",1999-10-08,article,Review,,"['MOTION PICTURES', 'Reviews', 'New York Film Festival']"
A Sad Judicial Mugging,1999-10-08,article,Editorial,,"['Appointments and Executive Changes', 'Federal District Courts', 'Courts', 'Editorials', 'Blacks', 'Black People', 'Capital Punishment']"
Albany Lawmakers Pass DNA and Clinic Bills,1999-10-08,article,News,,"['Fines (Penalties)', 'ABORTION', 'Bombs and Explosives', 'Stalking (Crime)', 'Threats and Threatening Messages', 'DEOXYRIBONUCLEIC ACID', 'Law and Legislation', 'Electric Light and Power', 'Crime and Criminals', 'Computers and the Internet']"
"Trooper in Turnpike Shooting Sues State, Saying He Was Unfit for Duty",1999-10-08,article,News,,"['Police Brutality and Misconduct', 'Blacks', 'Black People', 'Roads and Traffic', 'SUITS AND CLAIMS AGAINST GOVERNMENT', 'Police', 'Hispanic-Americans']"
"Time Is of the Essence (Oh, Really?)",1999-10-08,article,News,,"['Baseball', 'Time', 'Playoff Games']"
Don't Put Strings on Debt Relief; The Debt Bargain,1999-10-08,article,Letter,,"['Economic Conditions and Trends', 'Third World and Developing Countries', 'Foreign Aid']"
"Paid Notice: Deaths  WOLKOFF, NELLIE",1999-10-08,article,Paid Death Notice,,[]
"Paid Notice: Deaths  SENFELD, S. WILLIAM",1999-10-08,article,Paid Death Notice,,[]
"Chase Is Moving 3,500 of Its Jobs From New York",1999-10-08,article,News,,"['Relocation of Business', 'Economic Conditions and Trends', 'Banks and Banking']"
Hedge Fund to Curb Investors' Withdrawals,1999-10-08,article,News,,"['Stocks and Bonds', 'Hedge Funds']"
New Video Releases,1999-10-08,article,Review,,"['RECORDINGS (VIDEO)', 'MOTION PICTURES', 'Reviews']"
"Paid Notice: Deaths  GOMEZ, CHARLES G.",1999-10-08,article,Paid Death Notice,,[]
McEnroe's Leadership Test Will Begin in Zimbabwe,1999-10-08,article,News,,"['Davis Cup', 'Tennis']"
When Children Have to Be Chic,1999-10-08,article,News,,[]
"Paid Notice: Deaths  HILL, FRANCES",1999-10-08,article,Paid Death Notice,,[]
"WEEKEND WARRIOR; It's Not Just Speed on a Tandem; It's Conversation, Too",1999-10-08,article,News,,"['Bicycles and Bicycling', 'Travel and Vacations']"
FAMILY FARE,1999-10-08,article,News,,"['Entertainment and Amusements', 'Families and Family Life']"
Clinton Is Said To Plan Order To Aid Forests,1999-10-08,article,News,,"['Forests and Forestry', 'Law and Legislation', 'Logging Industry']"
"Paid Notice: Deaths  STRESEMANN, JOACHIM",1999-10-08,article,Paid Death Notice,,[]
Required for a Musical Marathon: Plenty of Sleep and Willpower,1999-10-08,article,News,,['Music']
Richter Out Tonight,1999-10-08,article,News,,[]
Iridium Fails to Find a Market : Satellite Phone Misses Its Orbit,1999-10-08,article,News,,[]
Store of the Big Cow Riles Land of the Quaint,1999-10-08,article,News,,"['RETAIL STORES AND TRADE', 'Food']"
Wired Revolution Helps Guerrillas : Latest Technology Links Jungle Rebels,1999-10-08,article,News,,[]
"For Up-and-Down Mets, Loss to Diamondbacks Is a Reminder",1999-10-08,article,News,,"['Baseball', 'Playoff Games']"
'Boogie' Writer Back in Valley,1999-10-08,article,News,,"['MOTION PICTURES', 'Women']"
Mayors Choose a New Model Of Vehicle for La Republique,1999-10-08,article,News,,[]
"Across the U.S., Universities Are Fueling High-Tech Economic Booms",1999-10-08,article,News,,"['United States Economy', 'Colleges and Universities', 'Science and Technology']"
Webvan Is Delaying Its Offering of Stock,1999-10-08,article,News,,"['Securities and Commodities Violations', 'Finances', 'Regulation and Deregulation of Industry', 'Food']"
Metro Business; Oxford to Move Offices,1999-10-08,article,News,,"['Relocation of Business', 'Medicine and Health']"
"With Pleasure and No Pain, a Most Apolitical China",1999-10-08,article,Review,,"['Reviews', 'Photography']"
Internet Companies Battle for Spain's Growing Market,1999-10-08,article,News,,[]
Treating Depression,1999-10-08,article,Letter,,"['Electroshock Therapy', 'Surgeon General (US)', 'Mental Health and Disorders', 'Depression (Mental)']"
Andreas Slominski,1999-10-08,article,Review,,"['Reviews', 'Art']"
"Paid Notice: Deaths  TAYLOR, WILLIAM ROBINSON",1999-10-08,article,Paid Death Notice,,[]
Fear Is Stalking the Streets After Williamsburg Killings,1999-10-08,article,News,,"['Murders and Attempted Murders', 'Serial Murders']"
European Central Bank Leaves Interest Rate Unchanged,1999-10-08,article,News,,"['Interest Rates', 'Credit', 'Economic Conditions and Trends']"
Together By a Twist Of Fate,1999-10-08,article,Review,,"['MOTION PICTURES', 'Reviews']"
THE MARKETS: COMMODITIES,1999-10-08,article,News,,"['International Trade and World Market', 'Oil (Petroleum) and Gasoline', 'Prices (Fares, Fees and Rates)', 'Futures and Options Trading', 'Production']"
INSIDE,1999-10-09,article,Summary,,[]
Rethinking U.S. Response To Calls for Disaster Relief,1999-10-09,article,News,,"['Drought', 'Farmers', 'Weather', 'Finances', 'Small Business', 'HURRICANE FLOYD', 'Budgets and Budgeting', 'Floods', 'Hurricanes and Tropical Storms']"
"Gen. Bruce K. Holloway, 87, Head of Strategic Air Command",1999-10-09,article,Obituary; Biography,,[]
"Paid Notice: Deaths  COLT, BARCLAY",1999-10-09,article,Paid Death Notice,,[]
"At Tight End, the Priority Is Blocking",1999-10-09,article,News,,[]
RECKSON SERVICE WILL BE ADDING TO TWO HOLDINGS,1999-10-09,article,News,,[]
How a Soldier Grew Into a Monster,1999-10-09,article,Review,,"['MOTION PICTURES', 'REVIEW']"
Lethal Weapon in Iraq,1999-10-09,article,Letter,,[]
City Administration Official Opposes Giuliani on Museum,1999-10-09,article,News,,"['Censorship', 'Finances', 'Freedom of Speech and Expression', 'Art']"
Journal; Pull the Plug on Brooklyn,1999-10-09,article,Op-Ed,,[]
Paul Petzoldt Is Dead at 91; Innovator in Rock Climbing,1999-10-09,article,Obituary; Biography,,[]
Inspired by Hungary's Past and Present,1999-10-09,article,Review,,[]
"Recurring Patterns, The Sinews Of Nature; Interest in Design Pulls Science Closer to Art",1999-10-09,article,News,,[]
"Paid Notice: Deaths  FOA, BRUNO",1999-10-09,article,Paid Death Notice,,[]
COLLEGE FOOTBALL REPORT,1999-10-09,article,News,,[]
Corrections,1999-10-09,article,Correction,,"['HEALTH MAINTENANCE ORGANIZATIONS AND MANAGED CARE', 'ADVERTISING', 'HEALTH INSURANCE', 'Forecasts', 'Medicine and Health', 'Law and Legislation', 'Correction Stories']"
BUSINESS DIGEST,1999-10-09,article,Summary,,[]
Roche Holding Plans Sale Of Part of Genentech Stake,1999-10-09,article,News,,"['Mergers, Acquisitions and Divestitures', 'Finances', 'Company Reports']"
"After Disease Scare, Inmates Rejoin Cleanup",1999-10-09,article,News,,"['Prisons and Prisoners', 'HURRICANE FLOYD', ""Legionnaires' Disease"", 'Floods', 'Hurricanes and Tropical Storms']"
Corrections,1999-10-09,article,Correction,,"['MOTION PICTURES', 'Correction Stories']"
Sprewell Lands in New York as Knicks Issue a Fine,1999-10-09,article,News,,[]
Johnson Won't Start on 3 Days' Rest,1999-10-09,article,News,,[]
"John McLendon, 84, Strategist In College and Pro Basketball",1999-10-09,article,Obituary; Biography,,[]
"Her Partners Can Call Her Ms. Chairman; Baker & McKenzie Takes Small Step for a Law Firm, Giant Leap for Womankind",1999-10-09,article,Biography,,"['Appointments and Executive Changes', 'Biographical Information', 'Women', 'Legal Profession']"
NESTLE SELLS FROZEN FOODS UNIT,1999-10-09,article,News,,"['Mergers, Acquisitions and Divestitures']"
A Multicultural Chameleon; Actor's Experience Spawns Polyglot Cast of Characters,1999-10-09,article,News,,"['Biographical Information', 'Theater']"
FORTUM TO SELL UNIT,1999-10-09,article,News,,"['Mergers, Acquisitions and Divestitures']"
Florida State Copes With Warrick Out,1999-10-09,article,News,,[]
"In California, a Fight Over a Road's Final Miles",1999-10-09,article,News,,[]
A Victory for Patients,1999-10-09,article,Editorial,,[]
Letting Patients Sue H.M.O.'s,1999-10-09,article,Letter,,[]
DIMINISHED BRAZILIAN INFLATION,1999-10-09,article,News,,"['Prices (Fares, Fees and Rates)', 'Economic Conditions and Trends']"
Catholic Hospital Merger,1999-10-09,article,Letter,,[]
Court Rules Pinochet Can Be Extradited,1999-10-09,article,Summary,,[]
CANADA JOBLESSNESS DECLINES,1999-10-09,article,News,,"['LABOR', 'Unemployment']"
Rapper Attitude in Designer Diamonds and Furs : Ghetto Fabulous Goes Global,1999-10-09,article,News,,[]
Printer Accused of Forging Yankees Tickets,1999-10-09,article,News,,"['Baseball', 'Playoff Games', 'Printing and Allied Trades', 'Counterfeit Merchandise']"
"Daniel Griffiths, 82, Dean of N.Y.U. School",1999-10-09,article,Obituary; Biography,,[]
Marching in the Vanguard,1999-10-09,article,Review,,[]
Government Panel Says Train in London Crash Ran Red Light,1999-10-09,article,News,,"['Accidents and Safety', 'PADDINGTON STATION (LONDON)', 'Privatization', 'Railroads']"
"Double-Parking, by the Rules",1999-10-09,article,Letter,,[]
Shake-Up at the Top as Natwest Tries to Thwart Hostile Bid,1999-10-09,article,News,,"['Suspensions, Dismissals and Resignations', 'Appointments and Executive Changes', 'Mergers, Acquisitions and Divestitures', 'Biographical Information', 'Banks and Banking']"
Talks Continue on Ford Motor Contract,1999-10-09,article,News,,[]
"In China's Boom, Rural Poor Feel a Widening Gap",1999-10-09,article,Series,,"['AGRICULTURE', 'GEOGRAPHIC PROFILES', 'Grain', 'Economic Conditions and Trends', 'Rural Areas']"
"Oil Prices Drop Some More, but Trend Is Seen as Temporary",1999-10-09,article,News,,[]
"Citibank Manager Accused of Stealing $500,000",1999-10-09,article,News,,"['Embezzlement', 'Banks and Banking']"
Cone's Future as a Yankee Unclear,1999-10-09,article,News,,[]
Chip Progress Forecast to Hit A Big Barrier,1999-10-09,article,News,,"['Computer Chips', 'TRANSISTORS', 'Miniaturization', 'Silicon', 'Forecasts', 'Computers and the Internet']"
"Paid Notice: Deaths  HANDROS, CELE L.",1999-10-09,article,Paid Death Notice,,[]
Witness Tearfully Describes Fatal Subway Shoving,1999-10-09,article,News,,"['Subways', 'Murders and Attempted Murders', 'Transit Systems']"
PRESIDENT ASKING SENATE TO DELAY VOTE ON TEST BAN,1999-10-09,article,News,,"['ATOMIC WEAPONS', 'Nuclear Tests', 'ARMS CONTROL AND LIMITATION AND DISARMAMENT', 'Treaties']"
Job Growth Falters in Possible Sign That Economy Is Starting to Slow,1999-10-09,article,News,,"['LABOR', 'Wages and Salaries', 'Unemployment']"
Gap Inc. Looks Vulnerable as Sales Decline at Its Flagship Stores,1999-10-09,article,News,,['Finances']
"Paid Notice: Deaths  FRIESNER, BEATRICE",1999-10-09,article,Paid Death Notice,,[]
"Paid Notice: Deaths  LEVIN, ALBERT",1999-10-09,article,Paid Death Notice,,[]
QUOTATION OF THE DAY,1999-10-09,article,News,,['QUOTATION OF THE DAY']
How Sweden Prospers,1999-10-09,article,Letter,,[]
British Court Rules Pinochet Extraditable for Trial in Spain,1999-10-09,article,News,,"['Extradition', 'Freedom and Human Rights']"
"In Giuliani's City Hall Strategy, Senate Race Rolls Quietly Along",1999-10-09,article,News,,"['Finances', 'Elections']"
Corrections,1999-10-09,article,Correction,,"['Relocation of Business', 'LABOR', 'Correction Stories', 'RELOCATION OF PERSONNEL']"
A Neglected Tudor Classic Finds a New Modern Style,1999-10-09,article,Review,,[]
Corrections,1999-10-09,article,Correction,,"['Sales', 'Automobiles', 'Correction Stories']"
Letting Patients Sue H.M.O.'s,1999-10-09,article,Letter,,[]
"Paid Notice: Deaths  LERNER, ESTHER",1999-10-09,article,Paid Death Notice,,[]
"Samso Journal; In This Energy Project, No Tilting at Windmills",1999-10-09,article,News,,"['Energy and Power', 'Windmills', 'Environment', 'GEOGRAPHIC PROFILES', 'Electric Light and Power']"
"Paid Notice: Deaths  GREENFIELD, EVA MILLER",1999-10-09,article,Paid Death Notice,,[]
"Paid Notice: Deaths  PAXINOS, HARRIET",1999-10-09,article,Paid Death Notice,,[]
"A Mama's Boy, So Helpful But He's Up To No Good",1999-10-09,article,Review,,['MOTION PICTURES']
Ratify the Test Ban Treaty,1999-10-09,article,Letter,,[]
"For Luxury Brands, Bottom-Line Problem Is Growth : High-Stakes Acquisitions Race",1999-10-09,article,News,,[]
"Paid Notice: Memorials  FEDERMAN, IZZY",1999-10-09,article,Paid Death Notice,,[]
Arguments Heard in Museum's Legal Battle With Mayor,1999-10-09,article,News,,"['Censorship', 'Finances', 'Freedom of Speech and Expression', 'Art']"
Woman Is Named Editor of A.M.A. Journal,1999-10-09,article,News,,[]
The New Yorker's Bill of Rights,1999-10-09,article,Op-Ed,,[]
Corrections,1999-10-09,article,Correction,,"['Correction Stories', 'Theater']"
Religion Journal; Humanist Jewish Group Welcomes a New Rabbi,1999-10-09,article,News,,"['ATOMIC WEAPONS', 'JEWS', 'Treaties', 'BIRMINGHAM TEMPLE (FARMINGTON HILLS, MICH)', 'Women']"
"Paid Notice: Deaths  SENFELD, S. WILLIAM",1999-10-09,article,Paid Death Notice,,[]
"Paid Notice: Deaths  HILL, FRANCES",1999-10-09,article,Paid Death Notice,,[]
Militiamen's Attack on Australian Peacekeepers 'Bodes Ill for Future' : Timor Ambush:Start of a Long War?,1999-10-09,article,News,,[]
Sports of The Times; Whispers Are Getting Louder,1999-10-09,article,News,,[]
Xerox Warns That Results Will Be Short Of Projections,1999-10-09,article,News,,['Finances']
BRIGHTENED MALAYSIA OUTLOOK,1999-10-09,article,News,,"['Ratings and Rating Systems', 'Credit', 'Economic Conditions and Trends']"
"Heart of Tony Bennett's World, Forever on a String",1999-10-09,article,Review,,[]
"Ali Wins, but the Fight Isn't the Greatest",1999-10-09,article,News,,[]
Clinton Visit Shows Warmth of Canadian Ties,1999-10-09,article,News,,"['United States International Relations', 'International Trade and World Market', 'UNITED STATES FOREIGN SERVICE', 'Oil (Petroleum) and Gasoline', 'Travel and Vacations']"
"Plenty of Quirks and Tenses, but Not a Film Star in Sight",1999-10-09,article,News,,[]
"Double-Parking, by the Rules",1999-10-09,article,Letter,,[]
"Paid Notice: Deaths  GULDIN, ANITA",1999-10-09,article,Paid Death Notice,,[]
"Double-Parking, by the Rules",1999-10-09,article,Letter,,[]
First Autumn Fire,1999-10-09,article,Editorial,,[]
Man Charged in Bombing Of U.S. Embassy in Africa,1999-10-09,article,News,,"['United States International Relations', 'Bombs and Explosives', 'UNITED STATES FOREIGN SERVICE', 'Restaurants', 'Terrorism']"
"Paid Notice: Deaths  HURWITZ, RUTH",1999-10-09,article,Paid Death Notice,,[]
COMPANY BRIEFS,1999-10-09,article,News,,[]
"Shouting Protesters Surround, and Startle, the Mayor at City Hall",1999-10-09,article,News,,"['Colleges and Universities', 'Demonstrations and Riots']"
Key Rates,1999-10-09,article,Statistics,,[]
Politics Threatens Brazilian Utility Sales,1999-10-09,article,News,,"['Suspensions, Dismissals and Resignations', 'Privatization', 'Boards of Directors', 'Politics and Government', 'Electric Light and Power']"
"Paid Notice: Deaths  FISHER, STANLEY",1999-10-09,article,Paid Death Notice,,[]
Holiday on Monday,1999-10-09,article,Schedule,,[]
Strong Debut for E-Stamp,1999-10-09,article,News,,[]
"Labor, Revitalized With New Recruiting, Has Regained Power and Prestige",1999-10-09,article,News,,[]
Beyond Testing: Senators' Views on U.S. Role in World,1999-10-09,article,Text,,"['ATOMIC WEAPONS', 'Nuclear Tests', 'ARMS CONTROL AND LIMITATION AND DISARMAMENT', 'Treaties']"
"Paid Notice: Memorials  KONKOY, WILLIAM J.",1999-10-09,article,Paid Death Notice,,[]
Two Sleepwalkers Wake Up Their Team,1999-10-09,article,News,,[]
OWNERSHIP RULES IN CABLE INDUSTRY LOOSENED BY F.C.C.,1999-10-09,article,News,,"['Mergers, Acquisitions and Divestitures', 'Standards and Standardization', 'Television', 'ANTITRUST ACTIONS AND LAWS', 'Prices (Fares, Fees and Rates)', 'Consumer Protection', 'Regulation and Deregulation of Industry', 'Telephones and Telecommunications', 'Computers and the Internet']"
"For Giants, It's Difficult to Forget '50'",1999-10-09,article,News,,[]
Corrections,1999-10-09,article,Correction,,"['Entertainment and Amusements', 'Correction Stories']"
Taking the Money Out of Politics,1999-10-09,article,Letter,,[]
"Paid Notice: Deaths  ZOROVICH, ANTHONY D.",1999-10-09,article,Paid Death Notice,,[]
Clemens Ready to Mess With Texas,1999-10-09,article,News,,[]
The View From City Hall Park,1999-10-09,article,Editorial,,[]
Gidone Busch Killing,1999-10-09,article,Letter,,[]
Politicking Gone Too Far,1999-10-09,article,Letter,,[]
Just Where Do We Belong? The Agony of Weak Misfits,1999-10-09,article,News,,[]
"Paid Notice: Deaths  LEVY, HARRY",1999-10-09,article,Paid Death Notice,,[]
WORLD BRIEFING,1999-10-09,article,News,,[]
PHELPS DODGE WILL NOT RAISE OFFER FOR ASARCO,1999-10-09,article,News,,[]
THE MARKETS: CURRENCIES,1999-10-09,article,News,,[]
"Paid Notice: Deaths  DE TAR, VERNON",1999-10-09,article,Paid Death Notice,,[]
"Paid Notice: Deaths  SCHEMAN, JOAN",1999-10-09,article,Paid Death Notice,,[]
Swollen Thumb Benches Piazza,1999-10-09,article,News,,[]
Judge Assesses State Farm $730 Million in Fraud Case,1999-10-09,article,News,,[]
TRANSACTIONS,1999-10-09,article,List,,[]
"In Neighborhood of Ticket Flurry, Officers Routinely Double-Park",1999-10-09,article,News,,"['Police Brutality and Misconduct', 'Traffic Violations', 'Parking', 'Roads and Traffic']"
Order and the Avant-Garde In Radiant Harmonies,1999-10-09,article,Review,,[]
THE NEW NEW THING,1999-10-09,article,Editors' Note,,[]
"Spectacular Braves Put On a Display, Demoralizing Astros",1999-10-09,article,News,,[]
Surprise in Indian State: Politics of Promising Fails,1999-10-09,article,An Analysis; News Analysis,,"['ELECTION ISSUES', 'Politics and Government', 'Elections', 'Election Results']"
"Paid Notice: Deaths  RUDBART, MILTON",1999-10-09,article,Paid Death Notice,,[]
24/7 MEDIA SHARES RISE ON SPECULATION OF TAKEOVER,1999-10-09,article,News,,[]
"Paid Notice: Deaths  LEVY, DAVID",1999-10-09,article,Paid Death Notice,,[]
Chechens Report Repelling Russian Forces in at Least 2 Villages,1999-10-09,article,News,,[]
"As Gore Slips, Top Advisers Second-Guess Early Moves",1999-10-09,article,News,,"['PUBLIC OPINION', 'Presidential Election of 2000']"
New Mexico Bars Creationism From State Curriculum,1999-10-09,article,News,,[]
"Stung by Defeat in House, H.M.O.'s Seek Compromise",1999-10-09,article,News,,[]
Final Tuneups For Breeders' Cup,1999-10-09,article,News,,[]
Words and Pain Are Not Enough to Stop Mets,1999-10-09,article,News,,[]
"Paid Notice: Deaths  COHN, ALFRED",1999-10-09,article,Paid Death Notice,,[]
Political Notes; Another Contender for Queens Borough Presidency,1999-10-09,article,News,,"['Blacks', 'Black People', 'Elections', 'BOROUGH PRESIDENTS']"
An Appraisal; A Newly Renovated City Hall Park Offers a Mix of Bucolic and Bunker,1999-10-09,article,News,,"['Restoration and Rehabilitation', 'Parks and Other Recreation Areas']"
"When a Deadly Virus Takes Flight, Literally",1999-10-09,article,Op-Ed,,[]
EEX IS IN AGREEMENT TO BUY TESORO PETROLEUM,1999-10-09,article,News,,[]
Memphis Mayor Is Re-elected by a Surprisingly Wide Margin,1999-10-09,article,News,,[]
"Gucci Moving to Buy Yves Saint Laurent, Fashion's Biggest Prize",1999-10-09,article,News,,[]
Kenzo's Rousing Send-Off; Margiela's Outsize Wit : Chanel Pumps Up the Volume,1999-10-09,article,News,,[]
Taking the Money Out of Politics,1999-10-09,article,Letter,,[]
A Thinking Bird or Just Another Birdbrain?,1999-10-09,article,News,,"['ANIMALS', 'PARROTS (BIRDS)', 'Language and Languages', 'Birds', 'Intelligence', 'Research']"
O'Neill Expected To Play In Game 3,1999-10-09,article,News,,[]
"Paid Notice: Deaths  SIMON, ARTHUR",1999-10-09,article,Paid Death Notice,,[]
Ambulance Crash Kills 1,1999-10-09,article,News,,"['Accidents and Safety', 'Roads and Traffic', 'SUNRISE HIGHWAY', 'AMBULANCES']"
Airline Again Cuts Travel Agent Fees,1999-10-09,article,News,,[]
"Paid Notice: Deaths  MCGOVERN, MARIE V. (NEE GOUGH)",1999-10-09,article,Paid Death Notice,,[]
Police Official Blames News Coverage for Murder Increase,1999-10-09,article,News,,"['Murders and Attempted Murders', 'News and News Media']"
"Quietly, Baines Just Keeps Hitting",1999-10-09,article,News,,[]
Carmazzi Throws For 5 Touchdowns,1999-10-09,article,News,,[]
"Paid Notice: Deaths  TURKEWITZ, GRACE",1999-10-09,article,Paid Death Notice,,[]
Sliding From Slinky Waltzes Into Sticky Spider Webs,1999-10-09,article,Review,,[]
Washington Talk; Standing Still on Campaign Finance,1999-10-09,article,News,,[]
Van Horn Returns To Practice,1999-10-09,article,News,,[]
Kinder Dyes Bolster a Global Trend That Appeals to All Ages : Now It's Natural to Color Hair,1999-10-09,article,News,,[]
"Paid Notice: Deaths  STATEMAN, ETHAN",1999-10-09,article,Paid Death Notice,,[]
"Paid Notice: Deaths  FORMAN, LILYANN",1999-10-09,article,Paid Death Notice,,[]
Fashion Houses Back French Culture : Patronage by Design,1999-10-09,article,News,,[]
Corrections,1999-10-09,article,Correction,,['Correction Stories']
"Paid Notice: Deaths  GITENSTEIN, MILTON P.",1999-10-09,article,Paid Death Notice,,[]
Rangers' Top Line Finds Its Offense,1999-10-09,article,News,,[]
AMERICAN HOME ADOPTS MEASURE AGAINST TAKEOVERS,1999-10-09,article,News,,[]
Image-Makers Steal the Scene : Hold That Pose,1999-10-09,article,News,,[]
HYUNDAI UNION VOTES TO STRIKE,1999-10-09,article,News,,"['Automobiles', 'LABOR', 'Strikes']"
Gay Rights in California,1999-10-09,article,Editorial,,[]
Dispute Delays Release of Palestinian Prisoners,1999-10-09,article,News,,"['Palestinians', 'Prisons and Prisoners', 'Terrorism']"
Gidone Busch Killing,1999-10-09,article,Letter,,[]
"Sports of The Times; Davis, a Real Battler, Hits the Spot",1999-10-09,article,News,,[]
NEWS SUMMARY,1999-10-09,article,Summary,,[]
"Famed Cuban Band Is Set to Perform in Miami, and the Overtone Is One of Strain",1999-10-09,article,News,,[]
"On Line All the Time, With Delivery to Match",1999-10-10,article,News,,"['Delivery Services', 'RETAIL STORES AND TRADE', 'Computers and the Internet']"
Collins Will Give Giants The Risk for the Reward,1999-10-10,article,News,,[]
Bottled Sociability,1999-10-10,article,Review,,"['Reviews', 'Wines', 'ALCOHOLIC BEVERAGES']"
