headline,date,doc_type,material_type,section,keywords
Drumming Along,1999-10-24,article,News,,['Music']
A Linguistic Big Bang,1999-10-24,article,News,,"['Deafness', 'Sign Language', 'Nicaraguan Sign Language', 'Children and Youth', 'Education and Schools', 'Special Education (Handicapped)', 'Language and Languages']"
"Paid Notice: Deaths  GLUCK, RUTH RUBIN",1999-10-24,article,Paid Death Notice,,[]
Fishing Gear Makers Are Now a Prize Catch,1999-10-24,article,News,,[]
"Paid Notice: Deaths  WOLFF, BARBARA E.",1999-10-24,article,Paid Death Notice,,[]
A Desire Named Streetcar,1999-10-24,article,News,,"['TROLLEY CARS', 'Transit Systems']"
"Paid Notice: Memorials  CIRKER, MINETTE",1999-10-24,article,Paid Death Notice,,[]
"Paid Notice: Deaths  GREENBERG, JOSEPH L.",1999-10-24,article,Paid Death Notice,,[]
Behind the Mysteries of Masks,1999-10-24,article,News,,[]
"Stars in Their Eyes; 'The Bus Would Pull Into Port Authority, and I Would Feel the Buzz.'",1999-10-24,article,Biography,,['Biographical Information']
"Stars in Their Eyes; 'I Sort of Follow People Around. At Night, I'm One of the Flock.'",1999-10-24,article,Biography,,['Biographical Information']
Another Company Gives Up Its State Flag,1999-10-24,article,News,,"['Electric Light and Power', 'Mergers, Acquisitions and Divestitures']"
On the Road to 2000,1999-10-24,article,News,,[]
Revered Catholic Icon Becomes Mysterious Target of Vandals in Los Angeles,1999-10-24,article,News,,"['Hispanic-Americans', 'Vandalism']"
Early Turnovers and Backup Quarterback Win for Army,1999-10-24,article,News,,['Football']
Waiting for Something to Happen,1999-10-24,article,Review,,"['Books and Literature', 'Reviews']"
Something Happened,1999-10-24,article,Review,,"['Reviews', 'Murders and Attempted Murders', 'Books and Literature']"
Helping the Little Guy Fight the Big Guy,1999-10-24,article,News,,[]
"H. Stuart Hughes, 83, Historian Defeated by Kennedy for Senate",1999-10-24,article,Obituary; Biography,,"['Biographical Information', 'Elections', 'Deaths (Obituaries)']"
The Way We Live Now: 10-24-99: Word & Image; Mondays With Morris,1999-10-24,article,News,,['Books and Literature']
Letters to the Editor And a Former Classmate,1999-10-24,article,Letter,,['Education and Schools']
Black Parents Use a Rally to Teach About a History of Hatred,1999-10-24,article,News,,"['Blacks', 'Black People', 'Demonstrations and Riots']"
After Test Ban Vote: Politics and Foreign Policy Tangle,1999-10-24,article,An Analysis; News Analysis,,"['ATOMIC WEAPONS', 'United States International Relations', 'ARMS CONTROL AND LIMITATION AND DISARMAMENT']"
Bookend; Me and Him,1999-10-24,article,News,,['Books and Literature']
October 17-23; Psychologists Unite,1999-10-24,article,News,,[]
"Kara Baker, Matthew Young",1999-10-24,article,News,,['Weddings and Engagements']
October 17-23; 'You Don't Want the Colors to Run',1999-10-24,article,News,,[]
"Motherless and Stranded, Baby Whale Is Put to Death",1999-10-24,article,News,,"['Whales and Whaling', 'Fish and Other Marine Life']"
Bashing The Burbs,1999-10-24,article,Letter,,"['Social Conditions and Trends', 'Suburbs']"
What's So Bad About Hate,1999-10-24,article,Letter,,['Hate Crimes']
Footnotes; Black Studies,1999-10-24,article,News,,[]
Aftereffects Of Columbine Are Claiming New Victims,1999-10-24,article,News,,"['Murders and Attempted Murders', 'Suicides and Suicide Attempts']"
THE GUIDE,1999-10-24,article,Schedule,,[]
"Paid Notice: Deaths  JOHNSON, MATTHEW",1999-10-24,article,Paid Death Notice,,[]
"Paid Notice: Deaths  REISER, ALBERT I., M.D.",1999-10-24,article,Paid Death Notice,,[]
Catering to Wall Street,1999-10-24,article,News,,[]
"For Lease: 10 Acres, Riv Vu",1999-10-24,article,News,,['Squatters']
"Paid Notice: Deaths  SCHEINMAN, DIANA. (NEE FRIEDENBERG)",1999-10-24,article,Paid Death Notice,,[]
U.S. Mediator Extends Effort To Rescue Ulster Accord,1999-10-24,article,News,,[]
"Jessica Tarnow, Kenneth Howard",1999-10-24,article,News,,['Weddings and Engagements']
Barber Thinks He Has What It Takes to Make the Big Play,1999-10-24,article,News,,['Football']
"Paid Notice: Deaths  MORSE, EMILY POTTER",1999-10-24,article,Paid Death Notice,,[]
Late Stand Allows Penn State To Survive,1999-10-24,article,News,,['Football']
"Paid Notice: Deaths  WILSON, WILLIAM H.",1999-10-24,article,Paid Death Notice,,[]
Safety and the S.U.V.,1999-10-24,article,Letter,,"['Accidents and Safety', 'Utility Vehicles and Other Light Trucks', 'Air Pollution']"
"Ms. Kemm, Mr. St. Victor-dePinho",1999-10-24,article,News,,['Weddings and Engagements']
Ideas & Trends: Think Again; How Much Give Can The Brain Take?,1999-10-24,article,News,,['Brain']
"Paid Notice: Memorials  MALBIN, HARRY S.",1999-10-24,article,Paid Death Notice,,[]
"Lisa Lang, Christopher Olsson",1999-10-24,article,News,,['Weddings and Engagements']
Post-Suharto Dawn,1999-10-24,article,An Analysis; News Analysis,,"['Reform and Reorganization', 'Politics and Government', 'Ethics', 'Freedom and Human Rights']"
"-----, She Moaned",1999-10-24,article,Review,,"['Reviews', 'Books and Literature']"
Among the Apes,1999-10-24,article,Review,,"['Books and Literature', 'Biographical Information', 'Monkeys and Apes', 'Reviews']"
"Ms. Winn, Mr. Dworkin",1999-10-24,article,News,,['Weddings and Engagements']
"Herman Farrell 3d, Nancy Jones",1999-10-24,article,News,,['Weddings and Engagements']
MOVIES: CRITICS' CHOICE,1999-10-24,article,News,,[]
"Paid Notice: Deaths  HALL, EDWARD, III",1999-10-24,article,Paid Death Notice,,[]
"If You're Thinking of Living In /Rowayton, Conn.; A Neighborly Enclave on the Sound",1999-10-24,article,News,,"['Housing', 'GEOGRAPHIC PROFILES']"
An Oil Outsider Revives a Cartel,1999-10-24,article,News,,[]
URBAN TACTICS; Snitching On a Snake?,1999-10-24,article,News,,['Reptiles']
Art Club,1999-10-24,article,News,,"['Celebrities', 'Photography']"
INSIDE,1999-10-24,article,Summary,,[]
"Paid Notice: Memorials  LIONNI, LEO",1999-10-24,article,Paid Death Notice,,[]
Thar She Blows! Time for a Swim,1999-10-24,article,News,,[]
Residential Sales,1999-10-24,article,List,,[]
"Paid Notice: Deaths  SCHMIDT, BENNO C.",1999-10-24,article,Paid Death Notice,,[]
"Canarsie Digs Itself a Hole, and Powerful Curtis Climbs Out of It",1999-10-24,article,News,,"['Interscholastic Athletics', 'Football']"
No Small Change as Pension Plans Are Converted,1999-10-24,article,Question,,[]
Alexis Mokotoff and Jon Shapiro,1999-10-24,article,News,,['Weddings and Engagements']
Domestic Unrest,1999-10-24,article,Review,,"['Reviews', 'Books and Literature']"
Barnard's Efforts For a Broadway Block,1999-10-24,article,News,,"['Renting and Leasing', 'RETAIL STORES AND TRADE']"
Israel's Y2K Problem,1999-10-24,article,Letter,,"['Religion and Churches', 'TWO THOUSAND (YEAR)']"
Q. & A.,1999-10-24,article,Question,,[]
Give Us This Day...,1999-10-24,article,News,,['Books and Literature']
"OLYMPICS; U.S.O.C. Authorizes New, Independent Agency to Supervise Drug Tests",1999-10-24,article,News,,"['Olympic Games', 'Drug Abuse and Traffic', 'Tests and Testing', 'Pan American Games', 'OLYMPIC GAMES (2000)']"
Spacey's Subtlety,1999-10-24,article,Letter,,['MOTION PICTURES']
By Popular Demand,1999-10-24,article,Letter,,['Music']
Computer Project Seeks To Avert Youth Violence,1999-10-24,article,News,,"['Murders and Attempted Murders', 'Education and Schools', 'Computers and the Internet']"
University Presses Books in Brief: Nonfiction,1999-10-24,article,Review,,[]
POSTINGS: A $21-Billion Mortgage Initiative; Fannie Mae Eases Loans,1999-10-24,article,News,,"['Mortgages', 'Standards and Standardization', 'IMMIGRATION AND REFUGEES', 'Housing']"
"Paid Notice: Deaths  ORTIZ, PROVIDENCIA R.",1999-10-24,article,Paid Death Notice,,[]
"Paid Notice: Deaths  MATORIN, IRVING",1999-10-24,article,Paid Death Notice,,[]
"Kira Zimmerman, Jeffrey Kerstine",1999-10-24,article,News,,['Weddings and Engagements']
Corrections,1999-10-24,article,Correction,,"['Automobiles', 'Correction Stories']"
"Big Thoughts, Still Uncensored",1999-10-24,article,News,,[]
Numbers That Don't Matter Much These Days,1999-10-24,article,News,,[]
One Man's Home Is Another's Disaster Area,1999-10-24,article,News,,"['Accidents and Safety', 'Chemicals']"
University Presses Books in Brief: Fiction & Poetry,1999-10-24,article,Review,,"['Reviews', 'Books and Literature']"
"Meredith Simpson, Christopher Ernst",1999-10-24,article,News,,['Weddings and Engagements']
Food; Fresh Prince,1999-10-24,article,News,,"['Cooking and Cookbooks', 'Recipes']"
Henry's Series Interest,1999-10-24,article,News,,['Baseball']
"Paid Notice: Deaths  OWENS, GRADY JR.",1999-10-24,article,Paid Death Notice,,[]
New Owner For a Pair Of Papers,1999-10-24,article,News,,"['Newspapers', 'Mergers, Acquisitions and Divestitures']"
Got a Best Friend?,1999-10-24,article,News,,[]
Memorial for Leo Castelli,1999-10-24,article,Obituary; Biography,,"['Art', 'Deaths (Obituaries)']"
The View From/Yorktown; Jazz Party Adds Nuptials As a Surprise Attraction,1999-10-24,article,News,,['Weddings and Engagements']
Trance Casts a Spell Over the Youth Of a Worried Israel,1999-10-24,article,News,,[]
How Much of a River Can a City Claim?,1999-10-24,article,News,,"['Water', 'SUITS AND CLAIMS AGAINST GOVERNMENT']"
"Streetscapes/Appellate Division, 25th Street and Madison Avenue; A Milky White Courthouse With Rooftop Sculptures",1999-10-24,article,News,,"['COURTHOUSES', 'Historic Buildings and Sites', 'Courts', 'Restoration and Rehabilitation']"
An Epidemic of Death,1999-10-24,article,Review,,"['Reviews', 'Books and Literature', 'Suicides and Suicide Attempts']"
Art for Humanity's Sake,1999-10-24,article,Review,,"['Reviews', 'Books and Literature', 'Culture']"
"In Bizarre Ending, Tyson Bout Is Declared a No Contest",1999-10-24,article,News,,['Boxing']
Putting the W's in www,1999-10-24,article,Review,,"['Reviews', 'Books and Literature', 'Computers and the Internet']"
Pop That's Produced Alone at Home Gets Personal,1999-10-24,article,Biography,,[]
NEIGHBORHOOD REPORT: COLUMBUS CIRCLE; A Final Sale That Means Goodbye to the Vendors,1999-10-24,article,News,,"['Vendors, Street', 'Flea Markets', 'Coliseum (Nyc Building)']"
Word for Word/Culture Clash; Martha vs. the W. W. F.: The Final Confit,1999-10-24,article,News,,[]
"Instead of the Singing Telegram, Generators and Cooling Systems",1999-10-24,article,News,,"['Noise', 'Telephones and Telecommunications', 'Computers and the Internet']"
"I'm Irrational, You're Irrational",1999-10-24,article,Review,,"['Books and Literature', 'Reviews']"
INVESTING WITH: James B. Rubin; Resurgence Asset Management,1999-10-24,article,News,,[]
How the Other Half Lived It Up,1999-10-24,article,News,,"['Restaurants', 'Grand Central Terminal (NYC)', 'Restoration and Rehabilitation', 'Railroads', 'Stations and Terminals (Passenger)']"
Ousted Loft Tenants Are Caught Off Guard,1999-10-24,article,News,,"['Accidents and Safety', 'Lofts', 'Evictions', 'Housing']"
Morning Becomes Bryant Gumbel,1999-10-24,article,Biography,,"['Television', 'Biographical Information']"
"Habitats/Lighthouse Hill, Staten Island; A Landmark 1959 Home With All the Wright Stuff",1999-10-24,article,News,,"['Housing', 'ARCHITECTURE']"
"For Israel, Long Denied Full U.N. Privileges, Some Progress",1999-10-24,article,News,,[]
High-Risk Irony Goes in Search of Its Time,1999-10-24,article,Review,,[]
"How to Play The Internet, With Apple",1999-10-24,article,News,,[]
Looming At Center Of Ranger Problems,1999-10-24,article,News,,"['Hockey, Ice']"
Saints and Sinners,1999-10-24,article,Review,,"['Reviews', 'Books and Literature']"
Patching the Safety Net For the Mentally Ill,1999-10-24,article,News,,"['HEALTH MAINTENANCE ORGANIZATIONS AND MANAGED CARE', 'Mental Health and Disorders', 'Hospitals']"
"Paid Notice: Deaths  PRAGER, SYLVIA A. (NEE ALTSCHULER)",1999-10-24,article,Paid Death Notice,,[]
"Melville, a Modern",1999-10-24,article,Letter,,"['Books and Literature', 'Theater']"
"O'Neill Gets His Wish, and He Might Even Be Happy",1999-10-24,article,News,,"['Baseball', 'World Series']"
Sublimity in Simplicity,1999-10-24,article,Letter,,['MOTION PICTURES']
How to Build Atop a Building,1999-10-24,article,News,,"['Housing', 'Building (Construction)']"
"Maddux Steps In, And Can't Quite Win",1999-10-24,article,News,,"['Baseball', 'World Series']"
"Paid Notice: Memorials  FEDERICO, GENE",1999-10-24,article,Paid Death Notice,,[]
The Goodbye Guy,1999-10-24,article,Review,,"['Reviews', 'Books and Literature', 'Biographical Information', 'Theater']"
"Paid Notice: Deaths  EPSTEIN, JACK",1999-10-24,article,Paid Death Notice,,[]
Entrenched,1999-10-24,article,Review,,"['Reviews', 'Books and Literature']"
"Paid Notice: Deaths  WAGSHUL, RUTH",1999-10-24,article,Paid Death Notice,,[]
Was It Really a Game?,1999-10-24,article,Letter,,['Books and Literature']
Arnott's Injury Slows the Devils,1999-10-24,article,News,,"['Hockey, Ice']"
"Paid Notice: Deaths  METCALF, GEORGE S.",1999-10-24,article,Paid Death Notice,,[]
A Gallery for Those Just Getting Started,1999-10-24,article,News,,['Art']
Nassau Budget Crisis Opens the Political Field,1999-10-24,article,News,,"['Finances', 'ELECTION ISSUES', 'Budgets and Budgeting', 'Elections']"
A Need for Child Care,1999-10-24,article,Letter,,"['United States Economy', 'Child Care']"
Fidelity's Big Three Look Bullish on Technology,1999-10-24,article,News,,[]
Refining the Financing For Special Education,1999-10-24,article,Letter,,"['Equal Educational Opportunities', 'Education and Schools', 'Finances', 'Special Education (Handicapped)']"
Flexibility in Temporary Work,1999-10-24,article,Letter,,"['LABOR', 'Employment Agencies', 'UNIONIZATION', 'Temporary Employment', 'Computers and the Internet']"
"Beyond Irving and Cheever; Westchester Writers Abound, Drawing Inspiration From the Suburban Muse",1999-10-24,article,News,,['Books and Literature']
McCain Welcomes Rival To Web Site,1999-10-24,article,News,,"['Presidential Election of 2000', 'Computers and the Internet']"
October 17-23; A Faulty Antidote,1999-10-24,article,News,,[]
University Presses Books in Brief: Fiction & Poetry,1999-10-24,article,Review,,"['Reviews', 'Books and Literature']"
A Decade in Hell,1999-10-24,article,Review,,"['Reviews', 'Books and Literature', 'Biographical Information']"
Their Mission In Hitler's Europe: Save the Children,1999-10-24,article,News,,[]
Pro Arte Begins 27th Season,1999-10-24,article,Review,,[]
"Can't Tell His Age, Can't Hit His Pitches: El Duque Is Baffling",1999-10-24,article,News,,"['Baseball', 'Biographical Information', 'World Series']"
"BEST SELLERS: October 24, 1999",1999-10-24,article,List,,[]
Television Focuses on Africa's Human History,1999-10-24,article,News,,[]
"Parcells to Start Mirer Again Today, but for How Long?",1999-10-24,article,News,,['Football']
New School on the Block Discovers Trouble Next Door,1999-10-24,article,News,,"['Accidents and Safety', 'Education and Schools']"
An Italian Old-Timer That's Bounced Back,1999-10-24,article,Review,,"['Reviews', 'Restaurants']"
"Miss Edmund, Dr. Alvarado",1999-10-24,article,News,,['Weddings and Engagements']
Herons Replace Hoodlums At a Park With a Pond,1999-10-24,article,News,,['Parks and Other Recreation Areas']
Jury Adjourns in Trial Of Garage Developer,1999-10-24,article,News,,['Murders and Attempted Murders']
The Nation; Playing It Safe Can Sure Be Risky,1999-10-24,article,News,,"['Baseball', 'Playoff Games']"
Walking a Mile in Vanderbilt's Golf Shoes,1999-10-24,article,News,,"['Historic Buildings and Sites', 'Restoration and Rehabilitation', ""EAGLE'S NEST GOLF COURSE (CENTERPORT, NY)"", 'Golf']"
Detour to Angelfish And a Patron Saint,1999-10-24,article,News,,[]
October 17-23; Indicting McDonnell Douglas,1999-10-24,article,News,,[]
Sports of The Times; El Duque Provides Some New Series Memories,1999-10-24,article,News,,"['Baseball', 'World Series']"
A Call for Replay,1999-10-24,article,Letter,,"['Baseball', 'Playoff Games', 'Umpires']"
Using Baseball for a Greater Message,1999-10-24,article,News,,"['Baseball', 'Blacks', 'Black People']"
"Paid Notice: Deaths  LUTIN, SIDNEY B.",1999-10-24,article,Paid Death Notice,,[]
Schuerholz Thrives As Expectations Rise,1999-10-24,article,News,,"['Baseball', 'Playoff Games', 'Biographical Information', 'World Series']"
"Paid Notice: Deaths  GLASSER, CAROL",1999-10-24,article,Paid Death Notice,,[]
"Paid Notice: Deaths  BLAU, HAROLD",1999-10-24,article,Paid Death Notice,,[]
VOTES IN CONGRESS,1999-10-24,article,List,,[]
Bashing The Burbs,1999-10-24,article,Letter,,"['MOTION PICTURES', 'Theater']"
A Night for Spectral Pleasures,1999-10-24,article,News,,[]
Impaired Vision,1999-10-24,article,Letter,,['Theater']
Where On-Line Traders Find Satisfaction,1999-10-24,article,News,,[]
Throwaway Cities,1999-10-24,article,Review,,"['Books and Literature', 'Urban Areas', 'Suburbs', 'Reviews']"
"Paid Notice: Deaths  BAYLIS, DOROTHY S. (NEE SMITH)",1999-10-24,article,Paid Death Notice,,[]
More Flights To the Caribbean,1999-10-24,article,News,,[]
Board Election a Factor In Redistricting Power,1999-10-24,article,News,,"['Politics and Government', 'REAPPORTIONMENT', 'Elections']"
"A NIGHT OUT WITH/The Buena Vista Social Club; Noche de La Habana, Wherever They Go",1999-10-24,article,News,,['Music']
Early Turnovers and Backup Quarterback Win for Army,1999-10-24,article,News,,['Football']
Commercial Property /111 Eighth Avenue; Developers Taking a Manhattan Formula to Chicago,1999-10-24,article,News,,"['Warehouses', 'OFFICE BUILDINGS']"
QUOTATION OF THE DAY,1999-10-24,article,News,,['QUOTATION OF THE DAY']
"Stars in Their Eyes; Despite Rising Housing Costs, New York Remains a Magnet for the Young",1999-10-24,article,News,,"['Housing', 'Renting and Leasing']"
"Rebuffing West, Russia Pounds Chechnya",1999-10-24,article,News,,['INDEPENDENCE MOVEMENTS AND SECESSION']
"Alissa Churchill, Thomas Carley",1999-10-24,article,News,,['Weddings and Engagements']
"David Holbrook, Andrea Kline-Greif",1999-10-24,article,News,,['Weddings and Engagements']
Leather Jackets,1999-10-24,article,News,,['APPAREL']
America's Other Motherland,1999-10-24,article,Review,,"['Books and Literature', 'Reviews', 'Television']"
The Collector,1999-10-24,article,Letter,,['Art']
"Paid Notice: Deaths  BONO, LUDWIG P.",1999-10-24,article,Paid Death Notice,,[]
Bradley Relies On Wall Street To Raise Funds,1999-10-24,article,News,,"['Political Action Committees', 'Reform and Reorganization', 'Finances', 'Presidential Election of 2000', 'BUSINESS ROLE IN POLITICS']"
Room at the Inn In the Holy Land,1999-10-24,article,News,,[]
A Toothless Ban Barely Nibbles at Big Rigs,1999-10-24,article,News,,"['Trucks and Trucking', 'Roads and Traffic']"
The Quiet Help Of Family Members,1999-10-24,article,News,,[]
Ninepins Rallies For Second Victory,1999-10-24,article,News,,"['Horse Racing', ""BREEDERS' CUP GRAND NATIONAL STEEPLECHASE"", 'STEEPLECHASE RACING']"
Foreign Affairs; Playing Russian Roulette,1999-10-24,article,Op-Ed,,"['Politics and Government', 'Stocks and Bonds', 'Economic Conditions and Trends']"
Venture Capital Crooning,1999-10-24,article,News,,[]
Palermo Court Rules in Favor Of Andreotti,1999-10-24,article,News,,"['Organized Crime', 'Decisions and Verdicts']"
Teachers: the Experienced And the New Are Needed,1999-10-24,article,Letter,,"['Education and Schools', 'Wages and Salaries', 'Teachers and School Employees']"
'Hitler's Pope',1999-10-24,article,Letter,,"['Books and Literature', 'Nazi Policies Toward Jews and Minorities']"
"Antoinetta Chieco, Michael Cutrona",1999-10-24,article,News,,['Weddings and Engagements']
The Fun and Games of Living a Virtual Life,1999-10-24,article,Review,,[]
The Untouchables,1999-10-24,article,Review,,"['Reviews', 'Books and Literature']"
Cancer Study,1999-10-24,article,News,,"['Diet and Nutrition', 'Breasts', 'Cancer', 'Oils and Fats', 'Research']"
Ariane Schreiber and Jeffrey Horn,1999-10-24,article,News,,['Weddings and Engagements']
Remembering Slavery,1999-10-24,article,Letter,,"['Slavery', 'Blacks', 'Black People', 'Monuments and Memorials']"
East Timor's Aftermath,1999-10-24,article,News,,[]
"Hardaway's Career Enters Third Act, With Kidd a Co-Star",1999-10-24,article,News,,['Basketball']
NEWS SUMMARY,1999-10-24,article,Summary,,[]
Year 2000 Activists Share Tales of Public Apathy,1999-10-24,article,News,,"['TWO THOUSAND (YEAR)', 'Computers and the Internet']"
Ties to Sierra Leone,1999-10-24,article,Letter,,"['United States International Relations', 'SIERRA LEONE-INTERNATIONAL RELATIONS-US', 'Politics and Government', 'Civil War and Guerrilla Warfare']"
Officials Call for Defeat of Pipeline,1999-10-24,article,News,,"['Gas (Fuel)', 'Pipelines']"
"Ms. Shanahan, Mr. Brecher",1999-10-24,article,News,,['Weddings and Engagements']
Housing Development To Be Privately Owned,1999-10-24,article,News,,"['Public Housing', 'Housing']"
"As Oil Prices Rise, So Could Heating Bills",1999-10-24,article,News,,"['HEATING FUEL', 'Oil (Petroleum) and Gasoline', 'Prices (Fares, Fees and Rates)', 'Forecasts']"
What Time Is It in the Transept?,1999-10-24,article,Review,,"['Sun', 'Calendars', 'Reviews', 'Books and Literature', 'Seasons and Months', 'Astronomy and Astrophysics']"
The Unrecognized,1999-10-24,article,Letter,,"['RECORDINGS (AUDIO)', 'Music']"
A British Web Site Offers Y2K Alerts,1999-10-24,article,News,,[]
The 18-Year Itch,1999-10-24,article,Review,,"['Reviews', 'Books and Literature']"
"Paid Notice: Memorials  KITCHEN, ELLEN C.",1999-10-24,article,Paid Death Notice,,[]
OPINION; Taking a Stand on Nassau's Budget,1999-10-24,article,News,,"['Ethics', 'Finances', 'Budgets and Budgeting', 'Politics and Government']"
The Nation: Encyclopedia Green; The High Road at a High Cost,1999-10-24,article,News,,"['Encyclopedias', 'Computers and the Internet']"
PERSONAL BUSINESS; Guidance For the Uninsured,1999-10-24,article,News,,[]
"The Sound of the Symphony, in a Box",1999-10-24,article,News,,[]
Twists and Turns in a Writer's Imagination,1999-10-24,article,Review,,"['Reviews', 'Theater']"
Nuclear Leak Report,1999-10-24,article,News,,"['Accidents and Safety', 'Indian Point Nuclear Power Plant (NY)', 'ATOMIC ENERGY']"
EVENING HOURS,1999-10-24,article,News,,[]
Having a Ball,1999-10-24,article,News,,[]
Mattingly Considers Returning to Yanks,1999-10-24,article,News,,[]
University Presses Books in Brief: Fiction & Poetry; Cozy but Not Comfy,1999-10-24,article,Review,,"['Reviews', 'Books and Literature']"
Emergency Response,1999-10-24,article,News,,"['HURRICANE FLOYD', 'Hurricanes and Tropical Storms']"
Communicating Through Photographs,1999-10-24,article,Review,,"['Reviews', 'Photography']"
Household Chores,1999-10-24,article,Letter,,['Mental Health and Disorders']
NEIGHBORHOOD REPORT: CHINATOWN; A Bermuda Triangle for Pedestrians at Chatham Square,1999-10-24,article,News,,"['Roads and Traffic', 'Accidents and Safety']"
Liberties; Why Can't a Woman . . .,1999-10-24,article,Op-Ed,,['Presidential Election of 2000']
Mauresmo in Final Without Playing,1999-10-24,article,News,,"['Tennis', 'EUROTEL INDOOR TENNIS TOURNAMENT']"
San Diego,1999-10-24,article,News,,[]
Clinton's Successes In Foreign Policy,1999-10-24,article,Letter,,['United States International Relations']
Violence Isn't Stylish,1999-10-24,article,Letter,,['MOTION PICTURES']
Not Time Yet To Put Tools Away,1999-10-24,article,News,,['Gardens and Gardening']
FIVE QUESTIONS: for JUAN SOMAVIA; Making Markets Work for All,1999-10-24,article,Interview,,[]
New Jersey Ranked Low On Insuring Children,1999-10-24,article,News,,"['HEALTH INSURANCE', 'Children and Youth', 'Medicine and Health']"
Finding My Body Beautiful's Limits,1999-10-24,article,News,,['Exercise']
Do the Right Thing,1999-10-24,article,Review,,"['Reviews', 'Books and Literature']"
"Paid Notice: Deaths  SPATT, SONDRA",1999-10-24,article,Paid Death Notice,,[]
What's So Bad About Hate,1999-10-24,article,Letter,,"['Crime and Criminals', 'Hate Crimes']"
Corrections,1999-10-24,article,Correction,,"['MOTION PICTURES', 'Correction Stories']"
"WARY OF ABUSES, U.S. SHARPLY CUTS VISAS FOR RUSSIANS",1999-10-24,article,News,,"['United States International Relations', 'IMMIGRATION AND REFUGEES', 'RUSSIA-INTERNATIONAL RELATIONS-US']"
University Presses Books in Brief: Nonfiction,1999-10-24,article,Review,,"['Books and Literature', 'Reviews', 'Music']"
"The Traveler, Redefined as Travel Agent",1999-10-24,article,News,,[]
South Africa Moves To Cut Highway Deaths,1999-10-24,article,News,,[]
When Late Is Too Late,1999-10-24,article,News,,[]
Sports of The Times; The Origin of a Series That Might Have Been,1999-10-24,article,News,,"['Baseball', 'Biographical Information', 'World Series']"
Israeli Military Aid,1999-10-24,article,Letter,,"['ARMAMENT, DEFENSE AND MILITARY FORCES']"
"Paid Notice: Deaths  OLIVER, ROSE",1999-10-24,article,Paid Death Notice,,[]
Striving to Become Israel's Louvre,1999-10-24,article,Biography,,[]
A Fault-Free Show By Thin Air,1999-10-24,article,News,,"['PENNSYLVANIA NATIONAL HORSE SHOW', 'HORSE SHOWS']"
Plans for New Power Plants Spur Fears in Asthma Valley,1999-10-24,article,News,,"['Electric Light and Power', 'Air Pollution']"
Redistricting Raises States' Election Stakes,1999-10-24,article,News,,"['REAPPORTIONMENT', 'Elections']"
"Scary Once, Scary Again",1999-10-24,article,News,,"['MOTION PICTURES', 'Halloween']"
The World; A Glimpse of the Future In the Pain of Today,1999-10-24,article,News,,"['Politics and Government', 'Civil War and Guerrilla Warfare']"
The Way We Live Now: 10-24-99; What They Were Thinking,1999-10-24,article,News,,['Photography']
October 17-23; Campaign Reform Loses In the Senate,1999-10-24,article,News,,[]
"Oh, What a Web . . .",1999-10-24,article,News,,"['Baseball', 'Coaches and Managers', 'Computers and the Internet']"
"Ms. Chamberlin, Mr. Commander",1999-10-24,article,News,,['Weddings and Engagements']
Separating the Pilgrims From the Puritans,1999-10-24,article,Letter,,['Puritans']
Doing What the Islands Do Best,1999-10-24,article,News,,[]
