headline,date,doc_type,material_type,section,keywords
A Battle for the Skies,2001-04-15,article,News,,[]
"Affirmative Action, Without the Program",2001-04-15,article,Letter,,[]
April 8-14; Riots in Cincinnati,2001-04-15,article,News,,[]
REVIEW OF DELAWARE DREDGING,2001-04-15,article,News,,[]
"Paid Notice: Deaths  WILSON, WILLIAM D.",2001-04-15,article,Paid Death Notice,,[]
Cajun Cotillion,2001-04-15,article,Letter,,[]
Willows: Surprising In Variety,2001-04-15,article,News,,[]
TEACHERS' MINIMUM PAY,2001-04-15,article,News,,[]
Songwriter-Playwright Takes a Crack at Community Theater,2001-04-15,article,News,,[]
An Accent The French Don't Mind,2001-04-15,article,News,,"['MOTION PICTURES', 'Biographical Information']"
"Paid Notice: Deaths  WHITTELSEY, DANIEL CHAUNCEY",2001-04-15,article,Paid Death Notice,,[]
Navy Pilot Thought His Plane Was Doomed After Collision,2001-04-15,article,News,,[]
Corrections,2001-04-15,article,Correction,,[]
"Jacob Getzels, 89, Educator And Researcher on Creativity",2001-04-15,article,Obituary; Biography,,[]
A Doyenne of Macdougal St. Lays Down Her Omelet Pan,2001-04-15,article,News,,[]
BackTalk; Baseball Film Faithful to Father's Memory,2001-04-15,article,News,,[]
Article 2001041592343841620 -- No Title,2001-04-15,article,News,,[]
Crowning a Winner In Robotics Competition,2001-04-15,article,Letter,,[]
Angry Beijing Denounces Washington's Reports That Its Pilot Caused the Collision,2001-04-15,article,News,,[]
Pity Jackson Hole,2001-04-15,article,Letter,,[]
"Diana Caskey, Lawrence Good",2001-04-15,article,News,,['Weddings and Engagements']
"Paid Notice: Deaths  LEFF, LILLIAN M.",2001-04-15,article,Paid Death Notice,,[]
Radical Thinking,2001-04-15,article,Letter,,['Books and Literature']
A Crisis of Fakes,2001-04-15,article,Letter,,[]
Political Briefing; A Kennedy Sets Out To Mend Some Fences,2001-04-15,article,News,,[]
Ideas & Trends: Crash Course; A New President Bumps Up Against Asia,2001-04-15,article,News,,[]
"Paid Notice: Deaths  BERKOWITZ, IRWIN B.",2001-04-15,article,Paid Death Notice,,[]
Immobile on the Subway,2001-04-15,article,Letter,,[]
The Bismarck's Grave,2001-04-15,article,News,,[]
"At Taj Mahal, Drawing All Ages",2001-04-15,article,News,,[]
Instilling Some Pride In Police on the Beat,2001-04-15,article,Letter,,[]
Changing Landscape,2001-04-15,article,Letter,,['Music']
When Nowhere Is the Place to Be,2001-04-15,article,News,,[]
"Kavita Verma, Sandeep Thakrar",2001-04-15,article,News,,['Weddings and Engagements']
"Nobody Knows Your Name, and Keep It That Way",2001-04-15,article,News,,[]
Mayor Scoffs at Arrest Complaints,2001-04-15,article,News,,"['Art', 'Police', 'Sex Crimes', 'Discrimination']"
"New York's Taxes, Vast and Uneven",2001-04-15,article,Letter,,[]
New Jersey's Own at Appel Farm,2001-04-15,article,News,,[]
"Paid Notice: Deaths  CLAYSON, DAVID, DR.",2001-04-15,article,Paid Death Notice,,[]
Chargers Facing a Quandary on Draft Day,2001-04-15,article,News,,[]
BENEFITS,2001-04-15,article,Schedule,,[]
Symbol U. Brings Classes to a Corporate Campus,2001-04-15,article,News,,[]
Luggage That Does Tricks,2001-04-15,article,News,,[]
"Reporter's Notebook; Achy Joints and All, Aging Loan Sharks Still Talk Tough",2001-04-15,article,News,,[]
"Ideas & Trends; 150 Years Later, Latinos Finally Hit the Mainstream",2001-04-15,article,News,,[]
Alisha Tlumacki and John Head,2001-04-15,article,News,,['Weddings and Engagements']
Retreats That Renew In Old Ways,2001-04-15,article,News,,[]
"Private Sector; Flying Americans Home, And Reaping Bonus Miles",2001-04-15,article,News,,[]
Article 2001041591402831038 -- No Title,2001-04-15,article,News,,[]
New Job Prospect for Officer in Diallo Case Fuels Debate,2001-04-15,article,News,,[]
"Paid Notice: Deaths  CANTOR, ARTHUR",2001-04-15,article,Paid Death Notice,,[]
"Private Sector; New City, New Best Friend?",2001-04-15,article,News,,[]
BOOKS IN BRIEF: POETRY,2001-04-15,article,Review,,"['Reviews', 'Books and Literature']"
Slime-Time Ceremony With Star Appeal,2001-04-15,article,News,,[]
F.Y.I,2001-04-15,article,Question,,[]
How to Deliver Bad News,2001-04-15,article,News,,[]
Have You Seen Article?,2001-04-15,article,Letter,,['Books and Literature']
Political Briefing; Green Party's Status Falls in New Mexico,2001-04-15,article,News,,[]
"Paid Notice: Deaths  POLSEN, WILLIAM F.",2001-04-15,article,Paid Death Notice,,[]
"Filipino Rap Debates City Life, Pro and Con",2001-04-15,article,News,,[]
"Paid Notice: Deaths  WEISSMAN, WILLIAM R.",2001-04-15,article,Paid Death Notice,,[]
"The View From/Hartford; To Glimpse The Past, Just Step Into Parlor",2001-04-15,article,News,,[]
Selling Small Arms,2001-04-15,article,Letter,,[]
THE GUIDE,2001-04-15,article,Schedule,,[]
Cats' 'Grandpa' Makes Way for a School,2001-04-15,article,News,,[]
"Once Burned, but Still Bold",2001-04-15,article,News,,"['Computers and the Internet', 'COMPANY AND ORGANIZATION PROFILES', 'Executives and Management', 'Conventions and Conferences']"
"Union Protests Sway Diners, And a Restaurant Closes",2001-04-15,article,News,,[]
BOOKS IN BRIEF: POETRY,2001-04-15,article,Review,,"['Reviews', 'Books and Literature']"
Cornell Freshman Tells Of University's Appeal,2001-04-15,article,Letter,,[]
Footlights,2001-04-15,article,News,,[]
Retreats That Renew In Old Ways,2001-04-15,article,News,,[]
"No Danger in Gas Leak, M.T.A. Says, but Residents Worry",2001-04-15,article,News,,[]
THE GUIDE,2001-04-15,article,Schedule,,[]
Meetings Are Possible Again With Senators Who Interact,2001-04-15,article,News,,[]
An Investor Plunges Into Unknown Territory,2001-04-15,article,News,,[]
"Paid Notice: Deaths  NAROFF, STANLEY",2001-04-15,article,Paid Death Notice,,[]
A Crisis of Fakes,2001-04-15,article,Letter,,[]
Making It Legal to Hail Livery Cabs Where Yellow Fears to Tread,2001-04-15,article,News,,[]
Food; Party Animals,2001-04-15,article,News,,[]
High School Seniors On Joe College's Turf,2001-04-15,article,News,,[]
BOOKS IN BRIEF: POETRY,2001-04-15,article,Review,,"['Reviews', 'Books and Literature']"
The Past Tense of Feel,2001-04-15,article,Review,,"['Reviews', 'Books and Literature']"
Article 2001041591762120665 -- No Title,2001-04-15,article,News,,[]
This Old Thing? I've Had It Forever,2001-04-15,article,News,,[]
Article 2001041592242663380 -- No Title,2001-04-15,article,News,,[]
"Paid Notice: Memorials   RUSSELL, WILLIAM T.",2001-04-15,article,Paid Death Notice,,[]
"INVESTING WITH/Keith A. Lee, Robert E. Hall and Kempton M. Ingersol; Brown Capital Management Small Company Fund",2001-04-15,article,News,,[]
Plumber Lust and Other Ideas,2001-04-15,article,News,,[]
Elegies for a Homeless Man By Friends He Left Behind,2001-04-15,article,News,,[]
"Flushing Journal; At Shea, Free Box Seats, Just Tune Out the Train",2001-04-15,article,News,,[]
What Goes Around Comes Around,2001-04-15,article,Review,,['Books and Literature']
An Impure Work,2001-04-15,article,Letter,,['Theater']
Bargains At Christie's,2001-04-15,article,Review,,[]
Retreats That Renew In Old Ways,2001-04-15,article,News,,[]
The Way We Live Now: 4-15-01: Process; How to Plan Chaos,2001-04-15,article,News,,[]
Ideas & Trends; These Artful Dodgers Doth Protest Too Much,2001-04-15,article,News,,[]
Lives; A Union of East and West,2001-04-15,article,News,,[]
Retreats That Renew In Old Ways,2001-04-15,article,News,,[]
Personal Business Diary: Some Job Networks Are Still Unplugged,2001-04-15,article,News,,"['Education and Schools', 'Children and Youth', 'Credit', 'Banks and Banking']"
"Paid Notice: Deaths  WEINTRAUB, JOSEPH",2001-04-15,article,Paid Death Notice,,[]
Immobile on the Subway,2001-04-15,article,Letter,,[]
"PAPERBACK BEST SELLERS: April 15, 2001",2001-04-15,article,List,,[]
BackTalk; Running's Guru Knew Some Answers,2001-04-15,article,News,,[]
Footnotes; Future Shop,2001-04-15,article,News,,[]
Stumbling Toward A Theater Near You,2001-04-15,article,News,,['MOTION PICTURES']
Retreats That Renew in Old Ways,2001-04-15,article,News,,"['Telephones and Telecommunications', 'APPAREL', 'RETAIL STORES AND TRADE', 'Cooking and Cookbooks']"
April 8-14; Is Nothing Sacred?,2001-04-15,article,News,,[]
"Turrets, Terraces and Tea",2001-04-15,article,News,,"['Editorials', 'Music', 'Restaurants', 'Drug Abuse and Traffic']"
MOVIES: CRITIC'S CHOICE,2001-04-15,article,News,,[]
"The Nation; Discretionary Spending, Where the Money Isn't.",2001-04-15,article,News,,[]
Political Briefing; Democrats Prepare To Take On Jeb Bush,2001-04-15,article,News,,[]
When 200 Women Are Happily Crammed Into a Boutique,2001-04-15,article,News,,[]
"In Tibetan Rituals, Metaphors for Freedom",2001-04-15,article,News,,"['Theater', 'Buddhism']"
Willows You Never Expected,2001-04-15,article,News,,[]
Profiles in Corruption,2001-04-15,article,Review,,"['Reviews', 'Books and Literature']"
April 8-14; D.E.A. Direct,2001-04-15,article,News,,[]
Winning Coach Faces His Biggest Challenge,2001-04-15,article,News,,[]
Life After Wartime,2001-04-15,article,Letter,,[]
"Paid Notice: Memorials  MALLER, JULIUS B. DR.",2001-04-15,article,Paid Death Notice,,[]
Sport Utility Vehicles And the Right to the Road,2001-04-15,article,Letter,,[]
Bedding Down With History,2001-04-15,article,News,,[]
San Francisco Journal; Case of a Fatal Mauling By Dogs Fascinates City,2001-04-15,article,News,,[]
Tumult at the Top Leaves a Company in a Whirl,2001-04-15,article,News,,[]
"His Music Can Leap and Fall, Tickle and Appall",2001-04-15,article,News,,"['Music', 'Biographical Information']"
Corrections,2001-04-15,article,Correction,,[]
Word for Word/Cloak and Greasepaint; When a Little Production in Hollywood Freed Six Americans Trapped in Iran,2001-04-15,article,News,,[]
Introduction,2001-04-15,article,Letter,,[]
Roses and Revenues For a Tribe,2001-04-15,article,News,,[]
"Paid Notice: Deaths  ARSCOTT, LOIS COFFIN",2001-04-15,article,Paid Death Notice,,[]
Pot Luck,2001-04-15,article,Review,,"['Reviews', 'Books and Literature']"
"Amid Elegance, a Variety of Indian Dishes",2001-04-15,article,Review,,[]
Bush Isn't All Wrong About the Endangered Species Act,2001-04-15,article,Op-Ed,,[]
The Gantlet Of Mortgage Approval,2001-04-15,article,News,,[]
"If You're Thinking of Living In/Paramus; In Shopping Mecca, Houses Sell Well Too",2001-04-15,article,News,,[]
Another Look at a Restaurant in Croton,2001-04-15,article,Review,,[]
Entrepreneur Sails in Free Time,2001-04-15,article,News,,[]
Fellow Educator Praises Rice Family,2001-04-15,article,Letter,,[]
"Jam Band Finds Flood of Devotion, 60's Style",2001-04-15,article,News,,[]
"POSTINGS: At 51st Street and First Avenue, Near Beekman Place; A 32-Story, 89-Apartment Condo",2001-04-15,article,News,,[]
Raising Voices at a Library Over the Supply of Jewish Books,2001-04-15,article,News,,[]
"A 1939 Theater Is Restored and the Area Is Looking Up, Too",2001-04-15,article,News,,[]
"Private Sector; Once Burned, but Still Bold",2001-04-15,article,Biography,,[]
Reckonings; Let Them Shovel,2001-04-15,article,Op-Ed,,[]
"Paid Notice: Deaths  RUBINGER, SUSAN",2001-04-15,article,Paid Death Notice,,[]
. . .And See a Sticky Wicket In the Form of Liquor Sales,2001-04-15,article,News,,[]
Grief and Fury at Funeral for Slain Youth,2001-04-15,article,News,,[]
Those Lipstick Marks on Brad: Loving Wax Figures Too Much,2001-04-15,article,News,,[]
Corrections,2001-04-15,article,Correction,,[]
April 8-14; Florida's New Water Plan,2001-04-15,article,News,,[]
April 8-14; Spy Plane Tensions Persist,2001-04-15,article,News,,[]
"Paid Notice: Deaths  PEPPER, ANITA GOLDEN, DR.",2001-04-15,article,Paid Death Notice,,[]
"Paid Notice: Deaths  FRIEDMAN, MARTIN R., ESQ.",2001-04-15,article,Paid Death Notice,,[]
A New Era May Dawn for Trout,2001-04-15,article,News,,[]
Discount Shoe Chain Opens New Stores in County,2001-04-15,article,News,,[]
Streetscapes/Apartment-Building Canopies; An Aspect of City Life Usually Taken for Granted,2001-04-15,article,News,,[]
An Egg Roll For 12,2001-04-15,article,News,,[]
Stockpiling More Than Half of the Country's Mercury,2001-04-15,article,Interview,,[]
"Paid Notice: Deaths  DELAMBILY, CAPT. ROBERT W.",2001-04-15,article,Paid Death Notice,,[]
Cajun Cotillion,2001-04-15,article,Letter,,[]
Life After Wartime,2001-04-15,article,Letter,,[]
"Paid Notice: Deaths  HAMMERMAN, FAY",2001-04-15,article,Paid Death Notice,,[]
Paying for Repairs In a Co-op,2001-04-15,article,Question,,[]
CHILDREN'S BOOKS,2001-04-15,article,Review,,"['Reviews', 'Books and Literature']"
Private Sector; Where's the Beef? Here and There,2001-04-15,article,News,,[]
"Ignored for Decades, They're Suddenly a Hot Band",2001-04-15,article,News,,"['Music', 'Biographical Information']"
"Berlusconi, The Rerun",2001-04-15,article,News,,[]
New Airport at Inchon Replaces One in Seoul,2001-04-15,article,News,,[]
Bicycle Tutor Expands To Play Dates and Repairs,2001-04-15,article,News,,[]
Ideas & Trends: Lost Illusions; Bring Back Bardot,2001-04-15,article,News,,[]
Racing Festivities At the Starting Gate,2001-04-15,article,News,,[]
Corrections,2001-04-15,article,Correction,,[]
Sweet Salvation,2001-04-15,article,News,,[]
A Bitter Pill,2001-04-15,article,Letter,,['Art']
'Never Stop Moving',2001-04-15,article,News,,[]
A Revival Mines a Golden Age,2001-04-15,article,Review,,[]
"Affirmative Action, Without the Program",2001-04-15,article,Letter,,[]
"Immobile on the Subway; A Great Photographer, And Not So Obscure",2001-04-15,article,Letter,,[]
L.I. @ WORK,2001-04-15,article,News,,[]
Article 2001041591543826610 -- No Title,2001-04-15,article,News,,[]
Big,2001-04-15,article,Letter,,[]
"Jacqueline Young, Nicholas Perrins",2001-04-15,article,News,,['Weddings and Engagements']
"Harry Boykoff, 78, St. John's Star in the 1940's, Dies",2001-04-15,article,Obituary; Biography,,[]
You Can Leave Your Hat On: Fedoras Are Snazzy Again,2001-04-15,article,News,,[]
Springtime for the Music Man in Me,2001-04-15,article,News,,['Theater']
REPUBLICAN PARTY CHAIRMAN,2001-04-15,article,News,,[]
Sites in Westchester Chosen for Richard Gere Film,2001-04-15,article,News,,[]
Silver Surfers,2001-04-15,article,News,,[]
April 8-14; Nowhere to Go but Up?,2001-04-15,article,News,,[]
A Sanctuary in the Yucatán,2001-04-15,article,News,,[]
"In Municipal Bonds, A Search for Diversity",2001-04-15,article,News,,[]
Trading Countries,2001-04-15,article,News,,[]
When Lights Go Out in California,2001-04-15,article,Letter,,[]
Theater Listings,2001-04-15,article,News,,"['Art', 'Music', 'AIRLINES AND AIRPLANES', 'MOTION PICTURES']"
Crossing the Line,2001-04-15,article,Review,,"['Reviews', 'Books and Literature']"
Paying the Price of Debt,2001-04-15,article,Letter,,[]
"Deborah Greenebaum, Luis Vidali",2001-04-15,article,News,,['Weddings and Engagements']
"A Talk Show Pioneer, Before TV Talk Was Toxic",2001-04-15,article,News,,[]
Devils Reflect N.H.L.'s Stunted Development,2001-04-15,article,News,,[]
The Last Straw,2001-04-15,article,News,,[]
"Immobile on the Subway; A Great Photographer, And Not So Obscure",2001-04-15,article,Letter,,[]
"The Nation: The 'D' Word; Suddenly, Deficits Regain Their Luster",2001-04-15,article,News,,[]
"Paid Notice: Deaths  GROSSMAN, SIDNEY",2001-04-15,article,Paid Death Notice,,[]
Bush Is Devoting Scanty Attention to California,2001-04-15,article,News,,[]
Stairways to Heaven,2001-04-15,article,News,,[]
"Paid Notice: Deaths  MERCER, TOMMY",2001-04-15,article,Paid Death Notice,,[]
Letters on Travel,2001-04-15,article,News,,"['Editorials', 'APPAREL', 'Lobbying and Lobbyists', 'Museums']"
Corrections,2001-04-15,article,Correction,,[]
"Youths Armed for Battle, on Chessboards",2001-04-15,article,News,,[]
The Forecast for the Draft,2001-04-15,article,News,,[]
When Lights Go Out in California,2001-04-15,article,News,,"['Editorials', 'United States Economy', 'Reform and Reorganization', 'Regulation and Deregulation of Industry']"
Retreats That Renew In Old Ways,2001-04-15,article,News,,[]
"Paid Notice: Deaths  SALSHUTZ, NORMAN",2001-04-15,article,Paid Death Notice,,[]
Officials Promise a Fight As Airlines Defy Curfew,2001-04-15,article,News,,[]
"SOAPBOX; Frankly, My Deer . . .",2001-04-15,article,News,,[]
"Paid Notice: Deaths  FINLEY, REVEREND JAMES, S.J.",2001-04-15,article,Paid Death Notice,,[]
INSIDE,2001-04-15,article,Summary,,[]
Horse Sense,2001-04-15,article,News,,[]
CRIME,2001-04-15,article,Review,,"['Reviews', 'Books and Literature']"
NEWS SUMMARY,2001-04-15,article,Summary,,[]
"Seeing Blue Skies, Again, For Chips",2001-04-15,article,Interview,,[]
Catching the Light,2001-04-15,article,Review,,"['Reviews', 'Books and Literature']"
A Tool to Measure Closed-End Bond Funds,2001-04-15,article,News,,[]
Talk of 'Holy War' From Jakarta Leader's Home Base,2001-04-15,article,News,,[]
"Paid Notice: Deaths  KLEIN, ESTHER",2001-04-15,article,Paid Death Notice,,[]
Bear Market? The Young Needn't Be Restless,2001-04-15,article,News,,[]
"Devils, Reminded by History, Guard Against Complacency",2001-04-15,article,News,,[]
Prosecution In I.R.A. Trial Will Focus On American,2001-04-15,article,News,,[]
Investing Diary: A Tool to Measure Closed-End Bond Funds,2001-04-15,article,News,,"['Stocks and Bonds', 'Interest Rates', 'Mutual Funds']"
"Favorite Son, Unfavorable Light",2001-04-15,article,News,,[]
The Perfect Station Car,2001-04-15,article,News,,[]
Buenos Aires,2001-04-15,article,News,,[]
When Lights Go Out in California,2001-04-15,article,Letter,,[]
Copyright Protection,2001-04-15,article,Letter,,"['COPYRIGHTS', 'MOTION PICTURES']"
"Oil-Patch Epicenter, Embracing the Web",2001-04-15,article,News,,[]
"Paid Notice: Deaths  SCHMIDT, LEO",2001-04-15,article,Paid Death Notice,,[]
Sidewalk Soldiers,2001-04-15,article,News,,[]
Smaller Classes Sought in Chappaqua,2001-04-15,article,News,,[]
April 8-14; Trade Talks Bear Fruit,2001-04-15,article,News,,[]
Urge to Splurge Is Taking a Back Seat to Window Shopping,2001-04-15,article,News,,[]
"Sandy Hill, Thomas Dittmer",2001-04-15,article,News,,['Weddings and Engagements']
"Leiter Loses Out as Mets Continue to Pile Up Frustration, Instead of Runs",2001-04-15,article,News,,[]
Artist's Mondrian Intimations,2001-04-15,article,Review,,[]
The Great Books (Yes!),2001-04-15,article,Letter,,[]
'The Burghers of Calais' Being Restored in Rome,2001-04-15,article,News,,[]
QUOTATION OF THE DAY,2001-04-15,article,News,,['QUOTATION OF THE DAY']
"Records Are Still Selling, But Rappers Shut 2 Shops",2001-04-15,article,News,,[]
The Way We Live Now: 4-15-01: On Language; Foot/Hoof In/And Mouth,2001-04-15,article,News,,[]
"Pincay, 54, And Young 3-Year-Old Win Easily",2001-04-15,article,News,,[]
"Latino Style Is Cool. Oh, All Right: It's Hot.",2001-04-15,article,News,,[]
"Williams With Father, With Torre's Blessing",2001-04-15,article,News,,"['Baseball', 'Coaches and Managers', 'Athletics and Sports', 'Handicapped']"
No Time to Put Your Feet Up As Retirement Comes in Stages,2001-04-15,article,News,,[]
"Turrets, Terraces and Tea",2001-04-15,article,News,,[]
Restoring The Luster To Sacred Sites,2001-04-15,article,News,,[]
Sport Utility Vehicles And the Right to the Road,2001-04-15,article,Letter,,[]
"Habitats/Stuyvesant Street, East Village; A House for a President -- And Also for a Dean",2001-04-15,article,News,,[]
"New York's Taxes, Vast and Uneven",2001-04-15,article,Letter,,[]
"Travel Advisory: New Airport in Korea, Triple Crown Festivities and More",2001-04-15,article,News,,"['Women', 'Lobbying and Lobbyists', 'LIFE STYLES']"
BOOKS IN BRIEF: POETRY,2001-04-15,article,Review,,"['Reviews', 'Books and Literature']"
"Paid Notice: Deaths  GILBERT, MILDRED",2001-04-15,article,Paid Death Notice,,[]
Woods's Feat Surpasses Jones,2001-04-15,article,Letter,,[]
New Rochelle Company Buys Harrison Executive Complex,2001-04-15,article,News,,[]
Corrections,2001-04-15,article,Correction,,[]
Music Listing,2001-04-15,article,News,,"['Art', 'Music', 'Theater', 'Automobiles']"
Network,2001-04-15,article,Review,,"['Reviews', 'Books and Literature']"
A Digital Divide Threatens Public TV; Some Have-Not Stations Wonder How to Pay for Required Technology,2001-04-15,article,News,,[]
A NIGHT OUT WITH: Tony Hendra; Literary License,2001-04-15,article,News,,[]
Next Stop Is Kentucky as Congaree Holds Off Monarchos,2001-04-15,article,News,,[]
The Reluctant Feminist,2001-04-15,article,News,,[]
Article 2001041591604344285 -- No Title,2001-04-15,article,News,,[]
The Way We Live Now: 4-15-01: Questions for Ernest Adams; Heir of the Dogma,2001-04-15,article,Interview,,[]
"Move Over, Cows and Onions",2001-04-15,article,News,,[]
Taylor Dayne in Atlantic City,2001-04-15,article,News,,[]
"Want Pathos, Pain and Courage? Get Real",2001-04-15,article,News,,[]
Investing; Just Who Brought Those Duds To Market?,2001-04-15,article,News,,[]
"Catherine Boyle, David Winkler",2001-04-15,article,News,,['Weddings and Engagements']
"Flying Americans Home, and Reaping Bonus Miles",2001-04-15,article,News,,"['AIRLINES AND AIRPLANES', 'Automobiles', 'Utility Vehicles and Other Light Trucks', 'TELEVISION AND RADIO PROGRAMMING']"
Different Leagues,2001-04-15,article,Letter,,[]
"Judith Trescott, Laurence Mester",2001-04-15,article,News,,['Weddings and Engagements']
Circles Within Circles Within Iran,2001-04-15,article,News,,"['MOTION PICTURES', 'Biographical Information']"
Navy Panel Urges No Court-Martial For Sub's Skipper,2001-04-15,article,News,,[]
A Short History of American Indifference,2001-04-15,article,Op-Ed,,[]
China and the United States,2001-04-15,article,Editorial,,[]
A Constellation Forms,2001-04-15,article,Review,,[]
Give Jones the *,2001-04-15,article,Letter,,[]
April 8-14; Endangered Lawsuits,2001-04-15,article,News,,[]
"Paid Notice: Deaths  EISENSTEIN, TRUDY",2001-04-15,article,Paid Death Notice,,[]
"Ideas & Trends; Why Johnny Can't Read, Write, Multiply or Divide",2001-04-15,article,News,,[]
Does More Sleep Mean Higher Grades?,2001-04-15,article,News,,[]
CHILDREN'S BOOKS,2001-04-15,article,Review,,"['Reviews', 'Books and Literature']"
The Way We Live Now: 4-15-01; What They Were Thinking,2001-04-15,article,Interview,,[]
"Paid Notice: Deaths  DUBNER, MELVIN",2001-04-15,article,Paid Death Notice,,[]
Personal Business; Why Dealers Are Putting a New Shine on Used Cars,2001-04-15,article,News,,[]
Decency and Secrecy,2001-04-15,article,Letter,,[]
"Paid Notice: Deaths  ROBINSON, ANNE GROSVENOR",2001-04-15,article,Paid Death Notice,,[]
April 8-14; Setback in '63 Bombing Trial,2001-04-15,article,News,,[]
Dispute Grows Over Providing Arms to Taiwan,2001-04-15,article,News,,[]
DataBank; About-Face: Investors Find Reasons to Buy,2001-04-15,article,News,,[]
"QUICK BITE/Linden; A Big Man, a Big Sandwich",2001-04-15,article,Review,,[]
Article 2001041592885927485 -- No Title,2001-04-15,article,News,,[]
AND BEAR IN MIND,2001-04-15,article,Review,,[]
Parent Trap,2001-04-15,article,Review,,"['Reviews', 'Books and Literature']"
The Hidden Side,2001-04-15,article,Letter,,[]
Business; Private Traders See Gold in Venture Capital Ruins,2001-04-15,article,News,,[]
BEACH SMOKING BAN,2001-04-15,article,News,,[]
The Travails of Air Travel,2001-04-15,article,Editorial,,[]
"In Matchup of Stars, Soriano Eclipses Both",2001-04-15,article,News,,[]
The Lost Children,2001-04-15,article,Letter,,['Books and Literature']
The Nation; Going for Broke On the Budget,2001-04-15,article,News,,[]
"Our Towns; The Kid Takes a Big Step, a Chance to Fight for Cash and Family",2001-04-15,article,News,,[]
Parking Rules,2001-04-15,article,Schedule,,[]
PrivateSector; Where's the Beef? Here and There,2001-04-15,article,News,,[]
Commercial Property/Florida; A Cinderella Story Unfolds in West Palm Beach,2001-04-15,article,News,,[]
"Kay Willis, 71, an Adviser And Writer on Being a Parent",2001-04-15,article,Obituary; Biography,,[]
A Flashback to the 70's?,2001-04-15,article,News,,[]
The Better To Bat With,2001-04-15,article,News,,[]
"Paid Notice: Deaths  ASIP, WILLIAM",2001-04-15,article,Paid Death Notice,,[]
Ideas & Trends: Reproductive Gerontology; Ask Not for Whom the Clock Ticks,2001-04-15,article,News,,[]
"Automatic, Even Invincible, Except When Facing Yanks",2001-04-15,article,News,,[]
Mondavi Expands Winery and Tours,2001-04-15,article,News,,[]
B Is for Bam! Bam!,2001-04-15,article,News,,[]
Sorenstam Comes From 10 Back to Win 4th Tournament in Row,2001-04-15,article,News,,[]
OPINION; Less Building for a Real Earth Day,2001-04-15,article,News,,[]
A Hate Film,2001-04-15,article,Letter,,['Mental Retardation']
Jumping Jack Flash,2001-04-15,article,News,,[]
Weasel From Another Planet,2001-04-15,article,Review,,"['Reviews', 'Books and Literature']"
Literary Aspirations,2001-04-15,article,Letter,,['MOTION PICTURES']
Art Listings,2001-04-15,article,News,,"['Art', 'ARCHITECTURE', 'Museums', 'Documentary Films and Programs']"
"Paid Notice: Deaths  WEISBERG, AILEEN S.",2001-04-15,article,Paid Death Notice,,[]
"Affirmative Action, Without the Program",2001-04-15,article,News,,"['Editorials', 'Blacks', 'Black People', 'Urban Areas']"
"Andrene Coleman, John Ezzard",2001-04-15,article,News,,['Weddings and Engagements']
"Paid Notice: Memorials  ROLFE, GOLDIE",2001-04-15,article,Paid Death Notice,,[]
"Long on Ceremony, Short on Business",2001-04-15,article,News,,[]
"Paid Notice: Deaths  ROSEN, SYLVIA",2001-04-15,article,Paid Death Notice,,[]
MUSIC; Closing the Melodramatic Book on the Mahler 10th,2001-04-15,article,News,,[]
Dance Listings,2001-04-15,article,News,,"['Art', 'Music', 'Theater', 'Culture']"
OUT THERE: Miami Beach; 'I'm on the Guest List' (for the Pool),2001-04-15,article,News,,[]
30th Flemington Crafts Festival,2001-04-15,article,News,,[]
Professors With a Passion for Beauty,2001-04-15,article,News,,[]
TRANSACTIONS,2001-04-15,article,List,,[]
Ageless Latin Stars Who Embraced Their Roots,2001-04-15,article,News,,"['RECORDINGS (AUDIO)', 'Music', 'Reviews', 'Hispanic-Americans']"
Creative Issues,2001-04-15,article,Letter,,['MOTION PICTURES']
Eclecticism,2001-04-15,article,Letter,,['Music']
Neighbors Complain About a Slaughterhouse Next Door . . .,2001-04-15,article,News,,[]
Corrections,2001-04-15,article,Correction,,[]
