headline,date,doc_type,material_type,section,keywords
Metro Matters; Dissecting The Mania On 44th Street,2001-04-23,article,News,,['Theater']
Heroes With Solid Feet,2001-04-23,article,Op-Ed,,['Nazi Policies Toward Jews and Minorities']
Picks and Pans,2001-04-23,article,News,,"['Draft and Recruitment (Sports)', 'Football']"
A Dispute Over Books Unsettles South Africa,2001-04-23,article,News,,"['Censorship', 'Education and Schools', 'Books and Literature', 'Teachers and School Employees']"
STATES CREATING PLANS TO REDUCE COSTS FOR DRUGS,2001-04-23,article,News,,"['States (US)', 'HEALTH INSURANCE', 'Drugs (Pharmaceuticals)', 'Cooperatives', 'Medicaid', 'Prices (Fares, Fees and Rates)', 'AGED', 'Medicare', 'Discount Selling', 'Medicine and Health']"
Dividend Meetings,2001-04-23,article,Schedule,,[]
Green Calls for More Work In Unifying City of Minorities,2001-04-23,article,News,,"['Mayors', 'Social Conditions and Trends', 'Minorities (US)', 'Blacks', 'Black People', 'ELECTION ISSUES', 'Elections']"
"In Hollywood, New Hopes Perhaps Born In Desperation",2001-04-23,article,News,,"['LABOR', 'MOTION PICTURES', 'Television', 'Strikes']"
METRO BRIEFING,2001-04-23,article,News,,[]
Book Says Israel Intended 1967 Attack on U.S. Ship,2001-04-23,article,News,,"['Ships and Shipping', 'United States International Relations', 'ISRAEL-INTERNATIONAL RELATIONS-US', 'Books and Literature', 'Biographical Information', 'UNITED STATES ARMAMENT AND DEFENSE']"
TRANSACTIONS,2001-04-23,article,List,,[]
Court Stories; Death of a Young Navajo Casts the Spotlight on a Rare Virus,2001-04-23,article,Series,,"['Hantavirus', 'Surveys and Series', 'Malpractice', 'Suits and Litigation', 'Hospitals']"
"Paid Notice: Deaths  OVERLANDER, JOHN CRAIG",2001-04-23,article,Paid Death Notice,,[]
Article 2001042392044381739 -- No Title,2001-04-23,article,News,,[]
Hamilton Wins a Wreck-Free Talladega,2001-04-23,article,News,,"['TALLADEGA 500 (AUTO RACE)', 'Automobile Racing']"
Alitalia Talks To Air France About Forming An Alliance,2001-04-23,article,News,,"['AIRLINES AND AIRPLANES', 'Mergers, Acquisitions and Divestitures']"
Delta Reaches Tentative Deal With Pilots On a Contract,2001-04-23,article,News,,"['AIRLINES AND AIRPLANES', 'LABOR', 'Pilots', 'Wages and Salaries', 'Prices (Fares, Fees and Rates)']"
Meg Greenfield's Secret Book Offers Insights but No Dish,2001-04-23,article,News,,"['Books and Literature', 'Biographical Information']"
Istanbul Hotel Under Siege in Protest Over War in Chechnya,2001-04-23,article,News,,"['Hostages', 'HOTELS AND MOTELS', 'Civil War and Guerrilla Warfare']"
Cuban Exiles Mark a Painful Anniversary in Miami,2001-04-23,article,News,,"['United States International Relations', 'Child Custody and Support', 'PUBLIC OPINION', 'Cuban-Americans', 'Hispanic-Americans']"
Article 2001042391666203632 -- No Title,2001-04-23,article,News,,[]
2 Big Accounts Move Within Lowe's Orbit,2001-04-23,article,News,,"['Automobiles', 'Delivery Services', 'ADVERTISING', 'ACCOUNT CHANGES']"
Killing Prompts Call for Alarms in Livery Cabs,2001-04-23,article,News,,"['Robberies and Thefts', 'Taxicabs and Taxicab Drivers', 'Murders and Attempted Murders', 'Security and Warning Systems']"
Clash Delays Health Plan For the Poor,2001-04-23,article,News,,"['HEALTH INSURANCE', 'Medicine and Health']"
"Playoff Time and, Presto, the Knicks Turn It Up",2001-04-23,article,News,,"['Playoff Games', 'Basketball']"
"Pak Wins, And Stops Sorenstam",2001-04-23,article,News,,"['LONGS DRUGS CHALLENGE (GOLF)', 'Golf']"
I Cried for Joey Ramone,2001-04-23,article,Letter,,['Music']
PENTAGON PANEL URGES SCUTTLING HOWITZER SYSTEM,2001-04-23,article,News,,"['ARMIES', 'UNITED STATES ARMAMENT AND DEFENSE']"
"Kenneth Mickey, Kansas City, Mo., November 2000",2001-04-23,article,News,,[]
Article 2001042392132024617 -- No Title,2001-04-23,article,News,,[]
Essay; Of Human Wrongs,2001-04-23,article,Op-Ed,,"['United States International Relations', 'Palestinians', 'Demonstrations and Riots']"
QUOTATION OF THE DAY,2001-04-23,article,News,,['QUOTATION OF THE DAY']
Sports of The Times; Ward and the Evidence of Things Unseen,2001-04-23,article,News,,"['JEWS', 'ANTI-SEMITISM', 'Basketball']"
E-Commerce Report; Record labels struggle with Napster alternatives that will make money and please consumers.,2001-04-23,article,News,,"['COPYRIGHTS', 'RECORDINGS (AUDIO)', 'Music', 'Computers and the Internet', 'Royalties']"
Equity Offerings,2001-04-23,article,Schedule,,[]
"Paid Notice: Deaths  SEGALL, FRANCES",2001-04-23,article,Paid Death Notice,,[]
An Unrepentant Nader Sees a Positive Side of Bush Policy,2001-04-23,article,Biography,,"['Environment', 'Presidential Election of 2000', 'Elections', 'Third-Party Moves (US)']"
This Week,2001-04-23,article,News,,"['Music', 'FRANCE MOVES (FESTIVAL)', 'PEN/BARBARA GOLDSMITH FREEDOM TO WRITE AWARDS', 'Politics and Government', 'Freedom of Speech and Expression', 'Art', 'Awards, Decorations and Honors', 'Dancing', 'New Orleans Jazz and Heritage Festival']"
"In Aftershock of Unrest, Cincinnati Seeks Answers",2001-04-23,article,News,,"['Police Brutality and Misconduct', 'ARBITRATION, CONCILIATION AND MEDIATION', 'Blacks', 'Black People', 'Suits and Litigation', 'Demonstrations and Riots', 'Police']"
"Mike Schacht, 65, Baseball-Loving Painter, Author and Teacher",2001-04-23,article,Obituary; Biography,,"['Biographical Information', 'Deaths (Obituaries)']"
Compressed Data; All That Was Treev Will Now Be Ceyoniq,2001-04-23,article,News,,"['Names, Organizational', 'Mergers, Acquisitions and Divestitures', 'Computers and the Internet']"
"To Preserve Dance on Film, a Passionate Infusion of Oxygen",2001-04-23,article,News,,"['FRANCE MOVES (FESTIVAL)', 'MOTION PICTURES', 'Biographical Information', 'Dancing']"
Article 2001042391413924148 -- No Title,2001-04-23,article,News,,[]
Political Tests From the Bench,2001-04-23,article,Letter,,"['Judges', 'United States Politics and Government', 'Courts', 'Legal Profession']"
The Giants' Draft Has an Unscripted Feel,2001-04-23,article,News,,"['Draft and Recruitment (Sports)', 'Football']"
Jets Turn Their Focus To Defense On Day 2,2001-04-23,article,News,,"['Draft and Recruitment (Sports)', 'Football']"
Hungary and Slovakia Struggle to Reform Health Systems,2001-04-23,article,News,,[]
PLUS: MARATHON; El-Mouaziz and Tulu Are Tops in London,2001-04-23,article,News,,[]
Article 2001042393701773344 -- No Title,2001-04-23,article,News,,[]
"More Than a Little Piece of Her Heart, Baby",2001-04-23,article,Review,,"['Reviews', 'Theater']"
BUSINESS DIGEST,2001-04-23,article,Summary,,[]
Yellow Pages Group Will Open Review,2001-04-23,article,News,,"['ADVERTISING', 'Directories', 'ACCOUNT CHANGES', 'Telephones and Telecommunications']"
METROPOLITAN DIARY,2001-04-23,article,News,,[]
Arab Suicide Bomber Kills Doctor in Israel,2001-04-23,article,Summary,,[]
Economic Calendar,2001-04-23,article,News,,['LABOR']
"Paid Notice: Deaths  LEEPSON, LENLEY, LEONORE",2001-04-23,article,Paid Death Notice,,[]
"Patents; Software that lets a user control the stereo, the DVD and the computer, all from the TV screen.",2001-04-23,article,News,,"['Recording Equipment', 'Electronics', 'Television', 'Inventions and Patents', 'Computers and the Internet']"
Sled Dogs First: College Can Wait,2001-04-23,article,Letter,,['Colleges and Universities']
"Paid Notice: Deaths  ZABLO, DAVID",2001-04-23,article,Paid Death Notice,,[]
"Paid Notice: Deaths  GOLDSTEIN, RITA",2001-04-23,article,Paid Death Notice,,[]
Restoring Brancusi's Art,2001-04-23,article,Letter,,"['Restoration and Rehabilitation', 'Art']"
Start-Up Hopes to Shape the Future by Keeping Its Roots in the Past,2001-04-23,article,News,,"['Biographical Information', 'Computers and the Internet']"
Biggest Obstacle to Selling Trade Pact: Sovereignty,2001-04-23,article,An Analysis; News Analysis,,"['International Trade and World Market', 'Third World and Developing Countries']"
Fed's Surprise Rate Cut,2001-04-23,article,Letter,,"['United States Economy', 'Interest Rates', 'Credit']"
Reformist Legislator Is Set to Be New Japanese Premier,2001-04-23,article,News,,[]
"Thanks to One Punch, Rahman Wears the Title Belts and Holds the Cards",2001-04-23,article,News,,['Boxing']
Carter Once Again Yields Under Pressure,2001-04-23,article,News,,"['Playoff Games', 'Basketball']"
Sports of The Times; Lilly's Bid for No. 5 Spot Gives Yanks Hope,2001-04-23,article,News,,['Baseball']
Talks Reported On a Deal for Unit of Degussa,2001-04-23,article,News,,"['Mergers, Acquisitions and Divestitures', 'Metals and Minerals']"
Ramirez Ends Homecoming With 2 Home Runs,2001-04-23,article,News,,[]
3M to Cut 7 Percent of Work Force,2001-04-23,article,News,,[]
Corrections,2001-04-23,article,Correction,,"['Correction Stories', 'Company Reports']"
People,2001-04-23,article,News,,['Appointments and Executive Changes']
Votes Show Montenegro Leaning Toward Independence,2001-04-23,article,News,,"['Politics and Government', 'Biographical Information', 'Elections']"
"Paid Notice: Deaths  TITONE, SALVATORE",2001-04-23,article,Paid Death Notice,,[]
"For Protesters at Yale, a Who's Who",2001-04-23,article,News,,"['Education and Schools', 'LABOR', 'Theater', 'Roads and Traffic']"
Isn’t It Ionic?,2001-04-24,article,News,,[]
National Briefing,2001-04-24,article,News,,[]
Japan Party Picks 'Oddball' to Be the 11th Prime Minister,2001-04-24,article,News,,[]
"Streets of Fashion Dreams, One in Brooklyn . . .",2001-04-24,article,News,,['APPAREL']
SUNY Albany Gets $150 Million For Development of Microchips,2001-04-24,article,News,,"['Colleges and Universities', 'Research', 'Computers and the Internet']"
Arnott Expected Back For Toronto Rematch,2001-04-24,article,News,,"['Hockey, Ice', 'Playoff Games']"
"Paid Notice: Deaths  STARER, ROBERT",2001-04-24,article,Paid Death Notice,,[]
Sports of The Times; Countering The Terms Of Hatred,2001-04-24,article,News,,"['JEWS', 'ANTI-SEMITISM', 'Basketball']"
Ratings Decline For N.B.A. Playoffs,2001-04-24,article,News,,"['Playoff Games', 'Television', 'Ratings and Rating Systems', 'Basketball']"
Dispute Over Seeding May Provoke Wimbledon Boycott,2001-04-24,article,News,,"['Ratings and Rating Systems', 'Boycotts', 'Tennis', 'Wimbledon Tennis Tournament']"
Arsenic on Tap,2001-04-24,article,Letter,,"['Water', 'ARSENIC']"
BURGER KING SELECTS AN EXECUTIVE VICE PRESIDENT,2001-04-24,article,News,,"['Appointments and Executive Changes', 'Biographical Information']"
"THE MARKETS: Market Place; Who's Afraid Of the Big, Bad Bear Market?",2001-04-24,article,News,,"['Mutual Funds', 'Stocks and Bonds']"
KROLL-O'GARA TO SELL ARMORED VEHICLE BUSINESS,2001-04-24,article,News,,"['Mergers, Acquisitions and Divestitures', 'ARMORED CAR SERVICES']"
A Song in Your Head Can Turn Deadly,2001-04-24,article,News,,"['Music', 'Brain', 'ANEURYSMS']"
"Paid Notice: Deaths  SEVILLE, LEON",2001-04-24,article,Paid Death Notice,,[]
"Paid Notice: Deaths  KOREN, BEATRICE",2001-04-24,article,Paid Death Notice,,[]
Science's Elusive Realm: Life's Little Mysteries,2001-04-24,article,News,,"['Research', 'Physics']"
I.B.M. OFFERS LINUX-CAPABLE SERVERS,2001-04-24,article,News,,"['COMPUTER SOFTWARE', 'Prices (Fares, Fees and Rates)', 'Computers and the Internet']"
City Offers New Plan on Homeless In a Bid to Avoid a Contempt Order,2001-04-24,article,News,,['Homeless Persons']
Metro Business Briefing,2001-04-24,article,News,,"['Credit', 'Wages and Salaries', 'COMPANY AND ORGANIZATION PROFILES', 'Securities and Commodities Violations']"
"Paid Notice: Deaths  MARTIN, FLORET",2001-04-24,article,Paid Death Notice,,[]
Learning From Life,2001-04-24,article,Letter,,"[""COCKAYNE'S SYNDROME""]"
Article 2001042492169809435 -- No Title,2001-04-24,article,News,,[]
"Seattle, Quebec and the World",2001-04-24,article,Letter,,"['International Trade and World Market', 'Environment']"
Throwing Out the Script,2001-04-24,article,Op-Ed,,"['LABOR', 'MOTION PICTURES', 'Television']"
"What Do Those Barks Mean? To Dogs, It's All Just Talk",2001-04-24,article,News,,"['Dogs', 'Research']"
Article 2001042491876886228 -- No Title,2001-04-24,article,News,,[]
The Invasion of the Soil Snatchers; Newcomers Push Out Native Plants,2001-04-24,article,News,,['Flowers and Plants']
"Paid Notice: Deaths  DUHAN, BERNARD F.",2001-04-24,article,Paid Death Notice,,[]
McVeigh's Fate,2001-04-24,article,Letter,,"['Bombs and Explosives', 'Capital Punishment', 'Terrorism']"
TRANSACTIONS,2001-04-24,article,List,,[]
GERMANY: CONFIDENCE GAUGE FALLS,2001-04-24,article,News,,['Economic Conditions and Trends']
'Maximum' Heart Rate Theory Is Challenged,2001-04-24,article,News,,"['Heart', 'Exercise']"
"Paid Notice: Deaths  STARK, JANE",2001-04-24,article,Paid Death Notice,,[]
A Motley Cast of Types And Bits and Pieces Rampant,2001-04-24,article,Review,,"['Reviews', 'Dancing']"
ARGENTINA: BOND MARKET TURMOIL,2001-04-24,article,News,,"['Recession and Depression', 'Finances', 'Economic Conditions and Trends', 'Government Bonds']"
The Big City; Striking Oil? My Backyard Is Just Fine,2001-04-24,article,News,,"['Shortages', 'Electric Light and Power']"
". . . And One in Harlem, That Cradle of Style",2001-04-24,article,News,,['APPAREL']
BRITAIN: HOTEL ACQUISITION,2001-04-24,article,News,,"['Mergers, Acquisitions and Divestitures', 'HOTELS AND MOTELS']"
Some Snacks Putting On a Few Calories,2001-04-24,article,News,,"['Diet and Nutrition', 'Weight', 'Snack Foods', 'Calories', 'Research']"
Last 6 Employees Leave Katsin/Loeb,2001-04-24,article,News,,"['Suspensions, Dismissals and Resignations', 'Appointments and Executive Changes', 'Biographical Information']"
"Robert Starer, 77, Composer of Ballets and Operas",2001-04-24,article,Obituary; Biography,,"['Biographical Information', 'Deaths (Obituaries)']"
"No Evidence of Autism Link Is Seen in Vaccine, Study Says",2001-04-24,article,News,,"['Autism', 'German Measles (Rubella)', 'Mumps', 'Vaccination and Immunization', 'Children and Youth', 'Measles']"
Article 2001042493886867604 -- No Title,2001-04-24,article,News,,[]
Recycling in Schools,2001-04-24,article,Letter,,"['Waste Materials and Disposal', 'Recycling of Waste Materials']"
Taiwan's Reaction Is Muted on Bush Plan to Offer Arms,2001-04-24,article,News,,[]
Corrections,2001-04-24,article,Correction,,"['Restaurants', 'Correction Stories']"
'Twas a Night for Sharing Irish Virtuosity and Heart,2001-04-24,article,Review,,"['Music', 'Reviews']"
"In Vegas, Steve Martin Tries a Different Kind of Show",2001-04-24,article,Review,,"['Reviews', 'Art']"
"For Chrysler These Days, It May Be Robots or Mexico",2001-04-24,article,News,,"['Relocation of Business', 'Automobiles', 'LABOR', 'FACTORIES AND INDUSTRIAL PLANTS', 'Layoffs and Job Reductions', 'Robots', 'Production']"
"Paid Notice: Deaths  BIER, HORACE",2001-04-24,article,Paid Death Notice,,[]
Problems Plague Two Leagues,2001-04-24,article,News,,['Soccer']
Verizon Would Extend Connecticut Long Distance,2001-04-24,article,News,,['Telephones and Telecommunications']
Foreign Affairs; Protesting for Whom?,2001-04-24,article,Op-Ed,,"['International Trade and World Market', 'Demonstrations and Riots', 'Economic Conditions and Trends']"
CNBC.com To Be Merged Into MSN,2001-04-24,article,News,,"['LABOR', 'Mergers, Acquisitions and Divestitures', 'Television', 'Layoffs and Job Reductions', 'Computers and the Internet']"
HCA Healthcare Profit Is Up,2001-04-24,article,News,,"['Medicine and Health', 'HEALTH INSURANCE']"
Campaign Reform in the House,2001-04-24,article,Editorial,,"['Editorials', 'Finances', 'Ethics', 'Law and Legislation', 'Elections']"
"Up Everest, for the Ultimate in Exercise",2001-04-24,article,News,,['Bicycles and Bicycling']
Physicians and Fate,2001-04-24,article,Letter,,"['Malpractice', 'Medicine and Health']"
IRIDIUM NAMES A NEW CHIEF,2001-04-24,article,News,,"['Suspensions, Dismissals and Resignations', 'Appointments and Executive Changes', 'Biographical Information']"
NEWS SUMMARY,2001-04-24,article,Summary,,[]
Front Row; A sportswear line online from Galliano An auction of gowns by the mystery designer of that vintage yellow chiffon Oscar dress.,2001-04-24,article,News,,['APPAREL']
Eclecticism Echoes Through Some German Works,2001-04-24,article,Review,,"['Music', 'Reviews']"
"Paid Notice: Deaths  LIVISAY, LEONIDAS F., M.D.",2001-04-24,article,Paid Death Notice,,[]
"Paid Notice: Deaths  JONES, CHARLES E.",2001-04-24,article,Paid Death Notice,,[]
Russians Kill 6 Chechen Civilians in Revenge Raid,2001-04-24,article,News,,"['Politics and Government', 'Civil War and Guerrilla Warfare']"
Stealthy Tornado Stole a Third of Unsuspecting Kansas Town,2001-04-24,article,News,,['Tornadoes']
"Paid Notice: Deaths  SNEED, SHERMAN B.",2001-04-24,article,Paid Death Notice,,[]
Model for Research Rises in a Third World City,2001-04-24,article,News,,"['Genetics and Heredity', 'Genetic Engineering', 'Biology and Biochemistry']"
"A Good Night's Sleep, Without the Pills",2001-04-24,article,News,,"['Sleep', 'Research', 'Insomnia']"
Grants for Stem Cell Work Are Delayed,2001-04-24,article,News,,"['Stem Cells', 'Fetal Tissue', 'Medicine and Health', 'Research', 'Federal Aid (US)']"
"Paid Notice: Deaths  MELSON, HAROLD W.",2001-04-24,article,Paid Death Notice,,[]
Woman Has Eye on a Winston Cup Start,2001-04-24,article,News,,"['Women', 'NAPA 500 (AUTO RACE)', 'Automobile Racing']"
Physicians and Fate,2001-04-24,article,Letter,,"['Malpractice', 'Suits and Litigation', 'Medicine and Health']"
Hasbro Has Loss as Pokémon Wanes,2001-04-24,article,News,,['Company Reports']
Hale House and Its President Ordered to Produce Records,2001-04-24,article,News,,"['Philanthropy', 'Finances', 'Children and Youth']"
"Paid Notice: Deaths  ACKER, JACK (JOHN J., JR.)",2001-04-24,article,Paid Death Notice,,[]
Slow Medical Sleuthing,2001-04-24,article,Letter,,"['Religious Cults', 'Salmonella (Bacteria)', 'Food Contamination and Poisoning']"
AD GROWTH SLOWS SHARPLY,2001-04-24,article,News,,"['ADVERTISING', 'Computers and the Internet']"
When Lead Paint Vanishes and Returns,2001-04-24,article,News,,"['Paints and Painting', 'Lead']"
BUSINESS DIGEST,2001-04-24,article,Summary,,[]
Prison Guards And Teenagers,2001-04-24,article,Letter,,['Prisons and Prisoners']
"David M. Walker, 56, Astronaut and Aviator",2001-04-24,article,Obituary; Biography,,"['Biographical Information', 'Deaths (Obituaries)']"
"Paid Notice: Deaths  SINOPOLI, GIUSEPPE",2001-04-24,article,Paid Death Notice,,[]
"As Technology Improves, More People Breathe With Machines",2001-04-24,article,News,,"['Medicine and Health', 'RESPIRATION AND RESPIRATORS']"
Technology Briefings,2001-04-24,article,News,,"['Appointments and Executive Changes', 'Layoffs and Job Reductions', 'COMPUTER SOFTWARE']"
"Pepsi Earnings Increase 18%, Continuing Growth Streak",2001-04-24,article,News,,['Company Reports']
"Paid Notice: Deaths  FOULKE, LOUISA L.W. (NEE WOOD)",2001-04-24,article,Paid Death Notice,,[]
BUSH IS OFFERING TAIWAN SOME ARMS BUT NOT THE BEST,2001-04-24,article,News,,"['Ships and Shipping', 'NAVIES', 'United States International Relations', 'ARMAMENT, DEFENSE AND MILITARY FORCES', 'DESTROYERS', 'Radar', 'CHINA-INTERNATIONAL RELATIONS-US', 'Submarines', 'Missiles and Missile Defense Systems', 'UNITED STATES ARMAMENT AND DEFENSE']"
"Paid Notice: Deaths  PONTECORVO, OLGA",2001-04-24,article,Paid Death Notice,,[]
"Seattle, Quebec and the World",2001-04-24,article,Letter,,['International Trade and World Market']
Mets' Calls To Bullpen Get Answers,2001-04-24,article,News,,['Baseball']
Suit on Sex Harassment at Work Fails to Meet High Court's Test,2001-04-24,article,News,,"['LABOR', 'Sexual Harassment', 'Law and Legislation', 'Decisions and Verdicts']"
"Tunnel Vision; When School's Out, the Subways Can Turn Ugly",2001-04-24,article,News,,"['Subways', 'Transit Systems']"
"Paid Notice: Deaths  KOROSTOFF (KAYE), BERNARD",2001-04-24,article,Paid Death Notice,,[]
Consortium Of Investors To Offer Bid For Eircom,2001-04-24,article,News,,"['Mergers, Acquisitions and Divestitures', 'Privatization', 'Telephones and Telecommunications']"
Mississippi Near Settlement In Rights Case,2001-04-24,article,News,,"['Equal Educational Opportunities', 'Blacks', 'Black People', 'Colleges and Universities', 'Suits and Litigation', 'Discrimination']"
Missionaries' Church Casts Net Wide,2001-04-24,article,News,,"['AIRLINES AND AIRPLANES', 'United States International Relations', 'Religion and Churches', 'PERU-INTERNATIONAL RELATIONS-US', 'Drug Abuse and Traffic']"
Whitman in Spotlight Anew With Comments on Drilling,2001-04-24,article,News,,"['Oil (Petroleum) and Gasoline', 'ELECTION ISSUES', 'Presidential Election of 2000']"
"Seattle, Quebec and the World",2001-04-24,article,Letter,,['International Trade and World Market']
Los Angeles Hotel Deal,2001-04-24,article,News,,[]
Court Allows Arrest for Minor Violations,2001-04-24,article,News,,[]
Senate Panel Votes to Repeal Power Law,2001-04-24,article,News,,[]
Suffolk Day-Labor Center Appears Doomed as Veto Draws Support,2001-04-24,article,News,,"['LABOR', 'IMMIGRATION AND REFUGEES', 'Vetoes (US)', 'Law and Legislation']"
"Paid Notice: Deaths  GALLET, JEFFRY H.",2001-04-24,article,Paid Death Notice,,[]
Salomon Faces Complaints Over Options At WorldCom,2001-04-24,article,News,,"['Suits and Litigation', 'Stock Options and Purchase Plans', 'Stocks and Bonds', 'Brokers and Brokerage Firms']"
Heat Faces Sweep As Hornets Dominate,2001-04-24,article,News,,"['Playoff Games', 'Basketball']"
Surprising Twins Give Foes a Run for Their Money,2001-04-24,article,News,,['Baseball']
"Top of the Order, Bottom of the Order",2001-04-24,article,News,,[]
"Paid Notice: Deaths  LUMPP, ANNE",2001-04-24,article,Paid Death Notice,,[]
Morgan Stanley to Cut Work Force,2001-04-24,article,News,,"['Stocks and Bonds', 'Banks and Banking', 'Layoffs and Job Reductions', 'COMPANY AND ORGANIZATION PROFILES']"
"Hollywood Denizens, Like Stravinsky",2001-04-24,article,Review,,"['Music', 'Reviews']"
"Kenneth Mickey, Kansas City, Mo., November 2000",2001-04-24,article,News,,[]
The Selling of Free Trade,2001-04-24,article,Editorial,,"['International Trade and World Market', 'Editorials', 'Protectionism (Trade)']"
Mother and Sisters of Knicks Star Held Hostage for Hours,2001-04-24,article,News,,"['Hostages', 'Sex Crimes', 'Kidnapping', 'Basketball']"
"CONSECO TO ACQUIRE EXL, OUTSOURCING COMPANY",2001-04-24,article,News,,"['LABOR', 'Mergers, Acquisitions and Divestitures']"
Peru's Reckless Shooting,2001-04-24,article,Editorial,,"['Accidents and Safety', 'AIRLINES AND AIRPLANES', 'Editorials', 'PERU-INTERNATIONAL RELATIONS-US', 'Drug Abuse and Traffic']"
American Express First-Quarter Profit Fell 18%,2001-04-24,article,News,,['Company Reports']
Several Changes Set at Thompson,2001-04-24,article,News,,"['Suspensions, Dismissals and Resignations', 'Appointments and Executive Changes', 'Biographical Information']"
Raptors Ask Carter to Make an Impact,2001-04-24,article,News,,"['Playoff Games', 'Basketball']"
NORTEL EXECUTIVE TO HEAD ENTRUST,2001-04-24,article,News,,"['Suspensions, Dismissals and Resignations', 'Appointments and Executive Changes', 'Biographical Information']"
Grizzled Baby All Grown Up to Be a Cowboy,2001-04-24,article,Review,,"['Music', 'Reviews']"
Key Rates,2001-04-24,article,Statistics,,[]
'Masters' Show How to Get High on Life Without Abusing Alcohol,2001-04-24,article,News,,"['Alcohol Abuse', 'Surveys and Series', 'Books and Literature']"
Church-Based Projects Lack Data on Results,2001-04-24,article,News,,"['Social Conditions and Trends', 'Finances', 'Biographical Information', 'Religion and Churches', 'Research', 'Budgets and Budgeting', 'Church-State Relations']"
"My Fiji Souvenirs: Shells, Driftwood, Space Debris . . .",2001-04-24,article,News,,"['Space', 'Space Stations', 'MIR (SPACE STATION)']"
Fame and Fingernails as a TV Mobster's Wife,2001-04-24,article,Biography,,"['Television', 'Biographical Information']"
"Paid Notice: Deaths  FISHMAN, IDA",2001-04-24,article,Paid Death Notice,,[]
"A Woman From Jordan, a Court Case in Utah",2001-04-24,article,Letter,,"['Kidnapping', 'Homosexuality']"
Article 2001042493266715762 -- No Title,2001-04-24,article,News,,[]
A Poet Who Makes Love As Artfully as He Writes,2001-04-24,article,Review,,"['Reviews', 'Books and Literature']"
Drop at Samsung Electronics Is Not as Steep as Expected,2001-04-24,article,News,,['Company Reports']
"Paid Notice: Deaths  PFISTER, PHYLLIS ROULE",2001-04-24,article,Paid Death Notice,,[]
Corrections,2001-04-24,article,News,,[]
OUTPOST.COM ALTERS SHIPPING POLICY,2001-04-24,article,News,,"['Prices (Fares, Fees and Rates)', 'RETAIL STORES AND TRADE']"
"Paid Notice: Deaths  BIANCHI, ANNE",2001-04-24,article,Paid Death Notice,,[]
Regents Study Shows Gains For Students In Special Ed,2001-04-24,article,News,,"['Education and Schools', 'Tests and Testing', 'Special Education (Handicapped)']"
"Paid Notice: Deaths  FLANCE, BLANCHE J.",2001-04-24,article,Paid Death Notice,,[]
Ward Is Contrite After Stern's Rebuke,2001-04-24,article,News,,"['JEWS', 'ANTI-SEMITISM', 'Basketball']"
QUOTATION OF THE DAY,2001-04-24,article,News,,['QUOTATION OF THE DAY']
A Scientific Niche for Women in a Male-Dominated Era,2001-04-24,article,News,,"['Flowers and Plants', 'Women', 'Art']"
"Paid Notice: Deaths  HARVEY, CLARA",2001-04-24,article,Paid Death Notice,,[]
"Paid Notice: Deaths  FORSTER, BAYARD STUYVESANT",2001-04-24,article,Paid Death Notice,,[]
HCA Healthcare Profit Is Up; More Use of Hospitals Is Cited,2001-04-24,article,News,,['Company Reports']
Future Earth Days,2001-04-24,article,Letter,,['Environment']
Article 2001042490537182360 -- No Title,2001-04-24,article,News,,[]
Surge in Illegal Logging Puts Indonesia's Economy in Peril,2001-04-24,article,News,,[]
Survivor of Birmingham Church Bombing Has Few Expectations for Trial,2001-04-24,article,News,,"['Bombs and Explosives', 'Murders and Attempted Murders', 'Blacks', 'Black People', 'Biographical Information', 'Religion and Churches']"
