headline,date,doc_type,material_type,section,keywords
Gain for Entrepreneurial Women,2001-04-08,article,News,,[]
"Ronald Van Dunk, 68, Chief Red Bone of the Ramapough Mountain Indians, Is Dead",2001-04-08,article,Obituary; Biography,,[]
Using the Art of Graffiti To Start a Conversation,2001-04-08,article,News,,[]
Chipped Nails To Flaunt,2001-04-08,article,News,,['Nails (Body Part)']
An Archipelago Called Russian,2001-04-08,article,News,,"['Russian Language', 'Travel and Vacations']"
"Commercial Property/Web-Based Products; For Realty Concerns, Internet Is a Disappointment",2001-04-08,article,News,,[]
London,2001-04-08,article,Letter,,"['Walking', 'Travel and Vacations']"
Word-Starved In Heidelberg,2001-04-08,article,News,,"['German Language', 'Travel and Vacations']"
Active Managers Await the Verdict,2001-04-08,article,News,,[]
JERSEY CITY LEGAL BILLS,2001-04-08,article,News,,[]
Books in Brief: Nonfiction,2001-04-08,article,Review,,"['Books and Literature', 'Reviews']"
"Wall of Park Avenue Building Collapses, Disrupting Metro-North",2001-04-08,article,News,,[]
This Marriage Takes A Bit of Explication,2001-04-08,article,News,,[]
Salvage A Portfolio,2001-04-08,article,News,,[]
Panama,2001-04-08,article,Letter,,['Travel and Vacations']
"Private Sector; Standing Up to the Men, With Nerve and a Step Stool",2001-04-08,article,News,,[]
Political Briefing; Pennsylvania G.O.P. Looks for a New Star,2001-04-08,article,News,,[]
How to Download and Use Napster,2001-04-08,article,News,,[]
"Despite Recent Record, Duval Exudes Confidence",2001-04-08,article,News,,"['Playoff Games', 'Golf', 'Athletics and Sports']"
Two Hamlets Explore New Paths in an Old Terrain,2001-04-08,article,Interview,,['Theater']
Disney Goes High Tech With New Parade,2001-04-08,article,News,,"['Lighting', 'AMUSEMENT PARKS', 'Parades', 'Travel and Vacations']"
New & Noteworthy Paperbacks,2001-04-08,article,Review,,[]
April 1-7; The Senate Shows A Mind of Its Own,2001-04-08,article,News,,[]
An Arts Festival (Plus Azaleas) in Norfolk,2001-04-08,article,News,,['Travel and Vacations']
"Paid Notice: Deaths  GOTTLIEB, HARRY",2001-04-08,article,Paid Death Notice,,[]
Letters: New-Economy Worth,2001-04-08,article,News,,"['Editorials', 'Suits and Litigation', 'Taxation', 'Computers and the Internet']"
Tell if Your Parents are Spying on You,2001-04-08,article,News,,[]
Corrections,2001-04-08,article,Correction,,"['Music', 'Correction Stories']"
Ideas & Trends; Selling to Gen Y: A Far Cry From Betty Crocker,2001-04-08,article,News,,"['Social Conditions and Trends', 'LIFE STYLES', 'Age, Chronological', 'Population', 'MARKETING AND MERCHANDISING', 'Children and Youth', 'Consumer Behavior']"
"Paid Notice: Deaths  FLAX, ARTHUR",2001-04-08,article,Paid Death Notice,,[]
MetroStars Win Physical Opening Game,2001-04-08,article,News,,[]
Drop the Gun,2001-04-08,article,News,,[]
Fire I. National Park Said to Be Endangered,2001-04-08,article,News,,[]
"Paid Notice: Deaths  KLUGER, ERICA",2001-04-08,article,Paid Death Notice,,[]
Royal Club Drops Sails on Admiral's Cup,2001-04-08,article,News,,[]
"Paid Notice: Memorials  HERTZ, MOE",2001-04-08,article,Paid Death Notice,,[]
The Blinding Power of Data,2001-04-08,article,News,,[]
"It's Home to Shea, La Guardia . . . And U.S. Indians",2001-04-08,article,News,,[]
A Classroom With Quiche At the Bell,2001-04-08,article,News,,"['French Language', 'Travel and Vacations']"
Officials See Program Cuts,2001-04-08,article,News,,[]
Cafeteria-Free Dining,2001-04-08,article,News,,[]
Personal Business; Fighting Back When Someone Steals Your Name,2001-04-08,article,News,,[]
"Responding To Rap, R & B Is Reborn",2001-04-08,article,News,,['Music']
Wild Hawaii,2001-04-08,article,Letter,,"['Gardens and Gardening', 'Travel and Vacations']"
Preparing to Sell A Scout Camp,2001-04-08,article,Letter,,[]
"After the Downsizing, a Downward Spiral",2001-04-08,article,News,,[]
In Search of Just Enough Audience,2001-04-08,article,News,,[]
Inside a Lifelong Dream of Desert Light,2001-04-08,article,News,,"['RODEN CRATER (ARIZONA)', 'Volcanoes', 'Art']"
Kitchawan Institute to Sell Center to a Research Group,2001-04-08,article,News,,[]
"The Diamond Game, Shedding Its Mystery",2001-04-08,article,Chronology,,[]
Which Way to Go After the Bear Market,2001-04-08,article,Interview,,[]
"MY MONEY, MY LIFE; The Work That Drains Life",2001-04-08,article,News,,[]
A Fan's Lament,2001-04-08,article,Letter,,['Television']
"Private Sector; Amid a Plunge, Waiting to Land",2001-04-08,article,News,,[]
Isles Lose To End A Season To Forget,2001-04-08,article,News,,[]
Environmental Rollbacks,2001-04-08,article,Editorial,,"['PUBLIC OPINION', 'Environment', 'Editorials', 'ELECTION ISSUES']"
Sports of The Times; Stopping Shots and Starting a Life,2001-04-08,article,News,,[]
Are Index Funds Great Literature?,2001-04-08,article,News,,[]
Gardiners Island: May It Rest in Peace,2001-04-08,article,Letter,,[]
London,2001-04-08,article,Letter,,"['Newsletters', 'Travel and Vacations', 'Computers and the Internet', 'Theater']"
Children Recycle to Create The Soul of a New Sculpture,2001-04-08,article,News,,[]
Corrections,2001-04-08,article,Correction,,"['Books and Literature', 'Correction Stories']"
Where Exuberant Dreams Often Sink Out of Sight,2001-04-08,article,News,,['Art']
"In a Colorful Campaign in Peru, 3 Points of View Emerge",2001-04-08,article,News,,"['ELECTION ISSUES', 'Politics and Government', 'Elections']"
"Paid Notice: Deaths  SAMUELS, ROBERT",2001-04-08,article,Paid Death Notice,,[]
Is Food Just Another Scapegoat?,2001-04-08,article,Letter,,"['Labeling and Labels', 'Consumer Protection', 'ALLERGIES', 'Food']"
Getting Married Today,2001-04-08,article,Letter,,['Books and Literature']
Invent a Brand Name,2001-04-08,article,News,,[]
Reckonings; Two Untrue Things,2001-04-08,article,Op-Ed,,"['Taxation', 'Law and Legislation']"
Music Listings,2001-04-08,article,News,,"['Art', 'Music', 'Theater', 'Deaths (Obituaries)']"
TRANSACTIONS,2001-04-08,article,List,,[]
Corrections,2001-04-08,article,Correction,,"['Correction Stories', 'Theater']"
Another Country,2001-04-08,article,News,,"['HOTELS AND MOTELS', 'Travel and Vacations']"
Books in Brief: Nonfiction,2001-04-08,article,Review,,"['Reviews', 'Books and Literature']"
The Sopranos,2001-04-08,article,Letter,,['Books and Literature']
"Paid Notice: Deaths  PATTERSON, RAYMOND R.",2001-04-08,article,Paid Death Notice,,[]
"Peace of Mind, and More, at the Push of a Button",2001-04-08,article,News,,[]
"The View From/Greenwich; For Abandoned Baby, It's Love to the Rescue",2001-04-08,article,News,,[]
New Composers in the Spotlight,2001-04-08,article,News,,[]
Talks Set to Begin On Sex Offender Site,2001-04-08,article,News,,[]
Corrections,2001-04-08,article,Correction,,"['HOTELS AND MOTELS', 'Prices (Fares, Fees and Rates)', 'Consumer Protection', 'Correction Stories', 'Travel and Vacations', 'Telephones and Telecommunications']"
Senators Are Nearing Compromise on Rescuing Failing Schools,2001-04-08,article,News,,[]
"Accidents, Like Careers In Acting, Do Pan Out",2001-04-08,article,News,,['Theater']
White House Plans to Revise New Medical Privacy Rules,2001-04-08,article,News,,[]
"Susan Lee, Stephen Ko",2001-04-08,article,News,,['Weddings and Engagements']
It Takes a Village a Year To Unearth Local History,2001-04-08,article,News,,[]
The Man in the Tux Dons His Tails,2001-04-08,article,News,,['Music']
"Rebecca Eisenberg, Curtis Smolar1",2001-04-08,article,News,,['Weddings and Engagements']
Article 2001040891100590264 -- No Title,2001-04-08,article,News,,[]
"You Let Your Hair Down, and This Barkeep Cuts It",2001-04-08,article,News,,[]
2001 Final Four Archive,2001-04-08,article,News,,[]
"Sean Combs: Unstoppable, Whatever His Guise",2001-04-08,article,News,,"['Art', 'Music', 'Blacks', 'Black People', 'APPAREL']"
Business Diary: A Stadium Name Deal Leaves Investors Fuming,2001-04-08,article,News,,['COMPANY AND ORGANIZATION PROFILES']
"Paid Notice: Deaths  GLEICH, VIVIEN LANDAY",2001-04-08,article,Paid Death Notice,,[]
A Move Against Claims Over Job Appraisals,2001-04-08,article,News,,[]
Corrections,2001-04-08,article,Correction,,[]
QUICK BITE/Pluckemin; What Else in Pluckemin but Chicken?,2001-04-08,article,News,,[]
Endpaper; Life With Mama,2001-04-08,article,News,,[]
A Curator in a Compelling World,2001-04-08,article,News,,[]
What Is It Worth?,2001-04-08,article,Letter,,"['Prices (Fares, Fees and Rates)', 'Photography']"
Bias Against Blacks in Blue?,2001-04-08,article,News,,[]
The Week in Review: April 1-8,2001-04-08,article,News,,"['Music', 'LABOR', 'Politics and Government', 'Elections']"
Read All About It,2001-04-08,article,News,,[]
"The Nation; A Hue, and a Cry, In the Heartland",2001-04-08,article,News,,"['ILLEGAL ALIENS', 'PUBLIC OPINION', 'IMMIGRATION AND REFUGEES']"
Kansas City: Culture in Many Forms,2001-04-08,article,News,,"['Baseball', 'Blacks', 'Black People', 'Museums', 'Travel and Vacations']"
Ideas & Trends; Putting a Price Tag On the Priceless,2001-04-08,article,News,,"['Water Pollution', 'Hazardous and Toxic Substances', 'Environment']"
"First Thought, Best Thought",2001-04-08,article,Review,,"['Reviews', 'Books and Literature']"
"Paid Notice: Deaths  LYNCH, GERTRUDE MCCORMICK",2001-04-08,article,Paid Death Notice,,[]
"NEIGHBORHOOD REPORT: MIDTOWN; Smokers, Driven Outside, Now Driven From Outside",2001-04-08,article,News,,[]
Travel Advisory,2001-04-08,article,News,,['Festivals']
Rangers Shift Their Attention To Next Season,2001-04-08,article,News,,[]
Letters,2001-04-08,article,News,,"['Editorials', 'Art', 'Reviews', 'Music']"
Corrections,2001-04-08,article,Correction,,"['Correction Stories', 'Travel and Vacations']"
Run A Successful Silicon Valley Business,2001-04-08,article,News,,[]
The Nation: Between the Lines; Getting To Know You: America Fills Fox's Dance Card,2001-04-08,article,News,,"['ILLEGAL ALIENS', 'United States International Relations', 'IMMIGRATION AND REFUGEES']"
Holding Back a Human Tide,2001-04-08,article,News,,[]
CHINESE INSISTING U.S. MUST DO MORE TO END STANDOFF,2001-04-08,article,News,,"['United States International Relations', 'Military Aircraft', 'UNITED STATES ARMAMENT AND DEFENSE']"
Around the World in a Day (With No Overtime),2001-04-08,article,News,,['Television']
The Chapter After 'The End',2001-04-08,article,Op-Ed,,"['Plagiarism', 'Books and Literature', 'Ethics']"
IN BRIEF; East Hampton Star Names New Editor,2001-04-08,article,News,,[]
A Star in Two Sports In the Same Season,2001-04-08,article,News,,[]
Budget Impasse in Albany,2001-04-08,article,Editorial,,"['Editorials', 'Education and Schools', 'Finances', 'Budgets and Budgeting']"
"Anna Lee, David Barry",2001-04-08,article,News,,['Weddings and Engagements']
New-Economy Worth,2001-04-08,article,Letter,,[]
A NIGHT OUT WITH: Michael Webber; Gin With Everything,2001-04-08,article,News,,"['Gin (Liquor)', 'ALCOHOLIC BEVERAGES']"
Article 2001040891928815434 -- No Title,2001-04-08,article,News,,[]
Budapest,2001-04-08,article,News,,['Travel and Vacations']
Corrections,2001-04-08,article,Correction,,[]
The City as the Star,2001-04-08,article,Letter,,['Television']
Risking a New War in the Balkans,2001-04-08,article,Op-Ed,,['WAR CRIMES AND CRIMINALS']
Corrections,2001-04-08,article,Correction,,"['Hinduism', 'Hindi Language', 'INDEPENDENCE MOVEMENTS AND SECESSION', 'Correction Stories', 'Suicides and Suicide Attempts', 'Terrorism']"
Another Sign Of Slowdown: Smaller Paychecks,2001-04-08,article,News,,[]
"Paid Notice: Deaths  FREDERSEN, ROSALIE S.",2001-04-08,article,Paid Death Notice,,[]
Zero Tolerance Changes Life At On School,2001-04-08,article,News,,"['VIOLENCE', 'Education and Schools', 'Crime and Criminals', 'Drug Abuse and Traffic']"
Personal Business Diary: A Move Against Claims Over Job Appraisals,2001-04-08,article,News,,"['States (US)', 'Population', 'Census']"
Parker Is Picture of Professionalism in Defeat,2001-04-08,article,News,,"['Baseball', 'Athletics and Sports', 'Running']"
"In Diplomacy School, Foreign Faces",2001-04-08,article,News,,"['Colleges and Universities', 'ENROLLMENT', 'FOREIGN STUDENTS', 'SPECIAL SECTIONS']"
"Or, Collaborations",2001-04-08,article,Letter,,"['MOTION PICTURES', 'Books and Literature']"
"Paid Notice: Deaths  GRAYSON, ARTHUR",2001-04-08,article,Paid Death Notice,,[]
The 'Big House' As Tourist Spot,2001-04-08,article,News,,[]
"PAPERBACK BEST SELLERS: April 8, 2001",2001-04-08,article,List,,[]
Point Given Romps to Victory at Santa Anita,2001-04-08,article,News,,[]
"Sins of the Father, Visited Upon the Mother",2001-04-08,article,News,,[]
Ballet Is No Longer Province of Young,2001-04-08,article,News,,[]
Street Scene,2001-04-08,article,Letter,,['Books and Literature']
A Walker in the Cité,2001-04-08,article,Review,,"['Reviews', 'Books and Literature']"
"Paid Notice: Deaths  VOGT, DONALD",2001-04-08,article,Paid Death Notice,,[]
Bodies and Basketball,2001-04-08,article,Letter,,[]
Dinner Parties: How Difficult Is Simple?,2001-04-08,article,News,,"['Cooking and Cookbooks', 'Parties (Social)']"
DataBank; Familiar Feeling as Second Quarter Starts,2001-04-08,article,News,,[]
Footlights,2001-04-08,article,News,,[]
Seeking Solutions For Chappaqua Swap Shop,2001-04-08,article,Letter,,[]
"Paid Notice: Deaths  SECUNDA, LOUIS, C.P.A.",2001-04-08,article,Paid Death Notice,,[]
2001 Final Four Archive,2001-04-08,article,News,,[]
On the Trail of a Few More Ancestors,2001-04-08,article,News,,"['Fossils', 'Evolution']"
"Paid Notice: Deaths  FIALKOFF, IVY",2001-04-08,article,Paid Death Notice,,[]
HOW TO; Make a One-Person Firm Seem Like a Giant Corporation,2001-04-08,article,News,,[]
HOW TO; Stop Telemarketers,2001-04-08,article,News,,[]
Island's Hospitals: Corporate vs. Community,2001-04-08,article,News,,[]
The Innocent Ways Of Renée Zellweger,2001-04-08,article,News,,['MOTION PICTURES']
April 1-7; A Jolt for Russian TV,2001-04-08,article,News,,[]
Revolution Rocks,2001-04-08,article,Review,,"['Reviews', 'Books and Literature']"
A Gracious Gift,2001-04-08,article,Letter,,[]
OPINION; When a Mall Goes Out of Control,2001-04-08,article,News,,[]
New & Noteworthy Paperbacks,2001-04-08,article,Review,,[]
"Condos in Washington: $1,000 a Square Foot and Up",2001-04-08,article,News,,[]
Valley Elder Goes to Washington,2001-04-08,article,News,,"['Education and Schools', 'ADVERTISING', 'United States Politics and Government', 'PRIMARIES']"
'I Know It When I See It',2001-04-08,article,News,,[]
Peckish in an Unfamiliar Place,2001-04-08,article,News,,"['Restaurants', 'Ratings and Rating Systems', 'Roads and Traffic', 'Travel and Vacations', 'Computers and the Internet', 'GUIDEBOOKS']"
Talking Irish,2001-04-08,article,Review,,"['Reviews', 'Books and Literature']"
The Belle in New Jersey,2001-04-08,article,News,,[]
State Considers Limits on Teenage Drivers,2001-04-08,article,News,,[]
"Vocalism in Her Soul, Drama in Her Blood",2001-04-08,article,News,,['Opera']
"Valerie Rodriguez, Scott McMurray",2001-04-08,article,News,,['Weddings and Engagements']
"Once the Wallflower, Bonds Now Have Suitors",2001-04-08,article,News,,[]
The Money Boat,2001-04-08,article,News,,"['Ships and Shipping', 'Travel and Vacations', 'Cruises']"
April 1-7; The Idea Einstein Hated,2001-04-08,article,News,,[]
Are You in Anthropodenial?,2001-04-08,article,Review,,"['Books and Literature', 'Reviews']"
Bush Calls on Public To Lobby Congress,2001-04-08,article,News,,[]
The Blossoms Are Indoors,2001-04-08,article,News,,['Parties (Social)']
Woods Gets Historic Win at Augusta,2001-04-08,article,News,,[]
A Lawyer's Workload,2001-04-08,article,Letter,,"['Wages and Salaries', 'Legal Aid for the Poor', 'Ethics']"
"Easter Brunch: Ham, Lamb and More",2001-04-08,article,Review,,[]
A Kick in the Shins,2001-04-08,article,Letter,,['Music']
The Way We Live Now: 4-08-01; How to E-Mail Like a C.E.O.,2001-04-08,article,News,,[]
No End to the Tears: A Latino Rally Recalls a Killing,2001-04-08,article,News,,[]
Climbing in Nepal,2001-04-08,article,Letter,,"['Mountain Climbing', 'Travel and Vacations']"
Is Food Just Another Scapegoat?,2001-04-08,article,News,,"['Editorials', 'Food', 'Food Contamination and Poisoning', 'Diet and Nutrition']"
Meals on Wheels,2001-04-08,article,Review,,"['Reviews', 'Books and Literature']"
. . . or the Shoes,2001-04-08,article,Letter,,[]
"Paid Notice: Deaths  WEINBAUM, SAMUEL",2001-04-08,article,Paid Death Notice,,[]
"Paid Notice: Deaths  SCHAPIRO, DR. IVOR",2001-04-08,article,Paid Death Notice,,[]
M.T.A. Drops Plan For Greenlawn Yard,2001-04-08,article,News,,[]
Not Loving Thy Neighbor,2001-04-08,article,News,,[]
BENEFITS,2001-04-08,article,Schedule,,[]
Anytime Riesling,2001-04-08,article,Review,,[]
"Fair Housing, Equal Opportunity",2001-04-08,article,Letter,,[]
"Just Sitting Around Thinking, or Not",2001-04-08,article,News,,"['Education and Schools', 'SPECIAL SECTIONS']"
On the Parkway Again,2001-04-08,article,News,,[]
When Dance Gets To Be Ordinary,2001-04-08,article,News,,['Dancing']
Corrections,2001-04-08,article,Correction,,[]
April 1-7; Blair Puts Off an Election,2001-04-08,article,News,,[]
A Stadium Name Deal Leaves Investors Fuming,2001-04-08,article,News,,[]
Playoff Race Intense For Western Teams,2001-04-08,article,News,,[]
Books in Brief: Nonfiction,2001-04-08,article,Review,,"['Reviews', 'Books and Literature']"
April 1-7; Woody Sounds Off,2001-04-08,article,News,,[]
HOW TO; Make A Frank Gehry Building,2001-04-08,article,News,,[]
So Could Overuse . . .,2001-04-08,article,Letter,,[]
"Sheila Easley, Lee Norton",2001-04-08,article,News,,['Weddings and Engagements']
Central Park Wilding,2001-04-08,article,Letter,,"['Police Brutality and Misconduct', 'Puerto Ricans', 'Sex Crimes', 'Puerto Rican Day', 'Police']"
Political Briefing; Illinois Candidate Is One for the Ages,2001-04-08,article,News,,[]
"Melissa Rayworth, Edward Anthony",2001-04-08,article,News,,['Weddings and Engagements']
Lawyers Often Fail New York's Poor,2001-04-08,article,Series,,"['Courts', 'Legal Aid for the Poor', 'Crime and Criminals']"
Sports of The Times; How Bobby Jones Planned the First Grand Slam,2001-04-08,article,News,,[]
Woman of the Cloth,2001-04-08,article,Review,,"['Reviews', 'Books and Literature']"
Greene's Team Wins Race in Texas Relays,2001-04-08,article,News,,[]
As I Lay Drowning,2001-04-08,article,Review,,"['Reviews', 'Books and Literature']"
Beyond the Back of Beyond,2001-04-08,article,Review,,"['Reviews', 'Books and Literature']"
Article 2001040891031145854 -- No Title,2001-04-08,article,News,,[]
April 1-7; Bush Meets Mubarak,2001-04-08,article,News,,[]
Eagles Settle an Old Score With the Sioux,2001-04-08,article,News,,[]
BOOKSHELF,2001-04-08,article,News,,[]
Is Food Just Another Scapegoat?,2001-04-08,article,Letter,,"['Diet and Nutrition', 'Consumer Behavior', 'Food Contamination and Poisoning', 'Food']"
Dance Listings,2001-04-08,article,News,,"['Music', 'Dancing', 'ALCOHOLIC BEVERAGES']"
FOLLOWING UP,2001-04-08,article,News,,[]
Talk of Lost Farms Reflects Muddle of Estate Tax Debate,2001-04-08,article,News,,"['AGRICULTURE', 'PUBLIC OPINION', 'Taxation', 'ESTATES', 'Wills and Estates']"
"Paid Notice: Deaths  LUCIANO, MICHAEL J.",2001-04-08,article,Paid Death Notice,,[]
Panama,2001-04-08,article,Letter,,"['HOTELS AND MOTELS', 'Travel and Vacations']"
A Time and Place That Sustained Wealth and Art,2001-04-08,article,News,,[]
"Editorial Observer; Poland Faces an Ugly Truth, and Doesn't Blink",2001-04-08,article,Editorial,,"['JEWS', 'WAR CRIMES AND CRIMINALS', 'PUBLIC OPINION', 'ANTI-SEMITISM', 'Editorials', 'Nazi Policies Toward Jews and Minorities']"
Out of Contextualism,2001-04-08,article,News,,[]
Angles of Approach,2001-04-08,article,Review,,"['Reviews', 'Books and Literature']"
When Politics as Usual Has An Unusually Ominous Ring,2001-04-08,article,News,,[]
Residential Sales,2001-04-08,article,List,,[]
Mourning Progressing More Than Heat,2001-04-08,article,News,,[]
Passion Play Article Neglected History,2001-04-08,article,Letter,,[]
INSIDE,2001-04-08,article,Summary,,[]
Biology Text Illustrations More Fiction Than Fact,2001-04-08,article,News,,[]
Multitask,2001-04-08,article,News,,[]
Those Chasing Woods Think They Have a Shot,2001-04-08,article,News,,[]
"Paid Notice: Deaths  EPSTEIN, NATHAN",2001-04-08,article,Paid Death Notice,,[]
POSTINGS: Architect's 1934 House for Rent; Follow The Glass Block Wall,2001-04-08,article,News,,[]
"Of Love, Betrayal and the Promenade",2001-04-08,article,News,,[]
"Another University, Another Turnaround",2001-04-08,article,News,,[]
The Risks for Readers When Actors Move In,2001-04-08,article,News,,['MOTION PICTURES']
"Paid Notice: Deaths  EPSTEIN, JERRY",2001-04-08,article,Paid Death Notice,,[]
Adult Day Care Center Named for a Pastor,2001-04-08,article,News,,[]
It's Easier To Be Green,2001-04-08,article,News,,"['PUBLIC OPINION', 'Vegetarianism', 'Mad Cow Disease (Bovine Spongiform Encephalopathy)', 'Consumer Behavior', 'Food Contamination and Poisoning', 'Food']"
"The World; Whose Plane Is It, Anyway?",2001-04-08,article,News,,"['Accidents and Safety', 'AIRLINES AND AIRPLANES', 'United States International Relations', 'Espionage', 'Military Aircraft', 'Law and Legislation']"
U.S. Finding Alliances On Rights Are Tangled,2001-04-08,article,News,,"['United States International Relations', 'Courts', 'WAR CRIMES AND CRIMINALS', 'Treaties', 'Freedom and Human Rights']"
Mailbox: Stress Could Play Role in Injuries,2001-04-08,article,News,,"['Basketball', 'Baseball', 'Tennis', 'Discrimination']"
What Now in Roosevelt Field's Court Fight?,2001-04-08,article,News,,[]
L.I.@WORK,2001-04-08,article,News,,[]
"3-Card Monte Is Vanishing, Just Like Your $50 Bill Did",2001-04-08,article,News,,[]
In the Region/Westchester; A Rye Brook Project Invokes New Urbanism's Ideas,2001-04-08,article,News,,[]
North Korea Gives Priority to Military,2001-04-08,article,News,,"['ARMAMENT, DEFENSE AND MILITARY FORCES']"
Taking On the Saint of Indexing,2001-04-08,article,News,,[]
"Sundays in the Kitchen, Singing Along With Aretha",2001-04-08,article,News,,"['Art', 'Music', 'Poetry and Poets', 'Jewels and Jewelry']"
"Paid Notice: Deaths  EGLI, KONRAD",2001-04-08,article,Paid Death Notice,,[]
Solve The New York Times Crossword Puzzle,2001-04-08,article,News,,[]
HOW TO; Hop A Freight Train,2001-04-08,article,News,,[]
"Paid Notice: Deaths  BLUE, DONALD JOSEPH",2001-04-08,article,Paid Death Notice,,[]
Touch of New Orleans Comes to Oakdale,2001-04-08,article,Review,,[]
Condensed Business Course Available in a New Book,2001-04-08,article,News,,[]
If You're Thinking of Living In/Syosset; A Hamlet Where the Schools Are Stellar,2001-04-08,article,News,,[]
How to Create and Maintain a Web Site,2001-04-08,article,News,,[]
Boat's New Berth,2001-04-08,article,News,,[]
IN THE STUDIO WITH/Kendall Klingbeil; 'Energy Painter' Creates Art That Makes People Feel Good,2001-04-08,article,Interview,,[]
Get Into College After Being Rejected,2001-04-08,article,News,,[]
"A Soap Opera That Goes to Hell, Among Other Places",2001-04-08,article,News,,['Television']
"Paid Notice: Deaths  BRENNER, SEYMOUR DR.",2001-04-08,article,Paid Death Notice,,[]
"Silents, Please",2001-04-08,article,News,,"['MOTION PICTURES', 'SILENT MOVIE THEATRE (HOLLYWOOD)', 'Travel and Vacations']"
Unchaining a No-Longer-Temporary Marble Arch,2001-04-08,article,News,,[]
Lighting Up a House With the Sun's Power,2001-04-08,article,News,,[]
Cook The Basics Like Daniel Boulud,2001-04-08,article,News,,[]
Habitats/Crown Heights; A Brooklyn Compromise,2001-04-08,article,News,,[]
One Family's Wandering Comes to an End,2001-04-08,article,News,,[]
TEAMSTERS AT THE SLOTS,2001-04-08,article,News,,[]
"Private Sector; Dow Is Down, but So Is Decibel Level",2001-04-08,article,News,,[]
Cajun Flavor at the McCarter,2001-04-08,article,News,,[]
FIELD OFFER WITHDRAWN,2001-04-08,article,News,,[]
Bellying Up to the Bar,2001-04-08,article,News,,[]
BackTalk; New York Fans Have Code of Excellence,2001-04-08,article,News,,[]
Asian Art Museum Reopens in Paris,2001-04-08,article,News,,"['Restoration and Rehabilitation', 'Museums', 'Art', 'Travel and Vacations']"
Patterned Glass That Lets Light In,2001-04-08,article,News,,['Windows']
Dancing With Critics,2001-04-08,article,News,,"['Indians, American', 'Mascots', 'Discrimination', 'SPECIAL SECTIONS', 'Football']"
"Butterflies Are Free, Again",2001-04-08,article,News,,"['APPAREL', 'Butterflies and Moths']"
The Way We Live Now: 4-08-01: Recommendations; How to Upgrade,2001-04-08,article,News,,[]
Celebrating Passover With Some Old Friends,2001-04-08,article,News,,[]
"JAN.1-MARCH 31,2001",2001-04-08,article,News,,[]
"Von Trier and Wagner, a Bond Sealed in Emotion",2001-04-08,article,News,,['MOTION PICTURES']
"Alexis Topjian, Scott Stephan",2001-04-08,article,News,,['Weddings and Engagements']
And Bear In Mind,2001-04-08,article,Review,,[]
Run In 2004,2001-04-08,article,News,,[]
Parking Rules,2001-04-08,article,Schedule,,[]
"PrivateSector; Amid a Plunge, Waiting to Land",2001-04-08,article,News,,[]
"Frederick Rath, 87, Pioneer Of Historical Conservation",2001-04-08,article,Biography; Obituary,,[]
"April 1-7; Outta My Way, Dude",2001-04-08,article,News,,[]
Chinese Team Defeats U.S. In First of a 4-Match Series,2001-04-08,article,News,,[]
Words to Win By,2001-04-08,article,News,,[]
Q & A,2001-04-08,article,Question,,[]
"In Money Funds, Awaiting Dawn",2001-04-08,article,News,,[]
"Renée Chenault, Chaka Fattah",2001-04-08,article,News,,['Weddings and Engagements']
Yearbooks That Speak Volumes,2001-04-08,article,News,,"['COMPUTER SOFTWARE', 'CD-ROM (COMPACT DISC-READ ONLY MEMORY)', 'Education and Schools', 'Colleges and Universities', 'SPECIAL SECTIONS', 'Yearbooks', 'Computers and the Internet']"
Darwin vs. Design: Evolutionists' New Battle,2001-04-08,article,News,,"['Bible', 'Education and Schools', 'CREATIONISM', 'Biology and Biochemistry', 'Evolution']"
Great Expectations,2001-04-08,article,News,,"['ILLEGAL ALIENS', 'IMMIGRATION AND REFUGEES', 'Finances', 'Colleges and Universities', 'SPECIAL SECTIONS']"
