headline,date,doc_type,material_type,section,keywords
2nd Banana Whose Taste Is Irresistible,2005-09-23,article,News,,"['Comedy and Humor', 'Television']"
Khodorkovsky Appeal Rejected,2005-09-23,article,News,,[]
Baker Adds Another Dimension to the Jets,2005-09-23,article,News,,['Football']
Manna From Hollywood: Charity Begins on TV,2005-09-23,article,Review,,['Television']
Agency Calls on Frist About Timing of Stock Sale,2005-09-23,article,News,,[]
911 Call About Stabbings Sent Police to Wrong Place,2005-09-23,article,News,,[]
Corrections,2005-09-23,article,Correction,,[]
"West Presses for Nuclear Agency to Rebuke Iran, Despite Russian Dissent",2005-09-23,article,News,,[]
"Paid Notice: Deaths   FROIMSON, ALFRED",2005-09-23,article,Paid Death Notice,,[]
Spare Times,2005-09-23,article,Schedule,,[]
"Paid Notice: Deaths   KENNEDY, ELIZABETH",2005-09-23,article,Paid Death Notice,,[]
Embattled Commissioner of F.D.A. Resigns,2005-09-23,article,News,,[]
"Raise the Gas Tax, Save the Planet",2005-09-23,article,Letter,,[]
Germany's bleak future; Europe's Turkey question,2005-09-23,article,News,,[]
Metro Briefing | New York: Manhattan: Truck Fire Snarls Bridge Traffic,2005-09-23,article,News,,[]
Oracle Profit Flat in First Quarter; Database Business Slowed,2005-09-23,article,News,,['Computers and the Internet']
Art in Review,2005-09-23,article,Review,,['Art']
Hamas Leader Guilty in Two Deadly Attacks,2005-09-23,article,News,,[]
WHAT'S ON TONIGHT,2005-09-23,article,Schedule,,[]
"Paid Notice: Deaths   DREYER, HARVEY",2005-09-23,article,Paid Death Notice,,[]
"One father, back in court",2005-09-23,article,News,,[]
Drug Treatments for Schizophrenia,2005-09-23,article,Letter,,[]
Polish election may decide pace of conversion to euro,2005-09-23,article,News,,[]
"Meanwhile: Katrina, the Mississippi and the farm",2005-09-23,article,News,,[]
"Raise the Gas Tax, Save the Planet",2005-09-23,article,Letter,,[]
"For Hotelier, Crisis Is Another Word for Opportunity",2005-09-23,article,News,,"['Mergers, Acquisitions and Divestitures', 'HOTELS AND MOTELS', 'KATRINA (STORM)', 'Floods', 'Hurricanes and Tropical Storms']"
Briefly: Senate passes huge bill on food and agriculture,2005-09-23,article,News,,[]
Star Parties,2005-09-23,article,News,,"['Space', 'Parties (Social)', 'Astronomy and Astrophysics']"
"In the O.C., a Walkable Island With Neighbors Nearby",2005-09-23,article,News,,"['GEOGRAPHIC PROFILES', 'Travel and Vacations']"
Corrections,2005-09-23,article,Correction,,[]
"Once Disaster Hits, It Seems Never to End",2005-09-23,article,Review,,"['MOTION PICTURES', 'Reviews']"
Editorial Observer: Changing the Rules for the Team Sport of Bread-Winning,2005-09-23,article,Editorial,,"['LABOR', 'Men', 'Children and Youth', 'Women', 'Families and Family Life']"
Is the World Suffering From Too Much Martha?,2005-09-23,article,News,,['Television']
World Business Briefing | Americas: Venezuela: Mining Investigation,2005-09-23,article,News,,[]
"In One Ohio Town, a Fading Sport Is Still King, for a Day",2005-09-23,article,News,,['Horse Racing']
China Lectured by Taiwan Ally,2005-09-23,article,News,,"['COMMUNISM', 'Politics and Government']"
Senate panel strongly backs Roberts,2005-09-23,article,News,,[]
Math Scores Statewide Show Gains in 4th Grade,2005-09-23,article,News,,"['Education and Schools', 'Tests and Testing']"
Briefly: Political parties vow to boycott elections,2005-09-23,article,News,,[]
TRANSACTIONS,2005-09-23,article,List,,[]
Louisiana Lawmakers Propose $250 Billion Recovery Package,2005-09-23,article,News,,[]
"Pataki's in China, but the Briefing Is in Albany",2005-09-23,article,News,,[]
"With Faith and Hope, Some Stay Put in Galveston",2005-09-23,article,News,,['Hurricanes and Tropical Storms']
National Briefing | Midwest: Illinois: Indictments Of Chicago Officials,2005-09-23,article,News,,"['Mayors', 'Frauds and Swindling', 'Hiring and Promotion', 'Ethics', 'Government Employees']"
Dickensian Deprivations Delivered From the Gut,2005-09-23,article,Review,,"['MOTION PICTURES', 'Reviews', 'Books and Literature']"
"5 Days After Title Bout, Fighter Dies of Injuries",2005-09-23,article,News,,['Boxing']
"Currencies: As fears of storm ebb, the dollar moves up",2005-09-23,article,News,,[]
"Panel Approves Roberts, 13-5, As 3 of 8 Democrats Back Him",2005-09-23,article,News,,"['Judges', 'Appointments and Executive Changes']"
Two Major Collections Land at Christie's,2005-09-23,article,News,,"['Auctions', 'Art']"
Background: Reporting on the Aspirations of Young Women,2005-09-23,article,News,,[]
Airbus Chief Sees Some Virtue in High Oil Prices,2005-09-23,article,News,,['FUEL']
"Halt Hockey Arena, Forrester Urges",2005-09-23,article,News,,[]
Cristina Iglesias,2005-09-23,article,Review,,[]
A Detective Used to Finding Killers and Losing Partners,2005-09-23,article,Review,,['Television']
"Paid Notice: Deaths   HOROWITZ, RAYMOND",2005-09-23,article,Paid Death Notice,,[]
"Paid Notice: Deaths   FREUND, SERENA",2005-09-23,article,Paid Death Notice,,[]
Crave Huge Risk? This Investment May Be for You,2005-09-23,article,News,,"['Mergers, Acquisitions and Divestitures']"
Drug Treatments for Schizophrenia,2005-09-23,article,Letter,,[]
France offers an incentive for 3rd child,2005-09-23,article,News,,[]
Scalia Defends Government's Right to Deny Art Funds,2005-09-23,article,News,,[]
Free software targets pirating,2005-09-23,article,News,,[]
"Paid Notice: Deaths   WEISS, MELVIN",2005-09-23,article,Paid Death Notice,,[]
Ukraine approves new prime minister,2005-09-23,article,News,,[]
With Interest:Be careful what you tax,2005-09-23,article,News,,[]
Metro Briefing | New York: Staten Island: Three Highway Workers Hit By Truck,2005-09-23,article,News,,[]
Little House on the Flood Plain,2005-09-23,article,Editorial,,"['HOMESTEADING', 'Vouchers', 'MOBILE HOMES', 'Housing', 'Renting and Leasing', 'Editorials', 'KATRINA (STORM)', 'HURRICANE KATRINA', 'Law and Legislation', 'Hurricanes and Tropical Storms']"
Latest Trump Venture Is in Jersey City,2005-09-23,article,News,,['Buildings (Structures)']
The Last Playboy: The High Life of Porfirio Rubirosa,2005-09-23,article,News,,[]
Pentagon defends its growing reliance on foreign contractors,2005-09-23,article,News,,[]
"Plath and Hughes: Good Times, Bad Times and All the Rest of It",2005-09-23,article,News,,"['Poetry and Poets', 'Writing and Writers', 'Books and Literature', 'Museums']"
U.S. will be judging India on its stance toward Iran,2005-09-23,article,News,,[]
National Briefing | Washington: Antiwar Protest Is Scheduled,2005-09-23,article,News,,"['United States International Relations', 'Demonstrations and Riots', 'UNITED STATES ARMAMENT AND DEFENSE']"
The Listings: Sept. 23-Sept. 29; THE WHITE STRIPES,2005-09-23,article,News,,[]
"Paid Notice: Deaths   KAUFMAN, SIDNEY",2005-09-23,article,Paid Death Notice,,[]
Metro Briefing | New York: Queens: School Bus Employees Arraigned,2005-09-23,article,News,,[]
Europeans thumb their noses at the experts,2005-09-23,article,News,,[]
Science and Uncertainty,2005-09-23,article,Letter,,[]
Six Die in Two Blasts in Pakistan,2005-09-23,article,News,,[]
Correction,2005-09-23,article,Correction,,"['Correction Stories', 'Travel and Vacations']"
"Paid Notice: Deaths   CURRAN, MARYLYN.",2005-09-23,article,Paid Death Notice,,[]
"Kill the Light, Save a Bird",2005-09-23,article,News,,['Birds']
"Europa: A generous state pays, and avoids hard reality",2005-09-23,article,News,,[]
Returning to Familiar Form,2005-09-23,article,News,,['Baseball']
At the Gothic Crossroads of Prague,2005-09-23,article,Review,,"['Museums', 'Art']"
Look it up: Language programs,2005-09-23,article,News,,[]
"Paid Notice: Deaths   BACHRACH, DORIS (NEE MAYDIN)",2005-09-23,article,Paid Death Notice,,[]
Suspect in effort to bomb London train ischarged,2005-09-23,article,News,,[]
BUSINESS DIGEST,2005-09-23,article,Summary,,[]
Key rates,2005-09-23,article,Statistics,,[]
Indicators Drop; Joblessness Up,2005-09-23,article,News,,"['HURRICANE KATRINA', 'Unemployment']"
EU is still seeking a way to take Iran issue to UN,2005-09-23,article,News,,[]
Hall of Fame Inductees Happily Spread New York Roots,2005-09-23,article,News,,"['Halls of Fame', 'Basketball']"
"In Disc Golf, Stardom Avoids You, and You Avoid the Salad Bar",2005-09-23,article,News,,"['DISC GOLF', 'Athletics and Sports']"
Utah and Nuclear Waste,2005-09-23,article,Letter,,[]
Joint Trial for 9 Srebrenica Suspects,2005-09-23,article,News,,[]
Where Hikers Run Out of Trail,2005-09-23,article,News,,"['Walking', 'Hiking', 'Travel and Vacations']"
Paloma Varga Weisz,2005-09-23,article,Review,,[]
"Paid Notice: Deaths   LONG, REV. JOHN F., S.J.",2005-09-23,article,Paid Death Notice,,[]
"She Sees Dead People, and Offers Them a Sympathetic Ear",2005-09-23,article,Review,,['Television']
Willis Outplays Martínez on Mound and at the Plate,2005-09-23,article,News,,['Baseball']
Hospitals Move Swiftly to Evacuate Patients,2005-09-23,article,News,,"['Hospitals', 'Hurricanes and Tropical Storms']"
Events of 43rd New York Film Festival,2005-09-23,article,News,,"['MOTION PICTURES', 'New York Film Festival']"
The French table: Theater of the absurd?,2005-09-23,article,News,,[]
"Paid Notice: Deaths   FORRELL, GENE",2005-09-23,article,Paid Death Notice,,[]
North Korea signals desire to negotiate,2005-09-23,article,News,,[]
Earlier Landing Gear Problems in Airbus Jets,2005-09-23,article,News,,"['Accidents and Safety', 'AIRLINES AND AIRPLANES']"
Children in Hurricanes,2005-09-23,article,Letter,,[]
Cycling: Australian rider gets his 'fantastic' finish,2005-09-23,article,News,,[]
"World Briefings: Europe, Middle East, Asia, Americas, United Nations",2005-09-23,article,News,,[]
News Analysis: Following the trajectory of the candidate Merkel,2005-09-23,article,News,,[]
Judge Finds Nudity Charge Too Skimpy,2005-09-23,article,News,,[]
"Delta to cut salaries and 8,000 more jobs",2005-09-23,article,News,,[]
Gunmen in Kyrgyzstan assassinate top legislator,2005-09-23,article,News,,[]
Metro Briefing | New York: Manhattan: Port Authority Gives To 9/11 Memorial,2005-09-23,article,News,,[]
World Briefing | United Nations: High Death Rates For Muslim Children,2005-09-23,article,News,,[]
Corrections,2005-09-23,article,Correction,,[]
"Paid Notice: Deaths  VACCHIANO, WILLIAM",2005-09-23,article,Paid Death Notice,,[]
3rd Antiwar Defendant Is Held in Contempt,2005-09-23,article,News,,['Demonstrations and Riots']
International Team Relishes Underdog Role,2005-09-23,article,News,,['Golf']
Lottery,2005-09-23,article,News,,[]
Hunting for a Child No One Believes Is There,2005-09-23,article,Review,,"['MOTION PICTURES', 'Reviews']"
"Facing His Irish Recruits, Willingham Drives Ahead",2005-09-23,article,News,,"['Coaches and Managers', 'Football']"
Leading a Rooftop Rescue by the Dawn's Early Light,2005-09-23,article,News,,"['Rescues', 'HURRICANE KATRINA']"
Yonkers Enlists Badillo to Investigate School Finances,2005-09-23,article,News,,['Education and Schools']
"Paid Notice: Deaths   ARLT, PAUL T.",2005-09-23,article,Paid Death Notice,,[]
"Paid Notice: Deaths   FLORSHEIM, HARRIETTE D.",2005-09-23,article,Paid Death Notice,,[]
Bloomberg on Top of the World. But the World Trade Center?,2005-09-23,article,News,,"['Mayors', 'World Trade Center (NYC)', 'Elections']"
Salute to the 130th Anniversary of the Art Students League,2005-09-23,article,Review,,[]
Resurgent Run Defense Will Receive a Big Test,2005-09-23,article,News,,['Football']
Corrections,2005-09-23,article,Correction,,[]
Ex-Pharmaceutical Executive Sentenced to 8 Years in the Beating Death of His Wife,2005-09-23,article,News,,['Murders and Attempted Murders']
"Arts, Briefly; 'Lost' Draws a Crowd",2005-09-23,article,News,,[]
Bus Carrying Elderly Storm Evacuees Explodes Near Dallas,2005-09-23,article,News,,[]
Why His Peers Say Kozlowski Got Off Easy,2005-09-23,article,News,,"['Frauds and Swindling', 'Executives and Management', 'PUBLIC OPINION', 'Securities and Commodities Violations', 'Sentences (Criminal)', 'Ethics', 'Crime and Criminals']"
"Paid Notice: Deaths   HESSE, HENRY H.",2005-09-23,article,Paid Death Notice,,[]
Theodore Barber Dies at 78; Was Major Critic of Hypnosis,2005-09-23,article,Obituary; Biography,,['Deaths (Obituaries)']
Where's the Party? Scottsdale!,2005-09-23,article,News,,"['GEOGRAPHIC PROFILES', 'Travel and Vacations', 'NIGHTCLUBS AND CABARETS']"
"Paid Notice: Deaths   BEDER, EILEEN",2005-09-23,article,Paid Death Notice,,[]
"Vexed by Rivalries and Deficits, Italy's Economy Minister Quits",2005-09-23,article,News,,['Finances']
Newly Crowded Homes and Towns Strain at the Seams,2005-09-23,article,News,,['HURRICANE KATRINA']
Ukraine Parliament Approves New Premier After Rivals' Deal,2005-09-23,article,News,,['Politics and Government']
Where Is Love?,2005-09-23,article,Letter,,[]
"Arts, Briefly; Daniel Pearl Music Days",2005-09-23,article,News,,[]
Drug Treatments for Schizophrenia,2005-09-23,article,Letter,,[]
"Prospects growing worse for Iraqis, Saudi warns",2005-09-23,article,News,,[]
"Glamorous Southern Outlaws, Singing",2005-09-23,article,Review,,['Theater']
He's Got to Put It All Down in a Letter (to His Gun),2005-09-23,article,Review,,"['MOTION PICTURES', 'Reviews', 'Firearms']"
Senator Frist's Stock Sale,2005-09-23,article,Editorial,,"['Editorials', 'Ethics']"
Energy Group Plans to Build Nuclear Plants in Gulf States,2005-09-23,article,News,,['Regulation and Deregulation of Industry']
TechBrief: BT division to run local phone lines,2005-09-23,article,News,,[]
A Casualty Whose Words Were Weapons,2005-09-23,article,News,,[]
The Bears Are Bouncing Back,2005-09-23,article,News,,['Football']
Magnificent Desolation,2005-09-23,article,Review,,"['MOTION PICTURES', 'Reviews']"
Orlan/Brian Belott,2005-09-23,article,Review,,[]
Witnesses differ on private's role in abuse,2005-09-23,article,News,,[]
Briefly: IMF open to new agreement,2005-09-23,article,News,,[]
Texans flee powerful storm,2005-09-23,article,News,,[]
EU proposes changes in air security rules,2005-09-23,article,News,,[]
"Other Views: Daily Star, Times of India, Philadelphia Inquirer",2005-09-23,article,News,,[]
H.D.S. Greenway: Hamas on the ballot,2005-09-23,article,News,,[]
The Listings: Sept. 23-Sept. 29; MATTHEW MORRISON,2005-09-23,article,News,,[]
Adam Dant,2005-09-23,article,Review,,[]
Gay Men Ponder Impact of Proposal by Vatican,2005-09-23,article,News,,"['Priests', 'Homosexuality']"
"Have Nail Gun, Will Travel: Contractors Arrive",2005-09-23,article,News,,"['HURRICANE KATRINA', 'Buildings (Structures)']"
Jim Isermann,2005-09-23,article,Review,,[]
"Paid Notice: Deaths   GREENSPAN, PHYLLIS",2005-09-23,article,Paid Death Notice,,[]
Metro Briefing | New York: Bronx: Ex-Boyfriend Sought In Woman's Beating,2005-09-23,article,News,,[]
"Renewing Spirits, Mostly His Own",2005-09-23,article,News,,"['Music', 'HURRICANE KATRINA']"
National Briefing | Washington: Police Mistreatment Of Gay Men Is Called Common,2005-09-23,article,News,,"['Police Brutality and Misconduct', 'Transsexuals', 'Homosexuality']"
"Delta to Cut $3 Billion More, in Both Paychecks and Planes",2005-09-23,article,News,,"['AIRLINES AND AIRPLANES', 'Bankruptcies']"
Metro Briefing | New Jersey: Newark: Ridership Record For New Jersey Transit,2005-09-23,article,News,,[]
Where deals are made,2005-09-23,article,News,,[]
Corrections: For the Record,2005-09-23,article,Correction,,[]
The Frequent Traveler: Counting the cost of rocketing oil prices to airline customers,2005-09-23,article,News,,[]
The Listings: Sept. 23-Sept. 29; JOHN COLTRANE'S 79TH-BIRTHDAY CELEBRATION,2005-09-23,article,News,,[]
A Photographer Captivated by Wax and Fragments From the Past,2005-09-23,article,Review,,"['Photography', 'Art']"
"Paid Notice: Deaths   SEGAL, ROSE (ZIMAND)",2005-09-23,article,Paid Death Notice,,[]
Let Other Doctors Save Lives; These Specialists Create Them,2005-09-23,article,Review,,['Television']
Metro Briefing | New York: Labor Leader To Be Host Of Cable Show,2005-09-23,article,News,,[]
"At Abuse Trial, Two Accounts of Why G.I. Was in Photos",2005-09-23,article,News,,['Guards']
National Briefing | New England: Rhode Island: Court Denies Access To Records,2005-09-23,article,News,,"['Mormons (Church of Jesus Christ of Latter-Day Saints)', 'ADOPTIONS', 'Church-State Relations', 'Decisions and Verdicts']"
John McLaughlin,2005-09-23,article,Review,,[]
Corrections,2005-09-23,article,Correction,,[]
"Nice America, enthralled by violence",2005-09-23,article,News,,[]
"In Katrina Relief, Some Leagues Are Digging Deeper",2005-09-23,article,News,,[]
"Paid Notice: Deaths   BROD, ALBERT T.",2005-09-23,article,Paid Death Notice,,[]
Corrections,2005-09-23,article,Correction,,[]
QUOTATION OF THE DAY,2005-09-23,article,News,,['QUOTATION OF THE DAY']
"Canada, new home to Bollywood",2005-09-23,article,News,,[]
CyberSource to Bid for Credit Card Processor,2005-09-23,article,News,,[]
National Briefing | Washington: A New Head Start Bill,2005-09-23,article,News,,"['Education and Schools', 'Teachers and School Employees', 'Law and Legislation', 'Church-State Relations', 'Head Start Program']"
"Paid Notice: Deaths   GARTEN, LILA",2005-09-23,article,Paid Death Notice,,[]
The fault is not in the stars,2005-09-23,article,News,,[]
Top Shiite Cleric Is Planning To Urge Iraqis to Back Charter,2005-09-23,article,News,,[]
Dirty Love,2005-09-23,article,Review,,"['MOTION PICTURES', 'Reviews']"
"With an Agent and a Part, He Just Needs a Line Now",2005-09-23,article,Review,,['Television']
Arno Rafael Minkkinen,2005-09-23,article,Review,,[]
"Some got off the bus, 'but not all of them could'",2005-09-23,article,News,,[]
The Big Uneasy,2005-09-23,article,Op-Ed,,"['United States International Relations', 'United States Economy', 'KATRINA (STORM)', 'Oil (Petroleum) and Gasoline', 'HURRICANE KATRINA', 'Finances', 'Prices (Fares, Fees and Rates)', 'Budgets and Budgeting', 'Hurricanes and Tropical Storms', 'UNITED STATES ARMAMENT AND DEFENSE']"
U.S. and EU edge closer on farming,2005-09-23,article,News,,[]
"Arts, Briefly",2005-09-23,article,News,,[]
The Listings: Sept. 23-Sept. 29,2005-09-23,article,Schedule,,[]
China Currency Move Signals Cautious Policy,2005-09-23,article,News,,['Currency']
Oprah's Book Club toAdd Contemporary Writers,2005-09-23,article,News,,"['Writing and Writers', 'Television', 'Books and Literature', 'Book Trade']"
Prints That Helped Europe Discover Its Great Artists,2005-09-23,article,Review,,"['Museums', 'Art']"
"Paid Notice: Deaths   JOHNSON, MARTHA COLLINS",2005-09-23,article,Paid Death Notice,,[]
"Paid Notice: Deaths   KINDSER, REVA",2005-09-23,article,Paid Death Notice,,[]
Icahn to Keep Pressuring Time Warner,2005-09-23,article,News,,['Computers and the Internet']
Fighting in south Thailand kills 7,2005-09-23,article,News,,[]
EU farmers plant more genetically altered corn,2005-09-23,article,News,,[]
On the Ground With Soldiers in Iraq,2005-09-23,article,Review,,"['MOTION PICTURES', 'Reviews', 'Documentary Films and Programs']"
"Paid Notice: Deaths   FELDMAN, SANDRA.",2005-09-23,article,Paid Death Notice,,[]
Drug Treatments for Schizophrenia (5 Letters),2005-09-23,article,Letter,,"['Schizophrenia', 'Medicine and Health']"
"Now, from Hollywood, visions of conservatism",2005-09-23,article,News,,[]
Departing Chairman of Public TV Defends Acts,2005-09-23,article,News,,['Television']
A Long Night of Saving the Favorites for the End,2005-09-23,article,Review,,['Music']
Brazil's Lofty Promises After Nun's Killing Prove Hollow,2005-09-23,article,News,,['Social Conditions and Trends']
Swiss to vote on East European workers,2005-09-23,article,News,,[]
"Tolerance, Peace and Man in a Duck Head",2005-09-23,article,Review,,['Dancing']
INSIDE,2005-09-23,article,Summary,,[]
World Business Briefing | Europe: Suit Filed Against Sony BMG,2005-09-23,article,News,,[]
Saudi Minister Warns U.S. Iraq May Face Disintegration,2005-09-23,article,News,,[]
"Michael deCourcy Hinds, Reporter, Dies at 58",2005-09-23,article,Obituary; Biography,,['Deaths (Obituaries)']
"For Pay Toilet Company, Progress Is Sometimes Slow",2005-09-23,article,News,,['Bathrooms and Toilets']
Blurred Line for the Ground Zero Museum,2005-09-23,article,News,,"['World Trade Center (NYC)', 'Monuments and Memorials', 'Museums']"
Nepal's Leader Pledges Elections,2005-09-23,article,News,,['Politics and Government']
Children's Events,2005-09-23,article,Schedule,,[]
New China-U.S. dialogue could strengthen complex ties,2005-09-23,article,News,,[]
"For Poles, climax of a mudslinging campaign",2005-09-23,article,News,,[]
Verizon Introduces Fiber Optic TV Service,2005-09-23,article,News,,"['Fiber Optics', 'Telephones and Telecommunications']"
The Danger Next Door,2005-09-23,article,Op-Ed,,"['United States International Relations', 'Foreign Aid', 'Terrorism', 'UNITED STATES ARMAMENT AND DEFENSE']"
"Paid Notice: Deaths  ROSENTHAL, JACQUELINE",2005-09-23,article,Paid Death Notice,,[]
Carmen Electra's Guide to Reporting,2005-09-23,article,News,,[]
Can You Hear Me Now? Avoiding the Weekend Disconnect,2005-09-23,article,News,,"['Cellular Telephones', 'ANTENNAS', 'Rural Areas', 'Telephones and Telecommunications', 'Computers and the Internet']"
The Listings: Sept. 23-Sept. 29; JEANINE DURNING,2005-09-23,article,News,,[]
Names of the Dead,2005-09-23,article,List,,[]
"Paid Notice: Deaths   GLUCK, KATE K.",2005-09-23,article,Paid Death Notice,,[]
Custom Homes,2005-09-23,article,Interview,,"['Housing', 'Real Estate']"
15 Palestinians Dead in Blast at Hamas Weapons Parade,2005-09-23,article,News,,[]
Panel Investigates Whether Guidant Violated Agreement,2005-09-23,article,News,,"['Politics and Government', 'Medicine and Health']"
"36 Hours in Point Reyes, Calif.",2005-09-23,article,News,,"['Parks and Other Recreation Areas', 'Travel and Vacations', 'National Parks, Monuments and Seashores']"
"News in Black, White and Shades of Gray",2005-09-23,article,Review,,"['MOTION PICTURES', 'Reviews', 'New York Film Festival', 'Television', 'Freedom of the Press', 'News and News Media', 'Theater']"
"West, Southwest, Midwest, Mid-Atlantic, New England and Washington",2005-09-23,article,News,,[]
,2005-09-23,multimedia,Slideshow,,[]
,2005-09-23,multimedia,Slideshow,,[]
Today's Home Page Images,2005-09-23,multimedia,Slideshow,,[]
Pulse,2005-09-23,multimedia,Slideshow,,[]
Re-enacting History: The Oneida Nation,2005-09-23,multimedia,Slideshow,,[]
Military Recruitment Posters,2005-09-23,multimedia,Slideshow,,[]
Show Me the Story,2005-09-23,article,News,,[]
A Look at the Exhibits,2005-09-23,multimedia,Slideshow,,[]
The Future of Driving,2005-09-23,multimedia,Slideshow,,[]
Baseball’s Finest Moment: Pee Wee Reese,2005-09-23,article,News,,[]
Pakistan Free Trade,2005-09-23,article,News,,[]
Count Your Blessings,2005-09-23,article,News,,[]
The Khamis Mushayt Girl,2005-09-23,article,News,,[]
The News From Iraq,2005-09-23,article,News,,[]
"Bill Gates, Steve Jobs and Songs",2005-09-24,article,Review,,"['Reviews', 'New York Musical Theater Festival', 'Computers and the Internet', 'Theater']"
"As antiwar groups grow, so do their differences",2005-09-24,article,News,,[]
Explosion at rally kills 10 in Gaza Strip,2005-09-24,article,News,,[]
"Great Job, Vacation Is on Us",2005-09-24,article,News,,"['ADVERTISING', 'Magazines']"
Frist Sale of Stock Spurs Inquiries Into Trusts,2005-09-24,article,News,,[]
Briefly: Head of drug agency resigns his position,2005-09-24,article,News,,[]
Strahan Questionable Again,2005-09-24,article,News,,[]
"2 Quarterbacks May Be Friends, but Never on a Sunday",2005-09-24,article,News,,[]
"Bringing Back Memories, Both Methodic and Melodic",2005-09-24,article,Review,,['Music']
New Love Breaks Up a 6-Year Relationship at the Zoo,2005-09-24,article,News,,"['ANIMALS', 'Homosexuality']"
Leetch Uncertain About Playing in Garden in a New Uniform,2005-09-24,article,News,,"['Hockey, Ice']"
"Leader of the F.D.A. Steps Down After a Short, Turbulent Tenure",2005-09-24,article,News,,['Drugs (Pharmaceuticals)']
Regular Lovers,2005-09-24,article,Review,,"['MOTION PICTURES', 'Reviews']"
Hit and miss at Chinese art auctions,2005-09-24,article,News,,[]
S.E.C. Sends Fidelity 2nd Inquiry Notice,2005-09-24,article,News,,[]
"West, Northwest, Southwest, South, Mid-Atlantic, New England and The Islands",2005-09-24,article,News,,[]
TRANSACTIONS,2005-09-24,article,List,,[]
So Who Is Right in Debate on Role of Global Warming?,2005-09-24,article,News,,"['Weather', 'Environment', 'Hurricanes and Tropical Storms']"
"It's Not TV, It's Yahoo",2005-09-24,article,News,,['Television']
An artist's army: Soldiers on parade in the park,2005-09-24,article,News,,[]
Corrections,2005-09-24,article,Correction,,[]
"World Comes to 5th Ave., for Racing, Not Shopping",2005-09-24,article,News,,[]
"Lessons of Katrina, Realities of Rita",2005-09-24,article,Letter,,[]
Barring Gays From the Priesthood,2005-09-24,article,Letter,,[]
Avenge but One of My Two Eyes,2005-09-24,article,Review,,"['MOTION PICTURES', 'Reviews']"
Educated by Rita,2005-09-24,article,Editorial,,['Hurricanes and Tropical Storms']
"ViewPoints:There's a bleak side, then a bright side",2005-09-24,article,News,,[]
Tennis: A day of comebacks and what might have been,2005-09-24,article,News,,[]
"Arts, Briefly",2005-09-24,article,News,,"['Music', 'Television', 'Art', 'Theater']"
Progress and Concerns Noted in Special Education System,2005-09-24,article,News,,"['Education and Schools', 'Special Education (Handicapped)']"
New Jersey's Child Welfare Chief Announces His Resignation,2005-09-24,article,News,,[]
"In Baghdad, 6 killed by bomber at bus stop",2005-09-24,article,News,,[]
"Paid Notice: Deaths   GARTEN, LILA",2005-09-24,article,Paid Death Notice,,[]
"William Vacchiano, Trumpeter and Teacher, Dies at 93",2005-09-24,article,Obituary; Biography,,"['Classical Music', 'Deaths (Obituaries)']"
China Loosens Limits on Trading Against Other Currencies but Keeps Rein on Dollar,2005-09-24,article,News,,['Currency']
Corrections,2005-09-24,article,Correction,,[]
Corrections,2005-09-24,article,Correction,,[]
