headline,date,doc_type,material_type,section,keywords
Bush and Putin Stand Side by Side on North Korea and Iran,2005-09-16,article,News,,[]
Architecture: Reimagining a ravaged city,2005-09-16,article,News,,[]
"David C. Anderson, of The Times, Dies at 62; Wrote About Crime",2005-09-16,article,Obituary; Biography,,['Deaths (Obituaries)']
Microsoft Said to Be Talking About AOL Link,2005-09-16,article,News,,"['Electronic Mail', 'Mergers, Acquisitions and Divestitures', 'Computers and the Internet']"
Russian Jet Crashes in Lithuania,2005-09-16,article,News,,[]
A Night of Halloween Horror,2005-09-16,article,Review,,"['MOTION PICTURES', 'Reviews']"
"Chief Justice Nominee SpeaksVolumes, While Saying Little",2005-09-16,article,An Analysis; News Analysis,,"['Judges', 'Constitutions']"
"Frustrated by Roberts, and Unsure How to Vote",2005-09-16,article,News,,['PUBLIC OPINION']
Art in Review; Dennis Adams,2005-09-16,article,Review,,"['Reviews', 'Art']"
Not the Sun King after all,2005-09-16,article,News,,[]
In Search of a Family Treasure,2005-09-16,article,News,,"['Bible', 'KATRINA (STORM)', 'HURRICANE KATRINA', 'Floods', 'Hurricanes and Tropical Storms']"
Briefly: Ophelia stalls off coast,2005-09-16,article,News,,[]
"Paid Notice: Deaths   WAGLEY, F. EDWARD",2005-09-16,article,Paid Death Notice,,[]
"Another Test Drive for the Red Sox' Rotation, but Schilling Is in Reverse",2005-09-16,article,News,,['Baseball']
Metro Briefing | New York: Manhattan: Baruch College Plans Renovation,2005-09-16,article,News,,[]
"Paid Notice: Memorials   CARR, DR. ELIZABETH",2005-09-16,article,Paid Death Notice,,[]
Just What the Professor Ordered,2005-09-16,article,Op-Ed,,"['Textbooks', 'ANTITRUST ACTIONS AND LAWS', 'Tuition', 'Colleges and Universities', 'Prices (Fares, Fees and Rates)', 'Books and Literature', 'Ethics', 'Teachers and School Employees']"
Corrections,2005-09-16,article,Correction,,"['Correction Stories', 'Elections', 'District Attorneys', 'PRIMARIES']"
The Enigma That Is Judge Roberts (8 Letters),2005-09-16,article,Letter,,[]
"Art, or Something Like It, Brings Russian Leader to Bayonne",2005-09-16,article,News,,['Monuments and Memorials']
Tooth and Claw,2005-09-16,article,News,,[]
National Briefing | New England: Massachusetts: Governor Overruled On Pill Bill,2005-09-16,article,News,,"['Vetoes (US)', 'Law and Legislation', 'Birth Control and Family Planning']"
The Enigma That Is Judge Roberts,2005-09-16,article,Letter,,[]
Iraq suicide attacks kill 24 police officers,2005-09-16,article,News,,[]
"After Backlash, Amtrak Delays Fare Increase",2005-09-16,article,News,,[]
Brooklyn,2005-09-16,article,News,,['Travel and Vacations']
The Nuclear Waste Site in Utah,2005-09-16,article,Editorial,,"['Indians, American', 'Nuclear Wastes', 'Editorials']"
The Stars of Texas,2005-09-16,article,News,,"['Space', 'Telescopes and Observatories', 'HOTELS AND MOTELS', 'Travel and Vacations', 'Astronomy and Astrophysics']"
"For Athletes Left on Sideline, Welcome Mats and Questions",2005-09-16,article,News,,"['Draft and Recruitment (Sports)', 'Interscholastic Athletics', 'KATRINA (STORM)', 'Education and Schools', 'HURRICANE KATRINA', 'Ethics', 'Football', 'Hurricanes and Tropical Storms']"
An online crutch for German voters,2005-09-16,article,News,,[]
Another Star Vehicle Has Its Revival,2005-09-16,article,News,,['Children and Youth']
Solving for X: Is She Crazy or a Math Mastermind?,2005-09-16,article,Review,,"['MOTION PICTURES', 'Reviews']"
How Long to Jail White-Collar Criminals?,2005-09-16,article,News,,"['Frauds and Swindling', 'ACCOUNTING AND ACCOUNTANTS', 'WHITE COLLAR CRIME', 'Securities and Commodities Violations', 'Sentences (Criminal)', 'Ethics', 'Crime and Criminals', 'Decisions and Verdicts']"
"In Detroit, a Bitter Battle for the Mayor's Seat",2005-09-16,article,News,,"['Mayors', 'Debating', 'Elections', 'PRIMARIES']"
The Enigma That Is Judge Roberts,2005-09-16,article,Letter,,[]
Not the New Deal,2005-09-16,article,Op-Ed,,"['KATRINA (STORM)', 'HURRICANE KATRINA', 'Finances', 'Ethics', 'Budgets and Budgeting', 'Hurricanes and Tropical Storms']"
"West, Southwest, Midwest, New England and Washington",2005-09-16,article,News,,[]
"It's a Dead Scene, but That's a Good Thing",2005-09-16,article,Review,,"['MOTION PICTURES', 'Reviews']"
Evacuees Find Comfort and Encouragement in Speech,2005-09-16,article,News,,"['KATRINA (STORM)', 'Hurricanes and Tropical Storms']"
"After Talk of Comeback, Armstrong Rules It Out",2005-09-16,article,News,,"['Steroids', 'Bicycles and Bicycling', 'Tour de France (Bicycle Race)']"
Baseball:Ortiz wins another one for Red Sox,2005-09-16,article,News,,[]
"Paid Notice: Deaths   BRACH, ANN D.",2005-09-16,article,Paid Death Notice,,[]
Sharon calls for peace movesby Palestinians,2005-09-16,article,News,,[]
Metro Briefing | New York: Albany: Secretary Of State Announces Resignation,2005-09-16,article,News,,[]
Sarabeth's,2005-09-16,article,Review,,"['Reviews', 'Restaurants']"
"The Desire to Draw, Sometimes a Compulsion",2005-09-16,article,Review,,"['Reviews', 'Obsessive-Compulsive Disorder', 'Mental Health and Disorders', 'Museums', 'Art']"
Corrections,2005-09-16,article,Correction,,"['Judges', 'Correction Stories']"
National Briefing | Washington: President Approves Base Closing Plan,2005-09-16,article,News,,"['Military Bases and Installations', 'Shutdowns (Institutional)', 'UNITED STATES ARMAMENT AND DEFENSE']"
Here's a burger no Muslim could beef about,2005-09-16,article,News,,[]
United Democratic Party Challenges the Mayor,2005-09-16,article,News,,"['Mayors', 'Elections']"
Documentary Examines a Cuban Classic,2005-09-16,article,Review,,"['MOTION PICTURES', 'Reviews', 'Documentary Films and Programs']"
Family Values With Mogul Price Tags,2005-09-16,article,News,,"['GEOGRAPHIC PROFILES', 'Travel and Vacations']"
Another Brutal Reminder: Iraq Isn't Going Away,2005-09-16,article,Letter,,[]
Corrections,2005-09-16,article,Correction,,"['Mayors', 'Elections', 'PRIMARIES']"
It Wouldn't Happen in Singapore (5 Letters),2005-09-16,article,Letter,,['HURRICANE KATRINA']
Staten Island Ferry in Quebec? Fantastique!,2005-09-16,article,News,,['Ferries']
"Paid Notice: Deaths   BLUM, LILLIAN L.",2005-09-16,article,Paid Death Notice,,[]
"Paid Notice: Deaths   DEGRAFFE, LUIS JORGE",2005-09-16,article,Paid Death Notice,,[]
Trying to Put Some Reins on Derivatives,2005-09-16,article,News,,"['United States Economy', 'Hedge Funds', 'Banks and Banking']"
Around the World,2005-09-16,article,News,,[]
Equity Firm Is Acquiring a Health Insurer,2005-09-16,article,News,,"['Insurance', 'Medicine and Health']"
"Paid Notice: Deaths   KUPPERSMITH, GRACE",2005-09-16,article,Paid Death Notice,,[]
INSIDE,2005-09-16,article,Summary,,[]
Iranian signals a bid to clear talks logjam,2005-09-16,article,News,,[]
"Paid Notice: Deaths   MALIS, LEONARD I. MD.",2005-09-16,article,Paid Death Notice,,[]
Mr. Bush in New Orleans,2005-09-16,article,Editorial,,"['World Trade Center (NYC)', 'AIRLINES AND AIRPLANES', 'Editorials', 'KATRINA (STORM)', 'HURRICANE KATRINA', 'Hijacking', 'Terrorism', 'Hurricanes and Tropical Storms']"
"From Nintendo, a wand-like game control",2005-09-16,article,News,,[]
"Paid Notice: Deaths   AUSTIN, LEROY SYL",2005-09-16,article,Paid Death Notice,,[]
"Taking a Chisel to 2 Columbus Circle, With No Regrets",2005-09-16,article,News,,[]
Hotel Watch: Hotel Silken Puerta América,2005-09-16,article,News,,[]
Demanding expatriates fuel Bangkok housing recovery,2005-09-16,article,News,,[]
An Election to Nowhere,2005-09-16,article,Editorial,,"['Mayors', 'Editorials', 'Finances', 'Elections', 'PRIMARIES']"
"Paid Notice: Memorials   VINE, SHIRLEY SARAH",2005-09-16,article,Paid Death Notice,,[]
"A Jet-Set Don Juan, Right Up to the Final Exit",2005-09-16,article,Review,,"['Reviews', 'Books and Literature', 'Biographical Information', 'NIGHTCLUBS AND CABARETS']"
Aide Denies Knowing of Lobby's Donation,2005-09-16,article,News,,['Courts']
Muskoka: The Malibu of the North,2005-09-16,article,News,,"['Lakes', 'Celebrities', 'Housing', 'GEOGRAPHIC PROFILES', 'Real Estate', 'Travel and Vacations']"
Corrections,2005-09-16,article,Correction,,"['Medical Schools', 'Medicine and Health', 'Correction Stories', 'Hospitals']"
Art in Review,2005-09-16,article,News,,['Art']
"Giants Reveal a Gentle Side, Until Kickoff",2005-09-16,article,News,,['Football']
Key rates,2005-09-16,article,Statistics,,[]
"From Yale to Cosmetology School, Americans Brush Up on History and Government",2005-09-16,article,News,,"['Mathematics', 'READING', 'United States Politics and Government', 'CONSTITUTION DAY', 'Education and Schools', 'Finances', 'Colleges and Universities', 'History', 'Constitutions', 'Law and Legislation', 'Budgets and Budgeting']"
Forget the U.N.: Clinton Has a League of His Own,2005-09-16,article,News,,[]
The Listings: Sept. 16 -- Sept. 22; VISION ARTISTS FOR NEW ORLEANS,2005-09-16,article,Schedule,,[]
"Paid Notice: Deaths   MCCANN, WILLIAM V.",2005-09-16,article,Paid Death Notice,,[]
"In Our Pages: 100, 75, & 50 years ago",2005-09-16,article,News,,[]
Still Eating Our Lunch,2005-09-16,article,Op-Ed,,"['Mathematics', 'Education and Schools', 'Science and Technology', 'Teachers and School Employees', 'Computers and the Internet']"
Tussle over MacArthur highlights split over U.S.,2005-09-16,article,News,,[]
"Paid Notice: Memorials   LABIANCA, VINCENT, MUNOZ, ISABEL",2005-09-16,article,Paid Death Notice,,[]
Bonds's Feat: Let's Hold Off on a Big Hand,2005-09-16,article,News,,['Baseball']
"Paid Notice: Deaths   WOODCOCK, WILLIAM A.",2005-09-16,article,Paid Death Notice,,[]
"Head of Major Crime Family in Custody, Italian Police Say",2005-09-16,article,News,,[]
Art in Review; Karl Schrag,2005-09-16,article,Review,,"['Reviews', 'Art']"
Deals,2005-09-16,article,News,,[]
Iranian Leader Promises New Proposals to End Nuclear Impasse,2005-09-16,article,News,,['ATOMIC WEAPONS']
Abbott Gets F.D.A. Approval for Neck Stent With a Filter,2005-09-16,article,News,,"['Medicine and Health', 'Stents (Medical Devices)']"
Still Waiting for His Miracle on Ice,2005-09-16,article,News,,"['Hockey, Ice', 'Olympic Games']"
Wal-Mart Questions Motives of Lawsuit by Labor Group,2005-09-16,article,News,,"['LABOR', 'Suits and Litigation']"
"Paid Notice: Deaths   KLEEMAN, ELAINE J.",2005-09-16,article,Paid Death Notice,,[]
Lottery Numbers,2005-09-16,article,News,,[]
"Republicans Speak of Respect of Roberts's Peers, and Democrats Issue Warnings",2005-09-16,article,Text,,[]
BROWN WINS MET P.G.A.,2005-09-16,article,News,,[]
A light in the forest,2005-09-16,article,News,,[]
"World Briefings: Europe, Asia, Africa, Americas, Middle East",2005-09-16,article,News,,[]
Japan's Fragile Foundation: Golden Eggs From Postal Goose,2005-09-16,article,An Analysis; News Analysis,,"['Privatization', 'Postal Service', 'Law and Legislation']"
The Library,2005-09-16,article,News,,['Books and Literature']
Philips weighs 'last resort' of closing a plant,2005-09-16,article,News,,[]
Fight to the finish in New Zealand,2005-09-16,article,News,,[]
"Giants Offer Their Meadowlands Plan, With an 80,000-Seat Stadium",2005-09-16,article,News,,[]
Oktoberfests,2005-09-16,article,News,,['Festivals']
A Journey Inspired by Family Becomes One of Forgiveness,2005-09-16,article,Review,,"['MOTION PICTURES', 'Reviews', 'Books and Literature']"
Corrections,2005-09-16,article,Correction,,"['Hazardous and Toxic Substances', 'Suits and Litigation', 'Ethics', 'Doctors', 'Asbestos', 'Correction Stories', 'Liability for Products']"
Airport congestion in EU causes worries for future,2005-09-16,article,News,,[]
"Amid the Ruins, a President Tries to Reconstruct His Image, Too",2005-09-16,article,An Analysis; News Analysis,,"['KATRINA (STORM)', 'HURRICANE KATRINA', 'Hurricanes and Tropical Storms']"
"Paid Notice: Deaths   GOLDBERG, RITA",2005-09-16,article,Paid Death Notice,,[]
EU court lowers fine on Daimler,2005-09-16,article,News,,[]
"Arts, Briefly",2005-09-16,article,News,,"['GRAND PALAIS (PARIS)', 'Restoration and Rehabilitation']"
A candidate is shot as Afghan vote draws near,2005-09-16,article,News,,[]
"Paid Notice: Deaths   BARRELL, EDYTHE",2005-09-16,article,Paid Death Notice,,[]
Art in Review; Ohad Meromi,2005-09-16,article,Review,,"['Reviews', 'Art']"
The quiet pleasures of 3 Czech towns,2005-09-16,article,News,,[]
Searching2 cultures for identity,2005-09-16,article,News,,[]
Storm Might Be a Factor as Fed Ponders a Rate Rise,2005-09-16,article,News,,"['HURRICANE KATRINA', 'Interest Rates']"
TechBrief: Freeview sales soar,2005-09-16,article,News,,[]
News Summary,2005-09-16,article,Summary,,[]
Corporate Coalition Issues Upbeat Report on City Schools,2005-09-16,article,News,,['Education and Schools']
Seinfeld Who? NBC Pursuing the Heartland,2005-09-16,article,News,,"['ADVERTISING AND MARKETING', 'Television', 'Christians and Christianity', 'Rural Areas']"
Roundup: Absentees scorned at lavish tourney,2005-09-16,article,News,,[]
FRIEDEL SIGNS EXTENSION,2005-09-16,article,News,,[]
Mississippi Sues Insurers Over Damage From Storm,2005-09-16,article,News,,"['Insurance', 'HURRICANE KATRINA', 'Suits and Litigation']"
F.D.A. Data on Defibrillators Expected,2005-09-16,article,News,,['Defibrillators']
Bush Rules Out Tax Increases to Pay for Hurricane Recovery,2005-09-16,article,News,,[]
Pope's Visit to Turkey Delayed,2005-09-16,article,News,,[]
"Celebrating Shaw, a Serious Optimist",2005-09-16,article,News,,['Theater']
Film in Review; Human Error,2005-09-16,article,Review,,"['MOTION PICTURES', 'Reviews']"
"A Wonderful Afterlife, but Must Share Bath",2005-09-16,article,Review,,"['MOTION PICTURES', 'Reviews']"
TRANSACTIONS,2005-09-16,article,List,,[]
Giants-Saints Tickets Still Available,2005-09-16,article,News,,[]
"Paid Notice: Deaths   SMITH, WILLIAM PIERCE, MD",2005-09-16,article,Paid Death Notice,,[]
Schwarzenegger Announces Bid for Re-election in California,2005-09-16,article,News,,[]
Moments of beauty are mixed with ugliness,2005-09-16,article,News,,[]
"Among Voters In New Jersey, G.O.P. Sees Dead People",2005-09-16,article,News,,[]
Seeing a Runoff as a Bad Rerun,2005-09-16,article,News,,['PRIMARIES']
"Paid Notice: Deaths   FRIEDLAND, BARBARA (NEE LEVINE)",2005-09-16,article,Paid Death Notice,,[]
It Wouldn't Happen In Singapore,2005-09-16,article,Letter,,[]
Corrections,2005-09-16,article,Correction,,"['Mayors', 'Correction Stories', 'Elections', 'PRIMARIES']"
The clash of Shariah and democracy,2005-09-16,article,News,,[]
Nina Wang to inherither husband's empire,2005-09-16,article,News,,[]
"Cruise Ships, Spurned by Evacuees, Are Home to Displaced City Workers and Families",2005-09-16,article,News,,"['Ships and Shipping', 'KATRINA (STORM)', 'HURRICANE KATRINA', 'Finances', 'Budgets and Budgeting', 'Government Employees', 'Hurricanes and Tropical Storms']"
"Energy Prices Lead Inflation, Overcoming Salary Increases",2005-09-16,article,News,,"['LABOR', 'Wages and Salaries', 'Oil (Petroleum) and Gasoline', 'HURRICANE KATRINA']"
Shielding a basic freedom,2005-09-16,article,News,,[]
Jihad's Fresh Face,2005-09-16,article,Op-Ed,,"['United States International Relations', 'Islam', 'Freedom and Human Rights', 'Terrorism']"
"For Women Without Men, Idleness Is a Virtue",2005-09-16,article,Review,,"['Reviews', 'Women', 'Theater']"
"Inspired by the Movies, and Buoyed by Terror",2005-09-16,article,Review,,"['Reviews', 'Television']"
Merkel gets high profile nod from EU official,2005-09-16,article,News,,[]
"As Chase Begins, Stewart Isn't Taking View From the Front for Granted",2005-09-16,article,News,,['Automobile Racing']
Man Behind the Mask Pleases Posada,2005-09-16,article,News,,['Baseball']
Liberals and Conservatives Remain Worlds Apart on Roberts's Suitability,2005-09-16,article,News,,"['Judges', 'Politics and Government', 'Women']"
Delta and Florida: No Longer So Happy Together,2005-09-16,article,News,,"['AIRLINES AND AIRPLANES', 'Prices (Fares, Fees and Rates)', 'Travel and Vacations']"
The History of a Dove,2005-09-16,article,Review,,"['MOTION PICTURES', 'Reviews', 'Documentary Films and Programs']"
We shall fight them on the beaches,2005-09-16,article,News,,[]
Roundup: Absentees scorned at lavish tourney,2005-09-16,article,News,,[]
Briefly: Emergency oil to U.S. ends,2005-09-16,article,News,,[]
No new taxes for storm rebuilding,2005-09-16,article,News,,[]
"For a Teenager, the Big Year in a Strange School",2005-09-16,article,News,,"['Private and Sectarian Schools', 'KATRINA (STORM)', 'Education and Schools', 'HURRICANE KATRINA', 'Children and Youth', 'Hurricanes and Tropical Storms']"
Little Change in Market Amid Inflation Concerns,2005-09-16,article,News,,[]
Schröder assails his foe's tax proposals,2005-09-16,article,News,,[]
"Paid Notice: Deaths   RUDERMAN, I. WARREN",2005-09-16,article,Paid Death Notice,,[]
"Robert Wise, Film Director, Dies at 91",2005-09-16,article,Obituary; Biography,,"['MOTION PICTURES', 'Deaths (Obituaries)']"
History Splashed on Canvas,2005-09-16,article,Review,,"['Reviews', 'Museums', 'Art', 'Travel and Vacations']"
"Paid Notice: Deaths   FUCHS, REUBEN",2005-09-16,article,Paid Death Notice,,[]
"Other Views: Christian Science Monitor, Gulf News, JoongAng Daily",2005-09-16,article,News,,[]
"Visions of Toy Soldiers, and War, Dance in Boys' Heads",2005-09-16,article,Review,,"['Reviews', 'Theater']"
Five Families,2005-09-16,article,News,,[]
Frayed Nerves and Visions as Two Worlds Compete,2005-09-16,article,News,,['Dresses']
Suffolk Plan Cuts Budget 1.6 Percent for 2006,2005-09-16,article,News,,['Budgets and Budgeting']
"Paid Notice: Deaths  ZUCKERBROD, SEYMOUR",2005-09-16,article,Paid Death Notice,,[]
Invasion of the Reluctant Renters,2005-09-16,article,News,,"['LABOR', 'Mortgages', 'Housing', 'Renting and Leasing', 'KATRINA (STORM)', 'HURRICANE KATRINA', 'Interest Rates', 'Hurricanes and Tropical Storms']"
A Third Day of Attacks in Iraq Leave at Least 23 Dead,2005-09-16,article,News,,"['UNITED STATES ARMAMENT AND DEFENSE', 'VIOLENCE']"
Low-fare airlines are celebrating in high style,2005-09-16,article,News,,[]
Serving Gays Who Serve God,2005-09-16,article,News,,"['Religion and Churches', 'Christians and Christianity', 'Homosexuality']"
"The Sultry Spirit of Peggy Lee, With a Slight Southern Accent",2005-09-16,article,Review,,"['Music', 'Reviews', 'JAZZ AT LINCOLN CENTER']"
Plan Will Pay 90% of Costs for Students Hit by Storm,2005-09-16,article,News,,"['HURRICANE KATRINA', 'Education and Schools']"
Metro Briefing | New York: Manhattan: Two City Officials Arrested,2005-09-16,article,News,,[]
"A Venerable Survivor, Rediscovering Castaway Songs",2005-09-16,article,News,,[]
Roger Collis: Readers' Queries,2005-09-16,article,News,,[]
New Orleans to Open Some Neighborhoods,2005-09-16,article,News,,"['KATRINA (STORM)', 'HURRICANE KATRINA', 'Curfews', 'Electric Light and Power', 'Hurricanes and Tropical Storms']"
Children's Events,2005-09-16,article,Schedule,,[]
News Analysis: Appearance of crossroads,2005-09-16,article,News,,[]
"A Sanctimonious Lawyer, His Hostess Wife and Their Dilemmas: Let the Betrayals Begin",2005-09-16,article,Review,,"['MOTION PICTURES', 'Reviews']"
"Arts, Briefly; 'Lennon' to Close",2005-09-16,article,News,,['Theater']
Sydney's chefs dial down the flash,2005-09-16,article,News,,[]
"After Democratic Squabble, Corzine Ally Loses Bid to Fill State Senate Seat",2005-09-16,article,News,,['Legislatures and Parliaments']
"Paid Notice: Deaths   HESS, DANIEL",2005-09-16,article,Paid Death Notice,,[]
The Enigma That Is Judge Roberts,2005-09-16,article,Letter,,[]
Aid Withheld to Nepal,2005-09-16,article,News,,[]
Spare Times,2005-09-16,article,Schedule,,[]
Eurotunnel narrows loss on cost cuts,2005-09-16,article,News,,[]
"Letter from China: For Beijing, fear grows as spirituality blooms",2005-09-16,article,News,,[]
When Charity Stems From a Lawsuit,2005-09-16,article,News,,"['Philanthropy', 'Derivatives (Financial Transactions)', 'Securities and Commodities Violations', 'Ethics', 'Gifts', 'Insider Trading', 'Computers and the Internet']"
Foreigners Detained in Britain,2005-09-16,article,News,,[]
Corrections,2005-09-16,article,Correction,,"['Transit Systems', 'Railroads']"
The Market McDonald's Missed: The Muslim Burger,2005-09-16,article,News,,"['Restaurants', 'Islam', 'Fast Food Industry']"
White House Backs NASA Plan for Vehicles,2005-09-16,article,News,,"['Accidents and Safety', 'Mars (Planet)', 'Space', 'SPACE SHUTTLE', 'Moon']"
The Yankees Restore Order to Their Universe,2005-09-16,article,News,,['Baseball']
Currencies: Economic data help dollar stay higher,2005-09-16,article,News,,[]
Bill Would Let E.P.A. Relax Rules for Cleanup,2005-09-16,article,News,,"['Water Pollution', 'KATRINA (STORM)', 'Law and Legislation', 'Air Pollution', 'Hurricanes and Tropical Storms']"
Water Lifts Its Awful Veil on Landscape of Destruction,2005-09-16,article,News,,"['Housing', 'KATRINA (STORM)', 'LEVEES', 'Floods', 'Hurricanes and Tropical Storms']"
Low-fare airlines celebrate in high style,2005-09-16,article,News,,[]
Soccer:Bucharest trounces faltering Everton,2005-09-16,article,News,,[]
Time to talk to Al Qaeda?,2005-09-16,article,News,,[]
QUOTATION OF THE DAY,2005-09-16,article,News,,['QUOTATION OF THE DAY']
Kraft Introduces 2 Somewhat Healthier Cookies Made of Whole Grains,2005-09-16,article,News,,"['Diet and Nutrition', 'Grain', 'Food']"
Executives accused of insurance bid rigging,2005-09-16,article,News,,[]
'I Am Cuba',2005-09-16,article,Schedule,,[]
Vote Counting Continuing in Close Race in East Harlem,2005-09-16,article,News,,['PRIMARIES']
Violence Continues in Afghanistan Ahead of Election,2005-09-16,article,News,,[]
The Enigma That Is Judge Roberts,2005-09-16,article,Letter,,[]
"With the Week's Newcomers, Enter the Warrior Princess",2005-09-16,article,News,,['Dresses']
Agitation and Anxiety Are All in the Family,2005-09-16,article,Review,,"['MOTION PICTURES', 'Reviews']"
A Teenager With an Embarrassing Habit Finds Transformation Through Ritalin,2005-09-16,article,Review,,"['MOTION PICTURES', 'Reviews']"
Partnership Formed to Build Nuclear Plants,2005-09-16,article,News,,"['Energy and Power', 'Electric Light and Power', 'ATOMIC ENERGY', 'Regulation and Deregulation of Industry']"
Man Accused of Killing 6 Hunters Says He Feared for His Life,2005-09-16,article,News,,"['Murders and Attempted Murders', 'Hunting and Trapping', 'Discrimination']"
Fugitive in Armored Car Theft Gives Up After 12 Years,2005-09-16,article,News,,"['Robberies and Thefts', 'RECORDINGS (VIDEO)', 'Television', 'ARMORED CAR SERVICES']"
G.O.P. Split Over Big Plans for Storm Spending,2005-09-16,article,News,,"['KATRINA (STORM)', 'Finances', 'Budgets and Budgeting', 'Hurricanes and Tropical Storms']"
Voting May Be Life-and-Death Choice for Afghans,2005-09-16,article,News,,"['Legislatures and Parliaments', 'United States International Relations', 'VIOLENCE', 'Threats and Threatening Messages', 'Politics and Government', 'Elections', 'UNITED STATES ARMAMENT AND DEFENSE']"
The Listings: Sept. 16 -- Sept. 22; TOM BURCKHARDT: 'FULL STOP',2005-09-16,article,Schedule,,[]
Tax Inquiry Is Moving Past KPMG,2005-09-16,article,News,,"['Frauds and Swindling', 'ACCOUNTING AND ACCOUNTANTS', 'Tax Evasion', 'Taxation', 'Suits and Litigation', 'Tax Shelters']"
Corrections,2005-09-16,article,Correction,,[]
"Paid Notice: Deaths   GABERMAN, EDWARD",2005-09-16,article,Paid Death Notice,,[]
"A Venerable Survivor, Rediscovering Castaway Songs",2005-09-16,article,Review,,"['Music', 'Reviews', 'WOMEN IN JAZZ FESTIVAL', 'Jazz']"
"Israeli court upholds West Bank barrier, but orders a revision",2005-09-16,article,News,,[]
"For Asian horror,a Hollywood twist",2005-09-16,article,News,,[]
Singapore's other side; Toeing the line,2005-09-16,article,News,,[]
The Listings: Sept 16 -- Sept. 22,2005-09-16,article,Schedule,,[]
The Enigma That Is Judge Roberts,2005-09-16,article,Letter,,[]
Madness And Math,2005-09-16,article,Summary,,[]
"Paid Notice: Deaths   LEVY, NORMAN F.",2005-09-16,article,Paid Death Notice,,[]
The Churn,2005-09-16,article,News,,['Executives and Management']
National Briefing | Southwest: Texas: County Bans Parking Near Ranch,2005-09-16,article,News,,"['United States International Relations', 'UNITED STATES ARMAMENT AND DEFENSE']"
Bush's Remarks at Washington National Cathedral,2005-09-16,article,News,,[]
Art in Review; Bill Rice,2005-09-16,article,Review,,"['Reviews', 'Art']"
Overtime Is the Right Time for the Sun in the Finals,2005-09-16,article,News,,['Basketball']
"Paid Notice: Memorials   HOCHBERG, CAROL ELAINE",2005-09-16,article,Paid Death Notice,,[]
Sharon Tells U.N. It's Time for Palestinian Peace Steps,2005-09-16,article,News,,"['International Relations', 'Palestinians']"
City Unemployment at Lowest Level in 17 Years,2005-09-16,article,News,,['Unemployment']
Briefly: No Air France comment for a report of pilot error,2005-09-16,article,News,,[]
North Koreans Insist on Demand For New Reactor In Nuclear Talks,2005-09-16,article,News,,"['ATOMIC WEAPONS', 'United States International Relations', 'Embargoes and Economic Sanctions']"
They Usually Put Us in the Pen,2005-09-16,article,News,,[]
Harrowing Details of a Firefighter's Death,2005-09-16,article,News,,['Fires and Firefighters']
"A Part of the Game, but Injuries Still Hurt",2005-09-16,article,News,,['Football']
F.C.C. Chief Offers Plan to Get Phones to Hurricane Victims,2005-09-16,article,News,,"['HURRICANE KATRINA', 'Telephones and Telecommunications']"
"Paid Notice: Deaths   LEDERER, GIRARD",2005-09-16,article,Paid Death Notice,,[]
A Veteran Stands Firm in a Sport Chasing Youth,2005-09-16,article,News,,['Automobile Racing']
Brodeur Feels Defanged by N.H.L.'s New Rule,2005-09-16,article,News,,"['Hockey, Ice']"
Taking Russian Art to the Motherland,2005-09-16,article,News,,"['ANTIQUES', 'Auctions', 'MOSCOW WORLD FINE ART FAIR', 'Art']"
It Wouldn't Happen In Singapore,2005-09-16,article,Letter,,[]
Aspiring pilots flock to simulator centers,2005-09-16,article,News,,[]
