headline,date,doc_type,material_type,section,keywords
"Rows and Rows of Corpses, and Voices Choked With Sobs",2005-09-01,article,News,,['VIOLENCE']
"A Sad Day, Too, for Architecture",2005-09-01,article,News,,[]
Comic Improv Competition as a Festival of Putdowns,2005-09-01,article,Review,,['Television']
"Elaine Stritch: Heart, Soul and Plenty of Leg",2005-09-01,article,News,,['Theater']
JetBlue Conducting Reviews For Creative and Media Work,2005-09-01,article,News,,"['AIRLINES AND AIRPLANES', 'ADVERTISING AND MARKETING', 'ACCOUNT CHANGES']"
Corrections,2005-09-01,article,Correction,,"['Correction Stories', 'Computers and the Internet']"
"Neck Deep in Rules, Before Getting a Toe Wet",2005-09-01,article,News,,['Swimming']
"Paid Notice: Deaths   BRICKNER, RABBI BALFOUR",2005-09-01,article,Paid Death Notice,,[]
Drivers Fear Gasoline Shortages as Prices Climb,2005-09-01,article,News,,"['Oil (Petroleum) and Gasoline', 'Hurricanes and Tropical Storms']"
Fields Casts Her Past as a Preview,2005-09-01,article,News,,['Television']
Iran to set up a 'love fund' with oil revenue,2005-09-01,article,News,,[]
"Paid Notice: Deaths   ZIMMERMAN, JOHN WILLIAM",2005-09-01,article,Paid Death Notice,,[]
"Parents, Teachers and the Crisis in Education",2005-09-01,article,Letter,,[]
Israel and Pakistan hold first high-level meeting,2005-09-01,article,News,,[]
Intricate Flood Protection Long a Focus of Dispute,2005-09-01,article,News,,"['Finances', 'LEVEES', 'Budgets and Budgeting', 'Floods', 'Hurricanes and Tropical Storms']"
"Administration Steps Up Actions, Adding Troops and Dispatching Medical Supplies",2005-09-01,article,News,,"['Rescues', 'STRATEGIC PETROLEUM RESERVE', 'United States Economy', 'Oil (Petroleum) and Gasoline', 'Finances', 'Prices (Fares, Fees and Rates)', 'Budgets and Budgeting', 'Looting', 'Hurricanes and Tropical Storms', 'UNITED STATES ARMAMENT AND DEFENSE']"
Roundup: Tri-Nations rivals suffer at half back,2005-09-01,article,News,,[]
Waiting for a Leader,2005-09-01,article,Editorial,,"['Editorials', 'KATRINA (STORM)', 'Hurricanes and Tropical Storms']"
"These Kids Today: A Bit Pop, a Bit Punk",2005-09-01,article,News,,"['Rock Music', 'Music']"
World Briefing | Middle East: Lebanon: Suspect In Hariri Case Freed,2005-09-01,article,News,,[]
In Hawaii,2005-09-01,article,News,,[]
A mother's goodbye lesson,2005-09-01,article,News,,[]
President BushÂs Remarks Thursday,2005-09-01,article,Transcript,,[]
Telekom loses round,2005-09-01,article,News,,[]
Students Letting Off Steam Leave the Neighbors Steaming,2005-09-01,article,News,,"['Housing', 'Renting and Leasing', 'Colleges and Universities']"
"Paid Notice: Deaths   SCHWARTZ, BLANCHE",2005-09-01,article,Paid Death Notice,,[]
Teenager Uses Upset of Roddick to Motivate,2005-09-01,article,News,,"['Tennis', 'United States Open (Tennis)']"
"Balfour Brickner, Activist Reform Rabbi, Dies at 78",2005-09-01,article,Obituary; Biography,,"['Biographical Information', 'Deaths (Obituaries)']"
Indonesia freeing Aceh rebel prisoners,2005-09-01,article,News,,[]
INSIDE,2005-09-01,article,Summary,,[]
Residents flee as lawlessness grips New Orleans,2005-09-01,article,News,,[]
A City in Ruins: Americans Open Their Hearts,2005-09-01,article,Letter,,[]
TRANSACTIONS,2005-09-01,article,List,,[]
Bolton Makes His Case at U.N. for a New Focus for Aid Projects,2005-09-01,article,News,,"['International Relations', 'Economic Conditions and Trends', 'Third World and Developing Countries', 'Foreign Aid']"
Corrections,2005-09-01,article,Correction,,[]
Lottery Numbers,2005-09-01,article,News,,['Lotteries']
"Paid Notice: Deaths   BROWNSTONE, CECILY",2005-09-01,article,Paid Death Notice,,[]
Officials Struggle to Reverse a Growing Sense of Anarchy,2005-09-01,article,News,,[]
Thursday's Top Game: Central Florida at South Carolina,2005-09-01,article,News,,[]
"A Sad Day, Too, for Architecture",2005-09-01,article,News,,"['Historic Buildings and Sites', 'Weather', 'Buildings (Structures)']"
Paris to skip Télécom offer,2005-09-01,article,News,,[]
"Ken Germann, Who Led Columbia Athletics, Dies at 84",2005-09-01,article,Obituary; Biography,,"['Biographical Information', 'Deaths (Obituaries)']"
"Citizen Navy in a Flotilla, Eager to Save",2005-09-01,article,News,,"['KATRINA (STORM)', 'Volunteers', 'Hurricanes and Tropical Storms']"
Blood supply to brain is linked to dementia,2005-09-01,article,News,,[]
"Paid Notice: Deaths   SQUAIRE, LAWRENCE",2005-09-01,article,Paid Death Notice,,[]
Knesset lets Egyptians patrol border of Gaza,2005-09-01,article,News,,[]
British Engineer and Translator Kidnapped in Afghanistan,2005-09-01,article,News,,[]
New contacts at WTO,2005-09-01,article,News,,[]
"Little Applauded in Life, a Recluse Goes on Display",2005-09-01,article,News,,[]
World Business Briefing | Europe: France: Saint-Gobain Makes Bid for BPB,2005-09-01,article,News,,"['Mergers, Acquisitions and Divestitures', 'GYPSUM', 'Building (Construction)']"
How to Make Phone Calls Without a Telephone,2005-09-01,article,News,,"['COMPUTER SOFTWARE', 'Telephones and Telecommunications', 'Computers and the Internet', 'Wire and Cable']"
Arroyo allies cut impeachment case,2005-09-01,article,News,,[]
4 Men in California Accused of Plotting Terrorist Attacks,2005-09-01,article,News,,"['Prisons and Prisoners', 'Synagogues', 'Islam', 'Terrorism', 'UNITED STATES ARMAMENT AND DEFENSE']"
A Kitchen Pro's Personal Picks,2005-09-01,article,News,,"['Restoration and Rehabilitation', 'Windows']"
A Baby Step Toward Wi-Fi Photos,2005-09-01,article,News,,"['Cameras', 'Wireless Communications', 'Photography', 'Computers and the Internet', 'Wire and Cable']"
Currencies: Revised U.S. GDP pushes dollar lower,2005-09-01,article,News,,[]
"Looks Normal at Shea, Except for the Standings",2005-09-01,article,News,,['Baseball']
RESIDENTIAL SALES,2005-09-01,article,List,,[]
Where World-Class Sports Are Played,2005-09-01,article,Editorial,,"['Tennis', 'United States Open (Tennis)', 'NATIONAL TENNIS CENTER (NYC)']"
Fashion Veteran at 24: New York's New Star?,2005-09-01,article,News,,['Dresses']
AFTER THE HURRICANE,2005-09-01,article,Summary,,[]
Metro Briefing | New York: Manhattan: Weak Support For Transport Bond Act,2005-09-01,article,News,,[]
Entr'acte: The Western world through Eastern eyes,2005-09-01,article,News,,[]
Corrections,2005-09-01,article,Correction,,"['Shutdowns (Institutional)', 'Correction Stories', 'RELOCATION OF PERSONNEL', 'UNITED STATES ARMAMENT AND DEFENSE']"
"Paid Notice: Deaths   MESSENGER, DAVID C.",2005-09-01,article,Paid Death Notice,,[]
National Briefing,2005-09-01,article,News,,[]
A City in Ruins: Americans Open Their Hearts,2005-09-01,article,Letter,,[]
The New College Mixer,2005-09-01,article,News,,"['Education and Schools', 'Colleges and Universities']"
Television Finds Covering Area Hit by Storm Is Like Working in a War Zone,2005-09-01,article,News,,"['Television', 'Ratings and Rating Systems', 'KATRINA (STORM)', 'News and News Media', 'Hurricanes and Tropical Storms']"
A Sharp Increase in Reports of Planes Flying Too Close,2005-09-01,article,News,,"['AIRLINES AND AIRPLANES', 'AIR TRAFFIC CONTROL']"
76 Arrested Protesting N.Y.U. Cutoff of Student Union,2005-09-01,article,News,,"['LABOR', 'Colleges and Universities', 'Demonstrations and Riots']"
Qaeda Claims Responsibility for London Bombing,2005-09-01,article,News,,[]
"Nurcholish Madjid, 66, Advocate of Moderate Islam, Dies",2005-09-01,article,Obituary; Biography,,"['Biographical Information', 'Islam', 'Deaths (Obituaries)']"
"First the Sticker Shock, Then On to the Shock Jock",2005-09-01,article,News,,"['RECORDINGS (AUDIO)', 'Recording Equipment', 'Radio']"
Ancient Yank Outduels Young Mariner,2005-09-01,article,News,,[]
Jets Not Counting Martin's Carries...Yet,2005-09-01,article,News,,['Football']
The Sensitive Case of E-Mail,2005-09-01,article,Question,,[]
Curing Health Costs: Let the Sick Suffer,2005-09-01,article,Op-Ed,,"['Health Insurance and Managed Care', 'Finances', 'Medicaid', 'Medicine and Health', 'Budgets and Budgeting']"
"After Decades, Nations Focus on Rights Abuses",2005-09-01,article,News,,"['Extradition', 'War Crimes, Genocide and Crimes Against Humanity', 'Freedom and Human Rights']"
A City in Ruins: Americans Open Their Hearts,2005-09-01,article,Letter,,[]
World Business Briefing | Americas: Brazil: Growth of 3.9% in 2nd Quarter,2005-09-01,article,News,,['Economic Conditions and Trends']
A City in Ruins: Americans Open Their Hearts,2005-09-01,article,Letter,,[]
"Paid Notice: Deaths   WAXBERG, LAURENCE",2005-09-01,article,Paid Death Notice,,[]
A City in Ruins: Americans Open Their Hearts,2005-09-01,article,Letter,,[]
The Revised Birthday Suit,2005-09-01,article,News,,"['Fads', 'Women', 'Cosmetics and Toiletries']"
"In Chimpanzee DNA, Signs of Y Chromosome's Evolution",2005-09-01,article,News,,"['Monkeys and Apes', 'Sex', 'Genetics and Heredity', 'Research', 'Evolution', 'DNA (Deoxyribonucleic Acid)']"
Higher Death Toll Seen; Police Ordered to Stop Looters,2005-09-01,article,News,,"['KATRINA (STORM)', 'SUPERDOME (NEW ORLEANS)', 'Looting', 'Hurricanes and Tropical Storms']"
World Briefing | Middle East: Netanyahu Calls For West Bank Expansion,2005-09-01,article,News,,[]
Corrections,2005-09-01,article,Correction,,"['ADVERTISING AND MARKETING', 'Correction Stories', 'Hispanic-Americans']"
Google Earth mapping service draws complaint from Seoul,2005-09-01,article,News,,[]
Why Verizon's Computer Operator Talks So Much,2005-09-01,article,News,,[]
Names of the Dead,2005-09-01,article,List,,[]
World Briefing | Asia: India: Premier To Meet With Kashmiri Separatists,2005-09-01,article,News,,[]
A niche of Vietnam resistant to change,2005-09-01,article,News,,[]
State Audit Details Problems at Westchester Hospital,2005-09-01,article,News,,[]
Bush sees parallels toWorld War II,2005-09-01,article,News,,[]
Briefs: Terror suspects used marriage to stay in U.S.,2005-09-01,article,News,,[]
Apple Is Accused of Violating Software Patent,2005-09-01,article,News,,"['Music', 'COMPUTER SOFTWARE', 'Inventions and Patents', 'Computers and the Internet']"
A French citadel?,2005-09-01,article,News,,[]
World Business Briefing | Asia: Japan: Industrial Production Falls 1.1%,2005-09-01,article,News,,"['Economic Conditions and Trends', 'Production']"
A City in Ruins: Americans Open Their Hearts,2005-09-01,article,Letter,,[]
Mandelson says Europe must let China textiles in,2005-09-01,article,News,,[]
Millions Said to Be Lacking Phone Service of Any Kind,2005-09-01,article,News,,"['KATRINA (STORM)', 'Cellular Telephones', 'Telephones and Telecommunications', 'Hurricanes and Tropical Storms', 'Wire and Cable']"
950 Die in Stampede on Baghdad Bridge,2005-09-01,article,News,,"['Accidents and Safety', 'PILGRIMS', 'United States International Relations', 'VIOLENCE', 'Bombs and Explosives', 'Bridges and Tunnels', 'Demonstrations and Riots', 'Terrorism', 'UNITED STATES ARMAMENT AND DEFENSE']"
"People: Art Garfunkel, Bruce Lee, Charlize Theron",2005-09-01,article,News,,[]
Taped Up and Ready to Impress Coughlin,2005-09-01,article,News,,['Football']
U.S. and China Fail to Reach Deal on Textile Shipments,2005-09-01,article,News,,"['Textiles', 'International Trade and World Market']"
"Longtime Tory Seeks to Lead Party, With Eye on 10 Downing",2005-09-01,article,News,,"['Politics and Government', 'Elections']"
And We're Just Helping Out at the Newspaper,2005-09-01,article,News,,[]
Sitting Down to Dinner on a 9/11 Anniversary,2005-09-01,article,Review,,"['MOTION PICTURES', 'Reviews', 'Documentary Films and Programs']"
Amusement Park Worker Dies After Being Pinned Under Ride,2005-09-01,article,News,,"['Accidents and Safety', 'AMUSEMENT AND THEME PARKS']"
A City in Ruins: Americans Open Their Hearts,2005-09-01,article,Letter,,[]
News Analysis: Netanyahu makes political gamble,2005-09-01,article,News,,[]
"Goodbye, Therapist. Hello, Anxiety?",2005-09-01,article,News,,"['Stress (Human)', 'Mental Health and Disorders', 'ANXIETY']"
"Paid Notice: Deaths   SHERMAN, RUTH",2005-09-01,article,Paid Death Notice,,[]
Building's Sale Threatens Times Sq. Tavern,2005-09-01,article,News,,"['Renting and Leasing', 'Urban Areas']"
"Schröder, in survival bid, goes on attack",2005-09-01,article,News,,[]
News Analysis: Hard NewTest for President,2005-09-01,article,An Analysis; News Analysis,,"['ANDREW (STORM)', 'PUBLIC OPINION', 'KATRINA (STORM)', 'Hurricanes and Tropical Storms', 'UNITED STATES ARMAMENT AND DEFENSE']"
Metro Briefing | New York: Manhattan: Man Charged With Lewdness On Subway,2005-09-01,article,News,,[]
Stocks: Retreat in oil price comforts U.S. investors,2005-09-01,article,News,,[]
India's mini-multinationals make waves in Western markets,2005-09-01,article,News,,[]
News Analysis: Roh strikes at Korea's regional politics,2005-09-01,article,News,,[]
A Little Shoe Therapy Never Hurt,2005-09-01,article,News,,['Tests and Testing']
"Parents, Teachers and the Crisis in Education",2005-09-01,article,Letter,,[]
Corrections,2005-09-01,article,Correction,,"['PUBLIC OPINION', 'Creationism and Intelligent Design', 'Education and Schools', 'Correction Stories', 'Evolution']"
Textile Talks With China Seen at Impasse,2005-09-01,article,News,,"['International Trade and World Market', 'Treaties', 'Customs (Tariff)', 'Textiles']"
New Breed of Trainers Are Proving Fat Is Fit,2005-09-01,article,News,,"['Diet and Nutrition', 'Exercise', 'Athletics and Sports']"
Israel and Pakistan Hold 'Historic' First Meeting,2005-09-01,article,News,,['Palestinians']
A City in Ruins: Americans Open Their Hearts,2005-09-01,article,Letter,,[]
State Dept. Official Urges Inclusive Tack on 9/11,2005-09-01,article,News,,"['World Trade Center (NYC)', 'AIRLINES AND AIRPLANES', 'International Relations', 'UNITED STATES FOREIGN SERVICE', 'Hijacking', 'Terrorism']"
"Real-Time, All-the-Time Computer Backup, So You Can Just Work",2005-09-01,article,News,,"['COMPUTER SOFTWARE', 'Prices (Fares, Fees and Rates)', 'Computer Security', 'Computers and the Internet']"
Utility Workers Come From Afar to Help Their Brethren Start Restoring Service,2005-09-01,article,News,,"['KATRINA (STORM)', 'Electric Light and Power', 'Hurricanes and Tropical Storms']"
"Paid Notice: Deaths   CAMPBELL, FATHER JOHN ''JAC''",2005-09-01,article,Paid Death Notice,,[]
Soccer: Spurs lead last-day buying spree,2005-09-01,article,News,,[]
School Siege Leader Calls Russia Unwitting Ally,2005-09-01,article,News,,"['Bombs and Explosives', 'Hostages', 'Children and Youth', 'Terrorism']"
Martínez and Mets Take a Big Step Back,2005-09-01,article,News,,['Baseball']
Digital convergence still elusive,2005-09-01,article,News,,[]
Gas Prices Surge as Supply Drops,2005-09-01,article,News,,"['Refineries', 'STRATEGIC PETROLEUM RESERVE', 'United States Economy', 'Pipelines', 'Shortages', 'KATRINA (STORM)', 'Oil (Petroleum) and Gasoline', 'Prices (Fares, Fees and Rates)', 'Hurricanes and Tropical Storms']"
BUSINESS DIGEST,2005-09-01,article,Summary,,[]
"Rows and Rows of Corpses, and Voices Choked With Sobs",2005-09-01,article,News,,"['VIOLENCE', 'Bombs and Explosives', 'Demonstrations and Riots', 'Terrorism']"
Fuel prices? Europeans have other concerns,2005-09-01,article,News,,[]
Sears to Sell Card Unit to Morgan,2005-09-01,article,News,,"['Mergers, Acquisitions and Divestitures', 'Credit and Money Cards']"
Plot twists in Italy's banking takeover drama,2005-09-01,article,News,,[]
The West's fear of Islamism backfires,2005-09-01,article,News,,[]
MySpace: A site with 26 million 'friends',2005-09-01,article,News,,[]
Graffanino Is Feeling Right at Home With Red Sox,2005-09-01,article,News,,['Baseball']
Senate Panel Plans Hearing Into Reports on Terrorist,2005-09-01,article,News,,"['World Trade Center (NYC)', 'Classification of Information', 'AIRLINES AND AIRPLANES', 'Hijacking', 'Terrorism']"
Twins vie to take over leadership of Poland,2005-09-01,article,News,,[]
Rethinking Roddick's Mojo After First-Round Defeat,2005-09-01,article,News,,"['ADVERTISING AND MARKETING', 'Credit and Money Cards', 'Tennis', 'United States Open (Tennis)']"
"Paid Notice: Deaths  LEVENTHAL, EMANUEL",2005-09-01,article,Paid Death Notice,,[]
Unsafe Paris buildings targeted,2005-09-01,article,News,,[]
WHAT'S ON TONIGHT,2005-09-01,article,Schedule,,[]
The Blind Trusting Their Stride,2005-09-01,article,News,,"['New York City Marathon', 'Running', 'Parks and Other Recreation Areas']"
Google Dips Into the World of Print Advertising,2005-09-01,article,News,,"['ADVERTISING', 'ADVERTISING AND MARKETING', 'Magazines', 'Computers and the Internet']"
F.D.A. Approves Drug Meant to Help Short Children Grow,2005-09-01,article,News,,"['Hormones', 'GROWTH', 'Drugs (Pharmaceuticals)', 'Children and Youth', 'INCRELEX (DRUG)', 'Tests and Testing']"
Crisp New England Autumns for Sale,2005-09-01,article,News,,"['Shoes and Boots', 'Dresses']"
World Business Briefing | Asia: China: Profit Flat at Telephone Company,2005-09-01,article,News,,['Company Reports']
"Furniture, Some of It Sat Upon, in Chelsea",2005-09-01,article,News,,[]
Survivors worry about the missing,2005-09-01,article,News,,[]
"But, Ma, I Saw It on 'The O.C.'",2005-09-01,article,News,,[]
"Paid Notice: Deaths   COX, RALEIGH CHAFFEE",2005-09-01,article,Paid Death Notice,,[]
National Briefing | Midwest: Illinois: Chicago Mayor Names Five To Cabinet,2005-09-01,article,News,,"['Mayors', 'Politics and Government', 'Hiring and Promotion', 'Ethics', 'Bribery']"
"When Trees Are Bending, Windows Needn't Break",2005-09-01,article,News,,[]
Taking Fashion to the Streets,2005-09-01,article,News,,"['Home Furnishings', 'APPAREL']"
Ruling on Campaign Money Muddies New Jersey Race,2005-09-01,article,News,,['Decisions and Verdicts']
Prescription for Injustice,2005-09-01,article,Op-Ed,,"['Pregnancy and Obstetrics', 'Drugs (Pharmaceuticals)', 'Suits and Litigation', 'Law and Legislation', 'Birth Control and Family Planning']"
Reaching for Success but Not Too Much of It,2005-09-01,article,News,,"['Sales', 'Small Business', 'Entrepreneurship', 'RETAIL STORES AND TRADE']"
European Union Calls for Common Rules on Deporting Illegals,2005-09-01,article,News,,['IMMIGRATION AND REFUGEES']
Lawsuit Delays Takeover of 4 Private Bus Lines,2005-09-01,article,News,,"['Buses', 'Transit Systems']"
Corrections,2005-09-01,article,Correction,,"['United States International Relations', 'Correction Stories', 'Demonstrations and Riots', 'UNITED STATES ARMAMENT AND DEFENSE']"
"New York, New Jersey and Connecticut",2005-09-01,article,News,,[]
Educators Offer Classrooms to Many Displaced Students,2005-09-01,article,News,,"['KATRINA (STORM)', 'Education and Schools', 'Colleges and Universities', 'Hurricanes and Tropical Storms']"
Corrections,2005-09-01,article,Correction,,"['Music', 'Correction Stories']"
"In City of Skyscrapers, Which Is the Mightiest of the High?",2005-09-01,article,News,,['Historic Buildings and Sites']
Funds in brief: Hedge fund executive criticizes German rules,2005-09-01,article,News,,[]
"For Its Motorists, Only Parts of Rome Prove to Be Eternal",2005-09-01,article,News,,"['Roads and Traffic', 'Restoration and Rehabilitation', 'Asphalt']"
Wall of Water Set a Record,2005-09-01,article,News,,"['Records and Achievements', 'CAMILLE (STORM)', 'KATRINA (STORM)', 'Hurricanes and Tropical Storms']"
The Opportunity Cost of Economics Education,2005-09-01,article,News,,"['Education and Schools', 'Colleges and Universities', 'Economics']"
Corrections,2005-09-01,article,Correction,,"['Privatization', 'Postal Service', 'Correction Stories']"
Loved Ones Turn to Web for Searches in Flood Zone,2005-09-01,article,News,,"['Rescues', 'KATRINA (STORM)', 'Missing Persons', 'News and News Media', 'Computers and the Internet', 'Hurricanes and Tropical Storms']"
Corrections,2005-09-01,article,Correction,,"['MOTION PICTURES', 'Correction Stories']"
News Analysis:Musharraf gains in local elections,2005-09-01,article,News,,[]
The Storm After the Storm,2005-09-01,article,Op-Ed,,"['KATRINA (STORM)', 'Blacks', 'Black People', 'History', 'Floods', 'Hurricanes and Tropical Storms']"
Jews and Catholics must work together,2005-09-01,article,News,,[]
Jailed Russian Oil Tycoon Says He Plans to Run for Parliament,2005-09-01,article,News,,"['Frauds and Swindling', 'Legislatures and Parliaments', 'Tax Evasion', 'Politics and Government', 'Elections']"
A Distribution System Brought to Its Knees,2005-09-01,article,News,,"['Ships and Shipping', 'International Trade and World Market', 'BARGES AND SCOWS', 'Shutdowns (Institutional)', 'Trucks and Trucking', 'Oil (Petroleum) and Gasoline', 'KATRINA (STORM)', 'Prices (Fares, Fees and Rates)', 'Ports', 'Grain', 'Corn', 'Diesel Power', 'United States Economy', 'Hurricanes and Tropical Storms']"
"The Horror of Beslan, Through Its Youngest Survivors",2005-09-01,article,News,,"['MOTION PICTURES', 'Television', 'Documentary Films and Programs', 'Terrorism']"
N.B.A. Prepares to Relocate Hornets in Aftermath of Hurricane,2005-09-01,article,News,,['Hurricanes and Tropical Storms']
The Pitch: A Series About Wacky Terrorists,2005-09-01,article,News,,"['Comedy and Humor', 'World Trade Center (NYC)', 'AIRLINES AND AIRPLANES', 'Television', 'Hijacking', 'Terrorism']"
Turkey rebuffs EU pressure on Cyprus,2005-09-01,article,News,,[]
Police and Owners Begin toChallenge Looters,2005-09-01,article,News,,"['Rescues', 'KATRINA (STORM)', 'Police', 'Looting', 'Hurricanes and Tropical Storms']"
Taking a new look at Japan,2005-09-01,article,News,,[]
Last puff for the French-made Gauloise,2005-09-01,article,News,,[]
Corrections,2005-09-01,article,Correction,,[]
"Searching for the Living, but Mostly Finding the Dead",2005-09-01,article,News,,"['Rescues', 'Dogs', 'KATRINA (STORM)', 'Floods', 'Hurricanes and Tropical Storms']"
Metro Briefing | New York: Manhattan: Jets Pass On West Side Deal,2005-09-01,article,News,,[]
At Stake in Court: Using the Patriot Act to Get Library Records,2005-09-01,article,News,,"['Freedom of Speech and Expression', 'Suits and Litigation', 'Law and Legislation']"
Suspension Gives Sheffield's Knee Some Rest,2005-09-01,article,News,,['Baseball']
Agassi Is Back to Being Great U.S. Hope,2005-09-01,article,News,,"['Tennis', 'United States Open (Tennis)']"
Defiant Khodorkovsky running for Parliament,2005-09-01,article,News,,[]
QUOTATION OF THE DAY,2005-09-01,article,News,,['QUOTATION OF THE DAY']
"Paid Notice: Deaths   DAVENPORT, WILLIAM (GERALD)",2005-09-01,article,Paid Death Notice,,[]
World Briefing: Middle East; Asia; Africa,2005-09-01,article,News,,[]
Metro Briefing | New York: Buffalo: Pirro Endorsed By Erie County Republican,2005-09-01,article,News,,[]
Ferrer and Bloomberg Increase Campaign Attacks on Each Other,2005-09-01,article,News,,['Mayors']
Iraqis bury victims of Baghdad stampede,2005-09-01,article,News,,[]
On The Street: Then,2005-09-01,article,News,,[]
"A Hard Drive Can't Be Too Big (or Too Small, Either, It Seems)",2005-09-01,article,News,,"['Prices (Fares, Fees and Rates)', 'Computers and the Internet']"
"Paid Notice: Deaths   WANNISKI, JUDE T.",2005-09-01,article,Paid Death Notice,,[]
"Paid Notice: Deaths   SCHEUER, JAMES H.",2005-09-01,article,Paid Death Notice,,[]
Corrections,2005-09-01,article,Correction,,"['Robberies and Thefts', 'MOTION PICTURES', 'Correction Stories']"
"Gay Cable's Like Straight, Except for Nervous Jokes",2005-09-01,article,News,,"['Cable Television', 'Reviews', 'Television', 'Homosexuality']"
Ex-minister seeks post in Britain's opposition,2005-09-01,article,News,,[]
"Administration Steps Up Actions, Adding Troops and Dispatching Medical Supplies",2005-09-01,article,News,,"['Hurricanes and Tropical Storms', 'Politics and Government']"
"Paid Notice: Deaths   SIEGEL, RUTH FISHER",2005-09-01,article,Paid Death Notice,,[]
Baghdad stampede kills nearly 850,2005-09-01,article,News,,[]
Why Ralph Fiennes is never just a guy,2005-09-01,article,News,,[]
"Paid Notice: Deaths   WINSTON, LABELLE",2005-09-01,article,Paid Death Notice,,[]
Lengthy Practices Prepare Court Nominee for His Senate Hearings,2005-09-01,article,News,,[]
"Some Assembly Required, But It Comes With a Mallet",2005-09-01,article,News,,[]
"Arts, Briefly; Video Music Awards Attract Fewer Viewers This Year",2005-09-01,article,News,,"['Television', 'Ratings and Rating Systems']"
Pakistan's President Consolidates Power in Local Elections,2005-09-01,article,News,,[]
"The Mohawk Becomes, Well, Cute",2005-09-01,article,News,,['Hair']
Ex-Pepsi Executive Named ConAgra Chief,2005-09-01,article,News,,"['Suspensions, Dismissals and Resignations', 'Appointments and Executive Changes', 'Biographical Information']"
Official Quits on Pill Delay at the F.D.A.,2005-09-01,article,News,,"['Suspensions, Dismissals and Resignations', 'Children and Youth', 'Plan B (Contraceptive)', 'Birth Control and Family Planning']"
"Paid Notice: Memorials   SHEPPS, HOWARD ZVI",2005-09-01,article,Paid Death Notice,,[]
Mourners to mark anniversary of Beslan tragedy,2005-09-01,article,News,,[]
A City in Ruins: Americans Open Their Hearts,2005-09-01,article,Letter,,[]
Future Face of New Orleans Has an Uncertain Look for Now,2005-09-01,article,News,,"['KATRINA (STORM)', 'Urban Areas', 'Floods', 'Hurricanes and Tropical Storms']"
Lives and Homes Strewn on an Abandoned Street,2005-09-01,article,News,,"['KATRINA (STORM)', 'Hurricanes and Tropical Storms']"
Review Planned of State Efforts to Curb Fraud in Medicaid,2005-09-01,article,News,,"['Frauds and Swindling', 'Medicaid']"
"Arts, Briefly; Pop Charts: Summer Hits",2005-09-01,article,News,,"['RECORDINGS (AUDIO)', 'Music', 'Ratings and Rating Systems']"
Better Late Than Never to Fix Latino Promotion,2005-09-01,article,News,,"['Baseball', 'ADVERTISING AND MARKETING', 'Hispanic-Americans']"
Cracks in the Guggenheim Get High-Tech Attention,2005-09-01,article,News,,"['Historic Buildings and Sites', 'Restoration and Rehabilitation', 'Museums']"
Briefs: MasterCard plans IPO,2005-09-01,article,News,,[]
Key Rates,2005-09-01,article,Statistics,,[]
