headline,date,doc_type,material_type,section,keywords
In the Shadow of the No. 7 Line,2005-09-08,multimedia,Slideshow,,[]
Prosperity in Soweto,2005-09-08,multimedia,Slideshow,,[]
Way After Last Call,2005-09-08,multimedia,Slideshow,,[]
"Studying Locally, Teaching Globally",2005-09-08,article,News,,[]
Plumbing the Character of Flight 93's Brave Passengers,2005-09-09,article,Review,,['Television']
"36 Hours in Panama City, Panama",2005-09-09,article,News,,['Travel and Vacations']
The State of Iraq: An Update,2005-09-09,article,News,,[]
Neither the Parents Nor the Kids Are All Right,2005-09-09,article,Review,,[]
Metro Briefing | New York: Lynbrook: Sentencing In Commuter's Death,2005-09-09,article,News,,[]
What Lies Beyond Poetry and Music,2005-09-09,article,Review,,"['Reviews', 'Opera']"
Congo's hope,2005-09-09,article,News,,[]
"Paid Notice: Memorials   BRECKIR, ROSE (GO, GO)",2005-09-09,article,Paid Death Notice,,[]
Advance Men in Charge,2005-09-09,article,Editorial,,"['Editorials', 'KATRINA (STORM)', 'HURRICANE KATRINA', 'Hurricanes and Tropical Storms']"
"Loops, Links and Lakefronts to Explore",2005-09-09,article,News,,"['Bicycles and Bicycling', 'Walking']"
"Frantic Search, and Questions",2005-09-09,article,Review,,['MOTION PICTURES']
"Paid Notice: Deaths   WEISBERG, LEOPOLD",2005-09-09,article,Paid Death Notice,,[]
"Free the Bear, Please (It's a Symbol)",2005-09-09,article,Summary,,[]
The Government And the Public Good,2005-09-09,article,Letter,,[]
Leader Who Rose in 9/11 Slips in Wake of Storm,2005-09-09,article,An Analysis; News Analysis,,"['World Trade Center (NYC)', 'AIRLINES AND AIRPLANES', 'KATRINA (STORM)', 'Hijacking', 'Terrorism', 'Hurricanes and Tropical Storms']"
"No Quick Fuel Surcharge, Taxi Commission Says",2005-09-09,article,News,,"['Taxicabs and Taxicab Drivers', 'Oil (Petroleum) and Gasoline', 'HURRICANE KATRINA']"
Lottery Numbers,2005-09-09,article,News,,['Lotteries']
A Newcomer Heats Up the Town,2005-09-09,article,Review,,['MOTION PICTURES']
"If you can't lick 'em, try diplomacy",2005-09-09,article,News,,[]
BUSINESS DIGEST,2005-09-09,article,Summary,,[]
Tories run up the antiwar banner,2005-09-09,article,News,,[]
Bush promises more help for Katrina survivors,2005-09-09,article,News,,[]
Balance Sheet: Bottom line is survival,2005-09-09,article,News,,[]
A Tribute to the Music of New Orleans,2005-09-09,article,Review,,"['Music', 'MOTION PICTURES', 'Documentary Films and Programs']"
"Arts, Briefly",2005-09-09,article,News,,"['Philanthropy', 'KATRINA (STORM)', 'TELETHONS', 'Hurricanes and Tropical Storms']"
The Personalities in the Orchestra Pit,2005-09-09,article,Review,,"['MOTION PICTURES', 'Classical Music', 'Documentary Films and Programs']"
The State of Iraq: An Update,2005-09-09,article,Op-Ed,,"['United States International Relations', 'Politics and Government', 'Economic Conditions and Trends', 'UNITED STATES ARMAMENT AND DEFENSE']"
EBay Is Said to Be in Talks to Buy Internet Phone Company,2005-09-09,article,News,,"['Mergers, Acquisitions and Divestitures', 'Computers and the Internet']"
Michael Chertoff's Announcement,2005-09-09,article,Transcript,,[]
"Conserve, and Drill",2005-09-09,article,Letter,,[]
"Brain May Still Be Evolving, Studies Hint",2005-09-09,article,News,,"['Brain', 'Genetics and Heredity', 'Research', 'Evolution', 'DNA (Deoxyribonucleic Acid)']"
PRO BASKETBALL: Nets Sign Two Forwards,2005-09-09,article,News,,[]
Email Sent by Ex-Lazard Banker,2005-09-09,article,News,,[]
"Paid Notice: Deaths   MEYER, BERNARD S.",2005-09-09,article,Paid Death Notice,,[]
Italy Continues Expulsion of Suspected Militants,2005-09-09,article,News,,[]
Pakistan and India Plan Prisoner Exchange,2005-09-09,article,News,,[]
Intel Says Strong Chip Demand Is Causing Supplies to Be Tight,2005-09-09,article,News,,['Computer Chips']
The Government And the Public Good,2005-09-09,article,Letter,,"['United States International Relations', 'KATRINA (STORM)', 'Ethics', 'Hurricanes and Tropical Storms', 'UNITED STATES ARMAMENT AND DEFENSE']"
"Panel Removes Judge, Rejecting Excuse Involving Iraq Work",2005-09-09,article,News,,['Judges']
Metro Briefing | Connecticut: Hartford: Official Drops Bid For Governor,2005-09-09,article,News,,[]
Korean defectors live in a twilight world,2005-09-09,article,News,,[]
"Dance, a Last Resort, Rises on Reality TV",2005-09-09,article,News,,"['Television', 'Dancing']"
"Agassi goes to the limit, and beyond, to win",2005-09-09,article,News,,[]
Broken Yardstick,2005-09-09,article,Op-Ed,,"['Recession and Depression', 'Population', 'United States Economy', 'Income']"
Israeli Army Removes Military Equipment From Gaza,2005-09-09,article,News,,['Palestinians']
Judge Orders Edgar Ray Killen to Prison,2005-09-09,article,News,,[]
The Human Voice of 9/11,2005-09-09,article,News,,"['World Trade Center (NYC)', 'Walking']"
No Trouble for Federer as He Cruises Into Semifinals,2005-09-09,article,News,,"['Tennis', 'United States Open (Tennis)']"
"A Time of Tangled Transition in Israel, and in a Family",2005-09-09,article,Review,,['MOTION PICTURES']
The Listings: Sept. 9 -- Sept. 15; ARCADE FIRE,2005-09-09,article,Schedule,,[]
"Check on your home, even from the road",2005-09-09,article,News,,[]
The Government And the Public Good,2005-09-09,article,Letter,,[]
Did We Let New Orleans Down? (5 Letters),2005-09-09,article,Letter,,['HURRICANE KATRINA']
Asia is in better shape than they say,2005-09-09,article,News,,[]
Butterfly Migration,2005-09-09,article,News,,"['MIGRATION', 'Butterflies and Moths']"
Corrections,2005-09-09,article,Correction,,"['Biographical Information', 'Correction Stories', 'Deaths (Obituaries)']"
Nothing to Be Done: Giants Still Waiting for Bonds,2005-09-09,article,News,,['Baseball']
From Falluja to the Shores of Louisiana,2005-09-09,article,News,,"['United States International Relations', 'KATRINA (STORM)', 'MARINE CORPS', 'Terrorism', 'Hurricanes and Tropical Storms', 'UNITED STATES ARMAMENT AND DEFENSE']"
Did We Let New Orleans Down?,2005-09-09,article,Letter,,[]
The Government And the Public Good,2005-09-09,article,Letter,,[]
Two Girls With One Goal: They Just Want to Have Fun,2005-09-09,article,Review,,['MOTION PICTURES']
A Hike Up to the Old Man of Haunting Mountains,2005-09-09,article,Review,,"['Reviews', 'Photography', 'Museums', 'Art']"
"'Going to Get It Done,' Cheney Vows on Gulf Tour",2005-09-09,article,News,,"['United States International Relations', 'Taxation', 'KATRINA (STORM)', 'HURRICANE KATRINA', 'Terrorism', 'Hurricanes and Tropical Storms', 'UNITED STATES ARMAMENT AND DEFENSE']"
Switching engines in midrace,2005-09-09,article,News,,[]
Arts Guide,2005-09-09,article,News,,[]
"Paid Notice: Deaths  LINDENBAUM, SHERWIN (SONNY)",2005-09-09,article,Paid Death Notice,,[]
The Days of Abandonment,2005-09-09,article,News,,[]
Metro Briefing | New York: Manhattan: U.N. Expected To Snarl Traffic,2005-09-09,article,News,,[]
With Interest: When banks bulk up on risk,2005-09-09,article,News,,[]
VW to Build Hybrid Minivan With Chinese,2005-09-09,article,News,,[]
How to Help Those Hurt by the Storm,2005-09-09,article,List,,"['Philanthropy', 'KATRINA (STORM)', 'Hurricanes and Tropical Storms']"
Briefs: Sears chairman removes CEO,2005-09-09,article,News,,[]
"Rail Line to Tibet Is a Marvel, but China Is Mum",2005-09-09,article,News,,['Railroads']
Spare Times,2005-09-09,article,Schedule,,[]
Snyder Faults Morgenthau on Drug Laws,2005-09-09,article,News,,['Elections']
WHERE GOD WAS BORN A Journey by Land to the Roots of Religion,2005-09-09,article,News,,[]
"News Analysis: In Egypt, progress was the real victor",2005-09-09,article,News,,[]
"14 Years Later, a New Classic for the U.S. Open",2005-09-09,article,News,,"['Tennis', 'United States Open (Tennis)']"
"Kathy Wilson, 54, Women's Rights Advocate, Dies",2005-09-09,article,Obituary; Biography,,['Deaths (Obituaries)']
"Shooting his own scripts, with a .45",2005-09-09,article,News,,[]
Golf: U.S. Solheim Cup team chills out to get fired up,2005-09-09,article,News,,[]
"Henry Luce III, 80, Publisher of Time and Philanthropist, Dies",2005-09-09,article,Obituary; Biography,,['Deaths (Obituaries)']
Duty pulls Annan in two directions,2005-09-09,article,News,,[]
Frivolity Revs Up as the Big Week Starts,2005-09-09,article,News,,['APPAREL']
Airlift of Evacuees to Northeast Is Under Way,2005-09-09,article,News,,"['Military Bases and Installations', 'KATRINA (STORM)', 'OTIS AIR NATIONAL GUARD BASE (MASS)', 'Hurricanes and Tropical Storms']"
Did We Let New Orleans Down?,2005-09-09,article,Letter,,[]
The Listings: Sept. 9 -- Sept. 15; MICHAEL FITZGERALD AND JAMES KENNEDY,2005-09-09,article,Schedule,,[]
Bolzano's Bar Cucina,2005-09-09,article,Review,,"['Reviews', 'Restaurants']"
Life lessons of an ex-Hollywood Prince,2005-09-09,article,News,,[]
Upstarts Preparing for Line Shift as U.S. Looks to Winter Games,2005-09-09,article,News,,"['Hockey, Ice', 'Olympic Games']"
Nations urged to embrace open technology standards,2005-09-09,article,News,,[]
"Paid Notice: Deaths   CONVERSE, H.",2005-09-09,article,Paid Death Notice,,[]
Hotel Watch: QT in New York City,2005-09-09,article,News,,[]
Judge to rule in case opposing technology titans,2005-09-09,article,News,,[]
Graham Meets Challenge and Sends One,2005-09-09,article,News,,['Football']
An Outsider Wants to Take His Watchdog Role Inside,2005-09-09,article,News,,"['Freedom of Speech and Expression', 'Elections']"
Corrections,2005-09-09,article,Correction,,"['Music', 'Cellular Telephones', 'Correction Stories', 'Telephones and Telecommunications', 'Computers and the Internet']"
Currencies: Yen rises as support for Koizumi grows,2005-09-09,article,News,,[]
Ford and Fiat to revive Cinquecento,2005-09-09,article,News,,[]
"Paid Notice: Deaths   ROSEN, RUTH (NEE JACOBSON)",2005-09-09,article,Paid Death Notice,,[]
Plumbing the Character of Flight 93's Brave Passengers,2005-09-09,article,Review,,"['Reviews', 'Television']"
Harlem School IntroducesChildren to Swiss Chard,2005-09-09,article,Series,,"['Education and Schools', 'Children and Youth', 'Obesity', 'Food']"
"Paid Notice: Deaths   WILKINS, ALBERT J., JR.",2005-09-09,article,Paid Death Notice,,[]
Chirac leaves hospital in 'very satisfying' condition but must rest,2005-09-09,article,News,,[]
"Stanley Dancer, Harness Racing Champion, Dies at 78",2005-09-09,article,Obituary; Biography,,['Horse Racing']
Plan by 13 Nations Urges Open Technology Standards,2005-09-09,article,News,,"['COMPUTER SOFTWARE', 'Computers and the Internet']"
Continental expects big loss for 2005,2005-09-09,article,News,,[]
Stocks: Markets expect consumers to spend,2005-09-09,article,News,,[]
Shariah Proposal Protested in Canada,2005-09-09,article,News,,[]
Broadway Is Going to the Movies via a New Musical Promotion,2005-09-09,article,News,,"['Theaters (Buildings)', 'MOTION PICTURES', 'PROMOTIONS (MARKETING TECHNIQUE)', 'ADVERTISING AND MARKETING', 'Theater']"
A railroad marvel conquers China's terrain,2005-09-09,article,News,,[]
"On Offense, the Patriots Will Play Follow the Leaders",2005-09-09,article,News,,['Football']
A Legal System in Shambles,2005-09-09,article,News,,"['Courts', 'KATRINA (STORM)', 'HURRICANE KATRINA', 'Crime and Criminals', 'Legal Profession', 'Hurricanes and Tropical Storms']"
From Children's Hands to New York Hearts,2005-09-09,article,News,,"['Poetry and Poets', 'MOSAICS', 'Children and Youth', 'Books and Literature', 'Parks and Other Recreation Areas', 'Art']"
Chernobyl's reduced impact,2005-09-09,article,News,,[]
Briefly: Court backs detention of 'dirty bomb' suspect,2005-09-09,article,News,,[]
"Paid Notice: Memorials   BRINKERHOFF, LILLIAN WESTAWAY",2005-09-09,article,Paid Death Notice,,[]
G.O.P.'s Failed Optimism,2005-09-09,article,Letter,,[]
"Amid Barrage of Criticism, Defending His Department",2005-09-09,article,News,,"['HURRICANE KATRINA', 'Biographical Information', 'Police', 'Hurricanes and Tropical Storms']"
Democratic Leaders Reject G.O.P. Storm Inquiry Plan,2005-09-09,article,News,,"['KATRINA (STORM)', 'HURRICANE KATRINA', 'Politics and Government', 'Hurricanes and Tropical Storms']"
"Holdouts on Dry Ground Say, 'Why Leave Now?'",2005-09-09,article,News,,"['KATRINA (STORM)', 'HURRICANE KATRINA', 'Firearms', 'Hurricanes and Tropical Storms']"
Israelis Kill Palestinian at Settlement,2005-09-09,article,News,,[]
Senate Democrats Are Shifting Focus From Roberts to Other Seat,2005-09-09,article,News,,"['Judges', 'Appointments and Executive Changes']"
U.S. asks NATO transport aid,2005-09-09,article,News,,[]
Corrections,2005-09-09,article,Correction,,"['Palestinians', 'Biographical Information', 'Correction Stories']"
Wells Revisits Yankees on Spotlight's Brighter Side,2005-09-09,article,News,,['Baseball']
Palm firm to be sold to Access of Japan,2005-09-09,article,News,,[]
Textbook sales show kids at their craftiest,2005-09-09,article,News,,[]
"HP's job cuts to hit hard in Europe, official says",2005-09-09,article,News,,[]
Vatican Making Effort to Mend Strained Relations,2005-09-09,article,News,,[]
Riding on empty,2005-09-09,article,News,,[]
"Polishing, and Inflating, Their Records",2005-09-09,article,News,,"['Mayors', 'Debating', 'Elections']"
Blank Invoices Detailed in Political Corruption Trial,2005-09-09,article,News,,"['Frauds and Swindling', 'Lobbying and Lobbyists']"
"The oyster route, for a taste of the sea",2005-09-09,article,News,,[]
"Paid Notice: Deaths   SCHRIER, ROBERT I., M.D.",2005-09-09,article,Paid Death Notice,,[]
"36 Hours in Panama City, Panama",2005-09-09,article,News,,['Travel and Vacations']
A School's Colorful Patina,2005-09-09,article,News,,['Art']
Briefcase: A real estate boom just off campus,2005-09-09,article,News,,[]
Did We Let New Orleans Down?,2005-09-09,article,Letter,,[]
Fiji rides wave of housing boom,2005-09-09,article,News,,[]
"Paid Notice: Deaths   GREENE, ELLIS",2005-09-09,article,Paid Death Notice,,[]
Inspiration From Real Estate Rejects,2005-09-09,article,Review,,"['Reviews', 'Art']"
"Auto Racing: Nostalgia for good, old gutsy past",2005-09-09,article,News,,[]
"Paid Notice: Deaths   SCHER, BENJAMIN",2005-09-09,article,Paid Death Notice,,[]
"After 7-year decline, Japan banks increase lending",2005-09-09,article,News,,[]
"Democratic Rivals Play Nice, Saving Sharpest Barbs for Mayor",2005-09-09,article,News,,"['Mayors', 'Debating', 'Elections']"
Names of the Dead,2005-09-09,article,List,,"['United States International Relations', 'UNITED STATES ARMAMENT AND DEFENSE']"
Lessons From Two Wrecked Hedge Funds,2005-09-09,article,News,,"['Securities and Commodities Violations', 'Suits and Litigation', 'Hedge Funds']"
Readers Consider the ITunes Cellphone,2005-09-09,article,News,,[]
"In Our Pages: 100, 75, & 50 years ago",2005-09-09,article,News,,[]
Booker Finalists Are Named,2005-09-09,article,News,,"['Contests and Prizes', 'Man Booker Prize', 'Books and Literature', 'BOOKER PRIZE', 'Awards, Decorations and Honors']"
Giants Give Barber a Raise and a Contract Extension,2005-09-09,article,News,,['Football']
SPORTS BRIEFING,2005-09-09,article,News,,[]
Corrections,2005-09-09,article,Correction,,"['KATRINA (STORM)', 'Correction Stories', 'Hurricanes and Tropical Storms']"
Corrections,2005-09-09,article,Correction,,"['Coaches and Managers', 'Correction Stories', 'Football']"
Chief of relief effort is replaced,2005-09-09,article,News,,[]
ABN set to acquire bank,2005-09-09,article,News,,[]
"Textile fight over, EU stresses economic ties to China",2005-09-09,article,News,,[]
Art in Review; Frederick Sommer at 100,2005-09-09,article,Review,,"['Reviews', 'Photography']"
Political Issues Snarled Plans for Troop Aid,2005-09-09,article,News,,"['ARMAMENT, DEFENSE AND MILITARY FORCES', 'United States Politics and Government', 'KATRINA (STORM)', 'HURRICANE KATRINA', 'Hurricanes and Tropical Storms', 'NATIONAL GUARD (US)', 'UNITED STATES ARMAMENT AND DEFENSE']"
New in Escapes,2005-09-09,article,News,,[]
"Paid Notice: Deaths   TURTELL, ANN GRACE (NEE GLOVER)",2005-09-09,article,Paid Death Notice,,[]
Gadget of the week: A keyboard to cut stress,2005-09-09,article,News,,[]
Corrections,2005-09-09,article,Correction,,"['Shutdowns (Institutional)', 'Books and Literature', 'Book Trade', 'Correction Stories']"
From UBS's Suite of Power to the Sweat of a Hedge Fund,2005-09-09,article,News,,"['Biographical Information', 'Hedge Funds', 'Banks and Banking']"
A New Meaning for 'Organized Religion': It Helps the Needy Quickly,2005-09-09,article,News,,"['KATRINA (STORM)', 'HURRICANE KATRINA', 'Religion and Churches', 'Hurricanes and Tropical Storms']"
Patriots should prevail - again,2005-09-09,article,News,,[]
Dresden vote district suddenly a linchpin,2005-09-09,article,News,,[]
Did We Let New Orleans Down?,2005-09-09,article,Letter,,[]
Europa: Would Merkel bridge a trans-Atlantic divide?,2005-09-09,article,News,,[]
Corrections,2005-09-09,article,Correction,,"['KATRINA (STORM)', 'Correction Stories', 'Hurricanes and Tropical Storms']"
EU phone talks stall,2005-09-09,article,News,,[]
G.O.P.'s Failed Optimism,2005-09-09,article,Letter,,[]
F.D.A. Panel Endorses Inhaled Form of Insulin,2005-09-09,article,News,,"['Exubera (Drug)', 'Diabetes', 'Drugs (Pharmaceuticals)', 'Insulin']"
Speed and stunts rev up franchise,2005-09-09,article,News,,[]
More Than 'Blame Game',2005-09-09,article,Letter,,[]
Amtrak Is Said to Be Planning a Big Fare Rise,2005-09-09,article,News,,"['Transit Systems', 'Railroads']"
Corrections,2005-09-09,article,Correction,,"['KATRINA (STORM)', 'Finances', 'Budgets and Budgeting', 'Hurricanes and Tropical Storms']"
Supreme Court Candidate Is Displaced,2005-09-09,article,News,,"['HURRICANE KATRINA', 'Hurricanes and Tropical Storms']"
Roethlisberger Wants to Prove He's No Fluke,2005-09-09,article,News,,['Football']
Archaeologists and Dealers Spar Over U.S.-Italian Art Accord,2005-09-09,article,News,,"['ARCHAEOLOGY AND ANTHROPOLOGY', 'Museums', 'Art']"
"In a Season of Discontent, Earnhardt Searches for Answers",2005-09-09,article,News,,['Automobile Racing']
A lost link in Matisse's final work,2005-09-09,article,News,,[]
"Paid Notice: Deaths   PIERCE, GERALD G., M.D.",2005-09-09,article,Paid Death Notice,,[]
Caspian beluga caviar is facing a ban by U.S.,2005-09-09,article,News,,[]
Storm's Punch Has Knocked Shuttle Timetable 'Off Kilter',2005-09-09,article,News,,"['Accidents and Safety', 'Space', 'SPACE SHUTTLE', 'KATRINA (STORM)', 'Hurricanes and Tropical Storms']"
Soccer: Easy part over for Mexico,2005-09-09,article,News,,[]
The pressure to leave is stepped up,2005-09-09,article,News,,[]
"Paid Notice: Deaths   KEMPNER, NAN S.",2005-09-09,article,Paid Death Notice,,[]
An Americana Collection Built Slowly and Steadily,2005-09-09,article,News,,"['Collectors and Collections', 'ANTIQUES', 'Furniture', 'Ceramics and Pottery', 'Art', 'Home Furnishings', 'Silver']"
"For Schröder, a hint of last hurrah",2005-09-09,article,News,,[]
Egypt's Metamorphosis: One Step Down the Open Road,2005-09-09,article,An Analysis; News Analysis,,"['Politics and Government', 'Elections', 'Demonstrations and Riots', 'Freedom and Human Rights']"
PPR's luxury strategy pays off,2005-09-09,article,News,,[]
New Orleans and Baghdad,2005-09-09,article,Op-Ed,,"['United States International Relations', 'KATRINA (STORM)', 'HURRICANE KATRINA', 'ELECTION ISSUES', 'Constitutions', 'Elections', 'Hurricanes and Tropical Storms', 'UNITED STATES ARMAMENT AND DEFENSE']"
"World Briefings: Africa, Americas, Middle East, Europe, Australia, Asia",2005-09-09,article,News,,[]
Private Investors to Buy Hertz for $15 Billion,2005-09-09,article,News,,[]
"Paid Notice: Deaths   MONTANA, RICHARD",2005-09-09,article,Paid Death Notice,,[]
Eagles remain the favorite,2005-09-09,article,News,,[]
WHAT'S ON TONIGHT,2005-09-09,article,Schedule,,[]
Caremark to Settle Whistle-Blower Suit,2005-09-09,article,News,,"['Drugs (Pharmaceuticals)', 'Suits and Litigation']"
Confusion on Debit Card Aid,2005-09-09,article,News,,"['KATRINA (STORM)', 'HURRICANE KATRINA', 'Credit and Money Cards', 'ASTRODOME (HOUSTON)', 'Hurricanes and Tropical Storms']"
Sheffield Believes a Quick Recovery Is Likely,2005-09-09,article,News,,['Baseball']
"Paid Notice: Deaths   PARISER, MARILYN",2005-09-09,article,Paid Death Notice,,[]
Chirac Discharged From Hospital,2005-09-09,article,News,,[]
Hope Appears to Take the Night Off for the Mets,2005-09-09,article,News,,['Baseball']
"Paid Notice: Deaths  BERNSTEIN, FLORENCE",2005-09-09,article,Paid Death Notice,,[]
"Arts, Briefly; TV's Summer Staggers To Its Finish",2005-09-09,article,News,,"['Television', 'Ratings and Rating Systems']"
Kayak Fishing,2005-09-09,article,News,,"['Kayaks', 'Fishing, Sport', 'Fish and Other Marine Life']"
"Brain genes evolving, study finds",2005-09-09,article,News,,[]
Ukraine Leader Fires Cabinet as Reform Coalition Splits,2005-09-09,article,News,,"['Suspensions, Dismissals and Resignations', 'Privatization', 'Politics and Government', 'Ethics']"
Focused Activity in the Wake of Tragedy,2005-09-09,article,Review,,"['MOTION PICTURES', 'Documentary Films and Programs']"
Gilt-edged adventure: You're just as remote as you feel,2005-09-09,article,News,,[]
Gas Inventories at a 5-Year Low,2005-09-09,article,News,,[]
"At Google, a new role as 'Internet evangelist'",2005-09-09,article,News,,[]
Murder Suspect Is Said to Cite His Own Abuse,2005-09-09,article,News,,"['Murders and Attempted Murders', 'Sex Crimes', 'Child Abuse and Neglect', 'Computers and the Internet']"
Crispin Porter & Bogusky Awarded Sprite Assignment,2005-09-09,article,News,,[]
Chirac to leave Paris hospital,2005-09-09,article,News,,[]
Miller Cancels More Ads in Dispute on Spending,2005-09-09,article,News,,"['Television', 'Elections']"
New Strain of Wheat Rust Appears in Africa,2005-09-09,article,News,,"['Science and Technology', 'Grain']"
Stewart Is Keeping the Engine Running,2005-09-09,article,News,,[]
QUOTATION OF THE DAY,2005-09-09,article,News,,['QUOTATION OF THE DAY']
"Dancing With the Devil, Then With a Prosecutor",2005-09-09,article,Review,,['MOTION PICTURES']
"Paid Notice: Deaths  EDELSTEIN, MILDRED",2005-09-09,article,Paid Death Notice,,[]
Briefs: Inquiry targets General Re chief,2005-09-09,article,News,,[]
America's Priciest Getaways,2005-09-09,article,News,,"['Housing', 'Prices (Fares, Fees and Rates)', 'Travel and Vacations']"
Gasoline Thefts Increasing as Fuel Prices Keep Rising,2005-09-09,article,News,,"['Automobiles', 'FUEL', 'Oil (Petroleum) and Gasoline', 'HURRICANE KATRINA']"
"Paid Notice: Deaths   BROOKS, VIRGINIA GUARD",2005-09-09,article,Paid Death Notice,,[]
Sri Lanka begins inquiry into fatal bomb hoax,2005-09-09,article,News,,[]
SHALIMAR THE CLOWN,2005-09-09,article,News,,[]
Plenty of corn grows on this ranch,2005-09-09,article,News,,[]
"A Surgeon Caught Up in the Flooding Tells of a Week of Chaos, Peril and Heroism",2005-09-09,article,News,,"['KATRINA (STORM)', 'HURRICANE KATRINA', 'Doctors', 'Medicine and Health', 'Hospitals', 'News and News Media', 'Hurricanes and Tropical Storms']"
"Ukraine's Orange Flame, Dimmed",2005-09-09,article,Editorial,,"['Suspensions, Dismissals and Resignations', 'Editorials', 'Politics and Government']"
EU puts pressure on oil firms,2005-09-09,article,News,,[]
Billions for Vaccines for the Poor to Be Raised in Bond Markets,2005-09-09,article,News,,"['Vaccination and Immunization', 'Children and Youth', 'Medicine and Health', 'Third World and Developing Countries', 'Foreign Aid']"
N. Korea seeks shift in food aid,2005-09-09,article,News,,[]
Police Begin Seizing Guns of Civilians,2005-09-09,article,News,,"['Philanthropy', 'KATRINA (STORM)', 'HURRICANE KATRINA', 'Electric Light and Power', 'Firearms', 'Hurricanes and Tropical Storms']"
China Says North Korea Nuclear Talks Will Resume Tuesday,2005-09-09,article,News,,"['ATOMIC WEAPONS', 'United States International Relations', 'Political Prisoners', 'Law and Legislation', 'Freedom and Human Rights']"
Ex-Clinton Official Draws Higher-Than-Expected Fine,2005-09-09,article,News,,"['Fines (Penalties)', 'Sentences (Criminal)', 'Archives and Records', 'Terrorism']"
Art in Review; Danica Phelps,2005-09-09,article,Review,,"['Reviews', 'Art']"
Auditor for Schools in Roslyn Is Charged,2005-09-09,article,News,,"['ACCOUNTING AND ACCOUNTANTS', 'Education and Schools']"
A Mountaintop Retreat With an Artistic Air,2005-09-09,article,News,,"['Housing', 'GEOGRAPHIC PROFILES']"
"Paid Notice: Deaths   LEVIN, MELVIN C.",2005-09-09,article,Paid Death Notice,,[]
Odd Couple Become Partners in Crimefighting,2005-09-09,article,Review,,['MOTION PICTURES']
VW chooses China to roll out first hybrid,2005-09-09,article,News,,[]
Positions harden in Boeing machinists' strike,2005-09-09,article,News,,[]
Some in Senate Seek to Change Mercury Rule,2005-09-09,article,News,,"['Environment', 'Coal', 'Law and Legislation', 'Electric Light and Power', 'FACTORIES AND INDUSTRIAL PLANTS', 'Regulation and Deregulation of Industry', 'Air Pollution', 'Mercury (Metal)']"
"Hey Jude, buy stocks and bonds",2005-09-09,article,News,,[]
Merkel camp jittery as polls shift,2005-09-09,article,News,,[]
The Churn,2005-09-09,article,News,,['Executives and Management']
Point Those Fingers,2005-09-09,article,Op-Ed,,[]
Child and His Abductor Journey Through City,2005-09-09,article,News,,['Kidnapping']
Malaysia's ex-leader assails U.S. and British role in Iraq,2005-09-09,article,News,,[]
"Fields Runs as an Underdog, in Her Own Way",2005-09-09,article,News,,['PRIMARIES']
EU divided on talks for Turkey,2005-09-09,article,News,,[]
A Light in the Forests,2005-09-09,article,Editorial,,"['Forests and Forestry', 'Environment', 'Editorials', 'Logging Industry']"
"First School Day Is Calm, Orderly and Attended by Many Politicians",2005-09-09,article,News,,"['Education and Schools', 'Children and Youth', 'Elections']"
Casanova's big night lights up Venice sky,2005-09-09,article,News,,[]
"Downtown in a Ruined City, the Story of a Corpse",2005-09-09,article,Letter,,[]
Schooling the Displaced,2005-09-09,article,Letter,,[]
