headline,date,doc_type,material_type,section,keywords
China: CNN Apologizes Over Tibet Comments,2008-05-16,article,Brief,,[]
Injured Actor Files Petition,2008-05-16,article,Brief,,['Theater']
Sanofi-Aventis Wants F.D.A. to Reconsider Heart Drug,2008-05-16,article,News,,"['Drugs (Pharmaceuticals)', 'Heart', 'Regulation and Deregulation of Industry']"
"Big Brown a Big Favorite, but Others Still Want a Shot",2008-05-16,article,News,,"['Preakness Stakes', 'Big Brown (Race Horse)', 'Horse Racing', 'Triple Crown (Horse Racing)']"
Bacon’s ‘Dyer’ Expected to Attract Big Numbers,2008-05-16,article,News,,['Art']
Competitor Files a Lawsuit Claiming Speedo Is Attempting a Monopoly,2008-05-16,article,News,,"['Suits and Litigation', 'ANTITRUST ACTIONS AND LAWS', 'Swimming']"
"Bad Words, Overused, Can Lose Their Sting",2008-05-16,article,News,,['Language and Languages']
Names of the Dead,2008-05-16,article,List,,['UNITED STATES ARMAMENT AND DEFENSE']
Rays Provide Yanks Glimpse of What Could Be,2008-05-16,article,News,,['Baseball']
What to Ask About Epilepsy,2008-05-16,article,Question,,"['Epilepsy', 'Seizures (Medical)', 'Medicine and Health', 'Children and Youth']"
New Parking Rules Receive a Wary Welcome,2008-05-16,article,News,,"['Parking', 'Automobiles']"
See How They Run,2008-05-16,article,Editorial,,"['Editorials', 'Presidential Election of 2008', 'United States Politics and Government']"
Women Are Finding Their Voices Behind the Mike,2008-05-16,article,News,,"['Basketball', 'Television', 'Athletics and Sports', 'Women']"
Discovering Alabama From Its Watery Byway,2008-05-16,article,News,,"['Travel and Vacations', 'Canoes and Canoeing']"
Tasting the Bounty of San Francisco Markets,2008-05-16,article,News,,"['Travel and Vacations', ""Farmers' Markets""]"
"A Brahms Piano Quartet, With No Strings Attached",2008-05-16,article,Review,,['Classical Music']
Study Links Rise in Mastectomies to M.R.I. Detection,2008-05-16,article,News,,"['Cancer', 'BREAST', 'Mastectomy', 'Medicine and Health', 'Women', 'Mammography']"
Spare Times,2008-05-16,article,Schedule,,[]
"After a Hectic Week, a Partylike Evening at Phillips de Pury Brings in $59 Million",2008-05-16,article,News,,"['Auctions', 'Art', 'Prices (Fares, Fees and Rates)']"
District Puts All the World in Classrooms,2008-05-16,article,News,,"['Education and Schools', 'International Relations', 'Language and Languages']"
A Hearing No One Needs,2008-05-16,article,News,,['Football']
Obama Admires Bush,2008-05-16,article,Op-Ed,,"['Presidential Election of 2008', 'Politics and Government']"
Spare Times: For Children,2008-05-16,article,Schedule,,[]
Footnotes,2008-05-16,article,Brief,,[]
CORRECTIONS,2008-05-16,article,Correction,,[]
California Supreme Court Overturns Gay Marriage Ban,2008-05-16,article,News,,"['Homosexuality', 'Marriages', 'Decisions and Verdicts']"
"Farm Bill, Facing Veto, Goes to Bush",2008-05-16,article,News,,"['Farm Bill (US)', 'Vetoes (US)']"
Those Gas Prices: Think Outside the Tank,2008-05-16,article,Letter,,"['Transit Systems', 'Oil (Petroleum) and Gasoline', 'Prices (Fares, Fees and Rates)']"
Yahoo’s Chairman Disputes Icahn’s Accusations,2008-05-16,article,News,,"['Mergers, Acquisitions and Divestitures']"
Unions Bankrolled Analyst Vetting Pension Bill,2008-05-16,article,News,,"['Pensions and Retirement Plans', 'Legislatures and Parliaments', 'Organized Labor', 'Law and Legislation', 'Retirement']"
Pakistan: Sharif Cleared to Run for Parliament,2008-05-16,article,Brief,,['Courts']
"This Is Basketball, Boys; It’s Not Rocket Science",2008-05-16,article,Review,,"['Documentary Films and Programs', 'MOTION PICTURES', 'Basketball']"
Soon-to-Be Retiree Has a Share of the Lead,2008-05-16,article,News,,['Golf']
Museum and Gallery Listings,2008-05-16,article,Schedule,,[]
CORRECTIONS,2008-05-16,article,Correction,,[]
100 Feared Dead in Nigerian Pipeline Fire,2008-05-16,article,News,,"['Pipelines', 'Accidents and Safety', 'Fires and Firefighters', 'Oil (Petroleum) and Gasoline']"
'Idol' Semifinals Buoy Fox,2008-05-16,article,Brief,,[]
Doherty Performs Again,2008-05-16,article,Brief,,['Rock Music']
CORRECTIONS: FOR THE RECORD,2008-05-16,article,Correction,,[]
Lottery Numbers,2008-05-16,article,List,,['Lotteries']
Italy Arrests Hundreds of Immigrants,2008-05-16,article,News,,"['IMMIGRATION AND REFUGEES', 'Illegal Immigrants', 'Police']"
What Next for the Democrats?,2008-05-16,article,Letter,,"['Presidential Election of 2008', 'Primaries and Caucuses', 'United States Politics and Government', 'Presidential Elections (US)']"
"Not Just a Dance, but a Book and a Web Site, Too",2008-05-16,article,Review,,['Dancing']
What Wine Goes With Beetle Larvae?,2008-05-16,article,News,,['Television']
Working Toward Total Seizure Control,2008-05-16,article,News,,"['Epilepsy', 'Seizures (Medical)', 'Medicine and Health']"
Selected Studies: Epilepsy,2008-05-16,article,News,,"['Epilepsy', 'Seizures (Medical)', 'Stroke', 'Medicine and Health', 'Children and Youth']"
New Indictment in Police Corruption Inquiry,2008-05-16,article,News,,"['Drug Abuse and Traffic', 'Ethics', 'Police']"
Theater Listings,2008-05-16,article,Schedule,,['Theater']
Shaking Up the Crowd at Cannes,2008-05-16,article,News,,"['MOTION PICTURES', 'Cannes International Film Festival']"
Ruling May Revive Gay Marriage as Issue,2008-05-16,article,News Analysis,,"['Presidential Election of 2008', 'ELECTION ISSUES', 'United States Politics and Government', 'Presidential Election of 2004', 'Homosexuality', 'Decisions and Verdicts', 'Marriages', 'Elections']"
More Progress Asked of Smithsonian,2008-05-16,article,Brief,,[]
Concerts Set to Benefit Children,2008-05-16,article,Brief,,['Philanthropy']
Fox Plans to Run Fewer Ads in 2 New Prime-Time Dramas,2008-05-16,article,News,,"['ADVERTISING AND MARKETING', 'Television']"
"From Around the Globe, a Mustering of the Tribes",2008-05-16,article,Review,,"['Art', 'Tribes and Tribalism']"
Opera Official Quits,2008-05-16,article,Brief,,[]
"Ways to Share, and Save",2008-05-16,article,News,,"['Housing', 'Time-Sharing', 'Travel and Vacations']"
"Oakley Hall, 87, Novelist Attuned to the Old West, Is Dead",2008-05-16,article,Obituary (Obit),,"['Writing and Writers', 'Deaths (Obituaries)', 'Books and Literature']"
Blackstone Reports a $66.5 Million Quarterly Loss,2008-05-16,article,News,,['Company Reports']
CORRECTIONS: FOR THE RECORD,2008-05-16,article,Correction,,[]
Myanmar Farmers May Miss Harvest,2008-05-16,article,News,,"['Cyclones', 'AGRICULTURE', 'Food']"
Shingles Vaccine Recommended,2008-05-16,article,Brief,,"['Shingles (Disease)', 'Vaccination and Immunization']"
Deal for Auto Workers,2008-05-16,article,News,,"['LABOR', 'Automobiles']"
The Table Brought a Whole Lot to D’Antoni,2008-05-16,article,News,,"['Basketball', 'Families and Family Life']"
"Out of the Wardrobe, Into a War Zone",2008-05-16,article,Review,,['MOTION PICTURES']
CORRECTIONS,2008-05-16,article,Correction,,[]
"Easing the Seizures, and Stigma, of Epilepsy",2008-05-16,article,News,,"['Epilepsy', 'Seizures (Medical)', 'Medicine and Health', 'Children and Youth', 'Families and Family Life']"
Spontaneity Was the Medium and the Message,2008-05-16,article,Review,,['Photography']
Gay Couples Celebrate California Decision; Both Sides See a Fight,2008-05-16,article,News,,"['Homosexuality', 'Marriages', 'Decisions and Verdicts']"
Oregon: Heat Killed Sea Lions,2008-05-16,article,Brief,,"['ANIMALS', 'Sea Lions']"
Grand Isolation,2008-05-16,article,Interview,,"['Travel and Vacations', 'Housing']"
"Eight Belles Did Not Have Heart Attack, Necropsy Report Says",2008-05-16,article,News,,"['Eight Belles (Race Horse)', 'Horse Racing', 'Kentucky Derby']"
Dance Listings,2008-05-16,article,Schedule,,[]
CORRECTIONS: FOR THE RECORD,2008-05-16,article,Correction,,[]
"France: Caesar Was Ambitious, and Perhaps Worried",2008-05-16,article,Brief,,[]
Text of Icahn’s Letter to Yahoo Board,2008-05-16,article,Text,,['Appointments and Executive Changes']
When Artworks Collide,2008-05-16,article,Review,,['Art']
Zimbabwe’s Rulers Unleash Police on Anglicans,2008-05-16,article,News,,"['Police Brutality and Misconduct', 'Politics and Government', 'ANGLICAN CHURCHES', 'Elections', 'Religion and Churches']"
Western Experts Monitor China’s Nuclear Sites for Signs of Earthquake Damage,2008-05-16,article,News,,"['International Relations', 'Plutonium', 'Earthquakes', 'ATOMIC WEAPONS']"
A Disgraceful Farm Bill,2008-05-16,article,Editorial,,"['Editorials', 'Farm Bill (US)', 'United States Politics and Government', 'AGRICULTURE', 'Law and Legislation', 'Vetoes (US)']"
McCain Vision Has Most G.I.’s Out of Iraq by 2013,2008-05-16,article,News,,"['UNITED STATES ARMAMENT AND DEFENSE', 'Presidential Election of 2008']"
"For a Change, N.L. Clubs Are Outscoring A.L. Clubs",2008-05-16,article,News,,"['Baseball', 'Statistics']"
Safer Building Sites,2008-05-16,article,Letter,,"['Accidents and Safety', 'Building (Construction)']"
Museum and Gallery Listings,2008-05-16,article,Schedule,,['Art']
Shaping a Work That Has Returned to Fashion,2008-05-16,article,Review,,['Classical Music']
"In Manhattan’s Dominican Areas, a Different Political Campaign Holds the Stage",2008-05-16,article,News,,['Elections']
"Of Canadians, Tourism, and Free Parties as Ads",2008-05-16,article,News,,['Travel and Vacations']
Blackwater’s Impunity,2008-05-16,article,Editorial,,"['Editorials', 'Defense Contracts', 'United States Politics and Government', 'Mercenaries', 'UNITED STATES ARMAMENT AND DEFENSE']"
Pakistan Defies U.S. on Halting Afghanistan Raids,2008-05-16,article,News,,"['Terrorism', 'UNITED STATES ARMAMENT AND DEFENSE', 'Politics and Government', 'Tribes and Tribalism', 'ARMAMENT, DEFENSE AND MILITARY FORCES', 'Pashtun (Ethnic Group)']"
The Serene Life of a Fighter for Civil Liberties,2008-05-16,article,Biography,,['Freedom of Speech and Expression']
Gay Couples Rejoice at Ruling,2008-05-16,article,News,,[]
Editor From Herald Tribune to Run A.P. News in the U.S.,2008-05-16,article,News,,"['Newspapers', 'News and News Media']"
"Led by Germany, a Strong Quarter for Europe",2008-05-16,article,News,,['Economic Conditions and Trends']
"Man’s Best Friend, Hoofed Department",2008-05-16,article,Review,,"['Horses', 'Art']"
Rescuers Aim for Chinese Villages Yet Unreached,2008-05-16,article,News,,"['Accidents and Safety', 'Rescues', 'Earthquakes']"
Housing Investment,2008-05-16,article,Letter,,"['Housing', 'Renting and Leasing']"
Bob the Builder,2008-05-16,article,Op-Ed,,['Art']
Hunger and Food Prices Push Afghanistan to Brink,2008-05-16,article,News,,"['International Relations', 'International Trade and World Market', 'Flour', 'Economic Conditions and Trends', 'Food', 'Grain', 'Foreign Aid', 'Prices (Fares, Fees and Rates)']"
The Woes of New York’s Public Schools,2008-05-16,article,Letter,,"['Education and Schools', 'Building (Construction)']"
"For Wall Street Workers, Ax Falls Quietly",2008-05-16,article,News,,"['Banks and Banking', 'Layoffs and Job Reductions']"
Tending to the Legacy of a Deco Master,2008-05-16,article,News,,"['Art', 'Museums']"
"Bush Assails ‘Appeasement,’ Touching Off Storm",2008-05-16,article,News,,"['Presidential Election of 2008', 'United States International Relations', 'United States Politics and Government', 'Terrorism']"
Former Videographer Details Patriots’ Spying,2008-05-16,article,Question,,['Football']
The Quad Countdown: No. 105 Temple,2008-05-16,article,News,,[]
LIVE Friday on This Blog: Russia-Finland and Canada-Sweden,2008-05-16,article,News,,[]
Herald Reporter Walks Through How He Botched Article,2008-05-16,article,News,,[]
The New Jersey State Museum,2008-05-16,multimedia,Slideshow,,[]
The King and the Pygmy,2008-05-16,article,News,,[]
Major art fair this weekend in Hong Kong,2008-05-16,article,News,,[]
Now Online / T's New Travel Issue ,2008-05-16,article,News,,[]
"‘Over 17,000 Boxes of Cookies’",2008-05-16,article,News,,[]
"A Hot Dog Play, Then a Throw With Mustard on It",2008-05-16,article,News,,[]
Kohlberg Kravis Digs Into Infrastructure Plays,2008-05-16,article,News,,[]
Morgan Stanley Cuts Staff in London,2008-05-16,article,News,,[]
Prudential Eyeing Equitable Fund,2008-05-16,article,News,,[]
Berkshire Hathaway Leaves R.B.S. Auction,2008-05-16,article,News,,[]
Australia’s GrainCorp Offers to Buy Ridley,2008-05-16,article,News,,[]
Report Finds Big Health V.C. Industry in Pennsylvania,2008-05-16,article,News,,[]
BHP Stock Mines Gold On Report of Partial Stake Buy,2008-05-16,article,News,,[]
Bernanke Says Banks Need More Capital,2008-05-16,article,News,,[]
Yue Yuen Aims for Retail Spinoff,2008-05-16,article,News,,[]
BlackRock’s UBS Portfolio Move: A Good Sign?,2008-05-16,article,News,,[]
Evercore Toasts Bollinger,2008-05-16,article,News,,[]
"As Private Equity Snaps Up Debt, Others Stay Away",2008-05-16,article,News,,[]
Severstal to Sell $1.5 Billion in Bonds,2008-05-16,article,News,,[]
An Expensive Stroll Down Old Lane,2008-05-16,article,News,,[]
CBS-CNet Deal is Good News for Jana,2008-05-16,article,News,,[]
"In Yahoo Fight, It’s Goldman Against Icahn Again",2008-05-16,article,News,,[]
Seattle Venture Firm Stays Active,2008-05-16,article,News,,[]
"For Wall Street Workers, Ax Falls Quietly",2008-05-16,article,News,,[]
Yahoo Chairman Fires Back at Icahn,2008-05-16,article,News,,[]
Attention CNET Shoppers,2008-05-16,article,News,,[]
Verso Shares Fall in Market Debut,2008-05-16,article,News,,[]
G.E. Confirms Potential Sale of Appliances Unit,2008-05-16,article,News,,[]
The Early Word: Conflict Issues for McCain,2008-05-16,article,News,,[]
Senate Rejects Looser Media Ownership Rules,2008-05-16,article,News,,[]
VH1 Acquires ‘Bachelor’ Library,2008-05-16,article,News,,[]
"City’s Employment Rate Holding Steady, for Now",2008-05-16,article,News,,[]
Thursday Ratings: ‘Idol’ Nears End,2008-05-16,article,News,,[]
In Search of McCain’s Mideast Doctrine,2008-05-16,article,News,,[]
Arbitration Court Rules in Favor of ‘Blade Runner’,2008-05-16,article,News,,[]
In This Week’s Magazine: Pixels at an Exhibition,2008-05-16,article,News,,[]
Obesity Promotes Global Warming?,2008-05-16,article,News,,[]
Carlyle to Buy Booz Allen’s Government Unit,2008-05-16,article,News,,[]
Stray Questions for: Katie Roiphe,2008-05-16,article,News,,[]
Looking Beyond Big Brown,2008-05-16,article,News,,[]
Low-Fat Diet May Cut Prostate Cancer Risk,2008-05-16,article,News,,[]
Upfront Wrap-Up: Speaking Profanglish,2008-05-16,article,News,,[]
Moody’s Drops Merrill Deal,2008-05-16,article,News,,[]
What’s ‘Even Worse’ About Buying Fake Handbags?,2008-05-16,article,News,,[]
Recipe of the Day: Fast Pot-Stickers,2008-05-16,article,News,,[]
Lacrosse: Playing for the Final Four,2008-05-16,article,News,,[]
"Batali, Paltrow, Bassols and Bittman",2008-05-16,article,News,,[]
Now Online | T Travel Summer 2008,2008-05-16,article,News,,[]
Our Preakness Picks,2008-05-16,article,News,,[]
White House Smacks Democrats Over Bush Remarks,2008-05-16,article,News,,[]
The Starting Line: What Is Disability?,2008-05-16,article,News,,[]
The View From Brooklyn to London,2008-05-16,article,News,,[]
Unintended Consequences of the House Democrats’ Winning Streak,2008-05-16,article,News,,[]
‘Calling a Reporter Sweetie’,2008-05-16,article,News,,[]
Parking Rule Suspension Starts Monday in Park Slope,2008-05-16,article,News,,[]
Bamboo You | Noguchi for Sale,2008-05-16,article,News,,[]
‘Anything She Can To Raise Money’,2008-05-16,article,News,,[]
Art Happens,2008-05-16,article,News,,[]
Love of a Sport Is Tested,2008-05-16,article,News,,[]
"New Clinton Ads for Oregon, Kentucky",2008-05-16,article,News,,[]
Job-Hunting in London? Keep Looking,2008-05-16,article,News,,[]
Chevys in the Guggenheim,2008-05-16,article,News,,[]
"The Morning Skate: Theory 33 Lives, the NHL Network Vanishes and Senator Blutarsky Speaks",2008-05-16,article,News,,[]
Q & A: The Drama of Calcio,2008-05-16,article,News,,[]
Buster Posey Plays All Nine Positions,2008-05-16,article,News,,[]
Stephen King: The College Years,2008-05-16,article,News,,[]
Interleague by the Numbers,2008-05-16,article,News,,[]
Tour of Homeless Shelter Does Not Solve Problem,2008-05-16,article,News,,[]
Who Ya Gonna Believe?,2008-05-16,article,News,,[]
"Grief, and Rising Anger, Over Fallen Schools",2008-05-16,article,News,,[]
Behindatthebar Is Scratched,2008-05-16,article,,,[]
‘Hillary Democrats?’,2008-05-16,article,News,,[]
Water Woes From Florida to Spain to Orbit,2008-05-16,article,News,,[]
Water Rates Will Rise 14.5 Percent,2008-05-16,article,News,,[]
Audio: A Conversation With Dr. Dean Richardson,2008-05-16,article,News,,[]
Icahn’s Proxy Fights: A Scorecard,2008-05-16,article,News,,[]
Props Dept. | Our Emmy Nominations,2008-05-16,article,News,,[]
FINAL: Russia 4-0 Finland,2008-05-16,article,News,,[]
Hot Prom Mess,2008-05-16,article,News,,[]
Republicans Warm Up at the N.R.A.,2008-05-16,article,News,,[]
The Upfront Deadpool: Which Network Shows Will Be Killed Off First?,2008-05-16,article,News,,[]
The Yahoo Final Exam,2008-05-16,article,News,,[]
Upfrontology: Which Shows Will Become Hits?,2008-05-16,article,News,,[]
About That Foreign Policy ‘Dust Up’ . . .,2008-05-16,article,News,,[]
A Construction Manual for Cupcakes,2008-05-16,article,News,,[]
The Week in Comments: ‘An Endless Stream’,2008-05-16,article,News,,[]
Sports Activity After a Concussion Slows Recovery,2008-05-16,article,News,,[]
Few Survivors Found in China Quake,2008-05-16,multimedia,Slideshow,,['Earthquakes']
From Pessimistic (Consumers) to Optimistic (Lenders),2008-05-16,article,News,,[]
Carlyle and the Washington Factor,2008-05-16,article,News,,[]
"No Method, Just Madness",2008-05-16,article,News,,[]
"Ratings: Finales Boost CBS; NBC, Not So Much",2008-05-16,article,News,,[]
McCain Preps for N.R.A. Speech,2008-05-16,article,News,,[]
For the Moment | Off-Limits Architecture,2008-05-16,article,News,,[]
Bright College Years,2008-05-16,article,News,,[]
Other Stops,2008-05-16,article,News,,[]
"At Last, a Use for Your Old Albums",2008-05-16,article,News,,[]
Running With the Enemy,2008-05-16,article,News,,[]
The Post-Materialist | Japanese Food Porn,2008-05-16,article,News,,[]
Atrocious Victorian Verse Shines at Auction,2008-05-16,article,News,,[]
Q&A: The Earthquake in China,2008-05-16,article,News,,[]
"Soft Serve | Dre Makes Headphones, Beijing’s Blurry Hotel, Wholesome Booze",2008-05-16,article,News,,[]
"A Tall, Lanky Player Stays Neutral in Subway Series",2008-05-16,article,News,,[]
Who’ll Stop the Rain?,2008-05-16,article,News,,[]
"FINAL: Canada 5, Sweden 4",2008-05-16,article,News,,[]
The U.S. Rower With the British Accent,2008-05-16,article,News,,[]
Crystal to YouTube: ‘I Was Raped’,2008-05-16,article,News,,[]
McCain’s Ads: He Leads,2008-05-16,article,News,,[]
Jozy Altidore: In the Pool,2008-05-16,article,News,,[]
"The Play’s the Thing, but N.Y.U. Has Some Revisions",2008-05-16,article,News,,[]
The Plutocrats Go Shopping,2008-05-16,article,News,,[]
Friday Happy Hour: Life in an Obamatopia,2008-05-16,article,News,,[]
Robert Mondavi Dies,2008-05-16,article,News,,[]
Minnesota’s Fired Crisis Director Stays Fired,2008-05-16,article,News,,[]
"Answers About Cycling in New York, Part 3",2008-05-16,article,News,,[]
Six Months Since Cyclone Sidr,2008-05-16,article,News,,[]
TV at 140 Miles an Hour,2008-05-16,article,News,,[]
Leaving for the Land of Euros,2008-05-16,article,,,[]
Protest Stops Traffic in Crown Heights,2008-05-16,article,News,,[]
Some Gas Pumps Can’t Handle the Truth,2008-05-16,article,News,,[]
Speaker Tosses Work of ‘Voodoo’ Actuary,2008-05-16,article,News,,[]
"McCain Criticizes Obama, Clinton on Gun Control",2008-05-16,article,News,,[]
Our Bloggers’ Picks,2008-05-16,article,News,,[]
Former Arabic School Principal Faces Defamation Suit,2008-05-16,article,News,,[]
Huckabee Jokes About Obama Ducking Gunfire,2008-05-16,article,News,,[]
‘The View’ To Go Backstage For One Show,2008-05-16,article,News,,[]
Larry King Squelches Ryan Seacrest Rumors,2008-05-16,article,News,,[]
Previewing the 2008 Cable Show,2008-05-16,article,News,,[]
The Week in Pictures for May 16,2008-05-16,article,News,,[]
Mets-Yankees Rained Out,2008-05-16,article,News,,[]
The Reasoning Behind the Pistorius Ruling,2008-05-16,article,News,,[]
Kimberly and Michael,2008-05-17,multimedia,Video,,[]
Sparring With Critics,2008-05-17,multimedia,Video,,['MOTION PICTURES']
Pistorius Can Sprint for Gold,2008-05-17,multimedia,Video,,"['Handicapped', 'Olympic Games (2008)']"
Frugal Traveler: Toronto,2008-05-17,multimedia,Video,,[]
The Long and Short of It,2008-05-17,multimedia,Video,,[]
McCain Reacts to Obama,2008-05-17,multimedia,Video,,['Presidential Election of 2008']
Bloggingheads: McCain's God Problem,2008-05-17,multimedia,Video,,[]
Obama Reacts to Bush's Speech,2008-05-17,multimedia,Video,,['Presidential Election of 2008']
Kimberly and Michael,2008-05-17,multimedia,Video,,[]
The Last Iron Shop,2008-05-17,multimedia,Video,,[]
The Bait Man,2008-05-17,multimedia,Video,,[]
A Remainder of SoHo's Industrial Past Vanishes,2008-05-17,multimedia,Slideshow,,"['Real Estate', 'Metals and Minerals']"
Final Preakness Preparations,2008-05-17,article,News,,[]
"Another Poll: At Odds, or Not?",2008-05-17,article,News,,[]
High-Tech Japan Running Out of Engineers,2008-05-17,article,News,,"['Electronics', 'Education and Schools', 'IMMIGRATION AND REFUGEES', 'Language and Languages', 'Engineering and Engineers']"
1 Killed and 7 Hurt as Van Jumps Curb,2008-05-17,article,News,,"['Accidents and Safety', 'Automobiles']"
"Parmalat Had Little Cash Left, Executive Testifies",2008-05-17,article,Brief,,"['Suits and Litigation', 'Frauds and Swindling', 'Milk']"
Marine Given 4 Years in Sex Case,2008-05-17,article,News,,"['Sex Crimes', 'UNITED STATES ARMAMENT AND DEFENSE', 'Sentences (Criminal)']"
Kyle Busch Is Being Compared to a Nascar Icon,2008-05-17,article,News,,['Automobile Racing']
"Glimpses of Survivors, Miraculous and Few, in Earthquake’s Ruins",2008-05-17,article,News,,"['Rescues', 'Earthquakes']"
"It’s Not Just Petroleum, All Imports Cost More",2008-05-17,article,News,,"['Consumer Price Index', 'International Trade and World Market', 'Economic Conditions and Trends', 'Oil (Petroleum) and Gasoline', 'Recession and Depression', 'United States Economy', 'Prices (Fares, Fees and Rates)']"
Most Popular Business News Articles on NYTimes.com,2008-05-17,article,List,,[]
Dominican President Wins a Third Term,2008-05-17,article,News,,"['Transit Systems', 'Politics and Government', 'Elections']"
Unwrapping the Secrets of Ordinary Objects,2008-05-17,article,Review,,['Art']
"Figures on a Stage, Alone, Together",2008-05-17,article,Review,,['Dancing']
A Classroom Where the Teacher Really Wants That Apple,2008-05-17,article,News,,"['Horses', 'Executives and Management']"
Medical Company’s Investors Sue Over Acquisition,2008-05-17,article,Brief,,"['Mergers, Acquisitions and Divestitures', 'Suits and Litigation']"
Sunni Insurgents in Mosul Offered Amnesty and Cash,2008-05-17,article,News,,"['AMNESTIES AND PARDONS', 'Shiite Muslims', 'Sunni Muslims', 'ARMAMENT, DEFENSE AND MILITARY FORCES']"
Mr. Bloomberg’s Small Pot of Gold,2008-05-17,article,Editorial,,"['Editorials', 'United States Politics and Government', 'Finances', 'City Councils']"
"Mayoral Hopeful, an Earmark Critic, Has His Own",2008-05-17,article,News,,"['Budgets and Budgeting', 'Finances', 'City Councils']"
"In Effort to Avoid Conflicts, McCain Issues New Rules for Staff",2008-05-17,article,News,,"['Presidential Election of 2008', 'Lobbying and Lobbyists']"
"Women of Rock, Here’s Your Musical Grandma",2008-05-17,article,Review,,"['Presidential Election of 2008', 'Rock Music', 'Television']"
The Harm That Drug Laws Do: 4 Perspectives,2008-05-17,article,Letter,,"['Race', 'Blacks', 'Black People', 'Drug Abuse and Traffic', 'Law and Legislation']"
CORRECTIONS: FOR THE RECORD,2008-05-17,article,Correction,,[]
Rhode Island’s Budget Crisis Deepens,2008-05-17,article,News,,['Budgets and Budgeting']
A Problem of Perception for the Mets,2008-05-17,article,News,,['Baseball']
Hard Roads Ahead,2008-05-17,article,Op-Ed,,"['Presidential Election of 2008', 'Education and Schools', 'United States Economy', 'Politics and Government']"
"Places to Go, but Dreading the Fill-Up",2008-05-17,article,News,,"['Oil (Petroleum) and Gasoline', 'Prices (Fares, Fees and Rates)', 'Automobiles']"
Stiller Eyes Sequel,2008-05-17,article,Brief,,[]
"In New York, Debating a Flat Tax on Gasoline",2008-05-17,article,News,,"['Prices (Fares, Fees and Rates)', 'Gasoline Tax (US)']"
CORRECTIONS: FOR THE RECORD,2008-05-17,article,Correction,,[]
Paulson Says Economy Is Starting to Rebound,2008-05-17,article,News,,"['Mortgages', 'Economic Conditions and Trends', 'Housing', 'Prices (Fares, Fees and Rates)']"
Soldier’s Ploy Backfires in Bid to Quit War,2008-05-17,article,News,,['UNITED STATES ARMAMENT AND DEFENSE']
"A Traveling Festival Comes Back to Town, This Time With a New Slate of Works",2008-05-17,article,Review,,['Music']
Obama Says Bush and McCain Are ‘Fear Mongering’ in Attacks,2008-05-17,article,News,,['Presidential Election of 2008']
Frustrating the Pirates,2008-05-17,article,News,,"['Counterfeit Merchandise', 'Suits and Litigation', 'Recordings and Downloads (Audio)', 'Recordings and Downloads (Video)', 'Computers and the Internet', 'Television', 'MOTION PICTURES']"
"Saving Horses, One Thoroughbred at a Time",2008-05-17,article,News,,"['ADOPTIONS', 'Horses', 'Horse Racing']"
No Hope for the Defense? Create a Distraction,2008-05-17,article,News,,"['Bridge (Card Game)', 'Cards and Card Games']"
Smithsonian Director Resigns,2008-05-17,article,Brief,,[]
"Galaxies Twice as Bright as They Seem, Study Finds",2008-05-17,article,News,,"['Stars and Galaxies', 'Space', 'Astronomy and Astrophysics', 'Science and Technology']"
