headline,date,doc_type,material_type,section,keywords
Penthouse Net,2008-05-22,article,News,,[]
Who Else Could Bid For Calpine?,2008-05-22,article,News,,[]
"‘Idol’ By the Numbers: 97 Million Votes, 31.7 Million Viewers",2008-05-22,article,News,,[]
Spitzer’s Downfall Inspires Performance Art,2008-05-22,article,News,,[]
Kayaking in Venice,2008-05-22,multimedia,Video,,[]
Kayaking in Venice,2008-05-22,multimedia,Video,,[]
Netflix Player,2008-05-22,multimedia,Video,,"['Recordings and Downloads (Video)', 'Computers and the Internet']"
Netflix Player,2008-05-22,multimedia,Video,,[]
Movie Minutes: 'The Edge of Heaven',2008-05-22,multimedia,Video,,['MOTION PICTURES']
"Bright College Years, Continued…",2008-05-22,article,News,,[]
Karl Rove Gets Served,2008-05-22,article,News,,[]
Testimony Links Pettigrew to Drugs,2008-05-22,article,News,,[]
Obama to Replace Kennedy at Wesleyan Commencement,2008-05-22,article,News,,[]
McCain Says Immigration Reform Should Be Top Priority,2008-05-22,article,News,,[]
Time Away Offers Perspective on the Mets’ Woes,2008-05-22,article,News,,[]
Networks Sue an Internet Video Start-Up,2008-05-22,article,News,,[]
Say What? Hillary Clinton and the Future of Democracy,2008-05-22,article,News,,[]
Should You Have an A.E.D. at Home?,2008-05-22,article,News,,[]
Avalanche Name Tony Granato Head Coach,2008-05-22,article,News,,[]
5 More Indicted in Stock-Loan Inquiry,2008-05-22,article,News,,[]
McCain and Obama Engage in War of Words,2008-05-22,article,News,,[]
Florida Prosecutors Declare Banker a Fugitive,2008-05-22,article,News,,[]
Very | Paris Hilton,2008-05-22,article,News,,[]
"Answers About New York’s Hidden Places, Part 2",2008-05-22,article,News,,[]
"Carl Icahn, Political Pundit",2008-05-22,article,News,,[]
I Shall Overcome,2008-05-22,article,News,,[]
Merrill Said to Tap Executive to Sell Subprime Assets,2008-05-22,article,News,,[]
Foundation Gives $25 Million in ‘Green’ Gifts,2008-05-22,article,News,,[]
McCain Rejects Hagee Backing as Nazi Remarks Surface,2008-05-22,article,News,,[]
Paulson Calls for Oil Supply Boost,2008-05-22,multimedia,Video,,[]
Congress Grills Big Oil on Big Pay,2008-05-22,multimedia,Video,,[]
"Hello, Sailor, You’re No. 500,000!",2008-05-22,article,News,,[]
Orlando: Values From Childhood,2008-05-22,multimedia,Video,,[]
Vegas Beckons,2008-05-22,multimedia,Video,,[]
The Well Podcast: More on Wasted Food,2008-05-22,article,News,,[]
A Top Republican Takes a Pass on Fossella’s Seat,2008-05-22,article,News,,[]
Red Bulls’ Sniper Trying to Regain Form,2008-05-22,article,News,,[]
Do the N.H.L. Playoffs Drag On Too Long?,2008-05-22,article,News,,[]
Justice and the Stonehenge Vandals,2008-05-22,article,News,,[]
Paterson Slips Into Past Tense on Clinton,2008-05-22,article,News,,[]
N.Y. Governor Slips Into Past Tense on Clinton,2008-05-22,article,News,,[]
Transit Warning: The UK this Bank Holiday,2008-05-22,article,News,,[]
Fund Managers Fight Over Citi’s Prospects,2008-05-22,article,News,,[]
Podcast: The Incredible Shrinking City,2008-05-22,article,News,,[]
On the Run,2008-05-22,multimedia,Slideshow,,[]
"Spoleto Festival U.S.A.: A Clash of Sensibilities, Now Resolved",2008-05-22,article,News,,[]
The Top 20 Shows of the Season,2008-05-22,article,,,[]
Fox Officially Takes the Gold This Broadcast Season,2008-05-22,article,News,,[]
The V-22 Osprey,2008-05-23,multimedia,Video,,[]
Friday’s Links: Can Blogging Revive a Stalled Start-Up?,2008-05-23,article,News,,[]
Convention Plans: The Power of Location,2008-05-23,article,News,,[]
Debris Detectors,2008-05-23,multimedia,Video,,[]
Debris Detectors,2008-05-23,multimedia,Video,,[]
"McCain Judges Obama, That ‘Young Man’",2008-05-23,article,News,,[]
Vintage Ascendant,2008-05-23,multimedia,Slideshow,,"['Furniture', 'Trade Shows and Fairs', 'Desks', 'Lamps and Lampshades', 'Design', 'Javits, Jacob K, Convention Center (NYC)']"
The Ear of the Beholder,2008-05-23,article,News,,['Music']
"Celebrating an Engineering Marvel, Born in Tragedy",2008-05-23,article,News,,[]
"Celebrating an Engineering Marvel, Born in Tragedy",2008-05-23,article,Web Log,,[]
A Soldier Remembers,2008-05-23,multimedia,Video,,[]
Ex-Stock Trader Is Accused of Duping Friends Out of Millions,2008-05-23,article,News,,"['Frauds and Swindling', 'Stocks and Bonds']"
Generals See Hope for Troop Reductions by Fall,2008-05-23,article,News,,['UNITED STATES ARMAMENT AND DEFENSE']
A Fountain on Every Corner,2008-05-23,article,Op-Ed,,"['Fountains', 'Water']"
F.A.A. Tests Ways to Detect Runway Junk,2008-05-23,article,News,,"['Accidents and Safety', 'AIRLINES AND AIRPLANES']"
Into the Louisiana Bayou,2008-05-23,article,News,,"['Travel and Vacations', 'Fishing, Sport']"
Classical Music/Opera Listings,2008-05-23,article,Schedule,,['Classical Music']
An Inquiry Into Interbank Loan Rate,2008-05-23,article,News,,"['Banks and Banking', 'Interest Rates']"
Immigrants Fleeing Fury of South African Mobs,2008-05-23,article,News,,"['VIOLENCE', 'IMMIGRATION AND REFUGEES']"
German President Will Seek Reelection,2008-05-23,article,News,,['Politics and Government']
U.N. Chief Sees Myanmar Devastation,2008-05-23,article,News,,"['International Relations', 'Cyclones', 'Foreign Aid']"
What Ever Happened to (the Good Kind of) States’ Rights?,2008-05-23,article,Editorial,,"['Editorials', 'Drugs (Pharmaceuticals)', 'United States Politics and Government', 'Environment', 'States (US)', 'Law and Legislation']"
"Farm Bill, in Part and in Full, Wins Passage",2008-05-23,article,News,,"['Law and Legislation', 'Farm Bill (US)', 'Vetoes (US)']"
"Wilfrid Mellers, 94, Musicologist and Critic, Is Dead",2008-05-23,article,Obituary (Obit),,"['Deaths (Obituaries)', 'Music', 'Rock Music', 'Classical Music']"
"One Word to You, Just One Word: Bakelite",2008-05-23,article,News,,['Art']
Bell Canada Shares Dive After Court Bars Buyout,2008-05-23,article,News,,"['Stocks and Bonds', 'Privatization']"
"Silent Survivors of Afghanistan’s 4,000 Tumultuous Years",2008-05-23,article,Review,,['Art']
"Step to the Rear of the Bus, Please, or Take a Seat Upstairs",2008-05-23,article,News,,"['Transit Systems', 'Buses']"
Court Says Texas Illegally Seized Sect’s Children,2008-05-23,article,News,,"['Polygamy', 'Fundamentalist Church of Jesus Christ of Latter-day Saints', 'Decisions and Verdicts', 'Child Abuse and Neglect', 'Yearning for Zion Ranch']"
"From Small Town to Big City, Desormeaux Comes Within Reach of Triple Crown",2008-05-23,article,News,,"['Triple Crown (Horse Racing)', 'Horse Racing', 'Belmont Stakes']"
Obama to Fill In for Kennedy at Ceremony,2008-05-23,article,News,,['Presidential Election of 2008']
"Shield My Eyes, These Cubbies Are Good",2008-05-23,article,News,,[]
Economic Toll Mounts From High Oil Prices,2008-05-23,article,News,,"['Oil (Petroleum) and Gasoline', 'Prices (Fares, Fees and Rates)']"
Germany: Tribute to Nazis’ Gay Victims,2008-05-23,article,Brief,,"['Homosexuality', 'Nazi Policies Toward Jews and Minorities', 'Monuments and Memorials']"
"Iraq Spending Ignored Rules, Pentagon Says",2008-05-23,article,News,,"['Defense Contracts', 'Mercenaries', 'Wages and Salaries']"
Dance Listings,2008-05-23,article,Schedule,,['Dancing']
Obama Asks Jewish Voters to Judge Him on His Policies,2008-05-23,article,News,,"['Presidential Election of 2008', 'Palestinians', 'JEWS', 'United States International Relations', 'Terrorism', 'Rumors']"
Another Warsaw Skyscraper,2008-05-23,article,Brief,,['ARCHITECTURE']
"Artisan Life in New York State, a Weekend at a Time",2008-05-23,article,News,,"['Travel and Vacations', 'Art']"
Contenders Spar on Veterans’ Bill,2008-05-23,article,News,,"['Presidential Election of 2008', 'Tuition', 'United States Politics and Government', 'Veterans']"
UBS Moves to Raise $15 Billion,2008-05-23,article,News,,['Mortgages']
Giants Amid the Blooms,2008-05-23,article,News,,"['Sculpture', 'Gardens and Gardening', 'Art']"
"Woman Troubles, in a Handy Musical Variety Pack",2008-05-23,article,Review,,['Theater']
Urgency Replaces Subtlety in Summer’s Struggle for Visitors,2008-05-23,article,News,,"['Travel and Vacations', 'ADVERTISING AND MARKETING', 'Prices (Fares, Fees and Rates)']"
"For Faneca, New Colors and a New Start With the Jets",2008-05-23,article,News,,['Football']
"Murder, From Front to Back, in a Project in Queens",2008-05-23,article,News,,"['Murders and Attempted Murders', 'Housing']"
Two Are Charged in Attack on Teenager in Crown Heights,2008-05-23,article,News,,"['JEWS', 'Blacks', 'Black People']"
U.S. Airstrike Kills 8 Civilians in Iraq,2008-05-23,article,News,,"['Helicopters', 'UNITED STATES ARMAMENT AND DEFENSE', 'ARMAMENT, DEFENSE AND MILITARY FORCES']"
Bacteria Thrive in Inner Elbow; No Harm Done,2008-05-23,article,News,,"['Bacteria', 'Microbiology', 'Skin', 'Science and Technology']"
Zimbabwe: Candidate Plans Return,2008-05-23,article,Brief,,"['Political Prisoners', 'Threats and Threatening Messages']"
"Junta Offers Showcase Camps, but Most Burmese Lack Aid",2008-05-23,article,News,,"['Foreign Aid', 'Cyclones']"
Generals Tell Senate They Hope for Modest Cut in U.S. Troops in Iraq This Fall,2008-05-23,article,News,,['Presidential Election of 2008']
Summer Sounds,2008-05-23,article,News,,"['RETAIL STORES AND TRADE', 'Music']"
Auto Parts Workers Approve a Contract,2008-05-23,article,News,,['Strikes']
Most Days Are for Fishing and a Few for Nascar,2008-05-23,article,News,,"['Travel and Vacations', 'Real Estate', 'Housing', 'Talladega Superspeedway']"
Financier Stands by a Firm Tainted by Heparin,2008-05-23,article,News,,"['Heparin (Drug)', 'Drugs (Pharmaceuticals)']"
Man Found for ‘All Seasons’,2008-05-23,article,Brief,,['Theater']
Correction: An ‘Our Town’ Stage for the Creative Set,2008-05-23,article,Correction,,[]
CORRECTIONS,2008-05-23,article,Correction,,[]
Off Broadway ‘Love’ Story Ends,2008-05-23,article,Brief,,['Theater']
Kentucky Speedway’s New Owner Promises a 2009 Sprint Cup Race,2008-05-23,article,News,,['Automobile Racing']
9 Airlines Face Threat of a Credit Downgrade,2008-05-23,article,News,,"['Ratings and Rating Systems', 'Finances', 'AIRLINES AND AIRPLANES']"
Jazz Listings,2008-05-23,article,Schedule,,['Jazz']
Congress Trims Bush’s Mexico Drug Plan,2008-05-23,article,News,,"['Drug Abuse and Traffic', 'United States Politics and Government', 'Foreign Aid']"
Better Nursing Homes,2008-05-23,article,Letter,,"['AGED', 'Nursing Homes']"
Corrections,2008-05-23,article,Correction,,[]
Everglades Park Counts the Good and the Bad After a Blaze,2008-05-23,article,News,,"['Fires and Firefighters', 'Environment']"
Suggested Read: Wood’s Comeback,2008-05-23,article,News,,[]
How to Rock in Iraq,2008-05-23,article,Review,,['MOTION PICTURES']
"A School That Cost $20,000 Not to Go To",2008-05-23,article,News,,"['Education and Schools', 'Private and Sectarian Schools', 'Tuition']"
Potential Inheritor of a Staten Island Congressional Seat Says He Won’t Run,2008-05-23,article,News,,['United States Politics and Government']
Medtronic Settles a Civil Lawsuit on Allegations of Medicare Fraud,2008-05-23,article,News,,"['Suits and Litigation', 'Frauds and Swindling', 'Medicine and Health', 'Medicare']"
Can We Find a New Way to Get Home?,2008-05-23,article,Letter,,"['Automobiles', 'Transit Systems', 'Oil (Petroleum) and Gasoline', 'Commuting', 'Prices (Fares, Fees and Rates)']"
Volumes to Go Before You Die,2008-05-23,article,News,,['Books and Literature']
Georgia Ruling Party Cements Power,2008-05-23,article,News,,['Politics and Government']
CORRECTIONS: FOR THE RECORD,2008-05-23,article,Correction,,[]
U.S. in Difficult Position Over Japan’s Rice Plan,2008-05-23,article,News,,"['Rice', 'Food', 'Prices (Fares, Fees and Rates)']"
"Couples (Physical) Therapy, the Jerome Robbins Version",2008-05-23,article,Review,,['Dancing']
The Sportsman’s Life in a ‘Bathtub Nash’,2008-05-23,article,News,,"['Travel and Vacations', 'Roads and Traffic', 'Automobiles']"
"Girardi Angrily Departs, Then Has Reason to Smile",2008-05-23,article,News,,['Baseball']
Iraqi Symphony Performs,2008-05-23,article,Brief,,['Classical Music']
Judge Says Bloomberg Cannot Testify at Trial of Gun Dealer,2008-05-23,article,News,,"['Firearms', 'Decisions and Verdicts']"
30 Former Officials Became Corporate Monitors,2008-05-23,article,News,,"['Politics and Government', 'Federal Taxes (US)']"
Admission of Doping Jeopardizes Relay Gold,2008-05-23,article,News,,"['Olympic Games', 'Steroids']"
CORRECTIONS,2008-05-23,article,Correction,,[]
"Soderbergh and Che, Provocateurs",2008-05-23,article,Review,,"['MOTION PICTURES', 'Cannes International Film Festival']"
CORRECTIONS: FOR THE RECORD,2008-05-23,article,Correction,,[]
Spare Times: For Children,2008-05-23,article,Schedule,,['Children and Youth']
Detroit Wins to Square Up East Finals 1-1,2008-05-23,article,News,,"['Basketball', 'Playoff Games']"
Metropolitan Opera Encores,2008-05-23,article,Brief,,[]
Embracing the Modern With a Shimmering Sound,2008-05-23,article,Review,,['Classical Music']
Veterans’ Benefits Bill Wins Approval in Senate,2008-05-23,article,News,,"['United States Politics and Government', 'Finances', 'Law and Legislation', 'Veterans']"
Alou’s Calf Injury Adds to Randolph’s Troubles,2008-05-23,article,News,,['Baseball']
F.D.A. to Expand Scrutiny of Risks From Drugs After They’re Approved for Sale,2008-05-23,article,News,,"['Drugs (Pharmaceuticals)', 'Medicine and Health']"
"Who’s Calling the Shots, the Yankees or Ortiz?",2008-05-23,article,News,,"['Yankee Stadium (NYC)', 'Baseball']"
"Jazz, the Dead and a Musical Bridge",2008-05-23,article,News,,"['Travel and Vacations', 'Music']"
74 City Schools Told to Expect 5% Budget Cut,2008-05-23,article,News,,"['Budgets and Budgeting', 'Education and Schools']"
Merrill Lynch Weighs Putting Headquarters at Ground Zero,2008-05-23,article,News,,['World Trade Center (NYC)']
A Home-Court Disadvantage,2008-05-23,article,News,,"['Tennis', 'French Open (Tennis)']"
Paris Bank’s Managers Are Blamed in a Scandal,2008-05-23,article,News,,['Frauds and Swindling']
Soothing or Salting Wounds From Election 2000,2008-05-23,article,Review,,['United States Politics and Government']
The Master of the M.T.A.’s Hudson Yards Deal,2008-05-23,article,Biography,,['West Side Railyards (NYC)']
3 Auditioning to Be McCain’s No. 2 Gain Qualified Backing,2008-05-23,article,News,,"['Presidential Election of 2008', 'Vice Presidents and Vice Presidency (US)', 'Conservatism (US Politics)']"
Correction,2008-05-23,article,Correction,,['Correction Stories']
Invasion of the Heart,2008-05-23,article,Review,,['MOTION PICTURES']
California: Same-Sex Marriages,2008-05-23,article,Brief,,"['Homosexuality', 'Marriages']"
Pop and Rock Listings,2008-05-23,article,Schedule,,['Music']
Shopkeeper Fatally Shot in Robbery,2008-05-23,article,News,,"['Robberies and Thefts', 'Murders and Attempted Murders']"
Italy Plans to Resume Building Atomic Plants,2008-05-23,article,News,,"['Global Warming', 'Oil (Petroleum) and Gasoline', 'Environment', 'ATOMIC ENERGY']"
"Ace Can’t Stop Mets From Loss, Fourth of Its Kind",2008-05-23,article,News,,['Baseball']
Spare Times ,2008-05-23,article,Schedule,,[]
‘Idol’ Finale: (Pop) Power to the People,2008-05-23,article,Review,,"['Music', 'Television']"
Suicide Bomber Attacks Gaza Crossing,2008-05-23,article,News,,"['Palestinians', 'Terrorism']"
House Panel Subpoenas Rove in Inquiry Into Justice Dept.,2008-05-23,article,News,,['United States Politics and Government']
Children in Adult Jails,2008-05-23,article,Editorial,,"['Federal Aid (US)', 'Prisons and Prisoners', 'Children and Youth', 'Juvenile Delinquency', 'Editorials']"
"Pettigrew Admits to Doping, Jeopardizing Relay Gold Medals",2008-05-23,article,News,,"['Track and Field', 'Doping']"
Teach for America,2008-05-23,article,Letter,,"['Education and Schools', 'Third World and Developing Countries', 'Colleges and Universities', 'Volunteers']"
Lakers Know the Emotional Value of a Comeback Victory,2008-05-23,article,News,,['Basketball']
"Her Father, His Secrets, Herself",2008-05-23,article,Review,,"['Families and Family Life', 'Episcopal Church', 'Priests', 'Books and Literature', 'Homosexuality']"
"As Koons Prices Balloon, His Dallas ‘Flower’ Will Be Sold",2008-05-23,article,News,,['Art']
Putting Out a ‘Willkommen’ Mat,2008-05-23,article,News,,['Housing']
CORRECTIONS,2008-05-23,article,Correction,,[]
The Same Old Song on High Gas Prices,2008-05-23,article,News Analysis,,"['Oil (Petroleum) and Gasoline', 'Prices (Fares, Fees and Rates)']"
A Hit Man in a War Zone That Could Easily Be Iraq,2008-05-23,article,Review,,"['MOTION PICTURES', 'Terrorism']"
Retrofitted for Revenge,2008-05-23,article,Review,,['MOTION PICTURES']
"J. C. Hurewitz, 93, Dies; Scholar of the Middle East",2008-05-23,article,Obituary (Obit),,"['Deaths (Obituaries)', 'International Relations', 'Colleges and Universities']"
Keep It Near? Keep It Safe?,2008-05-23,article,News,,"['Travel and Vacations', 'Boats and Boating', 'Housing']"
A New Détente Shakes Albany: Paterson-Bruno,2008-05-23,article,News,,"['Governors (US)', 'Politics and Government']"
"Jan Pokorny, 93, Is Dead; Melded Architectural Styles",2008-05-23,article,Obituary (Obit),,"['ARCHITECTURE', 'Restoration and Rehabilitation', 'Historic Buildings and Sites', 'Deaths (Obituaries)', 'Buildings (Structures)']"
Who Will Watch the Peacekeepers?,2008-05-23,article,Op-Ed,,"['Crime and Criminals', 'International Relations', 'Smuggling']"
"Chamberlain Is Ready to Start, Father Says",2008-05-23,article,News,,['Baseball']
Art in Review,2008-05-23,article,Review,,['Art']
Anarchy With a Short Attention Span,2008-05-23,article,Review,,['MOTION PICTURES']
Idol Finale a Major Hit,2008-05-23,article,Brief,,['Television']
"Tory Wins Labor Bastion, in Blow to Premier",2008-05-23,article,News,,['Elections']
Bangladesh: Bird Flu Found in Child,2008-05-23,article,Brief,,"['Avian Influenza', 'Children and Youth']"
"For Naked Mummies, It’s a Wrap",2008-05-23,article,Brief,,"['Museums', 'Mummies and Mummification']"
"At Supreme Court, 5-to-4 Rulings Fade, but Why?",2008-05-23,article,News,,[]
M.T.A. Approves a New Deal to Build at West Side Yards,2008-05-23,article,News,,"['Transit Systems', 'West Side Railyards (NYC)', 'Buildings (Structures)']"
"As Market Shifts, Ford Sees Profit Fleeing",2008-05-23,article,News,,"['Oil (Petroleum) and Gasoline', 'Sales', 'Prices (Fares, Fees and Rates)']"
California: Judge Rejects Gang Label,2008-05-23,article,Brief,,"['Gangs', 'Murders and Attempted Murders', 'Decisions and Verdicts']"
McCain Cuts Ties to Pastors Whose Talks Drew Fire,2008-05-23,article,News,,"['Presidential Election of 2008', 'Endorsements', 'Evangelical Movement', 'Nazi Policies Toward Jews and Minorities']"
Museum and Gallery Listings,2008-05-23,article,Schedule,,['Art']
Release Schedule,2008-05-23,article,List,,[]
"Stillness Returns, Sadness Lingers",2008-05-23,article,News,,"['Historic Buildings and Sites', 'Earthquakes']"
"Jazz at a Fever Pitch, With Moments of Melody",2008-05-23,article,Review,,['Jazz']
"When Driver’s Sponsor Disappears, Her Resolve Doesn’t",2008-05-23,article,News,,"['Indianapolis 500 (Auto Race)', 'Finances', 'Automobile Racing']"
Earthquake Shifts Tone of Games,2008-05-23,article,News,,"['Olympic Games (2008)', 'Earthquakes']"
Federal Prosecutors Declare European Banker a Fugitive,2008-05-23,article,News,,['Tax Evasion']
New Choice for Pakistan,2008-05-23,article,News,,"['UNITED STATES ARMAMENT AND DEFENSE', 'Appointments and Executive Changes']"
Italy Embraces Nuclear Power,2008-05-23,article,News,,"['ATOMIC ENERGY', 'Nuclear Wastes', 'Environment', 'Politics and Government']"
More U.S. Legal Troubles for Figure in Israeli Case,2008-05-23,article,News,,"['Frauds and Swindling', 'HOTELS AND MOTELS', 'Suits and Litigation']"
CORRECTIONS,2008-05-23,article,Correction,,[]
A Warning From the White House,2008-05-23,article,News,,"['Presidential Election of 2008', 'United States Politics and Government', 'News and News Media']"
"And He Can Pitch, Too",2008-05-23,article,News,,[]
CORRECTIONS: FOR THE RECORD,2008-05-23,article,Correction,,[]
CORRECTIONS: FOR THE RECORD,2008-05-23,article,Correction,,[]
A Businessman’s View of Mid-American Life,2008-05-23,article,Review,,"['Art', 'Photography']"
Hints of Progress in Drugs Treating Brain Cancer,2008-05-23,article,News,,"['Brain', 'Cancer', 'Tumors', 'Medicine and Health', 'Avastin (Drug)']"
Alaska Governor Proposes $500 Million in Subsidies for a Gas Pipeline,2008-05-23,article,News,,"['Gas (Fuel)', 'Pipelines']"
CORRECTIONS: FOR THE RECORD,2008-05-23,article,Correction,,[]
The Alpha Geeks,2008-05-23,article,Op-Ed,,"['English Language', 'Computers and the Internet', 'Language and Languages', 'History', 'Social Conditions and Trends']"
Paying a Premium for a Wright Design,2008-05-23,article,News,,['Housing']
"As Race Wanes, Talk of Clinton as No. 2 Grows",2008-05-23,article,News,,"['Presidential Election of 2008', 'Vice Presidents and Vice Presidency (US)']"
A Fitting End?,2008-05-23,article,News,,[]
Rallying Round a Train That Gets No Respect,2008-05-23,article,News,,['Transit Systems']
Lottery Numbers,2008-05-23,article,List,,['Lotteries']
Fund Fees Revisited in Court,2008-05-23,article,News,,['Finances']
Talking With the Enemy,2008-05-23,article,Editorial,,"['Editorials', 'Palestinians', 'Politics and Government']"
Leaving Las Vegas,2008-05-23,article,News,,[]
Theater Listings,2008-05-23,article,Schedule,,['Theater']
Trouble in the Hudson,2008-05-23,article,Editorial,,"['Editorials', 'PCB (Polychlorinated Biphenyls)', 'Rivers', 'Water Pollution', 'Environment', 'Fish and Other Marine Life']"
Chip Off the Old Block,2008-05-23,article,Brief,,"['Vandalism', 'Art']"
Olmert Peace Effort Elicits Cynicism and Hope,2008-05-23,article,News Analysis,,"['Terrorism', 'Palestinians', 'Politics and Government']"
Guantánamo Judge Won’t Delay Trials,2008-05-23,article,News,,"['Prisons and Prisoners', 'Terrorism']"
Violence in Rockaway,2008-05-23,multimedia,Slideshow,,[]
The Quad Countdown: No. 98 Syracuse,2008-05-23,article,News,,[]
Eight Bells for Eight Belles,2008-05-23,article,News,,[]
The Insider | Tim Hamilton ,2008-05-23,article,News,,[]
Afghanistan’s Hidden Treasures,2008-05-23,multimedia,Slideshow,,[]
Moore in America,2008-05-23,multimedia,Slideshow,,[]
‘Clone Your Family Dog’,2008-05-23,article,News,,[]
‘Indiana Jones’ and This Guy With a Tune,2008-05-23,article,News,,[]
"Spoleto Festival U.S.A.: Slave Trade in Charleston, This Time on Stage",2008-05-23,article,News,,[]
Senna wins in Monaco,2008-05-23,article,News,,[]
Flock Rounds Up $15 Million from V.C.s,2008-05-23,article,News,,[]
Bernie Ecclestone’s letter to the FIA club presidents,2008-05-23,article,News,,[]
Space Exploration Quiz,2008-05-23,article,News,,[]
Brevan Howard Raises $1 Billion in I.P.O.,2008-05-23,article,News,,[]
Defections Prompt Clear Channel to Sue Tribune,2008-05-23,article,News,,[]
Moody’s Said to Have Shuffled Analysts After Banks’ Criticism,2008-05-23,article,News,,[]
Crisis? What Crisis? A Q&A With Don Goldberg,2008-05-23,article,News,,[]
Halliburton Fires Up Counterbid for Expro,2008-05-23,article,News,,[]
Austria’s Bawag May Go Public Sooner Than Anticipated,2008-05-23,article,News,,[]
Advances in Merrill’s Deal for Ground Zero Headquarters,2008-05-23,article,News,,[]
Analyst Says Calpine Bid May Not Rise Much,2008-05-23,article,News,,[]
Buyout Shop Stands by a Firm Tainted by Heparin,2008-05-23,article,News,,[]
9 Airlines Face Threat of a Credit Downgrade,2008-05-23,article,News,,[]
Delta and Northwest Win Approval for Transatlantic Cooperation,2008-05-23,article,News,,[]
Borders Chief Denies Holding ‘Substantial’ Sales Talks,2008-05-23,article,News,,[]
Atos Meeting Suspended As Hedge Funds Gain Support,2008-05-23,article,News,,[]
An Inquiry Into Interbank Loan Rate,2008-05-23,article,News,,[]
Ex-Stock Trader Is Accused of Duping Friends Out of Millions,2008-05-23,article,News,,[]
Nomura Hedge Fund Manger to Start New Firm,2008-05-23,article,News,,[]
Mocana Ropes in $7 Million,2008-05-23,article,News,,[]
SmartSynch Puts $20 Million on the Meter,2008-05-23,article,News,,[]
Paris Bank’s Managers Are Blamed in a Scandal,2008-05-23,article,News,,[]
China’s Haier Leads List of Possible Suitors for G.E. Unit,2008-05-23,article,News,,[]
Linens ‘n Things Picks Stalking-Horse Bidders,2008-05-23,article,News,,[]
"The Early Word: Veepstakes, Democrat Edition",2008-05-23,article,News,,[]
Heading for a Yahoo Showdown,2008-05-23,article,News,,[]
Will Lehman Follow Bear into a Deal?,2008-05-23,article,News,,[]
Major Fallout as BCE Deal Falters,2008-05-23,article,News,,[]
‘The Cat in the Hat’ on the Couch,2008-05-23,article,News,,[]
Judicial Activism in Mutual Funds,2008-05-23,article,News,,[]
Trading in Silverjet Halted Amid Financing Troubles,2008-05-23,article,News,,[]
Weill Admits Mistake in Citi Succession Planning,2008-05-23,article,News,,[]
Weather Channel Bids Due Today,2008-05-23,article,News,,[]
Dancin’ With the Sales Dude,2008-05-23,article,News,,[]
"Sue Simmons, Unscathed",2008-05-23,article,News,,[]
USA Renews ‘Criminal Intent’,2008-05-23,article,News,,[]
The Paterson-Bruno Détente,2008-05-23,article,News,,[]
Giving Up the ‘Ugliest Skyscraper’ Title,2008-05-23,article,News,,[]
More of the Same Old?,2008-05-23,article,News,,[]
McCain’s Health Records,2008-05-23,article,News,,[]
Not in My House,2008-05-23,article,News,,[]
Nationwide predicts ‘single digit’ fall in U.K. housing prices,2008-05-23,article,News,,[]
"Dynegy, a Dark Horse Again?",2008-05-23,article,News,,[]
Commander-in-Chief Tours Barracks,2008-05-23,article,News,,[]
Surprise Stars Continue to Shine,2008-05-23,article,News,,[]
Southwest's Kelleher on Airlines,2008-05-23,multimedia,Video,,[]
A True Racehorse,2008-05-23,article,News,,[]
"Fox Welcomes The Total Viewer Win, But Wants To Stay Young",2008-05-23,article,News,,[]
