headline,date,doc_type,material_type,section,keywords
NBC Plans 24-Hour News for the New York Region,2008-05-08,article,News,,['Television']
Delta and Northwest Defend a Merger,2008-05-08,article,News,,"['Mergers, Acquisitions and Divestitures', 'Regulation and Deregulation of Industry', 'ANTITRUST ACTIONS AND LAWS', 'AIRLINES AND AIRPLANES']"
Idolatry Outdraws Terpsichore,2008-05-08,article,Brief,,[]
Lottery Numbers,2008-05-08,article,List,,['Lotteries']
R. Kelly Trial to Start,2008-05-08,article,Brief,,[]
Yemen: Japanese Tourists Briefly Taken Hostage,2008-05-08,article,Brief,,"['Kidnapping', 'Hostages']"
"In a Sleek Package, a Home Theater System to Rock Your World",2008-05-08,article,News,,"['Digital and High-Definition Television', 'DVD (Digital Versatile Disc)', 'Music', 'Loudspeakers']"
"For Peak Performance, 3 Is Not Better Than 1",2008-05-08,article,News,,"['Triathlon', 'Running', 'Swimming', 'Bicycles and Bicycling']"
Support for Clinton Wanes as Obama Sees Finish Line,2008-05-08,article,News,,['Presidential Election of 2008']
Germany: 2 Groups Banned for Neo-Nazism,2008-05-08,article,Brief,,['ANTI-SEMITISM']
Backstage All-Access Passwear,2008-05-08,article,News,,"['RETAIL STORES AND TRADE', 'APPAREL']"
"Ladies Who Lunch? No, Here’s to the Power Players",2008-05-08,article,Review,,['Theater']
A New Opening in Cuba,2008-05-08,article,Letter,,[]
CIRCUITS | The Robotic Lawn Mower Will Take Your Call Now,2008-05-08,article,News,,"['Lawns', 'Wireless Communications', 'Cellular Telephones', 'Robots']"
Your Chance to Finish a Movie Microsoft Started,2008-05-08,article,News,,"['Software', 'MOTION PICTURES', 'Computers and the Internet', 'ADVERTISING AND MARKETING']"
Violence in Zimbabwe Disrupts Schools and Aid,2008-05-08,article,News,,"['Education and Schools', 'Politics and Government', 'Elections']"
"For Boomers, It’s Time to Go to the (Brain) Gym",2008-05-08,article,Letter,,"['Age, Chronological', 'Brain', 'Sleep']"
"CURRENTS | Paul Kohn, a New Home-Décor Store, Opens in TriBeCa",2008-05-08,article,News,,"['Home Furnishings', 'Furniture', 'Interior Design', 'RETAIL STORES AND TRADE', 'ANTIQUES']"
Room to Improve,2008-05-08,article,News,,"['Chairs', 'Furniture', 'Interior Design', 'Home Furnishings']"
Questions May Follow Clemens’s Apology,2008-05-08,article,News,,"['Baseball', 'Steroids', 'ADULTERY', 'Perjury']"
Architects in Glass Houses,2008-05-08,article,News,,"['Glass', 'Home Furnishings', 'Restoration and Rehabilitation', 'ARCHITECTURE']"
Giuliani Weighs In on Distant Mayoral Race,2008-05-08,article,News,,['Politics and Government']
A New Council Spending Inquiry,2008-05-08,article,News,,['Suits and Litigation']
Indians’ Lee Puts the Yankees Under His Spell,2008-05-08,article,News,,['Baseball']
Extended Visits for Britney Spears,2008-05-08,article,Brief,,[]
Tales of the Big City,2008-05-08,article,News,,[]
"Today, I Think I’ll Be Hippohead",2008-05-08,article,News,,"['Children and Youth', 'Computers and the Internet']"
McCain Pushes Priorities That Resonate on the Right,2008-05-08,article,News,,"['Sexual Slavery', 'Presidential Election of 2008', 'Freedom of Religion', 'PORNOGRAPHY AND OBSCENITY']"
Georgia’s Offer,2008-05-08,article,Letter,,[]
Ex-Patriots Assistant Sends the N.F.L. Eight Tapes,2008-05-08,article,News,,['Recordings and Downloads (Video)']
"At 60, Israel Redefines Roles for Itself and for Jews Elsewhere",2008-05-08,article,News,,['JEWS']
Student Consultants Supply Fresh Insights to Businesses,2008-05-08,article,News,,"['Education and Schools', 'Business Schools', 'Entrepreneurship', 'Colleges and Universities']"
CIRCUITS | Simulating Vinyl With D.J. Gear for the PC,2008-05-08,article,News,,"['Music', 'Computers and the Internet', 'Disc Jockeys']"
How to Convert Uppercase Text,2008-05-08,article,Question,,"['Software', 'Electronic Mail']"
Toward Better Student Lending,2008-05-08,article,Editorial,,"['Editorials', 'Student Loans', 'Education and Schools', 'Finances', 'Colleges and Universities', 'United States Economy', 'Law and Legislation']"
Respond to Today’s Column: The Torch en Route,2008-05-08,article,News,,[]
"Born a Day Late, Not a Year Too Early",2008-05-08,article,News,,[]
Taking a Pass On Gas,2008-05-08,article,News,,[]
Iraq Briefing: Hometown Baghdad,2008-05-08,article,News,,[]
The New World Mapped,2008-05-08,article,News,,[]
"Ralph Wiggum, Pitchman",2008-05-08,article,News,,[]
Sprott I.P.O. Expected to Price,2008-05-08,article,News,,[]
UBS to Pay $37 Million in Settlement With Massachusetts A.G.,2008-05-08,article,News,,[]
Truths of Urban Warfare,2008-05-08,article,News,,[]
Illinois Tool Works to Add Enodis to its Belt,2008-05-08,article,News,,[]
Germany’s United Internet Moves to Halt Freenet Deal,2008-05-08,article,News,,[]
"Posting Loss, Marsh to Sell Kroll Units",2008-05-08,article,News,,[]
Dr Pepper Snapple Bows to Lukewarm Reception,2008-05-08,article,News,,[]
Carlyle and JMI Team Up to Take Gemcom Private,2008-05-08,article,News,,[]
BofA’s Selig on the Merger Market,2008-05-08,article,News,,[]
"Markets Plunge, as S.E.C. Calls for More Oversight of Banks",2008-05-08,article,News,,[]
Will May Be a Merry Month for I.P.O.’s?,2008-05-08,article,News,,[]
Clear Channel Case to Proceed in N.Y.,2008-05-08,article,News,,[]
Protestor at ‘Generations of Women for Hillary’ Event,2008-05-08,article,News,,[]
Colfax Prices I.P.O. at $18 a Share,2008-05-08,article,News,,[]
"Private Equity Firms Take More, Give Less, Report Says",2008-05-08,article,News,,[]
"TV Guide, Just Bought, Is Bracing to Be Sold",2008-05-08,article,News,,[]
GLG Hopes to Keep at Least $2 Billion in Coffey Funds,2008-05-08,article,News,,[]
Wave of Lawsuits Over Losses Could Hit a Wall,2008-05-08,article,News,,[]
Icahn Raises Stake in Motorola,2008-05-08,article,News,,[]
Bear Investors Drop Suit to Block JPMorgan Deal,2008-05-08,article,News,,[]
Albireo Swallows Addition Cash from TPG,2008-05-08,article,News,,[]
Giant Realm Takes $2 Million for Softbank Capital,2008-05-08,article,News,,[]
Steaz Gets $11 Million for Organic Drinks,2008-05-08,article,News,,[]
JPMorgan Sees Bear Clients Returning,2008-05-08,article,News,,[]
Carphone and Best Buy Strike $2.2 Billion Deal,2008-05-08,article,News,,[]
Murdoch Keeps His Sights on Newsday,2008-05-08,article,News,,[]
"Looking for a Deal, Microsoft Said to Feel Out Facebook",2008-05-08,article,News,,[]
Delta and Northwest Defend a Merger,2008-05-08,article,News,,[]
Northern Rock Shareholders Challenge Lender’s Nationalization,2008-05-08,article,News,,[]
The New Hacker Economics,2008-05-08,article,News,,[]
Huawei Said to Consider Stake Sale,2008-05-08,article,News,,[]
How Not to Greet Police Officers,2008-05-08,article,News,,[]
Decision Awaits in Charming Shoppes Proxy Fight,2008-05-08,article,News,,[]
Moody’s President to Step Down,2008-05-08,article,News,,[]
BlackRock to the Rescue,2008-05-08,article,News,,[]
"Election fundamentals, continued",2008-05-08,article,News,,[]
When Police Officers Open Fire,2008-05-08,article,News,,[]
The Early Word: The Clinton Watch,2008-05-08,article,News,,[]
Senator Mikulski Criticizes Media,2008-05-08,article,News,,[]
"Dragged Out, But for Democrats, Not a Drag",2008-05-08,article,News,,[]
D.C. United Catches a Bug,2008-05-08,article,News,,[]
A.F.L.-C.I.O. Aims at McCain in New Push,2008-05-08,article,News,,[]
AMC Renews ‘Breaking Bad’,2008-05-08,article,News,,[]
Clinton Touts White Support,2008-05-08,article,News,,[]
Wish You’d Held On to That ’75 Ducati?,2008-05-08,article,News,,[]
Top Edwards Adviser Endorses Obama,2008-05-08,article,News,,[]
Myanmar Struggles in Cyclone Aftermath,2008-05-08,multimedia,Slideshow,,[]
After Great Pain,2008-05-08,article,,,[]
A Gated Community for Ron Paul Supporters?,2008-05-08,article,News,,[]
Another Happy Day!,2008-05-08,article,News,,[]
Mayor Overboard! But Quinn Throws Him a Line,2008-05-08,article,News,,[]
Analysts Grill Cablevision on Deal Agenda,2008-05-08,article,News,,[]
Just 48 Hours to Tour the Cotswolds,2008-05-08,article,News,,[]
Trainer as Exercise Rider,2008-05-08,article,News,,[]
A Brief History of the Stirrup,2008-05-08,article,News,,[]
Jockey Club to Study Safety,2008-05-08,article,News,,[]
Now Showing | Roy McMakin,2008-05-08,article,News,,[]
This Week on TV Guide: A Sale?,2008-05-08,article,News,,[]
McBride Wants to Stay With Fulham,2008-05-08,article,News,,[]
A Vanderbilt Remembers Native Dancer,2008-05-08,article,News,,[]
Cold Turkey,2008-05-08,article,News,,[]
Fossella Admits to Extramarital Affair,2008-05-08,article,News,,[]
‘Tough Night for Hillary’,2008-05-08,article,News,,[]
The Quad Countdown: No 113 Alabama-Birmingham,2008-05-08,article,News,,[]
Recipe of the Day: Fast Tandoori Chicken,2008-05-08,article,News,,[]
Agent $0.07,2008-05-08,article,News,,[]
"‘I’m Fed Up, O.K.?’",2008-05-08,article,News,,[]
"Scrubbed (on NBC, at Least)",2008-05-08,article,News,,[]
"A Place to Read, and Comment on, Times Articles in Arabic",2008-05-08,article,News,,[]
A Place to Read and Comment on Times Articles in Arabic,2008-05-08,article,Web Log,,"['ARABIC LANGUAGE', 'Blogs and Blogging (Internet)']"
Facebook Agrees to Protect Young Customers,2008-05-08,article,News,,[]
Three Kitchen Tidbits,2008-05-08,article,News,,[]
Quote Unquote | Ballet Class,2008-05-08,article,News,,[]
NBC Bypasses Apple to Stream TV Shows to the iPhone,2008-05-08,article,News,,[]
Mission to Myanmar?,2008-05-08,article,News,,[]
Safety Panel Needs an Independent Voice,2008-05-08,article,News,,[]
"Back-Up Your Mac, Effortlessly",2008-05-08,article,News,,[]
Tape Time,2008-05-08,article,News,,[]
Take Me Out to Dreamland,2008-05-08,article,News,,[]
Clinton: Let’s Keep This Going,2008-05-08,article,News,,[]
A Bronx Diner Becomes a Teamsters Battleground,2008-05-08,article,News,,[]
Obama Works the House,2008-05-08,article,News,,[]
"The Morning Skate: Waiting for Probert, Gypsies and Octopi",2008-05-08,article,News,,[]
How to Get Microsoft Office at 91 Percent Off,2008-05-08,article,News,,[]
Fortress Falls on Yet Another Drop in Profits,2008-05-08,article,News,,[]
We’ll Show You Our Predictions if You Show Us Yours,2008-05-08,article,News,,[]
For the Moment | A Great Wine List in Any Century,2008-05-08,article,News,,[]
Holdouts Still Seek to Block Bear Deal,2008-05-08,article,News,,[]
"Back-Up Your Mac, Effortlessly",2008-05-08,article,News,,[]
Video: A Preacher Is Taking It to the Streets,2008-05-08,article,News,,[]
When Breast Biopsies Aren’t Necessary,2008-05-08,article,News,,[]
Philadelphia Police Officers Suspended Over Taped Beating,2008-05-08,article,News,,[]
Rolling On,2008-05-08,multimedia,Video,,"['Handicapped', 'Athletics and Sports']"
"Ruffian’s Day, a Different Time",2008-05-08,article,News,,[]
Indulging Our Winking-Chef Obsession,2008-05-08,article,News,,[]
"The New Celebrities on Syndicated Shows: Barack, Hillary and John",2008-05-08,article,News,,[]
Scent Notes | Privet Bloom by Hampton Sun,2008-05-08,article,News,,[]
Russia Plans Near-Quarantine for English Soccer Fans,2008-05-08,article,News,,[]
Bronfman Says Warner Is Far from ‘Rocks’,2008-05-08,article,News,,[]
Partisan Preview: Pittsburgh vs. Philadelphia,2008-05-08,article,News,,[]
The Name Is Bond. Lucky Jim Bond.,2008-05-08,article,News,,[]
Istanbul’s kaleidoscope of street vendors,2008-05-08,article,News,,['Street Vendors']
"A Soldier Pocket-Dials His Family, During Battle",2008-05-08,article,News,,[]
Breaking News from the Time Warp,2008-05-08,article,News,,[]
‘$2 Billion Ice Sculpture’,2008-05-08,article,News,,[]
The Long March,2008-05-08,article,News,,[]
Mediocre Ratings for Barbara Walters’ Bio Show,2008-05-08,article,News,,[]
Other Stops,2008-05-08,article,News,,[]
Life on Mars,2008-05-08,multimedia,Slideshow,,[]
Schiano Talks Notre Dame and Ray Rice,2008-05-08,article,News,,[]
"A Photographer and Her Subject, Reunited Decades Later",2008-05-08,article,News,,[]
"The White House Has Got Mail — Um, It Had Mail",2008-05-08,article,News,,[]
Announcing the DBSlayer ActiveRecord Adapter,2008-05-08,article,News,,[]
The Ol’ Sex Machine Routine,2008-05-08,article,News,,[]
The Clintons’ Legacy (Is it That Time Already?),2008-05-08,article,News,,[]
Superheroes at the Met,2008-05-08,multimedia,Slideshow,,"['Comic Books and Strips', 'APPAREL']"
Inflation Warning,2008-05-08,article,News,,[]
Don’t Blame the Jockey,2008-05-08,article,News,,[]
"Farewell, My Lovely Pork Buns",2008-05-08,article,News,,[]
Your Photos Here,2008-05-08,article,News,,[]
A Flood of Allusions?,2008-05-08,article,,,[]
"Queens Market Cheated Grocery Baggers, State Says",2008-05-08,article,News,,[]
Candidates Turning to Mom,2008-05-08,article,News,,[]
A Graveside View: You Must Be This Tall to See Miss Liberty,2008-05-08,article,News,,[]
Obama: I’m Not the Nominee Yet,2008-05-08,article,News,,[]
Brian Williams Talks to Barack Obama,2008-05-08,multimedia,Video,,[]
Love in Saudi Arabia,2008-05-08,multimedia,Video,,[]
Fabian Does Dallas,2008-05-08,article,News,,[]
An Aquarium for Humans,2008-05-08,multimedia,Slideshow,,['Spas']
China May Censor Some Web Sites During the Olympics,2008-05-08,article,News,,[]
Partisan Preview: Detroit vs. Dallas,2008-05-08,article,News,,[]
McCain on ‘Daily Show’,2008-05-08,article,News,,[]
The Pulse Smartpen,2008-05-08,multimedia,Video,,['Computers and the Internet']
Gotbaums Sue Phoenix Over Airport Death,2008-05-08,article,News,,[]
Preakness Updates: Thursday,2008-05-08,article,News,,[]
Paterson Meets With Bell’s Family and Sharpton,2008-05-08,article,News,,[]
More Reader Photographs From Myanmar,2008-05-08,article,News,,[]
Podcast: European Flair Goes Just So Far,2008-05-08,article,News,,[]
Clinton’s Fund-Raising Online: $1 Million,2008-05-08,article,News,,[]
Military Junta Portrays Control,2008-05-08,multimedia,Video,,[]
Military Junta Portrays Control,2008-05-08,multimedia,Video,,[]
MySpace Turns Social Network Sharing in the Right Direction,2008-05-08,article,News,,[]
Study of ‘Daily Show:’ It’s A Lot Like O’Reilly,2008-05-08,article,News,,[]
Confirmed: Wilmington To Make Early Switch to Digital TV,2008-05-08,article,News,,[]
Pelosi Pressured?,2008-05-08,article,News,,[]
The Torch Atop Everest,2008-05-08,article,News,,[]
The Widening Gap,2008-05-08,article,News,,[]
Movie Minutes: 'Speed Racer',2008-05-08,multimedia,Video,,['MOTION PICTURES']
"Google: We Like Yahoo, and We Like It Independent",2008-05-08,article,News,,[]
Turmoil in Student Lending,2008-05-08,article,News,,[]
UrbanEye: The NY Philharmonic,2008-05-08,multimedia,Video,,"['Theater', 'Classical Music']"
The Well Podcast: Child Care and Outdoor Play,2008-05-08,article,News,,[]
Hmong Hip-Hop Heritage,2008-05-08,multimedia,Video,,['Civil War and Guerrilla Warfare']
Why you should hate economists,2008-05-09,article,News,,[]
Cross Promotion,2008-05-09,article,News,,[]
Reaction Abroad to the U.S. Election,2008-05-09,multimedia,Video,,[]
A McCain Digs In,2008-05-09,article,News,,[]
Rocking the Vote and More,2008-05-09,article,News,,[]
Sharpton to Clinton: ‘It’s Over’,2008-05-09,article,News,,[]
Friday’s Links: Personality Types of Presidential Types,2008-05-09,article,News,,[]
Famed Dutch architect to make his mark on New York City skyline,2008-05-09,article,News,,[]
Picture this in Moscow….,2008-05-09,article,News,,[]
Violence in Beirut,2008-05-09,multimedia,Slideshow,,[]
Rick Ankiel’s Two Great Throws…,2008-05-09,article,News,,[]
Art-ful Travel: Fun at the New Eurostar Terminal,2008-05-09,article,News,,[]
Spare Times,2008-05-09,article,Schedule,,[]
Homeowner Rescue Bill Passed Despite Veto Threat,2008-05-09,article,News,,"['Law and Legislation', 'Foreclosures', 'Housing']"
A Decade of Sins Deserves a Year Out,2008-05-09,article,News,,"['Cheating', 'Football', 'Recordings and Downloads (Video)']"
Art in Review,2008-05-09,article,Review,,['Art']
Europeans and British Leave Rates Unchanged,2008-05-09,article,News,,"['Banks and Banking', 'Interest Rates']"
Pushkin Museum Overhaul Planned,2008-05-09,article,Brief,,[]
Dan Rather Revises Lawsuit Against CBS,2008-05-09,article,Brief,,[]
Supporters Rally in Newark as an Imam’s Trial Opens,2008-05-09,article,News,,"['Palestinians', 'Islam', 'Deportation']"
"Utah Mine Disaster Was Preventable, Report Says",2008-05-09,article,News,,"['Accidents and Safety', 'Mines and Mining']"
Names of the Dead,2008-05-09,article,List,,[]
Market Regulatory Reform,2008-05-09,article,Letter,,"['Regulation and Deregulation of Industry', 'Hedge Funds']"
CORRECTIONS: FOR THE RECORD,2008-05-09,article,Correction,,[]
His Impetuous Investment Races for the Crown,2008-05-09,article,News,,"['Triple Crown (Horse Racing)', 'Horse Racing']"
Nixon’s Secretary on Her Days of Glory and After,2008-05-09,article,Review,,"['Presidents and Presidency (US)', 'Theater']"
Italy: Starving the Pigeons of St. Mark’s Square,2008-05-09,article,Brief,,"['Pigeons', 'Historic Buildings and Sites']"
F.B.I. Says the Military Had Bogus Computer Gear,2008-05-09,article,News,,"['Defense Contracts', 'Computers and the Internet', 'Counterfeit Merchandise', 'Espionage']"
Cipriani Empire Charged With Violating State Laws,2008-05-09,article,News,,['Tax Evasion']
"A Postscript for a Writer, 200 Years in the Works",2008-05-09,article,News,,"['Writing and Writers', 'MOTION PICTURES', 'History', 'Tests and Testing']"
"On Ireland Visit, Noting That Council Speaker and Belfast Go Back a Long Way",2008-05-09,article,News,,[]
G.M. to Pay $200 Million to Settle Strike,2008-05-09,article,News,,['Strikes']
Reprieve for a Struggling Catholic School in Jersey City,2008-05-09,article,News,,"['Education and Schools', 'Private and Sectarian Schools']"
Push to End Europe’s Ban on U.S. Poultry Backfires,2008-05-09,article,News,,['Poultry']
Iran Says April 12 Blast at Shiraz Mosque Was Terrorism,2008-05-09,article,News,,['Terrorism']
Hitting Curves (of All Sorts),2008-05-09,article,Op-Ed,,"['Athletics and Sports', 'Baseball']"
"In a Changing World, an Ever-Evolving Terrorism",2008-05-09,article,Review,,"['UNITED STATES ARMAMENT AND DEFENSE', 'Books and Literature', 'Terrorism']"
"Short of Cash, Clinton Is Forced to Cut Spending",2008-05-09,article,News,,"['Finances', 'Presidential Election of 2008']"
Theater Listings,2008-05-09,article,Schedule,,['Theater']
Mr. Mugabe’s Cynical Plan,2008-05-09,article,Editorial,,"['Editorials', 'Voter Registration and Requirements', 'Politics and Government', 'Elections']"
Murcer the Author Tells of His Life and New Yogiism,2008-05-09,article,News,,"['Baseball', 'Medicine and Health']"
On Becoming an Ex-Smoker,2008-05-09,article,News,,"['Medicine and Health', 'Nicotine', 'Psychology and Psychologists']"
Cuomo Sees Fraud in Some Lawyers’ Pensions,2008-05-09,article,News,,"['Pensions and Retirement Plans', 'Frauds and Swindling']"
Lighter Mood as Ford Shareholders Meet,2008-05-09,article,News,,[]
Taxes and Oil Companies,2008-05-09,article,Letter,,"['Taxation', 'Oil (Petroleum) and Gasoline']"
"Average Teenage Girl, Assembling a Life Without a Set of Instructions",2008-05-09,article,Review,,['MOTION PICTURES']
"High Prices for Staple Foods Dip, but Volatile Markets Persist",2008-05-09,article,News,,"['AGRICULTURE', 'Economic Conditions and Trends', 'International Trade and World Market', 'Prices (Fares, Fees and Rates)']"
Something About Austria?,2008-05-09,article,Letter,,['Crime and Criminals']
U.N. Pressures Myanmar to Allow Aid,2008-05-09,article,News,,"['International Relations', 'Foreign Aid', 'Cyclones', 'Politics and Government', 'Disasters']"
'Soul Surfers' Rekindle the Love of the Longboard,2008-05-09,article,News,,"['Travel and Vacations', 'Surfing']"
Power Dressing,2008-05-09,article,Review,,"['Cartoons and Cartoonists', 'Comic Books and Strips', 'APPAREL', 'Costumes, Theatrical']"
The Bronx Opera Makes Fun of Itself in a Mozart Adaptation,2008-05-09,article,News,,['Opera']
Major Deal Preserves Ranch Land in California,2008-05-09,article,News,,"['Ranches', 'Environment']"
"Gentlemen, Start Your Hot-Hued Engines",2008-05-09,article,Review,,['MOTION PICTURES']
Top Colleges Dig Deeper in Wait Lists for Students,2008-05-09,article,News,,"['ADMISSIONS STANDARDS', 'Colleges and Universities']"
They Came to New York for the Waters,2008-05-09,article,News,,"['Travel and Vacations', 'Spas']"
Vienna Opera Chooses Female Concertmaster,2008-05-09,article,Brief,,[]
Youthful Energy and Religious Pain,2008-05-09,article,Review,,['MOTION PICTURES']
Facebook Agrees to Devise Tools to Protect Young Users,2008-05-09,article,News,,"['Children and Youth', 'Computers and the Internet']"
Putin Is Approved as Prime Minister,2008-05-09,article,News,,[]
Hard Sell to Medicare Insurance Buyers Would Get Softer Under New Rules,2008-05-09,article,News,,"['Medicine and Health', 'Health Insurance and Managed Care', 'Medicare']"
Verdi Versus Shakespeare: With ‘Macbeth’ It’s a Draw,2008-05-09,article,News,,"['Opera', 'Theater']"
Shiite-Sunni Clashes Intensify in Beirut,2008-05-09,article,News,,"['Threats and Threatening Messages', 'Shiite Muslims', 'Politics and Government', 'Sunni Muslims', 'ARMAMENT, DEFENSE AND MILITARY FORCES']"
New York’s Coveted Public Schools Face Pupil Jam,2008-05-09,article,News,,"['Education and Schools', 'Building (Construction)']"
"In Lake, Signs of Slow Shift From Savannah to Sahara",2008-05-09,article,News,,"['Geology', 'Environment', 'Water', 'Research']"
"Hanon Reznikov, a Force Behind the Living Theater, Dies at 57",2008-05-09,article,Obituary (Obit),,"['Deaths (Obituaries)', 'Theater']"
The Filling of an Empty Soul,2008-05-09,article,Review,,['MOTION PICTURES']
"Robert Vesco, ’70s Financier, Is Dead at 71",2008-05-09,article,Obituary (Obit),,"['Frauds and Swindling', 'Cancer', 'Death and Dying', 'Deaths (Obituaries)']"
Finding Your Bliss? Losing Your Mind,2008-05-09,article,Review,,['MOTION PICTURES']
Months of Talks End in New Contract for ABC’s President,2008-05-09,article,News,,['Television']
77 New Cases of Hepatitis Are Identified in Las Vegas,2008-05-09,article,News,,"['Medicine and Health', 'Hepatitis']"
Cuban Defectors Adjust to a New Life,2008-05-09,article,News,,['Soccer']
The Dream House at Last,2008-05-09,article,News,,"['Home Furnishings', 'Housing']"
CORRECTIONS: FOR THE RECORD,2008-05-09,article,Correction,,[]
Toyota Expects Decline in Annual Profit,2008-05-09,article,News,,"['Sales', 'International Trade and World Market', 'Automobiles']"
Reports of Qaeda Arrest,2008-05-09,article,News,,['UNITED STATES ARMAMENT AND DEFENSE']
Manslaughter Trial Set for British Artist,2008-05-09,article,Brief,,[]
Jack-Rabbit Habits,2008-05-09,article,Letter,,"['Automobiles', 'Prices (Fares, Fees and Rates)']"
"Defying Bush, House Passes Broad Housing Bill",2008-05-09,article,News,,"['Housing', 'Foreclosures']"
Iran: A Hate Note on Israel’s Birthday,2008-05-09,article,Brief,,"['Zionism', 'International Relations']"
"Pedaling, and Protecting, New Hampshire Trails",2008-05-09,article,News,,"['Travel and Vacations', 'Bicycles and Bicycling']"
"No Sex, Please, We’re British Indians",2008-05-09,article,Review,,['Theater']
The Conservative Revival,2008-05-09,article,Op-Ed,,"['Conservatism (US Politics)', 'Politics and Government']"
Myanmar’s Biggest City Still Paralyzed After 5 Days,2008-05-09,article,News,,"['Cyclones', 'Foreign Service', 'Restoration and Rehabilitation']"
Thinking About November,2008-05-09,article,Op-Ed,,"['United States Politics and Government', 'Presidential Election of 2008', 'Presidential Elections (US)']"
A Family That Surfs to a Beat: Its Own,2008-05-09,article,Review,,"['MOTION PICTURES', 'Surfing']"
After Them the Monsoon: Two Worlds Collide in India,2008-05-09,article,Review,,"['MOTION PICTURES', 'Tribes and Tribalism']"
"That Congenial Spot Revisited, With a World-Class Orchestra Playing Along",2008-05-09,article,Review,,"['Music', 'Theater']"
A Mystery With No Resolution,2008-05-09,article,Review,,['MOTION PICTURES']
McCain’s Vote in 2000 Is Revived in a Ruckus,2008-05-09,article,News,,"['Presidential Election of 2000', 'Presidential Election of 2008']"
Dance Listings,2008-05-09,article,Schedule,,[]
Argentine Farmers Cut Off Exports,2008-05-09,article,News,,"['Strikes', 'Grain', 'AGRICULTURE']"
A Portrait of Perseverance,2008-05-09,article,Review,,['MOTION PICTURES']
"García Plays in Calm Weather, Leaving Others to Twist in the Wind",2008-05-09,article,News,,"['Golf', 'Wind']"
Air Travelers Need to Pack More Money,2008-05-09,article,News,,"['AIRLINES AND AIRPLANES', 'Prices (Fares, Fees and Rates)']"
Madonna Sets Tour,2008-05-09,article,Brief,,[]
"A Little Pity, Please, for Lenders",2008-05-09,article,News,,"['Banks and Banking', 'Finances']"
"When Life Gives Lemons, Pick Up a Pool Stick",2008-05-09,article,Review,,['MOTION PICTURES']
"In Middle East, Looking Beyond Bush",2008-05-09,article,News,,['Presidential Election of 2008']
The Fight Stuff,2008-05-09,article,Op-Ed,,"['Women', 'Presidential Election of 2008', 'United States Politics and Government']"
Britain: Best Buy in Venture,2008-05-09,article,Brief,,"['Electronics', 'RETAIL STORES AND TRADE']"
Sen. Clinton and the Campaign,2008-05-09,article,Editorial,,"['Editorials', 'Presidential Election of 2008', 'PUBLIC OPINION', 'Primaries and Caucuses', 'Presidential Elections (US)', 'United States Politics and Government']"
Ritzenhein Withdraws,2008-05-09,article,Brief,,['Olympic Games (2008)']
Footnotes,2008-05-09,article,Brief,,[]
An ‘Our Town’ Stage for the Creative Set,2008-05-09,article,News,,"['Travel and Vacations', 'Art', 'Housing']"
"From Japan, With Genes to Capture the Belmont",2008-05-09,article,News,,"['Genetics and Heredity', 'Big Brown (Race Horse)', 'Belmont Stakes', 'Triple Crown (Horse Racing)', 'Horse Racing', 'Horses']"
Fossella Admits He Had an Extramarital Affair,2008-05-09,article,News,,['ADULTERY']
"A Heroine’s Inner Flame, Fueled by an Excess of Feeling",2008-05-09,article,Review,,['Theater']
