headline,date,doc_type,material_type,section,keywords
World’s Most Expensive Mint Julep Cup,2008-05-01,article,News,,[]
Jagr’s Last Stand?,2008-05-01,article,News,,[]
Auction Season’s Highs and Lows,2008-05-01,multimedia,Slideshow,,[]
Winding Up as a Season Winds Down,2008-05-01,article,News,,[]
"The End of the Gate, Not the End of the World",2008-05-01,article,News,,[]
Into the Amazon,2008-05-01,multimedia,Video,,[]
Regent’s Park building getting luxury residential makeover,2008-05-01,article,News,,[]
Your Comments on Thursday’s Amazon Column,2008-05-01,article,News,,[]
More Workplace Lessons From the Canine Set,2008-05-01,article,News,,[]
Justice Dept. Will Share Interrogation Opinions,2008-05-01,article,News,,"['Classification of Information', 'Torture', 'United States Politics and Government']"
Lacerated Spleen Sidelines Avery,2008-05-01,article,News,,"['Hockey, Ice']"
Names of the Dead,2008-05-01,article,News,,['UNITED STATES ARMAMENT AND DEFENSE']
CURRENTS | A Chance to Shop Till You Help,2008-05-01,article,News,,"['RETAIL STORES AND TRADE', 'Auctions', 'Acquired Immune Deficiency Syndrome']"
"The B.C.S. Takes a Pass, Again",2008-05-01,article,News,,[]
Arizona Adds Digit to License Plates to Keep Up With Growth,2008-05-01,article,News,,"['Roads and Traffic', 'Automobile Registration and License Plate', 'Population', 'Automobiles']"
Open-Toed Fetishes (and More),2008-05-01,article,News,,"['Shoes and Boots', 'RETAIL STORES AND TRADE']"
"Step Right Up, Kids (and Thank the Dance Gods You’re Not Elephants)",2008-05-01,article,Review,,['Dancing']
Reprise: The Fifth Avenue Ballad of Pale Male and Lola,2008-05-01,article,News,,['Birds']
Door Keeper on 79th St. Keeps Stories of Queens,2008-05-01,article,News,,"['Writing and Writers', 'Doormen']"
A Beach Where Discretion Is More Than Just Advised,2008-05-01,article,News,,"['Law and Legislation', 'Beaches']"
Pellicano on Pellicano: He Was No Mastermind,2008-05-01,article,News,,"['Racketeering and Racketeers', 'Wiretapping and Other Eavesdropping Devices and Methods', 'Suits and Litigation']"
IPod Quandary: Fix or Replace?,2008-05-01,article,Question,,['iPod']
F.B.I. Questions Clemens Associate,2008-05-01,article,News,,"['Perjury', 'Hormones', 'Human Growth Hormone']"
No. 20 Post? Derby Favorite’s Handlers Say Sure,2008-05-01,article,News,,"['Kentucky Derby', 'Horse Racing']"
Returning to the Past and Finding the Bogeyman Is Still There,2008-05-01,article,Review,,"['Books and Literature', 'Families and Family Life']"
Gambling Back at WOR,2008-05-01,article,Brief,,[]
Starbucks Reports 28% Drop in Profit and Trims Store Openings,2008-05-01,article,News,,"['Company Reports', 'RETAIL STORES AND TRADE', 'Coffee']"
Canada: Grocer’s Profit Climbs 15%,2008-05-01,article,Brief,,"['Company Reports', 'RETAIL STORES AND TRADE', 'Supermarkets']"
"Connecticut, Massachusetts and Rhode Island",2008-05-01,article,Schedule,,"['Gardens and Gardening', 'Historic Buildings and Sites']"
Opening a Window on a Forgotten Work and Feeling That Fresh Air Rush In,2008-05-01,article,Review,,['Classical Music']
It’s Not Easy to Stick to Principles Devised for Farmers 141 Years Ago,2008-05-01,article,News,,"['Organizations, Societies and Clubs', 'AGRICULTURE']"
"Loss and Furor Take Toll on Obama, Poll Finds",2008-05-01,article,News,,"['Presidential Election of 2008', 'PUBLIC OPINION']"
The F.D.A. and Heparin,2008-05-01,article,Letter,,"['Heparin (Drug)', 'Regulation and Deregulation of Industry', 'International Trade and World Market']"
Trials and Triumphs on the Road to Justice,2008-05-01,article,Review,,"['Theater', 'Blacks', 'Black People']"
Corrections: For the Record,2008-05-01,article,Correction,,[]
Man Threatens to Shoot Student,2008-05-01,article,News,,[]
New York City,2008-05-01,article,Schedule,,"['Historic Buildings and Sites', 'Brownstones', 'History', 'Housing']"
How Will It Play in Apex?,2008-05-01,article,Op-Ed,,"['Presidential Election of 2008', 'United States Politics and Government', 'Primaries and Caucuses', 'Presidential Elections (US)']"
Fed Cuts Rate but Hints About a Pause,2008-05-01,article,News,,"['United States Economy', 'Banks and Banking', 'Interest Rates', 'Economic Conditions and Trends']"
Federal Contracting Chief Is Forced Out,2008-05-01,article,News,,[]
Closing Arguments in Suit on Veterans’ Mental Care,2008-05-01,article,News,,"['Mental Health and Disorders', 'Veterans', 'Suits and Litigation']"
Boot Up for the Big Easy,2008-05-01,article,Editorial,,"['Editorials', 'Presidential Election of 2008', 'United States Politics and Government', 'Debating']"
Reshaping Health Care,2008-05-01,article,Letter,,"['Presidential Election of 2008', 'Health Insurance and Managed Care']"
Bloomberg Back on Radio,2008-05-01,article,News,,['Radio']
Carey Holds at No. 1,2008-05-01,article,Brief,,[]
Law Professor Accuses Students of Defamation,2008-05-01,article,News,,"['Race', 'Suits and Litigation', 'Libel and Slander', 'Colleges and Universities']"
"Whale Protection Caught in Agency Rivalry, Files Show",2008-05-01,article,News,,"['Whales and Whaling', 'Endangered and Extinct Species', 'Fish and Other Marine Life']"
Is This the World’s Cheapest Dress?,2008-05-01,article,News,,"['RETAIL STORES AND TRADE', 'APPAREL', 'Dresses', 'Prices (Fares, Fees and Rates)']"
Room to Improve,2008-05-01,article,Question,,"['Furniture', 'Interior Design', 'Paints and Painting', 'Textiles', 'Color']"
Features of Smartphone Without Smartphone Costs,2008-05-01,article,News,,"['Recordings and Downloads (Video)', 'Global Positioning System', 'Cellular Telephones', 'Wireless Communications']"
"Six Votes, Then and Now",2008-05-01,article,Editorial,,"['Editorials', 'Civil Rights', 'United States Politics and Government', 'Law and Legislation', 'Discrimination', 'Wages and Salaries']"
‘Idol’ Judge Admits Rehearsal Guided Her,2008-05-01,article,News,,['Television']
Corrections: For the Record,2008-05-01,article,Correction,,[]
G.M. Invests in Second Ethanol Process,2008-05-01,article,News,,['Ethanol']
"CURRENTS | An Encore, Even Without Nine High C’s",2008-05-01,article,News,,"['Cartoons and Cartoonists', 'Opera', 'Textiles']"
Footnote,2008-05-01,article,Brief,,[]
"For Europe’s Middle-Class, Stagnant Wages Stunt Lifestyle",2008-05-01,article,News,,"['Families and Family Life', 'Income', 'Economic Conditions and Trends', 'LABOR', 'Wages and Salaries', 'Prices (Fares, Fees and Rates)']"
CURRENTS | What Could Be Happier Than a Pig in Ceramic?,2008-05-01,article,News,,['Design']
CURRENTS | Not the Poster to Nail Up Over a Crack in the Plaster,2008-05-01,article,News,,"['Auctions', 'Art']"
"The Ore of Youth, Under Refinement",2008-05-01,article,Review,,['Dancing']
Live Bacteria to Keep the Cold Away,2008-05-01,article,News,,[]
Microsoft Chief Set to Narrow Pursuit of Yahoo,2008-05-01,article,News,,['Computers and the Internet']
"For Exxon Mobil, $10.9 Billion Profit Disappoints",2008-05-01,article,News,,['Oil (Petroleum) and Gasoline']
An Oldies Marathon Runs a Few Extra Miles,2008-05-01,article,Review,,['Blues Music']
A Rescued Goat Gets a Chance for a Normal Life,2008-05-01,article,News,,"['ANIMALS', 'Goats', 'AMPUTATION']"
Lottery Numbers,2008-05-01,article,List,,[]
It Was a Dark Afternoon for the Daydreaming Mets,2008-05-01,article,News,,['Baseball']
A Classroom Path to Entrepreneurship,2008-05-01,article,News,,"['Entrepreneurship', 'Small Business', 'Colleges and Universities']"
Prominent Green Group to Help Buyout Firm,2008-05-01,article,News,,"['Mergers, Acquisitions and Divestitures', 'Partnerships', 'Environment']"
Starbucks Earnings Sink 21%,2008-05-01,article,News,,"['Company Reports', 'Sales']"
Former D.N.C. Chairman Backs Obama,2008-05-01,article,News,,['Presidential Election of 2008']
Corrections: For the Record,2008-05-01,article,Correction,,[]
Cycling Success Measured in Frequent-Flier Miles,2008-05-01,article,News,,"['Triathlon', 'Bicycles and Bicycling']"
"More Mothers Breast-Feed, in First Months at Least",2008-05-01,article,News,,"['Medicine and Health', 'Babies', 'Nursing of Infants']"
"Yossi Harel, Who, Defying British, Brought Jews to Palestine, Is Dead at 90",2008-05-01,article,Obituary (Obit),,"['Zionism', 'JEWS', 'World War II (1939-45)', 'Palestinians', 'Nazi Policies Toward Jews and Minorities', 'Deaths (Obituaries)']"
No Change Imminent for B.C.S. Format,2008-05-01,article,News,,"['Football', 'College Athletics']"
"James Day, Public Television Host, Dies at 89",2008-05-01,article,Obituary (Obit),,"['Public Television', 'Deaths (Obituaries)', 'Television']"
"New York, True to Mayor’s Promise, Slashes City Parking Permits",2008-05-01,article,News,,"['Parking', 'Government Employees']"
Today in Business,2008-05-01,article,List,,[]
Status: Looking for Work on Facebook,2008-05-01,article,News,,"['Hiring and Promotion', 'Computers and the Internet']"
Fund Set for Minneapolis Bridge Collapse Victims,2008-05-01,article,News,,"['Deaths (Fatalities)', 'Bridges and Tunnels', 'Politics and Government', 'Accidents and Safety', 'Compensation for Damages (Law)']"
Hoosier Time,2008-05-01,article,Op-Ed,,"['Presidential Election of 2008', 'United States Politics and Government', 'Primaries and Caucuses']"
Sharing Your iPod Tunes Without Those Tangled Earbuds,2008-05-01,article,News,,"['Headphones', 'iPod']"
"In a New Climate Model, Short-Term Cooling in a Warmer World",2008-05-01,article,News,,"['Global Warming', 'Science and Technology', 'Environment', 'Forecasts', 'Computers and the Internet']"
A Run on Rice in Asian Communities,2008-05-01,article,News,,"['Rice', 'RETAIL STORES AND TRADE', 'Prices (Fares, Fees and Rates)']"
Pizza and Pop Lift Fox,2008-05-01,article,Brief,,[]
"The Pentagon’s Message, and Ours: 5 Analysts Reply",2008-05-01,article,Letter,,"['UNITED STATES ARMAMENT AND DEFENSE', 'Military Personnel', 'News and News Media', 'Propaganda']"
White House Forces Out G.S.A. Chief,2008-05-01,article,News,,"['Politics and Government', 'United States Politics and Government', 'Suspensions, Dismissals and Resignations']"
Pakistani Parties Weigh Reinstating Judges,2008-05-01,article,News,,"['Supreme Courts (State)', 'Politics and Government', 'Courts']"
"Hard Times, but Your Lips Look Great",2008-05-01,article,News,,"['Cosmetics and Toiletries', 'Economic Conditions and Trends', 'Sales']"
France: Drug Maker Posts a Decline,2008-05-01,article,Brief,,"['Company Reports', 'Drugs (Pharmaceuticals)']"
Corrections: For the Record,2008-05-01,article,Correction,,[]
"Attacks in Pakistan Rising, State Department Reports",2008-05-01,article,News,,"['Terrorism', 'Politics and Government', 'Bombs and Explosives']"
"After Break With Ex-Pastor, Obama Tries to Move On",2008-05-01,article,News,,['Presidential Election of 2008']
New Jersey,2008-05-01,article,Schedule,,"['Home Furnishings', 'Historic Buildings and Sites', 'Housing', 'Museums']"
Venerable Classical-Music Magazine Plans to Add Online Sales to Its Reviews,2008-05-01,article,News,,"['Recordings and Downloads (Audio)', 'Classical Music']"
Afghans See Link to Qaeda in Plot to Shoot Karzai,2008-05-01,article,News,,['Assassinations and Attempted Assassinations']
Corrections: For the Record,2008-05-01,article,Correction,,[]
Free Madonna Show? Only for Die-Hard Fans,2008-05-01,article,Brief,,[]
Corrections: For the Record,2008-05-01,article,Correction,,[]
The Heisman Trophy Moves Into Its New Home,2008-05-01,article,News,,"['Heisman Trophy', 'Museums']"
Los Angeles Police Expect Calm at Immigration Rally,2008-05-01,article,News,,"['Demonstrations and Riots', 'IMMIGRATION AND REFUGEES', 'Voter Registration and Requirements', 'Police']"
Corrections: For the Record,2008-05-01,article,Correction,,[]
Iraq Team to Discuss Militias With Iran,2008-05-01,article,News,,"['Islam', 'Shiite Muslims', 'Politics and Government']"
Fewer Latino Immigrants Sending Money Home,2008-05-01,article,News,,"['IMMIGRATION AND REFUGEES', 'Economic Conditions and Trends']"
Cablevision Set to Raise the Stakes in Newsday Bidding,2008-05-01,article,News,,"['Newspapers', 'Mergers, Acquisitions and Divestitures', 'Executives and Management']"
Fewer Latino Immigrants Send Money Home,2008-05-01,article,News,,"['Hispanic-Americans', 'IMMIGRATION AND REFUGEES']"
"Operation ‘Went Great,’ and Woods Expects Quick Recovery",2008-05-01,article,News,,"['Surgery and Surgeons', 'Masters Golf Tournament', 'Knees']"
The Yanks Add Hughes to the Disabled List,2008-05-01,article,News,,['Baseball']
Race Is No Longer Off the Beaten Track,2008-05-01,article,News,,"['Kentucky Derby', 'Horse Racing']"
British Bank Offers an Optimistic Outlook,2008-05-01,article,News,,"['Economic Conditions and Trends', 'Credit']"
"What Would You Drive, if the Taxpayers Paid?",2008-05-01,article,News,,['Automobiles']
Slower Consumer Spending Hits Home Depot,2008-05-01,article,News,,['RETAIL STORES AND TRADE']
Microsoft’s Board Meets on Yahoo Bid,2008-05-01,article,News,,"['Mergers, Acquisitions and Divestitures', 'ANTITRUST ACTIONS AND LAWS', 'Computers and the Internet']"
Palestinians Agree to Plan for Truce With Israel,2008-05-01,article,Brief,,"['International Relations', 'Palestinians']"
"Turnaround Under Way, G.M. Is Still Bleeding Cash",2008-05-01,article,News,,"['Company Reports', 'Housing', 'Home Equity Loans', 'Automobiles', 'Sales']"
Quintet of Calming Strings and a Rumbling Clarinet,2008-05-01,article,Review,,['Classical Music']
Even Less Help in Hard Times,2008-05-01,article,Editorial,,"['Editorials', 'Medicaid', 'Economic Conditions and Trends', 'Finances', 'Health Insurance and Managed Care', 'Recession and Depression', 'United States Economy', ""State Children's Health Insurance Program (S-CHIP)""]"
"Despite Some Bumps, Snedeker Enjoys Ride",2008-05-01,article,News,,"['Golf', 'Masters Golf Tournament']"
Brooklyn Councilman’s Funds for a Group He Founded Were Blocked,2008-05-01,article,News,,"['Ethics', 'Nonprofit Organizations', 'Finances', 'City Councils']"
Corrections: For the Record,2008-05-01,article,Correction,,[]
Firing Puts New Coach in Crowded Marketplace,2008-05-01,article,News,,['Basketball']
Can We Be as Smart as Bats?,2008-05-01,article,Op-Ed,,"['Global Warming', 'Carbon Dioxide', 'Education and Schools', 'Forests and Forestry', 'Bats']"
Belarus Expels 10 U.S. Diplomats,2008-05-01,article,News,,"['United States International Relations', 'International Relations']"
Parking Rules,2008-05-01,article,News,,[]
Senate Says McCain Is Qualified,2008-05-01,article,News,,"['Presidential Election of 2008', 'Constitutions', 'United States Politics and Government', 'Citizenship']"
Statement on Rate Cut by the Federal Reserve,2008-05-01,article,Text,,"['Interest Rates', 'United States Economy', 'Prices (Fares, Fees and Rates)']"
"Gordon Bradley, Who Nurtured U.S. Soccer, Dies at 74",2008-05-01,article,Obituary (Obit),,"['Deaths (Obituaries)', 'Soccer']"
"For a Day, the Giants Are Washington’s Favorite Team",2008-05-01,article,News,,"['Football', 'Super Bowl']"
U.S. Sues Alabama Mayor in Bond Deals,2008-05-01,article,News,,"['Suits and Litigation', 'Mayors', 'Frauds and Swindling']"
H.P. Unveils New Memory Technology,2008-05-01,article,News,,"['Computer Chips', 'Science and Technology']"
How to Amplify Those Fading Bars,2008-05-01,article,News,,"['Wireless Communications', 'Cellular Telephones']"
TV Dramas Feel Brunt of Strike Fallout,2008-05-01,article,News,,['Television']
"Adopting Meters, Washington Ends Taxi Zone System",2008-05-01,article,News,,['Taxicabs and Taxicab Drivers']
"In Inner Mongolia, Pushing Architecture’s Outer Limits",2008-05-01,article,News,,"['Buildings (Structures)', 'Economic Conditions and Trends', 'Design', 'ARCHITECTURE']"
Home and Garden Calendar,2008-05-01,article,Schedule,,"['Libraries and Librarians', 'ARCHITECTURE', 'Flowers and Plants', 'Museums', 'Photography', 'Art', 'Textiles']"
Sickened by the Office (Really),2008-05-01,article,News,,"['Asthma', 'ALLERGIES']"
Pittsburgh’s Dynastic Duo,2008-05-01,article,News,,"['Hockey, Ice']"
A Strained Wright-Obama Bond Finally Snaps,2008-05-01,article,News,,"['Presidential Election of 2008', 'Friendship', 'Christians and Christianity']"
Of Affirmed and Other Homestretch Heroes,2008-05-01,article,News,,[]
Tip of the Week: Searching for Text in Firefox,2008-05-01,article,Question,,"['Software', 'Computers and the Internet']"
"Moss Makes a Lush, No-Care Lawn",2008-05-01,article,News,,"['Grass', 'Lawns', 'Gardens and Gardening', 'Flowers and Plants']"
Whitney’s Downtown Sanctuary,2008-05-01,article,News,,['Art']
"With Two Aces Against a Slam, What to Lead?",2008-05-01,article,News,,"['Bridge (Card Game)', 'Cards and Card Games']"
"Three Young Performers, Showing Their Skills",2008-05-01,article,Review,,['Classical Music']
Politics and the Economy Occupy Ad Agencies,2008-05-01,article,News,,"['Conventions and Conferences', 'Presidential Election of 2008', 'ADVERTISING AND MARKETING']"
Yanks Finish April Under .500 and Under Siege From Injuries,2008-05-01,article,News,,['Baseball']
"Council Approves Rezoning of 125th Street, Over Loud Protests of Some Spectators",2008-05-01,article,News,,"['Zoning', 'City Councils']"
Reading Program Is Called Ineffective,2008-05-01,article,News,,"['Education and Schools', 'Reading and Writing Skills']"
"As Euro Nears 10, Cracks Emerge in Fiscal Union",2008-05-01,article,News,,"['Currency', 'Economic Conditions and Trends']"
Delays in $4 Billion Brooklyn Development Are Challenged in Tenants’ Lawsuit,2008-05-01,article,News,,"['Atlantic Yards (Brooklyn)', 'Suits and Litigation', 'Eminent Domain']"
"Pennsylvania, Delaware and Maryland",2008-05-01,article,Schedule,,"['Restoration and Rehabilitation', 'Gardens and Gardening', 'Historic Buildings and Sites']"
McCain Health Plan Could Mean Higher Tax,2008-05-01,article,News,,"['Tax Credits', 'Presidential Election of 2008', 'Income Tax', 'Insurance', 'Income', 'United States Politics and Government', 'Taxation', 'Health Insurance and Managed Care', 'Federal Taxes (US)', 'Wages and Salaries']"
Corzine Aide Resigns After Testifying in the Corruption Trial of a Hudson County Mayor,2008-05-01,article,News,,[]
First Tibetan Death in Unrest Reported by China,2008-05-01,article,News,,"['Demonstrations and Riots', 'Police Brutality and Misconduct', 'Police']"
Germany: Catch the Next Iceberg Out of Town,2008-05-01,article,Brief,,"['Homosexuality', 'Bears', 'Polar Bears']"
"While Clinton Focuses, Obama Is Distracted",2008-05-01,article,News,,"['Presidential Election of 2008', 'Endorsements']"
Producers’ Group Pessimistic on Labor Talks With Actors,2008-05-01,article,News,,"['MOTION PICTURES', 'Strikes', 'ACTORS AND ACTRESSES']"
States Limit Costly Sites for Cancer Radiation,2008-05-01,article,News,,"['Cancer', 'Medicine and Health', 'Health Insurance and Managed Care', 'Particle Accelerators', 'Hospitals']"
Canadians Investigate Death of Ducks at Oil-Sands Project,2008-05-01,article,News,,"['Ducks', 'Oil (Petroleum) and Gasoline', 'Environment']"
"Dressing Up, Win, Place or Show",2008-05-01,article,News,,"['APPAREL', 'Horse Racing']"
Protecting Alaska,2008-05-01,article,Letter,,"['Wilderness Areas', 'United States Politics and Government', 'Environment']"
Corrections: For the Record,2008-05-01,article,Correction,,[]
Wright Remains a Concern for Some Democrats,2008-05-01,article,News,,[]
A Student of Kicking Passes a Test and Lands in the N.F.L.,2008-05-01,article,News,,"['Football', 'Free Agents (Sports)']"
"Hey, Kids, Free Comics!",2008-05-01,article,Brief,,[]
An Ambulatory Arbor,2008-05-01,article,Question,,"['Flowers and Plants', 'Gardens and Gardening', 'Trees and Shrubs']"
China Says Abusive Child Labor Ring Is Exposed,2008-05-01,article,News,,"['Slave Labor', 'Child Labor']"
The Gas-Guzzler Gambit,2008-05-01,article,Editorial,,"['Editorials', 'Global Warming', 'Presidential Election of 2008', 'Gasoline Tax (US)', 'United States Politics and Government', 'Oil (Petroleum) and Gasoline', 'Prices (Fares, Fees and Rates)']"
Immigrants Challenge U.S. System of Detention,2008-05-01,article,News,,"['Death and Dying', 'Illegal Immigrants', 'Law and Legislation', 'IMMIGRATION AND REFUGEES']"
TV Images to Dazzle the Jaded,2008-05-01,article,News,,"['Digital and High-Definition Television', 'Television']"
New York State,2008-05-01,article,Schedule,,"['Libraries and Librarians', 'ARCHITECTURE', 'Housing', 'Museums']"
Texas Reports Added Signs of Abuse at Sect’s Ranch,2008-05-01,article,News,,"['Sex Crimes', 'Polygamy', 'Children and Youth', 'Fundamentalist Church of Jesus Christ of Latter-day Saints', 'Domestic Violence', 'Child Abuse and Neglect', 'Yearning for Zion Ranch']"
"Carolina, Out of Its Mind",2008-05-01,article,Op-Ed,,"['Primaries and Caucuses', 'Presidential Election of 2008', 'United States Politics and Government', 'Presidential Elections (US)']"
Obama and Wright: The Uproar,2008-05-01,article,Letter,,"['Presidential Election of 2008', 'Race', 'Blacks', 'Black People']"
U.S. Appeals Court Rejects City’s Suit to Curb Guns,2008-05-01,article,News,,"['Appeals Courts (US)', 'Decisions and Verdicts', 'Firearms']"
Yale Students' New Art,2008-05-01,article,Brief,,[]
French Premier to Seek Common Fiscal Policy in U.S.,2008-05-01,article,News,,"['International Trade and World Market', 'Recession and Depression', 'United States Economy', 'Politics and Government']"
A Mailbox Full of Paper Clips,2008-05-01,article,Question,,"['Computers and the Internet', 'Electronic Mail']"
"For Madonna Fans, the Wait Is Worth It",2008-05-01,article,News,,['Rock Music']
Agency Floats a Proposal to Help With Home Loans,2008-05-01,article,News,,"['Housing', 'Tax Credits', 'Law and Legislation', 'Foreclosures', 'Mortgages']"
H.P. Reports Big Advance in Memory Chip Design,2008-05-01,article,News,,"['Computer Chips', 'Nanotechnology', 'Computers and the Internet']"
Consumer Spending Stagnates as Prices Rise,2008-05-01,article,News,,"['United States Economy', 'Consumer Behavior', 'Unemployment', 'Prices (Fares, Fees and Rates)']"
NATO Accuses Russia of Stirring Tensions in Rebel Georgia Areas,2008-05-01,article,News,,['International Relations']
"Rise in Minorities Is Led by Children, Census Finds",2008-05-01,article,News,,"['Race', 'Minorities (US)', 'Population']"
Rome’s Mayor Plans to Raze Meier Museum,2008-05-01,article,Brief,,[]
Zimbabwe: Army Accused of Terror Campaign,2008-05-01,article,Brief,,['Politics and Government']
CURRENTS | Richard Neutra’s Home Seeks a Down Payment on Its Future,2008-05-01,article,News,,['ARCHITECTURE']
A Confrontation on ‘Costas Now’ Worthy of a Blog,2008-05-01,article,News,,"['Writing and Writers', 'Football', 'Books and Literature', 'Blogs and Blogging (Internet)', 'News and News Media']"
How the Poll Was Conducted,2008-05-01,article,News,,[]
Custom Fitting Just a Flight Away,2008-05-01,article,News,,[]
Time Warner Refocusing With Move to Spin Off Cable,2008-05-01,article,News,,"['Mergers, Acquisitions and Divestitures', 'MOTION PICTURES', 'Television', 'Cable Television']"
Joba Rules?,2008-05-01,article,News,,[]
"For Eyes That Have Seen It All, There’s a Way to Prove It",2008-05-01,article,News,,['Cameras']
5 Asian Nations Are Weighing a Rice Cartel,2008-05-01,article,News,,"['Rice', 'CARTELS', 'Prices (Fares, Fees and Rates)']"
Long Island,2008-05-01,article,Schedule,,"['Home Furnishings', 'Housing', 'Design', 'Museums']"
"After Troubled Tour, Torch Arrives in China",2008-05-01,article,News,,"['Demonstrations and Riots', 'Olympic Games (2008)']"
Low Spending Is Taking Toll on Economy,2008-05-01,article,News,,"['Income', 'Economic Conditions and Trends', 'LABOR', 'Consumer Behavior', 'Interest Rates', 'United States Economy', 'Wages and Salaries']"
Automakers’ April Sales Reflect Shift to Smaller Cars,2008-05-01,article,News,,[]
"In Wyoming, the Dark Side of America’s Thirst for Energy",2008-05-01,article,News,,"['Writing and Writers', 'Housing', 'Books and Literature']"
"State Could Save $1 Billion a Year by Consolidating Services, Report Says",2008-05-01,article,News,,"['Budgets and Budgeting', 'Finances']"
"South, Midwest and West",2008-05-01,article,Schedule,,"['Restoration and Rehabilitation', 'Gardens and Gardening', 'Housing', 'Home Furnishings']"
A Fabled Iraqi Instrument Thrives in Exile,2008-05-01,article,News,,"['Censorship', 'Music', 'Culture', 'IMMIGRATION AND REFUGEES']"
Corrections: For the Record,2008-05-01,article,Correction,,[]
Correction: Little Hedge Fund on the Prairie,2008-05-01,article,Correction,,[]
"If You Can't Be in the Stadium, the Scoreboard Can Come to You",2008-05-01,article,News,,"['Baseball', 'Computers and the Internet']"
The Quad’s Countdown,2008-05-01,article,News,,[]
Respond to Today’s Column: How Will It Play in Apex?,2008-05-01,article,News,,[]
Roger Goodell Interview Transcript,2008-05-01,article,News,,[]
London Mayoral Election Seen as Close,2008-05-01,article,News,,[]
Madonna at Roseland Ballroom,2008-05-01,multimedia,Slideshow,,['Rock Music']
The Wayward Bus Metaphor,2008-05-01,article,News,,[]
"‘Bad Trips, Freak-Outs and …’",2008-05-01,article,News,,[]
"AT&T Launches TV Service on Cell Phones, Rivaling Verizon",2008-05-01,article,News,,[]
Turner’s Value to Time Warner,2008-05-01,article,News,,[]
Big Plans in Inner Mongolia,2008-05-01,multimedia,Slideshow,,"['ARCHITECTURE', 'Housing']"
Abdul’s Review of a Dress Rehearsal Raises Questions For ‘Idol’,2008-05-01,article,News,,[]
Former Monster Executive Is Indicted,2008-05-01,article,News,,[]
WorkLight Burns Bright With $12 Million in Fresh Funding,2008-05-01,article,News,,[]
Wachovia May Take Charge of Up to $1 Billion After Ruling,2008-05-01,article,News,,[]
"Despite Gloomy Conditions, Private Equity Firms Book Gains",2008-05-01,article,News,,[]
Pimco Looking to Hire Wall Street Layoffs,2008-05-01,article,News,,[]
Private Equity Bidders Vie for 3i’s Ambea,2008-05-01,article,News,,[]
"Kleiner to Announce $500 Million Green Fund, Report Says",2008-05-01,article,News,,[]
