headline,date,doc_type,material_type,section,keywords
Lehman is Dead — Long Live Lehman!,2010-04-16,article,,,[]
"Only 60% of C.D.S.’s Should Clear Centrally, Analysts Say",2010-04-16,article,,,['Derivatives (Financial Instruments)']
In Defense of Pit Bulls,2010-04-16,article,,,[]
Analyst Raises Possibility of German Exit From Euro Zone,2010-04-16,article,,,[]
Tebow and Other Draft Enigmas: Where Will They Land?,2010-04-16,article,,,[]
"Income Falls, but G.E. Tops Forecasts",2010-04-16,article,News,,['Company Reports']
Stray Questions for: Tom McCarthy,2010-04-16,article,News,,[]
Goldman Director Decided to Leave After Notice,2010-04-16,article,,,[]
A Private Plan for a Hydrogen Highway,2010-04-16,article,,,[]
BofA Earns $3.2 Billion in 1st-Quarter Profit,2010-04-16,article,,,['Credit']
Boy Scouts Add a New Digital Badge,2010-04-16,article,,,"['Global Positioning System', 'Navigation']"
"Bank of America, With Merrill’s Help, Returns to Profit",2010-04-16,article,News,,['Company Reports']
Debating the ‘Tax Burden’,2010-04-16,article,News,,[]
South Korea Says Ship Sank After ‘External Explosion’,2010-04-16,article,News,,"['Ships and Shipping', 'Explosions']"
What Clark Hoyt Said,2010-04-16,article,,,[]
The Worst of Times,2010-04-16,article,,,[]
Tip of the Week: WordPad in Windows 7,2010-04-16,article,,,[]
Flight Chaos Sends Businesses Scrambling,2010-04-16,article,News,,"['AIRLINES AND AIRPLANES', 'Insurance', 'Volcanoes']"
"Sampler: Lawsuit Seeks Suede Nightclub Closure, and Palm Fronds For Oakland Elephants",2010-04-16,article,,,[]
Chinese Premier Visits Tibetan Quake Survivors,2010-04-16,article,News,,['Earthquakes']
Miss Liberty From Every Angle,2010-04-16,article,,,[]
"After the Housing Bust, Construction Shows Life",2010-04-16,article,News,,"['United States Economy', 'Housing Starts']"
The Early Word: Visitation Rights,2010-04-16,article,,,[]
Will Premium Subsidies Be Based on Personal Assets?,2010-04-16,article,,,[]
Toyota Passes Test Its Lexus Cousin Failed,2010-04-16,article,News,,"['Automobile Safety Features and Defects', 'Automobiles', 'Sports Utility Vehicles and Light Trucks']"
Return of a Rock Star That Didn’t Cross Over,2010-04-16,article,News,,"['Reviews', 'Automobiles']"
Italian Model Goes on a High-Carbon Diet,2010-04-16,article,News,,['Automobiles']
European Airports Close for Second Day as Ash Spreads,2010-04-16,article,,,[]
"Speed Read for Friday, April 16",2010-04-16,article,,,[]
Shoe Shiner Arrested for Arson Keeps Shining,2010-04-16,article,,,[]
"Reading, Riding, Wristmanship",2010-04-16,article,News,,"['Motorcycles, Motor Bikes and Motorscooters', 'Books and Literature']"
Samurai Shopper | Raising the Bar,2010-04-16,article,,,[]
Should You Tell the Employees?,2010-04-16,article,,,[]
Wall Street’s Win Streak Ends at 6,2010-04-16,article,News,,"['Company Reports', 'Stocks and Bonds']"
Complaint Box | Lunches and Landfills,2010-04-16,article,,,[]
Mr. Softee Fill-In,2010-04-16,article,,,[]
Updates on the Volcanic Ash Cloud,2010-04-16,article,,,[]
Graphic Book Best-Sellers: A Big Piece of the Pie for ‘One Piece’,2010-04-16,article,News,,[]
Flying Start to Chinese Grand Prix Weekend,2010-04-16,article,News,,[]
"Baby, It’s Hot Inside",2010-04-16,article,,,[]
"In China, Loan Regulations Without a Loophole",2010-04-16,article,,,['Regulation and Deregulation of Industry']
The Right to Rent,2010-04-16,article,,,[]
A Refund From the Reserves,2010-04-16,article,,,[]
Just How Russian Was Stravinsky?,2010-04-16,article,News,,['Classical Music']
"In a Foreclosure, Who Gets the Rent?",2010-04-16,article,,,[]
Week Ahead: April 18 — 24,2010-04-16,article,News,,[]
Theater Prizes Are Awarded,2010-04-16,article,News,,[]
"‘Rough Justice’ for Eliot Spitzer, in Book and Movie Form",2010-04-16,article,News,,[]
U.A.W. President Says ‘Things Are Turning Around’,2010-04-16,article,,,[]
Truth and Consequences,2010-04-16,article,Review,,['Books and Literature']
Oracle to Buy Phase Forward for $685 Million,2010-04-16,article,,,"['Mergers, Acquisitions and Divestitures', 'Software']"
Upstart With the Marks of Experience,2010-04-16,article,News,,['Dancing']
Mayor John Lindsay,2010-04-16,multimedia,Interactive Feature,,['Mayors']
‘I’ Exam,2010-04-16,article,Review,,['Books and Literature']
S.E.C. Accuses Goldman of Fraud in Housing Deal,2010-04-16,article,News,,"['Securities and Commodities Violations', 'Collateralized Debt Obligations', 'Subprime Mortgage Crisis', 'Mortgages']"
Those Who Wait,2010-04-16,article,Review,,['Books and Literature']
"Flexible Spending, a Little Less So",2010-04-16,article,News,,"['Doctors', 'Medicine and Health', 'Tax Deductions', 'Health Insurance and Managed Care', 'Reform and Reorganization']"
New Law Lowers Flex-Spending Benefit,2010-04-16,article,,,[]
Newspaper Advertising Decline is Slowing Markedly at Gannett,2010-04-16,article,,,"['ADVERTISING AND MARKETING', 'Company Reports', 'Newspapers']"
S.E.C. Accuses Goldman of Fraud in Mortgage Deal,2010-04-16,article,,,"['Hedge Funds', 'Housing and Real Estate', 'Mortgages', 'Securities and Commodities Violations', 'Subprime Mortgage Crisis', 'Suits and Litigation']"
Friday Reading: Getting More for Your Money in Europe,2010-04-16,article,,,[]
Overextended Family,2010-04-16,article,Review,,"['Books and Literature', 'Parenting', 'Families and Family Life']"
And Now for Something Completely Different: Terry Gilliam’s First Opera,2010-04-16,article,News,,[]
We Three Things | Lip Reading,2010-04-16,article,,,[]
Fashion Hotel Opens in New York City,2010-04-16,article,,,[]
The Making of the iPad Town Hall Video,2010-04-16,article,,,[]
Weighing the Evidence on Exercise,2010-04-16,article,News,,"['Calories', 'Exercise', 'Weight']"
An Unnecessary Law,2010-04-16,article,Letter,,"['Housing and Real Estate', 'Cooperatives']"
"My Daughter, the User",2010-04-16,article,Review,,"['Books and Literature', 'Drug Abuse and Traffic']"
Loyal Alumni,2010-04-16,article,Letter,,"['Education and Schools', 'Historic Buildings and Sites']"
View From the Corner,2010-04-16,article,Review,,"['Boxing', 'Books and Literature']"
London Dance Journal: Mark Morris Makes a Visit,2010-04-16,article,News,,[]
What Happens to All Those No. 42 Jerseys?,2010-04-16,article,,,[]
"Daryl F. Gates, L.A.P.D. Chief in Rodney King Era, Dies at 83",2010-04-16,article,Obituary (Obit),,"['Drug Abuse Resistance Education (DARE)', 'Race', 'Police Brutality and Misconduct', 'Crime and Criminals', 'Police', 'Deaths (Obituaries)']"
Syllabus Sampler,2010-04-16,multimedia,Interactive Feature,,"['Computers and the Internet', 'Education and Schools', 'Colleges and Universities']"
The Paper Debate,2010-04-16,article,News,,"['Education and Schools', 'Debating', 'Colleges and Universities', 'Computers and the Internet']"
Postmodernspeak,2010-04-16,article,News,,['Colleges and Universities']
Elementary: Quiz Answers,2010-04-16,article,News,,[]
Training Teacher’s Pe(s)ts,2010-04-16,article,News,,"['Colleges and Universities', 'Education and Schools', 'Customs, Etiquette and Manners', 'Teachers and School Employees']"
Finding a Gay-Friendly Campus,2010-04-16,article,News,,"['Education and Schools', 'Colleges and Universities']"
F.A.Q.,2010-04-16,article,News,,"['Education and Schools', 'Internships', 'Labor and Jobs', 'Colleges and Universities']"
The Long-Haul Degree,2010-04-16,article,News,,"['Education and Schools', 'Graduate Schools and Students', 'Colleges and Universities']"
My Teacher Is an Index,2010-04-16,article,News,,['Education and Schools']
If You Go…,2010-04-16,article,News,,"['Dormitories', 'Bathrooms and Toilets', 'Colleges and Universities']"
Asian Culture Through a Lens,2010-04-16,article,News,,"['Education and Schools', 'Colleges and Universities', 'Computers and the Internet']"
The Matrix,2010-04-16,article,News,,"['Mathematics', 'Computers and the Internet', 'Colleges and Universities']"
Exactly How Personal Is That Personal Statement?,2010-04-16,article,News,,"['Plagiarism', 'Software', 'Colleges and Universities', 'Education and Schools']"
Audit This,2010-04-16,article,News,,"['Colleges and Universities', 'Computers and the Internet', 'Education and Schools']"
Are Business Schools Failing?,2010-04-16,article,News,,"['Education and Schools', 'Colleges and Universities']"
How to Learn Something for Nothing,2010-04-16,article,News,,"['Education and Schools', 'Colleges and Universities', 'Computers and the Internet']"
Why We Go Cuckoo for …,2010-04-16,article,News,,"['Education and Schools', 'Computers and the Internet', 'Food', 'Colleges and Universities']"
Atoms and Antimatter,2010-04-16,article,News,,"['Manhattan Project', 'Colleges and Universities', 'Computers and the Internet']"
Voilà! A Better e-Course,2010-04-16,article,News,,"['Education and Schools', 'Computers and the Internet']"
The Inner Body,2010-04-16,article,News,,"['Computers and the Internet', 'ANATOMY AND PHYSIOLOGY', 'Colleges and Universities']"
An Open Mind,2010-04-16,article,News,,"['Computers and the Internet', 'Recordings and Downloads (Video)', 'Colleges and Universities']"
Decoding DNA,2010-04-16,article,News,,"['Genetics and Heredity', 'DNA (Deoxyribonucleic Acid)']"
They Have a Class for That,2010-04-16,article,News,,"['Education and Schools', 'Software', 'iPhone', 'Colleges and Universities']"
Elementary,2010-04-16,article,News,,"['Education and Schools', 'Intelligence Tests']"
"The Examined Life, Age 8",2010-04-16,article,News,,"['Education and Schools', 'Children and Youth', 'Philosophy']"
The Music Lesson,2010-04-16,article,News,,"['Education and Schools', 'Music', 'Computers and the Internet']"
Living With the Boss,2010-04-16,article,News,,"['Education and Schools', 'Careers and Professions', 'Internships', 'Colleges and Universities']"
"Smiles, Sex and Object Permanence",2010-04-16,article,News,,"['Psychology and Psychologists', 'Colleges and Universities']"
Paying for College on Your Own,2010-04-16,article,News,,"['Education and Schools', 'Student Loans', 'Tuition', 'Colleges and Universities']"
What They’re Watching,2010-04-16,article,List,,"['Science and Technology', 'Computers and the Internet', 'Education and Schools']"
The Marvel of Science,2010-04-16,article,News,,"['Computers and the Internet', 'Science and Technology']"
Acura Recalling 2010 ZDX for Air Bag Problem,2010-04-16,article,,,[]
How a Roth I.R.A. Conversion Can Hurt Financial Aid,2010-04-16,article,,,[]
Budget Ax Falls in Vance’s Office,2010-04-16,article,,,[]
Tocqueville: The Novel,2010-04-16,article,Review,,"['Books and Literature', 'Travel and Vacations']"
Living in a Commercial Space,2010-04-16,multimedia,Interactive Feature,,['Housing and Real Estate']
Born a Store,2010-04-16,article,News,,"['Windows', 'Housing and Real Estate']"
"Youth, ‘Fossils’ and Planetary Progress",2010-04-16,article,,,[]
McCann Erickson Sues Kirshenbaum Bond Senecal Over Senecal,2010-04-16,article,,,"['Executives and Management', 'Suits and Litigation']"
Did I Mention the Graves Out Back?,2010-04-16,article,News,,"['Tombs and Tombstones', 'Housing and Real Estate', 'Cemeteries']"
Tocqueville: The Life,2010-04-16,article,Review,,['Books and Literature']
Josh Hamilton’s Perspective on Ron Washington,2010-04-16,article,,,[]
Halfway Between New York and Philadelphia,2010-04-16,article,News,,['Housing and Real Estate']
Dr. Does-It-All,2010-04-16,article,News,,"['Doctors', 'Medicine and Health', 'Television']"
The Step-by-Step Four-Story Renovation in the West Village,2010-04-16,article,News,,"['Restoration and Renovation', 'Historic Buildings and Sites', 'Housing and Real Estate']"
An Apartment With Laundry on the Premises,2010-04-16,article,News,,"['Restoration and Renovation', 'Laundries and Laundry Aids', 'Housing and Real Estate']"
Christopher Albanese,2010-04-16,article,Interview,,['Housing and Real Estate']
Sales Pace Moves From Walk to Trot,2010-04-16,article,News,,"['Housing and Real Estate', 'Prices (Fares, Fees and Rates)']"
Luxury Condos for Princeton,2010-04-16,article,News,,"['Condominiums', 'Affordable Housing', 'Housing and Real Estate']"
"Bucks, Thunder Got Their Biggest Lift From the Top",2010-04-16,article,,,[]
Forecasts for Underwater Owners,2010-04-16,article,News,,"['Mortgages', 'Housing and Real Estate', 'Forecasts', 'Credit']"
Playing the Ball Correctly From Damaged Ground,2010-04-16,article,,,[]
Contractors on Call to Prepare Houses for Sale,2010-04-16,article,News,,"['Housing and Real Estate', 'Sales']"
Google Battles Bad Spellers,2010-04-16,article,,,[]
Middle East Boyhood,2010-04-16,article,Review,,"['Americans Abroad', 'United States International Relations', 'Books and Literature', 'Palestinians']"
Weekend Competition: Whelmed by Outunendo,2010-04-16,article,,,[]
Dear FloFab: My Boyfriend Was Raised by Wolves,2010-04-16,article,,,[]
A Ripe Old Age,2010-04-16,article,Review,,"['Books and Literature', 'Sex']"
Magic Monsters,2010-04-16,multimedia,Slideshow,,['Art']
Don’t Have a Nice Day,2010-04-16,article,Review,,['Books and Literature']
Obama Pushes for D.C. Voting Rights,2010-04-16,article,,,[]
Collateral Damage,2010-04-16,article,Review,,"['Books and Literature', 'Iraq War (2003- )']"
Milan Report | Saved By Droog,2010-04-16,article,,,[]
She’s Come Undone,2010-04-16,article,,,[]
Spitzer Antagonist Advises Ex-Madam’s Campaign,2010-04-16,article,News,,"['Prostitution', 'Politics and Government']"
An Unexpected Death,2010-04-16,article,Review,,['Books and Literature']
Experts Seek Clues to How Long Eruption Will Go On,2010-04-16,article,News,,"['Volcanoes', 'Science and Technology']"
Pride and Popularity,2010-04-16,article,Review,,"['Writing and Writers', 'ADVERTISING AND MARKETING', 'Books and Literature']"
Is YouTube’s Safety Mode Safe? Not Very.,2010-04-16,article,,,[]
Five Ways to Marinate Vegetables,2010-04-16,article,,,[]
"TimesCast | April 16, 2010",2010-04-16,multimedia,Video,,"['Volcanoes', 'Civil Rights and Liberties']"
"Icelandic Volcano Casts a Shadow Over Indio, Calif.",2010-04-16,article,News,,[]
Travel Deals: European Flight and Hotel Sale,2010-04-16,article,,,[]
"Let the Playoffs, and the Hand-Wringing, Begin",2010-04-16,article,News,,"['Playoff Games', 'Hockey, Ice']"
Gomez Finds Scoring Touch With Puebla,2010-04-16,article,,,[]
"For Oil Sands Project,  a Step Forward",2010-04-16,article,,,[]
The Fat Trap,2010-04-16,article,News,,"['Obesity', 'Parenting', 'Weight', 'Children and Youth']"
Taxes on the Rich vs. the Merely Affluent,2010-04-16,article,News,,[]
Everybody’s Doing the Co-opting a Name Thing,2010-04-16,article,,,[]
Body Talk,2010-04-16,article,Interview,,[]
Wellness,2010-04-16,article,News,,['English Language']
Weinsteins Get Exclusive Window to Close a Deal to Reclaim Miramax,2010-04-16,article,,,"['Mergers, Acquisitions and Divestitures', 'Movies']"
Charles Schwab Stops Offering 2 Percent Credit Cards,2010-04-16,article,,,[]
The Anatomy of Desire,2010-04-16,article,News,,"['Blindness', 'Psychology and Psychologists', 'Research']"
"McMillan, Adelman Did More With Less",2010-04-16,article,,,[]
Vanderbilt or Yale?,2010-04-16,article,,,[]
Chart: MGMT’s ‘Congratulations’,2010-04-16,article,News,,[]
Apple Invites Pulitzer Winner to Resubmit His Rejected iPhone App,2010-04-16,article,,,"['Awards, Decorations and Honors', 'Cartoons and Cartoonists', 'Computers and the Internet', 'iPhone', 'Pulitzer Prizes', 'Software']"
Healthy Talk About Food With Kids,2010-04-16,article,,,[]
Unhappy With Your Looks? Or Is It a Disorder?,2010-04-16,article,,,[]
New Yorkers Get Average Grade on Census,2010-04-16,article,,,[]
‘Do You Love Your Freedom?’,2010-04-16,article,,,[]
"Calculating Your Tax Bill, on the Go",2010-04-16,article,,,[]
Your Playoff Theme? “Amazing is…”,2010-04-16,article,,,[]
‘A Lot of Dependents’,2010-04-16,article,,,[]
Lessons in 20th-Century History,2010-04-16,article,News,,"['DVD (Digital Versatile Disc)', 'Blacks', 'Black People', 'Movies']"
Baghdad: The Traffic Is Murder,2010-04-16,article,,,[]
Talking About the Roman Catholic Church and the Sex Abuse News,2010-04-16,article,,,[]
Naked Ambition,2010-04-16,article,News,,['Fashion and Apparel']
Naked Ambition,2010-04-16,article,,,[]
Financial Tuneup: Check Your Credit Reports Free,2010-04-16,article,,,[]
Advertisers Line Up for ‘Sex and the City’ Sequel,2010-04-16,article,,,"['ALCOHOLIC BEVERAGES', 'Movies']"
Another Casting Change for Patton Oswalt,2010-04-16,article,News,,[]
A ‘Wire’ Star Redirects His Electricity,2010-04-16,article,News,,"['Movies', 'Television']"
Must See: And the Awards Go To …,2010-04-16,article,,,[]
Excerpt: 'Friday Night Lights',2010-04-16,multimedia,Video,,[]
Book Review Podcast: Anna Quindlen,2010-04-16,article,News,,[]
‘Good News for the Young Gay Applicant’,2010-04-16,article,,,[]
"No Gold, but Something Better: Going Home",2010-04-16,article,News,,"['Snowboarding', 'Sports Medicine']"
"Answers About Child-Friendly New York, Part 3",2010-04-16,article,,,[]
Book Review Podcast: Anna Quindlen,2010-04-16,article,News,,[]
Q. & A. With Sam Sifton (Round Two),2010-04-16,article,,,[]
Goldman’s Stock Loss Dwarfs Possible Penalty,2010-04-16,article,,,"['Fines (Penalties)', 'Mortgages', 'Securities and Commodities Violations', 'Stocks and Bonds', 'Subprime Mortgage Crisis']"
"S.E.C. Inquiry May Widen, Khuzami Hints",2010-04-16,article,,,"['Banks and Banking', 'Collateralized Debt Obligations', 'Credit Default Swaps', 'Hedge Funds', 'Housing and Real Estate', 'Mortgages', 'Securities and Commodities Violations', 'Suits and Litigation']"
PharmVille: Dr. Bob’s Web Site,2010-04-16,article,News,,"['Mental Health and Disorders', 'Computers and the Internet']"
The Cecil B. DeMille of Movie Lists,2010-04-16,article,News,,['Movies']
Kane’s Twist on Playoff Hair: It’s in Back,2010-04-16,article,,,[]
"Bringing Up Baby, Dirt and All",2010-04-16,article,Question,,"['Dating (Social)', 'Customs, Etiquette and Manners', 'Friendship']"
Treating a Son’s O.C.D.,2010-04-16,article,Question,,"['Medicine and Health', 'Obsessive-Compulsive Disorder', 'Ethics', 'Blood Donation']"
‘The Lake Shore Limited’,2010-04-16,article,First Chapter,,['Books and Literature']
History From Unexpected Characters,2010-04-16,article,News,,['Television']
"Arts & Leisure Preview: Courtney Love, Demi Moore, Idris Elba and More",2010-04-16,article,News,,[]
Weinsteins Get Window for Miramax Deal,2010-04-16,article,,,[]
Toyota Admits Lexus Safety Problem,2010-04-16,article,,,[]
The Morning Skate: What’s Wrong with Ovechkin and Other Cup Mysteries,2010-04-16,article,,,[]
Face Booking | Benetton Casts a Wide Net,2010-04-16,article,,,[]
"From Natalie Merchant, a Literary Tour",2010-04-16,article,News,,['Music']
‘Parrot and Olivier in America’,2010-04-16,article,First Chapter,,['Books and Literature']
British Leaders’ Debate in 60 Seconds,2010-04-16,article,,,[]
Community Advocate to Challenge Espada,2010-04-16,article,,,[]
Media Decoder: Apple Invites Pulitzer Winner to Resubmit Rejected App,2010-04-16,article,,,[]
"In Global Unemployment, a Sea of Young Faces",2010-04-16,article,News,,"['Labor and Jobs', 'Unemployment', 'Economic Conditions and Trends', 'Recession and Depression']"
Exploiting Kids on YouTube?,2010-04-16,article,,,[]
"In Bear Times, a Bull Market for Sitcoms",2010-04-16,article,News,,['Television']
What Goldman’s Conduct Reveals,2010-04-16,article,,,[]
"Poland Grieves, but With Few Tears",2010-04-16,article,,,[]
Sun Setting on Duncan’s Dominance,2010-04-16,article,,,[]
"Trusted Adviser, or Counterparty?",2010-04-16,article,News,,[]
There’s a Theorbo in the Rock Bin,2010-04-16,article,News,,['Music']
"After Strong Year for Hedge Funds, Investors Return",2010-04-16,article,News,,"['Stocks and Bonds', 'Hedge Funds']"
Europe Moves Toward Tougher Bank Supervision,2010-04-16,article,,,['Regulation and Deregulation of Industry']
Coming Back to Hedge Funds,2010-04-16,article,,,[]
Q. & A. With Sam Sifton (Round Three),2010-04-16,article,,,[]
Milan Report | Rossana Orlandi Presents,2010-04-16,article,,,[]
"Is Deutsche Bank in, or Out of, Trouble?",2010-04-16,article,News,,[]
Sunday Preview,2010-04-16,article,,,[]
Republicans Grill Appeals Court Nominee,2010-04-16,article,,,[]
Iceland Volcano Spews Consonants and Vowels,2010-04-16,article,,,[]
Pictures of the Day: Rescue Efforts in China and Frustration in Europe,2010-04-16,article,,,[]
"Chatting Up the Trophy Girl, Toddler Style",2010-04-16,article,News,,['Love (Emotion)']
Chic In Review | The Book on Alexander McQueen,2010-04-16,article,,,[]
The Deft Dance of the Critic and Artist,2010-04-16,article,News,,[]
Letters: The Love That Dare Not Squawk Its Name,2010-04-16,article,Letter,,[]
Airline Merger Talks Renew Skepticism of Tie-Ups,2010-04-16,article,News,,"['Mergers, Acquisitions and Divestitures', 'Regulation and Deregulation of Industry', 'AIRLINES AND AIRPLANES']"
Letters: A Closer Reading of Roman Vishniac,2010-04-16,article,Letter,,[]
Letter: Questions for Rand Paul,2010-04-16,article,Letter,,[]
"Behavior: Few Young Men Counseled on Sexual Health, Study Finds",2010-04-16,article,News,,"['Medicine and Health', 'Sexually Transmitted Diseases', 'Acquired Immune Deficiency Syndrome', 'Children and Youth']"
Letter: Cooking With Dexter,2010-04-16,article,Letter,,[]
Aging: Diet May Be Linked to Lower Alzheimer’s Risk in Older People,2010-04-16,article,News,,"['Dementia', 'Elderly', 'Medicine and Health', 'Research', ""Alzheimer's Disease""]"
The Man in the Grey Flannel Dishdasha?,2010-04-16,article,,,"['ADVERTISING AND MARKETING', 'Kurds']"
Formerly Unsober,2010-04-16,article,News,,['Alcohol Abuse']
"In Some Adoptions, Love Doesn’t Conquer All",2010-04-16,article,News,,"['Families and Family Life', 'ADOPTIONS']"
"From the Left Flank, Pearce Eyes World Cup Roster",2010-04-16,article,,,[]
"The Week in Culture Pictures, April 16",2010-04-16,article,News,,[]
Next Up: A Smarter Streetlight,2010-04-16,article,,,[]
Now Booking | Boca Chica in Acapulco,2010-04-16,article,,,[]
Katzenberg Talks Up 3-D at Broadcasters Convention,2010-04-16,article,,,"['ANIMATED FILMS', 'Movies', 'Three-Dimensional Devices']"
Ford Eco-Route: The Most Fuel-Efficient Path From A to B,2010-04-16,article,,,[]
Goldman Fraud Case Holds Risks for Both Sides,2010-04-16,article,,,"['Collateralized Debt Obligations', 'Hedge Funds', 'Mortgages', 'Securities and Commodities Violations', 'Suits and Litigation']"
"Comments of the Week: Robots, Nerds and Adobe Flash",2010-04-16,article,,,"['Computers and the Internet', 'Enterprise Computing', 'iPhone', 'Robots', 'Software', 'Space']"
The Enduring Relevance of a Gold-Rush Tycoon,2010-04-16,article,,,[]
Steve Jobs Says Apple Made a Mistake in Rejecting Pulitzer Winner’s App,2010-04-16,article,,,"['Cartoons and Cartoonists', 'iPad', 'iPhone', 'Pulitzer Prizes']"
South African Judge May Be Kept From Grandson’s Bar Mitzvah,2010-04-16,article,News,,[]
Footnote,2010-04-16,article,Brief,,[]
Daniel Radcliffe to Star in ‘How to Succeed’,2010-04-16,article,Brief,,[]
Terry Gilliam Takes on His First Opera,2010-04-16,article,Brief,,[]
Of Meter and Money,2010-04-16,article,Brief,,[]
Couple Honored for Years of Loyalty to Theater,2010-04-16,article,Brief,,[]
"A Brand-New Time Lord, but He Sounds Familiar",2010-04-16,article,Review,,['Television']
MySpace Offers Service for Concertgoers,2010-04-16,article,Brief,,[]
‘SNL’ Shines Brightly as ‘FlashForward’ Dims,2010-04-16,article,Brief,,[]
Pad Thai,2010-04-16,multimedia,Video,,"['Cooking and Cookbooks', 'Noodles']"
"Pad Thai, an Easy Stir-Fry",2010-04-16,article,News,,"['Noodles', 'Cooking and Cookbooks']"
A Pulitzer Winner Gets Apple’s Reconsideration,2010-04-16,article,News,,"['Cartoons and Cartoonists', 'Pulitzer Prizes', 'iPhone', 'Computers and the Internet']"
Dante’s Unearthly Story Updated for the Stage,2010-04-16,article,Review,,['Music']
Lawsuit Describes Art ‘Blacklist’ to Keep Some Collectors Away,2010-04-16,article,News,,"['Suits and Litigation', 'Art']"
A Lively Celebration of the Power of No! No!,2010-04-16,article,Review,,['Dancing']
"A Magazine, Long Gone, Is Given Digital CPR",2010-04-16,article,News,,['Magazines']
Pad Thai Doesn’t Have to Be Takeout,2010-04-16,article,,,[]
Slow-Cooking Asparagus in Paper Packets,2010-04-16,article,News,,"['Cooking and Cookbooks', 'Asparagus']"
"Next Up, Abso and Smirnie?",2010-04-16,article,,,"['ADVERTISING AND MARKETING', 'ALCOHOLIC BEVERAGES', 'Vodka']"
What We’re Reading: More Cellphones Than Toilets,2010-04-16,article,News,,[]
Reviving Liberty,2010-04-16,multimedia,Slideshow,,['Magazines']
"Demi Moore, Then and Now",2010-04-16,multimedia,Interactive Feature,,['Movies']
Detroit Seeks Exit From Doom Highway,2010-04-16,article,Review,,['Television']
Park Guide Is Equally Bright Eyed and Bushy Tailed,2010-04-16,article,,,[]
Europe’s Cloud of Ash Casts Pall Over World of Music,2010-04-16,article,News,,['Classical Music']
Goldman Fraud Case Weighs on Financial Bill,2010-04-16,article,,,"['Derivatives (Financial Instruments)', 'Law and Legislation', 'Regulation and Deregulation of Industry', 'Securities and Commodities Violations', 'Subprime Mortgage Crisis', 'United States Politics and Government']"
A $30 Cable and an iPad on a Television,2010-04-16,article,,,"['Cable Television', 'Computer Monitors', 'Computers and the Internet', 'DVD (Digital Versatile Disc)', 'iPad', 'Music', 'Recordings and Downloads (Video)', 'Software', 'Television']"
No American Left Inside,2010-04-16,article,,,"['National Parks, Monuments and Seashores']"
Iceland Volcano Disrupts Air Travel,2010-04-16,multimedia,Slideshow,,"['AIRPORTS', 'Disasters and Emergencies']"
"The Conservative Mind, Circa 2010",2010-04-16,article,,,[]
Great Tax Expectations,2010-04-16,article,News,,[]
Zimbabwe: Activists Honored by Obama are Jailed Again,2010-04-16,article,Brief,,[]
On Being an Island in a Sea of Laughs,2010-04-16,article,News,,['Theater']
