headline,date,doc_type,material_type,section,keywords
The Impact: Linebacker Rolando McClain,2010-04-23,article,,,[]
The Impact: Running Back C.J. Spiller,2010-04-23,article,,,[]
A Setback for Greece as Europe Says Deficit Is Larger Than Thought,2010-04-23,article,News,,"['Budgets and Budgeting', 'Strikes', 'Economic Conditions and Trends']"
Protecting the Street They Live On,2010-04-23,article,News,,"['Regulation and Deregulation of Industry', 'Politics and Government']"
Don’t Cry for Wall Street,2010-04-23,article,Op-Ed,,"['Regulation and Deregulation of Industry', 'Banks and Banking', 'Reform and Reorganization', 'Taxation', 'Subprime Mortgage Crisis', 'United States Economy']"
Backlash Builds in Japan to New Rules for Banks,2010-04-23,article,News,,"['Banks and Banking', 'Regulation and Deregulation of Industry', 'Economic Conditions and Trends']"
A Routine Deal Became an $840 Million Mistake,2010-04-23,article,News,,"['Frauds and Swindling', 'Banks and Banking', 'Collateralized Debt Obligations', 'Subprime Mortgage Crisis']"
The Government War,2010-04-23,article,Op-Ed,,"['Liberalism (US Politics)', 'United States Politics and Government', 'Polls and Public Opinion', 'Tea Party Movement', 'Conservatism (US Politics)']"
German Rail Operator Buys European Transportation Company,2010-04-23,article,News,,"['Mergers, Acquisitions and Divestitures', 'Railroads', 'Company Reports']"
Chilean Abuse Case Tests Loyalty of a Parish,2010-04-23,article,News,,"['Sex Crimes', 'Priests', 'Child Abuse and Neglect']"
Appeals Court Judge and U.S. Attorney Are Confirmed,2010-04-23,article,News,,"['Appointments and Executive Changes', 'United States Attorneys', 'Federal District Courts', 'United States Politics and Government']"
Ending the Slavery Blame-Game,2010-04-23,article,Op-Ed,,"['Slavery', 'Blacks', 'Black People', 'Reparations and Restitution']"
"Friend to Wall Street, Schumer Is Suddenly Quiet",2010-04-23,article,News,,"['Regulation and Deregulation of Industry', 'Banks and Banking', 'Law and Legislation']"
Round 2 in Britain: Old Guard Rebounds,2010-04-23,article,News,,"['Politics and Government', 'Debating']"
The Impact: Defensive Tackle Tyson Alualu,2010-04-23,article,,,[]
2 Mines Show How Safety Practices Vary Widely,2010-04-23,article,News,,"['Methane', 'Deaths (Fatalities)', 'Accidents and Safety', 'Mines and Mining', 'Coal']"
The Impact: Offensive Tackle Anthony Davis,2010-04-23,article,,,[]
Mr. Karzai Might Even Agree,2010-04-23,article,Editorial,,"['Frauds and Swindling', 'United States International Relations', 'Afghanistan War (2001- )', 'Foreign Aid']"
Trailblazer’s Take on Limiting Vendors,2010-04-23,article,News,,"['Parks and Other Recreation Areas', 'Vendors, Street']"
PepsiCo Raises Profit After Buying Two Bottlers,2010-04-23,article,News,,"['Company Reports', 'Reform and Reorganization', 'Soft Drinks']"
Privacy in a New World,2010-04-23,article,Editorial,,"['Text Messaging', 'Privacy', 'Fourth Amendment (US Constitution)', 'Police']"
The Impact: Running Back Ryan Matthews,2010-04-23,article,,,[]
In Antarctic Waters,2010-04-23,article,Editorial,,"['Cruises', 'Oil (Petroleum) and Gasoline', 'Ships and Shipping']"
Credit Suisse Reports a 2 Percent Rise in Profit,2010-04-23,article,News,,"['Company Reports', 'Banks and Banking', 'Stocks and Bonds']"
"Come Back, John McCain",2010-04-23,article,Editorial,,"['Hispanic-Americans', 'Immigration and Emigration']"
Plan for 34th St. Puts Buses and Feet First,2010-04-23,article,News,,"['Pedestrian Malls', 'Roads and Traffic']"
Lawmakers and Regulators Question Betting on Box Office,2010-04-23,article,News,,"['Law and Legislation', 'Movies', 'Commodities', 'Futures and Options Trading']"
The Impact: Defensive End Brandon Graham,2010-04-23,article,,,[]
The Stay-Awake Men,2010-04-23,article,,,[]
Connecticut Town Grapples With Claims of Police Bias,2010-04-23,article,News,,"['Hispanic-Americans', 'Police Brutality and Misconduct', 'Minorities', 'Discrimination', 'Police']"
"Keeping Score: 20 Innings, and Almost as Many Pitchers",2010-04-23,article,,,[]
Curbing Meth Production,2010-04-23,article,Letter,,['Methamphetamines']
Obama and the Mideast,2010-04-23,article,Letter,,"['Palestinians', 'United States International Relations']"
Evaluating Teachers,2010-04-23,article,Letter,,['Education and Schools']
Ash Reveries: In Search of Lost Time,2010-04-23,article,Letter,,"['Railroads', 'AIRLINES AND AIRPLANES']"
"Mark Twain, Literary Critic",2010-04-23,article,Letter,,['Books and Literature']
California Pensions,2010-04-23,article,Letter,,"['Pensions and Retirement Plans', 'Budgets and Budgeting']"
Apologies in the Balkans,2010-04-23,article,Letter,,['Apologies']
State Teachers’ Union Urges More Oversight of Charters,2010-04-23,article,News,,"['Education and Schools', 'Charter Schools']"
Ike Davis’s Real First Name Has a History of Its Own,2010-04-23,article,,,[]
Fencing Action,2010-04-23,article,,,[]
NY1 Is Cleared in Lawsuit but Feels Spotlight’s Glare,2010-04-23,article,News,,"['Sexual Harassment', 'Suits and Litigation', 'Discrimination', 'News and News Media', 'Decisions and Verdicts']"
The Impact: Safety Earl Thomas,2010-04-23,article,,,[]
"John Carl Warnecke, Architect to Kennedy, Dies at 91",2010-04-23,article,Obituary (Obit),,"['Deaths (Obituaries)', 'ARCHITECTURE']"
Iraq: Navy Seals Member Cleared,2010-04-23,article,Brief,,[]
"Buildings Superintendent Harassed Women, Suit Says",2010-04-23,article,News,,"['Suits and Litigation', 'Sexual Harassment', 'Sex Crimes']"
The Impact: Defensive End Jason Pierre-Paul,2010-04-23,article,,,[]
Polanski Fails to Block His Extradition,2010-04-23,article,News,,[]
"Jean Vergnes, Who Helped Open Le Cirque, Dies at 88",2010-04-23,article,Obituary (Obit),,"['Restaurants', 'Cooking and Cookbooks', 'Deaths (Obituaries)']"
Lottery Numbers,2010-04-23,article,List,,['Lotteries']
Polanski Fails to Block His Extradition,2010-04-23,article,,,[]
The Impact: Defensive End Derrick Morgan,2010-04-23,article,,,[]
The Impact: Offensive Guard Mike Iupati,2010-04-23,article,,,[]
"M. Edgar Rosenblum, Who Grew the Long Wharf Theater, Dies at 78",2010-04-23,article,Obituary (Obit),,"['Deaths (Obituaries)', 'Theater']"
The Men Behind the Liberty,2010-04-23,article,News,,['Basketball']
The Impact: Center Maurkice Pouncey,2010-04-23,article,,,[]
Colleague Disputes Case Against Anthrax Suspect,2010-04-23,article,News,,"['ANTHRAX', 'Laboratories and Scientific Equipment']"
Have You Ever Seen God and Stephen Sondheim in the Same Room?,2010-04-23,article,News,,[]
Espada’s Legacy May Be  Soundview and Sushi,2010-04-23,article,News,,"['Suits and Litigation', 'Frauds and Swindling']"
One-Fourth of Nonprofits Are to Lose Tax Breaks,2010-04-23,article,News,,"['Tax Exemptions', 'Law and Legislation', 'Taxation', 'Nonprofit Organizations']"
Once-Mighty Devils Tumble Out in First Round Again,2010-04-23,article,News,,"['Hockey, Ice', 'Playoff Games']"
The Impact: Linebacker Sean Weatherspoon,2010-04-23,article,,,[]
The Impact: Cornerback Kareem Jackson,2010-04-23,article,,,[]
Investors Resist I.P.O. Temptations,2010-04-23,article,News,,"['United States Economy', 'Initial Public Offerings', 'Stocks and Bonds', 'Gross National Product (GNP)']"
"Flying to Haiti, With Money and Purpose",2010-04-23,article,News,,"['Earthquakes', 'Humanitarian Aid']"
Stern Says to Leave the Refs Alone,2010-04-23,article,,,[]
Montana Passes the Piggy Bank for Cost-Saving Ideas,2010-04-23,article,News,,"['Governors (US)', 'Budgets and Budgeting', 'States (US)', 'Politics and Government']"
"Pakistan: More Rest, More Energy",2010-04-23,article,Brief,,[]
"Bradford Is No. 1, and Tebow Is Draft’s Surprise",2010-04-23,article,News,,"['Draft and Recruitment (Sports)', 'Football']"
The Impact: Tight End Jermaine Gresham,2010-04-23,article,,,[]
Brother of Victim in Baseball-Bat Killing Testifies in Hate-Crime Trial,2010-04-23,article,News,,['Hate Crimes']
Giants Add Acrobatic End to Defense,2010-04-23,article,News,,"['Draft and Recruitment (Sports)', 'Football']"
Germany: Merkel Says Troops Still Needed in Afghanistan,2010-04-23,article,Brief,,['Afghanistan War (2001- )']
Accidents Don’t Slow Gulf of Mexico Drilling,2010-04-23,article,News,,"['Accidents and Safety', 'Offshore Drilling and Exploration', 'Oil (Petroleum) and Gasoline', 'Environment']"
Glamour Selected as Magazine of the Year,2010-04-23,article,News,,"['Awards, Decorations and Honors', 'Magazines']"
Green Day Makes Surprise Appearance at Musical,2010-04-23,article,News,,[]
Big Bambú,2010-04-23,multimedia,Video,,"['Museums', 'Sculpture', 'Art']"
New Lawsuit Shows Letters to Vatican on Sexual Abuse Earlier Than Previously Thought,2010-04-23,article,News,,"['Sex Crimes', 'Cardinals (Roman Catholic Prelates)', 'Priests', 'Popes', 'Child Abuse and Neglect', 'Suits and Litigation']"
A Marathon Just to Reach the Start Line in London,2010-04-23,article,News,,['Running']
Obama’s NASA Blueprint Is Challenged in Congress,2010-04-23,article,News,,"['Rockets and Rocket Propulsion', 'United States Politics and Government', 'Space', 'United States Defense and Military Forces']"
The Impact: Wide Receiver Demaryius Thomas,2010-04-23,article,,,[]
"Rodriguez Earns First Save, Though It Requires Five Outs",2010-04-23,article,News,,['Baseball']
Fewer Blacks in City Could Affect the Politics,2010-04-23,article,News,,"['Politics and Government', 'Blacks', 'Black People']"
"At Evanston Train Depot, the Play Is the Thing",2010-04-23,article,News,,"['Theater', 'Stations and Terminals (Passenger)']"
Unexpected Repairs Rattle Owners of New Condos,2010-04-23,article,News,,"['Condominiums', 'Housing and Real Estate', 'Building (Construction)']"
"Capone’s Legacy Endures, to Chicago’s Dismay",2010-04-23,article,News,,['Organized Crime']
Some Lawyers Want to Keep Debt Collection Out of the Courts,2010-04-23,article,News,,"['Suits and Litigation', 'Collection Agencies']"
A Court Victory Al Gore May Not Want to Advertise,2010-04-23,article,News,,"['Photography', 'Decisions and Verdicts']"
Cornerback Wilson Adds to a Strength of the Jets’ Defense,2010-04-23,article,News,,['Draft and Recruitment (Sports)']
"For Better, for Worse",2010-04-23,article,News,,"['Homosexuality', 'Domestic Violence']"
The Impact: Offensive Tackle Bryan Bulaga,2010-04-23,article,,,[]
Indigenous Venezuelan Tradition Sparks Debate,2010-04-23,multimedia,Slideshow,,"['Indigenous People', 'Forest and Brush Fires']"
The Impact: Wide Receiver Dez Bryant,2010-04-23,article,,,[]
That Big Farm Called San Francisco,2010-04-23,article,News,,"['Gardens and Gardening', 'Environment', 'Food', 'Farmers', 'AGRICULTURE']"
The Impact: Quarterback Tim Tebow,2010-04-23,article,,,[]
Corrections,2010-04-23,article,Correction,,[]
The Impact: Defensive Tackle Dan Williams,2010-04-23,article,,,[]
The Impact: Cornerback Devin McCourty,2010-04-23,article,,,[]
The Impact: Defensive Tackle Jared Odrick,2010-04-23,article,,,[]
The Impact: Cornerback Kyle Wilson,2010-04-23,article,,,[]
The Impact: Running Back Jahvid Best,2010-04-23,article,,,[]
The Impact: Defensive End Jerry Hughes,2010-04-23,article,,,[]
The Impact: Cornerback Patrick Robinson,2010-04-23,article,,,[]
Word of the Day | rhapsodize,2010-04-23,article,,,[]
"The Brave Online World of Linking, Borrowing and Attributing (or Not)",2010-04-23,article,,,[]
Corrections,2010-04-23,article,Correction,,[]
"News Quiz | April 23, 2010",2010-04-23,article,,,[]
To See the Boy King,2010-04-23,article,,,[]
"Can Debt Collectors Overuse the Courts, and More in Friday’s Bay Area Report",2010-04-23,article,,,[]
Rainer Ganahl: ‘Language of Emigration & Pictures of Emigration’,2010-04-23,article,Review,,['Art']
William Scott,2010-04-23,article,Review,,['Art']
Dahesh Museum of Art: ‘Becoming an Artist: The Academy in 19th-Century France’,2010-04-23,article,Review,,['Art']
Corrections,2010-04-23,article,Correction,,[]
"Friend to Wall Street, Schumer Falls Quiet",2010-04-23,article,,,['Campaign Finance']
A-Rod vs. Braden: Who’s Right?,2010-04-23,article,,,[]
Abacus: From Routine Deal to Disaster,2010-04-23,article,,,[]
"For Web’s New Wave, Sharing Details Is the Point",2010-04-23,article,,,[]
Europe Says Greek Deficit Larger Than Thought,2010-04-23,article,,,[]
What’s the Coolest Thing You’ve Ever Seen in a Museum?,2010-04-23,article,,,[]
"For United, a Merger Still Looms",2010-04-23,article,,,[]
Suicide Cuisine,2010-04-23,article,,,[]
Belgium: Government Falls,2010-04-23,article,Brief,,['Politics and Government']
Investors Resist I.P.O. Temptations,2010-04-23,article,,,[]
Norris: S.E.C.’s Timing Seals Overhaul Deal,2010-04-23,article,,,[]
Turkey: Peace Process Hits Snag,2010-04-23,article,Brief,,[]
DynaVox Sees Flat Debut,2010-04-23,article,,,[]
No Bump for Alimera Sciences in Debut,2010-04-23,article,,,"['Initial Public Offerings', 'Stocks and Bonds']"
Backlash Builds in Japan to New Rules for Banks,2010-04-23,article,,,[]
Hollywood Hair Club for (Wo)Men,2010-04-23,article,,,[]
Start-Up Goes After Big Data With Hadoop Helper,2010-04-23,article,,,[]
Travelers Are Warned to Steer Clear of Bangkok,2010-04-23,article,News,,"['Demonstrations and Riots', 'Bombs and Explosives']"
Galleon Case Touches Buffett’s Goldman Deal,2010-04-23,article,,,['Insider Trading']
Global Geophysical Debut Low on Richter Scale,2010-04-23,article,,,[]
Authorities Question Betting on Box Office,2010-04-23,article,,,[]
Mitel Networks I.P.O. a ‘Disaster’,2010-04-23,article,,,"['Initial Public Offerings', 'Stocks and Bonds']"
Greece and Talk of Regulation Hamper Trading,2010-04-23,article,,,[]
Breaking Up the Banks,2010-04-23,article,,,[]
Morgan Fund Said to Win Debt Extension,2010-04-23,article,,,[]
F.D.R.’s Brief Dip Into Tidal Energy,2010-04-23,article,,,['Tidal and Wave Power']
"Trend for High, Pre-emptive Bids in Energy Deals",2010-04-23,article,,,['Oil Sands']
London’s Answer to South by Southwest,2010-04-23,article,,,[]
Get Ready for More Taxes,2010-04-23,article,News,,[]
North Korea Seizes Part of Resort Operated With South,2010-04-23,article,News,,['International Relations']
Signs of Life for Mideast Peace Talks,2010-04-23,article,News,,"['Palestinians', 'United States International Relations']"
Greece Calls for Activation of Rescue Package,2010-04-23,article,,,[]
Reviewing First Round of Draft: Big Winner Is N.F.L.,2010-04-23,article,,,[]
SPS Commerce Shares Close Up 13% in Debut,2010-04-23,article,,,['Stocks and Bonds']
"Amid Crime Surge, Caymans Call in U.K. Police",2010-04-23,article,,,[]
Clothes Do Make the Person,2010-04-23,article,,,[]
Hungary Tells Soros Fund to Pay $2.5 Million,2010-04-23,article,,,[]
Stray Questions for: Yiyun Li,2010-04-23,article,News,,[]
Profitless Codexis Bumps Up Slightly in Debut,2010-04-23,article,,,[]
BlackRock May Win $200 Billion a Year in Inflows,2010-04-23,article,,,[]
Tip of the Week: Repair Disc,2010-04-23,article,,,[]
The U.K.’s Richest Fund Mangers,2010-04-23,article,,,[]
A Greener Humvee?,2010-04-23,article,,,[]
Beijing Auto Show: Chevrolet Volt MPV5,2010-04-23,article,,,[]
"Sampler: Bill Seeks $1 Billion for Bay Restoration, and Richmond’s Sinkhole Mystery",2010-04-23,article,,,[]
Conflict of Interest for Goldman in Lloyds Deal?,2010-04-23,article,,,[]
"Dow Ends Week Up, Extending Its Streak to 5 Days",2010-04-23,article,News,,"['Economic Conditions and Trends', 'Stocks and Bonds']"
Did Broncos Make Right Call on Tebow?,2010-04-23,article,,,[]
U.S. Said to Make Plans for Shedding A.I.G. Stake,2010-04-23,article,,,['Subprime Mortgage Crisis']
Pace of Recovery in Britain Slowed by a Cold January,2010-04-23,article,News,,"['Gross Domestic Product', 'Economic Conditions and Trends']"
Wave of Fatal Bombings Widens Fissures in Iraq,2010-04-23,article,News,,"['Iraq War (2003- )', 'Terrorism']"
Feet First in a Plan for 34th Street,2010-04-23,article,,,[]
Still No Trace of Air France Jet,2010-04-23,article,News,,['Accidents and Safety']
A Greener Humvee?,2010-04-23,article,,,['Fuel Efficiency']
Sales of New Homes Soar With Help of Tax Credit,2010-04-23,article,News,,"['United States Economy', 'Durable Goods (Economic Indicator)', 'Factories and Manufacturing']"
Jon Stewart Takes On Comedy Central’s Censorship of ‘South Park’,2010-04-23,article,News,,[]
The Early Word: Wall Street Watch,2010-04-23,article,,,[]
NATO Backs Plan to Give Command to Afghans,2010-04-23,article,News,,"['Afghanistan War (2001- )', 'United States Defense and Military Forces']"
"Bishop, 73, in Belgium Steps Down Over Abuse",2010-04-23,article,News,,"['Sex Crimes', 'Priests', 'Child Abuse and Neglect']"
Are Insurance Companies Still Exempt From Antitrust Laws?,2010-04-23,article,,,[]
The National Agenda,2010-04-23,article,News,,['Music']
"In the Health Bill, a New Focus on Elder Abuse",2010-04-23,article,,,[]
What About Home Prices and Incomes?,2010-04-23,article,News,,[]
Democrats Outline Campaign Finance Bill,2010-04-23,article,,,[]
Wildlife Fill-In,2010-04-23,article,,,[]
Surreal Reveal,2010-04-23,article,,,[]
Imagining a Jet-Free Europe,2010-04-23,article,,,[]
Steal This Napkin. Feel No Guilt. Come Again.,2010-04-23,article,,,[]
"Speed Read for Friday, April 23",2010-04-23,article,,,[]
Graphic Books Best-Sellers: ‘Epic Epicness’,2010-04-23,article,News,,[]
"Club Fitting Is for Recreational Golfers, Too",2010-04-23,article,,,[]
Nocturnalist | Where the Paint Runs Wild,2010-04-23,article,,,[]
"Subway Terror Plotters Met Qaeda Leaders, Prosecutors Say",2010-04-23,article,,,[]
"Stop the Presses! Historian Says He, Not His Wife, Is Savage Online Critic",2010-04-23,article,News,,[]
Escaping the Crowds,2010-04-23,article,News,,"['Budgets and Budgeting', 'Travel and Vacations']"
Weekend Competition: Peter Piper Picked a Peck of Woodchucks,2010-04-23,article,,,[]
Screen Giant,2010-04-23,article,,,[]
When a Co-op Grows Taller,2010-04-23,article,,,[]
A Polish City Feels Its Future Has Arrived,2010-04-23,article,News,,['Travel and Vacations']
Caring for Hips and Knees to Avoid Artificial Joints,2010-04-23,article,News,,"['Knees', 'Medicine and Health', 'Sports Medicine', 'Osteoarthritis', 'ARTHRITIS AND RHEUMATISM']"
"First a New Stove, Then Higher Rent",2010-04-23,article,,,[]
Friday Reading: Indulging the Urge to Divulge,2010-04-23,article,,,[]
Taking Care of Knees and Hips,2010-04-23,article,,,[]
Subletting Your Co-op Can Cost You,2010-04-23,article,,,[]
When Pain Relievers Cause Bleeding,2010-04-23,article,,,[]
A New Character Is Arriving in Riverdale,2010-04-23,article,News,,[]
"Ford Is Recalling 33,000 Vehicles for Seat Problem",2010-04-23,article,,,[]
Cube Roots: Revisiting the Raiders and N.W.A. in Ice Cube’s ‘Straight Outta L.A.’,2010-04-23,article,,,[]
The Week Ahead: April 25 — May 1,2010-04-23,article,Schedule,,[]
Lufthansa Lounge in Munich Opens Beer Garden,2010-04-23,article,,,[]
How to Find Out if You Have Unclaimed Funds,2010-04-23,article,,,[]
Mugabe Lends Ahmadinejad His Support,2010-04-23,article,,,[]
Anatomy of an At-Bat: Braun vs. McCutchen,2010-04-23,article,,,[]
Screen Test | Rebecca Hall,2010-04-23,multimedia,Video,,[]
Stravinsky’s Identity: Don’t Pin Him Down,2010-04-23,article,Letter,,[]
State Decision Blocks Drilling for Gas in Catskills,2010-04-23,article,News,,"['Natural Gas', 'Regulation and Deregulation of Industry', 'Environment', 'Water']"
Why Dwell on Race?,2010-04-23,article,Letter,,[]
A Diet of Brutality,2010-04-23,article,Letter,,[]
Movies and Violence: Rethinking Standards,2010-04-23,article,Letter,,[]
Alexandra Lammers and Eric Hoyle,2010-04-23,article,News,,['Weddings and Engagements']
Real Violence vs. Fake,2010-04-23,article,Letter,,[]
"From Natalie Merchant, a Literary Tour",2010-04-23,article,Correction,,[]
A Value-Added Tax and the Poor,2010-04-23,article,News,,[]
Relationships and Other Possessions,2010-04-23,article,News,,['Movies']
A Tiny Piece of Hell's Kitchen,2010-04-23,multimedia,Interactive Feature,,['Housing and Real Estate']
"At City Ballet, Sweating Many Firsts",2010-04-23,article,News,,['Dancing']
Drilling All but Ruled Out in New York City’s Watershed,2010-04-23,article,,,[]
Tinkering With Taco Night,2010-04-23,article,,,[]
Complaint Box | Horns and Drivers,2010-04-23,article,,,[]
Absent Grandparents,2010-04-23,article,,,[]
Obama Slams Arizona’s Immigration Bill,2010-04-23,article,,,[]
One Man’s Trash . . .,2010-04-23,article,Review,,"['Hoarding', 'Mental Health and Disorders', 'Books and Literature']"
Parent Hood,2010-04-23,article,Review,,"['Books and Literature', 'Housing and Real Estate']"
Tebow’s Draft Magic,2010-04-23,article,News,,"['Draft and Recruitment (Sports)', 'Football']"
Dress Like You Care,2010-04-23,article,,,[]
Zipcar Expands in Europe,2010-04-23,article,,,[]
On Our Radar: Tracking Asian Monsoons,2010-04-23,article,,,[]
Reclaiming the Blood of the Havasupai,2010-04-23,article,,,[]
Does H. Sapiens Need a New Tune?,2010-04-23,article,,,[]
Fleas Hither and Thither,2010-04-23,article,,,[]
McDaniels Has Great Faith in Tebow’s Talents,2010-04-23,article,,,[]
Letter: Italy’s Home Cooks,2010-04-23,article,Letter,,[]
Letter: A Fictional Mauritius,2010-04-23,article,Letter,,[]
"A Mysterious Service From Cable, Part II",2010-04-23,article,,,[]
Correction: 36 Hours in Sydney,2010-04-23,article,Correction,,[]
Swapping Old Duds for a Good Cause,2010-04-23,article,,,[]
Beijing Auto Show: Ford Start Concept,2010-04-23,article,,,[]
A Euro-Style David vs. Minivan Goliaths,2010-04-23,article,Review,,"['Reviews', 'Vans', 'Automobiles']"
Smile on Your Face. Bugs in Your Teeth.,2010-04-23,article,News,,"['Automobiles', 'Automobile Racing']"
A Modest Car for a Man of Means,2010-04-23,article,News,,"['Collectors and Collections', 'Automobiles']"
Spreading That Secure Feeling,2010-04-23,article,News,,"['Automobiles', 'Wireless Communications', 'Computers and the Internet']"
Two Paths to Similar Ends for In-Car Data Systems,2010-04-23,article,News,,"['Automobiles', 'Wireless Communications', 'Computers and the Internet']"
M.I.T. Economist Wins John Bates Clark Medal,2010-04-23,article,News,,[]
The First Coach,2010-04-23,article,Interview,,"['Basketball (College)', 'Coaches and Managers']"
Two Chicks Very Ready to Make Music,2010-04-23,article,News,,['Country Music']
"From Jameson to Fela Kuti, Preshow Rites of a Soul Band",2010-04-23,article,Question,,['Music']
Ahab Sings! (The Whale Does Not),2010-04-23,article,News,,"['Opera', 'Classical Music']"
More Scrutiny of Lawyers in Deals Gone Bad,2010-04-23,article,,,[]
Anchors Don’t Come in Pretty Boxes,2010-04-23,article,News,,"['Love (Emotion)', 'Marriages']"
Advice from ‘Yale Mom’ for an Applicant with a Choice,2010-04-23,article,,,[]
"TimesCast | April 23, 2010",2010-04-23,multimedia,Video,,"['Finances', 'Immigration and Emigration']"
Can Big Food Fight Fat?,2010-04-23,article,,,[]
King Tut in New York,2010-04-23,multimedia,Slideshow,,['Art']
You Can Judge a Book by Its Movie,2010-04-23,article,News,,['Movies']
We Made It Ourselves | Mom-and-Pop Pop,2010-04-23,article,,,[]
Draft Q.& A. With Mike Tanier (Questions),2010-04-23,article,,,[]
Inside the List,2010-04-23,article,News,,['Books and Literature']
Editors’ Choice,2010-04-23,article,List,,['Books and Literature']
Levine’s Operation Deemed a Success,2010-04-23,article,News,,[]
Letterman: ‘Kind of Perplexing’,2010-04-23,article,,,[]
Bombings in Iraq Follow Killing of Militant Chiefs,2010-04-23,multimedia,Slideshow,,"['Bombs and Explosives', 'Terrorism', 'Shiite Muslims']"
Leno: ‘An Obama-Themed Nightclub’,2010-04-23,article,,,[]
Tech Entrepreneurs Share Sentiments in Therapy That Aren’t Fit for Twitter,2010-04-23,article,News,,"['Entrepreneurship', 'Social Networking (Internet)', 'Computers and the Internet']"
Why Women Find Their Parents Unpleasant,2010-04-23,article,News,,[]
"Adoption and Loss, From Three Angles",2010-04-23,article,News,,"['ADOPTIONS', 'Babies', 'Movies']"
When Over-Sharing Leads to Problems,2010-04-23,article,,,[]
"Jorda Piskuloska, Christopher Eilert",2010-04-23,article,News,,['Weddings and Engagements']
Not Afraid to Follow the Money,2010-04-23,article,News,,['Movies']
"In Turf Battle, City Cedes to Ball Players",2010-04-23,article,,,[]
Change in Experiment Will Delay Shuttle’s End,2010-04-23,article,News,,"['Discovery (Space Shuttle)', 'International Space Station', 'SPACE SHUTTLE', 'Science and Technology']"
‘Race’ Pays Off for Producers,2010-04-23,article,News,,[]
‘Uncollected Poems': Subtitle as Oxymoron,2010-04-23,article,News,,[]
Whaling ‘Peace Plan’ Just Less of the Same?,2010-04-23,article,,,[]
F.D.A. Steps Up Oversight of Infusion Pumps,2010-04-23,article,News,,"['Regulation and Deregulation of Industry', 'Deaths (Fatalities)', 'Accidents and Safety', 'Medical Devices', 'Medicine and Health']"
Beijing Auto Show: BMW Gran Coupé Concept,2010-04-23,article,,,[]
Book Review Podcast: Biographies of Henry Luce and Muriel Spark,2010-04-23,article,News,,[]
TimesCast: Financial Legislation,2010-04-23,article,,,[]
Top Senators on Finance Bill to Meet — on Sunday Talk Show,2010-04-23,article,,,[]
Divac Selected to Lead Serbian Olympic Committee,2010-04-23,article,,,[]
Milan Report | Pull Up a Chair,2010-04-23,article,,,[]
Cleveland Groups Team Up to Offer Stravinsky and Vonnegut,2010-04-23,article,News,,[]
Just a Moment: Photographing Ordinary Life,2010-04-23,article,,,[]
"Chelsea, 10:49 A.M.",2010-04-23,article,,,[]
The Amazing Jason Pierre-Paul,2010-04-23,article,,,[]
"Arts & Leisure Preview: ‘Friday Night Lights,’ Peter Martins, Nicole Holofcener and More",2010-04-23,article,News,,[]
Financial Tuneup: Treat Giving Like Saving,2010-04-23,article,,,[]
China Asks Monks to Leave Quake Area,2010-04-23,article,News,,"['Rescues', 'Earthquakes', 'Buddhism']"
What is the New Age of Travel?,2010-04-23,article,,,[]
Global Culture: A Scholar’s View,2010-04-23,article,Letter,,[]
Donor Takes Aim at Espada,2010-04-23,article,,,[]
"For Jamie Dimon, a Sinking Feeling About Housing",2010-04-23,article,,,[]
