headline,date,doc_type,material_type,section,keywords
Immigrant Groups and R.N.C. Split on Outcome of Meeting,2010-04-01,article,,,[]
Borders Repays $42.5 Million Loan From Ackman,2010-04-01,article,,,"['Book Trade', 'Company Reports', 'LOANS']"
The Pace of Deal-Making Picks Up,2010-04-01,article,News,,"['Mergers, Acquisitions and Divestitures', 'Banks and Banking', 'Subprime Mortgage Crisis']"
Furor Over Promotions of Palin TV Show,2010-04-01,article,,,[]
Calculating Morgan Stanley’s Fees for Citi Stock Sale,2010-04-01,article,,,"['Emergency Economic Stabilization Act (2008)', 'Subprime Mortgage Crisis']"
No Confetti as Apollo and K.K.R Move to List,2010-04-01,article,News,,"['Private Equity', 'Securities and Commodities Violations']"
Zimbabwe: New Charge in Terror Trial,2010-04-01,article,Brief,,[]
Court Requires Warning About Deportation Risk,2010-04-01,article,News,,"['Deportation', 'Crime and Criminals', 'Sixth Amendment (US Constitution)', 'Immigration and Emigration', 'Decisions and Verdicts']"
France: More Publishers Sue Google,2010-04-01,article,Brief,,"['Copyrights and Copyright Violations', 'Computers and the Internet', 'Suits and Litigation']"
"For Start-Ups, Late Bursts of Private Cash",2010-04-01,article,News,,['Venture Capital']
Belgium: Burqa Bill in Parliament,2010-04-01,article,Brief,,['Muslim Veiling']
Applications to Elite Universities Rise,2010-04-01,article,News,,"['ADMISSIONS STANDARDS', 'Colleges and Universities']"
"Texas: Changing Her Mind, Senator Says She’ll Stay",2010-04-01,article,Brief,,['United States Politics and Government']
California: Good-Bye to Ghost Fleet,2010-04-01,article,Brief,,"['Ships and Shipping', 'Environment']"
Top Bloomberg Aide Will Lead His Charity Board,2010-04-01,article,News,,"['Appointments and Executive Changes', 'Philanthropy', 'Politics and Government']"
"After 3 Days, Police Give Description of Subway Killer",2010-04-01,article,News,,"['Murders and Attempted Murders', 'Subways']"
Schedule Favors Rangers in Push for the Playoffs,2010-04-01,article,News,,"['Hockey, Ice']"
A .483 Batting Average? Not Quite Good Enough,2010-04-01,article,News,,['Baseball']
"At Law Firms, Reconsidering the Model for Associates’ Pay",2010-04-01,article,News,,"['Legal Profession', 'Wages and Salaries', 'Economic Conditions and Trends']"
Twins’ Span Hits His Mother With a Foul Ball,2010-04-01,article,News,,['Baseball']
New York and Airline to Team Up on Tourism,2010-04-01,article,News,,"['Travel and Vacations', 'ADVERTISING AND MARKETING']"
Parking Rules,2010-04-01,article,News,,['Parking']
Christie Survives His Dive Into Uncharted Political Waters. For Now.,2010-04-01,article,News,,"['Education and Schools', 'Politics and Government', 'Budgets and Budgeting']"
N.Y. Repeat Felon Law Is Found Unconstitutional,2010-04-01,article,News,,"['Crime and Criminals', 'Decisions and Verdicts', 'Appeals Courts (US)']"
Court Ruling May Imperil Florida Deal,2010-04-01,article,News,,"['Decisions and Verdicts', 'Environment']"
The Iraq Drawdown and Afghan Buildup,2010-04-01,multimedia,Video,,[]
No Shortcuts When Military Moves a War,2010-04-01,article,News,,"['Military Bases and Installations', 'Iraq War (2003- )', 'Afghanistan War (2001- )', 'United States Defense and Military Forces']"
Everyman on Everest,2010-04-01,article,,,[]
Iraq: The Wrong Type of Sand,2010-04-01,article,,,[]
Looking at the iPad From Two Angles,2010-04-01,article,News,,"['iPhone', 'iPad', 'Tablet Computers', 'Computers and the Internet']"
Bloggingheads: Avant-Garde Politics,2010-04-01,multimedia,Video,,[]
Go Mad,2010-04-01,article,News,,[]
Urban Disaster,2010-04-01,article,News,,[]
Wonder Show,2010-04-01,article,News,,[]
"Mississippi A.C.L.U. Rejects $20,000 for Alternate Prom",2010-04-01,article,News,,"['Education and Schools', 'Civil Rights and Liberties', 'Parties (Social)']"
Successes (and Some Growing Pains) at Hulu,2010-04-01,article,News,,"['Online Advertising', 'Television', 'Computers and the Internet', 'Prices (Fares, Fees and Rates)']"
Skepticism on Pledges for Haiti,2010-04-01,article,News,,"['Foreign Aid', 'Earthquakes', 'Humanitarian Aid']"
"Drill, but Not Everywhere",2010-04-01,article,Editorial,,"['Offshore Exploration and Installations', 'Oil (Petroleum) and Gasoline', 'Environment']"
A Web of Insider Trading Charges,2010-04-01,multimedia,Interactive Feature,,['Insider Trading']
Court Authorizes Inquiry of Kenyans,2010-04-01,article,News,,"['War Crimes, Genocide and Crimes Against Humanity', 'Politics and Government']"
"Rushed From Haiti, Then Jailed for Lacking Visas",2010-04-01,article,News,,"['Immigration Detention', 'Earthquakes', 'Immigration and Emigration', 'Visas']"
The Collector,2010-04-01,multimedia,Slideshow,,"['Collectors and Collections', 'Education and Schools']"
Charles Ryskamp,2010-04-01,article,Editorial,,"['Libraries and Librarians', 'Museums']"
Scions of Detroit Families Share Hockey Passion,2010-04-01,article,News,,"['Ford Field (Detroit)', 'Hockey, Ice']"
What France Can Do,2010-04-01,article,Editorial,,"['Afghanistan War (2001- )', 'Defense and Military Forces']"
Hedge Funds’ Mediocre Middlemen,2010-04-01,article,News,,"['Mutual Funds', 'Hedge Funds']"
Events in the Case of an Accused Priest,2010-04-01,article,News,,"['Child Abuse and Neglect', 'Sex Crimes']"
"China, Concubines and Google",2010-04-01,article,Op-Ed,,"['Censorship', 'United States International Relations']"
Interpreting the Test Scores,2010-04-01,article,Letter,,"['Education and Schools', 'Standards and Standardization', 'No Child Left Behind Act']"
The Real Census,2010-04-01,article,Editorial,,['Census']
"Mitt Romney, Liberal Icon",2010-04-01,article,Op-Ed,,"['Reform and Reorganization', 'Health Insurance and Managed Care', 'Law and Legislation', 'Tax Deductions']"
Rate of Caesarean Sections,2010-04-01,article,Letter,,"['Caesarean Section', 'Pregnancy and Obstetrics', 'Medicine and Health', 'Weight', 'Reform and Reorganization']"
Finding Happiness: Love Triumphs Over Work,2010-04-01,article,Letter,,"['ADULTERY', 'Marriages', 'Homosexuality']"
Are You Buying Illegal Drugs?,2010-04-01,article,Op-Ed,,"['Drugs (Pharmaceuticals)', 'Robberies and Thefts', 'Counterfeit Merchandise']"
The Pope and the Abuse Scandal,2010-04-01,article,Letter,,"['Child Abuse and Neglect', 'Christians and Christianity', 'Sex Crimes', 'Priests']"
When Israel and France Broke Up,2010-04-01,article,Op-Ed,,"['International Relations', 'United States International Relations']"
Risk Is Clear in Drilling; Payoff Isn’t,2010-04-01,article,News Analysis,,"['Offshore Exploration and Installations', 'United States Politics and Government', 'Oil (Petroleum) and Gasoline', 'Environment']"
Inquiry Into Ex-G.O.P. Leader,2010-04-01,article,News,,"['United States Politics and Government', 'Suspensions, Dismissals and Resignations']"
"Views on Reform, Then and Now",2010-04-01,article,News,,"['United States Politics and Government', 'Regulation and Deregulation of Industry']"
Militia Draws Distinctions Between Groups,2010-04-01,article,News,,"['Christians and Christianity', 'Fringe Groups and Movements']"
"U.S. Agent Infiltrated Militia, Lawyer Says",2010-04-01,article,News,,"['Fringe Groups and Movements', 'Bombs and Explosives']"
Coaches Finding No Tolerance for Losing,2010-04-01,article,News,,"['College Athletics', 'Basketball', 'Coaches and Managers']"
Where All Are Counted,2010-04-01,multimedia,Slideshow,,"['Census', 'Population']"
Trying to Break Down Resistance to the Census,2010-04-01,article,News,,"['Immigration and Emigration', 'Census', 'Volunteers']"
Mets’ Murphy Will Miss Opener With a Knee Injury,2010-04-01,article,News,,"['Sports Injuries', 'Baseball']"
Donovan (and Willard) Take Over at Seton Hall,2010-04-01,article,News,,"['Basketball', 'College Athletics', 'Coaches and Managers']"
Lavin Prepares for His Close-Up at St. John’s,2010-04-01,article,News,,"['Basketball', 'Coaches and Managers', 'College Athletics']"
"Welsh, a Coach Who Has Won, Gets a Chance to Contend at Hofstra",2010-04-01,article,News,,"['Coaches and Managers', 'College Athletics', 'Basketball']"
Like the Clues,2010-04-01,article,,,[]
Finding That Elusive One Person in Every 116 Acres in Mississippi,2010-04-01,article,News,,"['Census', 'Population']"
Inventive New Private School Hits Old Hurdles,2010-04-01,article,News,,"['Private and Sectarian Schools', 'Tuition', 'ADMISSIONS STANDARDS', 'Education and Schools']"
Pay of Hedge Fund Managers Roared Back Last Year,2010-04-01,article,News,,"['Hedge Funds', 'Executive Compensation']"
Parking Lot Is a Battleground for a Bronx Hospital and a Doctors Union,2010-04-01,article,News,,['American Recovery and Reinvestment Act (2009)']
Lottery Numbers,2010-04-01,article,List,,['Lotteries']
"Blood on Defendant’s Knife Was Victim’s, Scientist Says",2010-04-01,article,News,,"['Forensic Science', 'Hate Crimes', 'Murders and Attempted Murders']"
Empire Built by Developer Shows Signs of Distress,2010-04-01,article,News,,"['Office Buildings and Commercial Properties', 'Housing and Real Estate']"
"Few to Count, but All Eager to Get It Done",2010-04-01,article,News,,"['Census', 'Population', 'Rural Areas']"
Nets Unable to Slow Nash or the Suns,2010-04-01,article,News,,['Basketball']
Pfizer Chief Says Growth Is Imminent,2010-04-01,article,News,,"['Mergers, Acquisitions and Divestitures', 'Lipitor (Drug)', 'Drugs (Pharmaceuticals)', 'Medicine and Health']"
"David Mills, Television Writer and Producer, Dies at 48",2010-04-01,article,Obituary (Obit),,"['Writing and Writers', 'Race', 'Television', 'Deaths (Obituaries)']"
Corrections,2010-04-01,article,Correction,,[]
Tournament Tipoff: Unlikely Final Four,2010-04-01,multimedia,Video,,"['Basketball', 'NCAA Basketball Tournament (Men)']"
Deadlock Is Ending on Labor Board,2010-04-01,article,News,,"['Appointments and Executive Changes', 'United States Politics and Government', 'Organized Labor', 'Labor and Jobs']"
"Mortimer D. Sackler, Arts Patron, Dies at 93",2010-04-01,article,Obituary (Obit),,"['OxyContin (Drug)', 'Deaths (Obituaries)']"
Corrections,2010-04-01,article,Correction,,[]
"Jaime Escalante, Inspiration for a Movie, Dies at 79",2010-04-01,article,Obituary (Obit),,"['Teachers and School Employees', 'Education and Schools', 'Mathematics', 'Immigration and Emigration', 'Deaths (Obituaries)']"
Corrections,2010-04-01,article,Correction,,[]
German Cabinet Agrees on Bank Tax for Bailouts,2010-04-01,article,News,,"['Banks and Banking', 'Taxation', 'Politics and Government']"
Corrections,2010-04-01,article,Correction,,[]
Corrections,2010-04-01,article,Correction,,[]
Fed Ends Its Purchasing of Mortgage Securities,2010-04-01,article,News,,"['Banks and Banking', 'Interest Rates', 'Housing and Real Estate', 'United States Economy', 'Mortgages']"
Corrections,2010-04-01,article,Correction,,[]
Corrections,2010-04-01,article,Correction,,[]
Optimism and Doubt Feed a Duel Over Greece,2010-04-01,article,News,,"['Banks and Banking', 'Government Bonds', 'Ratings and Rating Systems']"
Haiti’s Founding Document Found in London ,2010-04-01,article,News,,"['Archives and Records', 'History', 'Earthquakes']"
Albany Misses Its Deadline on the Budget,2010-04-01,article,News,,"['Budgets and Budgeting', 'Politics and Government', 'State Legislatures']"
One Last Sitting for Holocaust Survivors,2010-04-01,article,,,[]
"Update: If You See a Quote from Professor Lirpaloof, Beware",2010-04-01,article,,,[]
Carbon Permits Said to Be in Excess in Europe,2010-04-01,article,News,,"['Carbon Dioxide', 'Greenhouse Gas Emissions']"
Fed Ends Its Purchasing of Mortgage Securities,2010-04-01,article,,,[]
A Call for Hong Kong to Clean the Air,2010-04-01,article,News,,"['Air Pollution', 'Greenhouse Gas Emissions', 'Environment']"
SS&C Tech Sees Static Debut,2010-04-01,article,,,[]
Unemployment and Inflation Rise in Europe,2010-04-01,article,News,,"['Unemployment', 'Economic Conditions and Trends', 'Inflation (Economics)']"
"Critics Exploit Télécom Suicides, Ex-Executive Says",2010-04-01,article,News,,['Suicides and Suicide Attempts']
"Peter Gowland, Pinup Photographer and Author, Dies at 93",2010-04-01,article,Obituary (Obit),,"['Deaths (Obituaries)', 'Photography', 'Movies']"
Behind the Fight to Regulate Derivatives,2010-04-01,article,,,"['Banks and Banking', 'Credit Default Swaps', 'Derivatives (Financial Instruments)', 'Futures and Options Trading', 'Law and Legislation', 'Lobbying and Lobbyists', 'Reform and Reorganization', 'Regulation and Deregulation of Industry', 'Subprime Mortgage Crisis', 'United States Politics and Government']"
Crumbling Knicks Lose in Portland,2010-04-01,article,News,,['Basketball']
How to Register a Start-Up,2010-04-01,article,,,[]
Britain Questions ‘Too Big to Fail’,2010-04-01,article,News,,"['Regulation and Deregulation of Industry', 'Banks and Banking', 'Credit Default Swaps']"
Immigrants and the Census in New York,2010-04-01,multimedia,Video,,['Immigration and Emigration']
Dr. Martens Kicks Off 50 Years of Boot Business With ‘Cover’ Campaign,2010-04-01,article,,,[]
Financial Laugh Lines,2010-04-01,article,,,[]
Funds for All,2010-04-01,article,,,[]
Hedge Funds’ Mediocre Middlemen,2010-04-01,article,,,[]
Successes (and Some Growing Pains) at Hulu,2010-04-01,article,,,[]
"At Law Firms, Reconsidering the Model for Associates’ Pay",2010-04-01,article,,,"['Bonuses', 'Economic Conditions and Trends', 'Hiring and Promotion', 'Labor and Jobs', 'Law Schools', 'Layoffs and Job Reductions', 'Legal Profession', 'Wages and Salaries']"
"Views on Reform, Then and Now",2010-04-01,article,,,[]
"For Start-Ups, Late Bursts of Private Cash",2010-04-01,article,,,"['Computers and the Internet', 'Executives and Management', 'Initial Public Offerings', 'Social Networking (Internet)', 'Start-ups', 'Venture Capital']"
No Confetti as Apollo and K.K.R Move to List,2010-04-01,article,,,"['Boards of Directors', 'Private Equity']"
Flush and Looking to Spend,2010-04-01,article,,,"['Enterprise Computing', 'Mergers, Acquisitions and Divestitures', 'Office Buildings and Commercial Properties', 'Shopping Centers and Malls']"
"Business Jets, an Economic Indicator?",2010-04-01,article,,,[]
The Pace of Deal-Making Picks Up,2010-04-01,article,,,"['Mergers, Acquisitions and Divestitures']"
Washington’s Scrap Dealers,2010-04-01,article,,,['Banks and Banking']
"News Quiz | April 1, 2010",2010-04-01,article,,,[]
Hedge Fund Managers’ Pay Roars Back,2010-04-01,article,,,[]
A Web of Insider Trading Charges,2010-04-01,article,,,['Insider Trading']
"Extreme Makeover, Wall Street Edition",2010-04-01,article,,,"['Banks and Banking', 'Executives and Management', 'Polls and Public Opinion', 'Public Relations and Publicity', 'Regulation and Deregulation of Industry', 'Subprime Mortgage Crisis']"
Optimism and Doubt in a Duel Over Greece,2010-04-01,article,,,[]
Word of the Day | paraphrase,2010-04-01,article,,,[]
Big Earners: Hedge-Fund Leaders for 2009,2010-04-01,multimedia,Slideshow,,"['Hedge Funds', 'Executive Compensation']"
Meru Networks Prices at Top of Range,2010-04-01,article,,,[]
A New Wave of Luxury Hybrids,2010-04-01,multimedia,Video,,"['Automobiles', 'New York International Auto Show']"
Mary Schapiro: A Pushover?,2010-04-01,article,,,[]
Bicycles Built for You,2010-04-01,article,,,[]
"Water, Water Everywhere",2010-04-01,article,,,[]
Britain Questions ‘Too Big to Fail’,2010-04-01,article,,,['Regulation and Deregulation of Industry']
An Up Quarter Ends With a Down Day,2010-04-01,article,,,[]
Femivores and Hegans,2010-04-01,article,,,[]
"Starting From Discount, Dai-ichi Takes Off",2010-04-01,article,,,[]
N.Y. Fed Clarifies Toxic Bear and A.I.G. Assets,2010-04-01,article,,,[]
Poor Diana – Engines Need Love Too,2010-04-01,article,News,,[]
Review: Panoramic Hindsight on Wall St. Disaster,2010-04-01,article,,,[]
"Amid Thaw, Obama Talks With Chinese Leader",2010-04-01,article,News,,"['International Trade and World Market', 'Yuan (Currency)', 'United States International Relations', 'Terrorism', 'Nuclear Weapons']"
"S.E.C. Mulls Publicizing Details, Even If You Settle",2010-04-01,article,,,[]
Opposition Boycotts in Sudan Elections,2010-04-01,article,News,,['Elections']
Citigroup’s Primerica I.P.O. Raises $320.4 Million,2010-04-01,article,,,[]
Exploring Bohemian Mumbai,2010-04-01,article,,,[]
Kleiner Doubles Down on iFund,2010-04-01,article,,,[]
Morgan Stanley Sues Former St. Louis Manager,2010-04-01,article,,,[]
UBS Brokerage Has No Plans For Split,2010-04-01,article,,,[]
Special Section: Wall Street’s Makeover,2010-04-01,article,,,"['Banks and Banking', 'Frauds and Swindling', 'Insider Trading', 'Mergers, Acquisitions and Divestitures']"
Pimco Recommends Investment in Asia,2010-04-01,article,,,[]
Broker Who Aided Dreier Sentenced to Prison,2010-04-01,article,,,[]
General Growth Files Plan to Exit Bankruptcy,2010-04-01,article,,,[]
New Directors/New Films Video: Yorgos Lanthimos,2010-04-01,article,News,,[]
"P.E.-Backed Firms Less Likely to Default, Industry Says",2010-04-01,article,,,[]
Capital Requirements Are Not Enough,2010-04-01,article,News,,[]
Cuomo Said to Investigate Ivy for Madoff Advice,2010-04-01,article,,,[]
What Gartmore Means: U.K. Bankers Are Nervous,2010-04-01,article,,,[]
"What Pranks, Jokes, Hoaxes or Tricks Have You Ever Fallen For or Perpetrated?",2010-04-01,article,,,[]
What Can Be Done to Stop Bullying?,2010-04-01,article,,,[]
Q.&A.: Backing Up a Sick iPod,2010-04-01,article,,,[]
"Sampler: Warrantless Wiretapping Ruled Illegal, and Suede Stays Closed",2010-04-01,article,,,[]
"Speed Read for Thursday, April 1",2010-04-01,article,,,[]
"The Management Styles of Harold Hooper, Cosmo G. Spacely, and Eugene H. Krabs",2010-04-01,article,,,[]
"Bloggers Assess the 2010 Yankees, Part 2",2010-04-01,article,,,[]
Medvedev Vows Harsh Tactics Against Militants,2010-04-01,article,News,,['Terrorism']
A Brooklyn Brownstone’s Costly Rescue,2010-04-01,article,,,[]
"For the Smart Grid, a ‘Synchrophasor’",2010-04-01,article,,,[]
Wall Street Ends Week Higher,2010-04-01,article,News,,"['Stocks and Bonds', 'Factories and Manufacturing']"
The Early Word: Come to Your Census,2010-04-01,article,,,[]
A System for Grading N.F.L. Draft Evaluators,2010-04-01,article,,,[]
Planned Rail Strikes in France and Britain,2010-04-01,article,,,[]
The Parents of the Bully,2010-04-01,article,,,[]
New York Times Company Sells Small Part of Its Red Sox Holdings,2010-04-01,article,,,"['Baseball', 'Fenway Park (Boston)']"
Scan Artist | Primary Resources,2010-04-01,article,,,[]
Won’t Get Fooled Again,2010-04-01,article,News,,[]
New York Auto Show: Porsche 911 GT3 R Hybrid,2010-04-01,article,,,[]
Chechen Rebel Leader Speaks via YouTube,2010-04-01,article,,,[]
Helpful Suggestions for N.H.L. Pranks,2010-04-01,article,,,[]
London Dance Journal: Troubling Signs in a Tribute to Diaghilev,2010-04-01,article,News,,[]
"In Montana, Governor Stirs Ire Over Coal",2010-04-01,article,,,[]
‘Tales of Overcoming Adversity’,2010-04-01,article,,,[]
Is It O.K. to Accept Hairdresser House Calls?,2010-04-01,article,,,[]
‘Scientists are Celebrating’,2010-04-01,article,,,[]
‘Let’s Have a Party’,2010-04-01,article,,,[]
‘Some Frightening Information’,2010-04-01,article,,,[]
Paterson Pick for Board Lacks Requirement,2010-04-01,article,News,,"['Appointments and Executive Changes', 'Philanthropy']"
Sparkly Stuff,2010-04-01,article,,,[]
Three Men in Custody in Subway Killings,2010-04-01,article,,,[]
New York Auto Show: 2011 Hyundai Equus,2010-04-01,article,,,[]
Thursday Reading,2010-04-01,article,,,[]
Plan For 2012 London Olympic Tower Is Unveiled,2010-04-01,article,News,,[]
The 21st-Century Orchestra: Now Hear It This Way,2010-04-01,article,News,,"['Recordings and Downloads (Audio)', 'Computers and the Internet', 'Music', 'Classical Music']"
Cromartie Says Jets Pieces Were Already in Place,2010-04-01,article,,,[]
Incentives Foster a Major Jump in Auto Sales,2010-04-01,article,News,,"['Automobiles', 'Sales']"
Malaysian Custody Dispute Lost Between Courts,2010-04-01,article,News,,"['Shariah (Islamic Law)', 'Courts', 'Child Custody and Support', 'Islam', 'Religion and Belief', 'Children and Youth', 'Divorce, Separations and Annulments']"
"At Hulu, the Goal Is More Episodes of More Shows",2010-04-01,article,,,[]
New York Auto Show: Porsche Cayenne S Hybrid,2010-04-01,article,,,[]
Norris Church Mailer: The Last Wife,2010-04-01,article,News,,"['Writing and Writers', 'Books and Literature']"
Hairy Comedian in Hairy Situation With Australian Prime Minister,2010-04-01,article,News,,[]
Powerhouse Gallery Is Splitting Apart,2010-04-01,article,News,,"['Art', 'Collectors and Collections']"
Did You See What She Was Reading?,2010-04-01,article,News,,[]
Yahoo Teams Up With Healthline,2010-04-01,article,,,[]
Mary Gaitskill and Wells Tower Among Public Library’s Cullman Fellows,2010-04-01,article,News,,[]
"ABC, NBC and CBS Shows Will Be Available on iPad",2010-04-01,article,,,[]
Seeing the World Through an Officer’s Eyes,2010-04-01,article,,,[]
The Calm Before the Semifinals,2010-04-01,article,News,,[]
Leonor Scherrer | Death Becomes Her,2010-04-01,article,,,[]
Retroactive Grade Inflation,2010-04-01,article,News,,[]
New York Auto Show: 2011 Kia Optima,2010-04-01,article,,,[]
"The iPad Consumer Case #1: Alone, Together, With an iPad",2010-04-01,article,,,[]
Q&A: Basque Country and the Pyrenees,2010-04-01,article,,,[]
BBC News and WNET: Together Again,2010-04-01,article,News,,[]
N.H.L. Scoreboard: Panthers’ Date With Futility,2010-04-01,article,,,[]
"Susan Tifft, Chronicler of News Dynasties, Is Dead at 59",2010-04-01,article,Obituary (Obit),,"['Newspapers', 'Books and Literature', 'Deaths (Obituaries)']"
Bishops Who Get It,2010-04-01,article,,,[]
F.S.A. Charges 7 in 2008 Insider Case,2010-04-01,article,,,[]
London Dance Journal: One Actor Who Can Really Dance,2010-04-01,article,News,,[]
Auriemma Tries to Shift Some of Connecticut’s Spotlight,2010-04-01,article,,,[]
On Generic Wine Lists,2010-04-01,article,,,[]
U.K. Court Halts Rail Strike Plans,2010-04-01,article,,,[]
Flavoring a Roast Chicken,2010-04-01,article,,,[]
Judge Acquitted in Campaign Finance Trial,2010-04-01,article,,,[]
Bucharest Bus and Tram Drivers Go on Strike,2010-04-01,article,,,[]
New York Times Co. Sells Part of Red Sox Holdings,2010-04-01,article,,,"['Baseball', 'Venture Capital']"
Signature Theater Adds ‘The Illusion’ to Its Kushner-Themed Season,2010-04-01,article,News,,[]
M.L.S. Expands Designated Player Rule,2010-04-01,article,,,[]
Coming Soon: More on the Class Act,2010-04-01,article,,,[]
New York Auto Show: 2011 Subaru WRX STI,2010-04-01,article,,,[]
Apple iPad FAQ’s,2010-04-01,article,News,,[]
"TimesCast | April 1, 2010",2010-04-01,multimedia,Video,,['iPad']
The Week Ahead | April 4 — April 10,2010-04-01,article,Schedule,,[]
Accel Invests in Personal Finance Site for Women,2010-04-01,article,,,[]
High-Yield Checking Comes With Strings Attached,2010-04-01,article,,,[]
Tech and Text: The Digital Recession,2010-04-01,article,Letter,,[]
‘Hamlet’: The Operatic Approach,2010-04-01,article,Letter,,[]
The Fate of Painting: It’s Back!,2010-04-01,article,Letter,,[]
Ethics Questions Raised for Congressmen Who Stayed at C Street House,2010-04-01,article,,,[]
Shiny Floor Shows,2010-04-01,article,,,[]
Toxic Goo (and Romance) in the Waters of the Gowanus,2010-04-01,article,,,[]
New York Auto Show: 2011 Kia Sportage,2010-04-01,article,,,[]
Dimon Defends Bank Size Against Critics,2010-04-01,article,,,"['Banks and Banking', 'Derivatives (Financial Instruments)', 'Subprime Mortgage Crisis']"
New York Auto Show: 2011 Hyundai Sonata Turbo and Hybrid,2010-04-01,article,,,[]
Vivaldi Sound Pictures (Cue Birds),2010-04-01,article,News,,['Classical Music']
What We’re Reading…,2010-04-01,article,News,,[]
U.S. Issues Limits on Greenhouse Gas Emissions From Cars,2010-04-01,article,News,,"['Greenhouse Gas Emissions', 'Fuel Efficiency', 'Automobiles']"
The Do-It-Yourself Classical Music Library,2010-04-01,article,News,,[]
BlackRock Opposes Spreading Money Fund Risks,2010-04-01,article,,,[]
"Now Grooming | A Shave and a Haircut, New Orleans Style",2010-04-01,article,,,[]
New Efficiency Standards for Water Heaters,2010-04-01,article,,,[]
Coming Visit May Signal Easing by China on Currency,2010-04-01,article,News,,"['Yuan (Currency)', 'Economic Conditions and Trends', 'International Trade and World Market']"
Apple Store Most Photographed in New York?,2010-04-01,article,,,[]
Hidden Corners of a City Within a City,2010-04-01,article,News,,['Restaurants']
When Patients Can’t Afford to Follow Up,2010-04-01,article,,,[]
The iPad Consumer Case #2: A Digital Appliance for All Appliances,2010-04-01,article,,,[]
Young Trendsetters Streak Their Hair With Gray,2010-04-01,article,,,[]
Haunted,2010-04-01,multimedia,Slideshow,,"['Art', 'Photography']"
Roundabout Brings ‘Rapture’ as ‘Lips Together’ Departs,2010-04-01,article,News,,[]
F.T.C. Is Said to Have Looked Into Amazon-Google Ties,2010-04-01,article,,,[]
When Lawyers Blog,2010-04-01,article,,,[]
iPad: Leading the Rise of the Tablets,2010-04-01,multimedia,Video,,['iPad']
Conductor Slatkin Leaves Met’s ‘La Traviata’,2010-04-01,article,News,,[]
Kangaroo Stunt to Promote Australia Boomerangs,2010-04-01,article,,,[]
Getting Rid of Norovirus,2010-04-01,article,,,[]
The iPad Consumer Case #3: A Device That Can See Through Walls,2010-04-01,article,,,[]
Media Decoded: A Video Discussion of the iPad,2010-04-01,article,,,[]
The Morning Skate: ‘The Guillotine’s Tightening’ in N.H.L. Playoff Races,2010-04-01,article,,,[]
San Francisco Entertainment Commission Fate Uncertain After It Suspends Club’s License,2010-04-01,article,,,[]
Autograph Request Catches Venditte Off Guard,2010-04-01,article,,,[]
Apple iPad FAQs,2010-04-01,article,,,[]
"Old Yankee Stadium, 9:45 A.M.",2010-04-01,article,,,[]
Primerica Climbs in First Day of Trading,2010-04-01,article,,,"['Initial Public Offerings', 'Insurance', 'Stocks and Bonds']"
