headline,date,doc_type,material_type,section,keywords
"For 50th Birthday of Shelby Cobra, Vintage Snakes Convene in California",2012-04-23,article,News,,"['Automobile Racing', 'Automobiles', 'Museums']"
Honoring a Father’s Memory With Words Carved More Deeply Than an Epitaph,2012-04-23,article,Review,,['Books and Literature']
"Deployment’s Hard Lessons for Children, and Their Teachers",2012-04-23,article,News,,"['Children and Childhood', 'Families and Family Life', 'Military Bases and Installations', 'Teachers and School Employees']"
"Jimi Hendrix, Édith Piaf and Other #KitchenPlaylist Staples",2012-04-23,article,News,,[]
Tribeca Video: Alex Karpovsky’s Pair of Firsts at the Festival,2012-04-23,article,News,,['Tribeca Film Festival (NYC)']
"For David Paterson, Next Stop: M.T.A.",2012-04-23,article,News,,['Appointments and Executive Changes']
Bill Would Crack Down on Lavish Events,2012-04-23,article,News,,[]
When Bots Attack,2012-04-23,article,News,,[]
Drilling Down: Making the Most of Cookiegate,2012-04-23,article,News,,"['Cookies', 'Public Relations and Publicity', 'Small Business']"
Vegetarian Pho With Asparagus and Noodles,2012-04-23,article,recipe,,"['Diet and Nutrition', 'Soups', 'Recipes', 'Asparagus', 'Noodles', 'Vegetarianism']"
Sudanese Warplanes Said to Attack South,2012-04-23,multimedia,Slideshow,,['Defense and Military Forces']
Sweetness That Bites Back,2012-04-23,article,Review,,"['Riesling (Wine)', 'Wines']"
"Even in a Prime Neighborhood, Some Forlorn Vacancies",2012-04-23,article,News,,['Real Estate and Housing (Residential)']
S.E.C. Charges Former Calpers Chief With Fraud,2012-04-23,article,News,,['Frauds and Swindling']
Barnes & Noble Shares Surge 18% After Jana Takes a Stake,2012-04-23,article,News,,"['Mergers, Acquisitions and Divestitures']"
A Face in the Sun,2012-04-23,article,Question,,"['Sunscreen', 'Ultraviolet Light', 'Skin', 'Vitamin D', 'Science and Technology']"
Big Price Tags Attached to Even the Littlest Leagues,2012-04-23,article,News,,"['Softball', 'Parenting', 'Sporting Goods', 'Children and Childhood', 'Baseball']"
"Netflix Added 3 Million Online Subscribers in Quarter, but Expects Slower Growth",2012-04-23,article,News,,[]
"Ravens Can Recognize Old Friends, and Foes, Too",2012-04-23,article,News,,"['Birds', 'Science and Technology']"
"Many Veterans Face Long Wait for Mental Health Evaluations, Report Finds",2012-04-23,article,News,,"['Mental Health and Disorders', 'United States Defense and Military Forces', 'Veterans']"
Portugal’s Finance Minister: We Tried Stimulus and It Didn’t Work,2012-04-23,article,News,,['European Sovereign Debt Crisis (2010- )']
More Reserve Teachers Finding Permanent Jobs,2012-04-23,article,News,,[]
TimesCast | A Farewell to New Jersey,2012-04-23,multimedia,Video,,[]
The Bill Clinton Habit,2012-04-23,article,News,,[]
A Bounty Hunter in the Big Easy,2012-04-23,multimedia,Slideshow,,"['Television', 'Bail']"
Shakespeare and the City,2012-04-23,article,News,,['Theater']
A Surprising Risk for Toddlers on Playground Slides,2012-04-23,article,News,,"['Accidents and Safety', 'Children and Childhood', 'Medicine and Health', 'Playgrounds']"
Heart Transplants for Older Patients,2012-04-23,article,News,,"['Elder Care', 'Transplants']"
Elizabeth Warren Introduces Herself to Massachusetts Voters in New Ad,2012-04-23,article,News,,['Political Advertising']
A wildlife expedition close to home; girlfriends of many species; and puncturing a myth about obesity.,2012-04-23,audio,,,['Science and Technology']
Prowling New Orleans With Guns Galore,2012-04-23,article,News,,"['Bail', 'Television']"
How Testing Is Hurting Teaching,2012-04-23,article,News,,[]
Today’s Scuttlebot: RIM Revamping and a $35 PC,2012-04-23,article,News,,[]
"Facing Cyberattack, Iranian Officials Disconnect Some Oil Terminals From Internet",2012-04-23,article,News,,"['Cyberwarfare', 'Computer Security', 'Oil (Petroleum) and Gasoline', 'Computer Malware']"
Next Up to Bat: A Whiff of the Yankees,2012-04-23,article,News,,"['Baseball', 'Perfumes and Fragrances']"
Pictures of the Day: South Sudan and Elsewhere,2012-04-23,article,News,,[]
New Editor for Chicago Sun-Times,2012-04-23,article,News,,"['Media', 'Newspapers']"
Petits Pois de L’Oustau de Baumanière,2012-04-23,article,recipe,,"['Cooking and Cookbooks', 'Recipes', 'Peas']"
Xerox Results Exceed Predictions,2012-04-23,article,News,,['Company Reports']
Provençal Peas,2012-04-23,multimedia,Slideshow,,"['Peas', 'Cooking and Cookbooks']"
Spring Brings Caviar in a Pod,2012-04-23,article,News,,"['Peas', 'Gardens and Gardening', 'Cooking and Cookbooks']"
Boehner Sees One-in-Three Chance G.O.P. Will Lose House,2012-04-23,article,News,,[]
"New Albums From Jack White, Sarah Jaffe and Kenny Garrett",2012-04-23,article,Review,,['Music']
"In Pursuit of Riches, and Travelers’ Supplies, in the Asteroid Belt",2012-04-23,article,News,,"['Mines and Mining', 'Metals and Minerals', 'Space', 'Water', 'Science and Technology', 'Asteroids']"
American Airlines Cites Progress in Labor Talks,2012-04-23,article,News,,"['Bankruptcies', 'Organized Labor', 'Labor and Jobs']"
"A Little Sondheim Music, 17 Ways, but No Words",2012-04-23,article,News,,['Music']
Behind the Story: A Cancer Doctor on Depression and the Possible Next Antidepressant,2012-04-23,article,News,,"['ANTIDEPRESSANTS', 'Depression (Mental)']"
Dancing Shoes Are Optional,2012-04-23,article,Review,,"['Music', 'Classical Music']"
American Track Gets New Leader,2012-04-23,article,News,,"['Appointments and Executive Changes', 'Track and Field', 'Olympic Games (2012)']"
"Sheep Crochets, Pig Flips, Rats Wear Parkas, and Dragon Outsmarts Man",2012-04-23,article,Review,,['Dancing']
Fly and Human Mothers Share a Milk Enzyme,2012-04-23,article,News,,"['Research', 'Breastfeeding', 'Flies', 'Science and Technology']"
The Neurological Roots of Lingering Regret,2012-04-23,article,News,,"['Science and Technology', 'Brain', 'Emotions', 'Research']"
The Path to Veganism (1 Letter),2012-04-23,article,Letter,,[]
Handle With Caution (1 Letter),2012-04-23,article,Letter,,[]
Hollywood Strivers at Home in Their Anthill,2012-04-23,article,Review,,['Television']
For All the Fish in the Sea (2 Letters),2012-04-23,article,Letter,,[]
Pho With Spinach and Tofu,2012-04-23,article,recipe,,"['Recipes', 'Cooking and Cookbooks', 'Soups', 'Noodles', 'Spinach', 'Tofu', 'Diet and Nutrition']"
"Before Its I.P.O., Google Looked Stronger Than Facebook",2012-04-23,article,News,,[]
China Extends Reach Into International Art,2012-04-23,article,News,,"['Art', 'Museums']"
Pho With Broccoli and Quinoa,2012-04-23,article,recipe,,"['Recipes', 'Diet and Nutrition', 'Medicine and Health', 'Soups', 'Quinoa', 'Broccoli']"
Too Many Receipts? A Solution in Your Pocket,2012-04-23,article,News,,"['Smartphones', 'Business Travel']"
A New Variant of Malware Takes Aim at Mac Users,2012-04-23,article,News,,"['Computer Malware', 'Computer Security']"
"Pho With Carrots, Turnips, Broccoli and Tofu",2012-04-23,article,recipe,,"['Recipes', 'Diet and Nutrition', 'Soups', 'Broccoli', 'Carrots', 'Tofu', 'Turnips', 'Noodles']"
Excerpt: 'The Lyons',2012-04-23,multimedia,Video,,['Theater']
"In Europe, Now What?",2012-04-23,article,News,,[]
His Imagination Leaps Onto the Page,2012-04-23,article,Review,,['Theater']
Romney Backs Extending Low Interest Rates on Student Loans,2012-04-23,article,News,,['Student Loans']
Not Much Suspense Likely in New York G.O.P. Primary,2012-04-23,article,News,,"['Primaries and Caucuses', 'Presidential Election of 2012']"
Two Cuban Actors in Tribeca Film Missing After Flight to Florida,2012-04-23,article,News,,['Tribeca Film Festival (NYC)']
Saints Deny Listening In on Rival Coaches,2012-04-23,article,News,,"['Wiretapping and Other Eavesdropping Devices and Methods', 'Football']"
Rubio Is Latest Possible Running Mate to Join Romney on the Campaign Trail,2012-04-23,article,News,,"['Presidential Election of 2012', 'Vice Presidents and Vice Presidency (US)', 'United States Politics and Government']"
Is Quick Therapy the Best Therapy?,2012-04-23,article,Letter,,"['Therapy and Rehabilitation', 'Psychiatry and Psychiatrists']"
Excerpt: 'Nice Work If You Can Get It',2012-04-23,multimedia,Video,,['Theater']
Virginia Tech Fires Its Men’s Coach,2012-04-23,article,Brief,,"['Basketball (College)', 'Coaches and Managers']"
Davis Drops to .136; Mets Drop to .500,2012-04-23,article,News,,['Baseball']
Benefits of Nuclear Power,2012-04-23,article,Letter,,"['Nuclear Energy', 'Alternative and Renewable Energy']"
Defense Department Plans New Intelligence Gathering Service,2012-04-23,article,News,,"['Espionage and Intelligence Services', 'International Relations', 'United States Defense and Military Forces', 'Computers and the Internet', 'Defense and Military Forces', 'Terrorism', 'Afghanistan War (2001- )', 'Iraq War (2003-11)']"
Access to Healthy Foods,2012-04-23,article,Letter,,"['Diet and Nutrition', 'Children and Childhood', 'Obesity', 'Food', 'Supermarkets and Grocery Stores']"
The Depressing Lot of the Conflicted American Mother,2012-04-23,article,News,,"['Breastfeeding', 'Children and Childhood', 'Family Leaves', 'Parenting', 'Pregnancy and Childbirth', 'Women and Girls', 'Work-Life Balance']"
When Lawyers File Suit for Accessible Workplaces,2012-04-23,article,Letter,,"['Suits and Litigation', 'Disabilities', 'AMERICANS WITH DISABILITIES ACT', 'Legal Profession']"
"Nigeria’s Population Boom: A Problem, or Not?",2012-04-23,article,Letter,,"['Population', 'Women and Girls', 'Birth Control and Family Planning', 'Economic Conditions and Trends']"
Tissue Maker Takes Flushables to Facebook,2012-04-23,article,News,,"['Online Advertising', 'ADVERTISING AND MARKETING', 'Consumer Behavior', 'Bathrooms and Toilets']"
Yankees-Rangers Will Pair Japanese Pitchers,2012-04-24,article,News,,['Baseball']
Louisiana: Prison Conditions Draw Threat ,2012-04-24,article,Brief,,"['Prisons and Prisoners', 'Police']"
A Good ‘Brain Drain’,2012-04-24,article,Letter,,"['Americans Abroad', 'Immigration and Emigration']"
Rhode Island: Pension Changes Proposed in Providence,2012-04-24,article,Brief,,['Pensions and Retirement Plans']
Numberplay Will Not Appear This Week,2012-04-24,article,News,,[]
Civilians Describe Atrocities in Blue Nile,2012-04-24,article,News,,[]
City Council to Assess Easing Steep Fines on Street Vendors,2012-04-24,article,News,,"['Law and Legislation', 'Street Vendors', 'Fines (Penalties)', 'City Councils']"
"In Barcelona, Passion and Worry Fill Air Around a Team Not Used to Losing",2012-04-24,article,News,,"['UEFA Champions League (Soccer)', 'Soccer']"
"For an Old Italian Game, a Crescendo of Sorts",2012-04-24,article,News,,"['Italian-Americans', 'Bocce (Game)']"
"As China Official Rose, His Family’s Wealth Grew",2012-04-24,article,News,,['Murders and Attempted Murders']
The Europeans Are Revolting,2012-04-24,article,News,,[]
"In a Change, Mexico Reins In Its Oil Monopoly",2012-04-24,article,News,,"['Regulation and Deregulation of Industry', 'Offshore Drilling and Exploration', 'Oil (Petroleum) and Gasoline', 'Law and Legislation']"
Peace Without Partners,2012-04-24,article,Op-Ed,,"['Palestinians', 'Israeli Settlements', 'International Relations']"
Actress Takes Stand at Trial in the Killings of Relatives,2012-04-24,article,News,,['Murders and Attempted Murders']
France Votes Its Discontents,2012-04-24,article,Editorial,,"['Elections', 'Editorials']"
Wal-Mart Stock Falls Nearly 5%,2012-04-24,article,News,,"['Foreign Corrupt Practices Act (1977)', 'Bribery and Kickbacks', 'Stocks and Bonds']"
Callous Choices in the House,2012-04-24,article,Editorial,,"['Federal Budget (US)', 'Food Stamps', 'United States Politics and Government', 'Editorials', 'United States Defense and Military Forces']"
A Would-Be Shoe Bomber Testifies in a Terror Trial,2012-04-24,article,News,,['Terrorism']
"For Bocce, a New Generation of Devotees",2012-04-24,multimedia,Slideshow,,"['Bocce (Game)', 'Italian-Americans']"
Occupy Movement Looks Toward Political Conventions,2012-04-24,article,News,,"['Republican National Convention', 'Democratic National Convention', 'Demonstrations, Protests, and Riots', 'Banking and Financial Institutions']"
Displaying Value: The Case for the Liberal Arts Yet Again,2012-04-24,article,News,,"['Books and Literature', 'Colleges and Universities', 'Humanities']"
A Test on Equal Pay,2012-04-24,article,Editorial,,"['Wages and Salaries', 'Women and Girls', 'Discrimination', 'Presidential Election of 2012', 'United States Politics and Government', 'Editorials', 'Law and Legislation']"
Ryan Seacrest to Remain as Host of  ‘American Idol’,2012-04-24,article,News,,['Television']
The Undocumented and the Unborn,2012-04-24,article,Editorial,,"['State Legislatures', 'Pregnancy and Childbirth', 'Illegal Immigrants', 'Health Insurance and Managed Care', 'Editorials']"
MetLife Settles Cases on Benefits,2012-04-24,article,News,,"['Suits and Litigation', 'Social Security (US)', 'Life Insurance']"
"George Rathmann, Amgen Chief, Dies at 84",2012-04-24,article,Obituary (Obit),,"['Deaths (Obituaries)', 'Biotechnology']"
"To Curb Rowdiness, Long Island Rail Road Will Ban Alcohol on Late-Night Weekend Trains",2012-04-24,article,News,,"['Railroads', 'ALCOHOLIC BEVERAGES']"
Hitting the Beach in Bangladesh,2012-04-24,article,News,,"['Economic Conditions and Trends', 'HOTELS AND MOTELS', 'Travel and Vacations']"
"Insurers Alter Cost Formula, and Patients Pay More",2012-04-24,article,News,,"['Prices (Fares, Fees and Rates)', 'Health Insurance and Managed Care', 'Medicare']"
Round Up the Usual Scapegoats,2012-04-24,article,Op-Ed,,"['Homosexuality', 'Discrimination', 'ANTI-SEMITISM']"
Arkansas Thinks Big in Hiring New Coach,2012-04-24,article,News,,"['Football (College)', 'Appointments and Executive Changes', 'Coaches and Managers']"
Chávez Out of Sight but Big as Life on Twitter,2012-04-24,article,News,,"['Cancer', 'Rumors']"
"A Brooklyn School Saved Lives, and Some Now Try to Return the Favor",2012-04-24,article,News,,"['Education (K-12)', 'Shutdowns (Institutional)', 'Dropouts']"
The Creative Monopoly,2012-04-24,article,Op-Ed,,"['United States Economy', 'Entrepreneurship', 'Creativity', 'Capitalism (Theory and Philosophy)']"
Talking With Your Fingers,2012-04-24,article,News,,"['E-Mail', 'Reading and Writing Skills', 'Text Messaging', 'Voice and Speech', 'Writing and Writers']"
A Reinvented Palais de Tokyo Reopens,2012-04-24,article,News,,"['Art', 'Travel and Vacations']"
Lottery Numbers,2012-04-24,article,List,,['Lotteries']
State Ponders Relinquishing Its Oversight of Vulnerable,2012-04-24,article,News,,"['Disabilities', 'Abuse of the Disabled']"
The Overrated Vice Presidential Home-State Effect,2012-04-24,article,News,,"['Presidential Election of 2012', 'Statistics']"
Report on State Agency Oversight of Vulnerable,2012-04-24,multimedia,Interactive Feature,,"['Health Insurance and Managed Care', 'Prices (Fares, Fees and Rates)']"
"Deficit, and Inconsistent Play, No Cause for Alarm to the Devils",2012-04-24,article,News,,"['Hockey, Ice', 'Playoff Games']"
"Becoming an Olympian, and Then a Newlywed",2012-04-24,article,News,,"['Weddings and Engagements', 'Olympic Games (2012)', 'Homosexuality', 'Same-Sex Marriage, Civil Unions and Domestic Partnerships', 'Wrestling']"
"‘Tainted,’ but Still Serving on Corporate Boards",2012-04-24,article,News,,"['Appointments and Executive Changes', 'Boards of Directors']"
Call for Growth to Counter German Push for Austerity,2012-04-24,article,News,,"['Budgets and Budgeting', 'European Sovereign Debt Crisis (2010- )']"
Classes Resume at Scene of Shootings in Oakland,2012-04-24,article,News,,"['Colleges and Universities', 'Korean-Americans', 'Murders and Attempted Murders']"
French Far Right a Challenge for Europe and Sarkozy,2012-04-24,article,News,,"['Voting and Voters', 'Fringe Groups and Movements', 'Elections']"
‘Ghost the Musical’,2012-04-24,multimedia,Slideshow,,['Theater']
Fees and Anger Rise in California Water War,2012-04-24,article,News,,"['Water', 'Suits and Litigation']"
"A Haunted Hotel, a Haunted Family: Who Let the Ghosts Out?",2012-04-24,article,Review,,['Theater']
Waiting for Dad to Die: Laughs Pile Up,2012-04-24,article,Review,,['Theater']
"In a Broadway Afterlife, Time Goes by So Slowly",2012-04-24,article,Review,,['Theater']
Draggin’ Girl,2012-04-24,article,News,,['Crossword Puzzles']
Bigger Role for Outside Conservative Groups,2012-04-24,multimedia,Interactive Feature,,[]
"Live and in Person, History Comes to Chicago’s Classrooms",2012-04-24,article,News,,"['Nobel Prizes', 'Education (K-12)']"
"Even as It Hurts Mexican Economy, Bribery Is Taken in Stride",2012-04-24,article,News,,"['Bribery and Kickbacks', 'International Trade and World Market', 'Economic Conditions and Trends', 'Frauds and Swindling']"
Rangers Live to Fight Another Day,2012-04-24,article,News,,"['Hockey, Ice', 'Playoff Games']"
Jeter and Rodriguez Help Yanks Prevail in Early Showdown,2012-04-24,article,News,,['Baseball']
The Mega Millions Solution,2012-04-24,article,News,,[]
Corrections: April 24,2012-04-24,article,Correction,,[]
New Fashion Wrinkle: Stylishly Hiding the Gun,2012-04-24,article,News,,"['Firearms', 'Fashion and Apparel']"
Murdochs Set to Testify Before Judicial Panel,2012-04-24,article,News,,"['Wiretapping and Other Eavesdropping Devices and Methods', 'News and News Media']"
"Player Trades: Rare in N.F.L., Common for Eagles",2012-04-24,article,News,,"['Football', 'Trades (Sports)']"
"Saying Goodbye, a Former Net Talks About the Knicks",2012-04-24,article,News,,[]
Conservative Groups Spending Heavily in Bid to Win a Senate Majority,2012-04-24,article,News,,"['Political Advertising', 'United States Politics and Government', 'Television', 'Elections', 'Elections, Senate']"
"In Egypt Race, Battle Is Joined on Islam’s Role",2012-04-24,article,News,,"['Series', 'Religion and Belief', 'Muslims and Islam', 'Elections']"
Time Expires on the Nets in New Jersey,2012-04-24,article,News,,"['Basketball', 'Relocation of Business']"
Egypt Rejects Registration Bids From 8 U.S. Nonprofit Groups,2012-04-24,article,News,,"['Nonprofit Organizations', 'Elections']"
Champions League: Chelsea Tries to Buck the System in Barcelona,2012-04-24,article,News,,"['Soccer', 'UEFA Champions League (Soccer)']"
Word of the Day | ogle,2012-04-24,article,News,,[]
Canada: Immigration Hearing for Relative of Tunisian Leader,2012-04-24,article,Brief,,['Immigration and Emigration']
S.E.C. Sues SinoTech Energy of China for Fraud,2012-04-24,article,News,,"['Securities and Commodities Violations', 'Suits and Litigation']"
Russia: Opposition Candidate Is Ending His Hunger Strike,2012-04-24,article,Brief,,"['Frauds and Swindling', 'Hunger Strikes', 'Elections']"
Russia: Police Captain Arrested in Crackdown on Corruption,2012-04-24,article,Brief,,"['Frauds and Swindling', 'Police Brutality and Misconduct', 'Police', 'Bribery and Kickbacks', 'Corruption (Institutional)']"
"In Japan, Suffer the Children",2012-04-24,article,News,,"['Anxiety and Stress', 'Depression (Mental)', 'Economic Conditions and Trends', 'Photography', 'Sex Crimes', 'Women and Girls', 'Youth']"
Power Play Is a Boost for Richards,2012-04-24,article,News,,"['Hockey, Ice', 'Playoff Games']"
Bo Xilai and Gu Kailai Family Connections,2012-04-24,multimedia,Interactive Feature,,[]
Rangers-Senators Replay: Game 6,2012-04-24,multimedia,Slideshow,,"['Hockey, Ice', 'Playoff Games']"
A Hit Maker Bets Future Earnings on India Expansion Plan,2012-04-24,article,News,,['Language and Languages']
Air National Guard Lobbies Successfully Against Budget Cuts,2012-04-24,article,News,,"['Governors (US)', 'United States Defense and Military Forces']"
"News Quiz | April 24, 2012",2012-04-24,article,News,,[]
"In an Unlikely Corner of Asia, Strong Promise of Growth",2012-04-24,article,News,,"['Economic Conditions and Trends', 'Travel and Vacations']"
A Conversation With: Zuber Jafri,2012-04-24,article,News,,"['Courts and the Judiciary', 'Families and Family Life', 'Poetry and Poets']"
"April 24, 1916 | Irish Nationalists Stage Easter Uprising in Dublin",2012-04-24,article,News,,[]
"Test Yourself | English, April 24, 2012",2012-04-24,article,News,,[]
"As Book Sales Grow, Publishers Flock to India",2012-04-24,article,News,,"['Books and Literature', 'Writing and Writers']"
"At Wal-Mart in Mexico, a Bribe Inquiry",2012-04-24,article,News,,[]
A Biscuit Tin of Memories on Film,2012-04-24,article,News,,"['Archives and Records', 'Flea Markets', 'Photography']"
Earth to Ben Bernanke,2012-04-24,article,News,,"['Economic Conditions and Trends', 'United States Economy', 'Recession and Depression', 'Labor and Jobs', 'Banking and Financial Institutions']"
Murdoch Case Shifts Its Focus to a Minister,2012-04-24,article,News,,['Wiretapping and Other Eavesdropping Devices and Methods']
Why Do You Share Photos?,2012-04-24,article,News,,[]
"Brandon Jacobs Says Goodbye, Apparently at High Speed",2012-04-24,article,News,,['Football']
Part 2: Answers to Readers’ Questions on Financial Aid,2012-04-24,article,News,,"['ADMISSIONS STANDARDS', 'Colleges and Universities', 'Financial Aid (Education)', 'Pell Grants']"
Shell Lifts Cove Energy Bid to $1.8 Billion,2012-04-24,article,News,,"['Mergers, Acquisitions and Divestitures', 'Oil (Petroleum) and Gasoline']"
The Early Word: Tryouts,2012-04-24,article,News,,[]
Insurer Details Higher Risks for Drivers After Deployment,2012-04-24,article,News,,"['Afghanistan War (2001- )', 'Iraq War (2003-11)', 'Roads and Traffic', 'Veterans']"
Fantasy Focus: On Deck,2012-04-24,article,News,,[]
Le Pen Pricks,2012-04-24,article,News,,"['Elections', 'Voting and Voters']"
Q&A: Linking iPhoto to Multiple Accounts,2012-04-24,article,News,,"['Cloud Computing', 'Software']"
Greg Cosell Has Griffin at No. 1,2012-04-24,article,News,,"['Draft and Recruitment (Sports)', 'Football']"
Art Remba Introduces ‘Rental’ Art,2012-04-24,article,News,,"['Art', 'Identification Devices', 'Indian-Americans']"
When Draft Classes Make the Biggest Difference,2012-04-24,article,News,,"['Draft and Recruitment (Sports)', 'Football']"
Behind an Owner’s Complicated Union Ties,2012-04-24,article,News,,[]
Bernanke and the Borg,2012-04-24,article,News,,[]
"Austerity And Growth, Again (Wonkish)",2012-04-24,article,News,,[]
J.P. Morgan Appoints New Asia-Pacific Head,2012-04-24,article,News,,[]
Former Apple Executive Blends Genres with iPad,2012-04-24,article,News,,"['iPad', 'Mobile Applications', 'National Parks, Monuments and Seashores', 'Travel and Vacations']"
Study Links Plant Damage to Nanoparticles,2012-04-24,article,News,,[]
G.O.P. Chairman Previews General Election Campaign,2012-04-24,article,News,,['Presidential Election of 2012']
Samsung Heirs Stage a Korean Soap Opera,2012-04-24,article,News,,"['Electronics', 'Suits and Litigation']"
Morning Take-Out,2012-04-24,article,News,,[]
Opinion Report: Equal Pay,2012-04-24,article,News,,"[""State Children's Health Insurance Program (S-CHIP)""]"
"From Bangladesh to Rochester, With a Missed Connection",2012-04-24,article,Review,,['Books and Literature']
Rain Intercedes as Parents Protest Asbestos Removal at Cobble Hill School,2012-04-24,article,News,,[]
Courtesy and History,2012-04-24,article,News,,[]
Courtesy and History,2012-04-24,article,News,,[]
CVC Capital Clinches AlixPartners Deal,2012-04-24,article,News,,[]
Muslim Women in India Seek Gender Equality in Marriage,2012-04-24,article,News,,"['Divorce, Separations and Annulments', 'Marriages', 'Muslims and Islam', 'Shariah (Islamic Law)']"
Daily Report: A Glimpse at Facebook’s Financials,2012-04-24,article,News,,['Initial Public Offerings']
Would This Post Get Me Jail Time in Russia?,2012-04-24,article,News,,"['Demonstrations, Protests, and Riots', 'Homosexuality']"
Why AT&T and Verizon Are Rooting for Windows Phones,2012-04-24,article,News,,[]
Another Passionate Plea to Save Bushwick High,2012-04-24,article,News,,[]
"Philippine Court Rules Aquino Estate Must Be Split Among 6,000",2012-04-24,article,News,,['Decisions and Verdicts']
Former Edwards Aide Testifies About Elaborate Efforts to Hide Affair,2012-04-24,article,News,,"['Presidential Election of 2008', 'United States Politics and Government', 'Frauds and Swindling', 'Campaign Finance']"
Harvard Releases Big Data for Books,2012-04-24,article,News,,['Libraries and Librarians']
Vain Glorious | The Scent of Departure,2012-04-24,article,News,,[]
"The Breakfast Meeting: Grilling for James Murdoch, and Facebook Tops 900 Million Users",2012-04-24,article,News,,[]
Image of the Day: April 24,2012-04-24,article,News,,[]
Cost of Spain’s Housing Bust Could Force a Bailout,2012-04-24,article,News,,"['Economic Conditions and Trends', 'European Sovereign Debt Crisis (2010- )', 'Real Estate and Housing (Residential)', 'Mortgages', 'Banking and Financial Institutions']"
Tuesday Reading: Knowing When to Put an End to Therapy,2012-04-24,article,News,,[]
Losing a Starring Role in the Republican Primary,2012-04-24,article,News,,['Presidential Election of 2012']
New Dolby Technology to Make Horror Movies Scarier,2012-04-24,article,News,,"['Movies', 'Speakers (Audio)']"
On Our Radar: BP Settlement Dispute,2012-04-24,article,News,,[]
Leading Off: Coaching Follies at Arkansas,2012-04-24,article,News,,"['College Athletics', 'Football', 'Hockey, Ice']"
Modi’s Ratings,2012-04-24,article,News,,"['News and News Media', 'Politics and Government']"
Man Is Accused of Killing His Half-Sister and Wounding His Mother,2012-04-24,article,News,,['Murders and Attempted Murders']
Company Admits It Bilked Clients on Big Projects,2012-04-24,article,News,,"['Frauds and Swindling', 'Building (Construction)']"
Congress Takes Fresh Look at MF Global,2012-04-24,article,News,,['Regulation and Deregulation of Industry']
N.F.L. Evolution:  The Eminence of the Left Tackle and Other Myths,2012-04-24,article,News,,['Football']
