headline,date,doc_type,material_type,section,keywords
Familiar Rivals in Final Four,2012-04-01,article,News,,['College Athletics']
The Nourse Auditorium,2012-04-01,article,News,,['Theater']
Wildcats Are Winners in Battle for Kentucky,2012-04-01,article,News,,"['Basketball (College)', 'NCAA Basketball Championships (Men)']"
Surprise in Florida Clouds Favorite’s Path to the Kentucky Derby,2012-04-01,article,News,,['Horse Racing']
"40-0 in Sight, Baylor Turns Focus to Stanford",2012-04-01,article,News,,['NCAA Basketball Championships (Women)']
The Secret Owners Behind a Prostitution Website,2012-04-01,article,News,,[]
A Study in Contrasts,2012-04-01,article,News,,"['Basketball', 'College Athletics', 'Draft and Recruitment (Sports)', 'NCAA Basketball Championships (Women)', 'Women and Girls']"
Keith Olbermann: Machine Gun for Hire,2012-04-01,article,News,,['Television']
N.C.A.A. Tournament Replay: March 31,2012-04-01,multimedia,Slideshow,,"['NCAA Basketball Championships (Men)', 'Basketball (College)']"
Romney Predicts a Victory in Wisconsin Primary,2012-04-01,article,News,,"['Presidential Election of 2012', 'Primaries and Caucuses']"
Lottery Numbers,2012-04-01,article,List,,['Lotteries']
Corrections: April 1,2012-04-01,article,Correction,,[]
Kansas Tops Ohio State in Tense Stretch Run,2012-04-01,article,News,,"['NCAA Basketball Championships (Men)', 'Basketball (College)']"
Subway Free-Ride Suspects,2012-04-01,multimedia,Video,,"['Subways', 'Robberies and Thefts']"
Chain Bandits,2012-04-01,multimedia,Video,,"['Subways', 'Robberies and Thefts']"
Recording the Crime,2012-04-01,multimedia,Video,,"['Subways', 'Robberies and Thefts']"
"Jamie Rosenkrantz, Joshua Spoont",2012-04-01,article,News,,['Weddings and Engagements']
"Tracey Lomrantz, Eric Lester",2012-04-01,article,News,,['Weddings and Engagements']
"Emily Siguler, Langdon Mitchell",2012-04-01,article,News,,['Weddings and Engagements']
"Pamela Bookbinder, Ernest Clarke",2012-04-01,article,News,,['Weddings and Engagements']
"Eileen Shy, Andrew Ormson",2012-04-01,article,News,,['Weddings and Engagements']
"Monica Malone, Mark Murphy",2012-04-01,article,News,,['Weddings and Engagements']
Shushannah Walshe and Ari Yasgur,2012-04-01,article,News,,['Weddings and Engagements']
Illa Steen and William Gaunt,2012-04-01,article,News,,['Weddings and Engagements']
"Leah Raful, Seth Goldberg",2012-04-01,article,News,,['Weddings and Engagements']
Margaret Weiss and Joseph Maloney,2012-04-01,article,News,,['Weddings and Engagements']
"Daniel Evans, Matthew Mazer",2012-04-01,article,News,,['Weddings and Engagements']
Michele Hyndman and Matthew Hodge,2012-04-01,article,News,,['Weddings and Engagements']
"Claire James, Ethan Ravetch",2012-04-01,article,News,,['Weddings and Engagements']
Lisa Olmos and Ronald Koo,2012-04-01,article,News,,['Weddings and Engagements']
"Elizabeth Pultorak, Matthew Walker",2012-04-01,article,News,,['Weddings and Engagements']
"Keren Sachs, Landis Kauffman",2012-04-01,article,News,,['Weddings and Engagements']
"Laura Rowntree, Andrew Gilman",2012-04-01,article,News,,['Weddings and Engagements']
"Rachel Moquete, Michael Day",2012-04-01,article,News,,['Weddings and Engagements']
"Lindsay Taylor, Jordan Farkas",2012-04-01,article,News,,['Weddings and Engagements']
"Ashley Cornforth, Evan Geronemus",2012-04-01,article,News,,['Weddings and Engagements']
Emily Blout and Michael Signer,2012-04-01,article,News,,['Weddings and Engagements']
"Alexis Buryk, Scott Borchert",2012-04-01,article,News,,['Weddings and Engagements']
"Knee Surgery for Lin, a Title for Marbury",2012-04-01,article,News,,"['Basketball', 'Chinese-Americans', 'Knees', 'Playoff Games', 'Sports Injuries']"
Pasty-gate and a Series of ‘Own Goals’ Hit Cameron,2012-04-01,article,News,,['Politics and Government']
Insurgents’ Bombs in Thailand: Bigger and Deadlier,2012-04-01,article,News,,"['Civilian Casualties', 'Deaths (Fatalities)', 'Defense and Military Forces', 'Human Rights and Human Rights Violations', 'Murders and Attempted Murders', 'Police', 'Terrorism']"
From Prisoner to Parliament in Myanmar,2012-04-01,article,News,,['Elections']
"Giants and Jets, the Same Dynamic",2012-04-01,article,News,,['Football']
Opening Day? Meh.,2012-04-01,article,News,,['Baseball']
U.S. Joins Effort to Equip and Pay Rebels in Syria,2012-04-01,article,News,,"['Humanitarian Aid', 'Middle East and North Africa Unrest (2010- )']"
Schrödinger’s Candidate,2012-04-01,article,News,,[]
DirecTV and Tribune Fail to Reach Deal,2012-04-01,article,News,,[]
"From Relais & Châteaux, a Chef-apalooza",2012-04-01,article,News,,"['Chefs', 'Cooking and Cookbooks', 'Travel and Vacations']"
Why I’m O.K. with ‘Pink Slime’ in Ground Beef,2012-04-01,article,News,,"[""APRIL FOOL'S DAY"", 'Beef', 'Meat']"
Disruptions: Top 10 Lists Lead to Less Choice on the Web,2012-04-01,article,News,,"['Computers and the Internet', 'Social Networking (Internet)']"
Iraqi Leader Visits Qatar in Defiance of Baghdad,2012-04-01,article,News,,"['Politics and Government', 'Fugitives', 'Oil (Petroleum) and Gasoline', 'Kurds']"
Senator Johnson Backs Romney as Santorum Vows Fight,2012-04-01,article,News,,"['Endorsements', 'Polls and Public Opinion', 'Presidential Election of 2012']"
Myanmar Elections,2012-04-01,multimedia,Slideshow,,[]
Another Big Weekend for ‘The Hunger Games’,2012-04-01,article,News,,['Movies']
"Miguel de la Madrid, President of Mexico in 1980s, Dies at 77",2012-04-01,article,Obituary (Obit),,"['Politics and Government', 'Deaths (Obituaries)']"
"On Amnesty Day, Somber Owners Surrender Pythons and a Snapping Turtle",2012-04-01,article,News,,"['ANIMALS', 'Zoos', 'Pets', 'Snakes']"
Santana Will Start for Mets on Opening Day,2012-04-01,article,News,,['Baseball']
"As Foreclosure Problems Persist, Fed Seeks More Fines",2012-04-01,article,News,,"['Banking and Financial Institutions', 'Foreclosures', 'Subprime Mortgage Crisis', 'Regulation and Deregulation of Industry']"
Original Review: ‘The Best Man’,2012-04-01,multimedia,Interactive Feature,,['Theater']
Response by Big Men in Physical Game Factors Into Kansas’ Victory,2012-04-01,article,News,,['College Athletics']
Complacency a Threat to Romney in Wisconsin,2012-04-01,article,News,,[]
Lifting Voices and Ambitions in a Soaring Sacred Space,2012-04-01,article,Review,,"['Music', 'Classical Music']"
Out of Sight in Wartime,2012-04-01,article,Review,,['Books and Literature']
"Something Borrowed, Something Kentucky Blue",2012-04-01,article,News,,"['Basketball', 'College Athletics', 'Weddings and Engagements']"
Unleashing Playful Music,2012-04-01,article,Review,,"['Music', 'Classical Music']"
"Private Needs, Public Displays",2012-04-01,article,Review,,['Dancing']
A Sure Blend of Noise and Melody Imported From Wales,2012-04-01,article,Review,,"['Music', 'Rock Music']"
"As Viewing Habits Change, Political Ads Switch Screens",2012-04-01,article,News,,"['Online Advertising', 'Political Advertising', 'Primaries and Caucuses', 'Television', 'Presidential Election of 2012', 'Computers and the Internet']"
"When Mom Makes Lunch, the Food Is Secondary",2012-04-01,article,News,,['Art']
Tobin-Brainard 1963,2012-04-01,article,News,,[]
Billion Price Update,2012-04-01,article,News,,[]
Rebellious Tinkerers Dress Up the iPhone’s Uniform,2012-04-01,article,News,,"['iPhone', 'Do It Yourself']"
Customized iPhones,2012-04-01,multimedia,Slideshow,,"['iPhone', 'Do It Yourself']"
Ranks of Working Poor Grow in Europe,2012-04-01,article,News,,"['Economic Conditions and Trends', 'Camps and Camping', 'European Sovereign Debt Crisis (2010- )', 'Labor and Jobs', 'Wages and Salaries']"
Romney Target of April Fool’s Joke,2012-04-01,article,News,,"[""APRIL FOOL'S DAY""]"
Booking Battle at the Morning Shows,2012-04-01,article,News,,['Television']
"In Kentucky-Louisville, Coaching Differences Were on Display",2012-04-01,article,News,,['College Athletics']
"Clarinet Quintets, From Centuries Old to Brand New",2012-04-01,article,Review,,"['Music', 'Classical Music', 'Clarinets']"
"We’ll Sing and We’ll Spiel, but No Sex Till War Ends",2012-04-01,article,Review,,"['Opera', 'Classical Music']"
The End of an Affair: Movement Marathon,2012-04-01,article,Review,,['Dancing']
Do Not Feed or Annoy the Dancers,2012-04-01,article,Review,,"['Dancing', 'Whitney Biennial']"
"In Arizona, Censoring Questions About Race",2012-04-01,article,News,,"['Books and Literature', 'Censorship', 'Discrimination', 'Education (K-12)', 'Hispanic-Americans', 'Law and Legislation', 'Race and Ethnicity']"
Stepping Out of the Shadows With a Sunnier Sound,2012-04-01,article,Question,,"['Music', 'Folk Music']"
Excerpt: 'Gore Vidal's The Best Man',2012-04-01,multimedia,Video,,['Theater']
Setback Rebounds at Machlin Women’s Swiss Teams,2012-04-01,article,News,,"['Bridge (Card Game)', 'Cards and Card Games']"
Cherry Blossoms and a Fan Telling Tales,2012-04-01,article,Review,,"['Kabuki (Japanese Theater)', 'Dancing']"
An Indie-Rock Memoir From Carrie Brownstein,2012-04-01,article,Brief,,"['Books and Literature', 'Music', 'Rock Music']"
"A Shooting, and Instant Polarization",2012-04-01,article,News,,"['Social Networking (Internet)', 'Murders and Attempted Murders', 'Blogs and Blogging (Internet)', 'Computers and the Internet', 'News and News Media']"
Footnote,2012-04-01,article,Brief,,"['Awards, Decorations and Honors', 'Humana Festival of New American Plays', 'Theater']"
Whitney Houston Items Are Sold at Auction,2012-04-01,article,Brief,,"['Auctions', 'Music']"
Encore at the Met Pleases the Audience,2012-04-01,article,Brief,,"['Opera', 'Music']"
Treasury Auctions Set for This Week,2012-04-01,article,Schedule,,"['Auctions', 'Stocks and Bonds']"
A Filmmaker Chases an Israeli Spy Story,2012-04-01,article,News,,"['Documentary Films and Programs', 'Movies']"
‘Die Verschworenen’,2012-04-01,multimedia,Slideshow,,['Opera']
The Joy Formidable,2012-04-01,multimedia,Slideshow,,"['Music', 'Rock Music']"
"With Title, Djokovic Steadies His Slam Path",2012-04-01,article,News,,['Tennis']
Much-Anticipated Cry,2012-04-01,article,News,,[]
Exotic Animal Amnesty Day,2012-04-01,multimedia,Video,,"['ANIMALS', 'Zoos']"
Looking Ahead to Economic Reports This Week,2012-04-01,article,Schedule,,"['Company Reports', 'Economic Conditions and Trends']"
"Giorgio Chinaglia, Cosmos and Lazio Star, Dies at 65",2012-04-01,article,News,,"['Deaths (Obituaries)', 'Soccer']"
Kentucky-Kansas: A Look at the Numbers,2012-04-01,article,News,,['NCAA Basketball Championships (Men)']
Coast Guard Rescues Sailors Whose Yacht Was Overtaken by Wave,2012-04-01,article,News,,"['Maritime Accidents and Safety', 'Sailboats and Sailing']"
"Anticipation High for Rangers-Bruins, but Tortorella Doesn’t Let On",2012-04-01,article,News,,"['Hockey, Ice', 'Playoff Games']"
Mets and Niese Are Said to Be Discussing Long-Term Deal,2012-04-01,article,News,,[]
Pension Funds Have Mixed Results With Alternative Investments,2012-04-01,multimedia,Interactive Feature,,['Pensions and Retirement Plans']
Pensions Find Riskier Funds Fail to Pay Off,2012-04-01,article,News,,"['Pensions and Retirement Plans', 'Private Equity', 'Stocks and Bonds', 'Hedge Funds', 'Government Bonds', 'States (US)', 'Government Employees', 'Prices (Fares, Fees and Rates)']"
Israel Frees Palestinian Detainee After Hunger Strike of Weeks,2012-04-01,article,News,,"['Detainees', 'Hunger Strikes', 'Muslims and Islam', 'Palestinians', 'Politics and Government']"
"On Leaving, and Not Leaving, the Church",2012-04-01,article,Letter,,"['Colleges and Universities', 'ABORTION']"
Mayoral Hopeful’s Slow Start Has Some Asking if His Heart Is in It,2012-04-01,article,News,,"['Mayors', 'Elections']"
Talk Radio Face-Off Approaches,2012-04-01,article,News,,"['ADVERTISING AND MARKETING', 'Radio']"
An Eighth-Grade Sports Encyclopedia Finds Himself Without a High School,2012-04-01,article,News,,"['Education (K-12)', 'Friendship']"
Does It Matter if the Orchestra Isn’t in the Pit?,2012-04-01,article,Letter,,"['Music', 'ACOUSTICS']"
Considerate Texting,2012-04-01,article,Letter,,"['Text Messaging', 'Roads and Traffic', 'Automobiles']"
Planning for Parking,2012-04-01,article,Letter,,['Parking']
Magazine Guidelines for Tablets,2012-04-01,article,News,,"['ADVERTISING AND MARKETING', 'Magazines', 'Tablet Computers']"
"To Enroll More Minority Students, Colleges Work Around the Courts",2012-04-01,article,News,,"['AFFIRMATIVE ACTION', 'Colleges and Universities', 'Race and Ethnicity', 'ADMISSIONS STANDARDS', 'Equal Educational Opportunities']"
Stars of Hollywood and Madison Avenue,2012-04-02,article,News,,"['Celebrities', 'ADVERTISING AND MARKETING']"
Can Privatization Kill?,2012-04-02,article,Op-Ed,,"['Deportation', 'Immigration Detention', 'Immigration and Emigration', 'Privatization']"
"At the University of Texas, Admissions as a Mystery",2012-04-02,article,News,,"['ADMISSIONS STANDARDS', 'Race and Ethnicity', 'Colleges and Universities', 'AFFIRMATIVE ACTION']"
"As Smartphones Become Health Aids, Ads May Follow",2012-04-02,article,News,,"['Online Advertising', 'ADVERTISING AND MARKETING', 'Diet and Nutrition', 'Medicine and Health', 'Smartphones', 'Mobile Applications']"
Your Choice for World Bank President?,2012-04-02,article,News,,"['Banking and Financial Institutions', 'Third World and Developing Countries']"
"Painstakingly Reimagining City’s Cabs, Down to the Floor Mats",2012-04-02,article,News,,"['Taxicabs and Taxicab Drivers', 'New York International Auto Show']"
Britain Sees Chechen Plot to Kill Exile,2012-04-02,article,News,,['Assassinations and Attempted Assassinations']
"2 Channels, and Anchor Who Set Liberal Tone",2012-04-02,article,News Analysis,,"['Television', 'United States Politics and Government', 'News and News Media']"
"Naked, With Children",2012-04-02,article,News,,"['Children and Childhood', 'Families and Family Life', 'Parenting', 'Teenagers and Adolescence']"
Pink Slime Economics,2012-04-02,article,Op-Ed,,"['Income Tax', 'United States Politics and Government', 'Taxation', 'Federal Budget (US)']"
"A Die-Hard Conservative, but Not on Immigrants",2012-04-02,article,News,,"['Arizona Immigration Law (SB 1070)', 'Immigration and Emigration', 'Illegal Immigrants', 'Migrant and Foreign Workers']"
"Newly in Business, and Finding a Lifeline",2012-04-02,article,News,,"['Microfinance', 'Entrepreneurship', 'Start-ups', 'Small Business']"
"For Some New York Shoppers, No More State Sales Tax",2012-04-02,article,News,,"['Shopping and Retail', 'Sales and Excise Taxes', 'Tax Credits, Deductions and Exemptions']"
Notre Dame Wins a Taut Game and Returns to the Final,2012-04-02,article,News,,"['NCAA Basketball Championships (Women)', 'Basketball (College)']"
"A Report for the Web, on TV",2012-04-02,article,News,,"['News and News Media', 'Television']"
Apple’s Chief Puts Stamp on Labor Issues,2012-04-02,article,News,,"['Factories and Manufacturing', 'Working Hours']"
Lottery Numbers,2012-04-02,article,List,,['Lotteries']
Tyler and Trayvon,2012-04-02,article,Op-Ed,,"['Crime and Criminals', 'Law and Legislation', 'Hate Crimes', 'Discrimination', 'Murders and Attempted Murders']"
Clients Raise Questions About MF Global Checks,2012-04-02,article,News,,['Banking and Financial Institutions']
Judo Legends Don’t Retire,2012-04-02,multimedia,Video,,"['Judo', 'Martial Arts', 'Mixed Martial Arts']"
"For 66 Years, a Force for Judo in the United States",2012-04-02,article,News,,"['Judo', 'Japanese-Americans', 'Martial Arts']"
"In Egyptian Hard-Liner’s Surge, New Worries for the Muslim Brotherhood",2012-04-02,article,News,,"['International Relations', 'United States International Relations', 'Muslims and Islam', 'Politics and Government', 'Elections']"
"Race, Tragedy and Outrage Collide After a Shot in Florida",2012-04-02,article,News,,"['Gun Control', 'Demonstrations, Protests, and Riots', 'Race and Ethnicity', 'Murders and Attempted Murders']"
A Ballerina Who Wasn’t and Other Reader Tales,2012-04-02,article,News,,"['Dogs', 'Chickpeas']"
Loan Gone Sour Clouds the Future of a Media Activists’ Haven in TriBeCa,2012-04-02,article,News,,"['Banking and Financial Institutions', 'Bankruptcies', 'Foreclosures', 'Real Estate and Housing (Residential)']"
Their Contributors’ Bidding,2012-04-02,article,Editorial,,"['Banking and Financial Institutions', 'Regulation and Deregulation of Industry', 'Dodd-Frank Wall Street Reform and Consumer Protection Act (2010)', 'Law and Legislation', 'United States Politics and Government', 'Derivatives (Financial Instruments)', 'Editorials']"
Myanmar Elections,2012-04-02,multimedia,Slideshow,,['Elections']
A Monsignor Goes on Trial,2012-04-02,article,Editorial,,"['Priests', 'Sex Crimes', 'Child Abuse and Neglect', 'Editorials']"
Encyclopaedia Britannica’s Last Print Edition Has a Sales Boom,2012-04-02,article,News,,"['Encyclopedias', 'Sales']"
The Puzzle of More Autism Cases,2012-04-02,article,Editorial,,"['Children and Childhood', 'Autism', 'Mental Health and Disorders', 'Editorials']"
"Mr. Chairman, the Great State of Nostalgia ...",2012-04-02,article,Review,,['Theater']
"Census Numbers for City Won’t Change, Bureau Says",2012-04-02,article,News,,"['Census', 'Population']"
Examining Marijuana Arrests,2012-04-02,article,Editorial,,"['Law and Legislation', 'Drug Abuse and Traffic', 'Marijuana', 'Politics and Government', 'Editorials']"
"For Santorum, Hope That Voters See Message as Pins Go Flying",2012-04-02,article,News,,"['Presidential Election of 2012', 'Primaries and Caucuses', 'Bowling']"
Master Runner,2012-04-02,multimedia,Video,,"['Running', 'Marathon Running']"
"After Late Start, Runner Is Speeding Through Records",2012-04-02,article,News,,"['Track and Field', 'Age, Chronological', 'Exercise', 'Marathon Running', 'Running']"
Ryan Seacrest Is Said to Be Close to New Deal With Comcast,2012-04-02,article,News,,['Television']
"Aides With Candidate’s Ear, if Not Title or Paycheck",2012-04-02,article,News,,"['Presidential Election of 2012', 'Lobbying and Lobbyists']"
Rethinking How We Teach Economics,2012-04-02,article,News,,[]
The Events Leading to the Shooting of Trayvon Martin,2012-04-02,multimedia,Interactive Feature,,"['Race and Ethnicity', 'Gun Control', 'Murders and Attempted Murders']"
"Nobody Minds Dyeing the Egg, but the Chicken Is Another Story",2012-04-02,article,News,,"['Cruelty to Animals', 'Easter and Holy Week', 'Chickens', 'Dyes and Dyestuffs']"
The Politics of Going to College,2012-04-02,article,News,,"['Presidential Election of 2012', 'United States Politics and Government']"
Washington Is First State to Take On Escort Sites,2012-04-02,article,News,,"['Human Trafficking', 'Sex Crimes', 'Prostitution', 'Online Advertising', 'Computers and the Internet', 'Law and Legislation']"
"After a Data Breach, Visa Removes a Service Provider",2012-04-02,article,News,,"['Computer Security', 'Credit Cards']"
Corrections: April 2,2012-04-02,article,Correction,,[]
Baylor’s Depth and Defense Subdue Stanford,2012-04-02,article,News,,"['NCAA Basketball Championships (Women)', 'Basketball (College)']"
Land Rover Time-Lapse,2012-04-02,multimedia,Video,,['Automobiles']
"Citizen Journalist in Syria Is Captured and Tortured, Activists Say",2012-04-02,article,News,,"['Freedom of Speech and Expression', 'News and News Media', 'Political Prisoners']"
Can Bicycling Affect a Woman’s Sexual Health?,2012-04-02,article,News,,"['Bicycles and Bicycling', 'Impotence', 'Medicine and Health', 'Sex', 'Women and Girls']"
Word of the Day | prognosis,2012-04-02,article,News,,[]
"Paul and Brenda Babits, 51",2012-04-02,article,News,,"['Pole Vault', 'Track and Field']"
"Jeanne Daprano, 75",2012-04-02,article,Caption,,"['Running', 'Track and Field']"
"Nolan Shaheed, 62",2012-04-02,article,Caption,,"['Running', 'Track and Field']"
"Phil McConkey, 55",2012-04-02,article,News,,"['Running', 'Track and Field']"
"Philippa Raschker, 65",2012-04-02,article,Caption,,"['Track and Field', 'Running', 'Pentathlon']"
"Bob Lida, 75",2012-04-02,article,Caption,,['Running']
North Korea Party Calls for Leadership Meeting,2012-04-02,article,News,,[]
"Too Many Small Fish Are Caught, Report Says",2012-04-02,article,News,,"['Fish Farming', 'Fish and Other Marine Life', 'Fishing, Commercial']"
"Paul S. Boyer, 76, Dies; Historian Studied A-Bomb and Witches",2012-04-02,article,Obituary (Obit),,"['Witchcraft', 'Deaths (Obituaries)', 'World War II (1939-45)']"
"Now, Will She Kick the Hornet’s Nest?",2012-04-02,article,News,,"['Constitutions', 'Defense and Military Forces', 'Diplomatic Service, Embassies and Consulates', 'Elections', 'Embargoes and Economic Sanctions', 'Human Rights and Human Rights Violations', 'International Relations', 'Legislatures and Parliaments', 'Political Prisoners', 'Politics and Government', 'Prisons and Prisoners']"
Bruins Prevent Rangers From Clinching Conference and Top Seeding,2012-04-02,article,News,,"['Hockey, Ice']"
A Land Rover Obstacle Course,2012-04-02,multimedia,Video,,['Automobiles']
Little Cheering Accompanies Bruins’ Division Title,2012-04-02,article,News,,"['Hockey, Ice']"
"Murray, in Loss to Djokovic, Is His Own Worst Enemy",2012-04-02,article,News,,[]
"Charles Lockwood, Who Wrote the Row-House Bible, Dies at 63",2012-04-02,article,Obituary (Obit),,"['Deaths (Obituaries)', 'Writing and Writers', 'Brownstones', 'ARCHITECTURE']"
Knicks Have Returned to Point of Disarray,2012-04-02,article,News,,['Basketball']
‘Mad Men’ Recap: Gloom for Betty and Roger,2012-04-02,article,News,,['Television']
"Meanwhile, Starring in China ....",2012-04-02,article,News,,['Basketball']
Newswallah: A Brief History of Corruption in the Ministry of Defense,2012-04-02,article,News,,"['Bribery and Kickbacks', 'Corruption (Institutional)', 'Politics and Government']"
The One Who Stayed Holds Kentucky Together,2012-04-02,article,News,,"['Basketball (College)', 'NCAA Basketball Championships (Men)', 'Awards, Decorations and Honors']"
Marlins Bet on Future in a Florida Theme Park,2012-04-02,article,News,,"['Stadiums and Arenas', 'Baseball']"
No Easy Path to the Rim for Either Tourney Finalist,2012-04-02,article,News,,"['Basketball (College)', 'NCAA Basketball Championships (Men)']"
Rodriguez Is Feeling at Home in Miami,2012-04-02,article,News,,['Baseball']
L.P.G.A.’s First Major Ends in Playoff After Stunning Miss on Final Hole,2012-04-02,article,News,,['Golf']
Vonn Unruffled by Prospect of Knee Surgery,2012-04-02,article,News,,"['ALPINE SKIING', 'Sports Injuries', 'World Cup (Skiing)', 'Skiing']"
India’s Industry Helps Open a Door to the World,2012-04-02,article,News,,"['International Relations', 'Politics and Government']"
"In Tug of War Over San Jose, A’s and the Giants Remain at a Standoff",2012-04-02,article,News,,"['Baseball', 'Stadiums and Arenas']"
Photo Replay: April 1,2012-04-02,multimedia,Slideshow,,"['Rodeos', 'Soccer', 'Golf', 'Basketball', 'Automobile Racing']"
"News Quiz | April 2, 2012",2012-04-02,article,News,,[]
"April 2, 1917 | Woodrow Wilson Asks For Declaration of War Against Germany",2012-04-02,article,News,,[]
"Test Yourself | Math, April 2, 2012",2012-04-02,article,News,,[]
Britons Protest Proposal to Widen Surveillance,2012-04-02,article,News,,"['Surveillance of Citizens by Government', 'Computer Security', 'Politics and Government', 'Computers and the Internet']"
"Beats, Rhymes and Hard Work",2012-04-02,article,News,,"['Music', 'Photography', 'Rap and Hip-Hop']"
Saris and Chuppahs for the B’nei Israel Jews of India,2012-04-02,article,News,,"['International Relations', 'Jews and Judaism']"
"‘Vogue of the Veiled’ Has a Following, and Critics",2012-04-02,article,News,,[]
Russian Crash After Takeoff Kills 31,2012-04-02,article,News,,['Aviation Accidents and Safety']
Counselor’s Calendar | April Checklist for Seniors,2012-04-02,article,News,,"['ADMISSIONS STANDARDS', 'Colleges and Universities', 'Education (K-12)']"
The Early Word: Free Advice,2012-04-02,article,News,,[]
N.F.C. West Team Needs,2012-04-02,article,News,,['Football']
Fantasy Focus: Late-Breaking Rises and Falls,2012-04-02,article,News,,[]
"Beneath the High Line, Land Rover Builds an Off-Road Jungle Gym",2012-04-02,article,News,,"['Automobiles', 'New York International Auto Show']"
What Would You Do If You Won the Lottery?,2012-04-02,article,News,,[]
Q&A: Recycling E-Waste by the Book,2012-04-02,article,News,,[]
"Syria Agrees to Troop Withdrawal, Annan Says",2012-04-02,article,News,,['Middle East and North Africa Unrest (2010- )']
DBS Group to Buy Bank Danamon for $7.2 Billion,2012-04-02,article,News,,[]
This Week in Small Business: Meet Your Start-Up Mate,2012-04-02,article,News,,"['Entrepreneurship', 'Small Business', 'Start-ups', 'United States Economy']"
Head of British Bankers’ Association to Step Down,2012-04-02,article,News,,"['Banking and Financial Institutions', 'Regulation and Deregulation of Industry']"
One Derivatives Trade That’s Now Off: Betting on the 2012 Election,2012-04-02,article,News,,"['Derivatives (Financial Instruments)', 'Presidential Election of 2012']"
Daily Report: Fixing Apple’s Supply Lines,2012-04-02,article,News,,['Factories and Manufacturing']
K.K.R. to Buy Shale Assets From WPX for $306 Million,2012-04-02,article,News,,[]
Voir Dire on Point,2012-04-02,article,News,,"['Dogs', 'Jury System']"
Coty Bid Adds to Avon’s Struggles,2012-04-02,article,News,,"['Mergers, Acquisitions and Divestitures']"
Opinion Report: Marijuana Possession,2012-04-02,article,News,,['Marijuana']
"On Recess, Congressional Leaders Shift Focus to Election",2012-04-02,article,News,,['Elections']
On Our Radar: The Bounteous South China Sea,2012-04-02,article,News,,[]
Morning Take-Out,2012-04-02,article,News,,[]
Technical Difficulties in Red Square,2012-04-02,article,News,,"[""APRIL FOOL'S DAY"", 'Demonstrations, Protests, and Riots', 'Police']"
A Conversation With: Uddhav Thackeray,2012-04-02,article,News,,"['Corruption (Institutional)', 'Politics and Government']"
Ratings Disaster,2012-04-02,article,News,,[]
