headline,date,doc_type,material_type,section,keywords
The Road We Need Not Have Traveled,2012-04-07,article,Editorial,,"['Military Tribunals', 'Human Rights and Human Rights Violations', 'Torture', 'United States Politics and Government', 'Detainees', 'September 11 (2001)', 'Editorials']"
Learning to Respect Religion,2012-04-07,article,Op-Ed,,"['Religion and Belief', 'Atheism', 'Books and Literature', 'Bullies']"
The Other Arab Spring,2012-04-07,article,Op-Ed,,"['Global Warming', 'Middle East and North Africa Unrest (2010- )', 'Drought', 'Population', 'Water', 'Politics and Government', 'Shortages']"
Divided by God,2012-04-07,article,Op-Ed,,"['Presidents and Presidency (US)', 'Civil Rights and Liberties', 'United States Politics and Government', 'Religion and Belief', 'Books and Literature', 'Presidential Election of 2012', 'Evangelical Movement', 'Mormons (Church of Jesus Christ of Latter-Day Saints)', 'Christians and Christianity']"
What Would Jesus Do at the Masters?,2012-04-07,article,Op-Ed,,"['Women and Girls', 'Olympic Games', 'Discrimination', ""Women's Rights""]"
"In Executive Pay, a Rich Game of Thrones",2012-04-07,article,News,,"['Stock Options and Purchase Plans', 'Executive Compensation']"
200 Slices of Wealth,2012-04-07,multimedia,Interactive Feature,,"['Executive Compensation', 'Bonuses', 'Wages and Salaries', 'Stock Options and Purchase Plans']"
When Shareholders Make Their Voices Heard,2012-04-07,article,News,,"['Dodd-Frank Wall Street Reform and Consumer Protection Act (2010)', 'Shareholder Rights and Activism', 'Executive Compensation']"
Junta in Mali to Step Down,2012-04-07,article,News,,"['Defense and Military Forces', ""Coups D'Etat and Attempted Coups D'Etat"", 'Politics and Government']"
"Spam Invades a Last Refuge, the Cellphone",2012-04-07,article,News,,"['Text Messaging', 'Wireless Communications', 'Spam (Electronic Mail)', 'Cellular Telephones', 'Consumer Protection']"
"Mauricio Lasansky, Master Printmaker, Dies at 97",2012-04-07,article,Obituary (Obit),,"['Holocaust and the Nazi Era', 'Art', 'Deaths (Obituaries)']"
"Edmund L. Epstein, Scholar Who Saved ‘Lord of the Flies,’ Dies at 80",2012-04-07,article,Obituary (Obit),,"['Books and Literature', 'Book Trade and Publishing', 'Deaths (Obituaries)']"
Verlander Continues to Seek Perfection,2012-04-07,article,News,,['Baseball']
The Caucus Click: The Week in Pictures,2012-04-07,multimedia,Slideshow,,"['Presidential Election of 2012', 'United States Politics and Government', 'Primaries and Caucuses']"
In-Nuendos,2012-04-07,article,News,,[]
"Sunday Breakfast Menu, April 8",2012-04-07,article,News,,[]
The Caucus Click: The Week in Pictures,2012-04-07,article,News,,"['Presidential Election of 2012', 'Primaries and Caucuses', 'United States Politics and Government']"
Gemologist Earns Spot in Kentucky Derby With Win in Wood Memorial,2012-04-07,article,News,,['Horse Racing']
Berkeley Group Digs In to Challenge of Making Sense of All That Data,2012-04-07,article,News,,"['Colleges and Universities', 'Data Storage', 'Research']"
"Tracy Morgan, the Newest Knick",2012-04-07,article,News,,['Basketball']
Little Farm,2012-04-07,article,News,,"['Agriculture and Farming', 'Livestock', 'ANIMALS', 'Education (K-12)']"
"A Fresh Discovery, Three Decades in the Making",2012-04-07,article,News,,"['Writing and Writers', 'Books and Literature']"
Running for Congress Against Octogenarians,2012-04-07,article,News,,"['United States Politics and Government', 'Elections, House of Representatives']"
U.S. Defines Its Demands for New Round of Talks With Iran,2012-04-07,article,News,,"['United States International Relations', 'Uranium', 'United States Defense and Military Forces', 'Nuclear Weapons']"
"As Large Companies Opt Out, Concerns Grow for Workers’ Compensation System",2012-04-07,article,News,,"['Labor and Jobs', ""Workers' Compensation Insurance"", 'Wages and Salaries']"
"Tuna Again? In Fault-Finding England, It’s a Cause for Divorce",2012-04-07,article,News,,"['Divorce, Separations and Annulments']"
Meager Participation Hobbles Drug Oversight,2012-04-07,article,News,,"['Drugs (Pharmaceuticals)', 'Drug Abuse and Traffic', 'Doctors']"
The Short-Time Amateur,2012-04-07,article,News,,"['Golf', 'Masters Golf Tournament']"
Hopeful Signs for a Homegrown Mets Roster,2012-04-07,article,News,,['Baseball']
God Makes a Comeback,2012-04-08,article,News,,[]
Lundqvist Is Also a Sure Thing During the Awards Season,2012-04-08,article,News,,"['Awards, Decorations and Honors', 'Hockey, Ice']"
Flustered Woods Loses Temper and More Ground,2012-04-08,article,News,,"['Golf', 'Masters Golf Tournament']"
Donald Recalls the Awful Moment,2012-04-08,article,News,,"['Golf', 'Masters Golf Tournament']"
"After Trying Stretch, Hughes Is Eager to Get Started on Fresh Season",2012-04-08,article,News,,"['Baseball', 'Sports Injuries']"
Edward and the Elephant,2012-04-08,article,News,,['Civil War (US) (1861-65)']
Welfare Limits Left Poor Adrift as Recession Hit,2012-04-08,article,News,,"['Families and Family Life', 'Single Mothers', 'United States Economy', 'Welfare (US)', 'Recession and Depression', 'States (US)']"
"Rangers, With Eye on Top Spot in League, Fall Flat at the Finish Line",2012-04-08,article,News,,"['Hockey, Ice']"
Lottery Numbers,2012-04-08,article,List,,['Lotteries']
The Puzzle of Measuring Poverty,2012-04-08,article,News,,"['Economic Conditions and Trends', 'Income', 'Recession and Depression', 'Welfare (US)']"
It Looked Good on Paper,2012-04-08,article,News,,"['Golf', 'Masters Golf Tournament']"
Leading From Behind,2012-04-08,multimedia,Slideshow,,"['Hockey, Ice']"
"On TV, Bored Ex-Champion Turns to Fighting Crime",2012-04-08,article,News,,"['Chess', 'Television']"
"Boston College Wins 5th Title, but Underdog Puts Up a Fight",2012-04-08,article,News,,"['NCAA Ice Hockey Championships', 'Hockey, Ice']"
A Friendship Dating to 1976 Resonates in 2012,2012-04-08,article,News,,"['United States International Relations', 'Presidential Election of 2012']"
Yanks’ Rally Can’t Offset Kuroda’s Shaky Start,2012-04-08,article,News,,['Baseball']
"Despite Deadly Fungus, Frog Imports Continue",2012-04-08,article,News,,"['Frogs', 'AMPHIBIANS', 'Fungi']"
Police Suspect Single Gunman in Attacks in Oklahoma,2012-04-08,article,News,,['Murders and Attempted Murders']
Corrections: April 8,2012-04-08,article,Correction,,[]
"Kira Krieger, Samuel Senders",2012-04-08,article,News,,['Weddings and Engagements']
Courtney Morgan and Andrew Montgomery,2012-04-08,article,News,,['Weddings and Engagements']
Laila Tabatabai and Shaan Raza,2012-04-08,article,News,,['Weddings and Engagements']
Jennifer Lenhart and Andrew Carranza,2012-04-08,article,News,,['Weddings and Engagements']
"Renée Robichaux, Guy Endore-Kaiser",2012-04-08,article,News,,['Weddings and Engagements']
"Shannon Liu, Hayes Shair",2012-04-08,article,News,,['Weddings and Engagements']
"Adria Waldbart, C. Allen Garrett Jr.",2012-04-08,article,News,,['Weddings and Engagements']
Showtime: A Japanese Star Is Ready for His Close-up,2012-04-08,article,News,,"['Baseball', 'Draft and Recruitment (Sports)']"
A Chance to Unfreeze the Standoff on the Glacier,2012-04-08,article,News,,"['Avalanches', 'Defense and Military Forces', 'Glaciers', 'International Relations', 'Politics and Government', 'Snow and Snowstorms']"
U.S. Transfers Control of Night Raids to Afghanistan,2012-04-08,article,News,,['Afghanistan War (2001- )']
"David Wilson, Fourth-Ranked Running Back in 2012 Draft",2012-04-08,article,News,,"['Draft and Recruitment (Sports)', 'Football']"
"As Russian Real Estate Money Floods in, Could New York Go the Way of London?",2012-04-08,article,News,,"['Foreign Investments', 'Real Estate and Housing (Residential)', 'Wills and Estates']"
Arrests in Shootings End a Terrifying Weekend in Tulsa,2012-04-08,article,News,,"['Blacks', 'Black People', 'Hate Crimes', 'Murders and Attempted Murders']"
Santorum Takes Monday Off to Be With Daughter,2012-04-08,article,News,,[]
Unemployment and Inflation,2012-04-08,article,News,,[]
Behind the Steering Wheel and Not a Grammarian in Sight,2012-04-08,article,News,,"['Parking', 'Traffic and Parking Violations']"
Overabundant Bunnies Find Off-Campus Haven,2012-04-08,article,News,,"['ANIMALS', 'CANADA', 'Cruelty to Animals', 'Invasive Species', 'Rabbits']"
Indian and Pakistani Leaders Encourage Ties in a Rare Visit,2012-04-08,article,News,,"['International Relations', 'Politics and Government']"
"Reactions to the Death of Mike Wallace, ’60 Minutes’ Pioneer",2012-04-08,article,News,,[]
Disruptions: Too Much Silence on Working Conditions,2012-04-08,article,News,,"['Electronics', 'Labor and Jobs']"
"Mike Wallace, CBS Pioneer of ‘60 Minutes,’ Dies at 93",2012-04-08,article,Obituary (Obit),,"['Television', 'Deaths (Obituaries)', 'News and News Media']"
"Site Finds Home Hosts, Not Kennels, for Your Dog",2012-04-08,article,News,,"['Dogs', 'Travel and Vacations']"
Four Officers Are Shot in Brooklyn; Assailant Is Critically Wounded,2012-04-08,article,News,,"['Gun Control', 'Murders and Attempted Murders', 'Attacks on Police']"
Last Word: Mike Wallace,2012-04-08,multimedia,Video,,"['News and News Media', 'Vietnam War', 'Smoking and Tobacco']"
"Ryan, Obama, and Deficits",2012-04-08,article,News,,[]
A Look Back 100 Years To Focus on the Titanic,2012-04-08,article,News,,"['Titanic (Ship)', 'Travel and Vacations']"
South Korea Suspects That North May Test Nuclear Device as Well as Rocket,2012-04-08,article,News,,"['Nuclear Tests', 'Missiles and Missile Defense Systems', 'Nuclear Weapons']"
Cricket and the Ajmer Sharif Shrine Bolster India Pakistan Relations,2012-04-08,article,News,,"['Cricket (Game)', 'Politics and Government']"
"Mike Wallace, 1918-2012",2012-04-08,multimedia,Slideshow,,['News and News Media']
Cardinal Dolan Talks of Role of Religion in Politics,2012-04-08,article,News,,"['Cardinals (Roman Catholic Prelates)', 'Mormons (Church of Jesus Christ of Latter-Day Saints)', 'Presidential Election of 2012', 'Primaries and Caucuses', 'Religion-State Relations']"
‘The Hunger Games’ Surpasses $300 Million in North America,2012-04-08,article,News,,['Movies']
Mickelson Has History for Him and Against Him,2012-04-08,article,News,,"['Golf', 'Masters Golf Tournament']"
"In Europe, Unease Over Bank Debt",2012-04-08,article,News,,"['Banking and Financial Institutions', 'European Sovereign Debt Crisis (2010- )']"
Pro’s Perspective: Liking Mickelson’s Chances,2012-04-08,article,News,,"['Golf', 'Masters Golf Tournament']"
Measuring Up Citigroup and Bank of America,2012-04-08,article,News,,"['Company Reports', 'Banking and Financial Institutions']"
Out of the Woods and Into the Green Jacket,2012-04-08,article,News,,"['Golf', 'Masters Golf Tournament']"
Rangers’ First-Round Schedule,2012-04-08,article,News,,"['Hockey, Ice']"
'Ghost: The Musical',2012-04-08,multimedia,Video,,['Theater']
Devils’ First-Round Schedule,2012-04-08,article,News,,[]
"100 Years Ago, a Disaster Captivated the City",2012-04-08,article,News,,"['Shipwrecks', 'Titanic (Ship)']"
"On Release Date, Crucial Nokia Phone Is Hard to Buy in New York",2012-04-08,article,News,,['Smartphones']
How It Met Big Ratings 7 Years Into Its Run,2012-04-08,article,News,,"['Ratings (Audience Measurement)', 'Television']"
A Fresh Look at How Humans Are Loading Climate ‘Dice’,2012-04-08,article,News,,"['Drought', 'Global Warming', 'Greenhouse Gas Emissions', 'Weather']"
Hole in One Highlights Van Pelt’s Late Charge,2012-04-08,article,News,,"['Golf', 'Masters Golf Tournament']"
German Courts at Epicenter of Global Patent Battles Among Tech Rivals,2012-04-08,article,News,,"['Inventions and Patents', 'Suits and Litigation']"
Work Doesn’t Stop for Cink After a Dismal Third Round,2012-04-08,article,News,,"['Golf', 'Masters Golf Tournament']"
Egyptian Presidential Candidate Carries Banner of the Old Order,2012-04-08,article,News,,"['Politics and Government', 'Elections']"
Looking Ahead to Economic Reports This Week,2012-04-08,article,List,,"['Company Reports', 'Economic Conditions and Trends']"
News From the Advertising Industry,2012-04-08,article,News,,"['Appointments and Executive Changes', 'ADVERTISING AND MARKETING']"
Edoardo Molinari Has Had Enough of the Masters,2012-04-08,article,News,,"['Golf', 'Masters Golf Tournament']"
Foundation Files Reveal Insights on Culture,2012-04-08,article,News,,"['Writing and Writers', 'Philanthropy', 'Grants (Corporate and Foundation)', 'Culture (Arts)', 'Archives and Records']"
"Anything You Can Do, I Can Do in a Glowing Squiggle",2012-04-08,article,Review,,"['Rap and Hip-Hop', 'Dancing']"
"Singing of Beasts and Battle, With Folky Starts and Arena Finishes",2012-04-08,article,Review,,['Music']
Jackson Heights’ Ambassador of Yoga,2012-04-08,multimedia,Video,,"['Yoga', 'Muslim-Americans', 'Muslims and Islam']"
Seeking to Clear a Path Between Yoga and Islam,2012-04-08,article,News,,"['Muslims and Islam', 'Muslim-Americans', 'Yoga']"
Anthony at His Best Against the Best,2012-04-08,article,News,,['Basketball']
Google’s Washington Night,2012-04-08,article,News,,['News and News Media']
"After Three Games, the Yankees Are Still Looking for a Win",2012-04-08,article,News,,['Baseball']
"No-Hit Bid Silenced, Mets Still Make Noise",2012-04-08,article,News,,['Baseball']
Origin of Speciousness,2012-04-08,article,News,,[]
"Jump, Twirl, Paint, Act!",2012-04-08,article,News,,"['London 2012 Festival', 'Olympic Games (2012)', 'Culture (Arts)', 'Music', 'Art', 'Theater']"
Serena Williams Continues Dominance to Win Family Circle Title,2012-04-08,article,News,,[]
Lessons From Ants to Grasp Humanity,2012-04-08,article,News,,"['Evolution', 'Biodiversity', 'Biology and Biochemistry', 'Ants', 'Books and Literature', 'Science and Technology']"
"Fifth Avenue, 12:32 P.M.",2012-04-08,article,News,,[]
Care for Romance and Acrobatics With Your Ceviche?,2012-04-08,article,Review,,"['Food', 'Theater', 'Chefs', 'Cooking and Cookbooks']"
London 2012 Festival,2012-04-08,multimedia,Slideshow,,['Culture (Arts)']
A Diva Dips Into Indie Rock and Musical Theater,2012-04-08,article,Review,,"['Opera', 'Music', 'Classical Music']"
Seattle Reporter Finds Bubbles of Corruption Under the Space Needle,2012-04-08,article,Review,,['Books and Literature']
A Puzzle That Makes Sense,2012-04-08,article,News,,['Crossword Puzzles']
"In Verdi’s Parisian Social Whirl, a Star Shines, Then Plummets in Flames",2012-04-08,article,Review,,['Opera']
"As Technology Evolves, AT&T Adjusts a Theme",2012-04-08,article,News,,"['Online Advertising', 'ADVERTISING AND MARKETING', 'Telephones and Telecommunications', 'Social Networking (Internet)', 'Cellular Telephones']"
Surprising Disparity at the Spring Nationals,2012-04-08,article,News,,"['Bridge (Card Game)', 'Cards and Card Games']"
Arrests in Case of Chinese Artifacts,2012-04-08,article,Brief,,"['Art', 'ARCHAEOLOGY', 'Robberies and Thefts']"
Supremacy in Jeopardy for ‘Today’,2012-04-08,article,News,,"['Television', 'Ratings (Audience Measurement)', 'News and News Media']"
NBC’s ‘Today’ Wins a Ratings Showdown,2012-04-08,article,Brief,,['Television']
Newspaper Barons Resurface,2012-04-08,article,News,,"['Newspapers', 'High Net Worth Individuals']"
Berkeley Rep Workshop,2012-04-08,article,Brief,,['Theater']
Leaving Las Vegas: The Telethon,2012-04-08,article,Brief,,"['Television', 'Labor Day']"
Bands Improvise New Ways to Live-Stream Shows,2012-04-08,article,News,,"['Music', 'Mobile Applications', 'Digital Audio Players', 'Computers and the Internet']"
North Korea Prepares Rocket Launch,2012-04-08,multimedia,Video,,[]
A Caregiver’s Decision to End Two Lives,2012-04-08,article,Letter,,"[""Alzheimer's Disease"", 'Elderly', 'Suicides and Suicide Attempts', 'Elder Care', 'Dementia', 'Murders and Attempted Murders']"
Lin Is Happy With Recovery So Far,2012-04-08,article,News,,"['Basketball', 'Sports Injuries', 'Knees']"
Returning Migrants,2012-04-08,article,Letter,,"['Immigration and Emigration', 'Human Trafficking']"
Obama and the Budget,2012-04-08,article,Letter,,"['Budgets and Budgeting', 'Federal Budget (US)', 'Presidential Election of 2012']"
Apps Take Positions in the Topps Baseball Lineup,2012-04-08,article,News,,"['Mobile Applications', 'Collectors and Collections', 'Trading Cards', 'Baseball']"
Creating a New Taxi,2012-04-08,article,Letter,,"['Taxicabs and Taxicab Drivers', 'Oil (Petroleum) and Gasoline']"
Talking About Gun Control,2012-04-08,article,Letter,,"['Gun Control', 'School Shootings', 'Murders and Attempted Murders']"
Israel Bars German Laureate Grass Over Poem,2012-04-08,article,News,,"['Poetry and Poets', 'Holocaust and the Nazi Era', 'ANTI-SEMITISM', 'Nuclear Weapons']"
Private Equity Firms Duel Over Water Park Operator,2012-04-08,article,News,,[]
Borrowing Costs Rising for Governments,2012-04-08,multimedia,Interactive Feature,,['Government Bonds']
"Owner Had Right to Clear Zuccotti Park, Judge Says",2012-04-08,article,News,,['Decisions and Verdicts']
Treasury and Bond Auctions Scheduled for This Week,2012-04-08,article,Schedule,,"['Stocks and Bonds', 'Auctions']"
Protecting Face-to-Face Protest,2012-04-09,article,Op-Ed,,"['Freedom of Speech and Expression', 'Republican National Convention', 'Constitutional Amendments', 'Democratic National Convention', 'Demonstrations, Protests, and Riots', 'United States Politics and Government', 'Presidential Election of 2012', 'Security and Warning Systems', 'First Amendment (US Constitution)']"
I.B.M. Executive Just Another Face in the Crowd,2012-04-09,article,News,,"['Women and Girls', 'Golf', 'Masters Golf Tournament', 'Discrimination']"
Eighth Place Is Good for Nostalgia but Little Else,2012-04-09,article,News,,['Basketball']
"Dental Insurance, but No Dentists",2012-04-09,article,Op-Ed,,"['Teeth and Dentistry', 'Preventive Medicine', 'Health Insurance and Managed Care', 'Emergency Medical Treatment']"
F.C.C. Pushes for Web Site on TV Political Ad Spending,2012-04-09,article,News,,"['Television', 'ADVERTISING AND MARKETING', 'Political Advertising', 'Computers and the Internet']"
"At Texas Schools, Making Do on a Shoestring",2012-04-09,article,News,,"['Teachers and School Employees', 'Budgets and Budgeting', 'Layoffs and Job Reductions', 'Suits and Litigation', 'Education (K-12)', 'Buses']"
"Peter Douglas, Sentry of California’s Coast, Dies at 69",2012-04-09,article,Obituary (Obit),,"['Land Use Policies', 'Deaths (Obituaries)']"
Begrudging the Wildcats’ Success and Opportunities,2012-04-09,article,News,,"['Basketball (College)', 'Draft and Recruitment (Sports)', 'NCAA Basketball Championships (Men)', 'Basketball', 'College Athletics', 'Economic Conditions and Trends']"
"Banker, Tailor, Soldier, Spy",2012-04-09,article,Op-Ed,,"['Espionage and Intelligence Services', 'Appointments and Executive Changes', 'United States International Relations', 'United States Politics and Government', 'Banking and Financial Institutions']"
"Kenneth Libo, Scholar of Immigrant Life, Dies at 74",2012-04-09,article,Obituary (Obit),,"['Jews and Judaism', 'Immigration and Emigration', 'Deaths (Obituaries)', 'Books and Literature']"
Tightening the Lid on Pain Prescriptions,2012-04-09,article,News,,"['OxyContin (Drug)', 'Pain-Relieving Drugs', 'Pain', 'Drug Abuse and Traffic', 'Doctors']"
How to Fix the World Bank,2012-04-09,article,Op-Ed,,"['Reform and Reorganization', 'Banking and Financial Institutions', 'Appointments and Executive Changes']"
My Beautiful Cushy Tushy,2012-04-09,article,News,,"['Children and Childhood', 'Families and Family Life', 'Obesity', 'Parenting', 'Weight', 'Women and Girls']"
Roger Furst Dies at 78; Equipped Mountaineers in the Northeast,2012-04-09,article,Obituary (Obit),,"['Hikes and Hiking', 'Deaths (Obituaries)', 'Camps and Camping']"
The Gullible Center,2012-04-09,article,Op-Ed,,"['Federal Budget (US)', 'United States Politics and Government']"
A Gadget Processional and Other Reader Tales,2012-04-09,article,News,,[]
What Is a Megabyte?,2012-04-09,multimedia,Video,,"['Cellular Telephones', 'Wireless Communications', 'Smartphones']"
"For Lindsey Vonn, Professional Triumph and Personal Turmoil",2012-04-09,article,News,,"['Divorce, Separations and Annulments', 'World Cup (Skiing)', 'Skiing', 'Olympic Games', 'ALPINE SKIING']"
Quiz: Do You Know Your Data?,2012-04-09,multimedia,Interactive Feature,,"['Computers and the Internet', 'Smartphones', 'Wireless Communications']"
Do You Need That Test?,2012-04-09,article,Editorial,,"['Reform and Reorganization', 'Health Insurance and Managed Care', 'Doctors', 'Editorials', 'Tests (Medical)']"
A Ballooning Megabyte Budget,2012-04-09,article,News,,"['Wireless Communications', 'iPad', 'Smartphones', 'Computers and the Internet', 'Video Recordings and Downloads', 'Customer Relations', 'Mobile Applications']"
Taking Credit Where None Is Due,2012-04-09,article,Editorial,,"['United States Economy', 'United States Politics and Government', 'Recession and Depression', 'Unemployment', 'Editorials']"
Keeping Students’ Mental Health Care Out of the E.R.,2012-04-09,article,News,,"['Mental Health and Disorders', 'Hospitals', 'Education (K-12)']"
Volunteers Scramble to Save a School for Immigrants,2012-04-09,article,News,,"['Shutdowns (Institutional)', 'English Language', 'Volunteers and Community Service', 'Immigration and Emigration', 'Education, Adult']"
Children Can Never Be Safe in Adult Prisons,2012-04-09,article,Editorial,,"['Prisons and Prisoners', 'Children and Childhood', 'Sex Crimes', 'United States Politics and Government', 'Juvenile Delinquency', 'Editorials']"
Detour on Fourth Hole Costs Mickelson His Chance,2012-04-09,article,News,,"['Golf', 'Left-Handedness', 'Masters Golf Tournament']"
"In Russia, Charges Are Dropped in Jail Death",2012-04-09,article,News,,"['Statutes of Limitations', 'Prisons and Prisoners']"
Financing for Job Programs Has Declined,2012-04-09,multimedia,Interactive Feature,,"['Economic Conditions and Trends', 'Labor and Jobs']"
Big Warning on Little Fish,2012-04-09,article,Editorial,,"['Fish and Other Marine Life', 'Endangered and Extinct Species', 'Fishing, Commercial', 'Sustainable Living', 'Editorials']"
Federal Funds to Train the Jobless Are Drying Up,2012-04-09,article,News,,"['Vocational Training', 'Economic Conditions and Trends', 'Labor and Jobs', 'United States Economy', 'Unemployment', 'Federal Aid (US)']"
"‘Super PAC,’ Eyeing General Election, Aims Blitz at Obama",2012-04-09,article,News,,"['Political Advertising', 'Presidential Election of 2012']"
The Taint of ‘Social Darwinism’,2012-04-09,article,News,,"['Evolution', 'Federal Budget (US)', 'Philosophy']"
Corrections: April 9,2012-04-09,article,Correction,,[]
"On Easter Sunday, Tebow Is a Headliner",2012-04-09,article,News,,"['Easter and Holy Week', 'Football']"
Data Scientists Get Ranked,2012-04-09,article,News,,"['Contests and Prizes', 'Statistics']"
"Rose Returns, but the Rust Shows",2012-04-09,article,News,,['Basketball']
AccentHealth Puts Medical Content on Waiting Room TVs,2012-04-09,article,News,,"['Doctors', 'Television']"
Tradition and Boat Race Both Upended on the Thames,2012-04-09,article,News,,"['Rowing', 'Boats and Boating', 'Demonstrations, Protests, and Riots', 'Colleges and Universities']"
Serena Williams Captures First Clay Title Since 2008,2012-04-09,article,Brief,,['Tennis']
Are Some Buildings Too Ugly to Survive?,2012-04-09,article,News,,[]
Long Waiting Lists Again for Kindergarten Seats,2012-04-09,article,News,,[]
Lottery Numbers,2012-04-09,article,List,,['Lotteries']
City to Install ‘Smart Screens’ in Some Public Phone Booths,2012-04-09,article,News,,"['Science and Technology', 'Telephones and Telecommunications', 'Computers and the Internet']"
M.L.S. Week 6: Henry Simply Sublime,2012-04-09,article,News,,['Soccer']
Romney the Centrist Peeks Out,2012-04-09,article,News,,['Presidential Election of 2012']
California May Close a Home to Its Past,2012-04-09,article,News,,"['Budgets and Budgeting', 'Parks and Other Recreation Areas', 'Mexican-Americans', 'Historic Buildings and Sites']"
Masters Replay: April 8,2012-04-09,multimedia,Slideshow,,"['Golf', 'Masters Golf Tournament']"
Nokia Lumia 900 Advertisement,2012-04-09,multimedia,Video,,[]
Ex-K.G.B. Agent Said to Win South Ossetia Presidency,2012-04-09,article,News,,['Elections']
Comedy Timing Is Bad as News and Film Collide,2012-04-09,article,News,,"['Murders and Attempted Murders', 'ADVERTISING AND MARKETING', 'Movies']"
America’s Place in the New World,2012-04-09,article,News,,"['Politics and Government', 'United States Economy']"
‘Mad Men’ Recap: A Fever Dream and Spooky Reality,2012-04-09,article,News,,['Television']
Indian and Pakistani Leaders Encourage Ties in a Rare Visit,2012-04-09,article,News,,['Politics and Government']
Still on Red Alert Over Green-on-Blue Attacks,2012-04-09,article,News,,"['Afghanistan War (2001- )', 'Civilian Casualties', 'Defense and Military Forces', 'Espionage and Intelligence Services', 'United States Defense and Military Forces']"
Seeking to Clear a Path Between Yoga and Islam,2012-04-09,article,News,,"['Immigration Detention', 'Muslim-Americans', 'Yoga']"
U.S. Said to Have Picked an Ambassador to Myanmar,2012-04-09,article,News,,"['Appointments and Executive Changes', 'Diplomatic Service, Embassies and Consulates', 'Embargoes and Economic Sanctions', 'Human Rights and Human Rights Violations', 'International Relations', 'Politics and Government', 'United States International Relations', 'United States Politics and Government']"
Iranian Officials Send Mixed Signals as Nuclear Talks Near Resumption,2012-04-09,article,News,,"['Nuclear Weapons', 'United States International Relations']"
Camera in the Net? Might Just Work,2012-04-09,article,News,,[]
"For Bilawal Bhutto Zardari and Rahul Gandhi, Divergent Public Styles",2012-04-09,article,News,,"['Politics and Government', 'Social Networking (Internet)']"
