headline,date,doc_type,material_type,section,keywords
Bay Out With Jammed Finger,2012-04-15,article,News,,['Baseball']
Some Side Dishes Served Up as a Varied Main Course,2012-04-15,article,Review,,"['Music', 'Classical Music']"
Volley of Words on the Ravages of War,2012-04-15,article,Review,,"['Tennis', 'Theater']"
A Festival With Broader Horizons,2012-04-15,article,News,,"['Movies', 'Tribeca Film Festival (NYC)']"
"Celebrating Robinson and Other Black Players, on the Field and in an Exhibit Hall",2012-04-15,article,News,,"['Baseball', 'Trading Cards']"
"Scenes From Coachella, Day 2",2012-04-15,article,News,,"['Coachella Valley Music and Arts Festival', 'Music', 'Rock Music']"
"There Go Starving Artists, Trying It All, Even the Lotto",2012-04-15,article,Review,,['Dancing']
"Rock Music With Tropical Punch, a Soundtrack for a Hip Island Hotel",2012-04-15,article,Review,,['Music']
Iraq Emerges From Isolation as Telecommunications Hub,2012-04-15,article,News,,"['Telephones and Telecommunications', 'Computers and the Internet']"
Crowd-Sourcing Expands Power of Brain Research,2012-04-15,article,News,,"['Brain', 'Memory', 'Intelligence (IQ)', 'Research', 'Genetics and Heredity']"
Cue the Goal-Line Technology Debate,2012-04-15,article,News,,['Soccer']
Treasury Auctions Set for This Week,2012-04-15,article,Schedule,,"['Auctions', 'Stocks and Bonds']"
News From the Advertising Industry,2012-04-15,article,News,,"['ADVERTISING AND MARKETING', 'Appointments and Executive Changes']"
Zen for High Schoolers: ‘Notice the Anxiety. Notice the Fear.’,2012-04-15,article,News,,"['Meditation', 'School Discipline (Students)']"
Daring to Cut Off Amazon,2012-04-15,article,News,,"['E-Books and Readers', 'Prices (Fares, Fees and Rates)', 'Antitrust Laws and Competition Issues', 'Book Trade and Publishing']"
"After Hearing With Shanahan, Rangers’ Hagelin Is Suspended Three Games",2012-04-15,article,News,,"['Hockey, Ice']"
Anthony’s Big Day Is No Match for Big Three,2012-04-15,article,News,,['Basketball']
"For Most, Choice of Stay-at-Home Motherhood Is Far From a Luxury",2012-04-15,article,News,,"['Parenting', 'Women and Girls', 'Presidential Election of 2012', 'Labor and Jobs']"
A Not-Quite-Young Man With a Plan Follows a Type-A Pursuit of Health,2012-04-15,article,Review,,"['Books and Literature', 'Medicine and Health']"
Arguing About Language,2012-04-15,article,News,,"['Grammar', 'Language and Languages', 'Philosophy']"
Book Publishing’s Real Nemesis,2012-04-15,article,News,,"['E-Books and Readers', 'Prices (Fares, Fees and Rates)', 'Books and Literature', 'Antitrust Laws and Competition Issues', 'Suits and Litigation', 'Book Trade and Publishing']"
"Excuses Spring Eternal, but Not in Fair Weather",2012-04-15,article,News,,"['Golf', 'Spring (Season)', 'Weather']"
Dressing Up and Discovering What’s in the Toy Box,2012-04-15,article,Review,,['Dancing']
Reconfigured Requiem With Words to the Fore,2012-04-15,article,Review,,"['Classical Music', 'Music']"
New York Public Library Defends Plan to Renovate,2012-04-15,article,News,,"['Libraries and Librarians', 'Historic Buildings and Sites', 'Restoration and Renovation']"
Double-counting Doubletalk,2012-04-15,article,News,,[]
"Man, Alive to Machine Possibilities",2012-04-15,article,News,,['Music']
Inequality and Crisis Response,2012-04-15,article,News,,[]
"Remembering Hans Kreijns, Dutch Champion",2012-04-15,article,News,,"['Bridge (Card Game)', 'Cards and Card Games']"
A Sketch Artist Animates a Fraternity of Bumblers,2012-04-15,article,Review,,['Movies']
"Mets Stumble Against Phillies, Missing Out on a Sweep",2012-04-15,article,News,,['Baseball']
Looking Ahead to Economic Reports This Week,2012-04-15,article,Schedule,,"['Economic Conditions and Trends', 'Company Reports']"
It’s Like a Borgasmord,2012-04-15,article,News,,['Crossword Puzzles']
Bradley Cooper Joins ‘The Elephant Man’,2012-04-15,article,Brief,,"['Williamstown Theater Festival', 'Theater']"
Stones to Record? Not So Fast,2012-04-15,article,Brief,,"['Rock Music', 'Music']"
TED Teams With NPR,2012-04-15,article,Brief,,['Radio']
Yale Drama Winner,2012-04-15,article,Brief,,"['Theater', 'Awards, Decorations and Honors']"
Severe Storms Spawn Tornadoes in the Midwest,2012-04-15,multimedia,Slideshow,,['Tornadoes']
Bidding to Change Golf’s Perception as Sport for Rich,2012-04-15,article,News,,['Golf']
"Pandora Courts Local Advertisers, by Offering Well-Defined Listeners",2012-04-15,article,News,,"['Online Advertising', 'ADVERTISING AND MARKETING', 'Radio']"
"A Great Show in China, a Lingering Cloud Over Bahrain",2012-04-15,article,News,,[]
Improving the State of America’s Teeth,2012-04-15,article,Letter,,"['Teeth and Dentistry', 'Health Insurance and Managed Care', 'Preventive Medicine', 'Emergency Medical Treatment']"
Private Student Loans,2012-04-15,article,Letter,,"['Student Loans', 'United States Politics and Government', 'Editorials', 'Colleges and Universities']"
The Cost of Cutting Welfare,2012-04-15,article,Letter,,"['Welfare (US)', 'United States Politics and Government']"
The Importance of Trees,2012-04-15,article,Letter,,"['Trees and Shrubs', 'Environment']"
Gas Wells Project in Utah,2012-04-15,article,Letter,,"['Natural Gas', 'Editorials']"
Evolution of a Game,2012-04-15,multimedia,Video,,"['Golf', 'Athletics and Sports']"
Safety of Chicken Meat,2012-04-15,article,Letter,,"['Chickens', 'ARSENIC', 'Meat', 'ANTIBIOTICS']"
Mere Mortal’s Approach to Shot That Won Masters,2012-04-15,article,News,,['Masters Golf Tournament']
Making Visas-for-Dollars Work,2012-04-15,article,Op-Ed,,"['Visas', 'Foreign Investments', 'United States Economy', 'Immigration and Emigration', 'Frauds and Swindling', 'Labor and Jobs', 'United States Politics and Government']"
"Progressive Rock Station, WBCN, Returns on HD",2012-04-15,article,News,,['Radio']
Europe’s Economic Suicide,2012-04-15,article,Op-Ed,,"['Budgets and Budgeting', 'European Sovereign Debt Crisis (2010- )', 'Recession and Depression']"
Teixeira Is Slow to Start; Girardi Is Slow to Worry,2012-04-16,article,News,,['Baseball']
"Murray Rose, Australian Olympic Swimming Star, Dies at 73",2012-04-16,article,Obituary (Obit),,"['Swimming', 'Deaths (Obituaries)', 'Olympic Games']"
"Trial in Martin Case, Filled With High Emotion, Would Draw a News Swarm",2012-04-16,article,News,,"['Television', 'Polls and Public Opinion', 'Computers and the Internet', 'News and News Media', 'Murders and Attempted Murders']"
Africa’s Free Press Problem,2012-04-16,article,Op-Ed,,"['Politics and Government', 'News and News Media', 'Freedom of the Press', 'Freedom of Speech and Expression', 'Foreign Investments']"
President Speaks Out on Guard Investigation,2012-04-16,article,News,,"['Prostitution', 'United States Politics and Government', 'Summit of the Americas']"
A Conversation With Arnold Palmer About Golf Clubs,2012-04-16,article,News,,['Golf']
"Butch Bouchard, Imposing Pillar of Montreal Canadiens’ Defense, Dies at 92",2012-04-16,article,Obituary (Obit),,"['Hockey, Ice', 'Deaths (Obituaries)', 'Stanley Cup']"
N.H.L. Suspends Rangers’ Hagelin Three Games for Elbowing Alfredsson,2012-04-16,article,News,,"['Hockey, Ice', 'Playoff Games', 'Suspensions, Dismissals and Resignations']"
"Lou Goldstein, Borscht Belt Master of Simon Says, Dies at 90",2012-04-16,article,Obituary (Obit),,"['Comedy and Humor', 'Deaths (Obituaries)']"
The Sweet Spot,2012-04-16,article,Op-Ed,,"['Voting and Voters', 'United States Politics and Government', 'Presidential Election of 2012']"
"After Florida Shooting, N.R.A. Crowd Sticks to What It Knows",2012-04-16,article,News,,"['Gun Control', 'Self-Defense', 'Murders and Attempted Murders']"
News Corporation’s Pursuer Had Modest Start,2012-04-16,article,News,,"['Suits and Litigation', 'Wiretapping and Other Eavesdropping Devices and Methods', 'News and News Media']"
From the Birthplace of Big Brother,2012-04-16,article,Editorial,,"['Politics and Government', 'Law and Legislation', 'Surveillance of Citizens by Government', 'Civil Rights and Liberties', 'Editorials']"
Letting Carmelo Anthony Go It Alone May Not Help Knicks,2012-04-16,article,News,,"['Basketball', 'Playoff Games']"
"Declining as a Manufacturer, Japan Weighs Reinvention",2012-04-16,article,News,,"['Japan Earthquake and Tsunami (2011)', 'Economic Conditions and Trends', 'International Trade and World Market', 'Factories and Manufacturing']"
Keeping a Promise to Home Care Aides,2012-04-16,article,Editorial,,"['Labor and Jobs', 'Home Health Care', 'Wages and Salaries', 'Minimum Wage', 'United States Politics and Government', 'Editorials']"
Many U.S. Immigrants’ Children Seek American Dream Abroad,2012-04-16,article,News,,"['Labor and Jobs', 'Americans Abroad', 'Immigration and Emigration', 'Entrepreneurship', 'Economic Conditions and Trends']"
Trying to Turn Arizona Blue,2012-04-16,multimedia,Interactive Feature,,['Presidential Election of 2012']
Antibiotics Off the Farm,2012-04-16,article,Editorial,,"['ANTIBIOTICS', 'Agriculture and Farming', 'Regulation and Deregulation of Industry', 'Labeling and Labels', 'ANIMALS', 'Livestock', 'Editorials']"
Raising Twins Where They May Never ‘Belong’,2012-04-16,article,News,,"['Families and Family Life', 'Homosexuality', 'Parenting']"
Car Hits and Kills a Boy in Brooklyn,2012-04-16,article,News,,"['Traffic Accidents and Safety', 'Hit-and-Run Drivers', 'Bicycles and Bicycling']"
"Obama Camp, Seeing Shift, Bets on Long Shot in Arizona",2012-04-16,article,News,,"['Voter Registration and Requirements', 'Hispanic-Americans', 'Presidential Election of 2012']"
Lottery Numbers,2012-04-16,article,List,,['Lotteries']
3 Arrested in Manhattan as March Turns Into a Melee,2012-04-16,article,News,,"['Book Fairs', 'Demonstrations, Protests, and Riots', 'Restaurants']"
Going Gets Rough; Flyers Take Charge,2012-04-16,article,News,,"['Playoff Games', 'Hockey, Ice']"
Pseudoscience and Tennessee’s Classrooms,2012-04-16,article,Editorial,,"['Law and Legislation', 'Evolution', 'Creationism and Intelligent Design', 'Editorials', 'Global Warming', 'Education (K-12)']"
Victims’ Advocates Protest as Prosecutors Detain 17-Year-Old Rape Victim in California,2012-04-16,article,News,,"['Juvenile Delinquency', 'Crime and Criminals', 'Sex Crimes', 'Witnesses']"
Unanswered Questions in F.C.C.’s Google Case,2012-04-16,article,News,,"['Wireless Communications', 'Fines (Penalties)', 'Privacy', 'Maps', 'Computers and the Internet', 'Fifth Amendment (US Constitution)']"
Homegrown Bomb Plot Is Rarity for Open Court,2012-04-16,article,News,,['Terrorism']
More Blacks in Management Would Be a True Robinson Tribute,2012-04-16,article,News,,"['Draft and Recruitment (Sports)', 'Blacks', 'Black People', 'Race and Ethnicity', 'Baseball']"
‘Peter and the Starcatcher’,2012-04-16,multimedia,Slideshow,,['Theater']
Americas Meeting Ends With Discord Over Cuba,2012-04-16,article,News,,"['United States International Relations', 'Summit of the Americas']"
Steely Traffic Managers Ease a Holland Tunnel Snarl,2012-04-16,article,News,,"['Roads and Traffic', 'Holland Tunnel']"
Effortless Flights of Fancy,2012-04-16,article,Review,,['Theater']
Corrections: April 16,2012-04-16,article,Correction,,[]
Tutoring Surges With Fight for Middle School Spots,2012-04-16,article,News,,"['Education (K-12)', 'Tutors and Tutoring', 'ADMISSIONS STANDARDS', 'Gifted Students']"
Fire in Catskills Ravages Site of Old Brown’s Hotel,2012-04-16,article,News,,"['Condominiums', 'Comedy and Humor', 'Fires and Firefighters']"
Opening Up a Path to Four-Year Degrees,2012-04-16,article,News,,"['Community Colleges', 'Colleges and Universities']"
Two Giants of Finance Will Release Diversity Data,2012-04-16,article,News,,"['Hiring and Promotion', 'Pensions and Retirement Plans', 'Minorities', 'Banking and Financial Institutions']"
Do We Need More Advice About Eating Well?,2012-04-16,article,News,,[]
G.O.P. Lawmakers and Romney Face a Delicate Tango,2012-04-16,article,News,,"['Presidential Election of 2012', 'United States Politics and Government']"
Let the Nanotargeting Begin,2012-04-16,article,News,,"['Elections', 'Political Advertising', 'Presidential Election of 2012']"
Gingrich and Paul Defy Calls to Rally Around Romney,2012-04-16,article,News,,"['Presidential Election of 2012', 'Republican National Convention']"
Spanish King’s Hip Surgery Follows Controversial Hunting Trip,2012-04-16,article,News,,"['Hunting and Trapping', 'Surgery and Surgeons']"
‘We’re Not Really Bad Kids’,2012-04-16,article,News,,"['Juvenile Delinquency', 'Series', 'Basketball', 'Education (K-12)']"
Ai Weiwei on the Pen and the Gun,2012-04-16,article,News,,"['Blogs and Blogging (Internet)', 'Computers and the Internet', 'Freedom of the Press', 'Human Rights and Human Rights Violations', 'Politics and Government', 'Surveillance of Citizens by Government']"
Photo Replay: April 15,2012-04-16,multimedia,Slideshow,,['Sailboats and Sailing']
"On Block in Harlem, Neighbors’ Push for Restoration Will End in Demolition",2012-04-16,article,News,,"['Demolition', 'Brownstones', 'Restoration and Renovation', 'Historic Buildings and Sites', 'Real Estate and Housing (Residential)']"
"In Market for Rings, Any Price Seems Worth Paying",2012-04-16,article,News,,"['World Series', 'Baseball']"
"April 16, 1947 | Fire Causes Huge Explosion in Texas City",2012-04-16,article,News,,[]
New Tumult in Egypt’s Politics After Panel Bars 3 Candidates for President,2012-04-16,article,News,,"['Politics and Government', 'Elections']"
Word of the Day | perceptive,2012-04-16,article,News,,[]
"In Ad Campaign, SAP Looks Beyond Business Customers",2012-04-16,article,News,,['ADVERTISING AND MARKETING']
Towns Is Said to Decline to Run Again for Congress,2012-04-16,article,News,,[]
Yankees’ Slumbering Bats Quickly Come to Life,2012-04-16,article,News,,['Baseball']
‘Good Wife’ Watch: A Political Spouse Once More,2012-04-16,article,News,,[]
"Americans, the Tax Man Cometh",2012-04-16,article,News,,"['Americans Abroad', 'Federal Taxes (US)', 'Tax Evasion', 'Taxation']"
"News Quiz | April 16, 2012",2012-04-16,article,News,,[]
"As Army Prepares to Shrink, Its Chief Tries to Reassure His Soldiers",2012-04-16,article,News,,"['United States Defense and Military Forces', 'Afghanistan War (2001- )', 'September 11 (2001)', 'Iraq War (2003-11)']"
"Raising the Memory of the Titanic, and a City’s Role in Its Creation",2012-04-16,article,News,,"['Titanic (Ship)', 'Monuments and Memorials', 'Museums', 'Economic Conditions and Trends']"
Is Siachen Worth Fighting Over?,2012-04-16,article,News,,"['Avalanches', 'Snow and Snowstorms']"
M.L.S. Week 7: Sevens Wild,2012-04-16,article,News,,['Soccer']
Trickle of Returning NRIs to Become a Flood,2012-04-16,article,News,,"['Immigration and Emigration', 'United States Economy']"
Norwegian Man Claims Self-Defense in Killings,2012-04-16,article,News,,"['Muslims and Islam', 'Murders and Attempted Murders', 'Fringe Groups and Movements']"
U.N. Truce Observers Arrive in Syria as Shelling Continues,2012-04-16,article,News,,['Middle East and North Africa Unrest (2010- )']
Popular Support for Growing Trade Ties Between India and Pakistan,2012-04-16,article,News,,"['Conventions, Fairs and Trade Shows']"
Afghan Forces Quell Attack; Few Civilians Are Killed,2012-04-16,article,News,,"['Afghanistan War (2001- )', 'United States Defense and Military Forces']"
"Scenes From Coachella, Day 3",2012-04-16,article,News,,['Coachella Valley Music and Arts Festival']
"Test Yourself | Math, April 16, 2012",2012-04-16,article,News,,[]
Test-Taking Tips,2012-04-16,article,News,,[]
Places Without Power (of Any Sort),2012-04-16,article,News,,[]
GDF Suez to Buy Remaining Stake in British Utility for $10 Billion,2012-04-16,article,News,,"['Mergers, Acquisitions and Divestitures']"
A First Draft of 2012 Admissions Decisions at Dozens of Universities,2012-04-16,article,News,,"['ADMISSIONS STANDARDS', 'Colleges and Universities']"
Gender and the Polls,2012-04-16,article,News,,['Women and Girls']
"Justin Blackmon, Second-Ranked Receiver in 2012 Draft",2012-04-16,article,News,,"['Draft and Recruitment (Sports)', 'Football']"
Who Knows What Bugs Lurk in Imported Plants?,2012-04-16,article,News,,[]
How Do You Archive Your Life?,2012-04-16,article,News,,[]
Q&A: Slinging Photos Between Devices,2012-04-16,article,News,,[]
This Week in Small Business: Raising Caine,2012-04-16,article,News,,[]
Bangalore’s ‘Maybe Virgin’ Generation,2012-04-16,article,News,,[]
In the Arcadian Woods,2012-04-16,article,News,,[]
A Half-Pound of iPhone Dock,2012-04-16,article,News,,['iPhone']
A Free Photo Lighting Lesson,2012-04-16,article,News,,"['iPad', 'Lighting', 'Photography']"
Carlyle Tries to Avoid Troubles of Other I.P.O.s,2012-04-16,article,News,,['Initial Public Offerings']
Opinion Report: Animal Antibiotics,2012-04-16,article,News,,[]
‘Mad Men’ Recap: Despair and Fisticuffs,2012-04-16,article,News,,[]
U.S.-Philippine War Games Start Amid China Standoff,2012-04-16,article,News,,"['International Relations', 'Defense and Military Forces']"
Citigroup’s First-Quarter Net Income Falls 2%,2012-04-16,article,News,,"['Banking and Financial Institutions', 'Company Reports']"
$53 Million Raised in March by Obama and Democratic Party,2012-04-16,article,News,,"['Campaign Finance', 'Presidential Election of 2012']"
Coty Discloses More Details of Avon Bid,2012-04-16,article,News,,"['Mergers, Acquisitions and Divestitures']"
Morning Take-Out,2012-04-16,article,News,,[]
"The Breakfast Meeting: Planning for Zimmerman Trial, and What Breitbart Wrought",2012-04-16,article,News,,[]
Monday Reading: When to Buy That Plane Ticket,2012-04-16,article,News,,[]
Gary Oldman to Direct Jack White Concert Webcast,2012-04-16,article,News,,"['Movies', 'Music', 'Rock Music']"
Vain Glorious | A New Face Balm for Men,2012-04-16,article,News,,[]
The Trademarked Beard,2012-04-16,article,News,,"['Beards', 'Copyrights and Copyright Violations', 'Trademarks and Trade Names']"
"On the Campaign Trail, Reciting Family History",2012-04-16,article,News,,['Elections']
Daily Report: Unanswered Questions About Google,2012-04-16,article,News,,"['Computers and the Internet', 'Privacy']"
"Testing, Tutoring and Worrying Occupy City School Parents",2012-04-16,article,News,,[]
Lee Equity Partners to Take Edelman Financial Private,2012-04-16,article,News,,"['Mergers, Acquisitions and Divestitures']"
"Morning Buzz, April 16: An Influx of 7-Elevens",2012-04-16,article,News,,[]
The Palin Counterfactual,2012-04-16,article,News,,[]
Goldman Sachs Sells Shares in China Bank for $2.5 Billion,2012-04-16,article,News,,"['Banking and Financial Institutions', 'Mergers, Acquisitions and Divestitures']"
What We’re Reading,2012-04-16,article,News,,[]
Great Wolf Declares KSL Takeover Bid Superior,2012-04-16,article,News,,"['Mergers, Acquisitions and Divestitures']"
Street-Crossing Time Trials,2012-04-16,article,News,,"['Traffic Signals and Signs', 'Walking']"
"The Horror, The Horror",2012-04-16,article,News,,[]
Leading Off: The N.H.L.’s Head Games,2012-04-16,article,News,,"['Baseball', 'Hockey, Ice']"
Ancient Chinese Relics to Be Displayed at Discovery Times Square,2012-04-16,article,News,,[]
Some Tax Breaks Unavailable to Same-Sex Couples,2012-04-16,article,News,,"['Same-Sex Marriage, Civil Unions and Domestic Partnerships', 'Taxation']"
Video of Anders Behring Breivik in Court,2012-04-16,article,News,,"['Murders and Attempted Murders', 'Terrorism']"
Animating Crumb,2012-04-16,multimedia,Video,,"['Art', 'Comic Books and Strips']"
"Business Day Live | April 16, 2012",2012-04-16,multimedia,Video,,"['Boycotts', 'Commodities']"
Maggie Smith Departing ‘Downton Abbey’? Studio Says ‘Not True’,2012-04-16,article,News,,[]
"To Fight a Dam, Rather Than ‘Live on Your Knees’",2012-04-16,article,News,,"['Awards, Decorations and Honors', 'Fishing, Commercial', 'Hydroelectric Power', 'Levees and Dams', 'Politics and Government', 'Water']"
Business Day Live: A Slowdown in China,2012-04-16,article,News,,[]
‘GMA’ Appears to Nudge ‘Today’ From Top Spot After 16 Years,2012-04-16,article,News,,"['News and News Media', 'Ratings (Audience Measurement)', 'Television']"
New York Public Library President is Taking Reader Questions,2012-04-16,article,News,,[]
"Scenes From Coachella, Day 3",2012-04-16,multimedia,Slideshow,,"['Coachella Valley Music and Arts Festival', 'Music']"
Kenyans Sweep Top Spots in a Warm Boston Marathon,2012-04-16,article,News,,"['Marathon Running', 'Boston Marathon']"
"Surviving a Deadly Twister, Twice in 65 Years",2012-04-16,article,News,,"['Weather', 'Tornadoes', 'Deaths (Fatalities)']"
Video of Taliban Firefight in Kabul and Its Aftermath,2012-04-16,article,News,,['Afghanistan War (2001- )']
Morning Walkabout: 4/16,2012-04-16,article,News,,[]
"In New York, Tutoring Intensifies in Race to Middle School",2012-04-16,article,News,,"['Education (K-12)', 'Tutors and Tutoring']"
Monday Motorsports: Nico Rosberg Wins First Formula One Grand Prix of His Career,2012-04-16,article,News,,"['Automobile Racing', 'Automobiles', 'Nascar Sprint Cup Series']"
Romney Talks of Ending Some Tax Deductions for Wealthy,2012-04-16,article,News,,"['Federal Taxes (US)', 'Presidential Election of 2012', 'Real Estate and Housing (Residential)', 'Tax Credits, Deductions and Exemptions']"
Numberplay: Living on the Far Side,2012-04-16,article,News,,"['Mathematics', 'Puzzles']"
Protesters Arrested in Sleep-Out and Demonstration Near Stock Exchange,2012-04-16,article,News,,"['Demonstrations, Protests and Riots']"
Death Row Inmate’s Best Lawyer Was Himself,2012-04-16,article,News,,"['Mental Health and Disorders', 'Public Defenders and Court-Appointed Lawyers (Criminal)', 'Capital Punishment', 'Legal Profession']"
Gearing Up for Test Day. And Then What?,2012-04-16,article,News,,[]
Street Style: Bomber and Varsity Jackets,2012-04-16,multimedia,Slideshow,,['Fashion and Apparel']
Look of the Moment | Kate Bosworth,2012-04-16,article,News,,[]
China Premier Calls for End to Corruption,2012-04-16,article,News,,"['Politics and Government', 'Corruption (Institutional)']"
Capitals Goalie Takes Rapid Rise Save by Save,2012-04-16,article,News,,"['Hockey, Ice']"
Slide Show: Day 3 at Coachella,2012-04-16,article,News,,['Coachella Valley Music and Arts Festival']
"In Economics, You Are What You Model",2012-04-16,article,News,,['Economics (Theory and Philosophy)']
A Population Antidote: High School for Girls,2012-04-16,article,News,,"['Education (K-12)', 'Population', 'Women and Girls']"
Anheuser-Busch InBev to Take Controlling Stake in Caribbean Brewer,2012-04-16,article,News,,"['Mergers, Acquisitions and Divestitures']"
Briton in a Chinese Scandal Reportedly Brokered Overseas Money Transfers,2012-04-16,article,News,,['Politics and Government']
U.N. Council to Expand North Korea Sanctions,2012-04-16,article,News,,"['ARMS CONTROL AND LIMITATION AND DISARMAMENT', 'Missiles and Missile Defense Systems', 'Satellites', 'Embargoes and Economic Sanctions', 'Nuclear Weapons']"
Supreme Court Rejects Former Enron Chief’s Latest Appeal,2012-04-16,article,News,,[]
Romney Moving Ahead With Search for Running Mate,2012-04-16,article,News,,"['Presidential Election of 2012', 'United States Politics and Government']"
Can Roads and Russian Forests Coexist?,2012-04-16,article,News,,"['Corruption (Institutional)', 'Environment', 'Forests and Forestry']"
Freedom Comes to Washington,2012-04-16,article,News,,"['Civil War (US) (1861-65)', 'Slavery']"
BTG Pactual Chief Fined Over Insider Trading,2012-04-16,article,News,,"['Initial Public Offerings', 'Insider Trading']"
Q. and A. With Stuart Elliott,2012-04-16,article,Question,,"['ADVERTISING AND MARKETING', 'Magazines', 'Perfumes and Fragrances', 'Amazon Kindle']"
Accounts and People of Note in the Advertising Industry,2012-04-16,article,News,,"['Appointments and Executive Changes', 'Hiring and Promotion', 'Public Relations and Publicity', 'ADVERTISING AND MARKETING']"
"The Tappan Zee’s Future, According to Readers",2012-04-16,article,News,,['Tappan Zee Bridge']
Rollaways of BMW 7 Series Sedans Prompt Upgrade of Safety Investigation,2012-04-16,article,News,,"['Automobile Safety Features and Defects', 'Automobiles']"
Disney to Team With Chinese Company to Make ‘Iron Man 3’,2012-04-16,article,News,,['Movies']
Coty Tries to Rally Support for Avon Bid Amid Skepticism,2012-04-16,article,News,,"['Mergers, Acquisitions and Divestitures']"
U.S. Candidate Is Chosen to Lead the World Bank,2012-04-16,article,News,,['Appointments and Executive Changes']
How the Buffett Rule Would Affect Small Businesses,2012-04-16,article,News,,"['Corporate Taxes', 'Federal Taxes (US)', 'High Net Worth Individuals', 'Income Tax', 'Small Business']"
Missing: 5 Guitars Belonging to Tom Petty Band,2012-04-16,article,News,,['Guitars']
Tribeca Film Festival Announces an Eclectic Lineup of Juries,2012-04-16,article,News,,['Tribeca Film Festival (NYC)']
Media Companies Ask Judge to Open Florida Defendant’s File,2012-04-16,article,News,,"['Murders and Attempted Murders', 'Media', 'News and News Media']"
"TimesCast | April 16, 2012",2012-04-16,multimedia,Video,,[]
Behind the Cover Story: Charles McGrath on Dreaming in Caro-ese,2012-04-16,article,News,,[]
Ads Urge ‘Book People’ to Help Children Read,2012-04-16,article,News,,"['Children and Childhood', 'Books and Literature', 'Reading and Writing Skills']"
J.K. Rowling Starts Her Potter Encyclopedia,2012-04-16,article,News,,['Books and Literature']
Image of the Day: April 16,2012-04-16,article,News,,"['Factories and Manufacturing', 'Rescues']"
The Myth of Shrinking Government,2012-04-16,article,News,,['Affordable Housing']
Iraq Election Official’s Arrest Casts Doubt on Prospect for Fair Voting,2012-04-16,article,News,,"['Politics and Government', 'Iraq War (2003-11)', 'Elections']"
Sex Pistols to Reissue ‘God Save the Queen’,2012-04-16,article,News,,['Music']
