headline,date,doc_type,material_type,section,keywords
Rescue Flight Evacuates 2 Sick Workers From the South Pole,2016-06-23,article,News,,"['Rescues', 'Evacuations and Evacuees']"
"Elvis, Madonna and Mao: Exploring Identity in China",2016-06-23,multimedia,Slideshow,,[]
Hillary Gossip Redux,2016-06-23,article,Op-Ed,,"['Presidential Election of 2016', 'Books and Literature']"
Policing the Police on Stop-and-Frisk,2016-06-23,article,Editorial,,"['Search and Seizure', 'Racial Profiling', 'Editorials', 'Fourth Amendment (US Constitution)', 'Suits and Litigation (Civil)']"
Understanding Gun Violence,2016-06-23,article,Editorial,,"['Gun Control', 'Federal Budget (US)', 'Editorials', 'State Legislatures', 'Research', 'Budgets and Budgeting']"
"Trump, Champion of the Downtrodden? Ha!",2016-06-23,article,Op-Ed,,"['Presidential Election of 2016', 'Speeches and Statements', 'Race and Ethnicity', 'Homosexuality and Bisexuality', 'Minorities', 'Muslims and Islam', 'Women and Girls']"
The Supreme Court’s Post-Scalia Term,2016-06-23,article,Op-Ed,,"['Organized Labor', 'Law and Legislation', 'AFFIRMATIVE ACTION', 'Executive Orders and Memorandums', 'Collective Bargaining', 'Regulation and Deregulation of Industry']"
A Broken Promise in Afghanistan,2016-06-23,article,Op-Ed,,"['Afghanistan War (2001-14)', 'Translation and Interpreters', 'Immigration and Emigration', 'Visas', 'United States Defense and Military Forces', 'United States International Relations']"
The World’s Disappearing Sand,2016-06-23,article,Op-Ed,,"['Sand and Gravel', 'Concrete', 'Conservation of Resources', 'Environment', 'Building (Construction)', 'Infrastructure (Public Works)', 'Urban Areas', 'Mines and Mining']"
"Elvis, Madonna and Mao: Exploring Identity in China",2016-06-23,article,News,,"['Celebrities', 'Photography']"
How Low Can the G.O.P. Go?,2016-06-23,article,Op-Ed,,['Presidential Election of 2016']
Brooklyn Apartment Wanted: Will Climb Stairs,2016-06-23,article,News,,"['Real Estate and Housing (Residential)', 'Renting and Leasing (Real Estate)']"
Will Ersatz Dollars Satisfy Cash-Starved Zimbabweans?,2016-06-23,article,News,,"['Banking and Financial Institutions', 'Currency', 'US Dollar (Currency)']"
Shawn Colvin and Steve Earle: Two Old Pals on the Road Together,2016-06-23,article,News,,"['Folk Music', 'Music']"
"In This Corner, Government Secrets and a Demoted Agent for Change",2016-06-23,article,News,,"['Boxing', 'Mixed Martial Arts', 'Corruption (Institutional)', 'Freedom of Information Act', 'Traumatic Brain Injury']"
"Despite Campaign Woes, Donald Trump Flies to Scotland to Tend to Business Interests",2016-06-23,article,News,,"['Presidential Election of 2016', 'United States Politics and Government']"
18 Newly Implicated in Killers’ Escape. Zero Fired; Zero Prosecuted.,2016-06-23,article,News,,"['Prison Escapes', 'Prison Guards and Corrections Officers', 'Inspectors General', 'Prisons and Prisoners']"
Making Sense of ‘Brexit’ in 4 Charts,2016-06-23,article,News,,"['Referendums', 'Foreign Workers', 'Immigration and Emigration', 'Voting and Voters', 'Great Britain Withdrawal from EU (Brexit)']"
Leaving the Pediatrician? Not at 26,2016-06-23,article,News,,"['Doctors', 'Health Insurance and Managed Care', 'Teenagers and Adolescence']"
Portraits of a Nation Contemplating a ‘Brexit’,2016-06-23,multimedia,Interactive Feature,,"['Referendums', 'Great Britain Withdrawal from EU (Brexit)']"
"Handel and Hendrix, Side by Side",2016-06-23,article,List,,['Museums']
Hendrix and Handel Slept Here: A Museum’s Strange Bedfellows,2016-06-23,article,News,,"['Museums', 'Pop and Rock Music', 'Music']"
Hong Kong Lawmaker ‘Long Hair’ Is Arrested Over Donation,2016-06-23,article,News,,"['Campaign Finance', 'Ethics and Official Misconduct']"
How You Fight With Your Spouse May Affect Different Body Parts,2016-06-23,article,News,,"['ANGER (EMOTION)', 'Emotions', 'Love (Emotion)', 'Marriages']"
"Democratic Party, ‘Brexit,’ N.B.A. Draft: Your Thursday Briefing",2016-06-23,article,briefing,,[]
New York Today: Beyond Stonewall,2016-06-23,article,briefing,,[]
How the Faena District Is Transforming Miami’s Mid-Beach,2016-06-23,article,News,,['Travel and Vacations']
Crab Is Sacred at the Crabby Shack,2016-06-23,multimedia,Slideshow,,"['Crabs', 'Restaurants']"
"The Crabby Shack, a Shrine to the Crustacean",2016-06-23,article,Review,,"['Seafood', 'Crabs', 'Restaurants']"
Is Selfie Culture Making Our Kids Selfish?,2016-06-23,article,News,,"['Children and Childhood', 'Empathy', 'Parenting', 'Smartphones']"
Chappatte on Brexit: Free at Last?,2016-06-23,article,Op-Ed,,"['Referendums', 'Great Britain Withdrawal from EU (Brexit)']"
"Man in Iwo Jima Flag Photo Was Misidentified, Marine Corps Says",2016-06-23,article,News,,"['World War II (1939-45)', 'United States Defense and Military Forces', 'Movies', 'Photography']"
Morning Agenda: An Early Winner in the ‘Brexit Vote’,2016-06-23,article,News,,"['Canals', 'Conflicts of Interest', 'For-Profit Schools', 'Fuel Emissions (Transportation)', 'Health Insurance and Managed Care', 'Initial Public Offerings', 'Medicare', 'Mergers, Acquisitions and Divestitures', 'Polls and Public Opinion', 'Private Equity', 'Sovereign Wealth Funds', 'Start-ups', 'Suits and Litigation (Civil)', 'Tax Evasion', 'Venture Capital']"
"Trump’s Immigration Policies May Cause Trouble Among Independents, Poll Shows",2016-06-23,article,News,,"['Immigration and Emigration', 'Presidential Election of 2016', 'Polls and Public Opinion']"
Croatia’s Political Chaos,2016-06-23,article,Editorial,,[]
Obama Begins West Coast Trip With Business Conference,2016-06-23,article,News,,['United States Politics and Government']
Why a Top 3 N.B.A. Draft Pick Is Crucial for Championship Teams,2016-06-23,article,News,,"['Draft and Recruitment (Sports)', 'NBA Championship']"
The Secret to a Great Chicken Parm: Grill It,2016-06-23,article,News,,"['Cooking and Cookbooks', 'Grilling (Cooking)', 'Recipes']"
Cynthia Ozick’s Long Crusade,2016-06-23,article,News,,"['Writing and Writers', 'Jews and Judaism', 'Books and Literature']"
Annie Proulx: By the Book,2016-06-23,article,Question,,"['Books and Literature', 'Writing and Writers']"
Donald Trump Follows a Good Day With a Trip to Scotland,2016-06-23,article,News,,['Presidential Election of 2016']
Why Isn’t Donald Trump Campaigning in Swing States?,2016-06-23,article,News,,"['Presidential Election of 2016', 'Political Advertising', 'Voting and Voters', 'Polls and Public Opinion', 'Asian-Americans']"
Ben Simmons Looks to LeBron James as Model as N.B.A. Draft Looms,2016-06-23,article,News,,"['Basketball', 'Draft and Recruitment (Sports)', 'Documentary Films and Programs']"
Review: ‘Swiss Army Man’ Is a Buddy Movie in Which One Pal Is Dead,2016-06-23,article,Review,,['Movies']
Louis Vuitton: Spring 2017,2016-06-23,multimedia,Slideshow,,"[""Men's Fashion Week"", 'Paris Fashion Week']"
China Vows to Replace ‘Poisonous’ Running Tracks at Schools,2016-06-23,article,News,,"['Education (K-12)', 'Hazardous and Toxic Substances', 'Children and Childhood']"
Acquittal in Freddie Gray Case Casts Doubts About Future Trials,2016-06-23,article,News,,"['Police Brutality, Misconduct and Shootings', 'Blacks', 'Black People', 'Decisions and Verdicts', 'Murders, Attempted Murders and Homicides']"
1891: Dr. Hermann Adler Installed as Chief Rabbi,2016-06-23,article,News,,"['Jews and Judaism', 'Social Conditions and Trends', 'Synagogues']"
Not Forgotten: Dr. Jonas Salk and the Continuing Battle Against Polio,2016-06-23,multimedia,Interactive Feature,,"['Poliomyelitis', 'Vaccination and Immunization']"
Vitra Museum’s New Space Takes Design Classics Out of Storage,2016-06-23,article,News,,"['Museums', 'Design']"
Cerberus Offers to Buy G.E.’s French Consumer Finance Business,2016-06-23,article,News,,"['Mergers, Acquisitions and Divestitures']"
Christo’s ‘Floating Piers’ to Close at Night for Repairs,2016-06-23,article,News,,['Art']
"At Clubbed Thumb, Nurturing a Theater of the Weird",2016-06-23,article,News,,['Theater']
World Leaders on ‘Brexit’ Vote,2016-06-23,multimedia,Video,,"['Referendums', 'Great Britain Withdrawal from EU (Brexit)']"
"Democrats End Sit-In After 25 Hours, Drawing Attention to Gun Control",2016-06-23,article,News,,"['Gun Control', 'Demonstrations, Protests and Riots', 'Orlando, Fla, Shooting (2016)', 'United States Politics and Government']"
"Voting Again, Spain Faces Threat to Two-Party System",2016-06-23,article,News,,"['Elections', 'Legislatures and Parliaments']"
Tributes Held for Jo Cox,2016-06-23,multimedia,Video,,['Funerals and Memorials']
"Maserati Recalls 13,000 Cars for Fiat Chrysler Gearshift Issue",2016-06-23,article,News,,"['Automobile Safety Features and Defects', 'Recalls and Bans of Products']"
Real Truths on Virtual Reality,2016-06-23,article,News,,['Virtual Reality (Computers)']
Rick Owens: Spring 2017,2016-06-23,multimedia,Slideshow,,"[""Men's Fashion Week""]"
Watching Virtual Reality Videos on YouTube,2016-06-23,article,Question,,"['Virtual Reality (Computers)', 'Smartphones']"
"In a New Comic, a Transgender Superhero Hides 2 Identities",2016-06-23,article,News,,"['Comic Books and Strips', 'Transgender and Transsexuals']"
Kolor: Spring 2017,2016-06-23,multimedia,Slideshow,,"[""Men's Fashion Week""]"
David Ortiz Is Hitting Like an M.V.P. at Age 40,2016-06-23,article,News,,['Baseball']
Bill Simmons as TV Host: Heavy on Sports and Cursing,2016-06-23,article,Review,,['Television']
Supreme Court Upholds Affirmative Action Program at University of Texas,2016-06-23,article,News,,"['AFFIRMATIVE ACTION', 'Colleges and Universities', 'ADMISSIONS STANDARDS', 'Race and Ethnicity']"
"C-Span, Gun Control and a Protest Made for Streaming",2016-06-23,article,News,,"['United States Politics and Government', 'Gun Control', 'Television', 'Social Media', 'News and News Media']"
Reading Novels at Medical School,2016-06-23,article,News,,"['Books and Literature', 'Depression (Mental)', 'Doctors', 'Medical Schools', 'Poetry and Poets']"
Supreme Court Tie Blocks Obama Immigration Plan,2016-06-23,article,News,,"['Immigration and Emigration', 'Law and Legislation', 'Deportation', 'Illegal Immigration', 'Decisions and Verdicts']"
Breaking the Glass Slipper: Where Are the Female Choreographers?,2016-06-23,article,News,,"['Dancing', 'Women and Girls']"
Dance Luminaries Weigh in on the Conspicuous Absence of Female Choreographers,2016-06-23,article,News,,"['Dancing', 'Women and Girls']"
1916: Arabs Revolt Against Turkey,2016-06-23,article,News,,"['Ottoman Empire', 'World War I (1914-18)']"
The Gospel Singer Mavis Staples to Get Kennedy Center Honor,2016-06-23,article,News,,"['Kennedy Center Honors', 'Music']"
"A ‘Home Land Security’ Art Show, at the Foot of the Golden Gate Bridge",2016-06-23,article,News,,['Art']
"Alexander Skarsgard, of Sound Mind and Body to Play Tarzan",2016-06-23,article,News,,"['Movies', 'ACTORS AND ACTRESSES', 'Race and Ethnicity']"
Police Kill Movie Theater Assailant in Germany,2016-06-23,article,News,,"['Kidnapping and Hostages', 'Firearms']"
Why The New York Times is Working With Matter,2016-06-23,article,News,,['Innovation']
Seeking to Define the Post-Mandela South Africa,2016-06-23,article,News,,[]
Supreme Court’s Decision on Immigration Case Affects Millions of Unauthorized Immigrants,2016-06-23,multimedia,Interactive Feature,,"['Illegal Immigration', 'Immigration and Emigration']"
Chris Mosier Is First Transgender Athlete in ESPN’s ‘Body Issue’,2016-06-23,article,News,,"['Transgender and Transsexuals', 'Nudism and Nudity', 'Athletics and Sports']"
"Good, Bad and Mad: Inside the News with Andrew Rosenthal",2016-06-23,audio,,,[]
"For Obama, Supreme Court Defeat Upends a Legacy on Immigration",2016-06-23,article,News Analysis,,"['Immigration and Emigration', 'Illegal Immigration', 'Deportation', 'Executive Orders and Memorandums', 'Hispanic-Americans', 'Presidential Election of 2016']"
Driven | 2016 Lamborghini Huracán,2016-06-23,multimedia,Video,,['Automobiles']
Video Review: Lamborghini Huracán LP 580-2 Is a Rear-Drive Dream,2016-06-23,article,News,,['Automobiles']
Britain’s Dreams of a ‘Swiss Miracle’ Look More Like Fantasy,2016-06-23,article,News,,"['International Trade and World Market', 'Referendums', 'Great Britain Withdrawal from EU (Brexit)']"
A Fresh Take on ‘Put an Egg on It’,2016-06-23,article,News,,"['Restaurants', 'Cooking and Cookbooks', 'Eggs', 'Grits', 'Chefs']"
"On Referendum Day, a Storm Hits London",2016-06-23,multimedia,Video,,"['Referendums', 'Great Britain Withdrawal from EU (Brexit)']"
"Credit Suisse Tries to Overhaul Its Image, but Problems Remain",2016-06-23,article,News,,"['Subprime Mortgage Crisis', 'Appointments and Executive Changes']"
Fashion Under a Sullen Sky,2016-06-23,article,News,,"['Paris Fashion Week', 'Fashion and Apparel', ""Men's Fashion Week""]"
"Twilio, a Cloud-Based Business, Soars After Its I.P.O.",2016-06-23,article,News,,"['Initial Public Offerings', 'Cloud Computing']"
Jeff Gennette to Succeed Terry Lundgren as Macy’s Chief,2016-06-23,article,News,,"['Shopping and Retail', 'Appointments and Executive Changes']"
Tornado Kills at Least 98 in Eastern China,2016-06-23,article,News,,['Tornadoes']
"At Valentino and Balenciaga, ‘War,’ Camo and the Unfinished Seam",2016-06-23,article,Review,,"['Paris Fashion Week', 'Fashion and Apparel', ""Men's Fashion Week""]"
Bank of America Merrill Lynch Hires Chief of European Mergers,2016-06-23,article,News,,['Appointments and Executive Changes']
"Good, Bad and Mad: Inside the News with Andrew Rosenthal",2016-06-23,article,News,,"['Gun Control', 'Endorsements', 'Presidential Election of 2016']"
"If a Friend Needs Therapy but Can’t Afford It, Should I Pay?",2016-06-23,article,News,,"['Customs, Etiquette and Manners', 'Friendship', 'Smoking and Tobacco', 'Parenting', 'Homosexuality and Bisexuality', 'Birthdays']"
Sheryl Sandberg on the Myth of the Catty Woman,2016-06-23,article,Op-Ed,,"['Women and Girls', 'Discrimination', 'Workplace Environment', 'Labor and Jobs']"
A Brief Guide to Today’s Supreme Court Decisions,2016-06-23,article,News,,"['Illegal Immigration', 'Immigration and Emigration', 'AFFIRMATIVE ACTION', 'Decisions and Verdicts', 'ABORTION']"
Popcast: Prince’s Fateful Flight and Judith Hill’s Story,2016-06-23,audio,,,['Music']
Reaction to a Supreme Court Tie on Immigration,2016-06-23,article,News,,['Illegal Immigration']
Popcast: Prince’s Fateful Flight and Judith Hill’s Story,2016-06-23,article,News,,['Pop and Rock Music']
"U.S. Partisanship Is Highest in Decades, Pew Study Finds",2016-06-23,article,News,,"['United States Politics and Government', 'Polls and Public Opinion', 'Research', 'ANGER (EMOTION)', 'Demonstrations, Protests and Riots']"
"Three Separate, Equal and Dysfunctional Branches of Government",2016-06-23,article,News,,"['United States Politics and Government', 'Immigration and Emigration', 'Gun Control', 'Illegal Immigration', 'Executive Orders and Memorandums']"
"Croatia Beat Spain, 2-1, but the Notable Score Came From the Orchestra",2016-06-23,article,News,,"['Music', 'Classical Music', 'Soccer', 'UEFA European Football Championship']"
Facebook Envy Lures Egyptian Teenagers to Europe and the Migrant Life,2016-06-23,article,News,,"['Middle East and Africa Migrant Crisis', 'Teenagers and Adolescence', 'Immigration and Emigration', 'Human Trafficking']"
Carven: Spring 2017,2016-06-23,multimedia,Slideshow,,"[""Men's Fashion Week"", 'Paris Fashion Week']"
"Rangers’ Ian Desmond Switches to the Outfield, and Doesn’t Look Back",2016-06-23,article,News,,['Baseball']
Tackling Teen Pregnancy (With More Than Just Sex Ed),2016-06-23,article,News,,"['Birth Control and Family Planning', 'Charter Schools', 'Condoms', 'Education (K-12)', 'Poverty', 'Pregnancy and Childbirth', 'Sex', 'Sex Education', 'Teenage Pregnancy', 'Women and Girls']"
New Nuclear Weapon’s Costs,2016-06-23,article,Letter,,['Nuclear Weapons']
Tip for Texters,2016-06-23,article,Letter,,['Text Messaging']
Testing the Clean-Energy Logic of a Tesla-SolarCity Merger,2016-06-23,article,News,,"['Mergers, Acquisitions and Divestitures', 'Alternative and Renewable Energy', 'Batteries', 'Solar Energy']"
Who Is a Jew? Maybe Not Woman Converted by Esteemed New York Rabbi,2016-06-23,article,News,,"['Jews and Judaism', 'Rabbis']"
Brooklyn Park’s Gift: Diversity,2016-06-23,article,Letter,,[]
"In “Punk Weekender,” a Spotlight on Women of the Punk Scene",2016-06-23,multimedia,Slideshow,,['Photography']
Supreme Court Ruling on Police Stops,2016-06-23,article,Letter,,['Search and Seizure']
"In London, a Celebration of All Things Punk",2016-06-23,article,News,,['Photography']
"Paul Giamatti, a Baseball Commissioner’s Son, Makes His Own Calls",2016-06-23,article,Question,,"['Movies', 'Baseball']"
What Old Monkeys and Old Humans Have in Common,2016-06-23,article,News,,"['Monkeys and Apes', 'Age, Chronological', 'Psychology and Psychologists']"
A Civil Rights Legacy,2016-06-23,article,Letter,,['Civil Rights Movement (1954-68)']
"1952 | ‘Eisenhower,’ a True Campaign Logo",2016-06-23,article,News,,['Logos']
A New Restaurant for (and of) the Berlin Art Scene,2016-06-23,article,News,,['Restaurants']
Should Your Driverless Car Hit a Pedestrian to Save Your Life?,2016-06-23,article,News,,"['Driverless and Semiautonomous Vehicles', 'Traffic Accidents and Safety', 'Research', 'Artificial Intelligence', 'Ethics (Personal)']"
"Ad From Trump Ally, Citing ’90s Scandals, Depicts Hillary Clinton as Anti-Woman",2016-06-23,article,News,,"['Presidential Election of 2016', 'Political Advertising', 'Political Action Committees', 'Women and Girls']"
Ruling on Caesar R. Goodson Jr. Charges in Freddie Gray Case,2016-06-23,multimedia,Interactive Feature,,[]
Photography’s Shifting Identity in an Insta-World,2016-06-23,article,Review,,"['Photography', 'Social Media']"
Adele’s ‘25’ Finally Comes to Streaming Services,2016-06-23,article,News,,"['Music', 'Audio Recordings, Downloads and Streaming']"
"Affirmative Action in College Admissions, Here to Stay",2016-06-23,article,Op-Ed,,"['Segregation and Desegregation', 'ADMISSIONS STANDARDS', 'Colleges and Universities', 'AFFIRMATIVE ACTION']"
Take the Learning Network Survey. Tell Us What You Think.,2016-06-23,article,News,,[]
"Senate Votes to Keep Gun Proposal Alive, but in Limbo",2016-06-23,article,News,,"['Gun Control', 'Law and Legislation']"
"Corey Lewandowski, Ex-Campaign Manager for Donald Trump, Joins CNN",2016-06-23,article,News,,"['Presidential Election of 2016', 'News and News Media']"
Yohji Yamamoto: Spring 2017,2016-06-23,multimedia,Slideshow,,"['Paris Fashion Week', ""Men's Fashion Week""]"
"Led Zeppelin Did Not Steal ‘Stairway to Heaven,’ Jury Says",2016-06-23,article,News,,"['Copyrights and Copyright Violations', 'Suits and Litigation (Civil)', 'Pop and Rock Music', 'Music']"
Chaos in the House Over Gun Control,2016-06-23,article,Letter,,['Gun Control']
Donald Trump to Convert $50 Million Loan Into a Contribution,2016-06-23,article,News,,"['Presidential Election of 2016', 'Campaign Finance']"
‘The Humans’ Will Stay on Broadway but Switch Theaters,2016-06-23,article,News,,['Theater']
Bank of America to Pay $415 Million to Settle S.E.C. Inquiry,2016-06-23,article,News,,"['Regulation and Deregulation of Industry', 'Subprime Mortgage Crisis']"
Dior Is Expected to Name Maria Grazia Chiuri as Artistic Director,2016-06-23,article,News,,"['Couture (Fashion)', 'Appointments and Executive Changes']"
N.H.L.’s Warm-Weather Outposts Produce Some Hot Prospects,2016-06-23,article,News,,"['Hockey, Ice', 'Draft and Recruitment (Sports)']"
The Supreme Court Has Upheld Affirmative Action. So Let’s Dump Mismatch Theory.,2016-06-23,article,Op-Ed,,"['AFFIRMATIVE ACTION', 'ADMISSIONS STANDARDS', 'Minorities', 'Colleges and Universities']"
"Men’s Fashion Shows: Balenciaga, Lemaire and Walter van Beirendonck",2016-06-23,multimedia,Slideshow,,"['Paris Fashion Week', ""Men's Fashion Week""]"
Justice Department Reaches Deal With Mississippi County on Prison Reform,2016-06-23,article,News,,"['Prisons and Prisoners', 'Police']"
How Has Food Shaped Your Identity?,2016-06-23,multimedia,Interactive Feature,,"['Cooking and Cookbooks', 'Race and Ethnicity']"
Reaction to Court Immigration Ruling,2016-06-23,multimedia,Video,,"['Immigration and Emigration', 'United States Politics and Government']"
‘Catastrophic’ Conditions Reported in Camp for People Fleeing Boko Haram,2016-06-23,article,News,,"['Malnutrition', 'Refugees and Displaced Persons', 'Humanitarian Aid', 'Terrorism']"
Supreme Court Decision on Affirmative Action Cheered by College Admissions Experts,2016-06-23,article,News,,"['ADMISSIONS STANDARDS', 'Race and Ethnicity', 'Colleges and Universities', 'AFFIRMATIVE ACTION']"
The Queens of Dish,2016-06-23,multimedia,Slideshow,,['Transvestism']
"36 Hours in Valencia, Spain",2016-06-23,multimedia,Interactive Feature,,['Travel and Vacations']
‘Leave’ Takes the Lead as Britain Awaits Outcome of E.U. Referendum,2016-06-23,article,News,,"['Referendums', 'Polls and Public Opinion', 'Great Britain Withdrawal from EU (Brexit)']"
"Buybacks by Companies Like Apple May Signal Danger, Not Growth",2016-06-23,article,News,,"['Corporations', 'Stocks and Bonds', ""Standard & Poor's 500-Stock Index"", 'Banking and Financial Institutions', 'Shareholder Rights and Activism']"
1930s Travel Films by the “Park Avenue Cubists”,2016-06-23,multimedia,Slideshow,,['Art']
Review: Matthew McConaughey Rebels Against Rebels in ‘Free State of Jones’,2016-06-23,article,Review,,['Movies']
"My Undocumented Mom, America’s Housekeeper",2016-06-23,article,Op-Ed,,"['Illegal Immigration', 'Deportation', 'Deferred Action for Childhood Arrivals', 'Domestic Service', 'Executive Orders and Memorandums']"
"Vintage 1930s Travel Films, Taken by the Berkshires’ Most Creative Couple",2016-06-23,article,News,,['Movies']
Why Do We Inherit Mitochondrial DNA Only From Our Mothers?,2016-06-23,article,News,,"['DNA (Deoxyribonucleic Acid)', 'Mitochondria', 'Genetics and Heredity', 'Biology and Biochemistry', 'Sperm']"
Dries Van Noten: Spring 2017,2016-06-23,multimedia,Slideshow,,"[""Men's Fashion Week""]"
Review: ‘Yarn’: And You Thought It Was Just for Knitting Mittens,2016-06-23,article,Review,,"['Movies', 'Art', 'Documentary Films and Programs']"
"A Year After the Same-Sex Marriage Ruling, How Goes It, Newlyweds?",2016-06-23,multimedia,Interactive Feature,,"['Same-Sex Marriage, Civil Unions and Domestic Partnerships']"
"Three’s a Trend: Big, Boxy Shoulders",2016-06-23,article,News,,"[""Men's Fashion Week""]"
It’s Gay Pride Weekend: Dress the Part,2016-06-23,article,News,,"['Culture (Arts)', 'Homosexuality and Bisexuality', 'Bars and Nightclubs', 'Parades', 'Transvestism']"
Anatomy of a Scene | ‘The Neon Demon’,2016-06-23,multimedia,Video,,[]
Nicolas Winding Refn Narrates a Scene From ‘The Neon Demon’,2016-06-23,article,News,,"['Movies', 'Fashion and Apparel']"
"Nation’s Biggest Banks Would All Withstand Recession, Fed Says",2016-06-23,article,News,,"['Banking and Financial Institutions', 'Dodd-Frank Wall Street Reform and Consumer Protection Act (2010)', 'Regulation and Deregulation of Industry']"
What to See in New York Art Galleries This Week,2016-06-23,multimedia,Interactive Feature,,['Art']
Review: ‘T-Rex’ Fights Like a Girl. And That’s Worth Gold.,2016-06-23,article,Review,,"['Documentary Films and Programs', 'Boxing', 'Olympic Games (2016)', 'Olympic Games (2012)', 'Movies']"
Bank Report Card: Part One,2016-06-23,multimedia,Interactive Feature,,['Banking and Financial Institutions']
"Review: In ‘The Phenom,’ Landing on the Couch for Losing the Strike Zone",2016-06-23,article,Review,,['Movies']
Review: ‘Septembers of Shiraz’ Revisits the 1979 Iranian Revolution,2016-06-23,article,Review,,['Movies']
"Review: In ‘The Kind Words,’ Siblings and a Secret",2016-06-23,article,Review,,['Movies']
A Comeback for Gabby Douglas at Age 20. That’s Gymnastics.,2016-06-23,article,News,,"['Gymnastics', 'Olympic Games (2012)', 'Olympic Games (2016)']"
"Review: In ‘Breaking a Monster,’ a Plea to Play Heavy Metal",2016-06-23,article,Review,,"['Movies', 'Music', 'Documentary Films and Programs']"
"Review: ‘Eat That Question,’ on Frank Zappa, the Media and Cultural Upheavals",2016-06-23,article,Review,,"['Movies', 'Documentary Films and Programs', 'Music']"
"‘Disguise: Masks and Global African Art,’ Where Tradition Meets Avant-Garde",2016-06-23,article,Review,,"['Art', 'Masks', 'Race and Ethnicity']"
Review: ‘From This Day Forward’ Attests to Love’s Adaptability,2016-06-23,article,Review,,"['Documentary Films and Programs', 'Transgender and Transsexuals', 'Movies']"
"Before He Was a Cubist, Picasso Was an Invertebrate",2016-06-23,article,News,,['Art']
"Review: In ‘The Neon Demon,’ Beauty Masks a Rotting Core",2016-06-23,article,Review,,['Movies']
Review: Angel Blue Makes Her Met Debut,2016-06-23,article,Review,,"['Opera', 'Music']"
The Museum of the City of New York to Examine a Gay Underground,2016-06-23,article,News,,"['Art', 'Museums', 'Sculpture']"
"Same Character, Different Film: Recurring Roles in Non-Sequels",2016-06-23,article,News,,['Movies']
‘Brexit’ and the Risks of Democracy,2016-06-23,article,News,,"['Polls and Public Opinion', 'Referendums', 'Great Britain Withdrawal from EU (Brexit)']"
"Review: ‘Wiener-Dog,’ the Tail That Wags Through a Few Bitter Lives",2016-06-23,article,Review,,['Movies']
"Review: ‘Three’ Asks, Any Mozart Aficionados in the House?",2016-06-23,article,Review,,['Movies']
Former Dallas Museum Director to Join African-American Art Foundation,2016-06-23,article,News,,['Art']
Theater Listings for June 24-30,2016-06-23,article,Schedule,,['Theater']
Review: ‘The Shallows’: Surfer Girl. Peckish Shark. Uh-Oh!,2016-06-23,article,Review,,['Movies']
