headline,date,doc_type,material_type,section,keywords
Thinking About Co-Signing a Loan? Proceed With Caution,2016-06-08,article,Question,,"['Personal Finances', 'Credit Cards', 'Student Loans', 'Consumer Protection', 'Credit Scores', 'Automobile Financing']"
Obama to Meet With Sanders to Nudge Him to Fully Back Clinton,2016-06-08,article,News,,['Presidential Election of 2016']
"A Milestone for Hillary Clinton, and for Women",2016-06-08,article,Letter,,"['Presidential Election of 2016', 'Women and Girls', 'Primaries and Caucuses']"
Enlisting Mosquitoes to Fight Zika,2016-06-08,multimedia,Video,,"['Zika Virus', 'Mosquitoes']"
Drummer Defends Stanford Student Convicted in Rape Case. Her Band Pays a Price.,2016-06-08,article,News,,"['Colleges and Universities', 'Music', 'Sex Crimes', 'Northside Festival (Music Festival)']"
Shooting in Tel Aviv,2016-06-08,multimedia,Slideshow,,['Terrorism']
Kendall & Kylie Selfie-Ready Swimsuits at Topshop,2016-06-08,article,News,,"['Shopping and Retail', 'Fashion and Apparel']"
Heels on the Ground: Beyoncé and the Army of Women at Her Command,2016-06-08,article,News,,"['Music', 'Dancing', 'Pop and Rock Music']"
An Art Show Inspired by Infomercials — and One Famous TV Psychic,2016-06-08,article,News,,"['Art', 'Blacks', 'Black People']"
The Modern Love Podcast: Cecily Strong Reads ‘When the Doorman Is Your Main Man’,2016-06-08,article,News,,"['Single Persons', 'Doormen', 'Podcasts', 'Dating and Relationships', 'Single Mothers']"
Review: A Deep Dive Into Benjamin Zander’s ‘Shining Eyes’,2016-06-08,article,Review,,"['Music', 'Classical Music']"
Review: ‘’Til Madness Do Us Part’ Finds Hell and Humanity,2016-06-08,article,Review,,"['Movies', 'Documentary Films and Programs', 'Mental Health and Disorders']"
"Review: ‘Universal Robots,’ a Sci-Fi Love Story in Slo-Mo",2016-06-08,article,Review,,['Theater']
‘Occupied’ and ‘The Bureau’: Two Gripping European Thrillers,2016-06-08,article,Review,,['Television']
"Hillary Clinton on Winning, and Why Her Mother Would Be Nervous",2016-06-08,article,News,,"['Presidential Election of 2016', 'Women and Girls', 'Primaries and Caucuses', 'United States Politics and Government']"
How a Dealer Prepares for the ‘Most Important’ Art Fair of the Year,2016-06-08,article,News,,"['Art', 'ART BASEL (FESTIVAL)']"
"At the Human Rights Watch Film Festival, a Lot of the Humans Are Women",2016-06-08,article,News,,"['Movies', ""Women's Rights"", 'Women and Girls', 'Human Rights and Human Rights Violations', 'Documentary Films and Programs']"
Review: ‘Himself and Nora’ Revels in a Complicated Joyce,2016-06-08,article,Review,,['Theater']
Review: Garbage Returns With ‘Strange Little Birds’,2016-06-08,article,Review,,['Music']
An Inside View as a Dealer Prepares for Art Basel,2016-06-08,multimedia,Slideshow,,"['Art', 'ART BASEL (FESTIVAL)']"
"Review: Allen Toussaint’s Last Album, ‘American Tunes’",2016-06-08,article,Review,,['Music']
100 Years of Jewish Fashion Design,2016-06-08,article,News,,"['Fashion and Apparel', 'Jews and Judaism', 'Suits (Apparel)']"
Six Bright and Breezy Summer Dresses to Buy Now,2016-06-08,multimedia,Interactive Feature,,"['Fashion and Apparel', 'Shopping and Retail', 'Dresses', 'Bathing Suits and Swimwear', 'T-Shirts (Apparel)']"
"Review: ‘Jackie Lynn,’ Further Proof That Haley Fohr Is Hard to Contain",2016-06-08,article,Review,,['Music']
U.S. and India Mark a New Moment in Relations as Narendra Modi Speaks to Congress,2016-06-08,article,News,,['United States International Relations']
"Hillary Clinton, Donald Trump, Cleveland Cavaliers: Your Wednesday Evening Briefing",2016-06-08,article,News,,[]
Your Evening Briefing,2016-06-08,multimedia,Slideshow,,[]
The Child Migrants of Africa,2016-06-08,multimedia,Slideshow,,[]
"Review: At School of American Ballet, Passing With Flying Colors",2016-06-08,article,Review,,['Dancing']
"Walter Curley, Venture Capitalist and U.S. Ambassador, Dies at 93",2016-06-08,article,Obituary (Obit),,"['Deaths (Obituaries)', 'Diplomatic Service, Embassies and Consulates', 'Venture Capital']"
Just How Bad an Election Night Was It for California Republicans?,2016-06-08,article,News,,"['Elections, Senate', 'Primaries and Caucuses', 'Hispanic-Americans']"
"Dennis McCullough, Pioneer of ‘Slow Medicine’ in End-of-Life Care, Dies at 72",2016-06-08,article,Obituary (Obit),,"['Deaths (Obituaries)', 'Elder Care', 'Doctors']"
Trial of 5 Rikers Guards Brings Out Culture of Violence at Jail,2016-06-08,article,News,,"['Prison Guards and Corrections Officers', 'Assaults']"
De Blasio Seeks Strength on M.T.A. Board Amid Challenges on Subway System,2016-06-08,article,News,,"['State Legislatures', 'Subways']"
Four Elements on the Periodic Table Get New Names,2016-06-08,article,News,,['Chemistry']
National Briefing,2016-06-08,article,News,,"['Elections, Senate', 'Education (K-12)', 'Budgets and Budgeting']"
"Jerome S. Bruner, Who Shaped Understanding of the Young Mind, Dies at 100",2016-06-08,article,Obituary (Obit),,"['Psychology and Psychologists', 'Children and Childhood', 'Deaths (Obituaries)']"
Justice Clarence Thomas’s Solitary Voice,2016-06-08,article,Op-Ed,,"['Blacks', 'Black People', 'Discrimination']"
Making Amends for a Splashing,2016-06-09,article,Brief,,"['Customs, Etiquette and Manners']"
Donald Trump’s Advice to Panicked Republicans: Man Up,2016-06-09,article,News,,"['Presidential Election of 2016', 'United States Politics and Government']"
Mets Reacquire Kelly Johnson to Bolster Depleted Lineup,2016-06-09,article,News,,"['Baseball', 'Sports Injuries', 'Trades (Sports)']"
"Theresa Saldana, Actress and Attack Survivor, Dies at 61",2016-06-09,article,Obituary (Obit),,"['ACTORS AND ACTRESSES', 'Deaths (Obituaries)']"
Violence and Corruption in a Prison Union,2016-06-09,article,Editorial,,"['Organized Labor', 'Prison Guards and Corrections Officers', 'Bribery and Kickbacks', 'Editorials']"
"Nick Bonino, Pummeled by Pucks, Revels in the Welts",2016-06-09,article,News,,"['Hockey, Ice', 'Playoff Games', 'Sports Injuries', 'Stanley Cup']"
"Three Hospitals Attacked in Rebel Side of Aleppo, Syria",2016-06-09,article,News,,"['Civilian Casualties', 'Hospitals', 'Bombs and Explosives', 'Defense and Military Forces']"
Speaker Paul Ryan to Issue His Agenda to Improve U.S. Security,2016-06-09,article,News,,"['Presidential Election of 2016', 'United States Politics and Government', 'Terrorism', 'Illegal Immigration']"
Tale of Two Draft Picks Plays Out in Mets-Pirates Game,2016-06-09,article,News,,"['Baseball', 'Draft and Recruitment (Sports)']"
"Weighted by Debt, Puerto Ricans Divided Over Federal Oversight",2016-06-09,article,News,,"['Credit and Debt', 'Law and Legislation', 'Economic Conditions and Trends']"
De Blasio Donor Emerges as Key Witness in Corruption Case. What Else Does He Know?,2016-06-09,article,News,,"['Campaign Finance', 'Corruption (Institutional)', 'Politics and Government']"
Michigan’s Jim Harbaugh Blazes Path With Satellite Camps,2016-06-09,article,News,,"['Football (College)', 'Camps and Camping', 'Colleges and Universities', 'Football']"
De Blasio and City Council Agree on $82.1 Billion Budget,2016-06-09,article,News,,['Budgets and Budgeting']
Novel Strategy Puts Big Soda Tax Within Philadelphia’s Reach,2016-06-09,article,News,,"['Soft Drinks', 'Sales and Excise Taxes', 'City Councils']"
Historic Import of Hillary Clinton’s Victory Is One More Source of Division,2016-06-09,article,News,,"['Presidential Election of 2016', 'Women and Girls']"
‘Hamilton’ Raises Ticket Prices: The Best Seats Will Now Cost $849,2016-06-09,article,News,,"['Theater', 'Ticket Scalping', 'Prices (Fares, Fees and Rates)']"
A Glaring Climate Shift Joins Trump’s Long Line of Flip-Flops,2016-06-09,article,News,,[]
Manhattan Street Is Renamed After Norman Rockwell,2016-06-09,article,News,,"['Art', 'Names, Geographical', 'Education (K-12)']"
Donald Trump Hires Pollster for New York,2016-06-09,article,News,,"['Presidential Election of 2016', 'Polls and Public Opinion']"
Juicy Ending,2016-06-09,article,News,,['Crossword Puzzles']
Brazil Overwhelms Haiti at Copa América,2016-06-09,article,News,,"['Soccer', 'Copa America (Soccer)']"
"Review: ‘Indian Summer,’ Toes in the Sand and Chemistry in the Air",2016-06-09,article,Review,,['Theater']
New York City to Help Blacks and Hispanics Attend Elite High Schools,2016-06-09,article,News,,"['Education (K-12)', 'Tests and Examinations', 'Blacks', 'Black People', 'Hispanic-Americans', 'Minorities']"
"‘The Americans,’ in Its Melancholy Fourth Season, Was ‘Breaking Sad’",2016-06-09,article,News,,['Television']
Dylan Baker on ‘The Americans’ Finale and His Character’s Monologue,2016-06-09,article,Question,,['Television']
‘The Americans’ Season 4 Finale: What Lies Ahead,2016-06-09,article,Review,,['Television']
"Cavs Flip the Script at Home, Routing the Warriors",2016-06-09,article,News,,"['Basketball', 'Playoff Games', 'NBA Championship']"
Mets Rally in Eighth and Edge Pirates in 10,2016-06-09,article,News,,['Baseball']
Word of the Day + Quiz | balm,2016-06-09,article,News,,[]
Carlos Beltran Takes the Yankees on His Aging Back,2016-06-09,article,News,,['Baseball']
"Corrections: June 9, 2016",2016-06-09,article,News,,[]
What’s on TV Thursday,2016-06-09,article,Schedule,,"['Television', 'Movies', 'Video Recordings, Downloads and Streaming']"
American Distance Star Plans to Run New York City Marathon,2016-06-09,article,News,,"['Track and Field', 'New York City Marathon', 'Olympic Games (2016)', 'Marathon Running']"
Quotation of the Day,2016-06-09,article,Quote,,[]
Emerging Young Photographers in the South Bronx,2016-06-09,multimedia,Slideshow,,[]
A French Minister Who Attracts Applause and Anger Considers a Bigger Stage,2016-06-09,article,News,,"['Demonstrations, Protests and Riots', 'Labor and Jobs', 'Economic Conditions and Trends']"
Emerging Young Photographers in the South Bronx,2016-06-09,article,News,,"['Education (K-12)', 'Photography']"
China Should Shut Down Zombie Businesses to Help the Economy,2016-06-09,article,Editorial,,"['International Trade and World Market', 'Factories and Manufacturing', 'Economic Conditions and Trends', 'Credit and Debt', 'Labor and Jobs', 'Editorials']"
The Hillary and Bernie Road Trip,2016-06-09,article,Op-Ed,,['Presidential Election of 2016']
"Muhammad Ali, the Political Poet",2016-06-09,article,Op-Ed,,"['Poetry and Poets', 'Blacks', 'Black People', 'Boxing']"
The Senate’s Confirmation Shutdown,2016-06-09,article,Editorial,,"['Courts and the Judiciary', 'United States Politics and Government', 'Editorials']"
"Sanders, Clinton and, er, President Trump?",2016-06-09,article,Op-Ed,,['Presidential Election of 2016']
Should For-Profit Colleges Benefit From the G.I. Bill?,2016-06-09,article,News,,[]
"The Stock Market Is Optimistic, So What’s Your Excuse?",2016-06-09,article,News,,"['United States Economy', 'Stocks and Bonds', ""Standard & Poor's 500-Stock Index"", 'Dow Jones Stock Average']"
"China’s Dog Meat Festival Is Again at Hand, and Opponents Are Lining Up",2016-06-09,article,News,,"['Animal Abuse, Rights and Welfare', 'Dogs', 'Festivals']"
2016 Found Poem Favorite | ‘Amy’,2016-06-09,article,News,,[]
Baseball Lessons in an Unlikely Outpost,2016-06-09,multimedia,Slideshow,,"['Baseball', 'Missionaries']"
Japanese Plant Seeds of Baseball Throughout Africa,2016-06-09,article,News,,"['Baseball', 'Olympic Games (2020)', 'World Baseball Classic']"
Afghanistan by Choice,2016-06-09,multimedia,Video,,"['Immigration and Emigration', 'Refugees and Displaced Persons', 'Terrorism']"
Afghanistan by Choice,2016-06-09,article,Op-Ed,,"['Refugees and Displaced Persons', 'Afghanistan War (2001-14)', 'Immigration and Emigration']"
Dong Energy Valued at $15 Billion in Copenhagen I.P.O.,2016-06-09,article,News,,"['Initial Public Offerings', 'Wind Power']"
News Q’s | Light Sentence for Brock Turner in Stanford Rape Case Draws Outrage,2016-06-09,article,News,,[]
A Chinese Delicacy Straight From the Swiftlet’s Mouth,2016-06-09,article,News,,"['Soups', 'Swiftlet (Bird)']"
When Bullets Hit Bystanders,2016-06-09,multimedia,Interactive Feature,,"['Murders, Attempted Murders and Homicides', 'Firearms', 'Blacks', 'Black People']"
Student Question | Do Your Parents Try Too Hard to Be Cool?,2016-06-09,article,News,,[]
Choosing a School for My Daughter in a Segregated City,2016-06-09,article,News,,"['Education (K-12)', 'Blacks', 'Black People', 'Hispanic-Americans', 'Segregation and Desegregation']"
Isn’t the Primary Over? Why Bernie Sanders Won’t Quit,2016-06-09,article,News,,"['Presidential Election of 2016', 'Democratic National Convention', 'Primaries and Caucuses']"
"Drug That Killed Prince Is Making Mexican Cartels Richer, U.S. Says",2016-06-09,article,News,,"['Fentanyl', 'Drug Cartels', 'Drug Abuse and Traffic', 'Heroin', 'Smuggling']"
Euro 2016: Who’s Playing and How Does It Work?,2016-06-09,article,News,,"['Soccer', 'UEFA European Football Championship']"
"All That Sex and Blood, Mr. De Palma!",2016-06-09,article,News,,['Movies']
Brooklyn Apartment Sticker Shock,2016-06-09,article,News,,"['Real Estate and Housing (Residential)', 'Renting and Leasing (Real Estate)']"
Where Listening Is the New Lecture,2016-06-09,article,News,,"['Children and Childhood', 'Education (K-12)']"
"Bernie Sanders, Hillary Clinton, Cleveland Cavaliers: Your Thursday Briefing",2016-06-09,article,briefing,,[]
New York Today: Days at the Races,2016-06-09,article,briefing,,[]
Senate Democrats to Release a Policy Agenda,2016-06-09,article,News,,['United States Politics and Government']
Where to Go in Paris’s 11th Arrondissement,2016-06-09,article,News,,['Travel and Vacations']
"Ready, Set, Hold That Pose! Have Smartphones Ruined Racing?",2016-06-09,article,News,,"['New York City Marathon', 'Photography', 'Running', 'Smartphones', 'Social Media']"
Japan Summons Chinese Envoy After Naval Ship Nears Disputed Islands,2016-06-09,article,News,,"['United States International Relations', 'International Relations', 'Defense and Military Forces', 'Ships and Shipping', 'Diplomatic Service, Embassies and Consulates']"
Morning Agenda:  A Bearish George Soros Trades Again,2016-06-09,article,News,,"['Banking and Financial Institutions', 'Conflicts of Interest', 'Federal Taxes (US)', 'Freedom of Information Act', 'Gold', 'Health Insurance and Managed Care', 'Hedge Funds', 'Puerto Ricans', 'Start-ups', 'Tax Evasion', 'Taxation', 'Wind Power']"
Bernie Sanders Meets President Obama and Pledges to Work to Defeat Donald Trump,2016-06-09,article,News,,['Presidential Election of 2016']
The American Way of Drinking,2016-06-09,article,News,,"['ALCOHOLIC BEVERAGES', 'Cocktails and Mixed Drinks']"
Mollie Hemingway Hates How Feminists Talk About Sex,2016-06-09,article,News,,"['Libertarianism (US Politics)', 'Presidential Election of 2016', 'Same-Sex Marriage, Civil Unions and Domestic Partnerships', 'Christians and Christianity']"
How We Measured Voters,2016-06-09,article,News,,"['Polls and Public Opinion', 'Blacks', 'Black People', 'Hispanic-Americans', 'Presidential Election of 2008', 'Youth']"
How We Built Our Model,2016-06-09,article,News,,"['Polls and Public Opinion', 'Voting and Voters', 'Race and Ethnicity', 'Presidential Election of 2012']"
Finding Ways to Keep Patients at Home,2016-06-09,article,News,,"['Death and Dying', 'Elderly', 'Home Health Care', 'Living Wills and Health Care Proxies', 'Nursing Homes']"
There Are More White Voters Than People Think. That’s Good News for Trump.,2016-06-09,article,News,,"['Presidential Election of 2016', 'Presidential Election of 2012', 'Polls and Public Opinion', 'Blacks', 'Black People', 'Hispanic-Americans', 'Minorities']"
"A Rising Chinese Actor, Dong Zijian, on Where the Good Movies Are Now",2016-06-09,article,Question,,"['Movies', 'ACTORS AND ACTRESSES']"
"He Had 8 Convictions for Driving Drunk. On His 9th, He Got Life.",2016-06-09,article,News,,"['Drunken and Reckless Driving', 'Sentences (Criminal)']"
"Ireland Abortion Ban Violated Woman’s Human Rights, U.N. Panel Says",2016-06-09,article,News,,"['ABORTION', 'Human Rights and Human Rights Violations', 'Birth Defects', ""Women's Rights"", 'Discrimination']"
The New Lanvin: A First Look,2016-06-09,article,News,,['Fashion and Apparel']
Common-Sense Steps to Deal With the Migrant Crisis,2016-06-09,article,Op-Ed,,"['Refugees and Displaced Persons', 'Illegal Immigration', 'Middle East and Africa Migrant Crisis']"
Driven | Porsche 911 Carrera S Cabriolet,2016-06-09,multimedia,Video,,['Automobiles']
Video Review: Porsche 911 Redesign Is Revved Up,2016-06-09,article,News,,['Automobiles']
When Classical Musicians Go Digital,2016-06-09,article,News,,"['Music', 'Tablet Computers', 'Science and Technology', 'Classical Music', 'Manuscripts', 'iPad', 'Computers and the Internet']"
Separated at Birth,2016-06-09,article,Op-Ed,,"['Children and Childhood', 'Social Conditions and Trends', 'Income Inequality', 'Education (K-12)']"
"LeBron James Leaps to Life, and the Cavs Have Hope",2016-06-09,article,News,,"['Basketball', 'NBA Championship']"
When Even Soccer Divides the French,2016-06-09,article,Op-Ed,,"['Soccer', 'Race and Ethnicity', 'Blacks', 'Black People', 'Minorities']"
"Old-School Embroidery, Made Cool Again",2016-06-09,article,News,,['Fashion and Apparel']
Stephen Curry in the N.B.A. Finals: Meh,2016-06-09,article,News,,"['Basketball', 'NBA Championship']"
Israelis Find Rare Moment of Solidarity in Aftermath of Tel Aviv Shootings,2016-06-09,article,News,,"['Palestinians', 'Terrorism']"
What Hillary Clinton Faces,2016-06-09,article,News,,"['Debates (Political)', 'Discrimination', 'Presidential Election of 2016', 'Women and Girls']"
Time to End the Strikes in France,2016-06-09,article,Editorial,,"['Organized Labor', 'Labor and Jobs']"
Who May Die? California Patients and Doctors Wrestle With Assisted Suicide,2016-06-09,article,News,,"['Euthanasia and Assisted Suicide', 'Doctors', 'Hospice Care']"
"Two Conferences Next Week, Each Facing Headwinds",2016-06-09,article,News,,"['Electronic Entertainment Expo (E3)', 'Computer and Video Games']"
Adding Features to Windows 10,2016-06-09,article,Question,,['Windows (Operating System)']
Arrest of Homa Hoodfar in Iran Shines Light on Dangers for Dual Citizens,2016-06-09,article,News,,"['Political Prisoners', 'Citizenship and Naturalization']"
Washington National Cathedral to Rid Windows of Confederate Battle Flag,2016-06-09,article,News,,"['Civil War (US) (1861-65)', 'Churches (Buildings)', 'Flags, Emblems and Insignia']"
Israel’s Problem With the Democratic Party,2016-06-09,article,Op-Ed,,"['United States International Relations', 'Presidential Election of 2016']"
Is It Harder to Be Transported By a Book As You Get Older?,2016-06-09,article,News,,"['Books and Literature', 'Writing and Writers', 'Children and Childhood']"
5 to Watch at London Collections: Men,2016-06-09,article,News,,"['Fashion and Apparel', 'London Fashion Week']"
1891: Dynamite Explosion in Paris,2016-06-09,article,News,,"['Bombs and Explosives', 'Demonstrations, Protests and Riots']"
An Elegant New Line That Nods to the Past,2016-06-09,article,News,,['Fashion and Apparel']
Uber and Its Executives Are Fined in France,2016-06-09,article,News,,"['Car Services and Livery Cabs', 'Fines (Penalties)']"
"It Was a Love Story, and Taylor Swift Just Said Yes",2016-06-09,article,News,,"['Weddings and Engagements', 'Music']"
"Against Parkinson’s, Muhammad Ali Proved Himself Again",2016-06-09,article,News,,"['Boxing', ""Parkinson's Disease""]"
Frequent Moves During Childhood May Be Bad for Health,2016-06-09,article,News,,"['Children and Childhood', 'Mental Health and Disorders', 'Suicides and Suicide Attempts']"
Musician to Know: The Woman Changing the Look of Indie Rock,2016-06-09,article,News,,"['Japanese-Americans', 'Music']"
James Corden’s Goal: Tony Awards That Let Everyone In on the Joke,2016-06-09,article,News,,"['Tony Awards (Theater Awards)', 'Theater']"
Bookshelf: Modern Fatherhood,2016-06-09,multimedia,Interactive Feature,,['Books and Literature']
Why Do Health Costs Keep Rising? These People Know,2016-06-09,article,News,,"['Patient Protection and Affordable Care Act (2010)', 'Health Insurance and Managed Care', 'Prices (Fares, Fees and Rates)']"
Taking a Hard Look at a Campaign Critical of a Fiduciary Rule,2016-06-09,article,News,,"['Pensions and Retirement Plans', 'Suits and Litigation (Civil)']"
In Defense of the Three-Week Vacation,2016-06-09,article,News,,"['Travel and Vacations', 'Paid Time Off']"
"Jaap van Zweden Extends His Other Gig, 8,000 Miles from David Geffen Hall",2016-06-09,article,News,,"['Music', 'Classical Music']"
"Eight Unexpected, Interesting Pendants",2016-06-09,multimedia,Interactive Feature,,['Jewels and Jewelry']
Formula One Development Tool Now at Hand for the Family Sedan,2016-06-09,article,News,,"['Automobiles', 'Innovation', 'Design']"
Viacom Has Few Options for Fighting National Amusements,2016-06-09,article,News,,['Boards of Directors']
Norman Seabrook’s Ouster as Union Chief May Complicate Overhaul at Rikers,2016-06-09,article,News,,['Appointments and Executive Changes']
VW Manager in Germany Is Said to Have Pushed for Removing Evidence,2016-06-09,article,News,,"['Diesel Power', 'Automobile Safety Features and Defects', 'Air Pollution', 'Fuel Emissions (Transportation)']"
Akhil Sharma and Lisa McInerney Win Book Awards,2016-06-09,article,News,,"['Books and Literature', 'Awards, Decorations and Honors']"
Caridad China,2016-06-09,multimedia,Slideshow,,['Restaurants']
Caridad China Revives Old-School Flavor in Williamsburg,2016-06-09,article,Review,,"['Restaurants', 'Chinese Food (Cuisine)']"
Fighting Corruption in Nigeria: The Government’s View,2016-06-09,article,Letter,,[]
Anaïs Mitchell Hopes to Change the World With Her First Musical,2016-06-09,article,News,,['Theater']
A French Film About Anti-Semitism,2016-06-09,article,Letter,,"['Jews and Judaism', 'ANTI-SEMITISM', 'Terrorism']"
"In Lawsuit, U.S. Says Queens School Discriminated Against 3 Black Teachers",2016-06-09,article,News,,"['Education (K-12)', 'Discrimination', 'Blacks', 'Black People', 'Teachers and School Employees', 'Suits and Litigation (Civil)', 'Principals (School)']"
Mary Roach: By the Book,2016-06-09,article,Question,,"['Books and Literature', 'Writing and Writers']"
Zak Pelaccio Revisits Malaysian Cooking in His New Restaurant,2016-06-09,article,News,,"['Restaurants', 'Chefs']"
India Film Censor Orders 94 Cuts to Movie About Punjab’s Drug Problem,2016-06-09,article,News,,"['Censorship', 'Drug Abuse and Traffic', 'Heroin', 'Movies']"
"In the Ring He Was Ali, but in the Newspapers He Was Still Clay",2016-06-09,article,News,,"['Boxing', 'Names, Personal', 'News and News Media', 'Newspapers']"
Poignant Pictures That Capture the Humanity in Historical Moments,2016-06-09,multimedia,Slideshow,,['Photography']
Cleaner Political Donations,2016-06-09,article,Letter,,['Campaign Finance']
Cracks Appear in Merger of Williams and Energy Transfer Equity,2016-06-09,article,News,,"['Mergers, Acquisitions and Divestitures']"
Rafael Nadal Withdraws From Wimbledon,2016-06-09,article,News,,"['Tennis', 'Sports Injuries', 'Wimbledon Tennis Tournament']"
How Safe Is Your City From a Flood?,2016-06-09,article,Letter,,"['Floods', 'Global Warming', 'Hurricane Katrina (2005)', 'Hurricane Sandy (2012)']"
Sanders to Meet with Clinton,2016-06-09,multimedia,Video,,['Presidential Election of 2016']
"‘The Witch’ and Five Hedy Lamarr Films Come to Disc, Casting Spells",2016-06-09,article,News,,"['Movies', 'Video Releases (Entertainment)']"
"At Film Forum, Hailing Women Behind the Camera",2016-06-09,article,News,,['Movies']
Sky-High Prices for Broadway Hits Like ‘Hamilton’,2016-06-09,article,Letter,,[]
"Obama Endorses Hillary Clinton, and Urges Democrats to Unite",2016-06-09,article,News,,"['Presidential Election of 2016', 'Endorsements']"
"‘Central Intelligence,’ Buddy Cops and the Art of Mismatched Pairs",2016-06-09,article,News,,['Movies']
"Iceland Carbon Dioxide Storage Project Locks Away Gas, and Fast",2016-06-09,article,News,,"['Carbon Dioxide', 'Global Warming', 'Greenhouse Gas Emissions', 'Carbon Capture and Sequestration']"
How Keeping Up Appearances Ruined a Former Dallas Banker,2016-06-09,article,News,,"['Insider Trading', 'Securities and Commodities Violations']"
"Muhammad Ali Was Her First, and Greatest, Love",2016-06-09,article,News,,['Boxing']
Anatomy of a Scene | ‘The Conjuring 2’,2016-06-09,multimedia,Video,,[]
James Wan Narrates a Scene From ‘The Conjuring 2’,2016-06-09,article,News,,['Movies']
‘Shut Down the Presses as Soon as Possible’,2016-06-09,article,News,,['Newspapers']
Belmont Stakes 2016: Here’s Who We Think Will Win,2016-06-09,article,News,,"['Horse Racing', 'Jockeys, Drivers and Trainers', 'Belmont Stakes']"
Scientists Find Genes That Let These Bees Reproduce Without Males,2016-06-09,article,News,,"['Bees', 'Reproduction (Biological)', 'Genetics and Heredity']"
United Nations Chief Exposes Limits to His Authority by Citing Saudi Threat,2016-06-09,article,News,,"['Humanitarian Aid', 'Human Rights and Human Rights Violations', 'Children and Childhood', 'International Relations']"
Brexit Vote Gives Tabloids Chance to Unleash Anti-European Tendencies,2016-06-09,article,News,,"['Referendums', 'Newspapers', 'International Relations', 'Great Britain Withdrawal from EU (Brexit)']"
"Rockettes Tradition, Set Free by a ‘Banshee Artist’",2016-06-09,article,News,,"['Dancing', 'Theater']"
Viacom Rumblings: Stacking the Board and Maybe Remerging With CBS,2016-06-09,article,News,,"['Boards of Directors', 'Mergers, Acquisitions and Divestitures', 'Privacy']"
The Ninth Circuit’s Firearms Ruling,2016-06-09,multimedia,Interactive Feature,,['Firearms']
