headline,date,doc_type,material_type,section,keywords
Facebook Asked to Provide Details of Gunman’s Postings,2016-06-16,multimedia,Interactive Feature,,[]
Is ‘Shrew’ Worth Taming? Female Directors Keep Trying,2016-06-16,article,News,,"['Theater', 'Women and Girls']"
Meet Some Wild Superheroes at the Brooklyn Children’s Museum,2016-06-16,article,News,,['Museums']
1948-2016 | A Times Art Treasure Comes to an Omaha Library,2016-06-16,article,News,,"['Restoration and Renovation', 'Murals', 'Libraries and Librarians']"
The White House’s Pick-Up Artists,2016-06-16,article,News,,['Ex-Convicts']
"As Russian Hackers Probe, NATO Has No Clear Cyberwar Strategy",2016-06-16,article,News,,"['Cyberwarfare and Defense', 'Defense and Military Forces', 'Espionage and Intelligence Services', 'International Relations']"
"Palestinian Killed by Israeli Soldier Posed No Danger, Commander Testifies",2016-06-16,article,News,,"['Murders, Attempted Murders and Homicides', 'Palestinians', 'Defense and Military Forces']"
Tasting Rosés With a Winemaker Who Knows Them Best,2016-06-16,article,News,,['Wines']
Witnesses on Attack of British Lawmaker,2016-06-16,multimedia,Video,,['Assaults']
Lincoln Center’s White Light Festival Draws Inspiration From India,2016-06-16,article,News,,"['White Light Festival (Lincoln Center, NYC)', 'Classical Music', 'Dancing', 'Opera']"
The First Big Company to Say It’s Serving the Legal Marijuana Trade? Microsoft.,2016-06-16,article,News,,"['Marijuana', 'Medical Marijuana', 'Software']"
Judge's Ruling Rejecting Reza Zarrab's Bail Proposal,2016-06-16,multimedia,Interactive Feature,,['Bail']
Opening Ceremony Honors New York Gay Bars,2016-06-16,article,News,,"['Homosexuality and Bisexuality', 'Orlando, Fla, Shooting (2016)', 'Fashion and Apparel', 'Bars and Nightclubs']"
Christo’s Newest Project: Walking on Water,2016-06-16,article,News,,['Art']
"Daniel Sturridge Plays Hero for England, Leaving Wales Stunned",2016-06-16,article,News,,"['Soccer', 'UEFA European Football Championship']"
Skeptics of Self-Driving Cars Span Generations,2016-06-16,article,News,,['Driverless and Semiautonomous Vehicles']
David Wright Opts for Neck Surgery,2016-06-16,article,News,,"['Baseball', 'Sports Injuries', 'Surgery and Surgeons']"
AirBlabNBore,2016-06-16,article,News,,['Travel and Vacations']
Lin-Manuel Miranda Confirms He’s Leaving ‘Hamilton’ on July 9,2016-06-16,article,News,,['Theater']
Unhitching? The Divorce Concierge Is at Your Service,2016-06-16,article,News,,"['Divorce, Separations and Annulments', 'Dating and Relationships', 'Consultants']"
Euro 2016: How England Can Qualify For the Next Round,2016-06-16,multimedia,Interactive Feature,,"['Soccer', 'UEFA European Football Championship']"
Euro 2016: How Wales Can Qualify For the Next Round,2016-06-16,multimedia,Interactive Feature,,"['UEFA European Football Championship', 'Soccer']"
Euro 2016: How Russia Can Qualify For the Next Round,2016-06-16,multimedia,Interactive Feature,,"['UEFA European Football Championship', 'Soccer']"
Online Tools to Shop for Doctors Snag on Health Care’s Complexity,2016-06-16,article,News,,"['Health Insurance and Managed Care', 'Computers and the Internet', 'Doctors']"
Euro 2016: How Slovakia Can Qualify For the Next Round,2016-06-16,multimedia,Interactive Feature,,"['UEFA European Football Championship', 'Soccer']"
House Members Unite to Read Stanford Rape Victim’s Letter,2016-06-16,article,News,,"['Sex Crimes', 'United States Politics and Government']"
Behind the Scenes With Lin-Manuel Miranda and Family on Tonys Night,2016-06-16,article,News,,"['Theater', 'Tony Awards (Theater Awards)']"
"At Ojai, Peter Sellars Has a Personal Yet Global Playlist",2016-06-16,article,News,,"['Music', 'Ojai Music Festival', 'Classical Music']"
"Shifting Attention to Mediterranean, NATO Fights Internal Dissent",2016-06-16,article,News,,"['International Relations', 'Middle East and Africa Migrant Crisis']"
"Defying China, Hong Kong Bookseller Describes Detention",2016-06-16,article,News,,"['Freedom of Speech and Expression', 'Book Trade and Publishing', 'Books and Literature', 'Political Prisoners']"
"After Insider Trading Conviction, a New Life as a Speaker",2016-06-16,article,News,,['Insider Trading']
Grammy Awards Tweak Rules for Streaming Music,2016-06-16,article,News,,"['Grammy Awards', 'Audio Recordings, Downloads and Streaming', 'Music']"
From Great Britain to Little England,2016-06-16,article,Op-Ed,,"['Immigration and Emigration', 'World War II (1939-45)', 'Referendums', 'Great Britain Withdrawal from EU (Brexit)']"
"Soccer Players’ Fatigue Grows as Matches Go on, and on, and on",2016-06-16,article,News,,"['Soccer', 'Sports Injuries', 'UEFA Champions League (Soccer)', 'Copa America (Soccer)', 'UEFA European Football Championship']"
Grace Wales Bonner Wins LVMH Prize for Young Designers,2016-06-16,article,News,,"['Fashion and Apparel', 'Awards, Decorations and Honors']"
"A Nuyorican Artist’s Career Survey: Loud, Proud and Timely",2016-06-16,article,Review,,"['Art', 'Fashion and Apparel']"
Microsoft-LinkedIn Deal Ignites Twitter Speculation,2016-06-16,article,News,,"['Mergers, Acquisitions and Divestitures']"
Health Care Merger Offers Little Reward but Much Risk,2016-06-16,article,News,,"['Mergers, Acquisitions and Divestitures']"
Latest Election Polls 2016,2016-06-16,multimedia,Interactive Feature,,"['Presidential Election of 2016', 'Polls and Public Opinion']"
Fighting Corruption in Brazil: The Ambassador’s View,2016-06-16,article,Letter,,['Corruption (Institutional)']
New ‘Extinct’ Meteorite Hints at Violent Cosmic Collision,2016-06-16,article,News,,"['Meteors and Meteorites', 'Geology', 'Space and Astronomy']"
How to Stay Safe on Your Next Trip,2016-06-16,article,News,,"['Travel and Vacations', 'First Aid']"
Supreme Court Rules on Legal Fees in Copyright Cases,2016-06-16,article,News,,"['Copyrights and Copyright Violations', 'Textbooks', 'Decisions and Verdicts']"
"Fighting ISIS With an Algorithm, Physicists Try to Predict Attacks",2016-06-16,article,News,,"['Terrorism', 'Social Media', 'Data-Mining and Database Marketing', 'Computers and the Internet']"
Defending a Loan Program: Emigrant Bank’s Rebuttal,2016-06-16,article,Letter,,"['Suits and Litigation (Civil)', 'Banking and Financial Institutions']"
The Other Verraz(z)ano Bridge,2016-06-16,article,Letter,,[]
C.D.C. Reports 234 Pregnant Women in U.S. With Zika,2016-06-16,article,News,,"['Zika Virus', 'Birth Defects', 'Pregnancy and Childbirth', 'Microcephaly']"
‘Shaken’: Gay Voices After Orlando,2016-06-16,article,Letter,,"['Orlando, Fla, Shooting (2016)', 'Homosexuality and Bisexuality']"
Scientists Hope to Cultivate an Immune System for Crops,2016-06-16,article,News,,"['Microbiology', 'Soil', 'Agriculture and Farming', 'Bacteria', 'Fungi']"
"‘Wicked,’ the Movie, Coming December 2019",2016-06-16,article,News,,['Movies']
The Republicans’ Failure on the Environment,2016-06-16,article,Letter,,"['Conservatism (US Politics)', 'Environment', 'United States Politics and Government', 'Conservation of Resources', 'Global Warming']"
I Used an Assault Rifle in the Army. I Don’t Think Civilians Should Own Them.,2016-06-16,article,News,,"['Firearms', 'Gun Control', 'Afghanistan War (2001-14)', 'Orlando, Fla, Shooting (2016)']"
How Climate Change Could Make the Ground Collapse,2016-06-16,article,News,,"['Global Warming', 'Greenhouse Gas Emissions', 'Infrastructure (Public Works)']"
A Few More Vegetables and a Little Less Meat May Reduce Diabetes Risk,2016-06-16,article,News,,"['Diabetes', 'Diet and Nutrition', 'Food', 'Vegetables']"
Men’s Fashion Shows: Gosha Rubchinskiy in Florence,2016-06-16,multimedia,Slideshow,,"[""Men's Fashion Week""]"
France Arrests More Than 300 in Euro Soccer Tournament’s First Week,2016-06-16,article,News,,"['Soccer', 'Demonstrations, Protests and Riots', 'UEFA European Football Championship']"
Soda Tax Passes in Philadelphia. Advocates Ask: Who’s Next?,2016-06-16,article,News,,"['Soft Drinks', 'Sales and Excise Taxes', 'Sugar']"
"Donald Trump’s Speeches Fire Up His Base, but May Cost Him",2016-06-16,article,News,,"['Presidential Election of 2016', 'Orlando, Fla, Shooting (2016)', 'Muslims and Islam', 'Polls and Public Opinion', 'Muslim Americans']"
"At Vigil for Orlando Victims, Utah Republican Apologizes to L.G.B.T. Community",2016-06-16,article,News,,"['Orlando, Fla, Shooting (2016)', 'Homosexuality and Bisexuality', 'Transgender and Transsexuals']"
Anatomy | ‘Hunt for the Wilderpeople’,2016-06-16,multimedia,Video,,['Movies']
When the Family Business Is a Gallery,2016-06-16,article,News,,['Art']
1966: Mississippi Marchers Arrested,2016-06-16,article,News,,"['Civil Rights and Liberties', 'Civil Rights Movement (1954-68)', 'Demonstrations, Protests and Riots']"
Taika Waititi Narrates a Scene From ‘Hunt for the Wilderpeople’,2016-06-16,article,News,,['Movies']
"Melvin Dwork, Once Cast From Navy for Being Gay, Dies at 94",2016-06-16,article,Obituary (Obit),,"['Deaths (Obituaries)', 'Discrimination', 'Homosexuality and Bisexuality', 'United States Defense and Military Forces']"
Why the Orlando Shooting Is Unlikely to Lead to Major New Gun Laws,2016-06-16,article,News Analysis,,"['Gun Control', 'Orlando, Fla, Shooting (2016)', 'United States Politics and Government', 'Terrorism']"
21st Century Fox Names Stacey Snider Its Next Studio Chief,2016-06-16,article,News,,['Appointments and Executive Changes']
"In Orlando, a Son of a Muslim Immigrant Rushed to Heal Pain Caused by Another",2016-06-16,article,News,,"['Orlando, Fla, Shooting (2016)', 'Immigration and Emigration', 'Terrorism', 'Homosexuality and Bisexuality', 'Hispanic-Americans', 'Muslim Americans']"
Review: Annie Proulx’s ‘Barkskins’ Is an Epic Tale of Logging and Doom,2016-06-16,article,Review,,['Books and Literature']
"With Organic Cotton and Online Ads, Boll & Branch Helps Indian Farmers",2016-06-16,article,News,,"['Organic Foods and Products', 'Beds and Bedding', 'Sustainable Living', 'E-Commerce']"
The Fed’s Policies Have Gotten It in a Tangle,2016-06-16,article,News,,"['Quantitative Easing', 'Income Inequality', 'United States Economy', 'Interest Rates', 'Inflation (Economics)', 'Wages and Salaries']"
"In Russian Doping Scandal, Time for a Punishment to Fit the Crime",2016-06-16,article,News,,"['Doping (Sports)', 'Olympic Games (2016)', 'Tests (Drug Use)', 'Olympic Games']"
"Redstone Moves to Replace Five Viacom Directors, Escalating Battle",2016-06-16,article,News,,['Appointments and Executive Changes']
"Convenient, and Kosher Too",2016-06-16,multimedia,Slideshow,,"['Sushi', 'Jews and Judaism', 'Kosher Foods and Products']"
"A Funeral for a Fire Chief, 15 Years After He Died on 9/11",2016-06-16,article,News,,"['Fires and Firefighters', 'September 11 (2001)', 'Funerals and Memorials', 'World Trade Center (Manhattan, NY)', 'Forensic Science']"
Enough With the Gefilte Fish. I’ll Have Sushi.,2016-06-16,article,News,,"['Sushi', 'Jews and Judaism', 'Restaurants', 'Kosher Foods and Products']"
Watch the Orlando Shooting Story Take Shape,2016-06-16,article,News,,"['Orlando, Fla, Shooting (2016)', 'News and News Media']"
"Review: Handel’s ‘Rinaldo,’ With Period Brass in Good Repair",2016-06-16,article,Review,,['Opera']
"Review: Sundance Film Festival Short Films, a Group of Hits and Misses",2016-06-16,article,Review,,"['Movies', 'Sundance Film Festival (Park City, Utah)', 'Documentary Films and Programs']"
"Review: In ‘Seoul Searching,’ Teenagers Explore Their Korean Roots to an ’80s Soundtrack",2016-06-16,article,Review,,['Movies']
A New Glass Museum Will Open in a Historic Factory,2016-06-16,article,News,,"['ANTIQUES', 'Glass', 'Collectors and Collections']"
"Review: In ‘Parched,’ Women in an Indian Village Chafe Against Oppression",2016-06-16,article,Review,,['Movies']
A Walk on Water,2016-06-16,multimedia,Video,,['Water']
"Is It Going to Be Me, or the Cat?",2016-06-16,article,News,,"['Pets', 'Customs, Etiquette and Manners', 'Hunting and Trapping', 'Homosexuality and Bisexuality', 'Dating and Relationships']"
"Review: A Couple’s Adoration After 76 Years of Marriage in ‘My Love, Don’t Cross That River’",2016-06-16,article,Review,,"['Movies', 'Documentary Films and Programs', 'Marriages']"
"Review: ‘Land and Shade,’ Set Among Colombia’s Sugar Farmers",2016-06-16,article,Review,,['Movies']
Russian Track Team Faces Ban From Olympics: Here’s What We Know,2016-06-16,article,News,,"['Track and Field', 'Doping (Sports)', 'Tests (Drug Use)', 'Olympic Games (2016)']"
"When a Phrase Takes On New Meaning: ‘Radical Islam,’ Explained",2016-06-16,article,News,,"['Muslims and Islam', 'United States Politics and Government', 'Orlando, Fla, Shooting (2016)', 'Presidential Election of 2016', 'Terrorism']"
36 Hours in Chicago,2016-06-16,multimedia,Interactive Feature,,['Travel and Vacations']
"In Race for Mayor of Rome, a Prize and a New Face for the Five Star Movement",2016-06-16,article,News,,"['Elections, Mayors']"
Families Bearing Up a Year After Slayings in a Charleston Church,2016-06-16,article,News,,"['Charleston, SC, Shooting (2015)', 'Gun Control', 'Blacks', 'Black People']"
Bloomsday Is Over but Joyce Left Plenty of Trail to Trace,2016-06-16,article,News,,['Travel and Vacations']
Review: ‘A Conspiracy of Faith’ Tracks a Message Written in Blood,2016-06-16,article,Review,,['Movies']
"Review: In ‘The Absent One,’ a Killer Confesses, and an Inquiry Ensues",2016-06-16,article,Review,,['Movies']
Nicole Najafi of Industry Standard in Cuba,2016-06-16,multimedia,Slideshow,,['Travel and Vacations']
An American Jeans Maker Discovers Cuba (and Color),2016-06-16,article,News,,['Travel and Vacations']
"Things to Do on Long Island, June 18 Through June 26",2016-06-16,article,Schedule,,"['Art', 'Culture (Arts)', 'Museums']"
What to See in New York Art Galleries This Week,2016-06-16,multimedia,Interactive Feature,,['Art']
"Review: In ‘Swan Lake,’ the Drama Depends on the Dancers",2016-06-16,article,News,,['Dancing']
"Review: ‘The Keeper of Lost Causes,’ Pitch-Black Nordic Noir",2016-06-16,article,Review,,['Movies']
"At Art Basel, Upbeat Dealers and Brisk Sales",2016-06-16,article,News,,"['Art', 'ART BASEL (FESTIVAL)', 'Collectors and Collections']"
"A Plan to Spread Dada Worldwide, Revisited at MoMA",2016-06-16,article,Review,,['Art']
"A Photo Series, with Audience Participation",2016-06-16,multimedia,Slideshow,,"['Photography', 'Meteors and Meteorites']"
Russians Make an Impact on Mixed Martial Arts,2016-06-16,article,News,,['Mixed Martial Arts']
"Review: In ‘Central Intelligence,’ a Weaponized Kevin Hart",2016-06-16,article,Review,,['Movies']
"Things to Do in New Jersey, June 18 Through June 26",2016-06-16,article,Schedule,,"['Art', 'Culture (Arts)']"
"Two Men Kiss, an Act of Love and Activism",2016-06-16,article,News,,"['Kissing', 'Hate Crimes', 'Homosexuality and Bisexuality', 'Orlando, Fla, Shooting (2016)']"
Political Substance Abuse: Donald Trump on Immigration and Terrorism,2016-06-16,article,News,,"['Immigration and Emigration', 'Presidential Election of 2016', 'Speeches and Statements', 'Terrorism']"
"Things to Do in the Hudson Valley, June 18 Through June 26",2016-06-16,article,Schedule,,"['Art', 'Culture (Arts)', 'Museums']"
"Jo Cox, EgyptAir, Golden State Warriors: Your Thursday Evening Briefing",2016-06-16,article,News,,[]
"Review: In ‘Argentina,’ a Call to Save Traditions",2016-06-16,article,Review,,"['Movies', 'Documentary Films and Programs']"
Why We Should Politicize the Orlando Massacre,2016-06-16,article,Op-Ed,,"['Orlando, Fla, Shooting (2016)', 'Homosexuality and Bisexuality', 'Discrimination', 'United States Politics and Government']"
Your Evening Briefing,2016-06-16,multimedia,Slideshow,,[]
"Review: In ‘Raiders!,’ Two Boys’ First, Great Movie Crush",2016-06-16,article,Review,,"['Movies', 'Documentary Films and Programs']"
"Things to Do in Connecticut, June 18 Through June 26",2016-06-16,article,Schedule,,"['Art', 'Culture (Arts)', 'Music']"
"Defining, and Proclaiming, a New Black Power",2016-06-16,article,News,,"['Blacks', 'Black People', 'Culture (Arts)', 'Theater', 'Music', 'Movies', 'Social Conditions and Trends']"
Review: ‘Tickled’ Is Fun and Giggles Until It Isn’t Anymore,2016-06-16,article,Review,,"['Movies', 'Tickling']"
Samira Wiley on ‘Orange Is the New Black’ and Being a Role Model,2016-06-16,article,News,,"['Web-Original Programming', 'Television', 'ACTORS AND ACTRESSES']"
Review: ‘Cosmos’ Is a Madcap Plunge Into Retro Avant-Gardism,2016-06-16,article,Review,,['Movies']
"Review: ‘Bang Gang,’ Seaside Orgies to a Soundtrack of Yawns",2016-06-16,article,Review,,['Movies']
Judge in Kenya Upholds Use of Anal Exams for Men Suspected of Being Gay,2016-06-16,article,News,,"['Homosexuality and Bisexuality', 'Human Rights and Human Rights Violations', 'Discrimination', 'Decisions and Verdicts', 'Men and Boys']"
"Atwood, Rushdie Among 300 Authors to Appear at 2016 Brooklyn Book Festival",2016-06-16,article,News,,"['Books and Literature', 'Brooklyn Book Festival', 'Book Fairs']"
Theater Listings for June 17-23,2016-06-16,article,Schedule,,['Theater']
Low-Budget Highlights After Midnight: ‘Decker’ and ‘Brule’,2016-06-16,article,News,,['Television']
Euro 2016: How Germany Can Advance to the Next Round,2016-06-16,multimedia,Interactive Feature,,"['Soccer', 'UEFA European Football Championship']"
Euro 2016: Why Ukraine Can’t Qualify For the Next Round,2016-06-16,multimedia,Interactive Feature,,['UEFA European Football Championship']
Euro 2016: How Northern Ireland Can Qualify For the Next Round,2016-06-16,multimedia,Interactive Feature,,['UEFA European Football Championship']
Euro 2016: How Poland Can Qualify For the Next Round,2016-06-16,multimedia,Interactive Feature,,['UEFA European Football Championship']
The Rough Read That Was ‘Ulysses’,2016-06-16,article,News,,['Books and Literature']
Home Should Not Be a War Zone,2016-06-16,article,Op-Ed,,"['Gun Control', 'Veterans', 'Orlando, Fla, Shooting (2016)', 'United States Defense and Military Forces', 'Terrorism']"
Comedy Listings for June 17-23,2016-06-16,article,Schedule,,['Comedy and Humor']
Federal Judge Tosses Texas’ Lawsuit to Bar Syrian Refugees,2016-06-16,article,News,,"['Refugees and Displaced Persons', 'Suits and Litigation (Civil)']"
"Years After United Merger, Flight Attendants Work for Two Airlines",2016-06-16,article,News,,"['Flight Attendants', 'Organized Labor', 'AIRLINES AND AIRPLANES', 'Mergers, Acquisitions and Divestitures']"
Comforters in the 1965 Blackout,2016-06-17,article,Brief,,"['Stations and Terminals (Passenger)', 'Power Failures and Blackouts', 'Good Samaritans']"
Prime Minister of Croatia Is Ousted by the Party That Backed Him,2016-06-17,article,News,,"['Appointments and Executive Changes', 'Legislatures and Parliaments']"
Euro 2016: How Germany Can Qualify For the Next Round,2016-06-17,multimedia,Interactive Feature,,"['UEFA European Football Championship', 'Soccer']"
A Who’s Who of Financiers Is Expected at Trump’s New York Fund-Raiser,2016-06-17,article,News,,"['Presidential Election of 2016', 'Campaign Finance', 'Banking and Financial Institutions']"
51 U.S. Diplomats Urge Strikes Against Assad in Syria,2016-06-17,article,News,,"['United States International Relations', 'United States Defense and Military Forces', 'Terrorism']"
Weapons Cache and Bomb-Making Instructions Found at Long Island Home,2016-06-17,article,News,,"['Firearms', 'Bombs and Explosives', 'Holocaust and the Nazi Era', 'Drug Abuse and Traffic']"
"Kenneth Walton, F.B.I.’s Bold New York Face in the ’80s, Dies at 76",2016-06-17,article,Obituary (Obit),,['Deaths (Obituaries)']
"With Final Goodbyes in Orlando, a Stark Reckoning for Loved Ones",2016-06-17,article,News,,"['Orlando, Fla, Shooting (2016)', 'Funerals and Memorials', 'Terrorism']"
Exxon Mobil Fights Back at State Inquiries Into Climate Change Research,2016-06-17,article,News,,"['Global Warming', 'Attorneys General']"
Movie Listings for June 17-23,2016-06-17,article,Schedule,,['Movies']
"Archbishop Sheen’s Family Sues to Move His Body, From New York to Illinois",2016-06-17,article,News,,['Beatifications and Canonizations']
Invitation to Fund-Raiser for Roy Blunt Headlined by George W. Bush,2016-06-17,multimedia,Interactive Feature,,[]
Invitation to John McCain Fund-Raiser Headlined by George W. Bush,2016-06-17,multimedia,Interactive Feature,,[]
An Unlikely Savior Emerges to Help Endangered Republicans: George W. Bush,2016-06-17,article,News,,"['Presidential Election of 2016', 'Elections, Senate', 'Muslims and Islam', 'Immigration and Emigration']"
"Rain Stops Play at United States Open, Bringing Some Players Relief",2016-06-17,article,News,,"['Golf', 'United States Open (Golf)', 'Weather']"
Classical Music Listings for June 17-23,2016-06-17,article,Schedule,,"['Classical Music', 'Opera', 'Make Music New York (Festival)']"
"Gene Cavallero Jr., Who Ran the Colony Restaurant, Dies at 92",2016-06-17,article,Obituary (Obit),,"['Deaths (Obituaries)', 'Restaurants', 'High Society and Socialites']"
Pop & Rock Listings for June 17-23,2016-06-17,article,Schedule,,['Pop and Rock Music']
Jazz Listings for June 17-23,2016-06-17,article,Schedule,,['Jazz']
Multiplying By Division,2016-06-17,article,News,,['Crossword Puzzles']
"Cab Ride Nets $200,000 for a Construction Worker and His Friends",2016-06-17,article,News,,"['Building (Construction)', 'Wages and Salaries', 'Taxicabs and Taxicab Drivers', 'Labor and Jobs']"
"Oscars’ Board May Get More Star Power, if Not Diversity",2016-06-17,article,News,,"['Academy Awards (Oscars)', 'Appointments and Executive Changes']"
Tentative Contract Deal at CUNY Ends Stalemate and Strike Threat,2016-06-17,article,News,,"['Colleges and Universities', 'Teachers and School Employees', 'Organized Labor']"
"After MetLife Ruling, Regulators Push Back on ‘Too Big to Fail’ Label",2016-06-17,article,News,,"['Banking and Financial Institutions', 'Dodd-Frank Wall Street Reform and Consumer Protection Act (2010)']"
"Bernie Sanders, Still Running, Pledges to ‘Make Certain’ Donald Trump Is Defeated",2016-06-17,article,News,,"['Presidential Election of 2016', 'Democratic National Convention', 'Vice Presidents and Vice Presidency (US)']"
"Old New York Police Surveillance Is Found, Forcing Big Brother Out of Hiding",2016-06-17,article,News,,"['Surveillance of Citizens by Government', 'Demonstrations, Protests and Riots', 'Archives and Records', 'Civil Rights and Liberties']"
Bartolo Colon Gives Mets a Much-Needed Lift and a Win Over the Pirates,2016-06-17,article,News,,"['Baseball', 'Sports Injuries']"
The Wedding Was Quirky. Now the Government Is Submitting Its Bill.,2016-06-17,article,News,,"['Frauds and Swindling', 'Embezzlement', 'Politics and Government']"
Hints of Deal Emerge as Lawmakers Make Late Push in Albany,2016-06-17,article,News,,"['Ethics and Official Misconduct', 'Homeless Persons', 'Elections, House of Representatives', 'State Legislatures', 'Bribery and Kickbacks', 'Politics and Government']"
United States Advances to Copa América Semifinals,2016-06-17,article,News,,"['Soccer', 'Copa America (Soccer)']"
Quotation of the Day,2016-06-17,article,Quote,,[]
"LeBron James and Cavaliers Rout Warriors, Forcing Game 7",2016-06-17,article,News,,"['Basketball', 'NBA Championship']"
Yankees End Four-Game Skid Behind Solid Start From C. C. Sabathia,2016-06-17,article,News,,['Baseball']
Word of the Day + Quiz | ductile,2016-06-17,article,News,,['English Language']
Why the ‘Brexit’ Warnings Don’t Seem to Be Working in Britain,2016-06-17,article,News,,"['Referendums', 'Polls and Public Opinion', 'Immigration and Emigration', 'Great Britain Withdrawal from EU (Brexit)']"
Dance Listings for June 17-23,2016-06-17,article,Schedule,,['Dancing']
What’s on TV Friday,2016-06-17,article,Schedule,,"['Television', 'Movies', 'Web-Original Programming']"
"This Week’s Movies | June 17, 2016",2016-06-17,multimedia,Video,,"['Movies', 'Documentary Films and Programs']"
American Kills Himself in Taiwan Court After 4-Year Drug Sentence,2016-06-17,article,News,,"['Marijuana', 'Suicides and Suicide Attempts', 'Drug Abuse and Traffic']"
Museum & Gallery Listings for June 17-23,2016-06-17,article,Schedule,,['Art']
Around Town for June 17-23,2016-06-17,article,Schedule,,['Culture (Arts)']
Spare Times for Children Listings for June 17-23,2016-06-17,article,Schedule,,"['Culture (Arts)', 'Children and Childhood']"
"The Week in Pictures: June 17, 2016",2016-06-17,multimedia,Slideshow,,['Photography']
"Corrections: June 17, 2016",2016-06-17,article,News,,[]
"The Week in Pictures: June 17, 2016",2016-06-17,article,News,,['Photography']
Choosing ‘Brexit’ Could Leave the Kingdom Less United,2016-06-17,article,News,,"['Referendums', 'International Relations', 'Immigration and Emigration', 'Great Britain Withdrawal from EU (Brexit)']"
Found Poem Favorite | ‘Apollo’,2016-06-17,article,News,,['Poetry and Poets']
Why LinkedIn Will Make You Hate Microsoft Word,2016-06-17,article,Op-Ed,,"['Writing and Writers', 'Social Media', 'Word Processing', 'Software', 'Computers and the Internet', 'Mergers, Acquisitions and Divestitures']"
"Fear, Loathing and Brexit",2016-06-17,article,Op-Ed,,"['International Trade and World Market', 'Referendums', 'Great Britain Withdrawal from EU (Brexit)']"
Trust Deficit at the Red Cross,2016-06-17,article,Editorial,,"['Editorials', 'Humanitarian Aid', 'Earthquakes', 'Philanthropy', 'Ethics and Official Misconduct']"
The New York Jail Break That Exposed a Broken System,2016-06-17,article,Editorial,,"['Editorials', 'Prison Escapes', 'Ethics and Official Misconduct', 'Prisons and Prisoners']"
A Week for All Time,2016-06-17,article,Op-Ed,,['Presidential Election of 2016']
