headline,date,doc_type,material_type,section,keywords
Can the American West Be Saved?,2019-08-15,article,Review,,"['Books and Literature', 'Land Use Policies', 'Fringe Groups and Movements']"
"‘Pleasure, Obligation, Curiosity, Inspiration’: What’s on Marie Arana’s Nightstand",2019-08-15,article,News,,"['Books and Literature', 'Writing and Writers']"
Is Josh Hawley the Future of the G.O.P.?,2019-08-15,article,Op-Ed,,"['United States Politics and Government', 'Conservatism (US Politics)', 'United States Economy', 'Drugs (Pharmaceuticals)', 'Antitrust Laws and Competition Issues', 'Science and Technology', 'Corporations', 'First Amendment (US Constitution)', 'Discrimination']"
"John Hickenlooper, Ending Presidential Bid, Will Give Senate ‘Serious Thought’",2019-08-15,article,News,,"['Presidential Election of 2020', 'Elections, Senate', 'United States Politics and Government']"
Many Democrats Love Elizabeth Warren. They Also Worry About Her.,2019-08-15,article,News,,"['Presidential Election of 2020', 'Polls and Public Opinion', 'Voting and Voters', 'United States Politics and Government']"
6 Podcasts for the Drama Lover,2019-08-15,article,News,,['Podcasts']
Moral Distress in Neurosurgery,2019-08-15,article,News,,"['Surgery and Surgeons', 'Hospice Care', 'Living Wills and Health Care Proxies', 'Death and Dying', 'Elder Care', 'Ethics (Personal)']"
How Did You Pay for College?,2019-08-15,article,Op-Ed,,"['Colleges and Universities', 'Student Loans', 'Community Colleges']"
Our Chief Soccer Correspondent on How He Covers the Game,2019-08-15,article,News,,[]
36 Hours in Santa Barbara County,2019-08-15,article,News,,['Travel and Vacations']
Golf’s New Breed Tries to Speed Things Up,2019-08-15,article,News,,['Golf']
How One Billionaire Could Keep Three Countries Hooked on Coal for Decades,2019-08-15,article,News,,"['Coal', 'Mines and Mining', 'Politics and Government', 'Economic Conditions and Trends', 'Global Warming', 'Electric Light and Power', 'Land Use Policies', 'Lobbying and Lobbyists', 'International Trade and World Market', 'Environment', 'Greenhouse Gas Emissions']"
"At ‘Black Woodstock,’ an All-Star Lineup Delivered Joy and Renewal to 300,000",2019-08-15,article,News,,"['Blacks', 'Black People', 'Pop and Rock Music', 'Woodstock Music Festivals']"
‘90 Day Fiancé’: An Anti-Fantasy for Troubled Times,2019-08-15,article,News,,"['Television', 'Immigration and Emigration', 'Marriages']"
"Stocks, Philadelphia, John Hickenlooper: Your Thursday Briefing",2019-08-15,article,briefing,,[]
What We Know About Jeffrey Epstein’s Death,2019-08-15,article,briefing,,['New York Child Victims Act (2019)']
"Gibraltar Releases Iranian Tanker, Hours After U.S. Asked to Seize It",2019-08-15,article,News,,"['Oil (Petroleum) and Gasoline', 'Ships and Shipping', 'Embargoes and Sanctions', 'International Relations', 'United States International Relations']"
DealBook Briefing: Global Economic Woes Shake the Markets,2019-08-15,article,News,,"['United States Economy', 'Stocks and Bonds']"
How I Survived Wedding Season in My First Year of Sobriety,2019-08-15,article,News,,"['Weddings and Engagements', 'Alcohol Abuse', 'Parties (Social)', 'Dating and Relationships']"
"They Supply the Garage, You Bring the Elbow Grease",2019-08-15,article,News,,"['Automobile Service and Charging Stations', 'Do It Yourself']"
The Incontinent Cows of Middle-earth,2019-08-15,article,Op-Ed,,"['Water Pollution', 'Irrigation', 'Water', 'Rivers', 'Cattle', 'Colon and Colorectal Cancer', 'Politics and Government']"
Alla Salute! Italy’s Aperitivo Is Back,2019-08-15,article,Op-Ed,,"['Millennial Generation', 'ALCOHOLIC BEVERAGES', 'Travel and Vacations', 'Wines', 'Prosecco (Wine)', 'Bars and Nightclubs', 'Beaches']"
Stacey Abrams Is Playing the Long Game for Our Democracy,2019-08-15,article,Op-Ed,,"['Voting Machines', 'Voter Registration and Requirements', 'Blacks', 'Black People', 'Presidential Election of 2020']"
The Supreme Court’s Second Amendment Appetite,2019-08-15,article,Op-Ed,,"['Gun Control', 'Firearms', 'Mass Shootings', 'Second Amendment (US Constitution)', 'Law and Legislation', 'Politics and Government']"
Is China Really Freeing Uighurs?,2019-08-15,article,News,,"['Propaganda', 'Uighurs (Chinese Ethnic Group)', 'Passports', 'Concentration Camps']"
The Silence Is the Loudest Sound,2019-08-15,article,Op-Ed,,"['Human Rights and Human Rights Violations', 'Censorship', 'Politics and Government', 'Defense and Military Forces', 'Constitutions', 'Legislatures and Parliaments', 'Terrorism']"
‘47 Meters Down: Uncaged’ Review: A Sequel Unworthy of the Original,2019-08-15,article,Review,,['Movies']
‘Driven’ Review: California Scheming,2019-08-15,article,Review,,['Movies']
‘Socrates’ Review: Surviving on the Streets of São Paulo,2019-08-15,article,Review,,['Movies']
‘Cold Case Hammarskjold’ Review: An Excavation of International Intrigue,2019-08-15,article,Review,,['Documentary Films and Programs']
‘What You Gonna Do’ Review: Struggles and Resilience in New Orleans,2019-08-15,article,Review,,"['Documentary Films and Programs', 'Race and Ethnicity', 'Blacks', 'Black People']"
‘Buñuel in the Labyrinth of the Turtles’ Review: Animating a Surrealist,2019-08-15,article,Review,,['Movies']
‘Kingdom’ Review: Where the Map Is Drawn in Blood,2019-08-15,article,Review,,['Movies']
‘End of the Century’ Review: A Vacation Veers Into Existential States,2019-08-15,article,Review,,['Movies']
Gio Urshela and the Yankees’ M.V.P. (Most Valuable Parrot),2019-08-15,article,News,,"['Baseball', 'Mascots']"
‘Aquarela’ Review: The Shapes of Water,2019-08-15,article,Review,,['Documentary Films and Programs']
Going From Hong Kong to Mainland China? Your Phone Is Subject to Search,2019-08-15,article,News,,"['Privacy', 'Stations and Terminals (Passenger)', 'Hong Kong Protests (2019)']"
Philadelphia Police Shooting: What We Know About the Standoff and the Suspect,2019-08-15,article,News,,"['Attacks on Police', 'Drug Abuse and Traffic']"
U.S. Seeks to Reassure Afghan Military Amid Uncertainty Over a Peace Deal,2019-08-15,article,News,,"['Afghanistan War (2001- )', 'Politics and Government', 'Civilian Casualties', 'Defense and Military Forces', 'United States International Relations', 'United States Defense and Military Forces']"
Beto O’Rourke’s New Approach to 2020: ‘Taking the Fight to Donald Trump’,2019-08-15,article,News,,['Presidential Election of 2020']
Israeli Decision on Omar and Tlaib Inflames Politics in Two Countries,2019-08-15,article,News,,"['Politics and Government', 'United States Politics and Government', 'United States International Relations', 'Palestinians']"
"At Tanglewood, You Can Hear 8 Concerts in 3 Days",2019-08-15,article,Review,,"['Tanglewood Music Festival (Lenox, Mass)', 'Classical Music']"
The Most Popular Listings of July,2019-08-15,article,News,,['Real Estate and Housing (Residential)']
Maria Qamar’s Bold Art Is Both Therapy and Weapon,2019-08-15,article,News,,"['Art', 'Women and Girls', 'Immigration and Emigration']"
Iconic Tropical Brutalist Buildings,2019-08-15,multimedia,Slideshow,,[]
On the Market in the New York Region,2019-08-15,multimedia,Slideshow,,['Real Estate and Housing (Residential)']
On the Market in New York City,2019-08-15,multimedia,Slideshow,,[]
The Unexpectedly Tropical History of Brutalism,2019-08-15,article,News,,"['ARCHITECTURE', 'Historic Buildings and Sites', 'Buildings (Structures)']"
Homes for Sale in Manhattan and Brooklyn,2019-08-15,article,News,,['Real Estate and Housing (Residential)']
Homes for Sale in New York and New Jersey,2019-08-15,article,News,,['Real Estate and Housing (Residential)']
Why Los Angeles Officials Voted to Cancel an Almost $2 Billion Contract,2019-08-15,article,briefing,,[]
Britain’s ‘Knifefree’ Fried Chicken Leaves a Bad Taste for Some,2019-08-15,article,News,,"['Police', 'Crime and Criminals', 'Youth', 'Race and Ethnicity']"
"Novichok Sickened 2nd British Officer, Police Say",2019-08-15,article,News,,"['Poisoning and Poisons', 'Assassinations and Attempted Assassinations']"
My Friend Won’t Share Her Boyfriend’s Age. Should I Be Worried?,2019-08-15,article,News,,"['Customs, Etiquette and Manners']"
Raphael Saadiq Finally Put His Past on the Record,2019-08-15,article,News,,['RHYTHM AND BLUES (MUSIC)']
Jeffrey Epstein: Autopsy Shows Bones in Neck Were Broken,2019-08-15,article,News,,"['Autopsies', 'Sex Crimes', 'Suicides and Suicide Attempts', 'Human Trafficking', 'Child Abuse and Neglect', 'Prostitution']"
The Truth About Koch Industries,2019-08-15,article,Review,,"['Books and Literature', 'Family Business', 'Oil (Petroleum) and Gasoline', 'Regulation and Deregulation of Industry']"
New York Subpoenas Banks and Financial Advisers for Sackler Records,2019-08-15,article,News,,"['Banking and Financial Institutions', 'Subpoenas', 'Pain-Relieving Drugs', 'Suits and Litigation (Civil)', 'Opioids and Opiates', 'OxyContin (Drug)', 'Attorneys General']"
The F.D.A.’s New Cigarette Warnings Are Disturbing. See for Yourself.,2019-08-15,article,News,,"['Labeling and Labels (Product)', 'Smoking and Tobacco', 'Suits and Litigation (Civil)', 'First Amendment (US Constitution)', 'your-feed-healthcare']"
Alibaba’s Strong Results Suggest Chinese Consumers Are Still Spending,2019-08-15,article,News,,"['Economic Conditions and Trends', 'International Trade and World Market', 'E-Commerce', 'Consumer Behavior', 'Shopping and Retail', 'Company Reports']"
How a Teeny-Weeny Chef Became a Great Big Star,2019-08-15,article,News,,"['Chefs', 'Social Media', 'Veganism']"
U.K. Lawmaker Rejects Jeremy Corbyn’s Call to Lead Caretaker Government,2019-08-15,article,News,,['Great Britain Withdrawal from EU (Brexit)']
The Forgotten Story of Operation Anvil,2019-08-15,article,Op-Ed,,"['Defense and Military Forces', 'Politics and Government', 'World War II (1939-45)']"
"On Immigration, the Democrats Are Playing Into Trump’s Hands",2019-08-15,article,Op-Ed,,"['Illegal Immigration', 'Immigration and Emigration']"
Merce Cunningham’s Rare Birds,2019-08-15,article,News,,['Dancing']
‘Olivia’ Explores Love and Tragedy in a French Finishing School,2019-08-15,article,News,,"['Movies', 'Homosexuality and Bisexuality']"
‘The Amazing Johnathan Documentary’ Review: The Joke’s on Who?,2019-08-15,article,Review,,"['Documentary Films and Programs', 'Comedy and Humor', 'Magic and Magicians']"
"From Wild Blueberries and Maine Terroir, Fine Sparkling Wine",2019-08-15,article,News,,"['Wines', 'Blueberries', 'Champagne (Wine)', 'ALCOHOLIC BEVERAGES', 'Agriculture and Farming']"
Trump Thinks Corey Lewandowski Would Be a ‘Fantastic’ Senator From New Hampshire,2019-08-15,article,News,,['United States Politics and Government']
How World Leaders Ruined the Global Economy,2019-08-15,article,Op-Ed,,"['International Trade and World Market', 'Customs (Tariff)', 'Protectionism (Trade)', 'Great Britain Withdrawal from EU (Brexit)', 'Politics and Government', 'United States Politics and Government']"
"In Central Park, a Concert for Immigrant Rights. And Selena.",2019-08-15,article,News,,"['Pop and Rock Music', 'Immigration and Emigration', 'Central Park Summerstage']"
The Challenges of Home Dialysis,2019-08-15,article,News,,"['Kidneys', 'Dialysis', 'Executive Orders and Memorandums', 'Medicare']"
What’s the Deal With That Inverted Yield Curve? A Sports Analogy Might Help,2019-08-15,article,News,,"['Stocks and Bonds', 'United States Economy', 'Interest Rates', 'Recession and Depression', 'Prices (Fares, Fees and Rates)']"
Trump Administration Asks Congress to Reauthorize N.S.A.’s Deactivated Call Records Program,2019-08-15,article,News,,"['Surveillance of Citizens by Government', 'USA Freedom Act', 'United States Politics and Government', 'Classified Information and State Secrets', 'Terrorism', 'Wiretapping and Other Eavesdropping Devices and Methods', 'USA PATRIOT Act', 'Civil Rights and Liberties', 'September 11 (2001)']"
Afghan War Casualty Report: August 9-15,2019-08-15,article,News,,['Civilian Casualties']
"Gerry Murray, Stalwart Roller Derby Star, Dies at 98",2019-08-15,article,Obituary (Obit),,"['Roller Derby', 'Women and Girls', 'Deaths (Obituaries)']"
House Panel Subpoenas Corey Lewandowski and Trump Aide in Obstruction Case,2019-08-15,article,News,,"['United States Politics and Government', 'Russian Interference in 2016 US Elections and Ties to Trump Associates']"
‘Blinded by the Light’ Review: Testing the Limits of Springsteen,2019-08-15,article,Review,,"['Movies', 'Pop and Rock Music']"
Catch a Buzz With Two New Books About Bugs,2019-08-15,article,Review,,"['Books and Literature', 'Insects', 'Mosquitoes', 'Bees']"
"Commuting Has Always Been Soul-Crushing, but There Are Inspiring Options",2019-08-15,article,News,,"['Commuting', 'Photography', 'Automobiles', 'Bicycles and Bicycling']"
"When Cities Try to Limit Guns, State Laws Bar the Way",2019-08-15,article,News,,"['Gun Control', 'Local Government', 'States (US)', 'Law and Legislation', 'Second Amendment (US Constitution)', 'Federal-State Relations (US)']"
One Last Run for the ‘Irish Forrest Gump’,2019-08-15,article,News,,"['Marathon Running', 'Alcohol Abuse', 'Records and Achievements', 'Bars and Nightclubs', 'Irish-Americans']"
Summer Chills: A Horror Fan’s Guide to What to Watch Right Now,2019-08-15,article,News,,"['Movies', 'Television']"
Where Malaysian Snacks Rule,2019-08-15,multimedia,Slideshow,,['Restaurants']
"Small Miracles, Wrapped in Pancakes, at Let’s Makan",2019-08-15,article,Review,,['Restaurants']
"Kary B. Mullis, 74, Dies; Found a Way to Analyze DNA and Won Nobel",2019-08-15,article,Obituary (Obit),,"['Deaths (Obituaries)', 'Nobel Prizes', 'DNA (Deoxyribonucleic Acid)', 'Chemistry']"
NOAA Data Confirms July Was Hottest Month Ever Recorded,2019-08-15,article,News,,"['Global Warming', 'Greenhouse Gas Emissions', 'Temperature', 'Records and Achievements']"
New York Needs to Move Aggressively to Protect Cyclists and Pedestrians,2019-08-15,article,Editorial,,"['Bicycles and Bicycling', 'Traffic Accidents and Safety', 'Roads and Traffic']"
Overstock C.E.O. Takes Aim at ‘Deep State’ After Romance With Russian Agent,2019-08-15,article,News,,"['E-Commerce', 'Russian Interference in 2016 US Elections and Ties to Trump Associates', 'United States Politics and Government']"
U.F.C. Needs an Antihero: Nate Diaz Returns Just in Time,2019-08-15,article,News,,['Mixed Martial Arts']
A Conservative’s Call for a Trump Challenger,2019-08-15,article,Letter,,"['Tuberculosis', 'Conservatism (US Politics)', 'Gun Control', 'Presidential Election of 2020', 'Sleep', 'Labeling and Labels (Product)', 'Food', 'United States Politics and Government']"
What Are Trump and Netanyahu Afraid Of?,2019-08-15,article,Editorial,,"['United States International Relations', 'Race and Ethnicity', 'Jews and Judaism', 'Palestinians']"
"Israel Bars 2 Congresswomen, and a Furor Ensues",2019-08-15,article,Letter,,"['Boycotts', 'International Relations']"
"Barbara Crane, 91, Dies; Photographer Found Abstract in the Ordinary",2019-08-15,article,Obituary (Obit),,"['Photography', 'Art', 'Deaths (Obituaries)']"
The U.S. Has Joined Secret Talks With Israel and the U.A.E. The Topic? Iran.,2019-08-15,article,News,,"['United States Politics and Government', 'United States International Relations', 'Economic Conditions and Trends', 'Embargoes and Sanctions']"
"Trump Tower on Obama Avenue: 290,000 Say Yes, but It Won’t Happen",2019-08-15,article,News,,"['Awards, Decorations and Honors']"
An Indian Space Mission Inspires a Bollywood Reckoning,2019-08-15,article,News,,"['Movies', 'Women and Girls']"
Amazon Uses a Twitter Army of Employees to Fight Criticism of Warehouses,2019-08-15,article,News,,['Social Media']
Your Friday Briefing,2019-08-15,article,briefing,,[]
Robert Indiana’s Estate Says Artist’s Caretaker Neglected Him,2019-08-15,article,News,,"['Wills and Estates', 'Art', 'Suits and Litigation (Civil)']"
"N.Y.P.D. Detectives Gave a Boy, 12, a Soda. He Landed in a DNA Database.",2019-08-15,article,News,,"['DNA (Deoxyribonucleic Acid)', 'Forensic Science', 'False Arrests, Convictions and Imprisonments', 'Racial Profiling', 'Search and Seizure', 'Civil Rights and Liberties', 'Privacy', 'Data-Mining and Database Marketing']"
"Daniil Medvedev Is Winning Ugly, but He’s Winning a Lot",2019-08-15,article,News,,['Tennis']
"Summer Reading Contest, Week 10: What Interested You Most in The Times This Week?",2019-08-15,article,News,,[]
9 New Books We Recommend This Week,2019-08-15,article,List,,['Books and Literature']
How YouTube Misinformation Resolved a WhatsApp Mystery in Brazil,2019-08-15,article,News,,[]
8 Things to Do With Your Kids in N.Y.C. This Weekend,2019-08-15,article,News,,['Children and Childhood']
5 Film Series to Catch in N.Y.C. This Weekend,2019-08-15,article,News,,['Movies']
4 Classical Music Concerts to See in N.Y.C. This Weekend,2019-08-15,article,News,,"['Classical Music', 'Opera']"
5 Dance Performances to See in N.Y.C. This Weekend,2019-08-15,article,News,,['Dancing']
6 Plays and Musicals to Go to in N.Y.C. This Weekend,2019-08-15,article,News,,['Theater']
5 Comedy Shows to Catch in N.Y.C. This Weekend,2019-08-15,article,News,,['Comedy and Humor']
"13 Pop, Rock and Jazz Concerts to Check Out in N.Y.C. This Weekend",2019-08-15,article,News,,"['Pop and Rock Music', 'Jazz']"
38 Art Exhibitions to View in N.Y.C. This Weekend,2019-08-15,article,News,,"['Art', 'Museums']"
The Complex History of the Women’s Suffrage Movement,2019-08-15,article,News,,"[""Women's Rights"", 'Nineteenth Amendment (US Constitution)', 'Blacks', 'Black People', 'Discrimination', 'Archives and Records', 'Constitutional Amendments', 'Citizenship and Naturalization', 'Asian-Americans', 'Voting Rights Act (1965)', 'Art', 'Race and Ethnicity', 'Voter Registration and Requirements']"
The Anti-Boycott Law Israel Used to Bar Both Omar and Tlaib,2019-08-15,article,News,,"['United States Politics and Government', 'International Relations']"
My Bill Viola Video Marathon,2019-08-15,article,Review,,"['Art', 'Video Recordings, Downloads and Streaming', 'Museums']"
Todd and Julie Chrisley Plead Not Guilty to Tax Evasion and Bank Fraud,2019-08-15,article,News,,"['Federal Taxes (US)', 'Tax Evasion', 'Reality Television', 'Income Tax']"
I Wish I Could Tell You It’s Gotten Better. It Hasn’t.,2019-08-15,multimedia,Interactive Feature,,[]
How an Online Mob Created a Playbook for a Culture War,2019-08-15,multimedia,Interactive Feature,,['Cyberharassment']
First They Came for the Black Feminists,2019-08-15,multimedia,Interactive Feature,,[]
When the Internet Chases You From Your Home,2019-08-15,multimedia,Interactive Feature,,[]
"What Makes People Charismatic, and How You Can Be, Too",2019-08-15,article,News,,"['Public Speaking', 'Parties (Social)', 'Psychology and Psychologists']"
Leftist Atop Argentina Race Moves From Kirchner’s Shadow. Will His Policies Follow?,2019-08-15,article,News,,['Politics and Government']
Push for Ethnic Studies in Schools Faces a Dilemma: Whose Stories to Tell,2019-08-15,article,News,,"['Education (K-12)', 'Race and Ethnicity', 'Blacks', 'Black People', 'Minorities', 'Jews and Judaism', 'Discrimination']"
‘Pose’ Star Mj Rodriguez ‘Had to Teach Simply by Existing’,2019-08-15,article,News,,"['Hispanic-Americans', 'Transgender and Transsexuals', 'ACTORS AND ACTRESSES', 'Television']"
The Real Hurdle at Tokyo’s Olympic Test Events: The Heat,2019-08-15,article,News,,"['Olympic Games (2020)', 'Weather', 'Triathlon']"
From Trump Boom to Trump Gloom,2019-08-15,article,Op-Ed,,"['United States Economy', 'Recession and Depression', 'Stocks and Bonds', 'United States Politics and Government']"
"Israel, Sacklers, ‘Black Woodstock’: Your Thursday Evening Briefing",2019-08-15,article,briefing,,[]
A Corey Lewandowski Senate Run Would be a Test Case for Trump World,2019-08-15,article,News,,"['United States Politics and Government', 'Presidential Election of 2020']"
How Much Watching Time Do You Have This Weekend?,2019-08-15,article,News,,"['Television', 'Olympic Games (2020)']"
"Migrant Children Are Entitled to Toothbrushes and Soap, Federal Court Rules",2019-08-15,article,News,,"['Immigration and Emigration', 'Immigration Detention', 'Children and Childhood', 'Illegal Immigration']"
"In Super-Deep Diamonds, Glimmers of Earth’s Distant Past",2019-08-15,article,News,,"['Earth', 'Diamonds', 'Helium', 'your-feed-science']"
"DeMarcus Cousins Tears A.C.L. in a Blow to the Lakers, and His Career",2019-08-15,article,News,,"['Basketball', 'Sports Injuries']"
New York Moves to Classify Killings Fueled by White Supremacy as Domestic Terrorism,2019-08-15,article,News,,"['Politics and Government', 'Law and Legislation', 'Mass Shootings', 'Terrorism', 'Hate Crimes', 'El Paso, Tex, Shooting (2019)', 'Dayton, Ohio, Shooting (2019)']"
Labor Dept. Moves to Expand Religion Exemption for Hiring and Firing,2019-08-15,article,News,,"['Government Contracts and Procurement', 'Civil Rights and Liberties', 'Freedom of Religion', 'Discrimination', 'Labor and Jobs', 'Homosexuality and Bisexuality', 'Executive Orders and Memorandums']"
"Edward Lewis, ‘Spartacus’ Producer Who Defied Blacklist, Dies at 99",2019-08-15,article,Obituary (Obit),,"['Movies', 'Blacklisting', 'Deaths (Obituaries)']"
Trial Opens for Former Obama Aide Accused of Lying About Foreign Lobbying,2019-08-15,article,News,,"['Russian Interference in 2016 US Elections and Ties to Trump Associates', 'United States Politics and Government', 'Lobbying and Lobbyists', 'Foreign Agents Registration Act', 'Special Prosecutors (Independent Counsel)']"
Economic Trouble Signs Hang Over Trump’s Trade War,2019-08-16,article,News Analysis,,"['United States Economy', 'International Trade and World Market', 'Customs (Tariff)', 'Recession and Depression', 'Inflation (Economics)', 'Interest Rates']"
"Trump’s Hong Kong Caution Isolates Him From Congress, Allies and Advisers",2019-08-16,article,News Analysis,,"['Hong Kong Protests (2019)', 'United States International Relations', 'International Trade and World Market', 'Human Rights and Human Rights Violations']"
North Korea Launches 2 Projectiles; South Korean Experts Blame Trump,2019-08-16,article,News,,['Defense and Military Forces']
"Trudeau, Once the Bright New Hope, Enters Campaign Tarnished by Scandal",2019-08-16,article,News,,"['Politics and Government', 'Elections', 'Voting and Voters', 'Canadian Federal Election (2019)']"
How a Shooting Unnerved Philadelphia: ‘Our Collective Hearts Were in Our Throats’,2019-08-16,article,News,,"['Attacks on Police', 'Gun Control']"
New Idea for Suicide Prevention Hotline: Just Dial 988,2019-08-16,article,News,,"['Emergency Telephone Numbers', 'Suicides and Suicide Attempts', 'Deaths (Fatalities)']"
"Review: In ‘Make Believe,’ Four Children Meet Their Inner Adults",2019-08-16,article,Review,,['Theater']
Like a Burglar or a Ballerina,2019-08-16,article,News,,['Crossword Puzzles']
Seven Australians You Should Be Reading About,2019-08-16,article,briefing,,"['Comedy and Humor', 'Politics and Government', 'Art']"
"Citing Economy, Trump Says That ‘You Have No Choice but to Vote for Me’",2019-08-16,article,News,,"['United States Economy', 'Presidential Election of 2020']"
"Mississippi Plants Knowingly Hired Undocumented Workers, ICE Says",2019-08-16,article,News,,['Illegal Immigration']
"Global Markets, Israel, Gibraltar: Your Friday Briefing",2019-08-16,article,briefing,,[]
Fact-Checking Trump’s New Hampshire Rally,2019-08-16,article,News,,['Renminbi (Currency)']
Trump Is Said to Ask: Can We Buy Greenland?,2019-08-16,article,News,,['United States Politics and Government']
She Wanted a Man With a Good Job Who Is Nice to Animals,2019-08-16,article,News,,"['Love (Emotion)', 'Dogs', 'Weddings and Engagements', 'Dating and Relationships']"
"Corrections: August 16, 2019",2019-08-16,article,Correction,,[]
On Politics: Israel’s Decision on Omar and Tlaib Inflames Politics in 2 Countries,2019-08-16,article,News,,['United States Politics and Government']
Quotation of the Day: Proposed Address for Trump Tower: 725 Obama Ave.,2019-08-16,article,Quote,,[]
E.P.A. Backtracks on Use of ‘Cyanide Bombs’ to Kill Wild Animals,2019-08-16,article,News,,"['Poisoning and Poisons', 'ANIMALS', 'Environment', 'Agriculture and Farming', 'Demonstrations, Protests and Riots', 'Hazardous and Toxic Substances', 'Biodiversity']"
What’s on TV Friday: ‘Blaze’ and a ‘Jim Gaffigan: Quality Time’,2019-08-16,article,News,,"['Television', 'Movies']"
Myanmar Military Uses Threat of Prison to Stifle Criticism Ahead of Elections,2019-08-16,article,News,,"['Defense and Military Forces', 'Elections', 'Human Rights and Human Rights Violations', 'Legislatures and Parliaments', 'Libel and Slander', 'Freedom of Speech and Expression']"
Colbert Says to Beware Trump’s ‘Patented Anti-Recession Elixir’,2019-08-16,article,News,,[]
"Wells Fargo Closed Their Accounts, but the Fees Continued to Mount",2019-08-16,article,News,,"['Customer Relations', 'Banking and Financial Institutions', 'Frauds and Swindling', 'Debt Collection']"
Why a $1.2 Billion Gambling Mecca Has Fallen on Hard Times,2019-08-16,article,News,,"['Casinos', 'Gambling', 'Politics and Government']"
Girl’s Quest to Sing With Berlin’s Boys’ Choir Is Dashed,2019-08-16,article,News,,"['Classical Music', 'Women and Girls', 'Men and Boys', 'Discrimination', 'Suits and Litigation (Civil)']"
News Quiz: Test Your Knowledge of the Week’s Headlines,2019-08-16,multimedia,Interactive Feature,,[]
Why the N.Y.P.D.’s DNA Database Has Some People Worried,2019-08-16,article,briefing,,"['DNA (Deoxyribonucleic Acid)', 'Forensic Science']"
The Scene of the Crime: A Jury Box?,2019-08-16,article,News,,['Books and Literature']
Sins of Commission (in Michigan) and Omission (in Spain),2019-08-16,article,Letter,,['Books and Literature']
