headline,date,doc_type,material_type,section,keywords
Washington State Beat Back Covid-19. Now It’s Rising Again.,2020-07-16,article,News,,"['Coronavirus (2019-nCoV)', 'Coronavirus Reopenings', 'Disease Rates']"
She Waved a Rainbow Flag at Our Cairo Show. Tragedy Followed.,2020-07-16,article,Op-Ed,,"['Homosexuality and Bisexuality', 'Music', 'Arabs']"
The Many Dimensions of the Chief Justice’s Triumphant Term,2020-07-16,article,Op-Ed,,"['Religion-State Relations', 'Private and Sectarian Schools', 'Discrimination', 'Freedom of Religion', 'Birth Control and Family Planning', 'United States Politics and Government', 'Decisions and Verdicts']"
North Carolina City Approves Reparations for Black Residents,2020-07-16,article,News,,"['Reparations', 'Black People', 'Blacks', 'Black Lives Matter Movement', 'George Floyd Protests (2020)', 'Race and Ethnicity', 'Slavery (Historical)', 'Income Inequality', 'City Councils']"
Ocasio-Cortez Pushes Cuomo to Back Billionaires’ Tax,2020-07-16,article,News,,"['Capital Gains Tax', 'Taxation', 'High Net Worth Individuals', 'Budgets and Budgeting', 'Coronavirus (2019-nCoV)', 'Politics and Government', 'Unemployment Insurance', 'Income Inequality']"
"In the Same Towns, Private Schools Are Reopening While Public Schools Are Not",2020-07-16,article,News,,"['Education (K-12)', 'Coronavirus Reopenings', 'Coronavirus (2019-nCoV)', 'Private and Sectarian Schools', 'Teachers and School Employees', 'E-Learning']"
It’s a Tough Time to Be a Street Musician With a 900-Pound Piano,2020-07-16,article,News,,"['Street Performers', 'Pianos', 'Coronavirus (2019-nCoV)']"
"To Make Orchestras More Diverse, End Blind Auditions",2020-07-16,article,News,,"['Race and Ethnicity', 'Black People', 'Blacks', 'Classical Music']"
Opera Can No Longer Ignore Its Race Problem,2020-07-16,article,News,,"['Black People', 'Blacks', 'Race and Ethnicity', 'Discrimination', 'Opera', 'Black Lives Matter Movement']"
It’s Merkel’s Last Rodeo. Will a Pandemic Rescue Deal Seal Her Legacy?,2020-07-16,article,News,,"['Politics and Government', 'Coronavirus (2019-nCoV)', 'International Relations', 'Stimulus (Economic)']"
Black Artists on How to Change Classical Music,2020-07-16,article,News,,"['Black People', 'Blacks', 'Classical Music', 'Opera']"
Boom Time for Death Planning,2020-07-16,article,News,,"['Coronavirus (2019-nCoV)', 'Grief (Emotion)', 'Funerals and Memorials', 'Living Wills and Health Care Proxies', 'Death and Dying', 'Wills and Estates', 'Computers and the Internet', 'Start-ups', 'Social Media', 'Midwives and Doulas']"
Shootings Have Soared. Is the N.Y.P.D. Pulling Back?,2020-07-16,article,News,,"['Murders, Attempted Murders and Homicides', 'Crime and Criminals', 'Police Reform', 'George Floyd Protests (2020)', 'Police']"
Vacation in the Summer of Covid-19,2020-07-16,article,News,,"['Coronavirus Risks and Safety Concerns', 'Travel Warnings', 'Travel and Vacations', 'Quarantines', 'Coronavirus (2019-nCoV)', 'Rivers', 'Quarantine (Life and Culture)', 'Summer (Season)', 'Camps and Camping', 'Coronavirus Reopenings', 'Road Trips', 'Parks and Other Recreation Areas', 'Wines']"
"Kicked Out of China, and Other Real-Life Costs of a Geopolitical Meltdown",2020-07-16,article,Op-Ed,,"['Coronavirus (2019-nCoV)', 'Embargoes and Sanctions', 'News and News Media', 'Freedom of the Press', 'Presidential Election of 2020', 'Newspapers', 'Immigration and Emigration', 'United States Politics and Government', 'Visas', 'Citizenship and Naturalization', 'International Relations', 'Uighurs (Chinese Ethnic Group)', 'Martial Arts', 'Moving and Moving Industry', 'Chinese-Americans']"
U.S. Shatters Its Record of New Coronavirus Infections as India’s Caseload Hits a Million,2020-07-16,article,News,,['Coronavirus (2019-nCoV)']
Unpacking Cuomo’s Covid-19 Poster,2020-07-16,article,briefing,,"['Coronavirus (2019-nCoV)', 'Posters', 'Quarantines', 'Art']"
"Reopening, Warily: Revisiting Jasmine Lombrage",2020-07-16,article,News,,"['Coronavirus (2019-nCoV)', 'Quarantines', 'Restaurants', 'Coronavirus Reopenings', 'States (US)']"
"Letting Your Insurer Ride Shotgun, for a Discounted Rate",2020-07-16,article,News,,"['Automobile Insurance and Liability', 'Automobiles', 'Mobile Applications', 'Computers and the Internet', 'Smartphones', 'Motivation and Incentive Programs']"
Big Business in Bangladesh: Selling Fake Coronavirus Certificates,2020-07-16,article,News,,"['Coronavirus (2019-nCoV)', 'Tests (Medical)', 'Frauds and Swindling', 'Migrant Labor (Non-Agriculture)', 'Foreign Workers']"
"Entering a Paris Theater, Warily, and Finding a Weight Lifted",2020-07-16,article,Review,,['Theater']
The pandemic has bolstered to start-ups that provide end-of-life services.,2020-07-16,article,News,,[]
China’s economic rebound from the virus may be hard to sustain.,2020-07-16,article,News,,[]
What’s Behind the Shootings?,2020-07-16,article,briefing,,[]
‘The Painted Bird’ Review: Horrors That Can’t Be Unseen,2020-07-16,article,Review,,['Movies']
‘Flannery’ Review: Stories About a Writer,2020-07-16,article,Review,,"['Documentary Films and Programs', 'Books and Literature']"
"‘Blessed Child’ Review: Leaving the Fold, but Not Family",2020-07-16,article,Review,,['Documentary Films and Programs']
‘Dirt Music’ Review: Damaged Lovers and Dreamy Landscapes,2020-07-16,article,Review,,['Movies']
‘Father Soldier Son’ Review: Service and Sacrifice,2020-07-16,article,Review,,"['Documentary Films and Programs', 'United States Defense and Military Forces']"
Fauci Calls White House Criticism ‘Bizarre’,2020-07-16,article,News,,"['Coronavirus (2019-nCoV)', 'United States Politics and Government']"
‘Tough Day for Us at Twitter’,2020-07-16,article,News,,"['Social Media', 'Coronavirus Risks and Safety Concerns', 'Coronavirus (2019-nCoV)']"
"Shamima Begum, Who Joined ISIS in Syria, Can Return to U.K., Court Says",2020-07-16,article,News,,"['Decisions and Verdicts', 'Citizenship and Naturalization']"
The New Must-Have Museum Souvenir: Face Masks,2020-07-16,article,News,,"['Art', 'Masks', 'Museums', 'Protective Clothing and Gear']"
Online Map Collection Provides a Peek at New York Over the Centuries,2020-07-16,article,News,,"['Maps', 'Agriculture and Farming']"
"A Big Convention Decision by Democrats, and a Play for White Suburban Voters by Trump",2020-07-16,article,News,,['Presidential Election of 2020']
Closest Pictures Ever Taken of Sun Show Tiny Campfire Flares,2020-07-16,article,News,,"['Sun', 'Solar System', 'Research', 'Solar Orbiter (Spacecraft)']"
Morgan Stanley reports record profits.,2020-07-16,article,News,,"['Company Reports', 'Banking and Financial Institutions']"
Bank of America sets aside another $4 billion to cover loan losses.,2020-07-16,article,News,,"['Banking and Financial Institutions', 'Company Reports', 'Credit and Debt', 'Coronavirus (2019-nCoV)']"
"California Breaks a Record: 10,000 New Cases in a Day",2020-07-16,article,briefing,,['Coronavirus (2019-nCoV)']
"As stores reopen, retailers say customer behavior is hit and miss.",2020-07-16,article,News,,[]
The T List: Five Things We Recommend This Week,2020-07-16,article,News,,"['Art', 'Music', 'Fashion and Apparel', 'Vinegar', 'Design']"
Financial Brokers Must Now Act in Your ‘Best Interest.’ What Does That Mean?,2020-07-16,article,News,,"['Consumer Protection', 'Financial Brokers', 'Regulation and Deregulation of Industry', 'Content Type: Service', 'Personal Finances']"
Spend More on Society and Get More for Yourself,2020-07-16,article,News,,"['United States Economy', 'Coronavirus (2019-nCoV)', 'High Net Worth Individuals', 'Income Tax']"
On the Market in New York City,2020-07-16,multimedia,Slideshow,,['Real Estate and Housing (Residential)']
"Homes for Sale in Brooklyn, Manhattan and the Bronx",2020-07-16,article,News,,['Real Estate and Housing (Residential)']
On the Market in the New York Region,2020-07-16,multimedia,Slideshow,,['Real Estate and Housing (Residential)']
Homes for Sale in New York and New Jersey,2020-07-16,article,News,,['Real Estate and Housing (Residential)']
Government Executes Second Federal Death Row Prisoner in a Week,2020-07-16,article,News,,"['Capital Punishment', 'Decisions and Verdicts', 'Murders, Attempted Murders and Homicides', 'Coronavirus (2019-nCoV)']"
Unfamiliar Territory for Indian Bridal Industry,2020-07-16,article,News,,"['Shopping and Retail', 'Fashion and Apparel', 'Coronavirus (2019-nCoV)', 'Luxury Goods and Services']"
British Vogue Editor Says the Magazine’s Security ‘Racially Profiled’ Him,2020-07-16,article,News,,"['Fashion and Apparel', 'Black People', 'Blacks', 'Social Media', 'your-feed-fashion', 'Magazines', 'Racial Profiling', 'Discrimination']"
"In Coronavirus Vaccine Race, China Strays From the Official Paths",2020-07-16,article,News,,"['Coronavirus (2019-nCoV)', 'Vaccination and Immunization', 'Clinical Trials', 'Politics and Government']"
Retail economists worry that rise in sales could be fleeting.,2020-07-16,article,News,,"['Shopping and Retail', 'Shutdowns (Institutional)']"
The Most Popular Listings of June,2020-07-16,article,News,,['Real Estate and Housing (Residential)']
Coronavirus Drug and Treatment Tracker,2020-07-16,multimedia,Interactive Feature,,"['Coronavirus (2019-nCoV)', 'Clinical Trials', 'Immune System', 'Drugs (Pharmaceuticals)', 'Hydroxychloroquine (Drug)', 'Dexamethasone (Drug)', 'Remdesivir (Drug)', 'Favipiravir (Drug)', 'Ventilators (Medical)', 'Ultraviolet Light', 'Vaccination and Immunization']"
"Russia Is Trying to Steal Virus Vaccine Data, Western Nations Say",2020-07-16,article,News,,"['Cyberwarfare and Defense', 'Coronavirus (2019-nCoV)', 'Vaccination and Immunization', 'Espionage and Intelligence Services', 'Drugs (Pharmaceuticals)', 'Research', 'Industrial Espionage']"
Biden Banks $242 Million as Big-Name Donors Write Huge Checks,2020-07-16,article,News,,"['Presidential Election of 2020', 'Campaign Finance', 'Political Action Committees']"
"Now That Studio Ghibli Is Streaming on HBO Max, Where Do You Start?",2020-07-16,article,News,,['ANIMATED FILMS']
"Finally, Some Good News (Carved From 90 Pounds of Butter)",2020-07-16,article,News,,"['Butter', 'State and County Fairs', 'Sculpture']"
"Florida, Georgia and California show a rise in jobless claims.",2020-07-16,article,News,,"['Unemployment Insurance', 'Unemployment']"
How a Struggling Company Won $1.6 Billion to Make a Coronavirus Vaccine,2020-07-16,article,News,,"['Vaccination and Immunization', 'Public-Private Sector Cooperation', 'Coronavirus (2019-nCoV)', 'Clinical Trials', 'Government Contracts and Procurement', 'Respiratory Syncytial Virus (RSV)', 'United States Politics and Government']"
‘Solitary leisure’ is one bright spot on the retail landscape.,2020-07-16,article,News,,[]
‘The Sunlit Night’ Review: A Trip to the Arctic to Find Her Muse,2020-07-16,article,Review,,['Movies']
"Leonardo Villar, Venerated Brazilian Actor, Dies at 96",2020-07-16,article,Obituary (Obit),,"['ACTORS AND ACTRESSES', 'Deaths (Obituaries)', 'Cannes International Film Festival', 'Movies']"
We Interrupt This Gloom to Offer … Hope,2020-07-16,article,Op-Ed,,"['United States Politics and Government', 'Black People', 'Blacks', 'Polls and Public Opinion', 'Race and Ethnicity', 'Coronavirus (2019-nCoV)', 'Recession and Depression', 'States (US)', 'Health Insurance and Managed Care', 'Welfare (US)', 'Income Inequality']"
How Ultra-Black Fish Disappear in the Deepest Seas,2020-07-16,article,News,,"['Fish and Other Marine Life', 'ANIMALS', 'Color', 'Evolution (Biology)', 'Research', 'your-feed-animals', 'Biology and Biochemistry']"
"Pandemic’s Headache for Managers: Downs, Ups and … Now What?",2020-07-16,article,News,,"['Shutdowns (Institutional)', 'Layoffs and Job Reductions', 'Coronavirus (2019-nCoV)', 'Factories and Manufacturing', 'Labor and Jobs', 'Coronavirus Reopenings', 'Coronavirus Aid, Relief, and Economic Security Act (2020)', 'United States Economy', 'Condiments', 'Small Business']"
"The eurozone economy is still fragile, E.C.B. president says.",2020-07-16,article,News,,[]
Need a Drink? Make It Just One,2020-07-16,multimedia,Interactive Feature,,['ALCOHOLIC BEVERAGES']
What Happens Now to All That Washington N.F.L. Merchandise?,2020-07-16,article,News,,"['Football', 'Race and Ethnicity', 'Memorabilia and Souvenirs', 'Names, Organizational', 'Native Americans', 'Discrimination']"
A Club of G.O.P. Political Heirs Push Back on Trump,2020-07-16,article,News,,"['United States Politics and Government', 'Presidential Election of 2020']"
"Charlie Kaufman Is Sorry, He’s a Bit Distracted",2020-07-16,article,News,,"['Books and Literature', 'Writing and Writers']"
Opposition Challenges Poland’s Presidential Election Results,2020-07-16,article,News,,"['Elections', 'Elections, Courts and the Judiciary', 'Voter Fraud (Election Fraud)']"
Southern Iraq’s Toxic Twilight,2020-07-16,article,News,,"['Air Pollution', 'Oil (Petroleum) and Gasoline', 'Cancer', 'Greenhouse Gas Emissions', 'Natural Gas', 'Hazardous and Toxic Substances']"
"No One Knows What Thailand Is Doing Right, but So Far, It’s Working",2020-07-16,article,News,,"['Coronavirus (2019-nCoV)', 'Economic Conditions and Trends', 'Disease Rates']"
"U.K. Police Step Back on Victims’ Data, a Flash Point in Rape Cases",2020-07-16,article,News,,"['Women and Girls', 'Sex Crimes', 'Search and Seizure']"
Reparations for Aunt Jemima!,2020-07-16,article,News,,['Reparations']
"He’s back at work, but wondering for how long.",2020-07-16,article,News,,[]
N.F.L. Teams and Players Make Decisions on Franchise Tags,2020-07-16,article,News,,"['Football', 'Free Agents (Sports)']"
Asheville’s City Council Votes for Reparations for Black Residents,2020-07-16,multimedia,Video,,"['City Councils', 'Reparations', 'Black People', 'Blacks', 'Income Inequality']"
Federal Missteps on Covid-19 Data and Testing,2020-07-16,article,Letter,,"['Coronavirus (2019-nCoV)', 'Tests (Medical)', 'United States Politics and Government']"
D.A. Accuses Trump of Delay ‘Strategy’ in Fight Over Tax Returns,2020-07-16,article,News,,"['United States Politics and Government', 'Trump Tax Returns', 'Decisions and Verdicts', 'Immunity from Prosecution']"
How Our Reporter Fought ‘Doomscrolling’,2020-07-16,article,News,,"['Social Media', 'News and News Media']"
How the Creators of ‘Cursed’ Conjured a Fresh Take on King Arthur,2020-07-16,article,News,,"['Television', 'Myths and Mythical Creatures']"
"Seeing ‘Black Lives Matter’ Written in Chalk, One City Declares It a Crime",2020-07-16,article,News,,"['George Floyd Protests (2020)', 'Black People', 'Blacks', 'Black Lives Matter Movement', 'Race and Ethnicity', 'Police Brutality, Misconduct and Shootings', 'Demonstrations, Protests and Riots', 'Art', 'Signs and Signage']"
7 Things to Do This Weekend,2020-07-16,article,News,,"['Music', 'Art', 'Theater', 'River to River Festival (NYC)', 'Dancing', 'Mathematics', 'Butterflies and Moths', 'Comedy and Humor', 'Quarantine (Life and Culture)', 'Children and Childhood', 'Pop and Rock Music', 'Classical Music']"
The ‘Black Lives Matter’ Street Art That Contains Multitudes,2020-07-16,article,News,,"['Art', 'Black Lives Matter Movement', 'Murals', 'Black People', 'Blacks', 'George Floyd Protests (2020)', 'Police Brutality, Misconduct and Shootings', 'United States Politics and Government']"
"David Kaiser, Rockefeller Heir Who Fought Exxon Mobil, Dies at 50",2020-07-16,article,Obituary (Obit),,"['Deaths (Obituaries)', 'Oil (Petroleum) and Gasoline', 'Global Warming', 'Philanthropy', 'Criminal Justice']"
Do Cinematographers Have a Signature? Let’s Try a Test,2020-07-16,article,News,,['Movies']
Supreme Court Allows Restrictions on Voting by Ex-Felons,2020-07-16,article,News,,"['Voter Registration and Requirements', 'Ex-Convicts', 'United States Politics and Government', 'Appeals Courts (US)', 'Twenty-Fourth Amendment (US Constitution)']"
"Amid the Storm, Dave Dombrowski Plots an M.L.B. Future in Nashville",2020-07-16,article,News,,"['Baseball', 'Stadiums and Arenas']"
"As Election Nears, Trump’s White House Grows Bolder in Flouting Ethical Norms",2020-07-16,article,News,,"['Presidential Election of 2020', 'United States Politics and Government', 'Ethics and Official Misconduct', 'Hatch Act (1939)', 'Government Employees']"
Keeping Kids Curious About Their Bodies Without Shame,2020-07-16,article,News,,"['Children and Childhood', 'Parenting', 'Education (K-12)', 'Sex', 'Content Type: Service']"
No Food? No Booze. Cuomo Cracks Down on Outdoor Drinking at Bars.,2020-07-16,article,News,,"['Bars and Nightclubs', 'Restaurants', 'Coronavirus Reopenings', 'Coronavirus (2019-nCoV)', 'Quarantines', 'ALCOHOLIC BEVERAGES']"
CVS Fined for Prescription Errors and Poor Staffing at Pharmacies,2020-07-16,article,News,,"['Drugs (Pharmaceuticals)', 'Drugstores', 'Fines (Penalties)']"
A False Sense of Safety From Inadequate Masks and Gloves,2020-07-16,article,Letter,,"['Coronavirus Risks and Safety Concerns', 'Masks', 'Protective Clothing and Gear', 'United States Politics and Government']"
"As Galleries Reopen, Two Critics Find Rewards Eclipse the Angst",2020-07-16,article,News,,"['Art', 'Coronavirus Reopenings']"
10 New Books We Recommend This Week,2020-07-16,article,List,,['Books and Literature']
"Hillary Gregg, Line Cook at Top-Shelf Restaurants, Dies at 73",2020-07-16,article,Obituary (Obit),,"['Deaths (Obituaries)', 'Coronavirus (2019-nCoV)', 'Cooking and Cookbooks', 'Restaurants', 'Chefs']"
It’s All About the Franklins … the Aretha Franklins,2020-07-16,article,News,,['US Dollar (Currency)']
Police Officers Found Guilty in Acid Attack. But Doubts Remain.,2020-07-16,article,News,,"['Corruption (Institutional)', 'Assaults']"
The Designer Who Defined Modern Parisian Cool,2020-07-16,article,News,,"['Fashion and Apparel', 'Design', 'ARCHITECTURE']"
"U.S. Visas, China’s Economy, Street Musicians: Your Friday Briefing",2020-07-16,article,briefing,,[]
Vatican Tells Bishops to Report Sex Abuse to Police (but Doesn’t Require It),2020-07-16,article,News,,"['Sex Crimes', 'Priests', 'Child Abuse and Neglect']"
The Boston Bruins Had Home Ice. Now They’ve Got a Hub.,2020-07-16,article,News,,"['Hockey, Ice']"
W.H.O. Asks for Help Fighting Growing Ebola Outbreak,2020-07-16,article,News,,"['Coronavirus (2019-nCoV)', 'Ebola Virus']"
Missing Theater Under the Stars (Even the Bugs and the Rain),2020-07-16,article,News,,"['Theater', 'Quarantine (Life and Culture)', 'Summer (Season)']"
Barr Urges U.S. Companies to Resist Serving as ‘Pawns’ for China,2020-07-16,article,News,,"['Speeches and Statements', 'United States International Relations', 'Censorship', 'Movies', 'Computer Security', 'Economic Conditions and Trends', 'Propaganda', 'Attorneys General', 'United States Politics and Government', 'Embargoes and Sanctions']"
The Time I Saw Angela Lansbury Instead of the Horse Show,2020-07-16,article,News,,"['Theater', 'Suburbs', 'ACTORS AND ACTRESSES']"
Washington N.F.L. Team Faces Sexual Harassment Claims from 15 Women,2020-07-16,article,News,,"['Football', 'Workplace Hazards and Violations', 'Sexual Harassment']"
When a Corporate Picnic Plus Shakespeare Is Anything but Routine,2020-07-16,article,News,,['Theater']
Anger at Mali’s President Rises After Security Forces Kill Protesters,2020-07-16,article,News,,"['Demonstrations, Protests and Riots', 'Civilian Casualties', 'Legislatures and Parliaments']"
How Much Watching Time Do You Have This Weekend?,2020-07-16,article,News,,['Television']
"Consumers Came Back in June, but for How Long?",2020-07-16,article,News,,"['Shopping and Retail', 'United States Economy', 'Consumer Behavior', 'Sporting Goods and Equipment', 'Coronavirus Aid, Relief, and Economic Security Act (2020)']"
Big Banks’ ‘Revolutionary’ Request: Please Don’t Weaken This Rule,2020-07-16,article,News,,"['Banking and Financial Institutions', 'Mortgages', 'Real Estate and Housing (Residential)', 'Discrimination', 'Race and Ethnicity', 'Regulation and Deregulation of Industry', 'Fair Housing Act (1968)']"
"Mortgage Rates Drop Below 3% for First Time, Tempting Home Buyers",2020-07-16,article,News,,"['Mortgages', 'Interest Rates', 'Real Estate and Housing (Residential)']"
How to Report on Internet Culture and the Teens Who Rule It,2020-07-16,article,News,,"['Computers and the Internet', 'Parenting', 'Youth', 'Social Media', 'Text Messaging', 'Instant Messaging', 'Video Recordings, Downloads and Streaming', 'your-feed-selfcare']"
"Joanna Cole, Who Imagined Fantastical Bus Rides, Dies at 75",2020-07-16,article,Obituary (Obit),,"['Books and Literature', 'Writing and Writers', 'Children and Childhood', 'Deaths (Obituaries)']"
Parenting in the Bubble: ‘This Is Mom’s Job. You Have to Work With Me.’,2020-07-16,article,News,,"['Parenting', 'Women and Girls', 'Athletics and Sports', 'Work-Life Balance', 'Soccer', 'Basketball', 'Quarantine (Life and Culture)']"
I’m a Black Police Officer. Here’s How to Change the System.,2020-07-16,article,Op-Ed,,"['Police Reform', 'Police', 'Budgets and Budgeting', 'Police Brutality, Misconduct and Shootings', 'Race and Ethnicity']"
"‘The Science Should Not Stand in the Way,’ McEnany Says of Reopening Schools",2020-07-16,multimedia,Video,,"['Coronavirus Reopenings', 'United States Politics and Government', 'Education (K-12)', 'Coronavirus (2019-nCoV)']"
Netflix Appoints Ted Sarandos as Co-Chief Executive,2020-07-16,article,News,,"['Appointments and Executive Changes', 'Coronavirus (2019-nCoV)', 'Company Reports', 'Web-Original Programming', 'Movies', 'Television']"
Coronavirus Briefing: What Happened Today,2020-07-16,article,briefing,,['Coronavirus (2019-nCoV)']
"Eddie Gale, Deeply Spiritual Jazz Trumpeter, Dies at 78",2020-07-16,article,Obituary (Obit),,"['Deaths (Obituaries)', 'Jazz']"
Twitter Struggles to Unpack a Hack Within Its Walls,2020-07-16,article,News,,"['Cyberattacks and Hackers', 'Computers and the Internet', 'Social Media', 'United States Politics and Government', 'Computer Security', 'Bitcoin (Currency)']"
"If Kanye West Is Running for President, So Is Your Mom",2020-07-16,article,News,,"['Presidential Election of 2020', 'Presidential Elections (US)']"
Matisse Thybulle Is the Breakout (Mini-Movie) Star of the N.B.A. Bubble,2020-07-16,article,News,,"['Basketball', 'Video Recordings, Downloads and Streaming', 'Social Media', 'Quarantine (Life and Culture)', 'Coronavirus Reopenings']"
Bill Stepien Takes Helm of Trump Campaign as a Data-Obsessed Political Fighter,2020-07-16,article,News,,"['Presidential Election of 2020', 'George Washington Bridge Scandal (2013)']"
"Under Hedge Fund Set to Own McClatchy, Canadian Newspapers Endured Big Cuts",2020-07-16,article,News,,"['Newspapers', 'Layoffs and Job Reductions', 'Shutdowns (Institutional)', 'Mergers, Acquisitions and Divestitures', 'News and News Media', 'Hedge Funds', 'Media']"
1 Dead and 3 Injured as Construction Platform Plummets in Manhattan,2020-07-16,article,News,,"['Accidents and Safety', 'Workplace Hazards and Violations']"
The Next Disaster Is Just a Few Days Away,2020-07-16,article,Op-Ed,,"['United States Economy', 'Labor and Jobs', 'Layoffs and Job Reductions', 'Coronavirus (2019-nCoV)', 'Unemployment Insurance', 'Unemployment', 'Coronavirus Aid, Relief, and Economic Security Act (2020)', 'Recession and Depression', 'United States Politics and Government']"
"Twitter, Russia, Comet NEOWISE: Your Thursday Evening Briefing",2020-07-16,article,briefing,,[]
What We Eat During a Plague,2020-07-16,article,News,,"['Food', 'Quarantine (Life and Culture)', 'Cooking and Cookbooks', 'Diet and Nutrition', 'Plague', 'Epidemics']"
"USA Today, After Fracas, Says Op-Ed Attacking Fauci Fell Short of Standards",2020-07-16,article,News,,"['Newspapers', 'Presidential Election of 2020', 'Coronavirus (2019-nCoV)', 'United States Politics and Government', 'Rumors and Misinformation']"
"At the Hirshhorn, a Battle Over Plans for Its Sculpture Garden",2020-07-16,article,News,,"['Art', 'Museums', 'Sculpture', 'ARCHITECTURE', 'Historic Buildings and Sites']"
Pompeo Says Human Rights Policy Must Prioritize Property Rights and Religion,2020-07-16,article,News,,"['Speeches and Statements', 'Human Rights and Human Rights Violations', 'United States International Relations', 'Freedom of Religion', 'United States Politics and Government']"
"NASA Delays James Webb Telescope Launch Date, Again",2020-07-16,article,News,,"['James Webb Space Telescope', 'Space and Astronomy', 'Stars and Galaxies', 'Telescopes and Observatories', 'Coronavirus (2019-nCoV)']"
N.C.A.A. Updates Guidelines and Says Return of Sports Depends on Spread,2020-07-16,article,News,,"['Football (College)', 'Coronavirus (2019-nCoV)', 'Athletics and Sports', 'Historically Black Colleges and Universities']"
"As the Virus Deepens Financial Trouble, Colleges Turn to Layoffs",2020-07-16,article,News,,"['Colleges and Universities', 'Layoffs and Job Reductions', 'Coronavirus (2019-nCoV)', 'Wages and Salaries']"
President Biden’s First Day,2020-07-16,article,Op-Ed,,['Presidential Election of 2020']
What the Twitter Hack Revealed: An Election System Teeming With Risks,2020-07-16,article,News,,"['Social Media', 'Cyberattacks and Hackers', 'Cyberwarfare and Defense', 'Presidential Election of 2020', 'Russian Interference in 2016 US Elections and Ties to Trump Associates', 'Elections', 'Rumors and Misinformation']"
"Federal Employees Can Express Support for Black Lives Matter, Watchdog Says",2020-07-16,article,News,,"['Black Lives Matter Movement', 'Hatch Act (1939)', 'United States Politics and Government']"
A Debate About Open Debate,2020-07-16,article,Op-Ed,,"['Labor and Jobs', 'Freedom of Speech and Expression', 'Speeches and Statements']"
"Extending Cruise Ban, C.D.C. Slams Industry for Spreading Coronavirus",2020-07-16,article,News,,"['Coronavirus (2019-nCoV)', 'Disease Rates', 'Cruises', 'Coronavirus Reopenings']"
