headline,date,doc_type,material_type,section,keywords
Trump Sends In More Federal Agents,2020-07-23,article,News,,"['United States Politics and Government', 'Crime and Criminals']"
Elon Musk Delivers a Big Surprise,2020-07-23,article,News,,"['Corporate Taxes', 'Antitrust Laws and Competition Issues', 'Shareholder Rights and Activism', ""Standard & Poor's 500-Stock Index"", 'Coronavirus (2019-nCoV)', 'Vaccination and Immunization']"
A Work in Progress That Explores Our Collective Ignorance,2020-07-23,article,News,,"['Art', 'Performance Art']"
"John Lewis, Civil Rights Icon and Congressman, Will Lie in State at the Capitol Rotunda",2020-07-23,article,News,,['Presidential Election of 2020']
Owner of Ann Taylor and Lane Bryant Files for Bankruptcy,2020-07-23,article,News,,"['Shopping Centers and Malls', 'Real Estate (Commercial)', 'Shopping and Retail', 'Fashion and Apparel', 'E-Commerce', 'Coronavirus (2019-nCoV)', 'Bankruptcies']"
Angels and Artisans,2020-07-23,article,News,,"['Fashion and Apparel', 'Dresses', 'Coronavirus (2019-nCoV)', 'Couture (Fashion)', 'Fashion Shows', 'your-feed-fashion']"
Introducing: Nice White Parents,2020-07-23,article,News,,"['Education (K-12)', 'Education', 'Parenting', 'Race and Ethnicity', 'Discrimination']"
"‘Tag-team parenting’ as jobs, joblessness and schooling take a toll on couples.",2020-07-23,article,News,,[]
California Reports More Coronavirus Cases Than New York,2020-07-23,article,briefing,,['Coronavirus (2019-nCoV)']
The T List: Five Things We Recommend This Week,2020-07-23,article,News,,"['Art', 'Books and Literature', 'Ceramics and Pottery', 'Deet (Insect Repellent)', 'Puzzles']"
Google Takes Aim at Amazon. Again.,2020-07-23,article,News,,"['E-Commerce', 'Computers and the Internet', 'Shopping and Retail', 'Search Engines', 'ADVERTISING AND MARKETING']"
How Well Is the Real Estate Market Recovering?,2020-07-23,article,News,,"['Real Estate and Housing (Residential)', 'Prices (Fares, Fees and Rates)', 'Coronavirus Reopenings', 'Coronavirus (2019-nCoV)']"
How New York’s Jewish Museum Anticipated the Avant-Garde,2020-07-23,article,News,,"['Art', 'Jews and Judaism', 'Museums']"
On the Market in the New York Region,2020-07-23,multimedia,Slideshow,,['Real Estate and Housing (Residential)']
Homes for Sale in New York and Connecticut,2020-07-23,article,News,,['Real Estate and Housing (Residential)']
On the Market in New York City,2020-07-23,multimedia,Slideshow,,['Real Estate and Housing (Residential)']
"Homes for Sale in Brooklyn, Manhattan and Queens",2020-07-23,article,News,,['Real Estate and Housing (Residential)']
"Beijing’s Tightrope: Stand Tough, but Avoid a Full Rupture With the U.S.",2020-07-23,article,News,,"['United States International Relations', 'Politics and Government', 'Elections', 'Economic Conditions and Trends']"
What Changes in the First Year of Marriage?,2020-07-23,article,News,,"['Marriages', 'Millennial Generation', 'Quarantines']"
‘Egregious Overreaction’: Portland Mayor Is Tear Gassed by Federal Officers,2020-07-23,multimedia,Video,,"['Tear Gas', 'Mayors', 'Federal-State Relations (US)', 'Police Brutality, Misconduct and Shootings', 'George Floyd Protests (2020)']"
Analysts worry about the top-heavy stock market.,2020-07-23,article,News,,[]
‘Almost Famous’: The Oral History of a Golden God’s Acid Trip,2020-07-23,article,News,,"['Movies', 'Music']"
A Decade of Puppets in Organized Chaos,2020-07-23,article,News,,"['Puppets', 'Quarantine (Life and Culture)', 'Theater']"
"Taylor Swift and Kanye West Will Tangle Again, With Dueling Albums",2020-07-23,article,News,,"['Pop and Rock Music', 'Rap and Hip-Hop', 'Movies']"
‘It’s Like Groundhog Day’: Coronavirus Testing Labs Again Lack Key Supplies,2020-07-23,article,News,,"['Coronavirus (2019-nCoV)', 'Tests (Medical)', 'Laboratories and Scientific Equipment', 'Research', 'Shortages']"
Large DNA Study Traces Violent History of American Slavery,2020-07-23,article,News,,"['your-feed-science', 'Genetics and Heredity', 'Slavery (Historical)', 'Research', 'DNA (Deoxyribonucleic Acid)']"
Why Some Mosquitoes Prefer Humans,2020-07-23,article,News,,"['Mosquitoes', 'Urban Areas', 'Genetics and Heredity', 'your-feed-science', 'your-feed-health']"
How Trump’s Use of Federal Forces in Cities Differs From Past Presidents,2020-07-23,article,News,,"['Demonstrations, Protests and Riots', 'Federal-State Relations (US)', 'Urban Areas', 'Crime and Criminals']"
Video Surfaces of Execution of Aid Workers and Others Abducted in Nigeria,2020-07-23,article,News,,"['Terrorism', 'Civilian Casualties', 'Politics and Government', 'Murders, Attempted Murders and Homicides', 'Humanitarian Aid', 'Kidnapping and Hostages']"
A Grandmother Offered Poetry and a Tween Found His Voice,2020-07-23,article,News,,"['Poetry and Poets', 'Grandparents', 'Parenting', 'Quarantines', 'Soccer', 'Homeless Persons', 'Coronavirus (2019-nCoV)']"
"The Tax Cut That Trump Wants, but Few Others Do, Explained",2020-07-23,article,News,,"['Taxation', 'Layoffs and Job Reductions', 'United States Economy', 'Federal Taxes (US)', 'Coronavirus (2019-nCoV)', 'Payroll Tax', 'Stimulus (Economic)']"
‘Finish the Fight’: A Special Digital Theater Performance Celebrates 100 Years of Women’s Right to Vote,2020-07-23,article,News,,"['Nineteenth Amendment (US Constitution)', ""Women's Rights"", 'Theater']"
Barack Obama and Joe Biden Join Forces in Video Targeting Trump,2020-07-23,article,News,,"['Presidential Election of 2020', 'United States Politics and Government', 'Patient Protection and Affordable Care Act (2010)', 'Coronavirus (2019-nCoV)', 'Masks']"
Viewing Party! Let’s All Watch ‘Love & Basketball’,2020-07-23,article,News,,['Movies']
Teachers’ Fear of Returning to the Classroom,2020-07-23,article,Letter,,"['Education (K-12)', 'Teachers and School Employees', 'Coronavirus (2019-nCoV)']"
Tropical Storm Gonzalo Expected to Become 2020’s First Atlantic Hurricane,2020-07-23,article,News,,"['Hurricanes and Tropical Storms', 'Weather']"
Saudi King Is Said to Have Successful Gallbladder Surgery,2020-07-23,article,News,,"['Surgery and Surgeons', 'Politics and Government']"
Should 5-Year-Olds Start School This Year?,2020-07-23,article,News,,"['Education (K-12)', 'Coronavirus Reopenings', 'E-Learning', 'Children and Childhood', 'Coronavirus (2019-nCoV)', 'internal-essential']"
"Judge Orders Cohen Released, Citing ‘Retaliation’ Over Tell-All Book",2020-07-23,article,News,,"['Books and Literature', 'Prisons and Prisoners', 'Decisions and Verdicts', 'United States Politics and Government']"
Shot Twice in the Back: A Case Tests the ‘Fleeing Felon’ Defense,2020-07-23,article,News,,"['George Floyd Protests (2020)', 'Police Brutality, Misconduct and Shootings', 'Fugitives', 'Suits and Litigation (Civil)']"
‘Days of the Whale’ Review: A Battle Between Art and Power,2020-07-23,article,Review,,['Movies']
Read a Summary of the Republican’s Draft Proposal for More Virus Aid,2020-07-23,multimedia,Interactive Feature,,[]
Do We Need to Tell Our Son That His Dad Has Coronavirus?,2020-07-23,article,News,,"['Customs, Etiquette and Manners', 'Coronavirus Risks and Safety Concerns']"
The W.N.B.A. Is Out to Reclaim ‘Tremendous Momentum’ in New Season,2020-07-23,article,News,,"['Basketball', 'Coronavirus Reopenings', 'Coronavirus (2019-nCoV)']"
Epstein Mansions in New York and Palm Beach for Sale for $110 Million,2020-07-23,article,News,,"['Child Abuse and Neglect', 'Real Estate and Housing (Residential)', 'Wills and Estates']"
"Ronald L. Graham, Who Unlocked the Magic of Numbers, Dies at 84",2020-07-23,article,Obituary (Obit),,"['Mathematics', 'Deaths (Obituaries)', 'Juggling and Jugglers']"
These Women Are in the Running to Be Biden’s Vice President Pick,2020-07-23,multimedia,Interactive Feature,,"['Presidential Election of 2020', 'United States Politics and Government', 'Vice Presidents and Vice Presidency (US)']"
Obama and Biden Discuss Health Care Legacy in Campaign Video,2020-07-23,multimedia,Video,,['Presidential Election of 2020']
"Suggestions, Distractions and Diaries. Our Staff Is an Open Book.",2020-07-23,article,News,,['Quarantine (Life and Culture)']
Big Tech Versus Climate Change,2020-07-23,article,News,,"['Greenhouse Gas Emissions', 'Global Warming', 'Books and Literature']"
"Gerald Williams, Poet, Essayist and Editor, Dies at 85",2020-07-23,article,Obituary (Obit),,"['Deaths (Obituaries)', 'Coronavirus (2019-nCoV)', 'Poetry and Poets', 'Books and Literature', 'Writing and Writers']"
Eight Artists on the Influence of Tom of Finland,2020-07-23,article,News,,"['Art', 'Homosexuality and Bisexuality', 'Leather and Leather Goods', 'Men and Boys']"
South Korea’s Most-Wanted Man Is Seized in New York,2020-07-23,article,News,,"['Maritime Accidents and Safety', 'Ferries', 'Embezzlement', 'Fugitives', 'Extradition']"
"12 Summer Sparkling Wines, Because Who Needs a Reason",2020-07-23,article,News,,"['Wines', 'ALCOHOLIC BEVERAGES', 'Grapes']"
‘I Am Someone’s Daughter:’ Ocasio-Cortez Condemn’s Yoho’s Remarks,2020-07-23,multimedia,Video,,[]
The Trump Swamp,2020-07-23,article,Letter,,"['British Open (Golf)', 'Cats', 'United States Politics and Government']"
Senators Say N.C.A.A. Needs Broad Reform,2020-07-23,article,News,,['College Athletics']
A Hedge Fund Bailout Highlights How Regulators Ignored Big Risks,2020-07-23,article,News,,"['Banking and Financial Institutions', 'Hedge Funds', 'Dodd-Frank Wall Street Reform and Consumer Protection Act (2010)', 'Regulation and Deregulation of Industry', 'United States Economy', 'Stocks and Bonds', 'United States Politics and Government', 'Government Bonds', 'Prices (Fares, Fees and Rates)', 'Coronavirus (2019-nCoV)']"
‘David Makes Man’ and the Matters of a Young Black Life,2020-07-23,article,News,,"['Black People', 'Blacks', 'Television']"
‘They Pushed Portland Too Far’: How Trump’s Crackdown Strengthened Protests,2020-07-23,multimedia,Video,,"['Federal-State Relations (US)', 'United States Politics and Government', 'George Floyd Protests (2020)']"
A Brooklyn Restaurant’s Answer to Cabin Fever: Summer Camp,2020-07-23,article,News,,"['Restaurants', 'Quarantine (Life and Culture)', 'Summer (Season)', 'Camps and Camping']"
Coming Next Year to the N.H.L.: The Seattle Kraken,2020-07-23,article,News,,"['Hockey, Ice']"
"With Covid-19, a Seismic Quiet Like No Other",2020-07-23,article,News,,"['Earthquakes', 'Coronavirus (2019-nCoV)', 'Geology', 'Noise', 'Research', 'your-feed-science']"
Viking Age Smallpox Complicates Story of Viral Evolution,2020-07-23,article,News,,"['Smallpox', 'Viruses', 'Coronavirus (2019-nCoV)', 'Evolution (Biology)', 'Immune System', 'DNA (Deoxyribonucleic Acid)', 'Genetics and Heredity', 'your-feed-science']"
Virtual Encounters With Purring Cheetahs and Curious Penguins,2020-07-23,article,News,,"['Zoos', 'AQUARIUMS', 'Coronavirus Reopenings', 'Quarantine (Life and Culture)', 'Coronavirus (2019-nCoV)', 'Content Type: Service']"
‘Radioactive’ Review: Marie Curie and the Science of Autonomy,2020-07-23,article,Review,,['Movies']
Ziwe May Destroy Hamilton,2020-07-23,article,News,,['Podcasts']
The Pleasure of Watching Charlize Theron Throw a Punch,2020-07-23,article,News,,"['Movies', 'ACTORS AND ACTRESSES']"
"Samantha Hickey, Nurse With a Gift for Diagnosis, Dies at 45",2020-07-23,article,Obituary (Obit),,"['Deaths (Obituaries)', 'Coronavirus (2019-nCoV)', 'Nursing and Nurses']"
Testing Bottlenecks Threaten N.Y.C.’s Ability to Contain Virus,2020-07-23,article,News,,"['Coronavirus (2019-nCoV)', 'Contact Tracing (Public Health)', 'Tests (Medical)']"
AT&T Signed Up 4 Million HBO Max Customers,2020-07-23,article,News,,"['Television', 'Media', 'Computers and the Internet', 'Telephones and Telecommunications', 'Wireless Communications', 'Company Reports', 'ADVERTISING AND MARKETING', 'Cable Television', 'Coronavirus (2019-nCoV)', 'Video Recordings, Downloads and Streaming']"
"With Officials’ Backing, Dubious Virus Remedies Surge in Latin America",2020-07-23,article,News,,"['Coronavirus (2019-nCoV)', 'Hydroxychloroquine (Drug)', 'Rumors and Misinformation', 'Chemicals']"
8 Things to Do This Weekend,2020-07-23,article,News,,"['Art', 'Music', 'Dancing', 'September 11 (2001)', 'Classical Music', 'Folk Music', 'Museums', 'Jazz', 'Opera', 'Documentary Films and Programs', 'Pop and Rock Music', 'Books and Literature', 'Children and Childhood', 'Theater', 'Quarantine (Life and Culture)']"
Here’s How Congress Might Replace the Extra $600 Weekly Jobless Benefit,2020-07-23,article,News,,"['United States Economy', 'Labor and Jobs', 'Unemployment Insurance', 'Wages and Salaries', 'Layoffs and Job Reductions', 'Recession and Depression', 'Coronavirus Aid, Relief, and Economic Security Act (2020)', 'Unemployment']"
"At the British Masters, Empty Fairways, Empty Pubs and a Hole in the Bubble",2020-07-23,article,News,,"['Golf', 'Coronavirus (2019-nCoV)']"
"No Longer in Shadows, Pentagon’s U.F.O. Unit Will Make Some Findings Public",2020-07-23,article,News,,"['Classified Information and State Secrets', 'United States Defense and Military Forces', 'Unidentified Flying Objects (UFO)', 'Space and Astronomy']"
Spain’s Reopening Stumbles as Virus Cases Rise Among Young People,2020-07-23,article,News,,"['Politics and Government', 'Contact Tracing (Public Health)', 'Coronavirus Reopenings', 'Disease Rates', 'Quarantines', 'Coronavirus (2019-nCoV)', 'Tests (Medical)', 'Bars and Nightclubs', 'Youth']"
"Juan Marsé, Who Wrote of Spain’s Dark Years, Is Dead at 87",2020-07-23,article,Obituary (Obit),,"['Deaths (Obituaries)', 'Writing and Writers', 'Books and Literature', 'Spanish Civil War (1936-39)', 'Spanish Language']"
Washington’s N.F.L. Team Will Retire Its Logo and Adopt a Temporary New Name,2020-07-23,article,News,,"['Names, Organizational', 'Logos', 'Football', 'Race and Ethnicity', 'Native Americans', 'Discrimination']"
"U.S. Outbreak, China-U.S. Feud, Climate Migration: Your Friday Briefing",2020-07-23,article,briefing,,"['Coronavirus (2019-nCoV)', 'Coronavirus Reopenings', 'Coronavirus Aid, Relief, and Economic Security Act (2020)']"
A Biden-Obama Reunion Pitches a Campaign as Comfort-Food TV,2020-07-23,article,News,,"['Presidential Election of 2020', 'Television']"
Why the U.S. Chamber of Commerce Is Suing the Trump Administration,2020-07-23,article,Op-Ed,,"['Immigration and Emigration', 'Foreign Workers', 'Foreign Students (in US)', 'United States Economy', 'Dream Act (Development, Relief and Education for Minors Act)', 'United States Politics and Government', 'Suits and Litigation (Civil)', 'Deferred Action for Childhood Arrivals']"
Who Gets the Covid-19 Vaccine First? Here’s One Idea,2020-07-23,article,News,,"['Coronavirus (2019-nCoV)', 'Rationing and Allocation of Resources', 'Shortages', 'Remdesivir (Drug)', 'Vaccination and Immunization', 'Drugs (Pharmaceuticals)']"
"Keith Sonnier, Playful Sculptor in Neon, Dies at 78",2020-07-23,article,Obituary (Obit),,"['Art', 'Sculpture', 'Deaths (Obituaries)']"
Baptist Pastor Is Fired After Coming Out as Transgender,2020-07-23,article,News,,"['Ministers (Protestant)', 'Transgender and Transsexuals', 'Baptist Churches']"
Johnny Depp and Amber Heard’s Courtroom Face-Off: An Explainer,2020-07-23,article,News,,"['Suits and Litigation (Civil)', 'Celebrities', '#MeToo Movement']"
"Anthony Terlato, Who Brought Pinot Grigio to the U.S., Dies at 86",2020-07-23,article,Obituary (Obit),,"['Wines', 'Deaths (Obituaries)']"
TikTok’s Parent Said to Weigh Selling a Majority Stake in the Video App,2020-07-23,article,News,,"['Social Media', 'United States International Relations', 'Computers and the Internet', 'Mergers, Acquisitions and Divestitures']"
How Much Watching Time Do You Have This Weekend?,2020-07-23,article,News,,['Television']
Juan Soto’s Positive Test Casts Shadow on Yankees-Nationals Opener,2020-07-23,article,News,,"['Baseball', 'Coronavirus (2019-nCoV)']"
"Yoga, SoulCycle and Peloton Face Truths About How Black Lives Matter",2020-07-23,article,News,,"['Black People', 'Blacks', 'Exercise', 'Black Lives Matter Movement', 'Health Clubs']"
Homeland Security Dept. Admits Making False Statements in Fight With N.Y.,2020-07-23,article,News,,"['Drivers Licenses', 'Federal-State Relations (US)', 'Airport Security', 'Illegal Immigration']"
Why Can’t Trump’s America Be Like Italy?,2020-07-23,article,Op-Ed,,"['Coronavirus Reopenings', 'Disease Rates', 'Coronavirus (2019-nCoV)', 'United States Politics and Government', 'Deaths (Fatalities)']"
Iranian Civilian Jet Swerves to Avoid American Warplane in Syria,2020-07-23,article,News,,"['Aviation Accidents, Safety and Disasters', 'United States Defense and Military Forces', 'Military Aircraft', 'United States International Relations']"
"Republican Convention, Stimulus, the Muppets: Your Thursday Evening Briefing",2020-07-23,article,briefing,,[]
"Overlooked No More: Cheryl Marie Wade, a Performer Who Refused to Hide",2020-07-23,article,News,,"['Biographical Information', 'Disabilities', 'Poetry and Poets', 'Art', 'AMERICANS WITH DISABILITIES ACT']"
"‘Not the Right Time’ for a Convention, Trump Says",2020-07-23,multimedia,Video,,"['Republican National Convention', 'Presidential Election of 2020', 'United States Politics and Government']"
London’s West End Comes Out of Lockdown. For an Afternoon.,2020-07-23,article,News,,"['Theater', 'Quarantine (Life and Culture)', 'Coronavirus Reopenings', 'Politics and Government', 'Finances', 'Coronavirus (2019-nCoV)']"
Tech Is About Power. And These Four Moguls Have Too Much of It.,2020-07-23,article,Op-Ed,,"['E-Commerce', 'Coronavirus (2019-nCoV)', 'High Net Worth Individuals']"
Canceled Tournaments in China Are a Big Blow to Women’s Tennis,2020-07-23,article,News,,"['Tennis', 'Coronavirus (2019-nCoV)', 'China Open (Tennis)']"
The Future of Nonconformity,2020-07-23,article,Op-Ed,,"['Conservatism (US Politics)', 'Liberalism (US Politics)', 'Social Media', 'Writing and Writers']"
"In Afghan Attacks, Facts Are Murky. But It’s Clear Deaths Are Piling Up.",2020-07-23,article,News,,"['Afghanistan War (2001- )', 'Civilian Casualties']"
Hearst Magazines President Resigns After Report About Lewd Workplace Behavior,2020-07-23,article,News,,"['Workplace Hazards and Violations', 'Magazines', 'Appointments and Executive Changes', 'Sexual Harassment', 'Discrimination']"
Rise in Unemployment Claims Signals an Economic Reversal,2020-07-23,article,News,,"['United States Economy', 'Unemployment Insurance', 'Layoffs and Job Reductions', 'Labor and Jobs', 'Unemployment', 'Coronavirus (2019-nCoV)', 'Shutdowns (Institutional)', 'Coronavirus Aid, Relief, and Economic Security Act (2020)', 'Coronavirus Reopenings']"
M.L.B. Expands Playoffs for 2020 Season,2020-07-23,article,News,,"['Playoff Games', 'Baseball', 'Organized Labor']"
Coronavirus Briefing: What Happened Today,2020-07-23,article,briefing,,['Coronavirus (2019-nCoV)']
House Democrats Advance New Checks on Presidential Pardon Power,2020-07-23,article,News,,"['United States Politics and Government', 'Amnesties, Commutations and Pardons', 'Law and Legislation', 'Constitution (US)', 'Debates (Political)']"
Trump Moves to Roll Back Obama Program Addressing Housing Discrimination,2020-07-23,article,News,,"['Presidential Election of 2020', 'United States Politics and Government', 'Real Estate and Housing (Residential)', 'Race and Ethnicity', 'Suburbs', 'Discrimination', 'Fair Housing Act (1968)']"
‘It’s Emotional Whiplash’: California Is Once Again at the Center of the Virus Crisis,2020-07-23,article,News,,"['Disease Rates', 'Coronavirus (2019-nCoV)']"
"Feds Sending Tactical Team to Seattle, Expanding Presence Beyond Portland",2020-07-23,article,News,,"['Demonstrations, Protests and Riots']"
"Republicans, Facing Political Headwinds, Begin Diverging From Trump",2020-07-23,article,News,,"['United States Politics and Government', 'Coronavirus Aid, Relief, and Economic Security Act (2020)', 'Coronavirus (2019-nCoV)']"
That Word,2020-07-23,article,News,,"['United States Politics and Government', 'Women and Girls', 'Indecency, Obscenity and Profanity']"
Three Ways to Get Kids Back in Class,2020-07-23,article,Op-Ed,,"['Coronavirus (2019-nCoV)', 'Coronavirus Reopenings', 'Private and Sectarian Schools', 'Teachers and School Employees', 'Children and Childhood']"
Trump Abruptly Cancels Republican Convention in Florida: ‘It’s Not the Right Time’,2020-07-23,article,News,,"['Republican National Convention', 'Coronavirus (2019-nCoV)', 'Presidential Election of 2020']"
They Want Your Attention. Don’t Give It to Them.,2020-07-23,article,Op-Ed,,"['Computers and the Internet', 'News and News Media', 'Freedom of Speech and Expression', 'Social Media']"
10 New Books We Recommend This Week,2020-07-23,article,List,,['Books and Literature']
A Rare Look Inside Trump’s Immigration Crackdown Draws Legal Threats,2020-07-23,article,News,,"['Immigration and Emigration', 'Illegal Immigration', 'Family Separation Policy (US Immigration)', 'Immigration Detention', 'Refugees and Displaced Persons', 'Documentary Films and Programs', 'Presidential Election of 2020']"
Gov. DeWine Urges Repeal of Bailout Bill in Bribery Case,2020-07-23,multimedia,Video,,"['Bribery and Kickbacks', 'Politics and Government', 'State Legislatures']"
"As Trump Calls for Schools to Fully Reopen, His Son’s School Says It Will Not",2020-07-24,article,News,,"['Teachers and School Employees', 'Coronavirus (2019-nCoV)', 'Coronavirus Reopenings', 'Education (K-12)']"
Republican Stimulus Talks Stall Over Differences on Unemployment,2020-07-24,article,News,,"['United States Politics and Government', 'Stimulus (Economic)', 'Coronavirus Aid, Relief, and Economic Security Act (2020)', 'United States Economy', 'Unemployment Insurance', 'Law and Legislation', 'Politics and Government', 'Coronavirus (2019-nCoV)']"
Millions of Americans Are About to Lose Their Homes. Congress Must Help Them.,2020-07-24,article,Editorial,,"['Real Estate and Housing (Residential)', 'Evictions', 'Renting and Leasing (Real Estate)', 'Foreclosures', 'United States Economy', 'Coronavirus (2019-nCoV)', 'Affordable Housing']"
‘Person. Woman. Man. Camera. TV.’ Didn’t Mean What Trump Hoped It Did,2020-07-24,article,News,,"['Dementia', 'Tests (Medical)', 'Intelligence and Intelligence Tests (IQ)', 'Presidential Election of 2020', 'United States Politics and Government']"
A.O.C. Unleashes a Viral Condemnation of Sexism in Congress,2020-07-24,article,News,,"['United States Politics and Government', 'Women and Girls', 'Indecency, Obscenity and Profanity', 'Discrimination']"
"Prince Harry and Meghan Sue Over Photos of Their Son, Archie",2020-07-24,article,News,,"['Photography', 'Suits and Litigation (Civil)', 'Privacy']"
How the U.S. Compares With the World’s Worst Coronavirus Hot Spots,2020-07-24,multimedia,Interactive Feature,,"['Coronavirus (2019-nCoV)', 'Disease Rates']"
Stock Character,2020-07-24,article,News,,['Crossword Puzzles']
"On Opening Day, a Rarity for M.L.B.: Support for Black Lives Matter",2020-07-24,article,News,,"['Baseball', 'George Floyd Protests (2020)', 'Black Lives Matter Movement', 'United States National Anthem Protests (2016- )']"
"A Half-Century Later, Police Identify a Homicide Suspect and His Victim",2020-07-24,article,News,,"['Forensic Science', 'Genealogy', 'DNA (Deoxyribonucleic Acid)', 'Murders, Attempted Murders and Homicides', 'Missing Persons']"
Why Did She Leave Me There?,2020-07-24,article,News,,"['Love (Emotion)', 'Orphans and Orphanages', 'ADOPTIONS']"
Quotation of the Day: It Feels Like March Again With California in Crisis,2020-07-24,article,Quote,,[]
Trump vs. Biden: Who’s Winning the Money Race in Your ZIP Code?,2020-07-24,multimedia,Interactive Feature,,"['Presidential Election of 2020', 'Campaign Finance']"
"China Orders U.S. to Shut Chengdu Consulate, Retaliating for Houston",2020-07-24,article,News,,"['United States International Relations', 'Diplomatic Service, Embassies and Consulates', 'Espionage and Intelligence Services']"
"Coronavirus, U.S.-China Feud, Climate Change: Your Friday Briefing",2020-07-24,article,briefing,,[]
"Corrections: July 24, 2020",2020-07-24,article,Correction,,[]
What’s on TV Friday: ‘Jim Gaffigan: The Pale Tourist’ and ‘The Kissing Booth 2’,2020-07-24,article,News,,"['Television', 'Movies']"
A Chinese Tycoon Denounced Xi Jinping. Now He Faces Prosecution,2020-07-24,article,News,,"['Coronavirus (2019-nCoV)', 'Politics and Government', 'Political Prisoners', 'Entrepreneurship', 'Human Rights and Human Rights Violations']"
H.G. Wells and George Bernard Shaw Fight Over Socialism,2020-07-24,article,News,,['Books and Literature']
"Divisions, Decency and ‘The Plague’",2020-07-24,article,News,,"['Coronavirus (2019-nCoV)', 'Quarantines', 'Border Barriers']"
Late Night Isn’t Impressed with Trump’s Cognitive Dissonance,2020-07-24,article,News,,[]
Refugee and Author Long Detained by Australia Gets Asylum in New Zealand,2020-07-24,article,News,,"['Immigration and Emigration', 'Immigration Detention', 'Asylum, Right of', 'Human Rights and Human Rights Violations', 'Refugees and Displaced Persons', 'Books and Literature', 'Kurds']"
"Michelle Wie West on Motherhood, Pain and a Possible Return to Golf",2020-07-24,article,News,,"['Golf', 'Coronavirus (2019-nCoV)']"
‘The Kissing Booth 2’ Review: Another Dose of Prep School Drama,2020-07-24,article,Review,,['Movies']
‘Animal Crackers’ Review: Of Hamsters and Men,2020-07-24,article,Review,,['ANIMATED FILMS']
Thailand Drops All Charges Against Red Bull Heir in Deadly Crash,2020-07-24,article,News,,"['Hit-and-Run Drivers', 'Deaths (Fatalities)', 'Fugitives']"
"News Quiz: Federal Agents, John Lewis, Mars",2020-07-24,multimedia,Interactive Feature,,[]
Mel Gibson Was Hospitalized for Coronavirus,2020-07-24,article,News,,"['Movies', 'Coronavirus (2019-nCoV)']"
