headline,date,doc_type,material_type,section,keywords
Where’s Trump’s Financial Disclosure? The White House Blames the Pandemic,2020-07-09,article,News,,"['Presidential Election of 2020', 'Presidential Election of 2016', 'Russian Interference in 2016 US Elections and Ties to Trump Associates', 'Trump Tax Returns']"
Call a Thing a Thing,2020-07-09,article,Op-Ed,,"['Race and Ethnicity', 'Whites', 'Black People', 'Blacks', 'Discrimination', 'George Floyd Protests (2020)', 'Black Lives Matter Movement', 'Language and Languages', 'News and News Media']"
"5 Guards and a Nurse Face Charges in Death of Inmate Who Pleaded, ‘I Can’t Breathe’",2020-07-09,article,News,,"['Police Brutality, Misconduct and Shootings', 'Prison Guards and Corrections Officers']"
"Quotation of the Day: Churches Open Doors, and the Virus Sweeps In",2020-07-09,article,Quote,,[]
‘Who’s a Good Boy?’,2020-07-09,article,News,,['Crossword Puzzles']
Watch Videos From Paris Fashion Week,2020-07-09,article,News,,"['Fashion and Apparel', ""Men's Fashion Week"", 'Paris Fashion Week', 'your-feed-fashion']"
Westchester Home Sales Drop to Recession-Era Lows,2020-07-09,article,News,,"['Real Estate and Housing (Residential)', 'Coronavirus (2019-nCoV)', 'Coronavirus Reopenings', 'Quarantine (Life and Culture)']"
New York Rents Fall as Vacancies Rise,2020-07-09,article,News,,"['Real Estate and Housing (Residential)', 'Renting and Leasing (Real Estate)', 'Coronavirus Reopenings', 'Quarantine (Life and Culture)']"
"U.S. Schools, U.K. Jobs, Hagia Sophia: Your Thursday Briefing",2020-07-09,article,briefing,,[]
Australia Halts Hong Kong Extradition Agreement and Extends Visas,2020-07-09,article,News,,"['International Relations', 'Politics and Government', 'Extradition', 'Citizenship and Naturalization']"
What’s on TV Thursday: ‘Once Upon a Time in America’ and ‘Stateless’,2020-07-09,article,News,,"['Television', 'Movies']"
"In the Absence of Live Theater, TV Takes, Well, Center Stage",2020-07-09,article,News,,"['Theater', 'Television']"
"Naya Rivera, ‘Glee’ Actress, Is Missing at California Lake",2020-07-09,article,News,,"['Television', 'Missing Persons', 'Drownings']"
Six Feet? Try Seven Separate Tracks,2020-07-09,article,News,,"['Track and Field', 'Coronavirus (2019-nCoV)', 'Pole Vault']"
"As N.B.A. Forges Ahead, LeBron James Is ‘Ready for This Moment’",2020-07-09,article,News,,"['Basketball', 'Coronavirus Reopenings', 'NBA Championship']"
Used Clothes Ban May Crimp Kenyan Style. It May Also Lift Local Design.,2020-07-09,article,News,,"['Fashion and Apparel', 'Textiles', 'Thrift Shops', 'Coronavirus (2019-nCoV)', 'International Trade and World Market']"
South Korean Triathlete’s Suicide Exposes Team’s Culture of Abuse,2020-07-09,article,News,,"['Triathlon', 'Suicides and Suicide Attempts', 'Child Abuse and Neglect', 'Sex Crimes', 'Athletics and Sports']"
The True Story of My Marriage to a Pot,2020-07-09,article,News,,"['Marriages', 'Astrology', 'Parenting']"
A Zombie Novel for Our Virus-Stricken Times,2020-07-09,article,Review,,['Books and Literature']
Would You Like to Come Over for Dinner … in 10 Years?,2020-07-09,article,News,,"['Coronavirus (2019-nCoV)', 'Quarantines', 'Parties (Social)']"
How Everclear Became a Pandemic Favorite,2020-07-09,article,News,,"['ALCOHOLIC BEVERAGES', 'Quarantine (Life and Culture)', 'Liquor']"
"Elin Hilderbrand Will See You Now, From a Safe Distance",2020-07-09,article,List,,['Books and Literature']
Air Pollution Takes a Global Toll on Heart Health,2020-07-09,article,News,,"['Heart', 'Air Pollution', 'Deaths (Fatalities)']"
"Game Time Beer? For M.L.S., Make That a Kickoff Cappuccino",2020-07-09,article,News,,"['Soccer', 'Coronavirus Reopenings']"
A Day-by-Day Re-Creation of Truman’s Decision to Use Nuclear Weapons,2020-07-09,article,Review,,"['Books and Literature', 'Nuclear Weapons', 'World War II (1939-45)', 'Manhattan Project']"
The Very Sweet Way Sarah Broom’s Mother Showed Her Love With Books,2020-07-09,article,News,,"['Books and Literature', 'Writing and Writers']"
"With a Monthly Budget of Around $3,000, They Wanted a Duplex With a Yard in Brooklyn. Which of These Homes Would You Choose?",2020-07-09,multimedia,Interactive Feature,,"['Real Estate and Housing (Residential)', 'Renting and Leasing (Real Estate)']"
Is Trump’s Fate Sealed?,2020-07-09,article,Op-Ed,,"['United States Politics and Government', 'Presidential Election of 2020']"
"Teletherapy, Popular in the Pandemic, May Outlast It",2020-07-09,article,News,,"['Therapy and Rehabilitation', 'Telemedicine', 'Coronavirus (2019-nCoV)', 'Mental Health and Disorders', 'Anxiety and Stress', 'Psychology and Psychologists', 'Health Insurance and Managed Care', 'Videophones and Videoconferencing']"
A Coronavirus Vaccine Won’t Work if People Don’t Take It,2020-07-09,article,Op-Ed,,"['Vaccination and Immunization', 'Parenting', 'Coronavirus (2019-nCoV)']"
When a Critic Met Facebook: ‘What They’re Doing Is Gaslighting’,2020-07-09,article,Op-Ed,,['Social Media']
Supreme Court to Decide if Trump Can Block Release of Tax Records,2020-07-09,article,News,,"['Federal Taxes (US)', 'United States Politics and Government', 'Subpoenas']"
Anything You Say in This Trader Joe’s Line May Be Used Against You,2020-07-09,article,News,,"['Noise', 'Supermarkets and Grocery Stores', 'Coronavirus (2019-nCoV)', 'Signs and Signage', 'Quarantines']"
68% Have Antibodies in This Clinic. Can a Neighborhood Beat a Next Wave?,2020-07-09,article,News,,"['Coronavirus (2019-nCoV)', 'Antibodies', 'Disease Rates', 'Coronavirus Reopenings', 'Hispanic-Americans', 'Tests (Medical)']"
Stocks That Could Thrive in a Post-Pandemic World,2020-07-09,article,News,,"['Coronavirus (2019-nCoV)', 'Computers and the Internet', 'Medical Devices', 'Politics and Government', 'Quarantines', 'Coronavirus Reopenings', 'Telecommuting', 'Tests (Medical)', 'Real Estate (Commercial)', 'Shopping and Retail', 'Stocks and Bonds', 'Factories and Manufacturing', 'DVD (Digital Versatile Disc)', 'Subprime Mortgage Crisis']"
Who Gets a Vaccine First? U.S. Considers Race in Coronavirus Plans,2020-07-09,article,News,,"['Coronavirus (2019-nCoV)', 'Vaccination and Immunization', 'Race and Ethnicity', 'Black People', 'Blacks', 'Hispanic-Americans', 'United States Politics and Government']"
High-Yield Bonds Have Been Behaving a Lot Like Stocks,2020-07-09,article,News,,"['Credit Ratings and Credit Rating Agencies', 'Stocks and Bonds', 'Credit and Debt', 'Asset Allocation (Personal Finances)', 'Mutual Funds', 'Interest Rates', 'Junk Bonds', 'Recession and Depression', 'Exchange Traded Funds', 'Income', 'Government Bonds', 'Automobiles', 'Bankruptcies', 'Corporations', ""Standard & Poor's 500-Stock Index""]"
An Investor Bought Billions in Stocks When It Really Hurt,2020-07-09,article,News,,"['Coronavirus (2019-nCoV)', 'Stocks and Bonds', 'Travel and Vacations', 'Quarantines', ""Standard & Poor's 500-Stock Index"", 'Coronavirus Reopenings', 'Prices (Fares, Fees and Rates)', 'Credit and Debt', 'Videophones and Videoconferencing', 'Mutual Funds', 'Hotels and Travel Lodgings', 'Vaccination and Immunization', 'Workplace Environment']"
Personal Finance Lessons From the Pandemic,2020-07-09,article,News,,"['Mortgages', 'Social Security (US)', 'Savings', 'Credit and Debt', 'Banking and Financial Institutions', 'Coronavirus (2019-nCoV)', 'Home Equity Loans', 'Quarantines', 'Stocks and Bonds', 'Coronavirus Reopenings', 'Subprime Mortgage Crisis', 'Interest Rates', 'Personal Finances', 'Retirement']"
New York as a Biking City? It Could Happen. And It Should.,2020-07-09,article,News,,"['Bicycles and Bicycling', 'Bridges and Tunnels', 'Infrastructure (Public Works)']"
How a Saber-Tooth Marsupial Blinded Us With Its Bite,2020-07-09,article,News,,"['Paleontology', 'Teeth and Dentistry', 'Mammals', 'Cats', 'Research', 'Skull (Body Part)', 'your-feed-science', 'your-feed-animals']"
Warehouse Workers in a Bind as Virus Spikes in Southern California,2020-07-09,article,News,,"['Coronavirus (2019-nCoV)', 'United States Economy', 'Workplace Hazards and Violations', 'Disease Rates', 'Factories and Manufacturing']"
"Cairo Badly Needed a Detox. Lockdown Supplied One, at a Steep Price.",2020-07-09,article,News,,"['Coronavirus (2019-nCoV)', 'Quarantines', 'Coronavirus Reopenings']"
Republican Senators in Arizona and Georgia Have a Problem: The Base,2020-07-09,article,News,,"['Elections, Senate', 'Endorsements', 'Presidential Election of 2020']"
"On Religion, the Supreme Court Protects the Right to Be Different",2020-07-09,article,Op-Ed,,"['Private and Sectarian Schools', 'Constitution (US)', 'Freedom of Religion', 'Homosexuality and Bisexuality', 'Birth Control and Family Planning']"
What N.Y.C. Schools Will Look Like in September,2020-07-09,article,briefing,,"['Coronavirus Reopenings', 'Education (K-12)', 'Shutdowns (Institutional)', 'Food']"
U.S. Hits Another Record for New Coronavirus Cases,2020-07-09,article,News,,['Coronavirus (2019-nCoV)']
Japan’s Deadly Combination: Climate Change and an Aging Society,2020-07-09,article,News,,"['Floods', 'Landslides and Mudslides', 'Elderly', 'Politics and Government', 'Weather', 'Evacuations and Evacuees', 'Rescues']"
"In ‘Buy American’ Speech, Biden Challenges Trump on the Economy",2020-07-09,article,News,,"['United States Politics and Government', 'Presidential Election of 2020', 'United States Economy', 'Coronavirus (2019-nCoV)', 'Factories and Manufacturing', 'Labor and Jobs']"
Campaign Urges NASA to Rename the John C. Stennis Space Center,2020-07-09,article,News,,"['Names, Organizational', 'Segregation and Desegregation', 'Black People', 'Blacks', 'Discrimination', 'Civil Rights Movement (1954-68)']"
Joy Reid Takes Nightly Anchor Slot at MSNBC,2020-07-09,article,News,,"['News and News Media', 'Television', 'Black People', 'Blacks', 'Women and Girls', 'Appointments and Executive Changes']"
A Missed Warning About Silent Coronavirus Infections,2020-07-09,article,News,,"['Coronavirus (2019-nCoV)', 'Epidemics', 'Disease Rates']"
Two Museums Turn a Seaside Haven Into a Car Lover’s Dream,2020-07-09,article,News,,"['Automobiles', 'Antique and Classic Cars', 'Museums', 'Historic Buildings and Sites', 'Coronavirus Reopenings']"
"Technology stocks rally, leading Nasdaq to a record.",2020-07-09,article,News,,['Coronavirus (2019-nCoV)']
"United Airlines says it could furlough up to 36,000 workers.",2020-07-09,article,News,,[]
Some personal finance lessons from the pandemic.,2020-07-09,article,News,,[]
Should Schools Reopen?,2020-07-09,article,briefing,,[]
"I’ve Seen a Future Without Cars, and It’s Amazing",2020-07-09,article,Op-Ed,,"['Area Planning and Renewal', 'Traffic Accidents and Safety', 'Buses', 'Transit Systems', 'Urban Areas', 'Roads and Traffic', 'Parking', 'Coronavirus (2019-nCoV)', 'Air Pollution', 'Land Use Policies', 'Pedestrian Malls']"
Seoul Mayor Is Found Dead After Harassment Complaint Is Filed,2020-07-09,article,News,,"['Politics and Government', 'Deaths (Fatalities)', 'Sexual Harassment']"
"Thailand Moves to Legalize Same-Sex Unions, a Rare Step in Asia",2020-07-09,article,News,,"['Homosexuality and Bisexuality', 'Same-Sex Marriage, Civil Unions and Domestic Partnerships']"
Exclusive — Venture Fund for Women Raises More Than Expected,2020-07-09,article,News,,"['Venture Capital', 'Entrepreneurship', 'Birth Control and Family Planning', 'Education (K-12)']"
"‘Guest of Honour’ Review: Burying a Father, Unburying Secrets",2020-07-09,article,Review,,['Movies']
"‘Bloody Nose, Empty Pockets’ Review: Over Drinks, a Blurry Line Between Truth and Fiction",2020-07-09,article,Review,,"['Movies', 'Documentary Films and Programs']"
‘Relic’ Review: A Haunted House and a Clouded Mind,2020-07-09,article,Review,,['Movies']
‘Widow of Silence’ Review: Burden of Proof,2020-07-09,article,Review,,['Movies']
‘Never Too Late’ Review: The Vietnam Vet as Lovable Codger,2020-07-09,article,Review,,['Movies']
‘We Are Little Zombies’ Review: Rocking Away the Pain,2020-07-09,article,Review,,['Movies']
‘Olympia’ Review: When the Moon Hits a Documentarian’s Eye,2020-07-09,article,Review,,"['Documentary Films and Programs', 'ACTORS AND ACTRESSES', 'Movies']"
‘Tito’ Review: An Oddball Character Study,2020-07-09,article,Review,,['Movies']
‘The Tobacconist’ Review: Playing Dress-Up in 1930s Vienna,2020-07-09,article,Review,,['Movies']
"Once You’re Out of the Market, It’s Tricky Getting Back In",2020-07-09,article,News,,"['Subprime Mortgage Crisis', 'Stocks and Bonds', 'Coronavirus (2019-nCoV)', 'Credit and Debt', 'Quarantines', 'Banking and Financial Institutions', 'Coronavirus Reopenings', 'Money Market Accounts', 'Financial Planners', 'Mutual Funds', 'Asset Allocation (Personal Finances)']"
"Biden and Bernie, United (at Least Briefly)",2020-07-09,article,News,,"['Presidential Election of 2020', 'United States Politics and Government']"
6 Takeaways From the Biden-Sanders Joint Task Force Proposals,2020-07-09,article,News,,"['Presidential Election of 2020', 'Immigration and Emigration', 'Income Inequality', 'Health Insurance and Managed Care', 'Education (K-12)', 'Green New Deal', 'Illegal Immigration', 'Deferred Action for Childhood Arrivals', 'Border Barriers', 'Dream Act (Development, Relief and Education for Minors Act)', 'Global Warming', 'Criminal Justice']"
Hedge Funds Duel in Bankruptcy Court Over McClatchy Newspapers,2020-07-09,article,News,,"['Newspapers', 'Hedge Funds', 'Bankruptcies', 'Auctions']"
Digital Dior. Remote Chanel. What’s Couture With No Runway?,2020-07-09,article,News,,"['Fashion and Apparel', 'Couture (Fashion)', 'Coronavirus (2019-nCoV)', 'Web-Original Programming', 'your-feed-fashion']"
Outdoor Dining Offers Fresh Air and Fantasy to a City That Needs Both,2020-07-09,article,News,,"['Restaurants', 'Fences and Property Barriers', 'Sidewalks', 'Coronavirus Reopenings', 'Coronavirus (2019-nCoV)', 'Quarantines']"
How Berkeley Could Remove the Police From Traffic Stops,2020-07-09,article,briefing,,['Coronavirus (2019-nCoV)']
"Shoppers Should Wear Masks. Shouldn’t Protesters, Too?",2020-07-09,article,News,,"['Customs, Etiquette and Manners']"
Review: ‘P-Valley’ Has All the Right Moves,2020-07-09,article,News,,['Television']
The T List: Five Things We Recommend This Week,2020-07-09,article,News,,"['Art', 'Travel and Vacations']"
"At Home, With a Long List of Needed Repairs",2020-07-09,article,News,,"['Real Estate and Housing (Residential)', 'Home Repairs and Improvements', 'Interest Rates', 'Home Equity Loans']"
On the Market in New York City,2020-07-09,multimedia,Slideshow,,['Real Estate and Housing (Residential)']
Homes for Sale in Brooklyn and Manhattan,2020-07-09,article,News,,['Real Estate and Housing (Residential)']
On the Market in the New York Region,2020-07-09,multimedia,Slideshow,,['Real Estate and Housing (Residential)']
Homes for Sale in New York and New Jersey,2020-07-09,article,News,,['Real Estate and Housing (Residential)']
"Northern Right Whales Are on the Brink, and Trump Could Be Their Last Hope",2020-07-09,article,News,,"['Global Warming', 'Environment', 'Greenhouse Gas Emissions', 'Fish and Other Marine Life', 'Lobsters', 'Whales and Whaling', 'Fishing, Commercial', 'Endangered and Extinct Species']"
A Melania Trump Statue Is Set on Fire. Its Patron Gets Inspired.,2020-07-09,article,News,,"['Sculpture', 'First Ladies (US)']"
"‘The Old Guard’ Review: Fighting to the Death, and Beyond",2020-07-09,article,Review,,['Movies']
The Timely Agitation of Run the Jewels,2020-07-09,article,News,,['Rap and Hip-Hop']
"James Harrison, Music Professor and Piano Lover, Dies at 84",2020-07-09,article,Obituary (Obit),,"['Deaths (Obituaries)', 'Classical Music', 'Colleges and Universities', 'Coronavirus (2019-nCoV)']"
"Carl Reiner, Perfect",2020-07-09,article,News,,"['Movies', 'Comedy and Humor']"
Exit Arias: What Opera Can Teach Us About Dying,2020-07-09,article,News,,"['Opera', 'Death and Dying']"
"The Dance on Camera Festival, When Dance Is Only on Camera",2020-07-09,article,News,,"['Dancing', 'Movies', 'Quarantine (Life and Culture)', 'Documentary Films and Programs']"
‘Maybe I Shouldn’t Have Come’: U.S. Visa Changes Leave Students in Limbo,2020-07-09,article,News,,"['Foreign Students (in US)', 'Coronavirus Reopenings', 'Colleges and Universities', 'E-Learning', 'Graduate Schools and Students', 'Visas', 'International Study and Teaching']"
NASA Scientist Jailed in Turkey for 3 Years Recounts His Ordeal,2020-07-09,article,News,,"['Politics and Government', 'Terrorism', ""Coups D'Etat and Attempted Coups D'Etat"", 'Turkish-Americans']"
Landmark Supreme Court Ruling Affirms Native American Rights in Oklahoma,2020-07-09,article,News,,"['Decisions and Verdicts', 'Native Americans', 'Criminal Justice', 'Federal-State Relations (US)', 'Treaties']"
Supreme Court Rules Trump Cannot Block Release of Financial Records,2020-07-09,article,News,,"['United States Politics and Government', 'Decisions and Verdicts', 'Trump Tax Returns', 'Campaign Finance']"
2 Art Gallery Shows to Explore From Home,2020-07-09,article,Review,,['Art']
How the Coronavirus Has Changed Air Travel: A Visual Diary of a Flight,2020-07-09,multimedia,Interactive Feature,,"['Coronavirus (2019-nCoV)', 'Coronavirus Reopenings', 'AIRPORTS', 'AIRLINES AND AIRPLANES', 'Airport Security', 'Masks', 'Travel and Vacations']"
"Redman, Mehldau, McBride and Blade Take Another Spin, 26 Years Later",2020-07-09,article,Review,,['Jazz']
N.Y.C. Paints ‘Black Lives Matter’ in Front of Trump Tower,2020-07-09,article,News,,"['Black Lives Matter Movement', 'George Floyd Protests (2020)', 'Black People', 'Blacks', 'Police Brutality, Misconduct and Shootings', 'Murals']"
First Woman Joins Green Berets After Graduating From Special Forces Training,2020-07-09,article,News,,"['United States Defense and Military Forces', 'Women and Girls']"
"‘Whac-a-Mole’ Against Virus Sounds Reasonable, Unless You’re the Mole",2020-07-09,article,News,,"['Coronavirus (2019-nCoV)', 'Coronavirus Reopenings', 'Shutdowns (Institutional)', 'Quarantines', 'Workplace Hazards and Violations', 'Politics and Government']"
‘Big Mess’ Looms if Schools Don’t Get Billions to Reopen Safely,2020-07-09,article,News,,"['Education (K-12)', 'Shutdowns (Institutional)', 'Coronavirus Reopenings', 'Coronavirus (2019-nCoV)', 'Budgets and Budgeting', 'United States Politics and Government', 'Federal Aid (US)', 'Workplace Hazards and Violations', 'Federal-State Relations (US)']"
9 New Books We Recommend This Week,2020-07-09,article,List,,['Books and Literature']
Can Facebook Ever Stop the Drama?,2020-07-09,article,News,,"['Social Media', 'Civil Rights and Liberties']"
7 Things to Do This Weekend,2020-07-09,article,News,,"['Music', 'Theater', 'Dancing', 'Jazz', 'Harry Potter (Fictional Character)', 'Classical Music', 'Children and Childhood', 'Comedy and Humor', 'Quarantine (Life and Culture)']"
A Swiss Dada Pioneer Finally Gets Her Spotlight,2020-07-09,article,News,,"['Sculpture', 'Art', 'Museums', 'Textiles']"
‘Palm Springs’ Review: Déjà Vu All Over Again,2020-07-09,article,Review,,['Movies']
These Scientists Raced to Find a Covid-19 Drug. Then the Virus Found Them.,2020-07-09,article,News,,"['Coronavirus (2019-nCoV)', 'Drugs (Pharmaceuticals)', 'Antibodies', 'Research', 'Clinical Trials']"
Top Manhattan Prosecutor Ousted by Trump Details Firing,2020-07-09,article,News,,"['United States Attorneys', 'Attorneys General', 'Appointments and Executive Changes', 'United States Politics and Government']"
How Does Anything Go Viral?,2020-07-09,article,Review,,"['Coronavirus (2019-nCoV)', 'Books and Literature']"
Sur La Table joins a growing list of bankrupt retailers.,2020-07-09,article,News,,[]
5 Arrested in Connection With Pop Smoke Killing,2020-07-09,article,News,,"['Rap and Hip-Hop', 'Murders, Attempted Murders and Homicides']"
Ziwe Fumudoh Asks: ‘How Many Black People Do You Know?’,2020-07-09,article,News,,"['Race and Ethnicity', 'Black People', 'Blacks', 'Social Media', 'Discrimination']"
Afghan War Casualty Report: July 2020,2020-07-09,article,News,,['Civilian Casualties']
It Looks Like a Reality Show. Why Not Just Make It One?,2020-07-09,article,News,,"['Social Media', 'Television']"
‘I Just Cost Myself 250 Grand.’,2020-07-09,article,News,,['Golf']
How Coronavirus Cases Have Risen Since States Reopened,2020-07-09,multimedia,Interactive Feature,,"['Coronavirus (2019-nCoV)', 'Coronavirus Reopenings', 'Disease Rates', 'Tests (Medical)', 'States (US)']"
"This Ancient Sea Creature Builds Its Body With a Whisper, Not a Scream",2020-07-09,article,News,,"['Reproduction (Biological)', 'Biology and Biochemistry', 'ANIMALS', 'Research', 'Fish and Other Marine Life']"
How André Holland and Company Brought ‘Richard II’ to Radio,2020-07-09,article,News,,"['Coronavirus (2019-nCoV)', 'Theater', 'Radio']"
"Don’t Be Fooled, Trump Is a Winner in the Supreme Court Tax Case",2020-07-09,article,Op-Ed,,"['Law and Legislation', 'United States Politics and Government', 'Courts and the Judiciary', 'Subpoenas', 'Constitution (US)']"
Review: Covid Responders Have Their Harrowing Say in ‘The Line’,2020-07-09,article,Review,,['Theater']
Michael Cohen Returned to Jail in Dispute Over Trump Book,2020-07-09,article,News,,"['Presidential Election of 2020', 'Quarantines', 'Books and Literature', 'Probation and Parole', 'Coronavirus (2019-nCoV)']"
Is Sex Dead for Parents?,2020-07-09,article,News,,"['Parenting', 'Sex', 'Coronavirus (2019-nCoV)']"
The Supreme Court’s Decision on Releasing Trump’s Records,2020-07-09,article,Letter,,"['Federal Taxes (US)', 'United States Politics and Government']"
"In a Death, Details of More Russian Murder-for-Hire Plots",2020-07-09,article,News,,"['Targeted Killings', 'Murders, Attempted Murders and Homicides', 'Informers', 'Politics and Government']"
"The Coronavirus Can Be Airborne Indoors, W.H.O. Says",2020-07-09,article,News,,"['Coronavirus Risks and Safety Concerns', 'Coronavirus (2019-nCoV)', 'Hygiene and Cleanliness', 'your-feed-science', 'Workplace Hazards and Violations']"
"India’s Outbreak, Seoul Mayor, Short Stories: Your Friday Briefing",2020-07-09,article,briefing,,[]
Melania Trump Statue Removed After Being Set on Fire,2020-07-09,multimedia,Video,,[]
Milley Calls for ‘Hard Look’ at Renaming Bases Honoring Confederates,2020-07-09,article,News,,"['United States Defense and Military Forces', 'Military Bases and Installations', 'Names, Organizational', 'Civil War (US) (1861-65)', 'Race and Ethnicity', 'United States Politics and Government']"
DeSantis Is Said to Quietly Hinder Fund-Raising for Trump Convention,2020-07-09,article,News,,"['United States Politics and Government', 'Presidential Election of 2020', 'Politics and Government', 'Republican National Convention', 'Campaign Finance']"
"NOAA Officials Feared Firings After Trump’s Hurricane Claims, Inspector General Says",2020-07-09,article,News,,"['Environment', 'Hurricane Dorian (2019)', 'United States Politics and Government']"
Drug Giants Create Fund to Bolster Struggling Antibiotic Start-Ups,2020-07-09,article,News,,"['your-feed-science', 'ANTIBIOTICS', 'Drugs (Pharmaceuticals)', 'Drug resistance (Microbial)', 'Start-ups', 'your-feed-healthcare']"
A Coffee Chain Reveals Flaws in the Fed’s Plan to Save Main Street,2020-07-09,article,News,,"['Small Business', 'Banking and Financial Institutions', 'Credit and Debt', 'United States Economy', 'Coronavirus (2019-nCoV)', 'Coronavirus Reopenings', 'Federal Aid (US)']"
"With Stores Closed, Barnes & Noble Does Some Redecorating",2020-07-09,article,News,,"['Books and Literature', 'Book Trade and Publishing']"
"As Mayor of Minneapolis, I Saw How White Liberals Block Change",2020-07-09,article,Op-Ed,,"['Police Reform', 'George Floyd Protests (2020)', 'Police Brutality, Misconduct and Shootings', 'Race and Ethnicity', 'Black People', 'Blacks', 'Mayors', 'Whites', 'Discrimination']"
A Short Yoga Sequence for You,2020-07-09,multimedia,Interactive Feature,,"['Yoga', 'Content Type: Service']"
So Y’all Finally Get It,2020-07-09,article,News,,"['Podcasts', 'George Floyd Protests (2020)', 'Black Lives Matter Movement', 'Police Brutality, Misconduct and Shootings']"
Supreme Court: Letting Employers Refuse to Cover Contraceptives,2020-07-09,article,Letter,,"['Birth Control and Family Planning', 'Freedom of Religion', 'Impeachment', 'Home Health Care', 'Coronavirus (2019-nCoV)', 'Hunting and Trapping', 'United States Politics and Government', 'Decisions and Verdicts']"
Netflix Renews ‘The Crown’ for a Sixth Season After All,2020-07-09,article,News,,"['Television', 'Royal Families']"
"Hiring Outlook Remains Dim, With ‘Scarring in the Economy’",2020-07-09,article,News,,"['United States Economy', 'Unemployment', 'Layoffs and Job Reductions', 'Unemployment Insurance', 'Labor and Jobs', 'Coronavirus (2019-nCoV)', 'Coronavirus Aid, Relief, and Economic Security Act (2020)', 'Coronavirus Reopenings', 'Shutdowns (Institutional)']"
"The Killing of Qassim Suleimani Was Unlawful, Says U.N. Expert",2020-07-09,article,News,,"['Targeted Killings', 'Drones (Pilotless Planes)', 'United States Defense and Military Forces']"
How Much Watching Time Do You Have This Weekend?,2020-07-09,article,News,,['Television']
U.S. Imposes Sanctions on Chinese Officials Over Mass Detention of Muslims,2020-07-09,article,News,,"['Human Rights and Human Rights Violations', 'Embargoes and Sanctions', 'Uighurs (Chinese Ethnic Group)', 'Muslims and Islam']"
New York Zoos and Aquarium Plan to Open This Month,2020-07-09,article,News,,"['Coronavirus Reopenings', 'Zoos', 'AQUARIUMS', 'Coronavirus (2019-nCoV)']"
My Favorite Summer Blockbuster,2020-07-09,article,News,,['Movies']
