headline,date,doc_type,material_type,section,keywords
This Is Where the States Want Billions in Infrastructure Funding Spent,2021-11-06,article,News,,"['American Jobs Plan (2021)', 'Infrastructure (Public Works)', 'Bridges and Tunnels', 'States (US)', 'Transportation', 'Transit Systems', 'Water', 'Electric and Hybrid Vehicles', 'Railroads', 'Federal Aid (US)', 'Law and Legislation', 'United States Politics and Government', 'audio-neutral-informative']"
"If You Sell ‘Oaxaca in a Bottle,’ What Happens to Oaxaca?",2021-11-06,article,News,,"['Tequila', 'Alcoholic Beverages']"
"On Spain’s Camino de Santiago, Even Óscar the Donkey Is a Pilgrim",2021-11-06,article,News,,"['Pilgrimages', 'Donkeys', 'Historic Buildings and Sites', 'Content Type: Personal Profile']"
"A Turtle, a Pool and the Fight to Save Puerto Rico’s Beaches",2021-11-06,article,News,,"['Turtles and Tortoises', 'Coastal Areas', 'Coast Erosion', 'Beaches', 'Building (Construction)', 'Conservation of Resources', 'Condominiums', 'Demonstrations, Protests and Riots', 'Land Use Policies', 'Hurricane Maria (2017)']"
Activists hope protests will draw large crowds as leaders haggle in Glasgow.,2021-11-06,article,News,,[]
How Slowing Down Helped Marathoner Molly Seidel Speed Up,2021-11-06,article,News,,"['Marathon Running', 'New York City Marathon', 'Olympic Games (2020)', 'Content Type: Personal Profile', 'Coaches and Managers']"
An Environmental Hero or Outlaw? Can It Be Both?,2021-11-06,article,News,,"['Oil (Petroleum) and Gasoline', 'Suits and Litigation (Civil)', 'Water Pollution']"
"For Carli Lloyd, Creative Tributes Abound as Retirement Approaches",2021-11-06,article,News,,"['Soccer', 'Content Type: Personal Profile', 'Fans (Persons)']"
"Tanker Truck Explodes in Sierra Leone, Killing at Least 98",2021-11-06,article,News,,"['Deaths (Fatalities)', 'Traffic Accidents and Safety', 'Explosions (Accidental)', 'Oil (Petroleum) and Gasoline']"
"After a Rough Year, New York Road Runners Searches for a Leader and Mission",2021-11-06,article,News,,"['Running', 'New York City Marathon', 'Appointments and Executive Changes']"
Lights Out: 5 New ‘Dark-Sky Places’ for Top-Shelf Stargazing,2021-11-06,article,News,,"['Parks and Other Recreation Areas', 'Wildlife Sanctuaries and Nature Reserves', 'National Parks, Monuments and Seashores', 'Milky Way Galaxy', 'Space and Astronomy', 'Lighting', 'Pollution']"
Spanish Police Seek Missing Plane Passengers After Emergency Landing,2021-11-06,article,News,,"['AIRLINES AND AIRPLANES', 'Airport Security', 'Airports', 'Fugitives']"
Infrastructure Bill Makes First Major U.S. Investment in Climate Resilience,2021-11-06,article,News,,"['Global Warming', 'Greenhouse Gas Emissions', 'American Jobs Plan (2021)', 'Infrastructure (Public Works)', 'United States Politics and Government', 'Disasters and Emergencies']"
Berkshire Hathaway’s Profit Fell in the Third Quarter,2021-11-06,article,News,,"['Stock Buybacks', 'United States Economy', 'Stocks and Bonds', 'Coronavirus (2019-nCoV)', 'Company Reports']"
How Do I Get My Landlord to Compensate Me?,2021-11-06,article,News,,"['Real Estate and Housing (Residential)', 'Rent Control and Stabilization', 'Renting and Leasing (Real Estate)', 'Landlords']"
A fire in Covid intensive care ward kills 11 people in India.,2021-11-06,article,News,,"['Coronavirus (2019-nCoV)', 'Hospitals']"
Costa Rica moves to require Covid shots for children.,2021-11-06,article,News,,"['Coronavirus (2019-nCoV)', 'Vaccination and Immunization']"
"Facing a spike in infections, Austria sharpens the rules of its Covid pass.",2021-11-06,article,News,,"['Coronavirus (2019-nCoV)', 'Vaccination Proof and Immunization Records', 'Vaccination and Immunization']"
High Schoolers Barred From Hockey Games After Crudely Taunting a Goalie,2021-11-06,article,News,,"['Hockey, Ice', 'Interscholastic Athletics', 'Education (Secondary)', 'School Discipline (Students)', 'Women and Girls', 'Discrimination', 'Indecency, Obscenity and Profanity']"
Wokeness Derails the Democrats,2021-11-06,article,Op-Ed,,"['American Jobs Plan (2021)', 'Infrastructure (Public Works)', 'United States Politics and Government']"
"COP26 Protesters Back an Array of Causes, Connected by Climate Change",2021-11-06,article,News,,"['Demonstrations, Protests and Riots', 'Global Warming', 'Greenhouse Gas Emissions', 'United Nations Framework Convention on Climate Change']"
Body Shaming Dressed Up as a Fitness Goal Is Still Body Shaming,2021-11-06,article,Op-Ed,,"['Track and Field', 'Women and Girls', 'Weight', 'Eating Disorders', 'Athletics and Sports', 'Coaches and Managers', 'internal-sub-only-nl']"
This Is What Africa Needs Right Now,2021-11-06,article,Op-Ed,,"['Global Warming', 'Greenhouse Gas Emissions', 'Floods', 'Foreign Aid', 'Third World and Developing Countries', 'International Relations', 'United Nations Framework Convention on Climate Change']"
Big Kid Vaccines Are Here!,2021-11-06,article,Op-Ed,,"['internal-sub-only-nl', 'Vaccination and Immunization', 'Daylight Saving Time', 'Parenting', 'Quarantine (Life and Culture)']"
At Least 8 People Killed at Astroworld Music Festival,2021-11-06,multimedia,Video,,"['Astroworld Music Festival Stampede (2021)', 'Deaths (Fatalities)', 'Stampedes', 'Rap and Hip-Hop', 'Music']"
The Way We Work Now (or Don’t),2021-11-06,article,Letter,,"['Labor and Jobs', 'Wages and Salaries', 'Minimum Wage', 'Computers and the Internet', 'Rumors and Misinformation']"
Foreman Says Military Jury Was Disgusted by C.I.A. Torture,2021-11-06,article,News,,"['Detainees', 'Amnesties, Commutations and Pardons', 'Torture', 'Terrorism', 'Jury System', 'Military Tribunals', 'United States Defense and Military Forces']"
Americans Are Flush With Cash and Jobs. They Also Think the Economy Is Awful.,2021-11-06,article,News,,"['United States Economy', 'Inflation (Economics)', 'Prices (Fares, Fees and Rates)', 'Labor and Jobs', 'Wages and Salaries', 'Consumer Price Index', 'Polls and Public Opinion', 'United States Politics and Government']"
Georgia Grand Jury Looms in Trump Inquiry,2021-11-06,article,News,,"['District Attorneys', 'Voter Fraud (Election Fraud)', 'Rumors and Misinformation', 'Racketeering and Racketeers', 'Presidential Election of 2020', 'United States Politics and Government']"
F.B.I. Searches James O’Keefe’s Home in Ashley Biden Diary Theft Inquiry,2021-11-06,article,News,,"['Search and Seizure', 'Diaries', 'Robberies and Thefts', 'Presidential Election of 2020', 'United States Politics and Government', 'Right-Wing Extremism and Alt-Right']"
How a $1 Trillion Infrastructure Bill Survived an Intraparty Brawl,2021-11-06,article,News,,"['Infrastructure (Public Works)', 'American Jobs Plan (2021)', 'Law and Legislation', 'United States Economy', 'United States Politics and Government']"
"Democrats Thought They Bottomed Out in Rural, White America. It Wasn’t the Bottom.",2021-11-06,article,News,,"['Elections, Governors', 'Rural Areas', 'Whites', 'Polls and Public Opinion', 'Voting and Voters', 'Politics and Government', 'United States Politics and Government']"
On the Scene: Climate Protests,2021-11-06,multimedia,Interactive Feature,,"['United Nations Framework Convention on Climate Change', 'Demonstrations, Protests and Riots']"
‘A Daily Cloud of Suffering’: A Crackdown in China Is Felt Abroad,2021-11-06,article,News,,"['Uighurs (Chinese Ethnic Group)', 'Political Prisoners', 'Human Rights and Human Rights Violations', 'Anxiety and Stress', 'Surveillance of Citizens by Government', 'Mental Health and Disorders', 'Depression (Mental)', 'Therapy and Rehabilitation', 'Muslims and Islam']"
Protesters in Glasgow Demand Climate Action,2021-11-06,multimedia,Video,,"['Global Warming', 'Demonstrations, Protests and Riots', 'United Nations Framework Convention on Climate Change']"
"Biden Celebrates Infrastructure Win, Even if Harder Victory Is Ahead",2021-11-06,article,News,,"['American Jobs Plan (2021)', 'United States Politics and Government', 'Infrastructure (Public Works)']"
How I Became Extremely Open-Minded,2021-11-06,article,Op-Ed,,"['Chronic Condition (Health)', 'Antibiotics', 'Lyme Disease', 'Rumors and Misinformation', 'Alternative and Complementary Medicine']"
"In Infrastructure Votes, 19 Members Broke With Their Party",2021-11-06,article,News,,"['Infrastructure (Public Works)', 'United States Politics and Government', 'Law and Legislation']"
A court temporarily blocks Biden’s vaccine mandate.,2021-11-06,article,News,,"['Workplace Hazards and Violations', 'Suits and Litigation (Civil)', 'Appeals Courts (US)']"
‘No Way Out’: A Sudden Life-and-Death Struggle at a Houston Concert,2021-11-06,article,News,,"['Astroworld Music Festival Stampede (2021)', 'Rap and Hip-Hop', 'Deaths (Fatalities)', 'Stampedes', 'Music']"
Tanker Truck Explosion Kills at Least 98 People in Sierra Leone,2021-11-06,multimedia,Video,,"['Explosions (Accidental)', 'Trucks and Trucking', 'Deaths (Fatalities)']"
Who Won What in the Bipartisan Infrastructure Deal,2021-11-06,article,Op-Ed,,"['American Jobs Plan (2021)', 'Infrastructure (Public Works)', 'American Families Plan (2021)', 'United States Politics and Government']"
This and That,2021-11-06,article,News,,"['Crossword Puzzles', 'Goats']"
"Mark Glaze, Influential Gun Control Advocate, Dies at 51",2021-11-06,article,Obituary (Obit),,"['Deaths (Obituaries)', 'Gun Control', 'Mass Shootings', 'Newtown, Conn, Shooting (2012)', 'School Shootings and Armed Attacks']"
How to watch U.F.C. 268 or Canelo Álvarez vs. Caleb Plant.,2021-11-06,article,News,,"['Mixed Martial Arts', 'Television', 'Video Recordings, Downloads and Streaming', 'Boxing']"
What to Know About the Houston Astroworld Tragedy,2021-11-07,article,News,,"['Astroworld Music Festival Stampede (2021)', 'Deaths (Fatalities)', 'Stampedes', 'Rap and Hip-Hop', 'Music']"
A thin crowd takes in four fights that couldn’t be seen on TV.,2021-11-07,article,News,,['Boxing']
Here’s how the full U.F.C. 268 Usman vs. Covington 2 pay-per-view card played out.,2021-11-07,article,News,,[]
Here’s how the Canelo Álvarez-Caleb Plant pay-per-view card played out.,2021-11-07,article,News,,['Boxing']
Fears of Wider Instability in Iraq After Attack on Prime Minister’s Home,2021-11-07,article,News,,"['Assassinations and Attempted Assassinations', 'Elections', 'Legislatures and Parliaments', 'Drones (Pilotless Planes)']"
Justin Gaethje won a wild decision that was a surprise for even getting to the judges.,2021-11-07,article,News,,[]
Pedigree wins out as Rey Vargas overcomes Leonardo Baez’s diligence.,2021-11-07,article,News,,['Boxing']
Anthony Dirrell knocks out Marcos Hernandez with a windmill uppercut.,2021-11-07,article,News,,['Boxing']
"Quotation of the Day: In Rural Areas, Prospects Sink for Democrats",2021-11-07,article,News,,[]
"Corrections: Nov. 7, 2021",2021-11-07,article,Correction,,[]
Rose Namajunas keeps the 115-pound championship with a split decision over Zhang Weili.,2021-11-07,article,News,,[]
Canelo Álvarez delivered on his promise for a knockout victory.,2021-11-07,article,News,,['Boxing']
Kamaru Usman is still the 170-pound U.F.C. champion.,2021-11-07,article,News,,[]
‘Saturday Night Live’ Introduces a New Donald Trump,2021-11-07,article,News,,['Television']
Spelling Bee Forum,2021-11-07,article,News,,[]
‘A Woman Who Was Crossing the Street Yelled to the Man in the Hat’,2021-11-07,article,News,,[]
French Clerical Abuse Report Puts Spotlight on Confession,2021-11-07,article,News,,"['Priests', 'Sex Crimes', 'Child Abuse and Neglect', 'Clergy', 'Religion-State Relations', 'Politics and Government']"
What a $50 Million Donation Did for One H.B.C.U.,2021-11-07,article,News,,"['Endowments', 'Colleges and Universities', 'Black People', 'Blacks', 'Philanthropy', 'George Floyd Protests (2020)', 'Race and Ethnicity', 'Income Inequality', 'Scholarships and Fellowships']"
"On Tiny Guam, It’s One Dogcatcher vs. 30,000 Strays",2021-11-07,article,News,,"['Dogs', 'Animal Abuse, Rights and Welfare', 'Rabies', 'Labor and Jobs', 'Accidents and Safety', 'Politics and Government']"
"‘Once the Race Starts, You’re Part of That Race’",2021-11-07,article,News,,"['Photography', 'New York City Marathon', 'Running']"
"Republicans, Basking in Tuesday’s Victories, Diverge on What Comes Next",2021-11-07,article,News,,"['Presidential Election of 2020', 'Presidential Election of 2024', 'Voter Fraud (Election Fraud)', 'Conservatism (US Politics)']"
"To Steer China’s Future, Xi Is Rewriting Its Past",2021-11-07,article,News,,['Politics and Government']
"Jil Sander Ski Wear, Coming to a City Block Near You",2021-11-07,article,News,,"['Skiing', 'Fashion and Apparel', 'your-feed-fashion', 'Content Type: Service']"
Nicaragua Descends Into Autocratic Rule as Ortega Crushes Dissent,2021-11-07,article,News,,"['Human Rights and Human Rights Violations', 'Elections', 'Politics and Government']"
Antarctica Was Once a Land of Fire and Not Ice,2021-11-07,article,News,,"['Wildfires', 'Paleontology', 'Charcoal', 'Research', 'your-feed-science']"
"With Cases Piling Up, an Eviction Crisis Unfolds Step by Step",2021-11-07,article,News,,"['Evictions', 'Renting and Leasing (Real Estate)', 'Landlords', 'Legal Aid for the Poor (Civil)', 'American Rescue Plan (2021)', 'Coronavirus (2019-nCoV)']"
"Infrastructure, Glasgow, New York City Marathon: Your Weekend Briefing",2021-11-07,article,briefing,,[]
The Sunday Read: ‘I Fell in Love With Motorcycles. But Could I Ever Love Sturgis?’,2021-11-07,article,News,,"['Motorcycles, Motor Bikes and Motorscooters', 'Motorcycle Racing', 'audio-neutral-informative']"
The Week in Business: Time to Slow the Economic Stimulus,2021-11-07,article,News,,"['United States Economy', 'Coronavirus (2019-nCoV)', 'Interest Rates', 'Stimulus (Economic)']"
Veteran U.S. Diplomat Comes Under Criticism for a Trip to Myanmar,2021-11-07,article,News,,"['Human Rights and Human Rights Violations', 'Political Prisoners', ""Coups D'Etat and Attempted Coups D'Etat"", 'United States International Relations']"
"What’s Going On in This Picture? | Nov. 8, 2021",2021-11-07,article,News,,[]
"Homes That Sold for Around $450,000",2021-11-07,article,News,,['Real Estate and Housing (Residential)']
A ‘Bachelorette’ star says of her first marathon: It’s just about ‘putting yourself out there.’,2021-11-07,article,News,,['New York City Marathon']
Shalane Flanagan completes her quest: six marathons in six weeks.,2021-11-07,article,News,,['New York City Marathon']
An Indigenous Canadian Director Channels Traumatic Memories Into Film,2021-11-07,article,News,,"['Movies', 'Content Type: Personal Profile', 'Indigenous People', 'Race and Ethnicity', 'Land Use Policies']"
"Michael Rutter, Pioneering Child Psychiatrist, Is Dead at 88",2021-11-07,article,Obituary (Obit),,"['Deaths (Obituaries)', 'Children and Childhood', 'Psychiatry and Psychiatrists', 'Mental Health and Disorders', 'Autism', 'Genetics and Heredity']"
International travelers eagerly await reunions with their loved ones as the U.S. travel changes near.,2021-11-07,article,News,,"['Coronavirus (2019-nCoV)', 'Vaccination and Immunization', 'Travel and Vacations', 'Quarantine (Life and Culture)']"
"What’s in a Name? For the Koreans of Sakhalin, an Anguished History",2021-11-07,article,News,,"['Immigration and Emigration', 'Cold War Era', 'Citizenship and Naturalization']"
‘On Consolation’ Searches for Solace in the Face of Grief and Misery,2021-11-07,article,Review,,['Books and Literature']
What to Cook This Week,2021-11-07,article,Letter,,"['Cooking and Cookbooks', 'Content Type: Service']"
How to Buy Nothing New This Holiday Gifting Season,2021-11-07,article,Op-Ed,,"['Gifts', 'Christmas', 'Shopping and Retail', 'Thrift Shops', 'Content Type: Service', 'Sustainable Living']"
Don’t Be So Quick to Doubt China’s Climate Change Dedication,2021-11-07,article,Op-Ed,,"['United Nations Framework Convention on Climate Change', 'Greenhouse Gas Emissions', 'Coal', 'Electric Light and Power', 'Shortages', 'Alternative and Renewable Energy', 'Global Warming']"
Peres Jepchirchir of Kenya wins the women’s race at the New York City Marathon.,2021-11-07,article,News,,['New York City Marathon']
Britain’s health secretary urges people to get booster shots amid a surge.,2021-11-07,article,News,,"['Coronavirus (2019-nCoV)', 'Vaccination and Immunization']"
How Covid Raised the Stakes of the War Between Faith and Science,2021-11-07,article,Op-Ed,,"['Science and Technology', 'Religion and Belief', 'Vaccination and Immunization', 'Christians and Christianity', 'Creationism and Intelligent Design', 'Evolution (Biology)', 'Coronavirus (2019-nCoV)', 'internal-sub-only-nl']"
Albert Korir of Kenya wins the men’s race at the New York City Marathon.,2021-11-07,article,News,,['New York City Marathon']
Two spotted hyenas at the Denver Zoo are the first known to have Covid-19.,2021-11-07,article,News,,"['Coronavirus (2019-nCoV)', 'Zoos', 'Hyenas', 'Tigers', 'Lions', 'Animals']"
Here’s how the celebrity runners fared in this year’s marathon.,2021-11-07,article,News,,['New York City Marathon']
"Running her first marathon, Abby Wambach plans to leave her teammates behind.",2021-11-07,article,News,,"['Soccer', 'New York City Marathon']"
"Stephen Karpiak, Pathbreaking H.I.V. Researcher, Dies at 74",2021-11-07,article,Obituary (Obit),,"['Deaths (Obituaries)', 'Acquired Immune Deficiency Syndrome', 'Homosexuality and Bisexuality', 'Elderly', 'Research']"
"TikTok’s running hero, Mrs. Space Cadet, competes in her first marathon.",2021-11-07,article,News,,"['Social Media', 'New York City Marathon']"
"Álvarez, Boxing’s Undisputed King, Is a Target for Fighters and Promoters",2021-11-07,article,News,,['Boxing']
Witnesses to the End,2021-11-07,article,News,,"['Afghanistan War (2001- )', 'United States Defense and Military Forces', 'Terrorism', 'Civilian Casualties', 'Evacuations and Evacuees']"
In photos: The breathtaking view from above the New York City Marathon.,2021-11-07,article,News,,['New York City Marathon']
Marcel Hug and Madison de Rozario Win N.Y.C. Marathon Wheelchair Races,2021-11-07,article,News,,"['New York City Marathon', 'Wheelchairs', 'Disabilities']"
Astroworld Victims Include High Schoolers and College Students,2021-11-07,article,News,,"['Astroworld Music Festival Stampede (2021)', 'Deaths (Fatalities)', 'Music', 'Rap and Hip-Hop', 'Stampedes']"
"The Biden administration is ‘prepared to defend’ the vaccine rules for big employers, the surgeon general says.",2021-11-07,article,News,,"['Coronavirus (2019-nCoV)', 'Suits and Litigation (Civil)', 'Vaccination and Immunization', 'Tests (Medical)', 'Workplace Hazards and Violations']"
Who Wants to Hang Out With Eric Adams in Puerto Rico? Everyone.,2021-11-07,article,News,,"['Politics and Government', 'Conventions, Fairs and Trade Shows', 'Hispanic-Americans']"
"Afghan Military Pilots, on the Run, Feel Abandoned by U.S.",2021-11-07,article,News,,"['Afghanistan War (2001- )', 'United States Defense and Military Forces', 'Pilots', 'Refugees and Displaced Persons', 'Evacuations and Evacuees']"
New York City Marathon Returns,2021-11-07,multimedia,Video,,"['New York City Marathon', 'Marathon Running', 'Running']"
Your Monday Briefing,2021-11-07,article,briefing,,"['American Jobs Plan (2021)', 'Quarantine (Life and Culture)', 'Sushi']"
Emotion and Grit Power Kenyans in New York City Marathon,2021-11-07,article,News,,"['New York City Marathon', 'Marathon Running']"
New York City Marathon Returns With Fanfare and Optimism,2021-11-07,article,News,,"['New York City Marathon', 'Coronavirus (2019-nCoV)', 'Running']"
A U.F.C. Champion’s Title Is Not Enough. He Wants to Fight a Boxer Next.,2021-11-07,article,News,,"['Mixed Martial Arts', 'Boxing']"
Review: ‘Gnit’ Seeks Itself in a Mist of Magic and Mischief,2021-11-07,article,Review,,['Theater']
"Playing It Safe, Giants Steal a Win From the Raiders",2021-11-07,article,News,,['Football']
Get a Move On,2021-11-07,article,News,,['Crossword Puzzles']
"Dolphins and Texans Swap Turnovers, if Not a Quarterback",2021-11-07,article,News,,[]
Reaching the Finish Line. Finally.,2021-11-08,multimedia,Video,,"['New York City Marathon', 'Running']"
What We Learned From Week 9 in the N.F.L.,2021-11-08,article,News,,['Football']
She Died With Long Covid. Should Her Organs Have Been Donated?,2021-11-08,article,News,,"['your-feed-science', 'Transplants', 'Coronavirus (2019-nCoV)', 'Organ Donation', 'Kidneys', 'Liver', 'Hospitals', 'Lungs', 'Chronic Condition (Health)']"
Why the Media Loves Labor Now,2021-11-08,article,News,,"['Organized Labor', 'News and News Media', 'Strikes', 'Labor and Jobs', 'Social Media']"
How Maps Reshape American Politics,2021-11-08,multimedia,Interactive Feature,,"['United States Politics and Government', 'Redistricting and Reapportionment', 'Voting Rights, Registration and Requirements', 'States (US)', 'State Legislatures']"
Houston Officials Worried About Crowd Control Before Travis Scott Took the Stage,2021-11-08,article,News,,"['Astroworld Music Festival Stampede (2021)', 'Security and Warning Systems', 'Stampedes', 'Rap and Hip-Hop', 'Music', 'Deaths (Fatalities)']"
"‘Succession’ Recap, Season 3, Episode 4: Meep-Meep",2021-11-08,article,Review,,['Television']
"‘Insecure’ Recap, Season 5, Episode 3: Slow Start to Fatherhood",2021-11-08,article,News,,['Television']
"For All Your Big Questions (and Small Ones, Too)",2021-11-08,article,News,,['Podcasts']
Word of the Day: ornery,2021-11-08,article,News,,[]
Why the ‘Scariest’ Night Didn’t Keep LaMarcus Aldridge Out of the N.B.A.,2021-11-08,article,News,,"['Content Type: Personal Profile', 'Basketball']"
Your Monday Briefing,2021-11-08,article,briefing,,[]
"Quotation of the Day: Rats Amok in the Park, on the Block and Even at Your Table",2021-11-08,article,Quote,,[]
"No Corrections: Nov. 8, 2021",2021-11-08,article,News,,[]
What’s on TV This Week: Documentaries on Kevin Garnett and Jake Burton Carpenter,2021-11-08,article,News,,"['Television', 'Movies']"
Spelling Bee Forum,2021-11-08,article,News,,[]
Retailers Scramble to Attract Workers Ahead of the Holidays,2021-11-08,article,News,,"['Shopping and Retail', 'Labor and Jobs', 'Wages and Salaries', 'Coronavirus (2019-nCoV)', 'Bonuses', 'Minimum Wage', 'Vaccination and Immunization', 'Holidays and Special Occasions', 'Hiring and Promotion']"
Chip Shortage Creates New Power Players,2021-11-08,article,News,,"['Computer Chips', 'Factories and Manufacturing', 'Computers and the Internet', 'Automobiles', 'Shortages']"
An Urban Problem: Rats on the Rise,2021-11-08,article,briefing,,"['Comedy and Humor', 'Quarantine (Life and Culture)', 'Coronavirus (2019-nCoV)', 'Rats', 'New York Comedy Festival']"
18 Warm-Up Activities to Engage Students Before They Read Nonfiction Texts,2021-11-08,article,News,,[]
"Police Officer Stabbed on French Riviera, Authorities Say",2021-11-08,article,News,,"['Attacks on Police', 'Murders, Attempted Murders and Homicides', 'Terrorism']"
Yuval Noah Harari Believes This Simple Story Can Save the Planet,2021-11-08,multimedia,Interactive Feature,,"['Content Type: Personal Profile', 'Global Warming', 'Philosophy', 'Christians and Christianity']"
What It Was Like to Run the Marathon,2021-11-08,multimedia,Interactive Feature,,['New York City Marathon']
What Is Unique About Your Hometown?,2021-11-08,article,News,,[]
What Paternity Leave Does for a Father’s Brain,2021-11-08,article,Op-Ed,,"['Family Leaves', 'Parenting', 'Paid Time Off', 'Men and Boys', 'American Families Plan (2021)', 'Law and Legislation']"
‘I Think We’re Cousins?’: ‘Ain’t Too Proud’ Performers Realize Link,2021-11-08,article,News,,"['Theater', 'Music', 'Content Type: Personal Profile', 'Families and Family Life']"
Behind Elon Musk’s Twitter Poll Is a Tax Bill Coming Due,2021-11-08,article,News,,"['Stock Options and Purchase Plans', 'Income Tax', 'Federal Taxes (US)', 'Executive Compensation', 'Electric and Hybrid Vehicles']"
How to Limit Temperature Increases in the Very Near Term,2021-11-08,article,Op-Ed,,"['Greenhouse Gas Emissions', 'Global Warming', 'Methane', 'Carbon Dioxide', 'United Nations Framework Convention on Climate Change']"
Why Are Republicans Now Loving the Sweet Sound of Electric Vehicles?,2021-11-08,article,News,,"['Electric and Hybrid Vehicles', 'Labor and Jobs', 'Factories and Manufacturing', 'United States Politics and Government', 'Global Warming']"
A Quiet Studio With a Home-Court Advantage,2021-11-08,article,News,,"['Real Estate and Housing (Residential)', 'Renting and Leasing (Real Estate)', 'Content Type: Personal Profile', 'Basketball']"
"Bill Clinton Saved His Presidency. Here’s How Biden Can, Too.",2021-11-08,article,Op-Ed,,"['Politics and Government', 'Voting and Voters', 'Polls and Public Opinion', 'Midterm Elections (2022)', 'Presidential Election of 2020', 'United States Politics and Government']"
The Popularity of E-Bikes Isn’t Slowing Down,2021-11-08,article,News,,"['Electric Bicycles, Motorcycles and Scooters', 'Transit Systems']"
"How Public Preschool Can Help, and How to Make Sure It Doesn’t Hurt",2021-11-08,article,News,,"['Education (Pre-School)', 'Child Care', 'Children and Childhood', 'Research', 'Families and Family Life', 'Teachers and School Employees']"
Why Republicans Won in a New York County Where Democrats Outnumber Them,2021-11-08,article,News,,"['Elections, District Attorneys', 'Elections, State Legislature', 'Voting and Voters', 'Suburbs', 'Politics and Government']"
"The Democrats’ No Good, Very Bad Day Changes the Landscape",2021-11-08,article,Op-Ed,,"['United States Politics and Government', 'Elections, Governors', 'Social Media', 'Infrastructure (Public Works)', 'American Jobs Plan (2021)', 'Education (K-12)', 'Dream Act (Development, Relief and Education for Minors Act)']"
When the Taliban Are in Your Bedroom,2021-11-08,article,News,,"['Afghanistan War (2001- )', 'News and News Media']"
